url,name,nickname_age,birth_date,age,death_date,location,country,height,weight,association,weight_class,wins_age,wins_ko,wins_submission,wins_decision,wins_other,lossess,losses_ko,losses_submission,losses_decision,losses_other,nickname_stats,wins_stats,losses,draws,height_cm,weight_in_kg,reach_in_cm,stance,date_of_birth,significant_strikes_landed_per_minute,significant_striking_accuracy,significant_strikes_absorbed_per_minute,significant_strike_defence,average_takedowns_landed_per_15_minutes,takedown_accuracy,takedown_defense,average_submissions_attempted_per_15_minutes
/fighter/ASol-Kwon-20992,a-sol kwon,,16/01/1985,36.0,,"Mokpo, South Jeolla",South Korea,"5'8""",155 lbs,Independent,Lightweight,21.0,11.0,3.0,7.0,,21.0,4.0,2.0,5.0,,,,,,,,,,,,,,,,,,
/fighter/AJ-Agazarm-313227,a.j. agazarm,Leao,26/07/1989,32.0,,"Hollywood, California",United States,"5'8""",145 lbs,Nick Diaz Academy,Featherweight,3.0,0.0,2.0,1.0,,3.0,0.0,0.0,2.0,,,,,,,,,,,,,,,,,,
/fighter/AJ-Lias-Mansor-78617,a.j. lias mansor,Pyro,16/05/1975,46.0,,"Kota Kinabalu, Sabah",Malaysia,"5'7""",143 lbs,Borneo Tribal Squad,Featherweight,4.0,1.0,1.0,2.0,,4.0,1.0,2.0,1.0,,,,,,,,,,,,,,,,,,
/fighter/AJ-McKee-194637,a.j. mckee,Mercenary,07/04/1995,26.0,,"Long Beach, California",United States,"5'10""",145 lbs,Team Bodyshop,Featherweight,18.0,6.0,7.0,5.0,,18.0,0.0,0.0,0.0,,,,,,,,,,,,,,,,,,
/fighter/AJ-Siscoe-90807,a.j. siscoe,Let's Go,20/09/1990,30.0,,"St. Charles, Missouri",United States,"5'7""",142 lbs,Team Pride and Pain,Featherweight,3.0,0.0,3.0,0.0,,3.0,0.0,2.0,0.0,,,,,,,,,,,,,,,,,,
/fighter/AJ-Williams-128627,a.j. williams,Black Dynamite,11/07/1986,35.0,,"Las Vegas, Nevada",United States,"6'0""",155 lbs,Syndicate MMA,Lightweight,1.0,1.0,0.0,0.0,,1.0,1.0,0.0,1.0,,,,,,,,,,,,,,,,,,
/fighter/Aalon-Cruz-103485,aalon cruz,,20/09/1989,31.0,,"Tampa, Florida",United States,"6'0""",155 lbs,Team Darkside MMA,Lightweight,8.0,2.0,2.0,4.0,,8.0,2.0,2.0,0.0,,,8.0,4.0,0.0,182.88,65.77,198.12,Switch,1989-09-20,7.58,39.0,8.88,58.0,0.0,0.0,0.0,0.0
/fighter/Aaron-Barringer-18116,aaron barringer,,,,,,United States,"0'0""",154 lbs,,Lightweight,4.0,0.0,4.0,0.0,,4.0,1.0,0.0,3.0,,,,,,,,,,,,,,,,,,
/fighter/Aaron-Brink-271,aaron brink,The Frijolero,12/11/1974,46.0,,"San Diego, California",United States,"6'3""",231 lbs,,Heavyweight,29.0,25.0,4.0,0.0,,29.0,11.0,15.0,1.0,,,26.0,26.0,0.0,190.5,92.99,,Orthodox,1974-11-12,3.49,42.0,5.71,57.0,0.0,0.0,0.0,0.0
/fighter/Aaron-Chalmers-253321,aaron chalmers,The Joker,26/05/1987,34.0,,"Newcastle, Tyne and Wear",England,"5'10""",170 lbs,UTC Birmingham,Welterweight,5.0,2.0,3.0,0.0,,5.0,0.0,1.0,1.0,,,,,,,,,,,,,,,,,,
/fighter/Aaron-Davis-23061,aaron davis,,27/01/1977,44.0,,"Sulphur, Louisiana",United States,"5'9""",186 lbs,Sulphur MMA,Middleweight,8.0,1.0,4.0,3.0,,8.0,3.0,4.0,0.0,,,,,,,,,,,,,,,,,,
/fighter/Aaron-Derrow-48564,aaron derrow,Daddy Long Legs,10/07/1987,34.0,,"Blue Springs, Missouri",United States,"6'1""",170 lbs,K2L Grindhouse,Welterweight,14.0,2.0,10.0,2.0,,14.0,4.0,0.0,6.0,,,,,,,,,,,,,,,,,,
/fighter/Aaron-Ely-84647,aaron ely,The Cyborg,18/03/1989,32.0,,"Leavenworth, Kansas",United States,"5'8""",135 lbs,HDMMA,Bantamweight,5.0,0.0,5.0,0.0,,5.0,0.0,0.0,2.0,,The Cyborg,5.0,2.0,0.0,172.72,61.23,,,,0.82,15.0,0.66,69.0,2.47,100.0,50.0,4.9
/fighter/Aaron-Hamilton-65199,aaron hamilton,The Snake,20/11/1982,38.0,,"Stockton, California",United States,"5'11""",184 lbs,,Middleweight,1.0,0.0,1.0,0.0,,1.0,4.0,1.0,1.0,,,,,,,,,,,,,,,,,,
,aaron jeffery,,,,,,,,,,,,,,,,,,,,,,10.0,3.0,0.0,187.96,83.91,185.42,Orthodox,1992-11-14,3.1,45.0,4.46,34.0,0.0,0.0,50.0,0.0
/fighter/Aaron-Johnson-39330,aaron johnson,Tex,01/04/1986,35.0,,"Kennesaw, Georgia",United States,"6'1""",185 lbs,Defkon1,Middleweight,13.0,1.0,12.0,0.0,,13.0,5.0,3.0,2.0,,,,,,,,,,,,,,,,,,
,aaron lanfranco,,,,,,,,,,,,,,,,,,,,,,5.0,1.0,0.0,,70.31,,,,0.0,0.0,0.0,0.0,0.0,0.0,0.0,0.0
/fighter/Aaron-McKenzie-118517,aaron mckenzie,,20/07/1988,33.0,,Oklahoma,United States,"5'11""",155 lbs,BattleGrounds MMA,Lightweight,10.0,4.0,4.0,2.0,,10.0,0.0,0.0,2.0,,,,,,,,,,,,,,,,,,
/fighter/Aaron-Miller-23570,aaron miller,Blood Spiller,23/05/1980,41.0,,"Hacienda Heights, California",United States,"5'9""",146 lbs,Bloodbank MMA,Featherweight,15.0,4.0,1.0,10.0,,15.0,1.0,8.0,1.0,,Blood Spiller,14.0,10.0,0.0,175.26,65.77,,,,0.0,0.0,0.0,0.0,0.0,0.0,0.0,0.0
/fighter/Aaron-Phillips-55298,aaron phillips,,05/08/1989,32.0,,"Lafayette, Louisiana",United States,"5'9""",135 lbs,Gladiators Academy,Bantamweight,12.0,6.0,2.0,4.0,,12.0,1.0,1.0,2.0,,The Dragon,12.0,5.0,0.0,175.26,61.23,180.34,Southpaw,1989-08-05,1.51,53.0,3.66,43.0,0.86,50.0,44.0,0.6
/fighter/Aaron-Pico-191127,aaron pico,,23/09/1996,24.0,,"Whittier, California",United States,"5'8""",145 lbs,Jackson-Wink MMA,Featherweight,8.0,6.0,2.0,0.0,,8.0,2.0,1.0,0.0,,,,,,,,,,,,,,,,,,
/fighter/Aaron-Riley-1567,aaron riley,,09/12/1980,40.0,,"Tell City, Indiana",United States,"5'9""",155 lbs,Jackson-Wink MMA,Lightweight,30.0,9.0,10.0,11.0,,30.0,7.0,2.0,5.0,,,30.0,14.0,1.0,172.72,70.31,175.26,Southpaw,1980-12-09,3.45,34.0,3.78,61.0,1.18,34.0,60.0,0.1
/fighter/Aaron-Roberson-80910,aaron roberson,,16/03/1990,31.0,,"Miami, Oklahoma",United States,"5'10""",146 lbs,,Featherweight,10.0,2.0,7.0,1.0,,10.0,1.0,6.0,2.0,,,,,,,,,,,,,,,,,,
/fighter/Aaron-Rodriguez-260529,aaron rodriguez,,26/01/1987,34.0,,"Lawton, Oklahoma",United States,"5'9""",185 lbs,,Middleweight,0.0,0.0,0.0,0.0,,0.0,0.0,0.0,1.0,,,,,,,,,,,,,,,,,,
/fighter/Aaron-Romero-11876,aaron romero,,26/07/1972,49.0,,"Wheat Ridge, Colorado",United States,"6'0""",161 lbs,Grudge Training Center,Welterweight,6.0,2.0,2.0,2.0,,6.0,3.0,1.0,7.0,,,,,,,,,,,,,,,,,,
/fighter/Aaron-Rosa-15129,aaron rosa,,28/05/1983,38.0,,"San Antonio, Texas",United States,"6'3""",205 lbs,Rodrigo Pinheiro Brazilian Jiu-Jitsu,Light Heavyweight,18.0,6.0,4.0,8.0,,18.0,3.0,2.0,1.0,,,18.0,6.0,0.0,193.04,92.99,195.58,Orthodox,1983-05-28,4.03,47.0,4.41,45.0,0.36,33.0,85.0,0.4
/fighter/Aaron-Simpson-24986,aaron simpson,A-Train,20/07/1974,47.0,,"Phoenix, Arizona",United States,"6'0""",170 lbs,Power MMA Team,Welterweight,12.0,6.0,1.0,5.0,,12.0,3.0,0.0,2.0,,A-Train,12.0,5.0,0.0,182.88,77.11,185.42,Orthodox,1974-07-20,3.6,52.0,2.53,56.0,3.78,34.0,83.0,0.5
/fighter/Aaron-Tregear-8199,aaron tregear,,,,,"London, Ontario",Canada,"0'0""",170 lbs,,Welterweight,6.0,3.0,3.0,0.0,,6.0,0.0,3.0,1.0,,,,,,,,,,,,,,,,,,
,aaron trujillo,,,,,,,,,,,,,,,,,,,,,,0.0,1.0,0.0,165.1,56.7,,,,0.0,0.0,0.0,0.0,0.0,0.0,0.0,0.0
/fighter/Aaron-Vickers-228029,aaron vickers,,,,,"Longview, Texas",United States,"0'0""",135 lbs,,Bantamweight,4.0,0.0,1.0,3.0,,4.0,0.0,1.0,3.0,,,,,,,,,,,,,,,,,,
/fighter/Aaron-Webb-194491,aaron webb,Spidey,07/08/1986,35.0,,"Joliet, Illinois",United States,"5'11""",145 lbs,,Featherweight,3.0,3.0,0.0,0.0,,3.0,2.0,2.0,0.0,,,,,,,,,,,,,,,,,,
,aaron wetherspoon,,,,,,,,,,,,,,,,,,,,,Slam,9.0,5.0,0.0,,77.11,,,,2.27,32.0,4.33,45.0,0.0,0.0,77.0,0.0
/fighter/Aaron-Wilkinson-39265,aaron wilkinson,The Daywalker,31/01/1987,34.0,,"Manchester, Greater Manchester",England,"5'10""",170 lbs,Straight Blast Gym,Welterweight,11.0,2.0,7.0,2.0,,11.0,2.0,4.0,1.0,,The Daywalker,11.0,7.0,0.0,177.8,70.31,,Orthodox,1987-01-31,0.0,0.0,0.0,100.0,7.32,100.0,0.0,0.0
/fighter/Aaron-Wise-16283,aaron wise,,,,,"Poteau, Oklahoma",United States,"5'6""",135 lbs,,Bantamweight,6.0,3.0,3.0,0.0,,6.0,1.0,5.0,0.0,,,,,,,,,,,,,,,,,,
,abdul azeem badakhshi,,,,,,,,,,,,,,,,,,,,,The Afghan Lion,13.0,3.0,0.0,,65.77,,,,0.0,0.0,0.0,0.0,0.0,0.0,0.0,0.0
/fighter/Abdul-Aziz-Calim-279119,abdul aziz calim,The Krauser,,,,,Indonesia,"0'0""",125 lbs,Han Academy,Flyweight,5.0,0.0,2.0,3.0,,5.0,2.0,3.0,0.0,,,,,,,,,,,,,,,,,,
/fighter/Abdul-Razak-Alhassan-151701,abdul razak alhassan,Judo Thunder,11/08/1985,36.0,,"Arlington, Texas",United States,"5'10""",185 lbs,Fortis MMA,Middleweight,10.0,10.0,0.0,0.0,,10.0,1.0,0.0,3.0,,,12.0,6.0,0.0,177.8,83.91,185.42,Orthodox,1985-08-11,3.37,48.0,3.99,55.0,0.89,38.0,50.0,0.2
,abdul-kareem al-selwady,,,,,,,,,,,,,,,,,,,,,Pride of Palestine,15.0,3.0,0.0,172.72,70.31,175.26,Orthodox,1995-04-10,4.6,28.0,3.6,61.0,1.0,16.0,0.0,0.0
/fighter/AbdulKerim-Edilov-63045,abdul-kerim edilov,,25/11/1991,29.0,,"Grozny, Chechnya",Russia,"6'3""",205 lbs,Akhmat Fight Team,Light Heavyweight,17.0,9.0,7.0,1.0,,17.0,0.0,3.0,1.0,,,17.0,4.0,0.0,187.96,92.99,,Orthodox,1991-11-25,10.22,61.0,0.13,92.0,3.98,100.0,0.0,2.0
/fighter/Abdulbasir-Vagabov-190827,abdulbasir vagabov,Dagestan Machine,23/05/1991,30.0,,St. Petersburg,Russia,"6'1""",242 lbs,Allstars Training Center,Heavyweight,12.0,7.0,4.0,1.0,,12.0,1.0,0.0,1.0,,,,,,,,,,,,,,,,,,
/fighter/Abe-Wagner-15041,abe wagner,Hurricane,04/03/1980,41.0,,"Omaha, Nebraska",United States,"6'4""",256 lbs,MidAmerica Martial Arts,Heavyweight,11.0,7.0,3.0,1.0,,11.0,3.0,4.0,1.0,,,,,,,,,,,,,,,,,,
/fighter/Abe-Wilson-46271,abe wilson,,,,,Tennessee,United States,"6'4""",185 lbs,,Middleweight,5.0,1.0,4.0,0.0,,5.0,0.0,0.0,5.0,,,,,,,,,,,,,,,,,,
,abel cullum,,,,,,,,,,,,,,,,,,,,,The Silent Assassin,20.0,6.0,0.0,170.18,63.05,,Orthodox,1987-04-21,1.82,40.0,1.23,46.0,4.01,52.0,0.0,2.8
/fighter/Abel-Trujillo-17129,abel trujillo,Killa,18/09/1983,37.0,,"Des Moines, Iowa",United States,"5'8""",155 lbs,Blackzilians,Lightweight,15.0,5.0,4.0,5.0,1.0,15.0,1.0,4.0,3.0,0.0,Killa,15.0,8.0,0.0,172.72,70.31,177.8,Orthodox,1983-09-18,2.65,41.0,2.31,59.0,2.18,45.0,40.0,0.4
/fighter/Abner-Lloveras-11729,abner lloveras,Skullman,04/09/1982,38.0,,"Barcelona, Catalonia",Spain,"5'11""",155 lbs,Gracie Barcelona,Lightweight,22.0,8.0,6.0,8.0,,22.0,3.0,1.0,7.0,,Skullman,20.0,9.0,1.0,180.34,70.31,,,,6.27,49.0,6.87,43.0,2.0,20.0,0.0,0.0
/fighter/Abner-Perez-154797,abner perez,The Lion Warrior,22/09/1986,34.0,,"Madera, California",United States,"5'9""",145 lbs,,Featherweight,0.0,0.0,0.0,0.0,,0.0,1.0,1.0,0.0,,,,,,,,,,,,,,,,,,
,abongo humphrey,,,,,,,,,,,,,,,,,,,,,,7.0,3.0,0.0,180.34,92.99,,Orthodox,,1.45,40.0,3.83,46.0,1.41,37.0,33.0,3.8
/fighter/Abraham-Vaesau-110637,abraham vaesau,,02/12/1987,33.0,,"San Francisco, California",United States,"5'11""",175 lbs,Dragon House MMA,Middleweight,5.0,5.0,0.0,0.0,,5.0,1.0,2.0,0.0,,,,,,,,,,,,,,,,,,
,abram torres,,,,,,,,,,,,,,,,,,,,,,4.0,3.0,0.0,177.8,77.11,,,,0.0,0.0,0.0,0.0,0.0,0.0,0.0,0.0
/fighter/Abrou-Fernandes-192763,abrou fernandes,The Black Komodo,,,,"Solo, Central Java",Indonesia,"5'9""",145 lbs,Hans Academy,Featherweight,9.0,3.0,3.0,3.0,,9.0,1.0,0.0,1.0,,,,,,,,,,,,,,,,,,
/fighter/Abu-Azaitar-55936,abu azaitar,Captain Morocco,10/03/1986,35.0,,Rabat,Morocco,"5'9""",185 lbs,Team Azaitar,Middleweight,15.0,8.0,1.0,6.0,,15.0,2.0,0.0,0.0,,Captain Morocco,14.0,4.0,1.0,175.26,83.91,193.04,Orthodox,1986-03-10,4.38,43.0,4.32,51.0,1.0,37.0,42.0,0.0
/fighter/Abubakar-Nurmagomedov-86474,abubakar nurmagomedov,,13/11/1989,31.0,,"Makhachkala, Dagestan",Russia,"5'11""",170 lbs,Fightspirit Team,Welterweight,16.0,6.0,4.0,6.0,,16.0,1.0,2.0,0.0,,,17.0,4.0,1.0,180.34,77.11,182.88,Orthodox,1989-11-13,2.78,53.0,2.61,65.0,1.25,22.0,88.0,0.0
/fighter/Abumuslim-Alikhanov-324893,abumuslim alikhanov,Merciless,08/07/1990,31.0,,Dagestan,Russia,"5'9""",145 lbs,Tiger Muay Thai,Featherweight,4.0,0.0,2.0,2.0,,4.0,0.0,0.0,0.0,,,,,,,,,,,,,,,,,,
,abus magomedov,,,,,,,,,,,,,,,,,,,,,,25.0,6.0,1.0,187.96,83.91,198.12,Orthodox,1990-09-02,3.73,42.0,5.36,54.0,0.61,50.0,100.0,0.0
,acacio dos santos,,,,,,,,,,,,,,,,,,,,,Pequeno,14.0,5.0,0.0,193.04,92.99,200.66,Orthodox,1991-09-29,1.27,41.0,1.4,43.0,0.0,0.0,31.0,0.0
,achilles estremadura,,,,,,,,,,,,,,,,,,,,,,7.0,1.0,0.0,177.8,70.31,172.72,Orthodox,1992-03-11,3.2,43.0,3.27,70.0,0.0,0.0,0.0,0.0
/fighter/Achmad-Eko-Priandono-295785,achmad eko priandono,Electrical Knock Out,,,,,Indonesia,"0'0""",135 lbs,Saint Electra MMA,Bantamweight,6.0,3.0,1.0,2.0,,6.0,0.0,0.0,2.0,,,,,,,,,,,,,,,,,,
,achmed labasanov,,,,,,,,,,,,,,,,,,,,,,7.0,4.0,0.0,190.5,97.52,,Orthodox,1978-04-24,0.75,39.0,1.1,46.0,3.0,100.0,0.0,0.8
/fighter/Acoidan-Duque-76212,acoidan duque,Pei,,,,"Las Palmas de Gran Canaria, Las Palmas",Spain,"5'11""",170 lbs,Taz Academy,Welterweight,15.0,2.0,10.0,2.0,1.0,15.0,2.0,0.0,1.0,0.0,,,,,,,,,,,,,,,,,
/fighter/Adam-Antolin-28758,adam antolin,Captain Chaos,28/02/1982,39.0,,"San Jose, California",United States,"5'5""",125 lbs,American Kickboxing Academy,Flyweight,15.0,3.0,10.0,2.0,,15.0,2.0,2.0,1.0,,Captain Chaos,12.0,3.0,0.0,165.1,56.7,160.02,Orthodox,1982-02-28,5.73,52.0,5.0,69.0,0.0,0.0,100.0,0.0
/fighter/Adam-Borics-198059,adam borics,The Kid,07/07/1993,28.0,,"Sirok, Heves",Hungary,"5'11""",145 lbs,Sanford MMA,Featherweight,17.0,4.0,6.0,6.0,1.0,17.0,0.0,1.0,0.0,0.0,,,,,,,,,,,,,,,,,
/fighter/Adam-Cella-69956,adam cella,El Natural,26/06/1985,36.0,,"St. Louis, Missouri",United States,"6'2""",189 lbs,Finney's HIT Squad,Light Heavyweight,10.0,6.0,4.0,0.0,0.0,10.0,2.0,5.0,2.0,1.0,El Naturel,6.0,8.0,0.0,187.96,77.11,,,,1.91,42.0,2.61,51.0,3.92,75.0,50.0,1.3
,adam fugitt,,,,,,,,,,,,,,,,,,,,,,9.0,4.0,0.0,185.42,77.11,195.58,Southpaw,1989-01-12,4.3,54.0,5.13,48.0,3.43,33.0,50.0,0.0
/fighter/Adam-Gustab-168945,adam gustab,,,,,Krakow,Poland,"0'0""",145 lbs,Kyoujin MMA,Featherweight,5.0,3.0,1.0,1.0,,5.0,2.0,2.0,1.0,,,,,,,,,,,,,,,,,,
,adam hunter,,,,,,,,,,,,,,,,,,,,,Warhammer,7.0,1.0,0.0,185.42,83.91,,Orthodox,1983-10-16,0.0,0.0,0.0,0.0,0.0,0.0,0.0,0.0
/fighter/Adam-Keresh-267233,adam keresh,,,,,Tel Aviv,Israel,"5'11""",245 lbs,Team Bert,Heavyweight,4.0,4.0,0.0,0.0,,4.0,0.0,0.0,0.0,,,,,,,,,,,,,,,,,,
,adam khaliev,,,,,,,,,,,,,,,,,,,,,,6.0,0.0,0.0,182.88,77.11,,Orthodox,1984-04-16,0.0,0.0,0.0,0.0,0.0,0.0,0.0,0.0
,adam lynn,,,,,,,,,,,,,,,,,,,,,,17.0,10.0,0.0,177.8,70.31,,Orthodox,,1.47,63.0,6.95,10.0,0.0,0.0,50.0,0.0
/fighter/Adam-Maciejewski-12686,adam maciejewski,Maja,11/07/1980,41.0,,Krasnik,Poland,"6'1""",251 lbs,Midwest Training Center,Heavyweight,13.0,4.0,4.0,5.0,,13.0,2.0,2.0,3.0,,,,,,,,,,,,,,,,,,
/fighter/Adam-McDonough-27047,adam mcdonough,Big Gunna,24/09/1985,35.0,,"St. Cloud, Minnesota",United States,"5'10""",170 lbs,Get Sum Athletic Compound,Welterweight,11.0,6.0,3.0,2.0,,11.0,0.0,0.0,1.0,,,,,,,,,,,,,,,,,,
/fighter/Adam-Meredith-57212,adam meredith,,07/12/1987,33.0,,"St. Louis, Missouri",United States,"6'2""",170 lbs,St. Charles MMA,Welterweight,5.0,1.0,3.0,1.0,,5.0,1.0,1.0,1.0,,,5.0,3.0,0.0,187.96,77.11,,,,2.63,50.0,2.11,55.0,7.89,100.0,100.0,7.9
/fighter/Adam-Milstead-60258,adam milstead,The Prototype,03/07/1987,34.0,,"Beaver Falls, Pennsylvania",United States,"6'3""",205 lbs,Pittsburgh Fight Club,Light Heavyweight,8.0,6.0,2.0,0.0,,8.0,2.0,0.0,1.0,,The Prototype,8.0,4.0,0.0,190.5,92.99,193.04,Orthodox,1987-07-03,3.85,46.0,4.79,43.0,0.0,0.0,64.0,0.0
/fighter/Adam-Piccolotti-149717,adam piccolotti,The Bomb,23/10/1988,32.0,,"Half Moon Bay, California",United States,"5'11""",155 lbs,American Kickboxing Academy,Lightweight,12.0,2.0,6.0,4.0,,12.0,0.0,1.0,3.0,,,9.0,0.0,0.0,180.34,70.31,,,,4.61,50.0,2.83,71.0,2.96,60.0,100.0,3.0
/fighter/Adam-Schindler-36534,adam schindler,,19/05/1983,38.0,,"Houston, Texas",United States,"5'8""",145 lbs,4oz. Fight Club,Featherweight,10.0,1.0,6.0,3.0,,10.0,4.0,0.0,2.0,,,10.0,6.0,0.0,172.72,70.31,,,,0.0,0.0,0.0,0.0,0.0,0.0,0.0,0.0
/fighter/Adam-Shahir-Kayoom-8830,adam shahir kayoom,Shogun,22/10/1977,43.0,,,Malaysia,"5'11""",170 lbs,Phuket Top Team,Welterweight,4.0,0.0,3.0,1.0,,4.0,0.0,0.0,1.0,,,,,,,,,,,,,,,,,,
,adam smith,,,,,,,,,,,,,,,,,,,,,,0.0,3.0,0.0,,,,,,0.0,0.0,0.0,0.0,0.0,0.0,0.0,0.0
/fighter/Adam-Snook-64541,adam snook,,,,,,,"0'0""",161 lbs,,Welterweight,0.0,0.0,0.0,0.0,,0.0,1.0,2.0,0.0,,,,,,,,,,,,,,,,,,
,adam steele,,,,,,,,,,,,,,,,,,,,,,0.0,1.0,0.0,,77.11,,,,0.0,0.0,0.0,0.0,0.0,0.0,0.0,0.0
/fighter/Adam-Ward-43120,adam ward,,28/02/1986,35.0,,"Chicago, Illinois",United States,"5'10""",145 lbs,Gilbert Grappling,Featherweight,18.0,4.0,6.0,7.0,1.0,18.0,4.0,3.0,6.0,0.0,,,,,,,,,,,,,,,,,
/fighter/Adam-Wieczorek-86930,adam wieczorek,Siwy,05/02/1992,29.0,,Chorzow,Poland,"6'5""",232 lbs,AKS Chorzow,Heavyweight,10.0,3.0,6.0,1.0,,10.0,0.0,0.0,2.0,,Siwy,10.0,2.0,0.0,195.58,113.4,205.74,Orthodox,1992-02-05,1.68,38.0,1.87,48.0,0.41,33.0,58.0,0.4
/fighter/Adam-Yandiev-186189,adam yandiev,Beard,07/07/1988,33.0,,"Nazran, Ingushetia",Russia,"5'11""",185 lbs,Fight or Die,Middleweight,9.0,3.0,6.0,0.0,,9.0,0.0,1.0,0.0,,Boroda,9.0,1.0,0.0,175.26,83.91,187.96,Orthodox,1988-08-07,0.18,8.0,6.14,36.0,0.0,0.0,25.0,0.0
/fighter/Adek-Omar-152557,adek omar,Wildcat,,,,"Johor Bahru, Johor",Malaysia,"0'0""",115 lbs,Reps Fitness,Strawweight,0.0,0.0,0.0,0.0,,0.0,0.0,3.0,0.0,,,,,,,,,,,,,,,,,,
/fighter/Adel-Altamimi-160687,adel altamimi,Kyokushin,07/03/1989,32.0,,"Los Angeles, California",United States,"5'9""",145 lbs,Kings MMA,Featherweight,8.0,1.0,7.0,0.0,,8.0,5.0,1.0,1.0,,,,,,,,,,,,,,,,,,
/fighter/Adi-Nugroho-232891,adi  nugroho,,,,,,Indonesia,"0'0""",125 lbs,Garuda Martial Arts,Flyweight,0.0,0.0,0.0,0.0,,0.0,1.0,0.0,1.0,,,,,,,,,,,,,,,,,,
/fighter/Adi-Paryanto-285001,adi paryanto,Zenwalk,,,,,Indonesia,"0'0""",115 lbs,IndoGym,Strawweight,5.0,1.0,3.0,1.0,,5.0,2.0,1.0,0.0,,,,,,,,,,,,,,,,,,
/fighter/Adib-Sulaiman-289323,adib sulaiman,Deep,01/02/1991,30.0,,,Brunei Darussalam,"5'4""",135 lbs,Wolfpack Training Ground,Bantamweight,3.0,3.0,0.0,0.0,,3.0,2.0,0.0,0.0,,,,,,,,,,,,,,,,,,
/fighter/Adil-Benjilany-150331,adil benjilany,Gloryboy,01/01/1991,30.0,,,Morocco,"5'11""",145 lbs,Midwest Training Center,Featherweight,6.0,4.0,0.0,2.0,,6.0,0.0,1.0,2.0,,,,,,,,,,,,,,,,,,
/fighter/Adin-Duenas-87993,adin duenas,The Dream,02/07/1988,33.0,,"Gilroy, California",United States,"5'6""",140 lbs,Antdawg's USH,Featherweight,6.0,0.0,2.0,4.0,,6.0,0.0,1.0,1.0,,,6.0,1.0,0.0,167.64,65.77,,,,0.0,0.0,0.0,0.0,0.0,0.0,0.0,0.0
/fighter/Adlan-Amagov-41523,adlan amagov,Borz,30/10/1986,34.0,,Grozny,Russia,"5'11""",170 lbs,Jackson-Wink MMA,Welterweight,14.0,8.0,1.0,5.0,,14.0,1.0,1.0,0.0,,Borz,14.0,2.0,1.0,187.96,77.11,193.04,Orthodox,1986-10-30,3.29,47.0,0.82,78.0,5.84,56.0,100.0,0.0
,adli edwards,,,,,,,,,,,,,,,,,,,,,,4.0,1.0,0.0,,65.77,,,,0.0,0.0,0.0,0.0,0.0,0.0,0.0,0.0
/fighter/Adrian-Cruz-50676,adrian cruz,Killa,02/04/1982,39.0,,"Rio Rancho, New Mexico",United States,"5'8""",135 lbs,Judgment MMA,Bantamweight,6.0,3.0,2.0,1.0,,6.0,1.0,0.0,1.0,,,,,,,,,,,,,,,,,,
,adrian diaz,,,,,,,,,,,,,,,,,,,,,,11.0,4.0,1.0,177.8,65.77,,Southpaw,1988-04-26,0.48,42.0,3.84,51.0,2.4,50.0,0.0,0.0
/fighter/Adrian-Hadribeaj-119963,adrian hadribeaj,The Eagle,17/10/1990,30.0,,"Waterford, Michigan",United States,"5'10""",155 lbs,Team Hadribeaj,Lightweight,10.0,2.0,2.0,6.0,,10.0,1.0,1.0,0.0,,,,,,,,,,,,,,,,,,
/fighter/Adrian-Haley-285581,adrian haley,,23/05/1998,23.0,,"Orlando, Florida",United States,"0'0""",126 lbs,American Top Team Longwood,Flyweight,1.0,0.0,0.0,1.0,,1.0,0.0,0.0,1.0,,,,,,,,,,,,,,,,,,
/fighter/Adrian-Henderson-96773,adrian henderson,A-Train,25/05/1979,42.0,,"Columbia, South Carolina",United States,"6'3""",260 lbs,,Heavyweight,8.0,4.0,3.0,1.0,,8.0,2.0,0.0,1.0,,,,,,,,,,,,,,,,,,
/fighter/Adrian-Mattheis-232883,adrian mattheis,Papua Badboy,14/05/1993,28.0,,Jakarta,Indonesia,"5'4""",115 lbs,Tiger Shark Fighting Academy,Strawweight,9.0,4.0,4.0,1.0,,9.0,2.0,2.0,1.0,,,,,,,,,,,,,,,,,,
/fighter/Adrian-Miles-48251,adrian miles,Guard Yo Grill,14/09/1983,37.0,,"Biloxi, Mississippi",United States,"6'0""",185 lbs,Alan Belcher MMA Club,Middleweight,16.0,7.0,5.0,4.0,,16.0,3.0,4.0,4.0,,,,,,,,,,,,,,,,,,
/fighter/Adrian-Najera-173747,adrian najera,,09/05/1991,30.0,,"San Diego, California",United States,"0'0""",125 lbs,San Diego Combat Academy,Flyweight,2.0,1.0,1.0,0.0,,2.0,0.0,0.0,1.0,,,,,,,,,,,,,,,,,,
/fighter/Adrian-Pang-8427,adrian pang,The Hunter,02/09/1977,43.0,,"Kokopo, East New Britain",Papua New Guinea,"5'7""",155 lbs,Integrated MMA,Lightweight,23.0,6.0,10.0,7.0,,23.0,3.0,1.0,9.0,,,,,,,,,,,,,,,,,,
/fighter/Adrian-Serrano-254,adrian serrano,,23/12/1963,57.0,,"Milwaukee, Wisconsin",United States,"5'8""",175 lbs,Adrian Serrano Combat Sports Gym,Middleweight,56.0,14.0,31.0,8.0,3.0,56.0,12.0,13.0,4.0,0.0,,56.0,29.0,4.0,172.72,77.11,,,,0.0,0.0,0.0,0.0,0.0,0.0,0.0,0.0
/fighter/Adrian-Yanez-86354,adrian yanez,,29/11/1993,27.0,,"La Porte, Texas",United States,"5'7""",135 lbs,Metro Fight Club,Bantamweight,14.0,9.0,2.0,3.0,,14.0,0.0,0.0,3.0,,,16.0,5.0,0.0,170.18,61.23,177.8,Orthodox,1993-11-29,6.15,39.0,5.73,57.0,0.0,0.0,100.0,0.0
/fighter/Adriano-Martins-9907,adriano martins,,16/12/1982,38.0,,"Manaus, Amazonas",Brazil,"5'10""",154 lbs,Top Life Amazonas,Lightweight,28.0,13.0,3.0,12.0,,28.0,3.0,0.0,8.0,,,28.0,9.0,0.0,177.8,70.31,182.88,Southpaw,1982-12-16,1.8,38.0,2.14,65.0,0.83,80.0,81.0,0.4
/fighter/Adriano-Moraes-84527,adriano moraes,Mikinho / Black Diamond,21/04/1989,32.0,,"Brasilia, Federal District",Brazil,"5'8""",135 lbs,Constrictor Team,Bantamweight,19.0,4.0,9.0,6.0,,19.0,0.0,0.0,3.0,,,,,,,,,,,,,,,,,,
/fighter/Adriano-Santos-206,adriano santos,,,,,,,"0'0""",0 lbs,,,0.0,0.0,0.0,0.0,,0.0,1.0,0.0,0.0,,,0.0,1.0,0.0,,,,,,0.0,0.0,0.0,0.0,0.0,0.0,0.0,0.0
/fighter/Adrienna-Jenkins-9513,adrienna jenkins,AJ,22/07/1981,40.0,,"Oceanside, California",United States,"5'8""",145 lbs,Miletich Martial Arts,Featherweight,19.0,10.0,8.0,0.0,1.0,19.0,2.0,3.0,1.0,0.0,AJ,19.0,6.0,0.0,172.72,65.77,,,,0.0,0.0,0.0,0.0,0.0,0.0,0.0,0.0
/fighter/Adrienne-Seiber-71311,adrienne seiber,Aggravated Battery,,,,"Evergreen Park, Illinois",United States,"5'8""",144 lbs,Academy of Self Defense,Featherweight,2.0,1.0,0.0,1.0,,2.0,0.0,0.0,2.0,,,,,,,,,,,,,,,,,,
/fighter/Agilan-Thani-153265,agilan thani,Alligator,18/08/1995,25.0,,Kuala Lumpur,Malaysia,"5'9""",180 lbs,Monarchy MMA,Middleweight,11.0,3.0,5.0,3.0,,11.0,1.0,2.0,2.0,,,,,,,,,,,,,,,,,,
/fighter/Agu-Demu-349811,agu demu,,,,,,China,"0'0""",180 lbs,,Middleweight,0.0,0.0,0.0,0.0,,0.0,0.0,1.0,0.0,,,,,,,,,,,,,,,,,,
/fighter/Agus-Nanang-90657,agus nanang,,,,,Bandung,Indonesia,"0'0""",168 lbs,Bandung Fighting Club,Welterweight,0.0,0.0,0.0,0.0,,0.0,1.0,0.0,0.0,,,,,,,,,,,,,,,,,,
,ahmad hassanzada,,,,,,,,,,,,,,,,,,,,,Lion of the Ring,10.0,2.0,0.0,185.42,70.31,190.5,Orthodox,1996-11-20,2.59,34.0,4.42,40.0,2.5,22.0,0.0,0.0
/fighter/Ahmad-Qais-Jasoor-244049,ahmad qais jasoor,,,,,Kabul,Afghanistan,"5'6""",143 lbs,,Featherweight,5.0,2.0,2.0,1.0,,5.0,1.0,1.0,0.0,,,,,,,,,,,,,,,,,,
/fighter/Ahmed-Faez-Anuar-305141,ahmed faez anuar,Eazy,,,,,Brunei,"0'0""",170 lbs,Khalifa MMA,Welterweight,3.0,0.0,2.0,1.0,,3.0,0.0,0.0,0.0,,,,,,,,,,,,,,,,,,
/fighter/Ahmed-Faress-113575,ahmed faress,The Prince,18/08/1991,29.0,,Cairo,Egypt,"5'9""",145 lbs,Saracens Team,Featherweight,16.0,3.0,13.0,0.0,,16.0,2.0,1.0,1.0,,,,,,,,,,,,,,,,,,
/fighter/Ahmed-Mujtaba-132987,ahmed mujtaba,The Wolverine,,,,Quetta,Pakistan,"5'11""",155 lbs,Fight Fortress MMA,Lightweight,8.0,2.0,4.0,1.0,1.0,8.0,0.0,2.0,0.0,0.0,,,,,,,,,,,,,,,,,
/fighter/Ahmed-White-284463,ahmed white,,,,,"Berkeley, California",United States,"5'11""",188 lbs,Rogue Empire MMA,Light Heavyweight,0.0,0.0,0.0,0.0,,0.0,1.0,0.0,0.0,,,,,,,,,,,,,,,,,,
/fighter/Ahmet-Kayretli-156307,ahmet kayretli,The Turk,23/03/1989,32.0,,,Turkey,"5'7""",135 lbs,Kaizen MMA Fairfax,Bantamweight,8.0,5.0,0.0,3.0,,8.0,1.0,3.0,0.0,,,,,,,,,,,,,,,,,,
/fighter/Ahsan-Abdullah-85771,ahsan abdullah,,02/08/1992,29.0,,"Cortland, New York",United States,"5'8""",138 lbs,Team Bombsquad,Featherweight,8.0,3.0,3.0,2.0,,8.0,1.0,5.0,3.0,,,,,,,,,,,,,,,,,,
/fighter/Ahva-Mayi-262519,ahva mayi,,,,,"Nashville, Tennessee",United States,"0'0""",145 lbs,,Featherweight,0.0,0.0,0.0,0.0,,0.0,0.0,0.0,0.0,,,,,,,,,,,,,,,,,,
/fighter/Ai-Shimizu-237929,ai shimizu,Princess Bee,24/10/1989,31.0,,Tokyo,Japan,"5'1""",107 lbs,Krazy Bee,Strawweight,5.0,2.0,1.0,2.0,,5.0,0.0,0.0,1.0,,,,,,,,,,,,,,,,,,
/fighter/Aiden-Lee-146975,aiden lee,,29/04/1995,26.0,,"Birmingham, West Midlands",England,"6'0""",145 lbs,Fearless MMA,Featherweight,9.0,2.0,5.0,2.0,,9.0,1.0,1.0,3.0,,,,,,,,,,,,,,,,,,
/fighter/Aiemann-Zahabi-121009,aiemann zahabi,,19/11/1987,33.0,,"Laval, Quebec",Canada,"5'8""",135 lbs,Tristar Gym,Bantamweight,8.0,5.0,2.0,1.0,,8.0,1.0,0.0,1.0,,,10.0,2.0,0.0,172.72,61.23,172.72,Orthodox,1987-11-19,3.04,43.0,3.4,72.0,0.25,16.0,75.0,0.0
,ailin perez,,,,,,,,,,,,,,,,,,,,,Fiona,9.0,2.0,0.0,165.1,61.23,167.64,Switch,1994-10-05,2.96,55.0,1.18,57.0,4.89,50.0,75.0,0.0
/fighter/Ailinuer-Ahejiang-305959,ailinuer ahejiang,,,,,,China,"0'0""",145 lbs,,Featherweight,4.0,2.0,2.0,0.0,,4.0,1.0,0.0,0.0,,,,,,,,,,,,,,,,,,
,ailiya muratbek,,,,,,,,,,,,,,,,,,,,,,9.0,2.0,0.0,,70.31,,,,0.0,0.0,0.0,0.0,0.0,0.0,0.0,0.0
/fighter/Ailton-Barbosa-23932,ailton barbosa,,09/09/1976,44.0,,"Miami, Florida",United States,"6'1""",179 lbs,American Top Team,Middleweight,13.0,1.0,10.0,2.0,,13.0,1.0,0.0,4.0,,,,,,,,,,,,,,,,,,
/fighter/Ainsley-Robinson-28623,ainsley robinson,,22/03/1972,49.0,,"Oshawa, Ontario",Canada,"5'7""",146 lbs,Elite Training Centre,Featherweight,5.0,3.0,0.0,2.0,,5.0,0.0,2.0,1.0,,,,,,,,,,,,,,,,,,
/fighter/Aisling-Daly-25245,aisling daly,Ais the Bash,24/12/1987,33.0,,"Dublin, Leinster",Ireland,"5'3""",116 lbs,SBG Ireland,Strawweight,16.0,5.0,8.0,3.0,,16.0,1.0,0.0,5.0,,Ais the Bash,16.0,6.0,0.0,157.48,52.16,162.56,Orthodox,1987-12-24,2.92,52.0,1.4,55.0,2.15,41.0,33.0,0.9
,aj cunningham,,,,,,,,,,,,,,,,,,,,,The Savage,10.0,3.0,0.0,177.8,65.77,180.34,Orthodox,1994-09-07,7.58,24.0,11.32,54.0,0.0,0.0,0.0,0.0
,aj dobson,,,,,,,,,,,,,,,,,,,,,,7.0,2.0,0.0,185.42,83.91,193.04,Orthodox,1992-01-18,4.38,47.0,5.25,47.0,1.82,75.0,64.0,0.3
,aj fletcher,,,,,,,,,,,,,,,,,,,,,The Ghost,10.0,3.0,0.0,177.8,77.11,170.18,Switch,1997-02-18,3.36,49.0,4.61,46.0,1.54,35.0,33.0,0.9
,aj fonseca,,,,,,,,,,,,,,,,,,,,,,5.0,4.0,0.0,162.56,65.77,,,,0.0,0.0,0.0,0.0,0.0,0.0,0.0,0.0
,aj matthews,,,,,,,,,,,,,,,,,,,,,,8.0,7.0,0.0,180.34,83.91,,,,5.11,52.0,4.96,51.0,0.0,0.0,100.0,0.0
,aj mckee,,,,,,,,,,,,,,,,,,,,,Mercenary,8.0,0.0,0.0,177.8,65.77,,,,2.75,32.0,0.92,80.0,11.01,100.0,100.0,11.0
,aj siscoe,,,,,,,,,,,,,,,,,,,,,Let's Go,1.0,2.0,0.0,170.18,61.23,,,,0.0,0.0,0.0,0.0,0.0,0.0,0.0,0.0
,aji susilo,,,,,,,,,,,,,,,,,,,,,,6.0,4.0,0.0,177.8,70.31,,,,0.0,0.0,0.0,0.0,0.0,0.0,0.0,0.0
/fighter/Akbarh-Arreola-6120,akbarh arreola,El Caballero,14/01/1983,38.0,,"Tijuana, Baja California",Mexico,"5'10""",155 lbs,Entram Gym,Lightweight,24.0,5.0,18.0,1.0,,24.0,7.0,0.0,4.0,,El Caballero,23.0,11.0,1.0,177.8,70.31,180.34,Southpaw,1983-01-14,2.32,45.0,4.01,56.0,1.07,100.0,33.0,0.4
/fighter/Akenbieke-Ayijiake-186615,akenbieke ayijiake,Tianshan Eagle,,,,,China,"5'7""",143 lbs,Hebei Wanshi Fight Club,Featherweight,12.0,2.0,6.0,4.0,0.0,12.0,1.0,2.0,11.0,1.0,,,,,,,,,,,,,,,,,
/fighter/Akhmed-Fararzha-265835,akhmed fararzha,,19/08/1994,26.0,,Amman,Jordan,"5'4""",135 lbs,Warrior Kharkiv,Bantamweight,8.0,1.0,6.0,1.0,,8.0,0.0,2.0,0.0,,,,,,,,,,,,,,,,,,
/fighter/Akihiro-Fujisawa-31160,akihiro fujisawa,Superjap,,,,,Japan,"5'5""",135 lbs,Yorky MMA,Bantamweight,6.0,5.0,1.0,0.0,,6.0,1.0,2.0,0.0,,,,,,,,,,,,,,,,,,
/fighter/Akihiro-Gono-1217,akihiro gono,,07/10/1974,46.0,,"Higashikurume, Tokyo",Japan,"5'9""",170 lbs,Grabaka,Welterweight,36.0,7.0,9.0,19.0,1.0,36.0,8.0,4.0,12.0,0.0,,35.0,21.0,8.0,170.18,77.11,172.72,Switch,1974-10-07,2.18,48.0,2.67,63.0,1.01,84.0,46.0,0.5
,akihito tanaka,,,,,,,,,,,,,,,,,,,,,Kinniku Mantaro,2.0,2.0,0.0,,,,Southpaw,,0.19,50.0,2.05,38.0,5.59,66.0,0.0,0.0
/fighter/Akira-Corassani-22641,akira corassani,,27/08/1982,38.0,,Gothenburg,Sweden,"5'8""",145 lbs,Renzo Gracie Jiu-Jitsu,Featherweight,12.0,1.0,3.0,7.0,1.0,12.0,6.0,0.0,0.0,0.0,,12.0,6.0,0.0,172.72,65.77,172.72,Orthodox,1982-08-27,3.25,45.0,4.91,50.0,0.7,28.0,86.0,0.0
,akira kikuchi,,,,,,,,,,,,,,,,,,,,,,16.0,4.0,0.0,172.72,70.31,,Orthodox,1978-07-23,3.67,56.0,0.4,14.0,2.0,40.0,100.0,0.0
,akira shoji,,,,,,,,,,,,,,,,,,,,,,14.0,17.0,5.0,172.72,88.45,,Orthodox,1974-01-31,1.03,34.0,2.63,53.0,1.79,73.0,82.0,0.4
,akitoshi tamura,,,,,,,,,,,,,,,,,,,,,The Ironman,21.0,18.0,2.0,175.26,61.23,177.8,Orthodox,1980-05-31,3.73,43.0,1.94,78.0,0.0,0.0,20.0,1.0
,akiyo nishiura,,,,,,,,,,,,,,,,,,,,,Wicky Akiyo,13.0,8.0,1.0,172.72,63.05,,Southpaw,1983-08-08,1.59,57.0,1.26,57.0,0.0,0.0,52.0,0.3
/fighter/Akonne-Wanliss-195067,akonne wanliss,The Jedi,,,,"Wolverhampton, West Midlands",England,"6'1""",145 lbs,Dark Circle Martial Arts,Featherweight,4.0,2.0,2.0,0.0,,4.0,0.0,0.0,2.0,,,,,,,,,,,,,,,,,,
/fighter/Akop-Stepanyan-45416,akop stepanyan,Sniper,06/05/1986,35.0,,St. Petersburg,Russia,"5'9""",146 lbs,RusFighters Sport Club,Featherweight,27.0,16.0,2.0,9.0,,27.0,2.0,7.0,3.0,,,,,,,,,,,,,,,,,,
/fighter/Akuri-Ronda-116747,akuri ronda,,20/03/1989,32.0,,"Chigasaki, Kanagawa",Japan,"5'7""",145 lbs,Shingikan MMA,Featherweight,5.0,2.0,1.0,2.0,,5.0,3.0,0.0,2.0,,,,,,,,,,,,,,,,,,
/fighter/Al-Iaquinta-42817,al iaquinta,Raging,30/04/1987,34.0,,"New York City, New York",United States,"5'7""",155 lbs,Serra-Longo Fight Team,Lightweight,14.0,7.0,1.0,6.0,,14.0,0.0,3.0,3.0,,Raging,14.0,7.0,1.0,177.8,70.31,177.8,Orthodox,1987-04-30,4.06,40.0,4.53,61.0,0.63,18.0,74.0,0.2
,al matavao,,,,,,,,,,,,,,,,,,,,,Sweetness,8.0,3.0,0.0,172.72,92.99,170.18,Orthodox,1994-02-23,7.84,46.0,6.7,58.0,0.0,0.0,0.0,0.0
/fighter/Alaa-Mazloum-149221,alaa mazloum,The Flash,14/11/1982,38.0,,Cairo,Egypt,"5'8""",155 lbs,Egyptian Top Team,Lightweight,1.0,1.0,0.0,0.0,,1.0,0.0,1.0,0.0,,,,,,,,,,,,,,,,,,
/fighter/Alain-Ngalani-141657,alain ngalani,The Panther,07/07/1975,46.0,,,Cameroon,"5'11""",229 lbs,Impakt Hong Kong,Heavyweight,4.0,3.0,0.0,1.0,,4.0,5.0,1.0,0.0,,,,,,,,,,,,,,,,,,
/fighter/Alan-Baudot-138183,alan baudot,The Black Samourai,01/02/1988,33.0,,Lyon,France,"6'3""",246 lbs,MMA Factory,Heavyweight,8.0,7.0,0.0,0.0,1.0,8.0,3.0,0.0,0.0,0.0,The Black Samourai,8.0,3.0,0.0,190.5,110.22,200.66,Orthodox,1988-02-01,5.36,58.0,4.82,46.0,0.0,0.0,62.0,0.0
/fighter/Alan-Belcher-10967,alan belcher,The Talent,24/04/1984,37.0,,"Biloxi, Mississippi",United States,"6'2""",185 lbs,Roufusport,Middleweight,18.0,11.0,5.0,2.0,,18.0,2.0,1.0,5.0,,The Talent,18.0,8.0,0.0,187.96,83.91,190.5,Orthodox,1984-04-24,2.7,41.0,3.1,59.0,0.44,26.0,55.0,0.9
/fighter/Alan-Benson-339121,alan benson,Beaston,,,,"Castro Valley, California",United States,"0'0""",185 lbs,Crispim BJJ,Middleweight,1.0,0.0,0.0,1.0,,1.0,0.0,0.0,1.0,,,,,,,,,,,,,,,,,,
,alan gomez,,,,,,,,,,,,,,,,,,,,,,2.0,0.0,0.0,,70.31,,,,0.0,0.0,0.0,0.0,0.0,0.0,0.0,0.0
,alan hiro,,,,,,,,,,,,,,,,,,,,,Yamaniha,14.0,5.0,4.0,165.1,61.23,,Orthodox,1986-04-04,0.0,0.0,0.0,0.0,0.0,0.0,0.0,0.0
/fighter/Alan-Jouban-65878,alan jouban,Brahma,25/11/1982,38.0,,"Lafayette, Louisiana",United States,"6'0""",170 lbs,Black House,Welterweight,17.0,11.0,0.0,6.0,,17.0,3.0,1.0,3.0,,Brahma,17.0,7.0,0.0,182.88,77.11,185.42,Southpaw,1981-11-25,5.67,50.0,3.77,60.0,0.51,44.0,58.0,0.3
/fighter/Alan-Omer-23437,alan omer,,14/09/1988,32.0,,"Erbil, Kurdistan Region",Iraq,"5'9""",155 lbs,Stallion Cage,Lightweight,24.0,9.0,12.0,3.0,,24.0,0.0,2.0,3.0,,,20.0,5.0,0.0,177.8,65.77,,Orthodox,1988-09-14,3.49,55.0,2.21,64.0,1.69,42.0,66.0,0.0
/fighter/Alan-Patrick-31096,alan patrick,Nuguette,09/07/1983,38.0,,"Manaus, Amazonas",Brazil,"5'11""",155 lbs,Fusion X-Cel,Lightweight,15.0,4.0,2.0,9.0,,15.0,2.0,0.0,1.0,,Nuguette,15.0,4.0,0.0,180.34,70.31,187.96,Southpaw,1983-07-19,1.82,40.0,2.95,43.0,3.01,33.0,43.0,0.3
/fighter/Alan-Philpott-60725,alan philpott,The Apprentice,22/09/1992,28.0,,"Ballymena, Antrim",Northern Ireland,"5'7""",135 lbs,IMMA,Bantamweight,19.0,4.0,8.0,7.0,,19.0,1.0,10.0,1.0,,,,,,,,,,,,,,,,,,
/fighter/Alateng-Burigede-171255,alateng burigede,,12/10/1989,31.0,,Beijing,China,"5'9""",145 lbs,Equilibrium MMA,Featherweight,0.0,0.0,0.0,0.0,,0.0,2.0,3.0,3.0,,,,,,,,,,,,,,,,,,
,alatengheili,,,,,,,,,,,,,,,,,,,,,The Mongolian Knight,16.0,9.0,2.0,165.1,61.23,167.64,Orthodox,1991-12-14,2.88,33.0,5.03,58.0,1.82,40.0,72.0,0.0
,alavutdin gadjiev,,,,,,,,,,,,,,,,,,,,,,18.0,13.0,1.0,187.96,83.91,,Orthodox,1982-06-23,0.99,27.0,0.99,57.0,0.0,0.0,50.0,0.0
/fighter/Albert-Cheng-63422,albert cheng,,07/02/1985,36.0,,"Mississauga, Ontario",Canada,"5'11""",155 lbs,Evolucao Thai,Lightweight,7.0,1.0,2.0,3.0,1.0,7.0,2.0,1.0,1.0,0.0,,7.0,4.0,0.0,180.34,77.11,,Orthodox,1985-02-07,1.0,41.0,2.6,71.0,0.0,0.0,0.0,0.0
,albert duraev,,,,,,,,,,,,,,,,,,,,,,16.0,5.0,0.0,180.34,83.91,190.5,Orthodox,1989-01-05,2.99,40.0,3.01,59.0,1.97,29.0,66.0,0.6
/fighter/Albert-Gonzales-249877,albert gonzales,BigAl,,,,"Fresno, California",United States,"6'3""",180 lbs,Dethrone MMA,Middleweight,2.0,2.0,0.0,0.0,,2.0,1.0,0.0,1.0,,,,,,,,,,,,,,,,,,
/fighter/Albert-Morales-161099,albert morales,The Warrior,25/05/1991,30.0,,"Carson, California",United States,"5'9""",135 lbs,Systems Training Center,Bantamweight,10.0,4.0,4.0,2.0,,10.0,2.0,3.0,2.0,,The Warrior,7.0,4.0,1.0,175.26,61.23,182.88,Orthodox,1991-05-25,3.81,35.0,3.96,56.0,0.91,35.0,70.0,0.2
/fighter/Albert-Rios-10591,albert rios,,,,,"Los Angeles, California",United States,"5'8""",135 lbs,Subfighter MMA,Bantamweight,13.0,1.0,4.0,7.0,1.0,13.0,1.0,1.0,4.0,0.0,,13.0,6.0,0.0,172.72,65.77,,,,0.0,0.0,0.0,0.0,0.0,0.0,0.0,0.0
/fighter/Albert-Tumenov-60198,albert tumenov,Einstein,26/12/1991,29.0,,"Nalchik, Kabardino-Balkaria",Russia,"5'11""",170 lbs,American Top Team,Welterweight,22.0,14.0,0.0,8.0,,22.0,0.0,2.0,2.0,,Einstein,18.0,4.0,0.0,180.34,77.11,185.42,Orthodox,1991-12-26,3.76,42.0,3.34,58.0,0.2,20.0,75.0,0.0
,alberta cerra leon,,,,,,,,,,,,,,,,,,,,,,0.0,1.0,0.0,172.72,107.95,,,,0.0,0.0,0.0,0.0,0.0,0.0,0.0,0.0
/fighter/Alberth-Dias-159885,alberth dias,,20/01/1992,29.0,,"Aracaju, Sergipe",Brazil,"5'10""",145 lbs,Killer Bees Muay Thai College,Featherweight,5.0,1.0,1.0,3.0,,5.0,0.0,2.0,1.0,,,,,,,,,,,,,,,,,,
/fighter/Alberto-Cerra-Leon-37,alberto cerra leon,,,,,Lemoa,Spain,"5'8""",231 lbs,,Heavyweight,0.0,0.0,0.0,0.0,,0.0,0.0,1.0,0.0,,,,,,,,,,,,,,,,,,
/fighter/Alberto-Correia-231105,alberto correia,Alber Magayver,23/03/1997,24.0,,"Fortaleza, Ceara",Brazil,"5'2""",115 lbs,Nova Uniao,Strawweight,2.0,1.0,0.0,1.0,,2.0,1.0,1.0,1.0,,,,,,,,,,,,,,,,,,
/fighter/Alberto-Crane-4767,alberto crane,,14/07/1976,45.0,,"Santa Fe, New Mexico",United States,"5'9""",155 lbs,Alberto Crane MMA,Lightweight,15.0,0.0,14.0,1.0,,15.0,3.0,0.0,2.0,,,15.0,5.0,0.0,165.1,70.31,,Orthodox,1976-07-14,0.43,25.0,2.61,57.0,0.0,0.0,50.0,4.0
/fighter/Alberto-Emiliano-Pereira-77297,alberto emiliano pereira,Uda,08/08/1984,37.0,,"Blumenau, Santa Catarina",Brazil,"6'3""",185 lbs,Astra Fight Team,Middleweight,13.0,4.0,7.0,2.0,,13.0,2.0,2.0,0.0,,,,,,,,,,,,,,,,,,
/fighter/Alberto-Mina-16705,alberto mina,Soldier of God,02/05/1982,39.0,,"Campina Grande, Paraiba",Brazil,"6'0""",170 lbs,Kings MMA,Welterweight,13.0,6.0,6.0,1.0,,13.0,0.0,0.0,1.0,,Soldier of God,13.0,1.0,0.0,182.88,77.11,195.58,Orthodox,1982-05-02,3.23,38.0,3.7,47.0,1.85,20.0,50.0,0.0
,alberto montes,,,,,,,,,,,,,,,,,,,,,The Promise,4.0,0.0,0.0,170.18,61.23,,,,0.0,0.0,0.0,0.0,0.0,0.0,0.0,0.0
,alberto uda,,,,,,,,,,,,,,,,,,,,,,12.0,2.0,0.0,190.5,83.91,,Orthodox,1984-08-08,1.79,52.0,3.49,45.0,2.83,50.0,66.0,0.0
/fighter/Alec-Hooben-115633,alec hooben,,31/10/1992,28.0,,"Pompton Lakes, New Jersey",United States,"5'11""",205 lbs,AMA Fight Club,Light Heavyweight,5.0,1.0,3.0,1.0,,5.0,3.0,1.0,1.0,,,,,,,,,,,,,,,,,,
/fighter/Alejandra-Lara-172513,alejandra lara,Azul,04/08/1994,27.0,,"Medellin, Antioquia",Colombia,"5'7""",125 lbs,Combat Training Club,Flyweight,9.0,4.0,3.0,2.0,,9.0,0.0,1.0,3.0,,,,,,,,,,,,,,,,,,
,alejandro flores,,,,,,,,,,,,,,,,,,,,,El Gallito,17.0,3.0,0.0,177.8,65.77,185.42,Orthodox,1991-08-06,3.66,40.0,2.02,54.0,0.0,0.0,0.0,0.0
/fighter/Alejandro-Garcia-8416,alejandro garcia,Alex,20/10/1980,40.0,,"Yuma, Arizona",United States,"5'7""",135 lbs,Arizona Athletic Club,Bantamweight,14.0,4.0,5.0,5.0,,14.0,3.0,7.0,0.0,,Alex,14.0,10.0,0.0,170.18,65.77,,,,1.22,62.0,1.14,65.0,8.55,87.0,66.0,0.0
/fighter/Alejandro-Perez-13428,alejandro perez,Turbo,02/09/1989,31.0,,Estado de Mexico,Mexico,"5'6""",135 lbs,American Kickboxing Academy,Bantamweight,21.0,9.0,5.0,7.0,,21.0,2.0,3.0,3.0,,Turbo,23.0,9.0,1.0,167.64,61.23,170.18,Orthodox,1989-09-02,3.45,35.0,3.18,61.0,0.54,22.0,70.0,0.3
/fighter/Alejandro-Villalobos-22473,alejandro villalobos,Ano,26/10/1978,42.0,,"Santo Domingo, Heredia",Costa Rica,"5'7""",145 lbs,Mandarina MMA,Featherweight,17.0,9.0,7.0,1.0,,17.0,2.0,1.0,2.0,,,17.0,5.0,0.0,170.18,65.77,,,,3.93,46.0,4.07,67.0,1.0,50.0,0.0,0.0
,alekander volkov,,,,,,,,,,,,,,,,,,,,,,,,,,,,,,,,,,,,,
/fighter/Aleksa-Camur-228789,aleksa camur,,25/09/1995,25.0,,Ohio,United States,"6'0""",205 lbs,Strong Style Fight Team,Light Heavyweight,6.0,5.0,0.0,1.0,,6.0,0.0,0.0,2.0,,,6.0,3.0,0.0,185.42,92.99,187.96,Orthodox,1995-09-25,4.73,57.0,4.26,54.0,0.46,22.0,50.0,0.0
/fighter/Aleksandar-Rakic-86829,aleksandar rakic,Rocket,06/02/1992,29.0,,Vienna,Austria,"6'5""",205 lbs,Gym 23,Light Heavyweight,14.0,9.0,1.0,4.0,,14.0,0.0,1.0,1.0,,,14.0,3.0,0.0,193.04,92.99,198.12,Orthodox,1992-02-06,4.01,50.0,2.3,53.0,0.82,25.0,90.0,0.2
,aleksander emelianenko,,,,,,,,,,,,,,,,,,,,,,23.0,7.0,0.0,198.12,115.67,,Orthodox,1981-08-02,2.75,41.0,1.7,65.0,2.32,72.0,66.0,0.9
/fighter/Aleksandra-Albu-144949,aleksandra albu,Stitch,14/07/1990,31.0,,Moscow,Russia,"5'2""",115 lbs,Red Fury Fight Team,Strawweight,3.0,1.0,1.0,1.0,,3.0,0.0,1.0,1.0,,Stitch,3.0,2.0,0.0,157.48,52.16,160.02,Orthodox,1990-07-14,4.83,47.0,5.56,38.0,2.27,50.0,77.0,0.4
/fighter/Aleksandra-Toncheva-Plamenova-212411,aleksandra toncheva plamenova,,24/07/1991,30.0,,Varna,Bulgaria,"5'5""",115 lbs,Desant MMA,Strawweight,2.0,0.0,0.0,2.0,,2.0,1.0,0.0,1.0,,,,,,,,,,,,,,,,,,
/fighter/Aleksei-Butorin-43883,aleksei butorin,,08/07/1986,35.0,,St. Petersburg,Russia,"6'0""",205 lbs,Tiger Muay Thai,Light Heavyweight,16.0,15.0,1.0,0.0,,16.0,0.0,3.0,1.0,,,,,,,,,,,,,,,,,,
,aleksei kunchenko,,,,,,,,,,,,,,,,,,,,,,20.0,2.0,0.0,172.72,77.11,177.8,Orthodox,1984-05-02,3.67,44.0,2.83,63.0,0.25,33.0,80.0,0.0
,aleksei oleinik,,,,,,,,,,,,,,,,,,,,,The Boa Constrictor,60.0,17.0,1.0,187.96,108.86,203.2,Orthodox,1977-06-20,3.29,48.0,3.8,44.0,1.82,46.0,37.0,1.9
/fighter/Aleksi-Toivonen-166189,aleksi toivonen,The Giant,20/10/1991,29.0,,,Finland,"5'6""",125 lbs,Lahden Gentai,Flyweight,7.0,1.0,6.0,0.0,,7.0,1.0,0.0,0.0,,,,,,,,,,,,,,,,,,
/fighter/Alen-Amedovski-134209,alen amedovski,,06/04/1988,33.0,,Zentar Zupa,Macedonia,"5'10""",185 lbs,American Top Team Rome,Middleweight,8.0,8.0,0.0,0.0,,8.0,1.0,0.0,1.0,,,8.0,4.0,0.0,177.8,83.91,187.96,Orthodox,1988-04-06,0.99,30.0,3.85,46.0,0.0,0.0,0.0,0.0
/fighter/Alessandro-Botti-90335,alessandro botti,The Bad,31/07/1988,33.0,,"Missaglia, Lecco",Italy,"6'0""",155 lbs,Clan Mano di Pietra,Lightweight,15.0,9.0,5.0,1.0,,15.0,5.0,4.0,3.0,,,,,,,,,,,,,,,,,,
,alessandro costa,,,,,,,,,,,,,,,,,,,,,Nono,13.0,4.0,0.0,162.56,56.7,170.18,Orthodox,1996-01-28,3.75,46.0,3.61,56.0,0.31,16.0,90.0,0.0
/fighter/Alessandro-Ricci-74266,alessandro ricci,Alex,21/07/1982,39.0,,"Woodbridge, Ontario",Canada,"5'11""",155 lbs,M-1 Thai Boxing,Lightweight,10.0,5.0,0.0,5.0,,10.0,1.0,0.0,4.0,,,,,,,,,,,,,,,,,,
/fighter/Alessio-Di-Chirico-89875,alessio di chirico,Manzo,12/12/1989,31.0,,Rome,Italy,"6'0""",185 lbs,Gloria Fight Center,Middleweight,13.0,6.0,4.0,3.0,,13.0,0.0,1.0,4.0,,Manzo,13.0,7.0,0.0,182.88,83.91,187.96,Orthodox,1989-12-12,3.32,39.0,3.44,61.0,1.46,39.0,83.0,0.0
/fighter/Alessio-Sakara-5366,alessio sakara,Legionarius,02/09/1981,39.0,,"Rome, Lazio",Italy,"6'1""",205 lbs,American Top Team,Light Heavyweight,21.0,15.0,2.0,4.0,0.0,21.0,6.0,3.0,3.0,1.0,Legionarius,19.0,11.0,0.0,182.88,83.91,182.88,Orthodox,1981-09-02,3.96,47.0,2.8,59.0,2.18,78.0,62.0,0.0
/fighter/Alex-Andrade-258,alex andrade,El Toro,14/05/1974,47.0,,"Laredo, Texas",United States,"5'11""",200 lbs,Lion's Den,Light Heavyweight,10.0,5.0,2.0,3.0,0.0,10.0,1.0,0.0,2.0,2.0,El Toro,10.0,5.0,0.0,180.34,90.72,,Orthodox,1974-05-14,0.2,36.0,2.6,53.0,0.0,0.0,25.0,0.8
/fighter/Alex-Caceres-41586,alex caceres,Bruce Leeroy,20/06/1988,33.0,,"Miami, Florida",United States,"5'9""",145 lbs,MMA Lab,Featherweight,18.0,3.0,6.0,9.0,,18.0,1.0,7.0,4.0,,Bruce Leeroy,21.0,14.0,0.0,177.8,65.77,185.42,Southpaw,1988-06-20,4.16,50.0,2.93,63.0,0.56,68.0,64.0,0.7
/fighter/Alex-Chambers-65649,alex chambers,Astro Girl,28/10/1978,42.0,,"St. Ives, New South Wales",Australia,"5'3""",115 lbs,American Top Team,Strawweight,5.0,2.0,2.0,1.0,,5.0,0.0,4.0,1.0,,Astro Girl,5.0,5.0,0.0,160.02,52.16,160.02,Southpaw,1978-10-25,2.97,54.0,5.1,50.0,2.31,41.0,53.0,1.0
,alex crispin,,,,,,,,,,,,,,,,,,,,,,0.0,1.0,0.0,,70.31,,,,0.0,0.0,0.0,0.0,0.0,0.0,0.0,0.0
,alex da silva,,,,,,,,,,,,,,,,,,,,,Leko,21.0,4.0,0.0,172.72,70.31,185.42,Orthodox,1996-02-04,2.14,46.0,2.52,56.0,1.97,43.0,76.0,0.3
/fighter/Alex-da-Silva-Coelho-153799,alex da silva coelho,Leko,04/02/1996,25.0,,"Icara, Santa Catarina",Brazil,"5'10""",155 lbs,Astra Fight Team,Lightweight,21.0,13.0,7.0,1.0,,21.0,0.0,1.0,2.0,,,,,,,,,,,,,,,,,,
/fighter/Alex-Dunworth-41341,alex dunworth,,,,,"Bridgewater, Massachusetts",United States,"5'8""",155 lbs,,Lightweight,2.0,0.0,1.0,1.0,,2.0,2.0,0.0,0.0,,,2.0,2.0,0.0,172.72,70.31,,,,1.94,31.0,8.71,35.0,0.0,0.0,50.0,0.0
,alex enlund,,,,,,,,,,,,,,,,,,,,,,14.0,2.0,0.0,177.8,65.77,,Orthodox,1987-05-27,0.0,0.0,0.0,0.0,0.0,0.0,0.0,0.0
/fighter/Alex-Fong-170601,alex fong,Lil Rocky,15/10/1995,25.0,,Labuan,Malaysia,"5'4""",125 lbs,Borneo Tribal Squad,Flyweight,1.0,0.0,1.0,0.0,,1.0,0.0,0.0,0.0,,,,,,,,,,,,,,,,,,
/fighter/Alex-Garcia-54124,alex garcia,The Dominican Nightmare,14/07/1987,34.0,,"Montreal, Quebec",Canada,"5'9""",171 lbs,Tristar Gym,Welterweight,15.0,6.0,6.0,3.0,,15.0,4.0,0.0,4.0,,The Dominican Nightmare,15.0,6.0,0.0,175.26,77.11,182.88,Orthodox,1987-07-14,1.81,31.0,3.03,59.0,3.72,52.0,66.0,0.1
,alex gilpin,,,,,,,,,,,,,,,,,,,,,,11.0,1.0,0.0,170.18,65.77,,Orthodox,1992-03-26,6.8,54.0,12.29,42.0,2.17,25.0,0.0,2.2
/fighter/Alex-Gorgees-222785,alex gorgees,Hitman,11/08/1995,26.0,,"Sydney, New South Wales",Australia,"0'0""",154 lbs,Australian Top Team,Lightweight,7.0,3.0,2.0,1.0,1.0,7.0,0.0,0.0,1.0,0.0,Hitman,6.0,1.0,0.0,187.96,70.31,187.96,Switch,1995-08-11,0.67,32.0,2.27,38.0,0.0,0.0,54.0,0.0
/fighter/Alex-Higley-167767,alex higley,,,,,California,United States,"0'0""",145 lbs,Blackline MMA,Featherweight,3.0,3.0,0.0,0.0,,3.0,1.0,2.0,1.0,,,4.0,3.0,0.0,177.8,65.77,,,,0.29,100.0,1.74,60.0,0.0,0.0,0.0,0.0
/fighter/Alex-Huddleston-81096,alex huddleston,The Shaved Gorilla,11/08/1986,35.0,,"Denver, Colorado",United States,"6'7""",254 lbs,K2L Grindhouse,Heavyweight,6.0,2.0,2.0,2.0,,6.0,1.0,0.0,1.0,,The Shaved Gorilla,6.0,2.0,0.0,200.66,115.21,,,,2.47,42.0,2.59,67.0,0.0,0.0,0.0,0.9
/fighter/Alex-Hunter-170,alex hunter,,,,,"Tarpon Springs, Florida",United States,"5'9""",226 lbs,,Heavyweight,2.0,1.0,0.0,1.0,,2.0,0.0,0.0,0.0,,,2.0,0.0,0.0,175.26,102.51,,Orthodox,,0.0,0.0,0.0,0.0,0.0,0.0,0.0,0.0
/fighter/Alex-Karalexis-11941,alex karalexis,T-Rex,20/09/1977,43.0,,"Boston, Massachusetts",United States,"5'8""",170 lbs,Team Sityodtong,Welterweight,10.0,5.0,1.0,4.0,,10.0,3.0,2.0,1.0,,The Assassin,10.0,6.0,0.0,172.72,70.31,167.64,Orthodox,1977-09-20,2.57,42.0,2.39,54.0,2.7,45.0,86.0,0.9
/fighter/Alex-Lim-121343,alex lim,,,,,Malacca,Malaysia,"0'0""",159 lbs,TNT Kickboxing,Welterweight,1.0,0.0,0.0,1.0,,1.0,1.0,2.0,0.0,,,,,,,,,,,,,,,,,,
/fighter/Alex-Lohore-140477,alex lohore,Da Killa Kid,19/12/1989,31.0,,Bobigny,France,"6'1""",170 lbs,Allrounders MMA,Welterweight,20.0,9.0,7.0,4.0,,20.0,3.0,0.0,4.0,,,,,,,,,,,,,,,,,,
/fighter/Alex-Macedo-207633,alex macedo,,,,,Texas,United States,"0'0""",125 lbs,,Flyweight,0.0,0.0,0.0,0.0,,0.0,0.0,0.0,0.0,,,,,,,,,,,,,,,,,,
/fighter/Alex-Morono-64894,alex morono,The Great White,16/08/1990,30.0,,"Houston, Texas",United States,"5'11""",170 lbs,Fortis MMA,Welterweight,19.0,6.0,6.0,6.0,1.0,19.0,2.0,0.0,5.0,0.0,The Great White,23.0,9.0,0.0,180.34,77.11,182.88,Orthodox,1990-08-16,5.02,41.0,4.17,58.0,0.34,22.0,50.0,0.3
/fighter/Alex-Munoz-207057,alex munoz,,27/02/1990,31.0,,"Dallas, Texas",United States,"5'9""",155 lbs,Team Alpha Male,Lightweight,6.0,2.0,1.0,3.0,,6.0,0.0,0.0,2.0,,,,,,,,,,,,,,,,,,
/fighter/Alex-Nicholson-121077,alex nicholson,The Spartan,02/05/1990,31.0,,"Apopka, Florida",United States,"6'4""",205 lbs,American Top Team Orlando,Light Heavyweight,14.0,13.0,1.0,0.0,,14.0,4.0,1.0,4.0,,The Spartan,7.0,4.0,0.0,193.04,83.91,195.58,Orthodox,1990-05-02,4.12,43.0,4.65,47.0,0.0,0.0,50.0,0.5
/fighter/Alex-OToole-71697,alex o'toole,The Chi Master,,,,Southend-on-Sea,England,"6'2""",205 lbs,Team Sure Grip,Light Heavyweight,4.0,1.0,3.0,0.0,,4.0,2.0,2.0,0.0,,,,,,,,,,,,,,,,,,
/fighter/Alex-Oliveira-110143,alex oliveira,Cowboy,21/02/1988,33.0,,"Tres Rios, Rio de Janeiro",Brazil,"5'11""",170 lbs,ATS Team Tres Rios,Welterweight,22.0,12.0,5.0,5.0,,22.0,1.0,6.0,3.0,,Cowboy,22.0,12.0,1.0,180.34,77.11,193.04,Orthodox,1988-02-21,2.99,51.0,2.55,46.0,2.35,38.0,63.0,0.6
,alex pereira,,,,,,,,,,,,,,,,,,,,,Poatan,9.0,2.0,0.0,193.04,92.99,200.66,Orthodox,1987-07-07,5.0,62.0,3.65,50.0,0.19,100.0,70.0,0.4
/fighter/Alex-Perez-12443,alex perez,,21/03/1992,29.0,,"Lemoore, California",United States,"5'6""",125 lbs,Team Oyama,Flyweight,24.0,5.0,7.0,12.0,,24.0,1.0,4.0,1.0,,,24.0,7.0,0.0,167.64,56.7,165.1,Orthodox,1992-03-21,4.67,48.0,3.14,60.0,2.84,44.0,77.0,1.3
/fighter/Alex-Polizzi-251099,alex polizzi,Eazy,22/12/1991,29.0,,"Madison, Wisconsin",United States,"6'0""",205 lbs,Chosen Few Gym,Light Heavyweight,8.0,3.0,4.0,1.0,,8.0,0.0,0.0,1.0,,,,,,,,,,,,,,,,,,
/fighter/Alex-Potts-236361,alex potts,40 oz.,11/01/1994,27.0,,"Syracuse, New York",United States,"5'9""",135 lbs,Ultimate Athletics Syracuse,Bantamweight,2.0,1.0,1.0,0.0,,2.0,1.0,0.0,0.0,,,,,,,,,,,,,,,,,,
/fighter/Alex-Reid-5415,alex reid,The Reidernater,21/08/1975,45.0,,London,England,"6'0""",185 lbs,London Shootfighters,Middleweight,10.0,3.0,5.0,2.0,,10.0,3.0,1.0,6.0,,,,,,,,,,,,,,,,,,
/fighter/Alex-Reyes-24199,alex reyes,,02/10/1986,34.0,,"Hollywood, California",United States,"5'11""",155 lbs,Cage Combat Academy,Lightweight,13.0,9.0,4.0,0.0,,13.0,2.0,0.0,1.0,,The Executioner,13.0,4.0,0.0,180.34,70.31,185.42,Orthodox,1986-10-02,4.04,39.0,10.91,40.0,0.0,0.0,0.0,0.0
,alex ricci,,,,,,,,,,,,,,,,,,,,,,10.0,5.0,0.0,180.34,70.31,,Orthodox,1982-07-21,2.48,41.0,2.53,64.0,0.0,0.0,64.0,0.0
/fighter/Alex-Schild-169255,alex schild,,07/03/1989,32.0,,"Rockville, Maryland",United States,"5'6""",125 lbs,Tiger Muay Thai,Flyweight,5.0,1.0,3.0,1.0,,5.0,2.0,0.0,2.0,,,,,,,,,,,,,,,,,,
/fighter/Alex-Schoenauer-4000,alex schoenauer,,05/05/1976,45.0,,"Las Vegas, Nevada",United States,"6'3""",185 lbs,Xtreme Couture,Middleweight,15.0,4.0,7.0,2.0,2.0,15.0,1.0,5.0,4.0,0.0,,15.0,10.0,0.0,190.5,83.91,,Orthodox,1976-05-05,1.22,40.0,2.27,42.0,0.0,0.0,22.0,4.9
,alex serdyukov,,,,,,,,,,,,,,,,,,,,,The Russian Crusher,8.0,5.0,0.0,187.96,77.11,187.96,Orthodox,1980-05-24,4.94,48.0,3.1,46.0,1.84,55.0,67.0,1.8
/fighter/Alex-Silva-85140,alex silva,Little Rock,10/10/1982,38.0,,"Ubatuba, Sao Paulo",Brazil,"5'4""",135 lbs,Evolve MMA,Bantamweight,9.0,0.0,8.0,1.0,,9.0,0.0,0.0,6.0,,,,,,,,,,,,,,,,,,
/fighter/Alex-Soto-50367,alex soto,Extremo,15/02/1984,37.0,,"San Diego, California",United States,"5'7""",135 lbs,KHK MMA Team,Bantamweight,8.0,3.0,3.0,2.0,,8.0,1.0,0.0,2.0,,Extremo,8.0,3.0,1.0,172.72,61.23,,Southpaw,1984-02-15,2.95,25.0,5.02,59.0,2.82,30.0,0.0,0.0
/fighter/Alex-Stiebling-269,alex stiebling,The Brazilian Killa,26/12/1976,44.0,,"Indianapolis, Indiana",United States,"6'2""",195 lbs,Integrated Fighting Academy,Light Heavyweight,19.0,4.0,10.0,5.0,,19.0,6.0,0.0,5.0,,The Brazilian Killa,19.0,11.0,1.0,187.96,92.99,,Southpaw,,1.77,42.0,1.45,52.0,0.35,66.0,66.0,0.7
/fighter/Alex-Torres-172645,alex torres,Rolo,29/05/1988,33.0,,Bogota,Colombia,"5'10""",145 lbs,Octagon MMA Colombia,Featherweight,6.0,3.0,0.0,3.0,0.0,6.0,1.0,2.0,1.0,1.0,Rolo,5.0,4.0,0.0,177.8,65.77,,Orthodox,1988-05-29,2.47,37.0,2.73,69.0,2.0,22.0,50.0,0.0
/fighter/Alex-Trinidad-202755,alex trinidad,The Ice Cream Man,25/07/1990,31.0,,"La Mesa, California",United States,"5'9""",155 lbs,The Arena,Lightweight,5.0,2.0,0.0,3.0,,5.0,1.0,2.0,0.0,,,,,,,,,,,,,,,,,,
/fighter/Alex-White-55954,alex white,The Spartan,22/10/1988,32.0,,"Fredericktown, Missouri",United States,"6'0""",155 lbs,Team Destruction,Lightweight,13.0,5.0,5.0,3.0,,13.0,1.0,1.0,4.0,,The Spartan,13.0,6.0,0.0,182.88,70.31,180.34,Southpaw,1988-10-22,3.76,42.0,3.07,60.0,0.92,28.0,71.0,0.5
,alex zuniga,,,,,,,,,,,,,,,,,,,,,,6.0,3.0,0.0,,65.77,,,,0.0,0.0,0.0,0.0,0.0,0.0,0.0,0.0
/fighter/Alexa-Grasso-142845,alexa grasso,,09/08/1993,28.0,,"Guadalajara, Jalisco",Mexico,"5'5""",125 lbs,Lobo Gym MMA,Flyweight,13.0,4.0,0.0,9.0,,13.0,0.0,1.0,2.0,,,16.0,3.0,1.0,165.1,56.7,167.64,Orthodox,1993-08-09,4.67,43.0,3.95,58.0,0.41,45.0,59.0,0.6
,alexander crispim,,,,,,,,,,,,,,,,,,,,,,8.0,6.0,0.0,,65.77,,,,0.0,0.0,0.0,0.0,0.0,0.0,0.0,0.0
/fighter/Alexander-Gustafsson-26162,alexander gustafsson,The Mauler,15/01/1987,34.0,,"Stockholm, Stockholm County",Sweden,"6'4""",240 lbs,Allstars Training Center,Heavyweight,18.0,11.0,3.0,4.0,,18.0,2.0,3.0,2.0,,The Mauler,18.0,8.0,0.0,195.58,92.99,200.66,Orthodox,1987-01-15,4.03,40.0,3.53,51.0,1.53,39.0,83.0,0.4
/fighter/Alexander-Hernandez-97669,alexander hernandez,The Great,01/10/1992,28.0,,"San Antonio, Texas",United States,"5'9""",155 lbs,Factory X,Lightweight,12.0,5.0,2.0,5.0,,12.0,2.0,0.0,2.0,,The Great Ape,14.0,7.0,0.0,175.26,65.77,182.88,Orthodox,1992-10-01,4.63,41.0,4.9,56.0,1.2,31.0,60.0,0.1
/fighter/Alexander-Lopez-158021,alexander lopez,,17/07/1986,35.0,,"Salinas, California",United States,"6'0""",185 lbs,Kugtar MMA,Middleweight,3.0,2.0,1.0,0.0,,3.0,1.0,0.0,1.0,,,,,,,,,,,,,,,,,,
,alexander morgan,,,,,,,,,,,,,,,,,,,,,The Chess Master,11.0,5.0,0.0,177.8,65.77,180.34,Orthodox,1991-05-14,3.71,44.0,2.78,47.0,0.0,0.0,0.0,0.0
,alexander munoz,,,,,,,,,,,,,,,,,,,,,,7.0,2.0,0.0,175.26,70.31,182.88,Switch,1990-02-27,3.7,42.0,4.73,55.0,3.0,40.0,100.0,0.0
/fighter/Alexander-Nikulin-241101,alexander nikulin,,,,,Beersheba,Israel,"6'0""",185 lbs,MMA Hajime Academy,Middleweight,3.0,3.0,0.0,0.0,,3.0,0.0,0.0,0.0,,,,,,,,,,,,,,,,,,
,alexander otsuka,,,,,,,,,,,,,,,,,,,,,The Diet Butcher,5.0,13.0,0.0,185.42,92.99,,Orthodox,1971-07-17,0.9,55.0,1.16,51.0,1.51,43.0,53.0,0.8
,alexander poppeck,,,,,,,,,,,,,,,,,,,,,,9.0,3.0,0.0,187.96,92.99,,Orthodox,1992-04-06,4.01,57.0,9.81,33.0,0.0,0.0,0.0,0.0
/fighter/Alexander-Romanov-242931,alexander romanov,King Kong,11/12/1990,30.0,,Comrat City,Moldova,"6'2""",264 lbs,Lion Club,Heavyweight,14.0,5.0,8.0,1.0,,14.0,0.0,0.0,0.0,,,,,,,,,,,,,,,,,,
/fighter/Alexander-Sarnavskiy-41790,alexander sarnavskiy,Tiger,17/01/1989,32.0,,Omsk,Russia,"5'11""",155 lbs,Storm Shlemenko Fight Team,Lightweight,38.0,11.0,20.0,7.0,,38.0,1.0,2.0,5.0,,Tiger,35.0,6.0,0.0,180.34,70.31,,,,1.43,66.0,2.06,42.0,0.0,0.0,75.0,0.0
/fighter/Alexander-Shlemenko-14461,alexander shlemenko,Storm,20/05/1984,37.0,,Omsk,Russia,"5'11""",185 lbs,Storm Shlemenko Fight Team,Middleweight,60.0,32.0,11.0,17.0,,60.0,2.0,4.0,7.0,,Storm,56.0,9.0,0.0,180.34,83.91,,,,4.36,60.0,1.71,63.0,0.0,0.0,0.0,0.0
,alexander soldatkin,,,,,,,,,,,,,,,,,,,,,,14.0,4.0,0.0,187.96,113.4,190.5,Orthodox,1993-06-10,1.16,60.0,1.35,26.0,1.45,50.0,50.0,0.0
,alexander trevino,,,,,,,,,,,,,,,,,,,,,,7.0,7.0,0.0,,77.11,,,,0.0,0.0,0.0,0.0,0.0,0.0,0.0,0.0
/fighter/Alexander-Volkanovski-101527,alexander volkanovski,The Great,29/09/1988,32.0,,"Windang, New South Wales",Australia,"5'6""",145 lbs,Freestyle Fighting Gym,Featherweight,22.0,11.0,3.0,8.0,,22.0,1.0,0.0,0.0,,The Great,26.0,3.0,0.0,167.64,65.77,180.34,Orthodox,1988-09-29,6.19,57.0,3.42,58.0,1.84,37.0,70.0,0.2
/fighter/Alexander-Volkov-40951,alexander volkov,Drago,24/10/1988,32.0,,Moscow,Russia,"6'7""",265 lbs,Strela Team,Heavyweight,33.0,22.0,3.0,8.0,,33.0,2.0,2.0,5.0,,Drago,37.0,10.0,0.0,200.66,113.4,203.2,Orthodox,1988-10-24,5.1,57.0,3.0,54.0,0.49,63.0,73.0,0.2
/fighter/Alexander-Yakovlev-10846,alexander yakovlev,Russian Thunder,18/07/1984,37.0,,St. Petersburg,Russia,"6'1""",170 lbs,K Dojo Warrior Tribe,Welterweight,25.0,9.0,9.0,7.0,,25.0,1.0,5.0,5.0,,Russian Thunder,24.0,10.0,1.0,190.5,70.31,187.96,Southpaw,1984-07-18,1.74,47.0,2.41,58.0,1.66,35.0,72.0,0.1
,alexandr romanov,,,,,,,,,,,,,,,,,,,,,King Kong,17.0,2.0,0.0,187.96,118.84,190.5,Southpaw,1990-12-11,4.06,52.0,2.2,50.0,4.32,54.0,20.0,0.9
/fighter/Alexandr-Shabliy-72353,alexandr shabliy,Peresvet,18/04/1993,28.0,,"Rostov-on-Don, Rostov Oblast",Russia,"5'9""",155 lbs,Peresvet FT,Lightweight,20.0,10.0,7.0,3.0,,20.0,0.0,1.0,2.0,,,,,,,,,,,,,,,,,,
,alexandra albu,,,,,,,,,,,,,,,,,,,,,,,,,,,,,,,,,,,,,
/fighter/Alexandra-Ballou-273067,alexandra ballou,The Great,21/01/1992,29.0,,"Bristol, Connecticut",United States,"5'7""",128 lbs,Ascension Athletics,Bantamweight,2.0,2.0,0.0,0.0,,2.0,0.0,1.0,0.0,,,,,,,,,,,,,,,,,,
/fighter/Alexandre-Barros-1424,alexandre barros,Baixinho,,,,"Rio de Janeiro, Rio de Janeiro",Brazil,"5'8""",170 lbs,Carlson Gracie Team,Welterweight,25.0,11.0,2.0,12.0,,25.0,4.0,0.0,8.0,,Baixinho,22.0,11.0,0.0,175.26,77.11,,Southpaw,1976-11-19,0.98,40.0,4.05,36.0,1.84,50.0,100.0,0.0
/fighter/Alexandre-Bezerra-37276,alexandre bezerra,Popo,25/09/1987,33.0,,"Campina Grande, Paraiba",Brazil,"5'8""",145 lbs,Alliance MMA,Featherweight,22.0,7.0,12.0,3.0,,22.0,1.0,1.0,5.0,,,,,,,,,,,,,,,,,,
/fighter/Alexandre-Dantas-264,alexandre dantas,Cafe,03/01/1979,42.0,,Rio de Janeiro,Brazil,"6'2""",176 lbs,Black Team,Middleweight,0.0,0.0,0.0,0.0,,0.0,3.0,0.0,0.0,,Cafe,0.0,3.0,0.0,187.96,107.95,,Orthodox,1979-03-01,0.21,25.0,1.87,60.0,0.0,0.0,0.0,3.1
/fighter/Alexandre-Ferreira-1398,alexandre ferreira,Cacareco,25/04/1979,42.0,,Rio de Janeiro,Brazil,"5'7""",204 lbs,Chute Boxe,Light Heavyweight,18.0,3.0,14.0,1.0,0.0,18.0,2.0,2.0,1.0,1.0,Cacareco,18.0,6.0,0.0,170.18,92.99,,Orthodox,1979-04-25,2.57,60.0,8.14,42.0,0.0,0.0,0.0,0.0
,alexandre franca nogueira,,,,,,,,,,,,,,,,,,,,,Pequeno,18.0,6.0,3.0,170.18,65.77,,Orthodox,1978-01-15,0.6,20.0,4.18,57.0,0.0,0.0,0.0,0.0
/fighter/Alexandre-Machado-46437,alexandre machado,Bebezao,,,,Rio de Janeiro,Brazil,"0'0""",220 lbs,Machado Team,Heavyweight,9.0,4.0,4.0,1.0,,9.0,3.0,0.0,1.0,,,,,,,,,,,,,,,,,,
/fighter/Alexandre-Pantoja-25023,alexandre pantoja,The Cannibal,16/04/1990,31.0,,"Arraial do Cabo, Rio de Janeiro",Brazil,"5'5""",125 lbs,Nova Uniao,Flyweight,23.0,8.0,8.0,7.0,,23.0,0.0,0.0,5.0,,The Cannibal,26.0,5.0,0.0,165.1,56.7,170.18,Orthodox,1990-04-16,4.41,48.0,3.81,51.0,1.75,44.0,66.0,1.0
,alexandru lungu,,,,,,,,,,,,,,,,,,,,,,14.0,4.0,0.0,182.88,174.63,,Orthodox,1974-09-03,3.61,66.0,7.22,40.0,0.0,0.0,0.0,0.0
/fighter/Alexei-Kudin-8065,alexei kudin,,20/12/1984,36.0,,Minsk,Belarus,"6'1""",237 lbs,Academy MMA Minsk,Heavyweight,26.0,20.0,1.0,5.0,0.0,26.0,2.0,3.0,6.0,1.0,,,,,,,,,,,,,,,,,
/fighter/Alexey-Kunchenko-140641,alexey kunchenko,,02/05/1984,37.0,,Tyumen,Russia,"5'8""",170 lbs,New Stream,Welterweight,20.0,13.0,1.0,6.0,,20.0,0.0,0.0,3.0,,,,,,,,,,,,,,,,,,
/fighter/Alexey-Oleynik-2027,alexey oleynik,The Boa Constrictor,25/06/1977,44.0,,Moscow,Russia,"6'2""",228 lbs,Oleynik Team,Heavyweight,59.0,8.0,46.0,5.0,,59.0,9.0,2.0,5.0,,,,,,,,,,,,,,,,,,
/fighter/Alexey-Trofimov-210733,alexey trofimov,,,,,,Russia,"0'0""",155 lbs,,Lightweight,2.0,1.0,0.0,1.0,,2.0,1.0,0.0,0.0,,,,,,,,,,,,,,,,,,
/fighter/Alexis-Davis-22071,alexis davis,Ally-Gator,04/10/1984,36.0,,"Port Colborne, Ontario",Canada,"5'6""",135 lbs,Combat Sports Academy,Bantamweight,20.0,2.0,8.0,10.0,,20.0,3.0,1.0,7.0,,,21.0,11.0,0.0,167.64,61.23,172.72,Orthodox,1984-10-04,4.63,49.0,4.45,54.0,0.95,44.0,34.0,0.7
/fighter/Alexis-Dufresne-113687,alexis dufresne,Sneaky Zebra,31/08/1990,30.0,,"Temecula, California",United States,"5'9""",150 lbs,Team Quest,Lightweight,6.0,3.0,3.0,0.0,,6.0,1.0,0.0,2.0,,Sneaky Zebra,6.0,3.0,0.0,175.26,61.23,,Orthodox,1990-08-31,1.33,27.0,3.33,60.0,1.5,50.0,50.0,0.0
/fighter/Alexis-Vila-39670,alexis vila,The Exorcist,12/03/1971,50.0,,"Miami, Florida",United States,"5'4""",125 lbs,American Top Team,Flyweight,15.0,7.0,3.0,5.0,,15.0,1.0,1.0,5.0,,,,,,,,,,,,,,,,,,
/fighter/Alfie-Davis-141739,alfie davis,The Axe Man,25/02/1992,29.0,,London,England,"5'11""",155 lbs,London Shootfighters,Lightweight,14.0,5.0,3.0,6.0,,14.0,0.0,0.0,4.0,,,,,,,,,,,,,,,,,,
/fighter/Alfonso-Alcarez-229,alfonso alcarez,Alfie,10/06/1970,51.0,,"Las Vegas, Nevada",United States,"5'3""",135 lbs,Nickwan Kick Gym,Bantamweight,1.0,1.0,0.0,0.0,,1.0,0.0,3.0,0.0,,,1.0,3.0,1.0,160.02,65.77,,,,0.0,0.0,0.0,0.0,0.0,0.0,0.0,0.0
/fighter/Alfred-Khashakyan-133919,alfred khashakyan,The Fearless,17/07/1988,33.0,,"Glendale, California",United States,"5'8""",135 lbs,Glendale Fighting Club,Bantamweight,11.0,11.0,0.0,0.0,,11.0,1.0,2.0,2.0,,The Fearless,8.0,3.0,0.0,172.72,61.23,177.8,Orthodox,1988-07-17,6.14,42.0,6.38,40.0,3.54,25.0,0.0,0.0
/fighter/Ali-AlQaisi-196307,ali alqaisi,The Royal Fighter,23/08/1990,30.0,,Amman,Jordan,"5'8""",135 lbs,Gladiator MMA,Bantamweight,10.0,2.0,4.0,4.0,,10.0,0.0,1.0,4.0,,The Royal Fighter,8.0,5.0,0.0,167.64,61.23,172.72,Orthodox,1990-09-23,2.43,42.0,1.97,56.0,3.5,29.0,60.0,1.0
/fighter/Ali-Bagautinov-81198,ali bagautinov,The King Puncher,12/06/1985,36.0,,Dagestan,Russia,"5'4""",125 lbs,Krepost,Flyweight,21.0,5.0,5.0,11.0,,21.0,1.0,0.0,6.0,,Puncher,15.0,6.0,0.0,162.56,56.7,165.1,Orthodox,1985-06-10,2.85,42.0,3.09,52.0,2.51,36.0,65.0,0.3
/fighter/Ali-Mokdad-34224,ali mokdad,The Monster,11/02/1983,38.0,,"Windsor, Ontario",Canada,"6'1""",184 lbs,Maximum Training Centre,Middleweight,6.0,1.0,4.0,1.0,,6.0,0.0,0.0,4.0,,,,,,,,,,,,,,,,,,
/fighter/Ali-Motamed-183423,ali motamed,,30/01/1991,30.0,,,Iran,"5'6""",135 lbs,Tiger Muay Thai,Bantamweight,7.0,2.0,2.0,3.0,,7.0,3.0,0.0,2.0,,,,,,,,,,,,,,,,,,
,ali qaisi,,,,,,,,,,,,,,,,,,,,,,,,,,,,,,,,,,,,,
/fighter/Ali-Yaakub-174311,ali yaakub,Captain Malaysia,01/07/1984,37.0,,"Bandar Tun Hussein Onn, Selangor",Malaysia,"5'4""",125 lbs,Harry Gym Warrior,Flyweight,0.0,0.0,0.0,0.0,,0.0,0.0,2.0,0.0,,,,,,,,,,,,,,,,,,
/fighter/Ali-Zebian-146161,ali zebian,Anabolic Arab,15/02/1994,27.0,,"Springfield, Massachusetts",United States,"5'5""",155 lbs,Fighting Arts Academy,Lightweight,5.0,3.0,0.0,2.0,,5.0,0.0,0.0,2.0,,,,,,,,,,,,,,,,,,
,aliaskhab khizriev,,,,,,,,,,,,,,,,,,,,,Black Wolf,14.0,0.0,0.0,175.26,83.91,187.96,Southpaw,1990-08-24,6.03,64.0,4.36,62.0,5.77,60.0,100.0,3.9
,alice ardelean,,,,,,,,,,,,,,,,,,,,,,,,,,,,,,,,,,,,,
/fighter/Alice-Yauger-151193,alice yauger,The Soccer Mom,05/10/1978,42.0,,"Arlington, Texas",United States,"5'4""",125 lbs,,Flyweight,4.0,1.0,0.0,3.0,,4.0,2.0,0.0,4.0,,,,,,,,,,,,,,,,,,
,aliev makhmud,,,,,,,,,,,,,,,,,,,,,,0.0,1.0,0.0,167.64,88.45,,Southpaw,1970-02-13,1.12,30.0,2.24,36.0,2.1,50.0,0.0,0.0
/fighter/Alistair-Overeem-461,alistair overeem,The Demolition Man,17/05/1980,41.0,,Amsterdam,Netherlands,"6'4""",256 lbs,Elevation Fight Team,Heavyweight,47.0,25.0,17.0,5.0,,47.0,15.0,1.0,3.0,,The Demolition Man,47.0,19.0,0.0,193.04,120.2,203.2,Orthodox,1980-05-17,3.67,64.0,2.44,57.0,1.42,55.0,73.0,0.8
/fighter/Aljamain-Sterling-66313,aljamain sterling,Funk Master,31/07/1989,32.0,,"Cortland, New York",United States,"5'7""",135 lbs,Serra-Longo Fight Team,Bantamweight,20.0,2.0,8.0,9.0,1.0,20.0,1.0,0.0,2.0,0.0,Funk Master,23.0,4.0,0.0,170.18,61.23,180.34,Orthodox,1989-07-31,4.73,52.0,2.41,58.0,1.97,24.0,45.0,0.8
/fighter/Alka-Matewa-75428,alka matewa,The Spartan,,,,Brussels,Belgium,"6'0""",157 lbs,Xtreme Couture Toronto,Welterweight,3.0,3.0,0.0,0.0,,3.0,1.0,1.0,0.0,,,,,,,,,,,,,,,,,,
/fighter/Allan-Albindo-332661,allan albindo,,,,,,Philippines,"5'6""",125 lbs,Yaw-Yan Ardigma Cebu,Flyweight,1.0,1.0,0.0,0.0,,1.0,0.0,0.0,2.0,,,,,,,,,,,,,,,,,,
,allan begosso,,,,,,,,,,,,,,,,,,,,,Mini,7.0,2.0,1.0,165.1,61.23,167.64,Orthodox,1995-11-23,1.8,40.0,7.73,34.0,0.0,0.0,25.0,2.0
/fighter/Allan-Goes-196,allan goes,,20/04/1971,50.0,,"Mission Viejo, California",United States,"6'0""",205 lbs,Goes Martial Arts,Light Heavyweight,10.0,3.0,6.0,1.0,,10.0,4.0,0.0,1.0,,,10.0,5.0,2.0,182.88,92.99,,Orthodox,1971-04-20,0.64,52.0,1.35,41.0,1.75,40.0,0.0,2.6
,allan nascimento,,,,,,,,,,,,,,,,,,,,,Puro Osso,20.0,6.0,0.0,172.72,56.7,175.26,Orthodox,1991-09-11,3.21,61.0,2.28,50.0,1.55,26.0,16.0,0.9
/fighter/Allan-Weickert-11710,allan weickert,,25/09/1981,39.0,,"Tiffin, Ohio",United States,"6'1""",185 lbs,Peak Submission Fight Team,Middleweight,6.0,3.0,2.0,1.0,,6.0,3.0,4.0,2.0,,,,,,,,,,,,,,,,,,
/fighter/Allan-Zuniga-57253,allan zuniga,Tigre,04/04/1992,29.0,,San Miguel,Costa Rica,"5'7""",155 lbs,Tigre MMA,Lightweight,13.0,3.0,4.0,6.0,,13.0,1.0,0.0,1.0,,Tigre,13.0,1.0,0.0,170.18,70.31,177.8,Orthodox,1992-04-04,3.93,52.0,1.8,61.0,0.0,0.0,57.0,1.0
/fighter/Allen-Berube-16459,allen berube,Monstah,25/08/1974,46.0,,"Biddeford, Maine",United States,"5'8""",155 lbs,Gracie Tampa,Lightweight,4.0,0.0,2.0,2.0,,4.0,2.0,1.0,0.0,,Monstah Lobstah,4.0,3.0,0.0,172.72,70.31,,Orthodox,1974-08-25,0.92,80.0,0.92,33.0,6.87,100.0,0.0,3.4
/fighter/Allen-Bose-99099,allen bose,,09/08/1986,35.0,,"Jacksonville, North Carolina",United States,"6'0""",202 lbs,USMC Fight Team,Light Heavyweight,3.0,2.0,1.0,0.0,,3.0,1.0,1.0,0.0,,,,,,,,,,,,,,,,,,
/fighter/Allen-Chong-157773,allen chong,Solomon,30/05/1982,39.0,,"Kota Kinabalu, Sabah",Malaysia,"5'6""",155 lbs,Borneo Tribal Squad,Lightweight,3.0,1.0,1.0,1.0,,3.0,4.0,1.0,0.0,,,,,,,,,,,,,,,,,,
/fighter/Allen-Crowder-157353,allen crowder,Pretty Boy,08/11/1989,31.0,,"Mebane, North Carolina",United States,"6'3""",237 lbs,Team Rubao Carioca BJJ,Heavyweight,10.0,5.0,3.0,1.0,1.0,10.0,4.0,0.0,0.0,0.0,Pretty Boy,10.0,4.0,0.0,190.5,111.13,193.04,Orthodox,1989-11-08,2.95,51.0,2.95,56.0,1.85,33.0,100.0,1.2
/fighter/Almiro-Barros-141663,almiro barros,,14/02/1985,36.0,,"Ubatuba, Sao Paulo",Brazil,"5'4""",125 lbs,Evolve MMA,Flyweight,1.0,0.0,0.0,1.0,,1.0,0.0,0.0,1.0,,,,,,,,,,,,,,,,,,
/fighter/Almog-Shay-237129,almog shay,,,,,,Israel,"0'0""",135 lbs,,Bantamweight,2.0,0.0,2.0,0.0,,2.0,0.0,0.0,3.0,,,,,,,,,,,,,,,,,,
/fighter/Alonzo-Martinez-3553,alonzo martinez,Zo Diddy,22/04/1984,37.0,,"Papillion, Nebraska",United States,"5'10""",155 lbs,Premier Combat Center,Lightweight,46.0,15.0,20.0,11.0,0.0,46.0,6.0,14.0,2.0,1.0,Zo Diddy,42.0,20.0,1.0,177.8,70.31,,,,3.07,27.0,7.33,52.0,0.0,0.0,0.0,0.0
/fighter/Alonzo-Menifield-210501,alonzo menifield,Atomic,18/10/1987,33.0,,"Dallas, Texas",United States,"6'0""",205 lbs,Saekson Muay Thai,Light Heavyweight,11.0,8.0,2.0,1.0,,11.0,1.0,0.0,1.0,,Atomic,14.0,3.0,1.0,182.88,92.99,193.04,Orthodox,1987-10-18,3.82,57.0,3.09,52.0,0.62,30.0,75.0,0.3
/fighter/Alptekin-Ozkilic-73826,alptekin ozkilic,The Turkish Delight,27/03/1986,35.0,,"Long Island, New York",United States,"5'5""",125 lbs,Bellmore Kickboxing Academy,Flyweight,9.0,2.0,1.0,6.0,,9.0,2.0,0.0,3.0,,The Turkish Delight,9.0,5.0,0.0,165.1,56.7,165.1,Orthodox,1986-03-27,3.81,32.0,5.72,59.0,4.21,58.0,75.0,0.0
,alton cunningham,,,,,,,,,,,,,,,,,,,,,The Bo-Man,4.0,2.0,0.0,187.96,92.99,195.58,Orthodox,1993-06-24,3.33,75.0,4.94,20.0,1.67,10.0,100.0,0.0
/fighter/Alvaro-Herrera-44627,alvaro herrera,Chango,14/05/1990,31.0,,"Guadalajara, Jalisco",Mexico,"6'0""",155 lbs,UAG MMA,Lightweight,9.0,5.0,3.0,0.0,1.0,9.0,4.0,3.0,0.0,0.0,,,,,,,,,,,,,,,,,
,alvaro herrera mendoza,,,,,,,,,,,,,,,,,,,,,Chango,9.0,6.0,0.0,182.88,70.31,187.96,Orthodox,1990-05-14,1.89,38.0,3.4,55.0,0.0,0.0,33.0,1.1
/fighter/Alvin-Cacdac-17297,alvin cacdac,,,,,"San Jose, California",United States,"5'6""",125 lbs,Nor-Cal Fighting Alliance,Flyweight,17.0,8.0,7.0,2.0,,17.0,2.0,9.0,2.0,,,18.0,13.0,0.0,167.64,56.7,,Orthodox,,1.21,66.0,0.61,0.0,0.0,0.0,0.0,0.0
/fighter/Alvin-Robinson-12212,alvin robinson,Kid,16/07/1982,39.0,,"Denver, Colorado",United States,"5'9""",145 lbs,Grudge Training Center,Featherweight,15.0,0.0,14.0,1.0,,15.0,5.0,4.0,0.0,,,15.0,9.0,0.0,175.26,70.31,172.72,Southpaw,1982-07-16,1.57,50.0,1.29,51.0,1.24,50.0,25.0,1.2
/fighter/Alyona-Rassohyna-80309,alyona rassohyna,,11/06/1990,31.0,,"Dnipro, Dnipropetrovsk",Ukraine,"5'2""",105 lbs,Yarost,Atomweight,13.0,0.0,11.0,2.0,,13.0,0.0,2.0,2.0,,,,,,,,,,,,,,,,,,
/fighter/Amador-Ramirez-60933,amador ramirez,,14/06/1990,31.0,,"Weslaco, Texas",United States,"5'7""",135 lbs,,Bantamweight,5.0,1.0,2.0,2.0,,5.0,0.0,4.0,0.0,,,5.0,4.0,0.0,,61.23,,,,4.93,51.0,2.07,69.0,1.0,33.0,0.0,0.0
/fighter/Amaechi-Oselukwue-45752,amaechi oselukwue,The Infamous A.O.,24/04/1985,36.0,,"Memphis, Tennessee",United States,"5'11""",184 lbs,Clinch Works,Middleweight,6.0,1.0,2.0,3.0,,6.0,4.0,1.0,7.0,,,,,,,,,,,,,,,,,,
/fighter/Amanda-Bell-46520,amanda bell,The Lady Killer,03/08/1988,33.0,,"Medford, Oregon",United States,"5'8""",146 lbs,Warrior Camp,Featherweight,7.0,5.0,1.0,1.0,,7.0,2.0,3.0,3.0,,,,,,,,,,,,,,,,,,
/fighter/Amanda-Bobby-Brundage-138223,amanda bobby brundage,ABC,22/10/1991,29.0,,"Bath, Michigan",United States,"5'3""",125 lbs,Scorpion Fighting System,Flyweight,4.0,2.0,1.0,1.0,,4.0,0.0,4.0,1.0,,,,,,,,,,,,,,,,,,
,amanda cooper,,,,,,,,,,,,,,,,,,,,,ABC,3.0,5.0,0.0,160.02,52.16,162.56,Switch,1991-10-22,3.55,44.0,3.2,51.0,1.53,38.0,28.0,1.8
/fighter/Amanda-Lemos-173973,amanda lemos,Amandinha,22/05/1987,34.0,,"Belem, Para",Brazil,"5'4""",115 lbs,Marajo Brothers Team,Strawweight,10.0,7.0,2.0,1.0,,10.0,1.0,0.0,0.0,,,13.0,3.0,1.0,162.56,52.16,165.1,Southpaw,1987-05-22,3.54,55.0,4.66,42.0,0.82,55.0,55.0,0.8
/fighter/Amanda-Nunes-31496,amanda nunes,Lioness,30/05/1988,33.0,,"Salvador, Bahia",Brazil,"5'8""",145 lbs,American Top Team,Featherweight,21.0,13.0,4.0,4.0,,21.0,2.0,1.0,1.0,,The Lioness,23.0,5.0,0.0,172.72,61.23,175.26,Orthodox,1988-05-30,4.55,51.0,2.62,57.0,2.73,54.0,82.0,0.7
/fighter/Amanda-Ribas-171625,amanda ribas,,26/08/1993,27.0,,"Varginha, Minas Gerais",Brazil,"5'4""",115 lbs,Marcelo Ribas Team,Strawweight,10.0,3.0,4.0,3.0,,10.0,2.0,0.0,0.0,,,12.0,4.0,0.0,160.02,52.16,167.64,Orthodox,1993-08-26,4.92,42.0,3.33,63.0,1.99,51.0,87.0,0.8
/fighter/Amar-Suloev-1995,amar suloev,,01/07/1976,,27/06/2016,Kalinin City,Armenia,"5'9""",185 lbs,Red Devil Sport Club,Middleweight,24.0,13.0,7.0,3.0,1.0,24.0,2.0,3.0,2.0,0.0,,24.0,7.0,0.0,175.26,83.01,,Orthodox,1976-07-01,1.98,37.0,2.19,70.0,0.27,100.0,88.0,0.3
/fighter/Amaury-Bitetti-135,amaury bitetti,,,,,Rio De Janeiro,Brazil,"5'9""",185 lbs,,Middleweight,5.0,2.0,1.0,1.0,1.0,5.0,2.0,0.0,0.0,0.0,,5.0,2.0,0.0,175.26,83.91,,Orthodox,,0.0,0.0,0.0,0.0,0.0,0.0,0.0,0.0
/fighter/Amber-Leibrock-166447,amber leibrock,,08/02/1988,33.0,,"Hayward, California",United States,"5'11""",146 lbs,Combat Sports Academy,Featherweight,4.0,3.0,0.0,1.0,,4.0,3.0,1.0,0.0,,,,,,,,,,,,,,,,,,
/fighter/Amber-Tackett-38966,amber tackett,,06/02/1987,34.0,,"Visalia, California",United States,"5'4""",125 lbs,Elite Team Visalia,Flyweight,1.0,0.0,0.0,1.0,,1.0,1.0,2.0,0.0,,,1.0,3.0,0.0,,52.16,,,,0.0,0.0,0.0,0.0,0.0,0.0,0.0,0.0
/fighter/Amedeo-Viola-25399,amedeo viola,,,,,"San Bernardino, California",United States,"6'0""",224 lbs,,Heavyweight,0.0,0.0,0.0,0.0,,0.0,1.0,1.0,0.0,,,,,,,,,,,,,,,,,,
/fighter/Ameer-Basheer-338085,ameer basheer,,,,,,Israel,"0'0""",205 lbs,,Light Heavyweight,0.0,0.0,0.0,0.0,,0.0,0.0,2.0,0.0,,,,,,,,,,,,,,,,,,
/fighter/Amilcar-Alves-23841,amilcar alves,,13/12/1979,41.0,,"Rio de Janeiro, Rio de Janeiro",Brazil,"5'11""",185 lbs,Nova Uniao,Middleweight,17.0,5.0,5.0,7.0,,17.0,9.0,4.0,8.0,,,15.0,12.0,0.0,182.88,77.11,,Southpaw,1988-08-08,0.5,46.0,2.02,30.0,0.0,0.0,53.0,0.0
/fighter/Amir-Albazi-51365,amir albazi,The Prince,27/10/1993,27.0,,,Sweden,"5'5""",125 lbs,London Shootfighters,Flyweight,14.0,4.0,8.0,2.0,,14.0,0.0,0.0,1.0,,The Prince,17.0,1.0,0.0,165.1,56.7,172.72,Orthodox,1993-10-27,2.8,39.0,3.07,63.0,1.71,33.0,40.0,0.7
/fighter/Amir-Aliakbari-199121,amir aliakbari,,11/12/1987,33.0,,"Shahriar, Tehran",Iran,"6'3""",250 lbs,AKA Thailand,Heavyweight,10.0,7.0,0.0,3.0,,10.0,2.0,0.0,0.0,,,10.0,1.0,0.0,190.5,113.4,,,,0.0,0.0,0.0,0.0,0.0,0.0,0.0,0.0
/fighter/Amir-Dadovic-89839,amir dadovic,,,,,"Atlanta, Georgia",United States,"6'1""",185 lbs,American Top Team Gwinnett,Middleweight,4.0,3.0,1.0,0.0,,4.0,0.0,2.0,3.0,,,,,,,,,,,,,,,,,,
/fighter/Amir-Khan-124985,amir khan,,05/11/1994,26.0,,,Singapore,"5'11""",155 lbs,Evolve MMA,Lightweight,13.0,9.0,2.0,2.0,,13.0,1.0,3.0,4.0,,,,,,,,,,,,,,,,,,
/fighter/Amir-Khillah-19803,amir khillah,,15/08/1979,41.0,,"Kalamazoo, Michigan",United States,"5'9""",155 lbs,Elite Performance,Lightweight,11.0,3.0,6.0,2.0,,11.0,0.0,2.0,3.0,,,,,,,,,,,,,,,,,,
,amir rahnavardi,,,,,,,,,,,,,,,,,,,,,,11.0,10.0,0.0,182.88,92.99,,Orthodox,1974-12-07,0.67,25.0,0.0,100.0,0.0,0.0,50.0,0.0
/fighter/Amir-Sadollah-34071,amir sadollah,,27/08/1980,40.0,,"Richmond, Virginia",United States,"5'11""",170 lbs,Syndicate MMA,Welterweight,6.0,0.0,2.0,4.0,,6.0,1.0,0.0,4.0,,,6.0,5.0,0.0,177.8,77.11,190.5,Orthodox,1980-08-27,4.71,46.0,3.55,60.0,0.57,27.0,60.0,0.3
/fighter/Amira-Badr-215441,amira badr,,05/01/1987,34.0,,,Egypt,"5'2""",108 lbs,Egyptian Top Team,Strawweight,1.0,0.0,1.0,0.0,,1.0,1.0,1.0,0.0,,,,,,,,,,,,,,,,,,
/fighter/Amira-Hafizovic-220881,amira hafizovic,,,,,"Sydney, New South Wales",Australia,"5'6""",115 lbs,Australian Top Team,Strawweight,2.0,0.0,1.0,1.0,,2.0,0.0,1.0,1.0,,,,,,,,,,,,,,,,,,
,amiran gogoladze,,,,,,,,,,,,,,,,,,,,,,14.0,3.0,0.0,185.42,77.11,187.96,Switch,1997-12-09,1.64,66.0,0.82,0.0,0.0,0.0,0.0,0.0
/fighter/Amitesh-Chaubey-114281,amitesh chaubey,Ami,,,,"Lucknow, Uttar Pradesh",India,"5'10""",170 lbs,,Welterweight,5.0,3.0,1.0,1.0,,5.0,1.0,3.0,1.0,,,,,,,,,,,,,,,,,,
/fighter/Amran-Aliyev-113801,amran aliyev,,17/10/1990,30.0,,"Syracuse, New York",United States,"5'9""",146 lbs,Team Bombsquad,Featherweight,3.0,2.0,1.0,0.0,,3.0,0.0,1.0,3.0,,,,,,,,,,,,,,,,,,
,an ying wang,,,,,,,,,,,,,,,,,,,,,,,,,,,,,,,,,,,,,
/fighter/Ana-Julaton-164679,ana julaton,The Hurricane,05/07/1980,41.0,,"San Francisco, California",United States,"5'5""",125 lbs,Team Julaton,Flyweight,2.0,1.0,0.0,1.0,,2.0,0.0,0.0,4.0,,,,,,,,,,,,,,,,,,
/fighter/Anastasia-Yankova-145249,anastasia yankova,,01/03/1991,30.0,,Moscow,Russia,"5'5""",125 lbs,AKA Thailand,Flyweight,5.0,0.0,3.0,2.0,,5.0,0.0,0.0,1.0,,,,,,,,,,,,,,,,,,
/fighter/Anatoliy-Malykhin-256721,anatoliy malykhin,Spartak,11/01/1988,33.0,,Kemerovo,Russia,"5'11""",265 lbs,Golden Team,Heavyweight,8.0,5.0,3.0,0.0,,8.0,0.0,0.0,0.0,,,,,,,,,,,,,,,,,,
/fighter/Anatoly-Tokov-56029,anatoly tokov,,17/02/1990,31.0,,"Tobolsk, Tyumen Oblast",Russia,"5'10""",185 lbs,FedorTeam,Middleweight,29.0,16.0,7.0,6.0,,29.0,1.0,0.0,1.0,,,25.0,2.0,0.0,177.8,83.91,,,,3.51,72.0,0.54,66.0,2.03,100.0,100.0,0.0
/fighter/Anatpong-Bunrad-117787,anatpong bunrad,Mak Mak,14/06/1986,35.0,,"Udon Thani, Isan",Thailand,"5'6""",125 lbs,Phuket Top Team,Flyweight,5.0,3.0,1.0,1.0,,5.0,0.0,1.0,3.0,,,,,,,,,,,,,,,,,,
/fighter/Anderson-dos-Santos-95053,anderson dos santos,Berinja,24/07/1985,36.0,,"Sao Paulo, Sao Paulo",Brazil,"5'6""",135 lbs,Babuino Gold Team,Bantamweight,21.0,5.0,12.0,4.0,,21.0,4.0,2.0,3.0,,Berinja,21.0,9.0,0.0,165.1,61.23,177.8,Orthodox,1985-07-24,2.7,25.0,5.37,49.0,0.98,14.0,66.0,0.7
/fighter/Anderson-Silva-1356,anderson silva,The Spider,14/04/1975,46.0,,"Curitiba, Parana",Brazil,"6'2""",185 lbs,Team Nogueira,Middleweight,34.0,23.0,3.0,8.0,0.0,34.0,4.0,2.0,4.0,1.0,The Spider,34.0,11.0,0.0,187.96,83.91,195.58,Southpaw,1975-04-14,3.05,61.0,2.05,60.0,0.5,77.0,69.0,0.8
,andre amado,,,,,,,,,,,,,,,,,,,,,Dida,6.0,4.0,1.0,182.88,69.85,,Orthodox,,2.27,24.0,5.91,63.0,0.0,0.0,20.0,0.0
/fighter/Andre-Ewell-204397,andre ewell,Mr. Highlight,21/01/1988,33.0,,"Riverside, California",United States,"5'11""",135 lbs,Apex MMA,Bantamweight,17.0,7.0,4.0,6.0,,17.0,2.0,3.0,3.0,,Mr. Highlight,17.0,9.0,0.0,172.72,65.77,190.5,Southpaw,1988-01-21,4.28,40.0,4.87,51.0,0.36,75.0,72.0,0.1
/fighter/Andre-Fialho-188171,andre fialho,,07/04/1994,27.0,,"Cascais, Lisbon",Portugal,"6'0""",170 lbs,Sanford MMA,Welterweight,12.0,9.0,1.0,2.0,,12.0,2.0,0.0,1.0,,,16.0,8.0,0.0,182.88,77.11,187.96,Orthodox,1994-04-07,3.3,41.0,6.26,45.0,0.25,100.0,66.0,0.0
/fighter/Andre-Fili-58385,andre fili,Touchy,25/06/1990,31.0,,"Sacramento, California",United States,"5'10""",145 lbs,Team Alpha Male,Featherweight,21.0,9.0,3.0,9.0,,21.0,2.0,2.0,4.0,,Touchy,22.0,10.0,0.0,180.34,65.77,187.96,Orthodox,1990-06-25,3.83,37.0,4.13,51.0,2.22,47.0,69.0,0.3
,andre galvao,,,,,,,,,,,,,,,,,,,,,,5.0,2.0,0.0,170.18,76.2,,Orthodox,1982-09-29,2.34,52.0,1.56,58.0,2.02,27.0,0.0,2.8
/fighter/Andre-Gusmao-15806,andre gusmao,,19/05/1977,44.0,,"Goiania, Goias",Brazil,"6'2""",185 lbs,,Middleweight,6.0,4.0,1.0,1.0,,6.0,2.0,0.0,1.0,,,6.0,3.0,0.0,182.88,92.99,,Orthodox,1977-05-19,2.79,43.0,3.28,60.0,0.0,0.0,60.0,0.0
,andre lima,,,,,,,,,,,,,,,,,,,,,Mascote,7.0,0.0,0.0,170.18,56.7,170.18,Orthodox,1999-02-04,4.07,66.0,1.67,67.0,1.0,100.0,100.0,0.0
/fighter/Andre-Muniz-81800,andre muniz,Sergipano,17/02/1990,31.0,,"Montes Claros, Minas Gerais",Brazil,"6'2""",185 lbs,Tata Fight Team Montes Claros,Middleweight,21.0,4.0,14.0,3.0,,21.0,4.0,0.0,0.0,,Sergipano,23.0,6.0,0.0,185.42,83.91,198.12,Southpaw,1990-02-17,2.17,50.0,2.03,53.0,2.97,40.0,35.0,1.5
,andre mussi,,,,,,,,,,,,,,,,,,,,,,11.0,5.0,0.0,190.5,109.77,,Orthodox,,0.0,0.0,10.59,35.0,0.0,0.0,0.0,0.0
/fighter/Andre-Pederneiras-227,andre pederneiras,Dede,22/03/1967,54.0,,,Brazil,"5'8""",160 lbs,Nova Uniao,Welterweight,1.0,1.0,0.0,0.0,,1.0,1.0,0.0,0.0,,,1.0,1.0,2.0,172.72,70.31,,Orthodox,1967-03-22,0.0,0.0,0.0,0.0,0.0,0.0,0.0,0.0
,andre petroski,,,,,,,,,,,,,,,,,,,,,,10.0,3.0,0.0,182.88,83.91,185.42,Switch,1991-06-12,3.61,51.0,3.03,51.0,4.48,54.0,71.0,2.5
/fighter/Andre-Roberts-194,andre roberts,The Chief,24/02/1965,56.0,,"Tama, Iowa",United States,"6'2""",345 lbs,,Super Heavyweight,14.0,8.0,5.0,0.0,1.0,14.0,1.0,1.0,0.0,0.0,The Chief,14.0,2.0,1.0,187.96,156.49,,Orthodox,1965-02-24,0.0,0.0,0.0,0.0,0.0,0.0,0.0,0.0
/fighter/Andre-Santos-21141,andre santos,Chatuba,08/01/1981,40.0,,"Rio de Janeiro, Rio de Janeiro",Brazil,"5'11""",170 lbs,Cacadores Team,Welterweight,38.0,5.0,22.0,11.0,,38.0,5.0,4.0,3.0,,Chatuba,38.0,10.0,0.0,182.88,77.11,,,,2.77,34.0,4.17,41.0,2.5,29.0,75.0,0.0
/fighter/Andre-Soukhamthath-67967,andre soukhamthath,The Asian Sensation,23/10/1988,32.0,,"Woonsocket, Rhode Island",United States,"5'9""",135 lbs,Combat Club,Bantamweight,14.0,8.0,3.0,3.0,,14.0,0.0,0.0,9.0,,The Asian Sensation,13.0,8.0,0.0,175.26,61.23,177.8,Orthodox,1988-10-23,2.77,44.0,4.31,49.0,1.25,53.0,58.0,0.2
/fighter/Andre-Tieva-70783,andre tieva,,25/12/1989,31.0,,"Northfield, Minnesota",United States,"5'8""",145 lbs,The Academy,Featherweight,9.0,3.0,4.0,2.0,,9.0,2.0,0.0,0.0,,,,,,,,,,,,,,,,,,
/fighter/Andre-Walker-146137,andre walker,,01/05/1986,35.0,,"Anaheim, California",United States,"6'2""",185 lbs,Cleber Jiu-Jitsu,Middleweight,6.0,4.0,1.0,1.0,,6.0,1.0,1.0,1.0,,,1.0,5.0,0.0,180.34,92.99,,Southpaw,,2.28,31.0,4.36,34.0,0.0,0.0,0.0,0.0
/fighter/Andre-Winner-17034,andre winner,,09/11/1981,39.0,,"Leicester, Leicestershire",England,"5'11""",155 lbs,Team Rough House,Lightweight,22.0,4.0,4.0,14.0,,22.0,0.0,3.0,10.0,,,21.0,11.0,2.0,180.34,70.31,185.42,Orthodox,1981-11-09,2.52,33.0,4.57,51.0,0.0,0.0,74.0,0.0
/fighter/Andrea-Fusi-221273,andrea fusi,Il Barbaro,16/12/1991,29.0,,Como,Italy,"5'10""",170 lbs,Clan Mano di Pietra,Welterweight,8.0,3.0,2.0,3.0,,8.0,1.0,2.0,3.0,,,,,,,,,,,,,,,,,,
/fighter/Andrea-Lee-149037,andrea lee,KGB,11/02/1989,32.0,,"Shreveport, Louisiana",United States,"5'6""",125 lbs,Karate Mafia,Flyweight,12.0,2.0,5.0,5.0,,12.0,0.0,1.0,4.0,,KGB,13.0,8.0,0.0,167.64,56.7,175.26,Orthodox,1989-02-11,4.91,47.0,3.69,63.0,1.84,57.0,54.0,0.6
/fighter/Andreas-Michailidis-65167,andreas michailidis,Spartan,18/07/1988,33.0,,Athens,Greece,"6'0""",185 lbs,EFL Academy,Middleweight,13.0,7.0,4.0,2.0,,13.0,4.0,0.0,0.0,,The Spartan,13.0,6.0,0.0,182.88,77.11,193.04,Orthodox,1988-07-18,2.9,51.0,3.57,44.0,1.12,27.0,50.0,0.0
/fighter/Andreas-Satyawan-311999,andreas satyawan,Yahyaz,,,,,Indonesia,"0'0""",155 lbs,,Lightweight,0.0,0.0,0.0,0.0,,0.0,1.0,0.0,0.0,,,,,,,,,,,,,,,,,,
/fighter/Andreas-Spang-31084,andreas spang,Sweet Swede,07/11/1978,42.0,,"Las Vegas, Nevada",United States,"6'1""",224 lbs,J-Sect MMA,Heavyweight,9.0,3.0,3.0,3.0,,9.0,1.0,1.0,1.0,,Sweet Swede,9.0,3.0,0.0,185.42,83.91,,,,0.0,0.0,0.0,0.0,0.0,0.0,0.0,0.0
/fighter/Andreas-Stahl-57322,andreas stahl,Real Steel,20/05/1988,33.0,,"Umea, Vasterbotten",Sweden,"6'1""",170 lbs,Renyi Fight Camp,Welterweight,12.0,5.0,1.0,6.0,,12.0,2.0,0.0,2.0,,Real Steel,10.0,4.0,0.0,180.34,77.11,,Orthodox,1988-05-20,2.83,37.0,4.74,57.0,1.55,66.0,80.0,0.0
/fighter/Andrei-Arlovski-270,andrei arlovski,The Pit Bull,04/02/1979,42.0,,Minsk,Belarus,"6'4""",250 lbs,American Top Team,Heavyweight,31.0,17.0,3.0,11.0,,31.0,11.0,2.0,7.0,,The Pitbull,34.0,22.0,0.0,190.5,108.86,195.58,Orthodox,1979-02-04,3.78,45.0,3.2,57.0,0.39,36.0,76.0,0.2
/fighter/Andrei-Barbarosa-121799,andrei barbarosa,,11/02/1989,32.0,,Chisinau,Moldova,"5'7""",155 lbs,CSA Moldova,Lightweight,6.0,1.0,2.0,3.0,,6.0,4.0,0.0,3.0,,,,,,,,,,,,,,,,,,
,andrei kopylov,,,,,,,,,,,,,,,,,,,,,,6.0,11.0,0.0,187.96,120.2,,Orthodox,1965-07-16,0.33,66.0,4.31,40.0,0.0,0.0,0.0,0.0
/fighter/Andrei-Semenov-1870,andrei semenov,White Shark,17/06/1977,44.0,,St. Petersburg,Russia,"6'0""",185 lbs,,Middleweight,34.0,11.0,15.0,8.0,,34.0,2.0,1.0,6.0,,,34.0,9.0,2.0,182.88,83.91,,Orthodox,1977-06-17,0.78,15.0,2.44,60.0,1.74,80.0,55.0,0.4
/fighter/Andres-Quintana-76492,andres quintana,The Bullet,15/07/1991,30.0,,"Roswell, New Mexico",United States,"6'0""",145 lbs,Luttrell-Yee MMA,Featherweight,18.0,11.0,2.0,5.0,,18.0,1.0,0.0,2.0,,,,,,,,,,,,,,,,,,
/fighter/Andrew-Benibe-40875,andrew benibe,,,,,,Philippines,"5'8""",155 lbs,Benibe MMA,Lightweight,6.0,3.0,3.0,0.0,,6.0,4.0,3.0,3.0,,,,,,,,,,,,,,,,,,
/fighter/Andrew-Calandrelli-11348,andrew calandrelli,,,,,"New Haven, Connecticut",United States,"5'9""",155 lbs,Ultimate MMA CT,Lightweight,6.0,0.0,4.0,2.0,,6.0,1.0,0.0,3.0,,,,,,,,,,,,,,,,,,
/fighter/Andrew-Chappelle-8070,andrew chappelle,The Powerhouse,,,,"San Antonio, Texas",United States,"0'0""",169 lbs,Team Texas Powerhouse,Welterweight,10.0,1.0,7.0,2.0,,10.0,1.0,1.0,5.0,,,,,,,,,,,,,,,,,,
/fighter/Andrew-Craig-63284,andrew craig,Highlight,15/01/1986,35.0,,"Houston, Texas",United States,"6'1""",170 lbs,Team Tooke,Welterweight,9.0,3.0,1.0,5.0,,9.0,1.0,1.0,2.0,,Highlight,9.0,4.0,0.0,185.42,77.11,193.04,Orthodox,1986-01-15,2.39,40.0,3.01,50.0,0.53,37.0,72.0,0.0
/fighter/Andrew-Cruz-88169,andrew cruz,Hurricane,,,,"Pocatello, Idaho",United States,"5'6""",145 lbs,,Featherweight,6.0,1.0,5.0,0.0,,6.0,1.0,0.0,2.0,,,,,,,,,,,,,,,,,,
/fighter/Andrew-Fisher-22657,andrew fisher,,,,,"Sunderland, Tyne and Wear",England,"5'10""",145 lbs,Team Fish Tank,Featherweight,18.0,6.0,9.0,3.0,,18.0,3.0,1.0,4.0,,,,,,,,,,,,,,,,,,
/fighter/Andrew-Holbrook-78384,andrew holbrook,,06/02/1986,35.0,,"Indianapolis, Indiana",United States,"5'11""",155 lbs,Indy Boxing & Grappling,Lightweight,12.0,1.0,9.0,2.0,,12.0,3.0,0.0,0.0,,,12.0,3.0,0.0,180.34,70.31,177.8,Southpaw,1986-02-06,2.2,49.0,3.0,54.0,0.85,18.0,10.0,2.1
/fighter/Andrew-Johnson-196395,andrew johnson,Mama Said Knock You Out,05/10/1994,26.0,,Illinois,United States,"5'9""",134 lbs,,Bantamweight,2.0,0.0,1.0,1.0,,2.0,0.0,0.0,0.0,,,,,,,,,,,,,,,,,,
/fighter/Andrew-Kapel-39691,andrew kapel,,04/08/1985,36.0,,"Minneapolis, Minnesota",United States,"6'1""",185 lbs,Elevation Fight Team,Middleweight,16.0,5.0,10.0,1.0,,16.0,0.0,6.0,1.0,,,,,,,,,,,,,,,,,,
/fighter/Andrew-Lazo-113645,andrew lazo,,29/04/1994,27.0,,"Riverside, California",United States,"5'8""",155 lbs,Fight Ugly,Lightweight,9.0,3.0,6.0,0.0,,9.0,2.0,6.0,0.0,,,,,,,,,,,,,,,,,,
/fighter/Andrew-Leone-67172,andrew leone,,17/08/1989,31.0,,"Cortland, New York",United States,"5'7""",125 lbs,Bali Muay Thai & MMA,Flyweight,8.0,0.0,2.0,6.0,,8.0,1.0,3.0,0.0,,,,,,,,,,,,,,,,,,
,andrew martinez,,,,,,,,,,,,,,,,,,,,,Mickey D,9.0,6.0,0.0,175.26,97.52,,,,3.4,31.0,2.3,47.0,1.5,50.0,0.0,0.0
,andrew montanez,,,,,,,,,,,,,,,,,,,,,,9.0,12.0,1.0,,83.91,,,,0.0,0.0,0.0,0.0,0.0,0.0,0.0,0.0
/fighter/Andrew-Murphy-220575,andrew murphy,The Carlow Kid,,,,,Ireland,"0'0""",145 lbs,Team Ryano MMA,Featherweight,1.0,1.0,0.0,0.0,,1.0,0.0,2.0,0.0,,,,,,,,,,,,,,,,,,
/fighter/Andrew-Natividad-82464,andrew natividad,,03/02/1990,31.0,,"Escondido, California",United States,"5'6""",135 lbs,Escondido Fight Club,Bantamweight,9.0,4.0,3.0,2.0,,9.0,3.0,2.0,8.0,,,,,,,,,,,,,,,,,,
/fighter/Andrew-Ramm-95501,andrew ramm,The,,,,"Bremerton, Washington",United States,"6'1""",170 lbs,10th Planet Buena Park,Welterweight,4.0,0.0,4.0,0.0,,4.0,1.0,0.0,3.0,,The,4.0,4.0,0.0,185.42,72.57,,,,0.0,0.0,0.0,0.0,0.0,0.0,0.0,0.0
/fighter/Andrew-Salas-103675,andrew salas,Ice Cold,09/08/1987,34.0,,"Freehold, New Jersey",United States,"5'8""",135 lbs,Wilkie's Warriors,Bantamweight,6.0,1.0,1.0,4.0,,6.0,1.0,1.0,4.0,,,,,,,,,,,,,,,,,,
/fighter/Andrew-Sanchez-105321,andrew sanchez,El Dirte,08/04/1988,33.0,,"St. Louis, Missouri",United States,"6'1""",185 lbs,Tristar Gym,Middleweight,12.0,6.0,2.0,4.0,,12.0,4.0,0.0,2.0,,El Dirte,13.0,7.0,0.0,185.42,83.91,187.96,Orthodox,1988-04-08,4.3,43.0,5.1,50.0,2.55,36.0,100.0,0.0
,andrew todhunter,,,,,,,,,,,,,,,,,,,,,The Sniper,8.0,0.0,0.0,182.88,83.91,,Switch,1987-11-30,0.0,0.0,0.0,0.0,0.0,0.0,0.0,0.0
,andrew valladerez,,,,,,,,,,,,,,,,,,,,,,5.0,7.0,0.0,,61.23,,,,0.0,0.0,0.0,0.0,0.0,0.0,0.0,0.0
,andrews nakahara,,,,,,,,,,,,,,,,,,,,,,5.0,4.0,2.0,185.42,83.91,,Orthodox,1983-03-12,2.68,44.0,1.9,57.0,0.0,0.0,72.0,0.4
/fighter/Andrews-Rodriguez-302799,andrews rodriguez,,,,,New York,United States,"0'0""",170 lbs,,Welterweight,1.0,0.0,0.0,1.0,,1.0,0.0,0.0,1.0,,,,,,,,,,,,,,,,,,
/fighter/Andrey-Koreshkov-74221,andrey koreshkov,Spartan,23/08/1990,30.0,,Omsk,Russia,"6'0""",171 lbs,Storm Shlemenko Fight Team,Welterweight,23.0,12.0,4.0,7.0,,23.0,2.0,1.0,1.0,,Spartan,19.0,2.0,0.0,182.88,77.11,,,,2.84,39.0,1.92,63.0,4.8,53.0,0.0,0.0
/fighter/Andria-Wawro-51165,andria wawro,,25/02/1978,43.0,,"Elkins Park, Pennsylvania",United States,"5'8""",155 lbs,Renzo Gracie Philly,Lightweight,3.0,0.0,1.0,2.0,,3.0,1.0,0.0,3.0,,,,,,,,,,,,,,,,,,
,andy anderson,,,,,,,,,,,,,,,,,,,,,The Hammer,0.0,1.0,0.0,167.64,108.86,,,,0.0,0.0,0.0,0.0,0.0,0.0,0.0,0.0
/fighter/Andy-Enz-61422,andy enz,Tank Mode,15/08/1991,29.0,,"Anchorage, Alaska",United States,"6'3""",185 lbs,Gracie Barra Alaska,Middleweight,10.0,1.0,7.0,2.0,,10.0,1.0,0.0,3.0,,Tank Mode,10.0,4.0,0.0,190.5,83.91,198.12,Orthodox,1991-08-15,3.51,23.0,5.32,57.0,0.0,0.0,58.0,0.0
/fighter/Andy-Main-45236,andy main,,24/03/1989,32.0,,"Boonton, New Jersey",United States,"5'11""",145 lbs,Pure MMA,Featherweight,12.0,2.0,7.0,3.0,,12.0,1.0,0.0,3.0,,,,,,,,,,,,,,,,,,
/fighter/Andy-Manzolo-57387,andy manzolo,Predator,09/08/1984,37.0,,,Estonia,"5'11""",185 lbs,Phoenix MMA,Middleweight,23.0,4.0,16.0,3.0,,23.0,4.0,3.0,2.0,,,,,,,,,,,,,,,,,,
/fighter/Andy-Murad-8197,andy murad,The Tooth Fairy,09/02/1983,38.0,,"El Cajon, California",United States,"5'9""",185 lbs,Und1sputed,Middleweight,16.0,4.0,5.0,7.0,,16.0,2.0,0.0,1.0,,The Tooth Fairy,15.0,2.0,0.0,175.26,83.91,,,,2.6,76.0,2.87,32.0,1.0,20.0,42.0,0.0
/fighter/Andy-Nguyen-64707,andy nguyen,The CrAsian,22/04/1982,39.0,,"Myrtle Beach, South Carolina",United States,"5'4""",105 lbs,Karate Mafia,Atomweight,6.0,3.0,1.0,2.0,,6.0,2.0,0.0,7.0,,,,,,,,,,,,,,,,,,
/fighter/Andy-Ogle-42659,andy ogle,The Little Axe,16/02/1989,32.0,,"Sunderland, Tyne and Wear",England,"5'9""",144 lbs,Team Kaobon,Featherweight,9.0,2.0,3.0,4.0,,9.0,1.0,2.0,3.0,,The Little Axe,9.0,6.0,0.0,172.72,65.77,175.26,Orthodox,1989-02-16,2.24,44.0,2.23,50.0,1.44,26.0,58.0,0.0
,andy ologun,,,,,,,,,,,,,,,,,,,,,,3.0,1.0,0.0,182.88,69.85,,Orthodox,1983-06-12,2.36,57.0,0.32,85.0,0.68,100.0,80.0,0.0
/fighter/Andy-Riley-187347,andy riley,Fast Track,07/09/1981,39.0,,"Kansas City, Missouri",United States,"5'7""",135 lbs,,Bantamweight,2.0,1.0,1.0,0.0,,2.0,0.0,1.0,1.0,,,,,,,,,,,,,,,,,,
/fighter/Andy-Uhrich-25525,andy uhrich,Stunner,13/09/1985,35.0,,"Memphis, Tennessee",United States,"6'0""",155 lbs,,Lightweight,11.0,4.0,2.0,5.0,,11.0,3.0,2.0,1.0,,,11.0,6.0,0.0,182.88,77.11,,,,0.0,0.0,0.0,0.0,0.0,0.0,0.0,0.0
/fighter/Andy-Wang-1331,andy wang,,28/05/1977,44.0,,"Los Angeles, California",United States,"5'6""",155 lbs,Grappling Unlimited,Lightweight,8.0,2.0,1.0,5.0,,8.0,2.0,0.0,7.0,,,7.0,8.0,1.0,167.64,70.31,,Orthodox,1977-05-28,3.43,36.0,10.29,62.0,0.0,0.0,0.0,0.0
,andy waters,,,,,,,,,,,,,,,,,,,,,,1.0,2.0,0.0,182.88,77.11,,,,0.0,0.0,0.0,0.0,0.0,0.0,0.0,0.0
,ange loosa,,,,,,,,,,,,,,,,,,,,,The Last Ninja,10.0,3.0,0.0,177.8,77.11,187.96,Orthodox,1993-03-18,6.32,46.0,6.88,51.0,2.25,45.0,100.0,0.2
,angel de anda,,,,,,,,,,,,,,,,,,,,,The Dream,18.0,6.0,0.0,175.26,102.06,,Orthodox,1985-05-28,5.68,46.0,6.32,47.0,0.0,0.0,0.0,0.0
,angel pacheco,,,,,,,,,,,,,,,,,,,,,,7.0,2.0,0.0,172.72,65.77,177.8,Orthodox,1992-01-13,13.13,40.0,13.6,35.0,0.0,0.0,33.0,0.0
/fighter/Angela-Hill-148517,angela hill,Overkill,12/01/1985,36.0,,"San Diego, California",United States,"5'3""",115 lbs,Alliance MMA,Strawweight,13.0,5.0,0.0,8.0,,13.0,0.0,2.0,8.0,,Overkill,16.0,13.0,0.0,160.02,52.16,162.56,Orthodox,1985-01-12,5.44,50.0,4.94,61.0,0.73,34.0,75.0,0.1
/fighter/Angela-Lee-173909,angela lee,Unstoppable,08/07/1996,25.0,,"Waipahu, Hawaii",United States,"5'4""",125 lbs,Evolve MMA,Flyweight,10.0,1.0,7.0,2.0,,10.0,1.0,0.0,1.0,,,,,,,,,,,,,,,,,,
/fighter/Angela-Magana-21720,angela magana,Your Majesty,02/08/1983,38.0,,"Farmington, New Mexico",United States,"5'1""",115 lbs,Independent,Strawweight,11.0,2.0,6.0,3.0,,11.0,1.0,6.0,3.0,,Your Majesty,11.0,9.0,0.0,154.94,52.16,165.1,Orthodox,1983-08-02,1.53,28.0,4.92,42.0,0.4,25.0,28.0,0.4
/fighter/Angelie-Sabanal-276137,angelie sabanal,D Explorer,,,,,Philippines,"5'1""",105 lbs,Mindanao Ultimate Mixed Martial Arts,Atomweight,1.0,0.0,0.0,1.0,,1.0,0.0,1.0,1.0,,,,,,,,,,,,,,,,,,
,angelo antonio,,,,,,,,,,,,,,,,,,,,,,1.0,4.0,0.0,,92.99,,Orthodox,,1.09,50.0,7.64,50.0,0.0,0.0,0.0,0.0
/fighter/Angelo-Bimoadji-300047,angelo bimoadji,The Unicorn King,,,,,Indonesia,"0'0""",115 lbs,IndoGym,Strawweight,1.0,0.0,1.0,0.0,,1.0,2.0,0.0,0.0,,,,,,,,,,,,,,,,,,
/fighter/Angelo-Sanchez-22878,angelo sanchez,The San-I Warrior,,,,"Santa Fe, New Mexico",United States,"5'7""",145 lbs,Luttrell's MMA,Featherweight,14.0,3.0,8.0,3.0,,14.0,1.0,2.0,3.0,,,,,,,,,,,,,,,,,,
,angelo trevino,,,,,,,,,,,,,,,,,,,,,Baby Monsta,7.0,3.0,0.0,180.34,77.11,,Switch,1993-06-10,5.19,54.0,3.9,47.0,0.0,0.0,100.0,0.0
,angga,,,,,,,,,,,,,,,,,,,,,The Hitman,13.0,3.0,0.0,170.18,65.77,172.72,Orthodox,1989-01-13,3.56,38.0,3.77,53.0,0.0,0.0,33.0,0.0
,anistavio medeiros,,,,,,,,,,,,,,,,,,,,,Gasparzinho,19.0,10.0,0.0,167.64,65.77,,Orthodox,1988-05-01,3.64,44.0,5.0,47.0,0.0,0.0,0.0,0.0
/fighter/Anistavio-Medeiros-de-Figueiredo-21962,anistavio medeiros de figueiredo,Gasparzinho,01/05/1988,33.0,,"Natal, Rio Grande do Norte",Brazil,"5'7""",145 lbs,Independent,Featherweight,19.0,3.0,16.0,0.0,,19.0,4.0,5.0,1.0,,,,,,,,,,,,,,,,,,
/fighter/Anita-Karim-292737,anita karim,The Arm Collector,02/10/1996,24.0,,Gilgit,Pakistan,"0'0""",115 lbs,Team Fight Fortress,Strawweight,2.0,0.0,0.0,2.0,,2.0,0.0,1.0,0.0,,,,,,,,,,,,,,,,,,
/fighter/Anita-Rodriguez-48244,anita rodriguez,El Tigre,18/09/1985,35.0,,"Dallas, Texas",United States,"5'2""",135 lbs,Phalanx MMA Academy,Bantamweight,7.0,2.0,3.0,2.0,,7.0,1.0,1.0,4.0,,,,,,,,,,,,,,,,,,
/fighter/Anjela-Pink-195915,anjela pink,,,,,"Spokane, Washington",United States,"5'4""",129 lbs,,Bantamweight,0.0,0.0,0.0,0.0,,0.0,4.0,2.0,0.0,,,,,,,,,,,,,,,,,,
/fighter/Ann-Osman-144119,ann osman,Athena,19/06/1986,35.0,,"Kota Kinabalu, Sabah",Malaysia,"5'3""",125 lbs,Borneo Tribal Squad,Flyweight,5.0,2.0,2.0,1.0,,5.0,1.0,2.0,1.0,,,,,,,,,,,,,,,,,,
/fighter/Anna-Elmose-162539,anna elmose,Panda,,,,Copenhagen,Denmark,"0'0""",135 lbs,Rumble Sports,Bantamweight,3.0,3.0,0.0,0.0,,3.0,1.0,0.0,1.0,,Panda,3.0,2.0,0.0,160.02,52.16,,Orthodox,1984-10-06,3.68,49.0,4.64,56.0,0.0,0.0,33.0,0.0
/fighter/Annalisa-Bucci-65428,annalisa bucci,No Fear,29/01/1983,38.0,,Bologna,Italy,"5'7""",140 lbs,Athletic Thai Gym,Featherweight,7.0,2.0,3.0,2.0,,7.0,0.0,2.0,2.0,,,,,,,,,,,,,,,,,,
/fighter/Ansar-Chalangov-7148,ansar chalangov,,30/10/1979,41.0,,Rostov-on-don,Russia,"5'9""",185 lbs,Legion Fight Team,Middleweight,14.0,3.0,10.0,1.0,,14.0,1.0,3.0,1.0,,,14.0,5.0,0.0,175.26,77.11,,Orthodox,1979-10-30,0.68,66.0,1.69,54.0,0.0,0.0,0.0,7.6
,anshul jubli,,,,,,,,,,,,,,,,,,,,,King of Lions,7.0,1.0,0.0,182.88,70.31,175.26,Switch,1995-01-13,6.48,46.0,5.61,51.0,0.82,18.0,63.0,0.4
,ante delija,,,,,,,,,,,,,,,,,,,,,Walking Trouble,17.0,3.0,0.0,193.04,111.13,,Orthodox,1990-08-07,0.0,0.0,0.0,0.0,0.0,0.0,0.0,0.0
/fighter/Anthony-Ruiz-6901,anthony    ruiz,A-Train,03/11/1977,43.0,,"Coarsegold, California",United States,"6'2""",185 lbs,Dethrone Base Camp,Middleweight,34.0,17.0,6.0,11.0,,34.0,3.0,14.0,8.0,,,,,,,,,,,,,,,,,,
,anthony adams,,,,,,,,,,,,,,,,,,,,,Sugafoot,8.0,2.0,0.0,185.42,83.91,193.04,Orthodox,1988-01-13,3.17,41.0,5.93,44.0,0.0,0.0,0.0,0.0
,anthony alves,,,,,,,,,,,,,,,,,,,,,,1.0,4.0,0.0,,,,,,0.0,0.0,0.0,0.0,0.0,0.0,0.0,0.0
,anthony avila,,,,,,,,,,,,,,,,,,,,,,13.0,5.0,0.0,170.18,65.77,,,,0.0,0.0,0.0,0.0,0.0,0.0,0.0,0.0
/fighter/Anthony-Bain-120897,anthony bain,,,,,"Grand Blanc, Michigan",United States,"5'9""",141 lbs,The System,Featherweight,1.0,0.0,1.0,0.0,,1.0,1.0,2.0,0.0,,,,,,,,,,,,,,,,,,
/fighter/Anthony-Birchak-53300,anthony birchak,El Toro,16/05/1986,35.0,,"Tucson, Arizona",United States,"5'8""",135 lbs,Luta Elite MMA,Bantamweight,16.0,5.0,8.0,3.0,,16.0,2.0,3.0,3.0,,El Toro,16.0,8.0,0.0,172.72,61.23,175.26,Orthodox,1986-05-16,3.93,36.0,3.67,56.0,0.48,14.0,61.0,0.5
/fighter/Anthony-Castrejon-232311,anthony castrejon,Pretty Boy,,,,"Las Vegas, Nevada",United States,"0'0""",135 lbs,One Kick's Gym,Bantamweight,1.0,1.0,0.0,0.0,,1.0,1.0,1.0,0.0,,,,,,,,,,,,,,,,,,
/fighter/Anthony-Christodoulou-53712,anthony christodoulou,,30/07/1987,34.0,,"Glyfada, Attica",Greece,"5'9""",155 lbs,Renzo Gracie Fight Academy,Lightweight,13.0,4.0,5.0,4.0,,13.0,2.0,3.0,2.0,,,12.0,7.0,0.0,175.26,70.31,,Orthodox,1987-07-30,2.19,26.0,5.9,45.0,0.0,0.0,40.0,0.0
/fighter/Anthony-Dizy-96117,anthony dizy,La Masse,12/07/1988,33.0,,Reims,France,"5'7""",145 lbs,ETTReims,Featherweight,13.0,5.0,2.0,6.0,,13.0,1.0,1.0,2.0,,,,,,,,,,,,,,,,,,
/fighter/Anthony-Do-161359,anthony do,The Antidote,11/04/1993,28.0,,"Sunnyvale, California",United States,"5'4""",120 lbs,American Kickboxing Academy,Flyweight,8.0,4.0,3.0,1.0,,8.0,1.0,2.0,1.0,,,4.0,2.0,0.0,162.56,56.7,,,,0.0,0.0,0.0,0.0,0.0,0.0,0.0,0.0
/fighter/Anthony-Engelen-126115,anthony engelen,The Archangel,23/06/1985,36.0,,"Ermelo, Gelderland",Netherlands,"5'6""",155 lbs,Tatsujin MMA Indonesia,Lightweight,8.0,3.0,4.0,1.0,,8.0,3.0,3.0,1.0,,,,,,,,,,,,,,,,,,
,anthony figueroa,,,,,,,,,,,,,,,,,,,,,,11.0,8.0,1.0,162.56,61.23,,Orthodox,,2.37,48.0,3.77,49.0,0.0,0.0,58.0,0.0
/fighter/Anthony-Figueroa-II-301561,anthony figueroa ii,,,,,"Gilroy, California",United States,"5'10""",155 lbs,AntDawg's MMA,Lightweight,1.0,0.0,0.0,1.0,,1.0,0.0,0.0,0.0,,,,,,,,,,,,,,,,,,
/fighter/Anthony-Garrett-138101,anthony garrett,Lionheart,10/11/1989,31.0,,"Kansas City, Kansas",United States,"6'5""",245 lbs,Title Boxing Club,Heavyweight,6.0,4.0,2.0,0.0,,6.0,2.0,1.0,0.0,,,,,,,,,,,,,,,,,,
/fighter/Anthony-Giacchina-53673,anthony giacchina,,,,,"Selden, New York",United States,"0'0""",160 lbs,,Welterweight,2.0,0.0,1.0,1.0,,2.0,1.0,1.0,0.0,,,,,,,,,,,,,,,,,,
/fighter/Anthony-Gomez-19630,anthony gomez,,,,,"Chicago, Illinois",United States,"6'3""",214 lbs,,Heavyweight,10.0,3.0,4.0,3.0,,10.0,0.0,0.0,3.0,,,,,,,,,,,,,,,,,,
/fighter/Anthony-Hamilton-58947,anthony hamilton,Freight Train,14/04/1980,41.0,,"Seattle, Washington",United States,"6'5""",261 lbs,Jackson-Wink MMA,Heavyweight,18.0,8.0,2.0,8.0,,18.0,4.0,3.0,2.0,,Freight Train,15.0,9.0,0.0,195.58,117.93,193.04,Orthodox,1980-04-14,3.91,65.0,3.02,45.0,2.62,42.0,78.0,0.0
/fighter/Anthony-Hernandez-86783,anthony hernandez,Fluffy,18/10/1993,27.0,,"Dunnigan, California",United States,"6'0""",185 lbs,MMA Gold Fight Team,Middleweight,8.0,1.0,6.0,1.0,,8.0,1.0,1.0,0.0,,Fluffy,11.0,2.0,0.0,182.88,83.91,190.5,Orthodox,1993-10-18,4.33,62.0,3.36,46.0,6.79,57.0,63.0,2.9
/fighter/Anthony-Ivy-143479,anthony ivy,Aquaman,23/01/1990,31.0,,"San Antonio, Texas",United States,"6'2""",170 lbs,Brazilian Top Team San Antonio,Welterweight,8.0,5.0,3.0,0.0,,8.0,2.0,2.0,1.0,,Aquaman,8.0,4.0,0.0,187.96,83.91,187.96,Orthodox,1990-01-23,2.5,42.0,4.57,51.0,4.69,20.0,100.0,0.0
/fighter/Anthony-Johnson-17662,anthony johnson,Rumble,06/03/1984,37.0,,"Boca Raton, Florida",United States,"6'2""",205 lbs,Sanford MMA,Light Heavyweight,23.0,17.0,0.0,6.0,,23.0,1.0,5.0,0.0,,Rumble,22.0,6.0,0.0,187.96,92.99,198.12,Orthodox,1984-03-06,3.25,47.0,1.83,60.0,2.43,57.0,77.0,0.6
/fighter/Anthony-Lapsley-18590,anthony lapsley,The Recipe,13/02/1980,41.0,,"Fort Wayne, Indiana",United States,"5'9""",170 lbs,,Welterweight,23.0,3.0,16.0,4.0,,23.0,1.0,4.0,2.0,,The Recipe,23.0,7.0,0.0,175.26,77.11,,Southpaw,1980-02-13,0.53,34.0,0.58,66.0,0.0,0.0,20.0,0.0
/fighter/Anthony-Lemon-82078,anthony lemon,,06/06/1991,30.0,,"Tullahoma, Tennessee",United States,"5'11""",170 lbs,Team Gravity,Welterweight,4.0,2.0,2.0,0.0,,4.0,1.0,8.0,1.0,,,,,,,,,,,,,,,,,,
/fighter/Anthony-Leone-40387,anthony leone,,27/05/1987,34.0,,"Center Moriches, New York",United States,"5'6""",125 lbs,Bali MMA,Flyweight,17.0,0.0,9.0,8.0,,17.0,2.0,4.0,3.0,,,15.0,8.0,0.0,167.64,61.23,,Orthodox,1987-05-27,1.94,53.0,2.52,56.0,1.72,18.0,0.0,0.0
/fighter/Anthony-Macias-53,anthony macias,Mad Dog,16/07/1969,52.0,,"Oklahoma City, Oklahoma",United States,"5'10""",170 lbs,USA Stars,Welterweight,26.0,5.0,16.0,2.0,3.0,26.0,9.0,8.0,1.0,0.0,Mad Dog,26.0,18.0,0.0,175.26,83.91,,Switch,,0.0,0.0,0.0,0.0,0.0,0.0,0.0,0.0
/fighter/Anthony-Morrison-16722,anthony morrison,Cheesesteak,29/03/1984,37.0,,"Philadelphia, Pennsylvania",United States,"5'7""",145 lbs,Daddis Fight Camps,Featherweight,20.0,10.0,4.0,6.0,,20.0,4.0,7.0,1.0,,Cheesesteak,20.0,12.0,0.0,170.18,65.77,,Orthodox,1984-03-29,1.7,33.0,0.49,80.0,0.0,0.0,50.0,0.0
/fighter/Anthony-Njokuani-7540,anthony njokuani,The Assassin,01/03/1980,41.0,,"Garland, Texas",United States,"6'0""",155 lbs,Janjira Muay Thai,Lightweight,16.0,9.0,0.0,7.0,,16.0,1.0,4.0,7.0,,The Assassin,16.0,12.0,0.0,185.42,70.31,190.5,Orthodox,1980-03-01,3.94,46.0,2.41,65.0,0.5,45.0,53.0,0.2
/fighter/Anthony-Perosh-9491,anthony perosh,The Hippo,10/05/1972,49.0,,"Sydney, New South Wales",Australia,"6'3""",205 lbs,Team Perosh Mixed Martial Arts,Light Heavyweight,15.0,5.0,10.0,0.0,,15.0,7.0,0.0,3.0,,The Hippo,15.0,10.0,0.0,190.5,92.99,190.5,Orthodox,1972-10-05,2.27,43.0,3.77,53.0,2.03,22.0,33.0,1.1
/fighter/Anthony-Pettis-26627,anthony pettis,Showtime,27/01/1987,34.0,,"Milwaukee, Wisconsin",United States,"5'10""",155 lbs,Roufusport,Lightweight,24.0,11.0,7.0,6.0,,24.0,2.0,2.0,8.0,,Showtime,24.0,10.0,0.0,177.8,70.31,182.88,Orthodox,1987-01-27,3.05,47.0,3.44,54.0,0.61,50.0,60.0,1.1
/fighter/Anthony-Rocco-Martin-80436,anthony rocco martin,,11/12/1989,31.0,,"Palos Heights, Illinois",United States,"6'0""",170 lbs,American Top Team,Welterweight,17.0,1.0,9.0,7.0,,17.0,0.0,2.0,4.0,,,17.0,6.0,0.0,182.88,77.11,185.42,Orthodox,1989-12-11,2.68,37.0,2.59,58.0,0.71,27.0,68.0,1.0
,anthony romero,,,,,,,,,,,,,,,,,,,,,The Genius,8.0,0.0,0.0,180.34,70.31,177.8,Orthodox,1997-02-25,5.87,52.0,4.0,65.0,2.0,22.0,100.0,0.0
,anthony ruiz,,,,,,,,,,,,,,,,,,,,,El Toro,33.0,22.0,0.0,187.96,92.99,,Orthodox,1977-11-03,2.56,64.0,1.67,28.0,1.43,31.0,21.0,0.0
/fighter/Anthony-Smith-29470,anthony smith,Lionheart,26/07/1988,33.0,,"Omaha, Nebraska",United States,"6'4""",205 lbs,Factory X,Light Heavyweight,35.0,19.0,13.0,2.0,1.0,35.0,9.0,4.0,3.0,0.0,Lionheart,37.0,18.0,0.0,193.04,92.99,193.04,Orthodox,1988-07-26,3.16,48.0,4.45,46.0,0.52,28.0,48.0,0.7
/fighter/Anthony-Taylor-173233,anthony taylor,Pretty Boy,23/06/1989,32.0,,"Alameda, California",United States,"5'7""",149 lbs,Beastmode MMA,Lightweight,7.0,1.0,1.0,5.0,,7.0,1.0,4.0,0.0,,Pretty Boy,1.0,3.0,0.0,170.18,65.77,,,,0.0,0.0,0.0,0.0,0.0,0.0,0.0,0.0
/fighter/Anthony-Torres-1884,anthony torres,The Crush,31/07/1978,43.0,,"Kailua, Hawaii",United States,"5'10""",170 lbs,MMA Development,Welterweight,5.0,2.0,2.0,0.0,1.0,5.0,1.0,0.0,2.0,0.0,The Crush,5.0,3.0,0.0,172.72,77.11,,Orthodox,1978-07-31,3.54,48.0,7.52,45.0,0.0,0.0,100.0,2.2
,anton berzin,,,,,,,,,,,,,,,,,,,,,The Body Snatcher,5.0,1.0,0.0,187.96,92.99,,Orthodox,1989-09-29,4.4,46.0,6.8,67.0,2.0,28.0,0.0,1.0
/fighter/Anton-Kuivanen-14865,anton kuivanen,,01/05/1984,37.0,,Helsinki,Finland,"5'9""",155 lbs,Primus Fight Team,Lightweight,26.0,7.0,8.0,11.0,,26.0,8.0,3.0,1.0,,,24.0,10.0,0.0,172.72,70.31,182.88,Orthodox,1984-05-01,2.27,38.0,1.63,67.0,1.2,100.0,71.0,0.4
/fighter/Anton-Lazebnov-306579,anton lazebnov,King Kong,25/12/2000,20.0,,Kiev,Ukraine,"5'9""",155 lbs,Octagon,Lightweight,5.0,4.0,1.0,0.0,,5.0,3.0,2.0,2.0,,,,,,,,,,,,,,,,,,
/fighter/Anton-Talamantes-46501,anton talamantes,El Terrible,,,,"Fort Wayne, Indiana",United States,"5'10""",205 lbs,,Light Heavyweight,5.0,2.0,2.0,1.0,,5.0,2.0,1.0,1.0,,,,,,,,,,,,,,,,,,
,anton turkalj,,,,,,,,,,,,,,,,,,,,,The Pleasure Man,8.0,3.0,0.0,193.04,92.99,198.12,Orthodox,1996-06-10,1.72,53.0,2.48,49.0,6.55,51.0,16.0,0.0
/fighter/Anton-Zafir-86294,anton zafir,The Professor,10/05/1987,34.0,,"Cairns, Queensland",Australia,"5'11""",170 lbs,Whitsunday Martial Arts,Welterweight,8.0,4.0,3.0,1.0,,8.0,3.0,1.0,0.0,,The Professor,7.0,3.0,0.0,180.34,77.11,,Orthodox,1987-05-10,2.99,64.0,2.31,52.0,6.11,60.0,0.0,0.0
/fighter/Antoni-Hardonk-1518,antoni hardonk,,05/02/1976,45.0,,"Weesp, North Holland",Netherlands,"6'4""",240 lbs,Dynamix MMA,Heavyweight,8.0,6.0,2.0,0.0,,8.0,2.0,1.0,3.0,,,8.0,6.0,0.0,193.04,111.13,198.12,Orthodox,1976-02-05,3.4,61.0,3.07,46.0,0.0,0.0,40.0,0.9
/fighter/Antoni-Romulo-27860,antoni romulo,,,,,"South Jakarta, Jakarta",Indonesia,"5'10""",204 lbs,Spider Academy,Light Heavyweight,1.0,1.0,0.0,0.0,,1.0,1.0,0.0,0.0,,,,,,,,,,,,,,,,,,
/fighter/Antonina-Shevchenko-45389,antonina shevchenko,La Pantera,20/11/1984,36.0,,Bishkek,Kyrgyzstan,"5'8""",125 lbs,Tiger Muay Thai,Flyweight,9.0,3.0,1.0,5.0,,9.0,0.0,1.0,2.0,,La Pantera,10.0,4.0,0.0,172.72,56.7,170.18,Southpaw,1984-11-20,3.86,55.0,2.93,52.0,0.43,42.0,53.0,0.4
/fighter/Antonio-Arroyo-173979,antonio arroyo,,01/07/1989,32.0,,"Belem, Para",Brazil,"6'0""",185 lbs,Marajo Brothers Team,Middleweight,9.0,4.0,4.0,1.0,,9.0,0.0,2.0,2.0,,,9.0,5.0,0.0,190.5,83.91,185.42,Orthodox,1989-07-01,2.82,66.0,2.02,50.0,1.14,41.0,41.0,0.2
/fighter/Antonio-Banuelos-2580,antonio banuelos,,23/09/1979,41.0,,"San Luis Obispo, California",United States,"5'3""",125 lbs,The Pit,Flyweight,20.0,7.0,1.0,12.0,,20.0,5.0,2.0,4.0,,,20.0,11.0,1.0,165.1,61.23,160.02,Orthodox,1979-09-23,2.69,33.0,3.15,58.0,1.62,62.0,86.0,0.4
/fighter/Antonio-Braga-Neto-19530,antonio braga neto,,29/10/1987,33.0,,"Rio de Janeiro, Rio de Janeiro",Brazil,"6'3""",185 lbs,Team Nogueira,Middleweight,9.0,1.0,7.0,1.0,,9.0,1.0,0.0,2.0,,,9.0,3.0,0.0,190.5,83.91,195.58,Orthodox,1987-10-29,1.36,33.0,3.92,45.0,3.07,37.0,0.0,0.5
/fighter/Antonio-Carlos-Jr-143157,antonio carlos jr.,Cara de Sapato,16/03/1990,31.0,,"Joao Pessoa, Paraiba",Brazil,"6'2""",185 lbs,American Top Team,Middleweight,11.0,0.0,9.0,2.0,,11.0,1.0,0.0,4.0,,,,,,,,,,,,,,,,,,
,antonio carlos junior,,,,,,,,,,,,,,,,,,,,,Cara de Sapato,11.0,5.0,0.0,187.96,83.91,200.66,Orthodox,1990-03-16,1.95,42.0,2.14,52.0,3.42,39.0,53.0,0.8
/fighter/Antonio-Caruso-126239,antonio caruso,The Spartan,24/12/1990,30.0,,"Adelaide, South Australia",Australia,"5'11""",170 lbs,Sanford MMA,Welterweight,8.0,1.0,4.0,3.0,,8.0,0.0,0.0,1.0,,,,,,,,,,,,,,,,,,
/fighter/Antonio-Carvalho-5346,antonio carvalho,Pato,30/05/1979,42.0,,"Toronto, Ontario",Canada,"5'8""",145 lbs,Bruckmann Martial Arts,Featherweight,15.0,7.0,3.0,5.0,,15.0,3.0,0.0,3.0,,Pato,15.0,6.0,0.0,175.26,65.77,177.8,Orthodox,1979-05-30,3.03,29.0,3.62,64.0,0.0,0.0,100.0,0.0
,antonio dos santos,,,,,,,,,,,,,,,,,,,,,Junior Alpha,6.0,4.0,0.0,177.8,83.91,,Orthodox,1988-07-21,5.4,51.0,3.94,43.0,0.0,0.0,100.0,0.0
/fighter/Antonio-dos-Santos-Jr-46759,antonio dos santos jr.,Junior Alpha,21/07/1988,33.0,,"Salvador, Bahia",Brazil,"5'10""",170 lbs,MMA Masters,Welterweight,9.0,5.0,2.0,2.0,,9.0,3.0,0.0,1.0,,,,,,,,,,,,,,,,,,
/fighter/Antonio-Duarte-15778,antonio duarte,Tigre,,,,"Tijuana, Baja California",Mexico,"5'7""",135 lbs,Entram Gym,Bantamweight,25.0,5.0,14.0,6.0,,25.0,4.0,2.0,1.0,,Tigre,19.0,7.0,0.0,170.18,61.23,,,,4.55,40.0,4.18,57.0,0.0,0.0,60.0,0.0
/fighter/Antonio-Jones-127091,antonio jones,Doomsday,12/04/1985,36.0,,"Holloman, New Mexico",United States,"6'0""",185 lbs,Pete Spratt Muay Thai,Middleweight,7.0,2.0,1.0,4.0,,7.0,2.0,1.0,1.0,,Doomsday,6.0,1.0,0.0,180.34,83.91,,Orthodox,1985-04-12,7.5,55.0,30.0,42.0,0.0,0.0,0.0,0.0
/fighter/Antonio-McKee-515,antonio mckee,Mandingo,12/03/1970,51.0,,"Lakewood, California",United States,"5'8""",155 lbs,Bodyshop Fitness Team,Lightweight,30.0,5.0,4.0,21.0,,30.0,2.0,1.0,3.0,,Mandingo,29.0,6.0,2.0,172.72,70.31,,Southpaw,1970-03-12,1.37,45.0,0.74,74.0,1.47,33.0,57.0,0.0
/fighter/Antonio-Mendes-7110,antonio mendes,Samuray,19/04/1981,40.0,,"Fortaleza, Ceara",Brazil,"6'3""",205 lbs,Dragon Fight,Light Heavyweight,18.0,8.0,4.0,6.0,,18.0,7.0,4.0,2.0,,Samurai,18.0,13.0,0.0,190.5,92.99,195.58,Southpaw,1981-04-19,1.34,47.0,6.85,22.0,2.51,50.0,100.0,0.0
/fighter/Antonio-Rodrigo-Nogueira-1440,antonio rodrigo nogueira,Minotauro,02/06/1976,45.0,,"Vitoria da Conquista, Bahia",Brazil,"6'3""",240 lbs,Team Nogueira,Heavyweight,34.0,3.0,21.0,10.0,,34.0,3.0,2.0,5.0,,Minotauro,34.0,10.0,1.0,190.5,108.86,195.58,Orthodox,1976-06-02,1.95,42.0,2.4,55.0,1.3,29.0,36.0,2.4
/fighter/Antonio-Rogerio-Nogueira-2270,antonio rogerio nogueira,Minotouro,02/06/1976,45.0,,"Vitoria da Conquista, Bahia",Brazil,"6'2""",205 lbs,Team Nogueira,Light Heavyweight,23.0,8.0,6.0,9.0,,23.0,4.0,0.0,6.0,,,,,,,,,,,,,,,,,,
,antonio schembri,,,,,,,,,,,,,,,,,,,,,Nino,5.0,5.0,0.0,175.26,92.99,,Orthodox,1974-06-01,0.72,26.0,2.12,55.0,1.31,40.0,0.0,0.4
/fighter/Antonio-Silva-12354,antonio silva,Bigfoot,14/09/1979,41.0,,"Brasilia, Distrito Federal",Brazil,"6'4""",264 lbs,American Top Team,Heavyweight,19.0,15.0,2.0,2.0,,19.0,11.0,0.0,2.0,,Bigfoot,19.0,12.0,1.0,193.04,119.75,208.28,Orthodox,1979-09-14,2.89,45.0,3.09,50.0,0.82,29.0,66.0,0.8
,antonio trocoli,,,,,,,,,,,,,,,,,,,,,Malvado,12.0,3.0,0.0,195.58,92.99,208.28,Orthodox,1990-12-06,1.27,71.0,4.56,25.0,3.8,100.0,100.0,3.8
,antony rea,,,,,,,,,,,,,,,,,,,,,Wild Thing,33.0,15.0,0.0,182.88,92.99,,Orthodox,1976-07-15,2.89,28.0,5.42,42.0,0.0,0.0,100.0,0.0
,antwain britt,,,,,,,,,,,,,,,,,,,,,The Juggernaut,11.0,6.0,0.0,185.42,92.99,195.58,,,1.46,39.0,2.81,44.0,1.56,40.0,50.0,0.0
/fighter/Anvar-Alizhanov-185507,anvar  alizhanov,,04/02/1989,32.0,,Republic of Dagestan,Russia,"5'9""",145 lbs,AKA Thailand,Featherweight,9.0,5.0,2.0,2.0,,9.0,0.0,1.0,1.0,,,,,,,,,,,,,,,,,,
/fighter/Anvar-Amirli-168779,anvar amirli,Wolf,07/07/1992,29.0,,Baku,Azerbaijan,"5'10""",155 lbs,RIO GRAPPLING,Lightweight,9.0,3.0,5.0,1.0,,9.0,0.0,0.0,0.0,,,,,,,,,,,,,,,,,,
,anvar boynazarov,,,,,,,,,,,,,,,,,,,,,The Uzbek,3.0,1.0,0.0,175.26,65.77,,Orthodox,1989-01-10,0.0,0.0,7.83,29.0,0.0,0.0,0.0,0.0
/fighter/Anying-Wang-135315,anying wang,Smiley,04/04/1991,30.0,,,Mongolia,"6'0""",170 lbs,Phuket Top Team,Welterweight,2.0,2.0,0.0,0.0,,2.0,2.0,2.0,0.0,,,2.0,1.0,0.0,182.88,77.11,,Orthodox,1991-04-04,1.32,26.0,1.63,44.0,0.0,0.0,33.0,0.0
,aori qileng,,,,,,,,,,,,,,,,,,,,,,,,,,,,,,,,,,,,,
,aoriqileng,,,,,,,,,,,,,,,,,,,,,The Mongolian Murderer,25.0,10.0,0.0,170.18,61.23,175.26,Orthodox,1993-06-25,5.31,50.0,5.56,50.0,1.64,46.0,58.0,0.0
/fighter/April-Osenio-191613,april osenio,,16/04/1994,27.0,,Baguio,Philippines,"5'3""",105 lbs,Team Lakay,Atomweight,2.0,0.0,2.0,0.0,,2.0,2.0,2.0,0.0,,,,,,,,,,,,,,,,,,
/fighter/Arash-Mardani-365133,arash mardani,,,,,,Iran,"6'1""",240 lbs,Fairtex Pattaya,Heavyweight,0.0,0.0,0.0,0.0,,0.0,1.0,0.0,0.0,,,,,,,,,,,,,,,,,,
/fighter/Arbi-Mezhidov-85225,arbi mezhidov,Alpha Wolf,17/04/1992,29.0,,Vienna,Austria,"5'10""",155 lbs,Gym 23,Lightweight,13.0,9.0,0.0,4.0,,13.0,0.0,3.0,2.0,,,,,,,,,,,,,,,,,,
/fighter/Ariane-Carnelossi-182853,ariane carnelossi,Sorriso,17/11/1992,28.0,,"Presidente Prudente, Sao Paulo",Brazil,"5'2""",115 lbs,Inside Muay Thai,Strawweight,13.0,9.0,1.0,3.0,,13.0,1.0,1.0,0.0,,Sorriso,14.0,3.0,0.0,157.48,52.16,154.94,Orthodox,1992-11-17,3.04,40.0,4.72,43.0,1.62,55.0,8.0,0.3
,ariane da silva,,,,,,,,,,,,,,,,,,,,,,,,,,,,,,,,,,,,,
/fighter/Ariane-Lipski-147487,ariane lipski,Queen of Violence,26/01/1994,27.0,,"Curitiba, Parana",Brazil,"5'6""",125 lbs,Rasthai,Flyweight,13.0,6.0,3.0,4.0,,13.0,3.0,0.0,4.0,,Queen of Violence,16.0,8.0,0.0,167.64,56.7,170.18,Orthodox,1994-01-26,3.94,39.0,4.2,51.0,0.54,50.0,78.0,0.3
/fighter/Ariel-Beck-157211,ariel beck,Sunshine,16/09/1990,30.0,,"Helena, Montana",United States,"5'6""",125 lbs,,Flyweight,4.0,2.0,0.0,1.0,1.0,4.0,1.0,2.0,2.0,0.0,,4.0,5.0,0.0,167.64,56.7,167.64,Southpaw,1990-09-16,4.44,34.0,4.31,64.0,0.0,0.0,0.0,0.0
,ariel gandulla,,,,,,,,,,,,,,,,,,,,,,7.0,9.0,0.0,180.34,92.99,,Orthodox,1968-05-07,1.95,23.0,2.07,72.0,1.88,66.0,0.0,0.0
/fighter/Ariel-Sepulveda-55555,ariel sepulveda,The Smash,14/09/1983,37.0,,"New York City, New York",United States,"6'1""",186 lbs,Carmine Zocchi Brazilian Jiu-Jitsu,Middleweight,6.0,1.0,3.0,2.0,,6.0,1.0,2.0,4.0,,,,,,,,,,,,,,,,,,
/fighter/Ariel-Sexton-22447,ariel sexton,Tarzan,17/01/1982,39.0,,San Jose,Costa Rica,"5'9""",155 lbs,Daniel Gracie Team,Lightweight,13.0,3.0,10.0,0.0,,13.0,0.0,2.0,2.0,,,,,,,,,,,,,,,,,,
,arjan bhullar,,,,,,,,,,,,,,,,,,,,,,9.0,1.0,0.0,185.42,111.13,190.5,Orthodox,1986-05-13,2.33,56.0,3.25,59.0,1.73,75.0,100.0,0.0
/fighter/Arjan-Singh-Bhullar-175321,arjan singh bhullar,,13/05/1986,35.0,,"Richmond, British Columbia",Canada,"6'1""",241 lbs,Ryan's MMA - Checkmat Vancouver,Heavyweight,11.0,4.0,0.0,7.0,,11.0,0.0,1.0,0.0,,,,,,,,,,,,,,,,,,
/fighter/Arlene-Blencowe-131845,arlene blencowe,Angerfist,11/04/1983,38.0,,"Manly, New South Wales",Australia,"5'5""",135 lbs,Team Te Huna,Bantamweight,14.0,8.0,1.0,5.0,,14.0,0.0,5.0,3.0,,Angerfist,9.0,6.0,0.0,165.1,65.77,,,,2.31,43.0,2.1,43.0,0.0,0.0,55.0,0.6
,arman ashimov,,,,,,,,,,,,,,,,,,,,,Mustafa Ozturik,11.0,3.0,1.0,167.64,56.7,,,,0.0,0.0,0.0,0.0,0.0,0.0,0.0,0.0
/fighter/Arman-Tsarukyan-213913,arman tsarukyan,Ahalkalakets,11/10/1996,24.0,,Khabarovsk,Russia,"5'9""",155 lbs,MFP Team,Lightweight,16.0,5.0,5.0,6.0,,16.0,1.0,0.0,1.0,,Ahalkalakets,21.0,3.0,0.0,170.18,70.31,182.88,Orthodox,1996-10-11,3.85,48.0,1.91,54.0,3.4,36.0,75.0,0.0
/fighter/Armando-Servin-63191,armando servin,,11/09/1978,42.0,,"Dallas, Texas",United States,"5'11""",170 lbs,,Welterweight,4.0,1.0,1.0,2.0,0.0,4.0,0.0,2.0,3.0,1.0,,,,,,,,,,,,,,,,,
/fighter/Armando-Villarreal-141205,armando villarreal,La Lumbre,08/08/1989,32.0,,"Waco, Texas",United States,"5'7""",145 lbs,Blitz Sport MMA,Featherweight,5.0,1.0,2.0,2.0,,5.0,0.0,1.0,1.0,,La Lumbre,5.0,2.0,0.0,170.18,61.23,167.64,Southpaw,1989-08-08,3.23,55.0,4.3,52.0,3.23,25.0,0.0,0.0
,armen petrosyan,,,,,,,,,,,,,,,,,,,,,Superman,9.0,2.0,0.0,190.5,83.91,180.34,Orthodox,1990-11-02,5.97,52.0,3.03,56.0,0.23,33.0,36.0,0.0
/fighter/Arnaud-Lepont-23443,arnaud lepont,The Game,13/05/1980,41.0,,,Vietnam,"5'8""",150 lbs,California Fitness and Yoga,Lightweight,12.0,2.0,9.0,0.0,1.0,12.0,2.0,3.0,0.0,0.0,,,,,,,,,,,,,,,,,
/fighter/Arnold-Allen-97499,arnold allen,Almighty,17/01/1994,27.0,,"Felixstowe, Suffolk",England,"5'9""",145 lbs,Tristar Gym,Featherweight,17.0,5.0,4.0,8.0,,17.0,0.0,0.0,1.0,,Almighty,19.0,2.0,0.0,172.72,65.77,177.8,Southpaw,1994-01-22,3.34,40.0,2.86,61.0,1.12,50.0,76.0,0.3
/fighter/Art-Arciniega-14385,art arciniega,King Arthur,15/10/1981,39.0,,"Dos Palos, California",United States,"5'8""",145 lbs,Pacific Martial Arts,Featherweight,16.0,1.0,8.0,7.0,,16.0,2.0,0.0,5.0,,King Arthur,15.0,7.0,0.0,172.72,65.77,,,,1.53,46.0,2.73,51.0,0.0,0.0,50.0,1.0
/fighter/Art-Becerra-33484,art becerra,Mighty Mouse,,,,"Madera, California",United States,"5'7""",145 lbs,Fresno Kickboxing Academy,Featherweight,4.0,1.0,1.0,2.0,,4.0,1.0,2.0,2.0,,,,,,,,,,,,,,,,,,
/fighter/Art-Jimmerson-20,art jimmerson,,04/08/1963,58.0,,"St. Louis, Missouri",United States,"6'1""",196 lbs,,Light Heavyweight,0.0,0.0,0.0,0.0,,0.0,0.0,1.0,0.0,,,0.0,1.0,0.0,185.42,88.9,,Orthodox,1963-08-04,0.0,0.0,0.0,0.0,0.0,0.0,0.0,0.0
,art santore,,,,,,,,,,,,,,,,,,,,,Pachuco,18.0,8.0,0.0,187.96,83.91,,,,1.4,12.0,7.31,52.0,0.0,0.0,100.0,0.0
,artem frolov,,,,,,,,,,,,,,,,,,,,,,11.0,0.0,0.0,177.8,83.91,,,,0.0,0.0,0.0,0.0,0.0,0.0,0.0,0.0
/fighter/Artem-Kazartsev-350525,artem kazartsev,,,,,,Israel,"0'0""",170 lbs,,Welterweight,0.0,0.0,0.0,0.0,,0.0,1.0,0.0,0.0,,,,,,,,,,,,,,,,,,
/fighter/Artem-Lobov-73700,artem lobov,The Russian Hammer,11/08/1986,35.0,,Dublin,Ireland,"5'9""",146 lbs,SBG Ireland,Featherweight,13.0,4.0,2.0,7.0,,13.0,1.0,2.0,12.0,,The Russian Hammer,13.0,15.0,1.0,175.26,65.77,165.1,Southpaw,1986-08-11,3.52,41.0,4.82,50.0,0.39,25.0,52.0,0.0
,artenus young,,,,,,,,,,,,,,,,,,,,,,10.0,12.0,0.0,,92.99,,,,0.0,0.0,0.0,0.0,0.0,0.0,0.0,0.0
/fighter/Arthur-Estrazulas-66302,arthur estrazulas,,23/06/1989,32.0,,"Porto Alegre, Rio Grande do Sul",Brazil,"5'10""",155 lbs,Kings MMA,Lightweight,12.0,2.0,8.0,2.0,,12.0,0.0,2.0,3.0,,,,,,,,,,,,,,,,,,
,artur oumakhanov,,,,,,,,,,,,,,,,,,,,,,9.0,6.0,0.0,170.18,69.85,,Orthodox,1979-02-27,1.2,33.0,1.67,82.0,3.0,75.0,33.0,0.0
/fighter/Artur-Pronin-191601,artur pronin,Predator,21/05/1988,33.0,,Moscow,Russia,"6'0""",185 lbs,R.O.D.,Middleweight,17.0,7.0,9.0,1.0,,17.0,4.0,2.0,0.0,,,,,,,,,,,,,,,,,,
/fighter/Arturo-Rivas-48596,arturo rivas,Turtle,04/02/1981,40.0,,"Moorpark, California",United States,"6'4""",259 lbs,Elite MMA,Heavyweight,6.0,2.0,1.0,3.0,,6.0,0.0,1.0,1.0,,,,,,,,,,,,,,,,,,
/fighter/Arunas-Andriuskevicus-16572,arunas andriuskevicus,,,,,,Lithuania,"6'2""",205 lbs,London Shootfighters,Light Heavyweight,15.0,11.0,3.0,1.0,,15.0,1.0,1.0,2.0,,,,,,,,,,,,,,,,,,
/fighter/Asael-Adjoudj-315075,asael adjoudj,The Sultan,,,,,France,"6'0""",145 lbs,SBG Ireland,Featherweight,1.0,1.0,0.0,0.0,,1.0,0.0,0.0,1.0,,,,,,,,,,,,,,,,,,
,asbel cancio,,,,,,,,,,,,,,,,,,,,,,0.0,1.0,0.0,177.8,102.06,,,,0.0,0.0,0.0,0.0,0.0,0.0,0.0,0.0
/fighter/Asef-Askar-248131,asef askar,,,,,"Orland Park, Illinois",United States,"5'8""",145 lbs,Midwest Training Center,Featherweight,2.0,0.0,2.0,0.0,,2.0,0.0,0.0,0.0,,,,,,,,,,,,,,,,,,
/fighter/Ash-Griffiths-76283,ash griffiths,,,,,"Hartlepool, County Durham",England,"0'0""",155 lbs,Pancrase Gym Sweden,Lightweight,4.0,3.0,1.0,0.0,,4.0,3.0,3.0,0.0,,,,,,,,,,,,,,,,,,
/fighter/Asha-Roka-244895,asha roka,Knockout Queen,04/10/1998,22.0,,,India,"5'1""",105 lbs,,Atomweight,4.0,2.0,2.0,0.0,,4.0,0.0,1.0,1.0,,,,,,,,,,,,,,,,,,
,ashe bowman,,,,,,,,,,,,,,,,,,,,,The Archer,9.0,11.0,0.0,175.26,70.31,,,,2.43,42.0,4.86,57.0,0.0,0.0,0.0,0.0
,ashiek ajim,,,,,,,,,,,,,,,,,,,,,Peak Physique,6.0,2.0,0.0,172.72,61.23,180.34,Switch,1994-06-19,5.0,40.0,11.25,25.0,0.0,0.0,0.0,0.0
/fighter/Ashkan-Mokhtarian-144015,ashkan mokhtarian,The Assassin,18/09/1985,35.0,,"Sydney, New South Wales",Australia,"5'6""",125 lbs,Australian Top Team,Flyweight,13.0,6.0,6.0,1.0,,13.0,1.0,1.0,2.0,,The Assassin,13.0,3.0,0.0,167.64,56.7,170.18,Southpaw,1985-09-15,1.95,43.0,3.66,43.0,0.54,16.0,33.0,0.0
/fighter/Ashkan-Morvari-30918,ashkan morvari,Smashkan,03/03/1978,43.0,,"Richfield, Minnesota",United States,"5'6""",155 lbs,American Top Team Savage,Lightweight,15.0,5.0,6.0,3.0,1.0,15.0,0.0,4.0,4.0,0.0,,,,,,,,,,,,,,,,,
/fighter/Ashlee-EvansSmith-75021,ashlee evans-smith,Rebel Girl,09/07/1987,34.0,,"Lake Forest, California",United States,"5'8""",135 lbs,Reign MMA,Bantamweight,6.0,3.0,0.0,3.0,,6.0,0.0,2.0,3.0,,Rebel Girl,6.0,6.0,0.0,172.72,61.23,170.18,Orthodox,1987-07-09,4.03,34.0,4.59,53.0,0.95,22.0,50.0,0.0
/fighter/Ashleigh-Grimshaw-7862,ashleigh grimshaw,The White Wolf,28/01/1982,39.0,,London,England,"5'8""",145 lbs,Team Titan,Featherweight,20.0,9.0,9.0,2.0,,20.0,5.0,2.0,5.0,,,,,,,,,,,,,,,,,,
/fighter/Ashley-Cummins-65896,ashley cummins,Smashley,02/08/1987,34.0,,"St. Louis, Missouri",United States,"5'3""",105 lbs,Wolves Den MMA,Atomweight,7.0,0.0,2.0,5.0,,7.0,1.0,1.0,4.0,,,,,,,,,,,,,,,,,,
/fighter/Ashley-Reece-121737,ashley reece,The Beast,08/09/1988,32.0,,"Stoke-on-Trent, Staffordshire",England,"5'10""",170 lbs,HAMMA,Welterweight,8.0,4.0,1.0,3.0,,8.0,0.0,0.0,2.0,,,,,,,,,,,,,,,,,,
/fighter/Ashley-Yoder-39298,ashley yoder,The Spider Monkey,20/10/1987,33.0,,"Temecula, California",United States,"5'7""",115 lbs,Team Quest,Strawweight,8.0,0.0,4.0,4.0,,8.0,0.0,0.0,8.0,,SpiderMonkey,8.0,9.0,0.0,170.18,52.16,175.26,Southpaw,1987-10-20,3.42,39.0,4.13,47.0,1.09,27.0,66.0,0.6
/fighter/Ashraf-Fauzi-340557,ashraf fauzi,,,,,,Singapore,"0'0""",145 lbs,Juggernaut Fight Club,Featherweight,0.0,0.0,0.0,0.0,,0.0,1.0,0.0,0.0,,,,,,,,,,,,,,,,,,
,asjabharan,,,,,,,,,,,,,,,,,,,,,,7.0,6.0,0.0,167.64,61.23,,,,0.0,0.0,0.0,0.0,0.0,0.0,0.0,0.0
,askar askar,,,,,,,,,,,,,,,,,,,,,AK-47,11.0,1.0,0.0,170.18,65.77,175.26,Orthodox,1994-08-19,0.0,0.0,0.0,0.0,0.0,0.0,0.0,0.0
/fighter/Askar-Askarov-149255,askar askarov,Bullet,09/10/1992,28.0,,"Khasavyurt, Dagestan",Russia,"5'5""",125 lbs,Fighting Eagle,Flyweight,14.0,4.0,7.0,3.0,,14.0,0.0,0.0,0.0,,Bullet,14.0,1.0,1.0,167.64,56.7,170.18,Orthodox,1992-10-09,3.05,54.0,2.8,57.0,2.6,24.0,66.0,0.4
,askar mozharov,,,,,,,,,,,,,,,,,,,,,,19.0,13.0,0.0,190.5,92.99,187.96,Orthodox,1994-10-26,0.43,18.0,4.07,13.0,0.0,0.0,33.0,0.0
/fighter/Aspen-Ladd-141393,aspen ladd,,01/03/1995,26.0,,"Folsom, California",United States,"5'6""",135 lbs,MMAGOLD Fight Team,Bantamweight,9.0,6.0,1.0,2.0,,9.0,1.0,0.0,0.0,,,9.0,3.0,0.0,167.64,61.23,167.64,Orthodox,1995-03-01,3.78,47.0,4.65,47.0,1.56,47.0,62.0,0.6
/fighter/Asraful-Islam-269887,asraful islam,Warrior,,,,Dhaka,Bangladesh,"0'0""",135 lbs,Warriors Academy,Bantamweight,0.0,0.0,0.0,0.0,,0.0,0.0,0.0,2.0,,,,,,,,,,,,,,,,,,
/fighter/Assaf-Batan-267213,assaf batan,,,,,Holon,Israel,"0'0""",155 lbs,,Lightweight,1.0,0.0,1.0,0.0,,1.0,0.0,0.0,0.0,,,,,,,,,,,,,,,,,,
,assu almabayev,,,,,,,,,,,,,,,,,,,,,Zulfikar,18.0,2.0,0.0,162.56,56.7,165.1,Orthodox,1994-01-25,3.18,65.0,0.49,77.0,3.67,40.0,0.0,3.7
/fighter/Assuerio-Silva-1587,assuerio silva,,18/06/1974,47.0,,"Curitiba, Parana",Brazil,"6'1""",235 lbs,,Heavyweight,16.0,7.0,7.0,2.0,,16.0,3.0,2.0,3.0,,,16.0,8.0,0.0,177.8,109.32,,Orthodox,1974-06-18,1.42,46.0,4.2,54.0,2.66,34.0,25.0,1.8
,asu almabayev,,,,,,,,,,,,,,,,,,,,,,,,,,,,,,,,,,,,,
/fighter/Asuka-Tsubaki-302773,asuka tsubaki,,,,,,Japan,"0'0""",145 lbs,Trident Gym,Featherweight,2.0,1.0,0.0,1.0,,2.0,1.0,2.0,0.0,,,,,,,,,,,,,,,,,,
/fighter/Atanas-Djambazov-27150,atanas djambazov,,,,,Pomorie,Bulgaria,"6'0""",204 lbs,,Light Heavyweight,24.0,12.0,12.0,0.0,,24.0,1.0,2.0,2.0,,,,,,,,,,,,,,,,,,
,atsushi yamamoto,,,,,,,,,,,,,,,,,,,,,,19.0,11.0,3.0,167.64,63.05,,Orthodox,1980-10-02,1.97,39.0,1.27,70.0,1.12,33.0,100.0,0.0
/fighter/Attila-Vegh-33506,attila vegh,Pumukli,09/08/1985,36.0,,Bratislava,Slovakia,"6'2""",205 lbs,American Top Team,Light Heavyweight,33.0,14.0,9.0,10.0,,33.0,3.0,1.0,5.0,,,,,,,,,,,,,,,,,,
/fighter/Audreylaura-Boniface-Raphael-215185,audreylaura boniface raphael,Ice Comet,27/12/1989,31.0,,"Papar, Sabah",Malaysia,"5'0""",110 lbs,Borneo Tribal Squad,Strawweight,0.0,0.0,0.0,0.0,,0.0,4.0,0.0,0.0,,,,,,,,,,,,,,,,,,
/fighter/Augusto-Mendes-160663,augusto mendes,Tanquinho,03/03/1983,38.0,,"Rio de Janeiro, Rio de Janeiro",Brazil,"5'6""",135 lbs,Soul Fighters BJJ,Bantamweight,6.0,1.0,4.0,1.0,,6.0,1.0,0.0,2.0,,Tanquinho,6.0,2.0,0.0,167.64,61.23,165.1,Orthodox,1983-03-03,2.42,34.0,3.91,56.0,1.75,33.0,80.0,0.0
/fighter/Augusto-Montano-41494,augusto montano,Dodger,25/10/1984,36.0,,Mexico City,Mexico,"6'1""",170 lbs,Bonebreakers Team,Welterweight,15.0,10.0,5.0,0.0,,15.0,1.0,0.0,2.0,,Dodger,15.0,3.0,0.0,185.42,77.11,185.42,Orthodox,1984-10-25,3.46,46.0,2.66,56.0,0.0,0.0,66.0,0.0
/fighter/Augusto-Sakai-87303,augusto sakai,,19/05/1991,30.0,,"Curitiba, Parana",Brazil,"6'4""",256 lbs,Gile Ribeiro Team,Heavyweight,15.0,11.0,0.0,4.0,,15.0,2.0,0.0,1.0,,,16.0,5.0,1.0,190.5,120.2,195.58,Orthodox,1991-05-09,4.6,49.0,3.83,48.0,0.23,40.0,56.0,0.0
/fighter/Aung-Kyaw-Kyaw-219857,aung kyaw kyaw,,,,,,Myanmar,"5'7""",135 lbs,,Bantamweight,1.0,1.0,0.0,0.0,,1.0,1.0,0.0,0.0,,,,,,,,,,,,,,,,,,
/fighter/Aung-La-N-Sang-13029,aung la n sang,The Burmese Python,21/05/1985,36.0,,"Myitkyina, Kachin",Myanmar,"6'1""",205 lbs,Sanford MMA,Light Heavyweight,27.0,13.0,12.0,2.0,,27.0,4.0,3.0,5.0,,,,,,,,,,,,,,,,,,
/fighter/Aung-Oo-Htet-259685,aung oo htet,,,,,,Myanmar,"0'0""",135 lbs,,Bantamweight,0.0,0.0,0.0,0.0,,0.0,1.0,0.0,0.0,,,,,,,,,,,,,,,,,,
,aurelijus kerpe,,,,,,,,,,,,,,,,,,,,,,11.0,22.0,0.0,,,,Orthodox,,1.26,16.0,8.21,31.0,0.0,0.0,0.0,0.0
,austen lane,,,,,,,,,,,,,,,,,,,,,,12.0,4.0,0.0,198.12,111.13,203.2,Orthodox,1987-11-09,4.48,47.0,2.85,48.0,0.0,0.0,0.0,0.0
/fighter/Austin-Arnett-57016,austin arnett,The Golden Boy,22/10/1991,29.0,,"Clarkston, Washington",United States,"6'0""",145 lbs,Sikjitsu,Featherweight,17.0,8.0,5.0,4.0,,17.0,1.0,1.0,5.0,,,16.0,6.0,0.0,182.88,65.77,182.88,Orthodox,1991-10-22,4.52,41.0,6.38,62.0,0.44,18.0,57.0,0.2
/fighter/Austin-Clem-303227,austin clem,The King,05/12/1992,28.0,,"Springfield, Missouri",United States,"6'0""",155 lbs,Team Fusion Jiu-Jitsu & MMA,Lightweight,4.0,0.0,3.0,1.0,,4.0,2.0,0.0,0.0,,,,,,,,,,,,,,,,,,
/fighter/Austin-Hubbard-191483,austin hubbard,Thud,22/12/1991,29.0,,"Denver, Colorado",United States,"5'10""",155 lbs,Elevation Fight Team,Lightweight,13.0,5.0,2.0,6.0,,13.0,0.0,2.0,3.0,,Thud,16.0,7.0,0.0,177.8,70.31,180.34,Orthodox,1991-12-22,3.83,46.0,3.37,56.0,1.55,52.0,63.0,0.0
/fighter/Austin-Lingo-236341,austin lingo,Lights Out,10/07/1994,27.0,,"Mesquite, Texas",United States,"5'10""",145 lbs,Fortis MMA,Featherweight,8.0,3.0,2.0,3.0,,8.0,0.0,0.0,1.0,,Lights Out,9.0,3.0,0.0,177.8,65.77,177.8,Orthodox,1994-07-10,3.86,37.0,4.86,57.0,0.43,66.0,75.0,0.0
/fighter/Austin-Lyons-57168,austin lyons,,08/03/1988,33.0,,"Memphis, Tennessee",United States,"5'9""",155 lbs,Memphis Judo & Jiu-Jitsu,Lightweight,13.0,2.0,7.0,4.0,,13.0,3.0,3.0,0.0,,,,,,,,,,,,,,,,,,
/fighter/Austin-Springer-41861,austin springer,,12/05/1987,34.0,,"Vancouver, Washington",United States,"5'8""",151 lbs,Vancouver Elite Martial Arts,Lightweight,12.0,7.0,2.0,3.0,,12.0,1.0,2.0,1.0,,,12.0,4.0,0.0,172.72,65.77,180.34,Orthodox,1987-05-12,3.54,57.0,3.15,41.0,3.37,40.0,100.0,0.8
,austin tweedy,,,,,,,,,,,,,,,,,,,,,,8.0,2.0,0.0,175.26,70.31,,Orthodox,1990-09-25,4.29,66.0,6.43,0.0,0.0,0.0,0.0,0.0
/fighter/Austin-Vanderford-206919,austin vanderford,The Gentleman,21/03/1990,31.0,,"Portland, Oregon",United States,"5'11""",185 lbs,Gracie Barra Portland,Middleweight,11.0,3.0,3.0,5.0,,11.0,0.0,0.0,0.0,,AK-47,4.0,0.0,0.0,180.34,77.11,,Orthodox,1990-03-21,3.9,52.0,5.19,45.0,0.0,0.0,100.0,1.9
/fighter/Ava-Knight-345807,ava knight,Lady of Boxing,15/08/1988,32.0,,"Chico, California",United States,"5'4""",115 lbs,Xtreme Couture,Strawweight,1.0,1.0,0.0,0.0,,1.0,0.0,1.0,0.0,,,,,,,,,,,,,,,,,,
/fighter/Avery-McPhatter-67198,avery mcphatter,The Irish Hurricane,07/02/1989,32.0,,"Brandon, Florida",United States,"6'2""",196 lbs,XFC,Light Heavyweight,9.0,2.0,5.0,2.0,,9.0,5.0,3.0,3.0,,,,,,,,,,,,,,,,,,
/fighter/Avi-Baron-237111,avi baron,,25/07/1983,38.0,,Haifa,Israel,"5'8""",185 lbs,,Middleweight,0.0,0.0,0.0,0.0,,0.0,1.0,0.0,0.0,,,,,,,,,,,,,,,,,,
/fighter/Aviv-Gozali-306577,aviv gozali,The King,29/11/2000,20.0,,Bat Yam,Israel,"6'0""",155 lbs,,Lightweight,6.0,0.0,6.0,0.0,,6.0,0.0,0.0,0.0,,,,,,,,,,,,,,,,,,
/fighter/Aya-Saied-Saber-117541,aya saied saber,Sheklesa,20/03/1991,30.0,,Giza,Egypt,"5'7""",125 lbs,Egyptian Top Team,Flyweight,3.0,1.0,1.0,1.0,,3.0,3.0,4.0,1.0,,,,,,,,,,,,,,,,,,
/fighter/Ayaka-Miura-164697,ayaka miura,,17/09/1990,30.0,,Saitama,Japan,"5'2""",115 lbs,Tribe Tokyo MMA,Strawweight,11.0,0.0,7.0,4.0,,11.0,2.0,0.0,1.0,,,,,,,,,,,,,,,,,,
/fighter/Aymard-Guih-125233,aymard guih,Barakuda,29/04/1988,33.0,,Abidjan,Cote d'Ivoire,"5'9""",155 lbs,Team MFC,Lightweight,15.0,3.0,6.0,6.0,,15.0,1.0,4.0,6.0,,,,,,,,,,,,,,,,,,
/fighter/Aysia-Cortez-207637,aysia cortez,The Savage,,,,"Lathrop, California",United States,"5'4""",125 lbs,Cortez Martial Arts,Flyweight,0.0,0.0,0.0,0.0,,0.0,0.0,0.0,0.0,,,,,,,,,,,,,,,,,,
/fighter/Azamat-Gashimov-71175,azamat gashimov,Tough Guy,07/04/1990,31.0,,Dagestan,Russia,"5'9""",135 lbs,Jackson-Wink MMA,Bantamweight,8.0,2.0,4.0,2.0,,8.0,2.0,1.0,0.0,,,8.0,3.0,0.0,167.64,56.7,,Orthodox,1990-04-07,1.24,21.0,4.75,53.0,1.69,25.0,0.0,0.0
,azamat murzakanov,,,,,,,,,,,,,,,,,,,,,The Professional,13.0,0.0,0.0,177.8,92.99,180.34,Southpaw,1989-04-12,4.57,57.0,3.12,57.0,0.75,16.0,83.0,0.0
,azat maksum,,,,,,,,,,,,,,,,,,,,,Qazaq,17.0,0.0,0.0,170.18,56.7,177.8,Southpaw,1995-02-02,3.07,24.0,5.4,61.0,2.0,18.0,0.0,0.0
/fighter/Aziz-Pahrudinov-73530,aziz pahrudinov,,28/06/1989,32.0,,"Buynaksk, Dagestan",Russia,"5'10""",155 lbs,K Dojo Warrior Tribe,Lightweight,22.0,7.0,14.0,1.0,,22.0,0.0,0.0,1.0,,,,,,,,,,,,,,,,,,
/fighter/Azunna-Anyanwu-68352,azunna anyanwu,Zu the 8th Wonder,05/08/1981,40.0,,"Philadelphia, Pennsylvania",United States,"6'1""",251 lbs,Renzo Gracie Philly,Heavyweight,15.0,9.0,2.0,4.0,,15.0,3.0,0.0,3.0,,Zulu,14.0,5.0,0.0,185.42,113.85,,Orthodox,1981-08-05,2.47,42.0,2.47,69.0,0.65,100.0,0.0,0.0
/fighter/BJ-Ferguson-31949,b.j. ferguson,The Boogeyman,28/05/1981,40.0,,"Louisville, Kentucky",United States,"5'8""",140 lbs,All American MMA,Featherweight,11.0,3.0,5.0,3.0,,11.0,2.0,1.0,3.0,,,,,,,,,,,,,,,,,,
/fighter/BJ-Penn-1307,b.j. penn,The Prodigy,13/12/1978,42.0,,"Hilo, Hawaii",United States,"5'9""",145 lbs,BJ Penn's MMA,Featherweight,16.0,7.0,6.0,3.0,,16.0,4.0,1.0,9.0,,,,,,,,,,,,,,,,,,
/fighter/Bae-Yong-Kwon-46855,bae yong kwon,Serial Killer,17/03/1981,40.0,,"Buan, Jeollabuk-do",South Korea,"5'9""",145 lbs,Team Posse,Featherweight,9.0,3.0,3.0,3.0,,9.0,1.0,0.0,3.0,,,,,,,,,,,,,,,,,,
,baergeng jieleyisi,,,,,,,,,,,,,,,,,,,,,,12.0,4.0,0.0,175.26,61.23,180.34,Orthodox,1995-11-24,2.53,38.0,3.87,45.0,0.0,0.0,0.0,0.0
,bahatebole batebolati,,,,,,,,,,,,,,,,,,,,,Lion King,8.0,1.0,1.0,180.34,70.31,180.34,Southpaw,1997-09-12,4.34,47.0,4.62,64.0,2.04,100.0,100.0,0.0
/fighter/Bakhtiyar-Abbasov-72357,bakhtiyar abbasov,,30/11/1985,35.0,,Baku,Azerbaijan,"5'10""",185 lbs,Gabala Sports Club,Middleweight,18.0,8.0,7.0,3.0,,18.0,3.0,1.0,1.0,,,,,,,,,,,,,,,,,,
/fighter/Bala-Shetty-170705,bala shetty,The Tulunad Warrior,,,,,India,"0'0""",170 lbs,,Welterweight,0.0,0.0,0.0,0.0,,0.0,2.0,1.0,0.0,,,,,,,,,,,,,,,,,,
,balajin,,,,,,,,,,,,,,,,,,,,,The Snow Leopard,23.0,4.0,0.0,175.26,65.77,182.88,Orthodox,1992-03-31,1.4,33.0,2.73,50.0,2.0,20.0,66.0,0.0
/fighter/Bam-Morris-78350,bam morris,Jungle King,24/10/1991,29.0,,Phuket,Thailand,"6'0""",185 lbs,Tiger Muay Thai Phuket,Middleweight,5.0,3.0,2.0,0.0,,5.0,1.0,2.0,2.0,,,,,,,,,,,,,,,,,,
/fighter/Bao-Quach-494,bao quach,,04/09/1979,41.0,,"Irvine, California",United States,"5'3""",144 lbs,Rounders MMA,Featherweight,19.0,5.0,4.0,10.0,,19.0,4.0,3.0,3.0,,,19.0,10.0,1.0,160.02,65.77,,Orthodox,1979-09-04,0.0,0.0,0.0,0.0,0.0,0.0,0.0,0.0
/fighter/Barb-Honchak-41484,barb honchak,Little Warrior,30/08/1979,41.0,,"St. Louis, Missouri",United States,"5'4""",124 lbs,Miletich Fighting Systems,Flyweight,10.0,1.0,2.0,7.0,,10.0,1.0,0.0,3.0,,Little Warrior,10.0,4.0,0.0,162.56,56.7,165.1,Orthodox,1979-08-30,4.04,30.0,4.67,66.0,0.0,0.0,0.0,1.3
/fighter/Bart-Palaszewski-3496,bart palaszewski,Bartimus,30/05/1983,38.0,,"Crystal Lake, Illinois",United States,"5'9""",145 lbs,Team Curran,Featherweight,36.0,18.0,10.0,8.0,,36.0,2.0,3.0,12.0,,Bartimus,36.0,17.0,0.0,175.26,65.77,177.8,Orthodox,1983-05-30,2.67,32.0,3.97,57.0,0.65,31.0,53.0,0.5
/fighter/Bartosz-Fabinski-87101,bartosz fabinski,The Butcher,26/04/1986,35.0,,Warsaw,Poland,"6'0""",185 lbs,WCA Fight Team,Middleweight,15.0,8.0,0.0,7.0,,15.0,0.0,4.0,1.0,,The Butcher,15.0,5.0,0.0,182.88,77.11,190.5,Orthodox,1986-04-26,2.23,68.0,1.46,51.0,7.1,70.0,80.0,0.0
,baru harn,,,,,,,,,,,,,,,,,,,,,Seiryu,1.0,2.0,0.0,,120.2,,,,0.0,0.0,0.0,0.0,0.0,0.0,0.0,0.0
/fighter/Bas-Rutten-214,bas rutten,El Guapo,24/02/1965,56.0,,Eindhoven,Netherlands,"6'1""",205 lbs,,Light Heavyweight,28.0,11.0,14.0,4.0,,28.0,0.0,3.0,1.0,,El Guapo,28.0,4.0,1.0,185.42,92.99,,Orthodox,1965-02-24,5.59,61.0,2.06,79.0,0.0,0.0,0.0,0.0
/fighter/Bashir-Ahmad-99781,bashir ahmad,Somchai,12/10/1982,38.0,,"Lahore, Punjab",Pakistan,"5'7""",145 lbs,Team Quest Thailand,Featherweight,4.0,0.0,3.0,1.0,,4.0,2.0,1.0,0.0,,,,,,,,,,,,,,,,,,
,bassil hafez,,,,,,,,,,,,,,,,,,,,,The Habibi,8.0,4.0,1.0,180.34,77.11,182.88,Orthodox,1992-01-31,2.13,25.0,5.53,39.0,3.0,15.0,50.0,0.0
,batgerel danaa,,,,,,,,,,,,,,,,,,,,,Storm,12.0,5.0,0.0,170.18,61.23,177.8,Orthodox,1989-07-04,5.38,36.0,4.21,47.0,0.52,50.0,62.0,0.0
/fighter/Batsumberel-Dagvadorj-271287,batsumberel dagvadorj,The Mongolian Falcon,07/04/1987,34.0,,Bayankhongor,Mongolia,"5'9""",155 lbs,Border Patrol Elite Team,Lightweight,7.0,4.0,2.0,1.0,,7.0,0.0,1.0,1.0,,,,,,,,,,,,,,,,,,
/fighter/Bayarmaa-Munkhgerel-194759,bayarmaa munkhgerel,,,,,,Mongolia,"5'3""",115 lbs,,Strawweight,1.0,0.0,0.0,1.0,,1.0,3.0,1.0,0.0,,,,,,,,,,,,,,,,,,
,bazigit atajev,,,,,,,,,,,,,,,,,,,,,Volk,17.0,1.0,0.0,185.42,104.33,,Orthodox,,0.87,41.0,3.14,49.0,1.0,33.0,0.0,0.0
/fighter/Bea-Malecki-271931,bea malecki,Bad News Barbie,23/08/1991,29.0,,Stockholm,Sweden,"5'11""",145 lbs,Fortis MMA,Featherweight,4.0,1.0,2.0,1.0,,4.0,0.0,0.0,0.0,,,4.0,1.0,0.0,175.26,61.23,187.96,Orthodox,1991-08-23,6.84,46.0,6.96,62.0,0.0,0.0,78.0,1.1
/fighter/Beau-Hamilton-46526,beau hamilton,The Show,08/09/1987,33.0,,"Stockton, California",United States,"5'5""",155 lbs,Team Do Somethin',Lightweight,3.0,2.0,0.0,1.0,,3.0,6.0,2.0,1.0,,,,,,,,,,,,,,,,,,
/fighter/Beau-Tribolet-40827,beau tribolet,,,,,"Tucson, Arizona",United States,"6'1""",204 lbs,,Light Heavyweight,7.0,3.0,4.0,0.0,,7.0,2.0,1.0,0.0,,,,,,,,,,,,,,,,,,
/fighter/Bec-Rawlings-84964,bec rawlings,Rowdy,11/02/1989,32.0,,"Brisbane, Queensland",Australia,"5'6""",116 lbs,Alliance MMA,Strawweight,8.0,1.0,4.0,3.0,,8.0,2.0,1.0,6.0,,Rowdy,7.0,8.0,0.0,167.64,56.7,162.56,Orthodox,1989-02-11,4.48,42.0,5.66,57.0,0.71,40.0,68.0,0.4
/fighter/Behrang-Yousefi-80072,behrang yousefi,Brown Sugar,17/09/1987,33.0,,Bandar Abbas,Iran,"6'0""",145 lbs,Kamikaze Punishment,Featherweight,8.0,1.0,5.0,2.0,,8.0,1.0,3.0,3.0,,,,,,,,,,,,,,,,,,
,bekzat almakhan,,,,,,,,,,,,,,,,,,,,,,,,,,,,,,,,,,,,,
/fighter/Belal-Muhammad-108315,belal muhammad,Remember the Name,09/07/1988,33.0,,"Chicago, Illinois",United States,"5'10""",170 lbs,Roufusport,Welterweight,19.0,4.0,1.0,14.0,,19.0,1.0,0.0,2.0,,Remember the Name,23.0,3.0,0.0,180.34,77.11,182.88,Orthodox,1988-07-09,4.55,43.0,3.64,57.0,1.98,35.0,93.0,0.2
/fighter/Ben-Alloway-60790,ben alloway,Benny Blanco,19/02/1981,40.0,,"Gold Coast, Queensland",Australia,"5'10""",170 lbs,BBA Mixed Martial Arts,Welterweight,18.0,8.0,6.0,4.0,,18.0,2.0,5.0,2.0,,Blanco,18.0,8.0,0.0,180.34,77.11,193.04,Orthodox,1981-02-19,1.28,49.0,1.9,59.0,0.62,50.0,26.0,0.0
/fighter/Ben-Askren-42390,ben askren,Funky,18/07/1984,37.0,,"Phoenix, Arizona",United States,"5'10""",170 lbs,Roufusport,Welterweight,19.0,6.0,6.0,7.0,,19.0,1.0,1.0,0.0,,Funky,19.0,2.0,0.0,180.34,77.11,185.42,Orthodox,1984-07-18,3.64,49.0,5.66,36.0,4.33,55.0,0.0,0.9
/fighter/Ben-Beebe-19473,ben beebe,,,,,"Temecula, California",United States,"6'3""",265 lbs,Fight Lab,Heavyweight,7.0,5.0,0.0,2.0,,7.0,4.0,0.0,1.0,,,,,,,,,,,,,,,,,,
/fighter/Ben-Brewer-85568,ben brewer,The Ruler,,,,"Nashville, Tennessee",United States,"6'1""",170 lbs,Nashville MMA,Welterweight,11.0,1.0,7.0,3.0,,11.0,3.0,2.0,0.0,,,,,,,,,,,,,,,,,,
/fighter/Ben-Cohen-350519,ben cohen,,,,,,Israel,"0'0""",135 lbs,,Bantamweight,1.0,0.0,1.0,0.0,,1.0,0.0,0.0,0.0,,,,,,,,,,,,,,,,,,
/fighter/Ben-Crowder-17018,ben crowder,,22/07/1986,35.0,,"Des Moines, Iowa",United States,"5'11""",185 lbs,Des Moines MMA Academy,Middleweight,10.0,5.0,5.0,0.0,0.0,10.0,5.0,6.0,0.0,1.0,,,,,,,,,,,,,,,,,
/fighter/Ben-Earwood-266,ben earwood,,,,,"Bettendorf, Iowa",United States,"5'8""",170 lbs,Miletich Martial Arts,Welterweight,12.0,2.0,6.0,2.0,2.0,12.0,1.0,0.0,2.0,0.0,,12.0,3.0,0.0,172.72,77.11,,Orthodox,,0.5,55.0,0.2,33.0,3.0,100.0,0.0,0.0
/fighter/Ben-Greer-8626,ben greer,,24/10/1984,36.0,,"Vancouver, British Columbia",Canada,"0'0""",143 lbs,Universal MMA,Featherweight,11.0,1.0,7.0,3.0,,11.0,3.0,2.0,0.0,,,,,,,,,,,,,,,,,,
,ben holscher,,,,,,,,,,,,,,,,,,,,,The Teacher,4.0,0.0,0.0,180.34,70.31,,,,0.0,0.0,0.0,0.0,0.0,0.0,0.0,0.0
,ben jones,,,,,,,,,,,,,,,,,,,,,Blitzkrieg,4.0,4.0,0.0,,83.91,,,,0.0,0.0,0.0,0.0,0.0,0.0,0.0,0.0
/fighter/Ben-Lagman-34936,ben lagman,Bad News,04/09/1986,34.0,,"Macomb Township, Michigan",United States,"6'2""",170 lbs,Martial Arts Unlimited,Welterweight,6.0,3.0,3.0,0.0,,6.0,2.0,3.0,0.0,,Bad News,6.0,5.0,0.0,187.96,83.91,,,,0.0,0.0,0.0,0.0,0.0,0.0,0.0,0.0
/fighter/Ben-Moa-251901,ben moa,,22/04/1981,40.0,,,United States,"0'0""",246 lbs,,Heavyweight,4.0,4.0,0.0,0.0,,4.0,0.0,1.0,0.0,,,,,,,,,,,,,,,,,,
/fighter/Ben-Nguyen-8183,ben nguyen,10,03/08/1988,33.0,,"Sioux Falls, South Dakota",United States,"5'5""",125 lbs,Integrated MMA,Flyweight,16.0,8.0,5.0,3.0,,16.0,6.0,2.0,1.0,,Ten,16.0,8.0,0.0,165.1,56.7,165.1,Switch,1988-08-03,3.51,40.0,3.01,59.0,0.25,33.0,63.0,1.0
/fighter/Ben-Parpart-70276,ben parpart,Baby Face,,,,"Boyce, Louisiana",United States,"5'8""",135 lbs,Bull's Gym,Bantamweight,3.0,1.0,2.0,0.0,,3.0,0.0,4.0,0.0,,,,,,,,,,,,,,,,,,
/fighter/Ben-Reiter-83786,ben reiter,The Hunter,27/06/1987,34.0,,"Coram, New York",United States,"6'0""",185 lbs,Jackson-Wink MMA,Middleweight,17.0,7.0,2.0,8.0,,17.0,1.0,1.0,1.0,,The Hunter,17.0,2.0,1.0,190.5,83.91,,,,1.8,46.0,1.53,54.0,7.0,43.0,0.0,0.0
/fighter/Ben-Rothwell-2262,ben rothwell,,17/10/1981,39.0,,"Kenosha, Wisconsin",United States,"6'4""",265 lbs,Rothwell MMA,Heavyweight,39.0,28.0,7.0,4.0,,39.0,4.0,2.0,7.0,,,39.0,14.0,0.0,193.04,120.2,198.12,Orthodox,1981-10-17,3.71,42.0,4.63,47.0,0.68,34.0,70.0,0.4
/fighter/Ben-Royle-84611,ben royle,,,,,"Manchester, Greater Manchester",England,"0'0""",145 lbs,Phuket Top Team,Featherweight,5.0,1.0,3.0,1.0,,5.0,0.0,1.0,0.0,,,,,,,,,,,,,,,,,,
/fighter/Ben-Saunders-10339,ben saunders,Killa B,13/04/1983,38.0,,"Orlando, Florida",United States,"6'3""",170 lbs,American Top Team Orlando,Welterweight,23.0,11.0,6.0,6.0,,23.0,9.0,1.0,3.0,,Killa B,22.0,13.0,2.0,187.96,77.11,195.58,Orthodox,1983-04-13,3.23,50.0,3.58,51.0,0.2,40.0,66.0,1.3
/fighter/Ben-Sosoli-125617,ben sosoli,Combat Wombat,10/12/1989,31.0,,"Melbourne, Victoria",Australia,"6'0""",264 lbs,Resilience Training Centre,Heavyweight,7.0,6.0,0.0,1.0,,7.0,1.0,0.0,2.0,,Combat Wombat,7.0,3.0,0.0,182.88,120.2,182.88,Southpaw,1989-12-10,2.31,31.0,4.3,47.0,0.0,0.0,0.0,0.0
/fighter/Ben-Wall-78164,ben wall,Manimal,25/03/1989,32.0,,"Brisbane, Queensland",Australia,"5'10""",154 lbs,Alliance MMA,Lightweight,10.0,0.0,4.0,6.0,,10.0,4.0,0.0,4.0,,Manimal,8.0,7.0,1.0,177.8,70.31,,Orthodox,1989-03-25,1.47,29.0,8.53,29.0,0.0,0.0,100.0,0.0
,benardo sopaj,,,,,,,,,,,,,,,,,,,,,,,,,,,,,,,,,,,,,
,bendy casimir,,,,,,,,,,,,,,,,,,,,,,20.0,14.0,2.0,165.1,65.77,,Southpaw,1980-06-10,0.74,27.0,3.42,54.0,0.0,0.0,100.0,0.0
/fighter/Benedict-Ang-152551,benedict ang,,02/04/1996,25.0,,,Singapore,"5'9""",145 lbs,Evolve MMA,Featherweight,3.0,2.0,0.0,1.0,,3.0,0.0,0.0,1.0,,,,,,,,,,,,,,,,,,
/fighter/Beneil-Dariush-56583,beneil dariush,,06/05/1989,32.0,,"Yorba Linda, California",United States,"5'10""",155 lbs,Kings MMA,Lightweight,21.0,5.0,8.0,8.0,,21.0,3.0,1.0,0.0,,,22.0,6.0,1.0,177.8,70.31,182.88,Southpaw,1989-05-06,3.78,48.0,2.65,57.0,1.9,34.0,80.0,0.9
/fighter/Benito-Lopez-122711,benito lopez,Golden Boy,06/04/1994,27.0,,"Oroville, California",United States,"5'10""",135 lbs,Team Alpha Male,Bantamweight,10.0,3.0,2.0,5.0,,10.0,0.0,1.0,0.0,,Golden Boy,10.0,2.0,0.0,177.8,61.23,185.42,Switch,1994-04-06,4.39,45.0,5.18,56.0,0.0,0.0,73.0,0.3
/fighter/Benjamin-Brander-112251,benjamin brander,El Skeletto,23/08/1987,33.0,,Zurich,Switzerland,"5'11""",155 lbs,360 Martial Arts,Lightweight,12.0,4.0,5.0,3.0,,12.0,1.0,4.0,3.0,,,,,,,,,,,,,,,,,,
/fighter/Benjamin-Wilhelm-67023,benjamin wilhelm,,,,,"Molokai, Hawaii",United States,"5'9""",170 lbs,Gracie Technics,Welterweight,5.0,0.0,5.0,0.0,,5.0,0.0,0.0,1.0,,,,,,,,,,,,,,,,,,
/fighter/Benji-Gomez-105101,benji gomez,The Brawler,13/12/1988,32.0,,"Oxnard, California",United States,"5'6""",125 lbs,Independent,Flyweight,9.0,2.0,0.0,7.0,,9.0,2.0,5.0,6.0,,,,,,,,,,,,,,,,,,
/fighter/Benji-Radach-2294,benji radach,The Razor,05/04/1979,42.0,,"Castlerock, Washington",United States,"5'10""",185 lbs,Reign MMA,Middleweight,21.0,17.0,1.0,3.0,,21.0,5.0,0.0,2.0,,Razor,21.0,7.0,0.0,177.8,83.91,,Orthodox,1979-04-05,2.62,49.0,2.31,51.0,1.06,41.0,71.0,0.4
,benny alloway,,,,,,,,,,,,,,,,,,,,,,,,,,,,,,,,,,,,,
/fighter/Benny-Madrid-47166,benny madrid,El Hijo,08/08/1980,41.0,,"Phoenix, Arizona",United States,"5'10""",160 lbs,Fight Ready,Welterweight,10.0,5.0,4.0,1.0,,10.0,1.0,0.0,2.0,,,,,,,,,,,,,,,,,,
,benoit saint denis,,,,,,,,,,,,,,,,,,,,,God of War,13.0,1.0,0.0,180.34,70.31,185.42,Southpaw,1995-12-18,5.53,52.0,5.2,44.0,4.55,36.0,66.0,1.4
/fighter/Benson-Henderson-20548,benson henderson,Smooth,16/11/1983,37.0,,"Glendale, Arizona",United States,"5'9""",170 lbs,MMA Lab,Welterweight,28.0,5.0,9.0,14.0,,28.0,2.0,2.0,6.0,,Smooth,24.0,7.0,0.0,175.26,77.11,177.8,Southpaw,1983-11-16,2.93,45.0,1.79,63.0,2.4,45.0,63.0,0.8
/fighter/Bentley-Syler-123973,bentley syler,Dr. Bolivia,22/12/1982,38.0,,Santa Cruz,Bolivia,"5'4""",125 lbs,American Top Team,Flyweight,5.0,2.0,2.0,1.0,,5.0,1.0,0.0,0.0,,Bolivia,5.0,1.0,0.0,162.56,56.7,,Orthodox,1982-12-22,1.3,18.0,1.73,79.0,0.0,0.0,75.0,0.0
/fighter/Bernard-Soriano-68319,bernard soriano,Burn / Hitman,,,,,Philippines,"5'8""",145 lbs,Round 1,Featherweight,3.0,1.0,2.0,0.0,,3.0,3.0,1.0,0.0,,,,,,,,,,,,,,,,,,
/fighter/Bernardo-Magalhaes-26495,bernardo magalhaes,Trekko,04/08/1981,40.0,,Rio de Janeiro,Brazil,"5'9""",155 lbs,TP Fight Team,Lightweight,13.0,1.0,2.0,10.0,,13.0,1.0,0.0,3.0,,Trekko,13.0,4.0,0.0,175.26,70.31,,Orthodox,1981-04-08,1.8,27.0,3.37,68.0,0.0,0.0,0.0,0.5
,bertrand amoussou,,,,,,,,,,,,,,,,,,,,,,1.0,1.0,0.0,172.72,86.18,,Orthodox,,6.75,39.0,2.01,83.0,0.0,0.0,0.0,0.0
/fighter/Besam-Yousef-32445,besam yousef,,25/03/1985,36.0,,Gothenburg,Sweden,"5'11""",170 lbs,Gladius MMA,Welterweight,7.0,2.0,4.0,1.0,,7.0,0.0,2.0,2.0,,,7.0,4.0,0.0,180.34,77.11,,Orthodox,1985-03-25,3.14,53.0,3.98,38.0,1.33,66.0,50.0,0.0
/fighter/Bethe-Correia-103069,bethe correia,Pitbull,22/06/1983,38.0,,"Campina Grande, Paraiba",Brazil,"5'4""",135 lbs,CM System,Bantamweight,11.0,2.0,0.0,9.0,,11.0,2.0,1.0,2.0,,Pitbull,11.0,6.0,1.0,165.1,61.23,162.56,Orthodox,1983-06-22,4.37,43.0,4.93,56.0,0.39,18.0,85.0,0.0
/fighter/Bevon-Lewis-211153,bevon lewis,The Extraordinary Gentleman,05/05/1991,30.0,,"Lawrenceville, Georgia",United States,"6'3""",185 lbs,Jackson-Wink MMA,Middleweight,7.0,3.0,0.0,4.0,,7.0,2.0,0.0,1.0,,,7.0,3.0,0.0,190.5,83.91,200.66,Orthodox,1991-05-05,3.73,43.0,2.67,54.0,0.0,0.0,66.0,0.0
,bharat kandare,,,,,,,,,,,,,,,,,,,,,Daring,5.0,3.0,0.0,170.18,61.23,182.88,Orthodox,1987-06-20,0.7,10.0,1.88,72.0,0.0,0.0,0.0,0.0
/fighter/Bharat-Khandare-86855,bharat khandare,Daring,20/06/1989,32.0,,"Bhagur, Maharashtra",India,"5'7""",145 lbs,Superhuman Gym,Featherweight,5.0,1.0,4.0,0.0,,5.0,0.0,3.0,0.0,,,,,,,,,,,,,,,,,,
/fighter/Bi-Nguyen-174715,bi nguyen,KillHer Bee,30/10/1989,31.0,,"Oakland, California",United States,"4'11""",105 lbs,Jackson-Wink MMA,Atomweight,6.0,1.0,0.0,5.0,,6.0,0.0,1.0,5.0,,,,,,,,,,,,,,,,,,
/fighter/Bibiano-Fernandes-11465,bibiano fernandes,The Flash,30/03/1980,41.0,,"Manaus, Amazonas",Brazil,"5'7""",145 lbs,AMC Pankration,Featherweight,24.0,2.0,9.0,12.0,1.0,24.0,1.0,0.0,3.0,0.0,,20.0,3.0,0.0,170.18,63.05,,Orthodox,1980-03-30,2.91,40.0,2.02,72.0,3.97,53.0,77.0,0.6
,bibulatov magomed,,,,,,,,,,,,,,,,,,,,,Chaborz,14.0,2.0,0.0,165.1,56.7,165.1,Orthodox,1988-08-22,3.6,51.0,1.83,52.0,2.85,40.0,75.0,0.0
/fighter/Biekemulati-Nulijiao-199409,biekemulati nulijiao,Murad,20/02/1996,25.0,,Tianjin,China,"5'8""",145 lbs,Da Cheng Wu Yi Gym,Featherweight,1.0,1.0,0.0,0.0,,1.0,1.0,0.0,0.0,,,,,,,,,,,,,,,,,,
/fighter/Bill-Albrecht-25664,bill albrecht,,,,,Oklahoma,United States,"6'2""",185 lbs,Luttrell-Yee MMA,Middleweight,23.0,2.0,19.0,2.0,,23.0,6.0,8.0,2.0,,,,,,,,,,,,,,,,,,
/fighter/Bill-Algeo-77441,bill algeo,Senor Perfecto,09/06/1989,32.0,,"State College, Pennsylvania",United States,"5'11""",146 lbs,Team Titan PA,Featherweight,14.0,3.0,6.0,5.0,,14.0,0.0,2.0,4.0,,Senor Perfecto,18.0,7.0,0.0,182.88,65.77,185.42,Switch,1989-06-09,6.11,52.0,4.41,47.0,0.89,46.0,56.0,0.1
,bill cooper,,,,,,,,,,,,,,,,,,,,,,2.0,1.0,0.0,,70.31,,,,0.0,0.0,0.0,0.0,0.0,0.0,0.0,0.0
,bill duvall,,,,,,,,,,,,,,,,,,,,,,1.0,2.0,0.0,187.96,83.91,,Southpaw,,0.0,0.0,2.4,40.0,0.0,0.0,0.0,0.0
/fighter/Bill-Mahood-4388,bill mahood,The Butcher,01/02/1967,54.0,,"Prince George, British Columbia",Canada,"6'3""",205 lbs,Revolution Fight Team,Light Heavyweight,20.0,15.0,4.0,1.0,,20.0,3.0,4.0,0.0,,The Butcher,20.0,7.0,1.0,190.5,90.72,,Orthodox,1967-02-01,1.54,85.0,3.59,17.0,0.0,0.0,0.0,3.9
,billy evangelista,,,,,,,,,,,,,,,,,,,,,,13.0,3.0,0.0,172.72,70.31,172.72,Orthodox,1980-10-07,4.51,40.0,3.96,61.0,1.6,19.0,61.0,0.2
/fighter/Billy-Giovanella-72882,billy giovanella,The Wolverine,20/08/1985,35.0,,"Bellingham, Massachusetts",United States,"5'8""",124 lbs,Connors MMA,Flyweight,9.0,3.0,4.0,2.0,,9.0,4.0,3.0,2.0,,Wolverine,9.0,5.0,0.0,172.72,56.7,,,,1.27,40.0,2.02,52.0,0.87,12.0,100.0,1.7
/fighter/Billy-Goff-282365,billy goff,,18/06/1998,23.0,,"Groton, Connecticut",United States,"5'10""",170 lbs,Dexter MMA,Welterweight,3.0,2.0,0.0,1.0,,3.0,1.0,0.0,1.0,,,9.0,2.0,0.0,177.8,77.11,182.88,Switch,1998-06-18,10.22,46.0,4.3,64.0,4.04,40.0,100.0,0.0
/fighter/Billy-Horne-18493,billy horne,Mojo,02/08/1977,44.0,,"Cincinnati, Ohio",United States,"6'1""",185 lbs,Cincinnati Gracie Jiu-Jitsu Academy,Middleweight,18.0,3.0,12.0,3.0,,18.0,3.0,0.0,2.0,,,,,,,,,,,,,,,,,,
/fighter/Billy-Miles-8845,billy miles,,28/04/1978,43.0,,"Lincoln, California",United States,"5'10""",185 lbs,Capital City Fighting Alliance,Middleweight,2.0,1.0,0.0,1.0,,2.0,0.0,2.0,0.0,,The Kid,2.0,2.0,0.0,177.8,77.11,,Orthodox,1978-04-28,0.0,0.0,1.25,33.0,0.0,0.0,0.0,0.0
,billy pasulatan,,,,,,,,,,,,,,,,,,,,,,10.0,3.0,0.0,165.1,56.7,167.64,Switch,1991-08-07,0.65,20.0,5.22,48.0,0.0,0.0,0.0,4.9
/fighter/Billy-Quarantillo-68076,billy quarantillo,,08/12/1988,32.0,,"Tampa, Florida",United States,"5'10""",145 lbs,Gracie Tampa South,Featherweight,16.0,7.0,5.0,4.0,,16.0,1.0,0.0,2.0,,,18.0,5.0,0.0,177.8,65.77,177.8,Orthodox,1988-12-08,7.71,57.0,5.61,43.0,1.31,23.0,63.0,1.2
,billy ray goff,,,,,,,,,,,,,,,,,,,,,,,,,,,,,,,,,,,,,
/fighter/Billy-Swanson-255841,billy swanson,Big Sexy,23/03/1994,27.0,,"Soddy-Daisy, Tennessee",United States,"6'2""",250 lbs,,Heavyweight,4.0,2.0,1.0,1.0,,4.0,1.0,0.0,0.0,,,,,,,,,,,,,,,,,,
,billy vaughan,,,,,,,,,,,,,,,,,,,,,,12.0,17.0,0.0,167.64,70.31,,,,0.0,0.0,1.36,50.0,0.0,0.0,0.0,0.0
/fighter/Binh-Son-Le-94941,binh son le,,26/10/1988,32.0,,Partille,Sweden,"5'5""",125 lbs,Bulldog Training Center,Flyweight,5.0,0.0,0.0,5.0,,5.0,0.0,0.0,4.0,,,,,,,,,,,,,,,,,,
,bj penn,,,,,,,,,,,,,,,,,,,,,The Prodigy,16.0,14.0,2.0,175.26,70.31,177.8,Orthodox,1978-12-13,2.76,48.0,3.2,56.0,1.19,55.0,74.0,0.5
/fighter/Blagoy-Ivanov-50154,blagoy ivanov,Baga,09/10/1986,34.0,,Sofia,Bulgaria,"5'11""",256 lbs,SK Absolute Bulgaria,Heavyweight,18.0,6.0,6.0,6.0,,18.0,0.0,1.0,3.0,,Baga,19.0,6.0,0.0,180.34,113.4,185.42,Southpaw,1986-10-09,3.25,40.0,4.2,53.0,0.69,40.0,61.0,0.1
/fighter/Blaine-ODriscoll-75570,blaine o'driscoll,,31/12/1991,29.0,,"Dublin, Leinster",Ireland,"5'6""",125 lbs,SBG Ireland,Flyweight,9.0,3.0,4.0,2.0,,9.0,1.0,1.0,2.0,,,,,,,,,,,,,,,,,,
/fighter/Blaine-Shutt-98887,blaine shutt,The Shuttdown,27/04/1992,29.0,,"Hummelstown, Pennsylvania",United States,"5'7""",135 lbs,Tech MMA,Bantamweight,8.0,0.0,6.0,2.0,,8.0,0.0,1.0,4.0,,,,,,,,,,,,,,,,,,
/fighter/Blair-Tugman-22846,blair tugman,The Bull Shark,,,,"North Haven, Connecticut",United States,"5'7""",135 lbs,Calandrelli Brazilian Jiu-Jitsu,Bantamweight,11.0,0.0,4.0,7.0,,11.0,0.0,2.0,5.0,,,10.0,6.0,0.0,182.88,61.23,,,,2.25,53.0,0.93,50.0,7.5,60.0,0.0,0.0
,blake bilder,,,,,,,,,,,,,,,,,,,,,El Animal,8.0,1.0,1.0,172.72,65.77,172.72,Switch,1990-07-12,4.96,50.0,4.54,56.0,0.45,10.0,100.0,0.9
,blake bowman,,,,,,,,,,,,,,,,,,,,,,2.0,6.0,0.0,187.96,77.11,,,,0.0,0.0,0.0,0.0,0.0,0.0,0.0,0.0
/fighter/Blake-Dufour-50516,blake dufour,Du4,,,,"New Orleans, Louisiana",United States,"5'10""",136 lbs,,Bantamweight,2.0,0.0,1.0,1.0,,2.0,0.0,1.0,1.0,,,,,,,,,,,,,,,,,,
/fighter/Blake-Pool-146457,blake pool,The Bull,28/01/1991,30.0,,"Kansas City, Missouri",United States,"5'7""",153 lbs,,Lightweight,0.0,0.0,0.0,0.0,,0.0,1.0,0.0,1.0,,,,,,,,,,,,,,,,,,
/fighter/Blake-Watkins-13430,blake watkins,,,,,"Bakersfield, California",United States,"6'2""",185 lbs,,Middleweight,5.0,2.0,3.0,0.0,,5.0,1.0,0.0,0.0,,,5.0,1.0,0.0,,83.91,,,,5.45,62.0,7.64,61.0,0.0,0.0,0.0,0.0
/fighter/Blas-Avena-20847,blas avena,,30/06/1983,38.0,,"Las Vegas, Nevada",United States,"6'3""",170 lbs,Machado Jiu Jitsu,Welterweight,8.0,2.0,6.0,0.0,,8.0,7.0,0.0,0.0,,The Disciple,8.0,7.0,0.0,182.88,77.11,187.96,Orthodox,1983-06-30,2.34,47.0,3.36,43.0,2.37,80.0,50.0,1.8
,blood diamond,,,,,,,,,,,,,,,,,,,,,,3.0,3.0,0.0,180.34,77.11,193.04,Switch,1988-07-10,3.12,55.0,2.17,48.0,0.0,0.0,73.0,0.0
,bo cantrell,,,,,,,,,,,,,,,,,,,,,Redrum,10.0,10.0,0.0,187.96,106.59,,Orthodox,1969-02-08,3.16,16.0,12.63,0.0,0.0,0.0,0.0,0.0
,bo nickal,,,,,,,,,,,,,,,,,,,,,,5.0,0.0,0.0,185.42,83.91,193.04,Southpaw,1996-01-14,2.76,62.0,0.55,75.0,11.04,50.0,0.0,13.8
/fighter/Bob-Cook-244,bob cook,Crazy Bob,,,,"Fresno, California",United States,"5'9""",170 lbs,American Kickboxing Academy,Welterweight,5.0,2.0,3.0,0.0,,5.0,0.0,0.0,0.0,,Crazy,5.0,0.0,0.0,175.26,77.11,,Orthodox,,0.0,0.0,0.0,0.0,0.0,0.0,0.0,0.0
/fighter/Bob-Gilstrap-197,bob gilstrap,,16/07/1974,47.0,,"Seattle, Washington",United States,"6'3""",210 lbs,,Heavyweight,5.0,2.0,3.0,0.0,0.0,5.0,1.0,1.0,4.0,1.0,,5.0,7.0,0.0,190.5,90.72,,Orthodox,,0.0,0.0,0.0,0.0,0.0,0.0,0.0,0.0
/fighter/Bob-Sapp-4416,bob sapp,The Beast,22/09/1973,47.0,,"Seattle, Washington",United States,"6'5""",329 lbs,Team Beast,Super Heavyweight,12.0,8.0,3.0,1.0,0.0,12.0,15.0,4.0,0.0,1.0,The Beast,11.0,20.0,0.0,195.58,158.76,,Orthodox,1974-09-22,3.19,55.0,1.88,49.0,0.58,100.0,72.0,0.0
,bob schrijber,,,,,,,,,,,,,,,,,,,,,Dirty,20.0,17.0,1.0,182.88,108.86,,Orthodox,,0.0,0.0,0.0,0.0,0.0,0.0,0.0,0.0
/fighter/Bobby-Cooper-68351,bobby    cooper,Super Duper,13/06/1986,35.0,,"Knob Noster, Missouri",United States,"6'1""",170 lbs,Glory MMA & Fitness,Welterweight,13.0,1.0,3.0,9.0,,13.0,1.0,0.0,7.0,,,,,,,,,,,,,,,,,,
/fighter/Bobby-Brents-9160,bobby brents,Zombie,14/04/1982,39.0,,"Springfield, Illinois",United States,"5'9""",254 lbs,Fiore MMA,Heavyweight,17.0,8.0,5.0,4.0,0.0,17.0,3.0,1.0,3.0,1.0,,,,,,,,,,,,,,,,,
,bobby cooper,,,,,,,,,,,,,,,,,,,,,Super Duper,12.0,7.0,0.0,185.42,70.31,,,,2.87,25.0,3.4,59.0,0.0,0.0,40.0,1.0
/fighter/Bobby-Escalante-52318,bobby escalante,,11/07/1989,32.0,,"Stockton, California",United States,"5'6""",135 lbs,Team Alpha Male,Bantamweight,5.0,1.0,4.0,0.0,,5.0,2.0,3.0,1.0,,,5.0,6.0,0.0,,58.97,,,,0.0,0.0,0.0,0.0,0.0,0.0,0.0,0.0
/fighter/Bobby-Flynn-64007,bobby flynn,,,,,"Mashpee, Massachusetts",United States,"0'0""",170 lbs,Pro-Elite Training Center,Welterweight,6.0,1.0,4.0,1.0,,6.0,2.0,2.0,0.0,,,6.0,4.0,0.0,,77.11,,,,0.38,25.0,0.77,0.0,0.0,0.0,0.0,0.0
/fighter/Bobby-Green-27953,bobby green,King,09/09/1986,34.0,,"Redlands, California",United States,"5'10""",155 lbs,Pinnacle MMA,Lightweight,27.0,9.0,8.0,10.0,,27.0,2.0,2.0,8.0,,King,31.0,15.0,1.0,177.8,70.31,180.34,Orthodox,1986-09-09,6.14,52.0,3.74,62.0,1.2,37.0,74.0,0.3
/fighter/Bobby-Hoffman-265,bobby hoffman,The Truth,28/10/1966,54.0,,"Bettendorf, Iowa",United States,"6'2""",245 lbs,Universal Grappling Academy,Heavyweight,36.0,23.0,6.0,7.0,,36.0,4.0,2.0,4.0,,The Truth,36.0,10.0,1.0,187.96,111.13,,Orthodox,1968-10-28,2.02,70.0,1.32,19.0,1.17,50.0,0.0,1.2
/fighter/Bobby-King-85399,bobby king,,09/12/1983,37.0,,Utah,United States,"5'9""",155 lbs,Koa Kingdom,Lightweight,10.0,2.0,5.0,3.0,,10.0,2.0,0.0,1.0,,,,,,,,,,,,,,,,,,
/fighter/Bobby-Lashley-39806,bobby lashley,The Dominator,16/07/1976,45.0,,"Aurora, Colorado",United States,"6'2""",241 lbs,American Top Team Altitude,Heavyweight,15.0,6.0,6.0,3.0,,15.0,1.0,0.0,1.0,,,15.0,2.0,0.0,190.5,115.67,198.12,Orthodox,1976-07-16,3.1,63.0,0.76,63.0,11.47,70.0,0.0,0.0
/fighter/Bobby-Lee-229583,bobby lee,,11/01/1996,25.0,,"St. Cloud, Minnesota",United States,"5'9""",155 lbs,Start BJJ Minnesota,Lightweight,12.0,2.0,6.0,4.0,,12.0,0.0,2.0,4.0,,,,,,,,,,,,,,,,,,
,bobby mcandrews,,,,,,,,,,,,,,,,,,,,,,1.0,3.0,0.0,,,,Orthodox,,2.56,83.0,1.03,50.0,0.0,0.0,33.0,7.7
/fighter/Bobby-Moffett-159019,bobby moffett,The Wolfman,01/06/1990,31.0,,"Homewood, Illinois",United States,"5'10""",145 lbs,MMA Lab,Featherweight,13.0,1.0,8.0,4.0,,13.0,1.0,0.0,5.0,,The Wolfman,13.0,5.0,0.0,177.8,65.77,185.42,Orthodox,1990-06-01,3.41,39.0,3.15,61.0,2.74,66.0,66.0,1.4
/fighter/Bobby-Nash-75423,bobby nash,Nashty,26/03/1990,31.0,,"East Lansing, Michigan",United States,"6'0""",170 lbs,Fit NHB,Welterweight,12.0,7.0,4.0,1.0,,12.0,3.0,0.0,1.0,,,8.0,4.0,0.0,182.88,77.11,187.96,Orthodox,1990-03-26,3.42,37.0,3.95,51.0,2.37,33.0,100.0,1.6
/fighter/Bobby-Reardanz-47098,bobby reardanz,The Believer,,,,"Bourbanais, Illinois",United States,"5'11""",160 lbs,David and Goliath Fighting System,Welterweight,9.0,2.0,7.0,0.0,,9.0,4.0,4.0,5.0,,,,,,,,,,,,,,,,,,
,bobby sanchez,,,,,,,,,,,,,,,,,,,,,The Kid,10.0,35.0,0.0,170.18,70.31,,Orthodox,,0.0,0.0,0.0,100.0,0.0,0.0,100.0,0.0
/fighter/Bobby-Southworth-551,bobby southworth,,16/12/1969,51.0,,"Santa Cruz, California",United States,"6'1""",228 lbs,American Kickboxing Academy,Heavyweight,10.0,6.0,2.0,2.0,,10.0,3.0,2.0,1.0,,,10.0,6.0,0.0,187.96,92.99,,Orthodox,1969-12-16,0.99,39.0,1.38,65.0,3.98,78.0,64.0,1.3
,bobby stack,,,,,,,,,,,,,,,,,,,,,,8.0,3.0,0.0,175.26,70.31,,Orthodox,,1.0,20.0,2.89,34.0,7.48,45.0,100.0,0.0
/fighter/Bobby-Voelker-15156,bobby voelker,Vicious,26/04/1979,42.0,,"Kansas City, Kansas",United States,"6'0""",170 lbs,Glory MMA & Fitness,Welterweight,33.0,26.0,0.0,7.0,,33.0,4.0,1.0,9.0,,Vicious,19.0,13.0,0.0,182.88,77.11,187.96,Orthodox,1979-04-26,4.01,35.0,5.84,42.0,1.04,50.0,66.0,0.0
,bogdan grad,,,,,,,,,,,,,,,,,,,,,The Unleashed,11.0,2.0,0.0,172.72,70.31,177.8,Orthodox,1995-09-28,1.45,50.0,9.4,45.0,0.0,0.0,0.0,0.0
,bogdan guskov,,,,,,,,,,,,,,,,,,,,,Czarevitch,14.0,3.0,0.0,190.5,92.99,193.04,Orthodox,1992-09-12,2.12,32.0,6.9,43.0,0.0,0.0,0.0,0.0
/fighter/Bojan-Mihajlovic-12400,bojan mihajlovic,,30/03/1980,41.0,,Novi Sad,Serbia,"5'11""",205 lbs,Family Fight Team,Light Heavyweight,10.0,4.0,2.0,4.0,,10.0,3.0,1.0,2.0,,,10.0,6.0,0.0,180.34,92.99,185.42,Orthodox,1980-03-30,1.23,35.0,5.95,47.0,0.0,0.0,33.0,0.0
/fighter/Bojan-Velickovic-76620,bojan velickovic,Serbian Steel,18/12/1988,32.0,,Novi Sad,Serbia,"6'0""",170 lbs,Elevation Fight Team,Welterweight,19.0,6.0,9.0,4.0,,19.0,1.0,0.0,9.0,,Serbian Steel,15.0,6.0,1.0,182.88,77.11,193.04,Southpaw,1988-12-18,2.18,34.0,2.31,57.0,0.67,25.0,55.0,0.5
/fighter/Bokang-Masunyane-241443,bokang masunyane,Little Giant,18/06/1994,27.0,,"Johannesburg, Gauteng",South Africa,"5'2""",125 lbs,FightFit Militia,Flyweight,8.0,1.0,1.0,6.0,,8.0,0.0,0.0,0.0,,,,,,,,,,,,,,,,,,
,bolaji oki,,,,,,,,,,,,,,,,,,,,,The Zulu Warrior,8.0,1.0,0.0,177.8,70.31,185.42,Orthodox,1995-11-15,11.57,53.0,4.34,62.0,0.0,0.0,0.0,0.0
/fighter/Booker-Arthur-60281,booker arthur,,16/11/1990,30.0,,,United States,"5'6""",155 lbs,,Lightweight,4.0,1.0,2.0,1.0,,4.0,1.0,0.0,4.0,,,,,,,,,,,,,,,,,,
,booker derousse,,,,,,,,,,,,,,,,,,,,,,6.0,5.0,0.0,187.96,92.99,,,,0.0,0.0,0.0,0.0,0.0,0.0,0.0,0.0
/fighter/Boris-Novachkov-324293,boris novachkov,,29/11/1989,31.0,,Sofia,Bulgaria,"5'7""",145 lbs,,Featherweight,0.0,0.0,0.0,0.0,,0.0,0.0,0.0,1.0,,,,,,,,,,,,,,,,,,
/fighter/Boston-Salmon-131463,boston salmon,Boom Boom,20/11/1990,30.0,,"Waianae, Hawaii",United States,"5'9""",135 lbs,PHD Athletics,Bantamweight,7.0,4.0,0.0,2.0,1.0,7.0,2.0,0.0,1.0,0.0,Boom Boom,6.0,3.0,0.0,175.26,61.23,175.26,Southpaw,1990-11-20,4.13,37.0,7.75,59.0,0.0,0.0,100.0,0.0
/fighter/Bounmy-Somchay-43576,bounmy somchay,,02/02/1973,48.0,,"West Palm Beach, Florida",United States,"5'8""",156 lbs,Team Chaikong,Lightweight,2.0,0.0,1.0,1.0,0.0,2.0,6.0,4.0,2.0,1.0,,,,,,,,,,,,,,,,,
/fighter/Bozhena-Antoniyar-274031,bozhena antoniyar,Toto,,,,,Myanmar,"5'2""",110 lbs,Bali MMA,Strawweight,3.0,2.0,0.0,1.0,,3.0,1.0,0.0,1.0,,,,,,,,,,,,,,,,,,
/fighter/Brad-Blackburn-2920,brad blackburn,Bad,25/05/1977,44.0,,"Seattle, Washington",United States,"5'10""",169 lbs,Victory Athletics,Welterweight,18.0,9.0,4.0,5.0,,18.0,4.0,1.0,8.0,,Bad Brad,18.0,13.0,1.0,177.8,77.11,185.42,Orthodox,1977-05-25,4.55,35.0,3.59,65.0,0.93,50.0,76.0,0.7
/fighter/Brad-Gumm-240,brad gumm,,,,,"Littleton, Colorado",United States,"5'11""",170 lbs,Gumm Mixed Martial Arts,Welterweight,10.0,1.0,5.0,4.0,,10.0,2.0,1.0,3.0,,,10.0,6.0,1.0,180.34,77.11,,Orthodox,,0.0,0.0,0.0,0.0,0.0,0.0,0.0,0.0
/fighter/Brad-Imes-11453,brad imes,The Hillbilly Heartthrob,06/05/1978,43.0,,"Sacramento, California",United States,"6'7""",260 lbs,Sacramaneto BJJ,Heavyweight,13.0,3.0,8.0,2.0,,13.0,3.0,1.0,3.0,,Hillbilly Heartthrob,13.0,7.0,0.0,200.66,120.2,,Orthodox,1977-03-13,2.73,31.0,4.24,49.0,1.72,71.0,0.0,1.0
/fighter/Brad-Jones-1009,brad jones,Sensi,04/09/1980,40.0,,Missouri,United States,"5'11""",170 lbs,War Room MMA,Welterweight,6.0,4.0,2.0,0.0,,6.0,4.0,0.0,0.0,,,,,,,,,,,,,,,,,,
/fighter/Brad-Katona-66518,brad katona,Superman,19/12/1991,29.0,,"Winnipeg, Manitoba",Canada,"5'6""",135 lbs,SBG Ireland,Bantamweight,9.0,1.0,3.0,5.0,,9.0,0.0,0.0,2.0,,Superman,15.0,2.0,0.0,167.64,61.23,162.56,Orthodox,1991-12-19,4.8,51.0,4.57,50.0,1.0,20.0,50.0,0.0
/fighter/Brad-Kohler-181,brad kohler,,26/05/1964,57.0,,"Bloomington, Minnesota",United States,"5'9""",220 lbs,,Heavyweight,12.0,8.0,4.0,0.0,,12.0,9.0,6.0,0.0,,,12.0,15.0,0.0,175.26,99.79,,Orthodox,1964-05-26,0.0,0.0,0.0,0.0,0.0,0.0,0.0,0.0
/fighter/Brad-Mitchell-48396,brad mitchell,The Bonecrusher,10/10/1974,46.0,,"Dallas, Texas",United States,"5'11""",145 lbs,Octagon MMA,Featherweight,4.0,1.0,0.0,3.0,,4.0,0.0,2.0,0.0,,,4.0,2.0,0.0,180.34,65.77,,,,1.15,33.0,4.2,52.0,0.0,0.0,100.0,1.9
/fighter/Brad-Morris-9024,brad morris,,,,,"Sydney, New South Wales",Australia,"6'1""",253 lbs,Gracie Barra Sydney,Heavyweight,10.0,3.0,4.0,3.0,,10.0,4.0,2.0,0.0,,,10.0,6.0,0.0,187.96,92.99,,Orthodox,1979-11-01,0.5,62.0,6.95,27.0,0.0,0.0,0.0,0.0
/fighter/Brad-Pickett-11743,brad pickett,One Punch,24/09/1978,42.0,,London,England,"5'6""",125 lbs,American Top Team,Flyweight,25.0,7.0,10.0,8.0,,25.0,3.0,5.0,6.0,,One Punch,25.0,14.0,0.0,167.64,61.23,172.72,Orthodox,1978-09-24,3.02,31.0,4.63,55.0,2.47,44.0,58.0,0.4
/fighter/Brad-Riddell-252693,brad riddell,Quake,30/09/1991,29.0,,Auckland,New Zealand,"5'8""",155 lbs,City Kickboxing,Lightweight,10.0,5.0,0.0,5.0,,10.0,0.0,1.0,0.0,,Quake,10.0,4.0,0.0,170.18,70.31,180.34,Orthodox,1991-09-30,4.71,53.0,3.53,53.0,1.77,36.0,63.0,0.0
/fighter/Brad-Robinson-113659,brad robinson,Vanilla Gorilla,,,,,United States,"6'0""",177 lbs,Fight G,Middleweight,3.0,1.0,1.0,1.0,,3.0,1.0,0.0,1.0,,,,,,,,,,,,,,,,,,
/fighter/Brad-Robison-252957,brad robison,,24/01/1984,37.0,,,United States,"0'0""",143 lbs,,Featherweight,0.0,0.0,0.0,0.0,,0.0,0.0,0.0,1.0,,,,,,,,,,,,,,,,,,
,brad royster,,,,,,,,,,,,,,,,,,,,,,1.0,2.0,0.0,,61.23,,,,0.0,0.0,0.0,0.0,0.0,0.0,0.0,0.0
,brad scott,,,,,,,,,,,,,,,,,,,,,Bear,11.0,6.0,0.0,185.42,77.11,193.04,Orthodox,1989-06-24,3.52,41.0,4.31,57.0,0.32,15.0,63.0,0.7
/fighter/Brad-Tavares-33095,brad tavares,,21/12/1987,33.0,,"Kailua, Hawaii",United States,"5'11""",185 lbs,Xtreme Couture,Middleweight,19.0,5.0,2.0,12.0,,19.0,3.0,0.0,3.0,,,20.0,9.0,0.0,185.42,83.91,187.96,Orthodox,1987-12-21,3.38,43.0,3.03,56.0,0.81,26.0,82.0,0.0
/fighter/Bradley-Desir-62059,bradley desir,Featherstone,04/03/1987,34.0,,New York,United States,"5'10""",155 lbs,Team Tiger Schulmann,Lightweight,10.0,8.0,2.0,0.0,,10.0,2.0,1.0,4.0,,,,,,,,,,,,,,,,,,
/fighter/Bradley-Scott-44442,bradley scott,Bear,22/06/1989,32.0,,"Melksham, Wiltshire",England,"6'1""",170 lbs,Dragons Lair MMA,Welterweight,11.0,5.0,5.0,1.0,,11.0,1.0,1.0,4.0,,,,,,,,,,,,,,,,,,
,brady fink,,,,,,,,,,,,,,,,,,,,,,2.0,3.0,0.0,182.88,83.01,,Orthodox,,1.69,41.0,1.69,61.0,3.63,25.0,0.0,3.6
,brady hiestand,,,,,,,,,,,,,,,,,,,,,,8.0,2.0,0.0,172.72,61.23,180.34,Orthodox,1999-04-30,2.93,52.0,3.65,53.0,4.06,46.0,42.0,0.3
,brady huang,,,,,,,,,,,,,,,,,,,,,The Kung Fu Warrior,11.0,2.0,0.0,175.26,61.23,175.26,Orthodox,1992-12-16,4.62,37.0,10.77,30.0,0.0,0.0,0.0,0.0
/fighter/Branden-Lee-Hinkle-437,branden lee hinkle,The Iron Lion,29/07/1973,48.0,,"Jefferson, Ohio",United States,"6'2""",230 lbs,Hammer House,Heavyweight,17.0,12.0,3.0,2.0,,17.0,2.0,8.0,1.0,,The Iron Lion,17.0,11.0,0.0,190.5,106.59,,Orthodox,1973-07-29,2.61,69.0,3.91,26.0,4.34,57.0,66.0,4.3
/fighter/Brandon-Bell-31956,brandon bell,The Juggernaut,13/11/1984,36.0,,"Harlan, Kentucky",United States,"5'8""",170 lbs,D3 Elite,Welterweight,7.0,2.0,1.0,4.0,,7.0,2.0,3.0,3.0,,,,,,,,,,,,,,,,,,
/fighter/Brandon-Bender-17391,brandon bender,,05/02/1987,34.0,,"Rancho Cucamonga, California",United States,"5'8""",135 lbs,Aguirre's Fighting System,Bantamweight,12.0,0.0,11.0,1.0,,12.0,1.0,0.0,1.0,,,,,,,,,,,,,,,,,,
/fighter/Brandon-Calton-317561,brandon calton,Bone Crusher,03/06/1980,41.0,,"Pennington Gap, Virginia",United States,"6'5""",265 lbs,Wise County Combat Club,Heavyweight,2.0,2.0,0.0,0.0,,2.0,0.0,0.0,1.0,,,,,,,,,,,,,,,,,,
/fighter/Brandon-Cash-32423,brandon cash,Money,,,,"Fresno, California",United States,"6'5""",255 lbs,Dethrone Base Camp,Heavyweight,10.0,7.0,2.0,1.0,,10.0,3.0,3.0,0.0,,Money,10.0,4.0,0.0,195.58,115.67,,Orthodox,,5.42,72.0,0.68,33.0,10.17,66.0,0.0,0.0
,brandon davis,,,,,,,,,,,,,,,,,,,,,Killer B,14.0,10.0,0.0,177.8,61.23,182.88,Orthodox,1990-05-08,4.68,35.0,4.62,58.0,0.74,42.0,57.0,0.1
/fighter/Brandon-Farran-23939,brandon farran,,05/09/1985,35.0,,"Abilene, Texas",United States,"5'10""",184 lbs,Future Fitness Team,Middleweight,12.0,7.0,5.0,0.0,,12.0,2.0,7.0,3.0,,,,,,,,,,,,,,,,,,
/fighter/Brandon-Faumui-82883,brandon faumui,Brilliant,17/09/1991,29.0,,"San Bruno, California",United States,"5'11""",159 lbs,Dragon House MMA,Welterweight,5.0,2.0,1.0,2.0,,5.0,0.0,0.0,4.0,,,,,,,,,,,,,,,,,,
/fighter/Brandon-Fleming-59070,brandon fleming,Bad Luck,08/03/1991,30.0,,"Marshfield, Massachusetts",United States,"5'8""",136 lbs,South Shore Sport Fighting,Bantamweight,7.0,3.0,2.0,2.0,,7.0,0.0,0.0,4.0,,,,,,,,,,,,,,,,,,
,brandon foxworth,,,,,,,,,,,,,,,,,,,,,,18.0,4.0,0.0,180.34,65.77,,Orthodox,1979-04-28,1.33,32.0,4.59,50.0,0.0,0.0,0.0,0.0
,brandon gaines,,,,,,,,,,,,,,,,,,,,,,5.0,21.0,0.0,190.5,83.91,,,,0.0,0.0,0.0,0.0,0.0,0.0,0.0,0.0
/fighter/Brandon-Girtz-32637,brandon girtz,,06/03/1985,36.0,,"Mankato, Minnesota",United States,"5'7""",155 lbs,Genesis Training Center,Lightweight,16.0,3.0,8.0,5.0,,16.0,3.0,2.0,5.0,,Cold Roll,14.0,7.0,0.0,170.18,70.31,,,,2.5,60.0,1.92,47.0,5.76,100.0,100.0,0.0
/fighter/Brandon-Halsey-91819,brandon halsey,Bull,16/09/1986,34.0,,"Huntington Beach, California",United States,"6'0""",185 lbs,HB Ultimate,Middleweight,12.0,3.0,4.0,5.0,,12.0,4.0,1.0,0.0,,Bull,9.0,3.0,0.0,182.88,83.91,,,,1.74,47.0,0.87,65.0,4.98,53.0,100.0,1.2
/fighter/Brandon-Hastings-43349,brandon hastings,The White Tiger,09/06/1981,40.0,,"Victorville, California",United States,"0'0""",145 lbs,White Tiger Martial Arts,Featherweight,6.0,5.0,1.0,0.0,,6.0,3.0,0.0,1.0,,,,,,,,,,,,,,,,,,
/fighter/Brandon-Hester-116003,brandon hester,The Beast,,,,"San Jose, California",United States,"6'1""",185 lbs,Team Undisputed Gladiators,Middleweight,4.0,0.0,3.0,1.0,,4.0,2.0,0.0,0.0,,The Beast,3.0,0.0,0.0,185.42,92.99,,,,3.53,53.0,0.4,68.0,4.0,80.0,0.0,0.0
,brandon jenkins,,,,,,,,,,,,,,,,,,,,,The Human Highlight Reel,15.0,9.0,0.0,182.88,70.31,180.34,Switch,1991-09-30,2.93,41.0,8.05,33.0,0.0,0.0,27.0,0.0
/fighter/Brandon-Laroco-150923,brandon laroco,Lil Beast,02/03/1995,26.0,,"Vallejo, California",United States,"5'7""",139 lbs,Combat Fitness,Featherweight,6.0,1.0,4.0,1.0,,6.0,0.0,0.0,2.0,,,,,,,,,,,,,,,,,,
,brandon lewis,,,,,,,,,,,,,,,,,,,,,,6.0,2.0,0.0,162.56,61.23,177.8,Orthodox,1997-08-02,2.17,29.0,3.63,53.0,1.0,15.0,20.0,0.0
/fighter/Brandon-Lowe-209031,brandon lowe,,24/04/1990,31.0,,"Bethalto, Illinois",United States,"5'8""",144 lbs,,Featherweight,4.0,2.0,0.0,2.0,,4.0,1.0,0.0,0.0,,,2.0,1.0,0.0,,70.31,,,,0.0,0.0,0.0,0.0,0.0,0.0,0.0,0.0
,brandon magana,,,,,,,,,,,,,,,,,,,,,,6.0,2.0,0.0,,77.11,,Orthodox,,0.0,0.0,0.0,0.0,0.0,0.0,0.0,0.0
/fighter/Brandon-McDowell-3062,brandon mcdowell,,15/08/1978,42.0,,"Austin, Texas",United States,"6'2""",183 lbs,City Boxing,Middleweight,32.0,1.0,24.0,6.0,1.0,32.0,14.0,15.0,6.0,0.0,,,,,,,,,,,,,,,,,
/fighter/Brandon-McMahan-54894,brandon mcmahan,,12/12/1987,33.0,,"Knoxville, Tennessee",United States,"5'7""",135 lbs,Hard Knox Combat Club,Bantamweight,5.0,1.0,2.0,2.0,,5.0,0.0,2.0,5.0,,,,,,,,,,,,,,,,,,
/fighter/Brandon-Medina-313889,brandon medina,B-25,25/11/1995,25.0,,New York,United States,"5'7""",125 lbs,East Coast United BJJ,Flyweight,0.0,0.0,0.0,0.0,,0.0,0.0,1.0,0.0,,,,,,,,,,,,,,,,,,
/fighter/Brandon-Melendez-10515,brandon melendez,The Murderer,24/03/1983,38.0,,"Bountiful, Utah",United States,"5'10""",170 lbs,Elite Performance,Welterweight,25.0,10.0,12.0,3.0,0.0,25.0,8.0,13.0,2.0,2.0,The Murderer,25.0,25.0,0.0,180.34,70.31,,Southpaw,1983-03-24,0.84,26.0,0.56,63.0,0.0,0.0,25.0,0.0
/fighter/Brandon-Michael-Davis-67782,brandon michael davis,Killer B,08/05/1990,31.0,,"Starkville, Mississippi",United States,"5'10""",145 lbs,Alan Belcher MMA Club,Featherweight,13.0,3.0,4.0,6.0,,13.0,0.0,2.0,6.0,,,,,,,,,,,,,,,,,,
,brandon michaels,,,,,,,,,,,,,,,,,,,,,,4.0,14.0,0.0,175.26,83.91,,,,0.0,0.0,0.0,0.0,0.0,0.0,0.0,0.0
/fighter/Brandon-Moreno-80173,brandon moreno,The Assassin Baby,07/12/1993,27.0,,"Tijuana, Baja California",Mexico,"5'7""",125 lbs,Entram Gym,Flyweight,19.0,3.0,11.0,5.0,,19.0,0.0,0.0,5.0,,The Assassin Baby,21.0,7.0,2.0,170.18,56.7,177.8,Orthodox,1993-12-07,3.8,43.0,3.4,56.0,1.73,45.0,64.0,0.5
/fighter/Brandon-Phillips-94003,brandon phillips,,05/11/1989,31.0,,"Oklahoma City, Oklahoma",United States,"5'6""",135 lbs,American Top Team OKC,Bantamweight,6.0,3.0,1.0,2.0,,6.0,0.0,1.0,3.0,,,,,,,,,,,,,,,,,,
/fighter/Brandon-Pieper-21153,brandon pieper,,,,,"Waipahu, Hawaii",United States,"5'7""",145 lbs,808 Top Team,Featherweight,11.0,5.0,3.0,3.0,,11.0,3.0,10.0,1.0,,,,,,,,,,,,,,,,,,
/fighter/Brandon-Polcare-187623,brandon polcare,,,,,"Malta, New York",United States,"5'6""",135 lbs,Spa City BJJ,Bantamweight,2.0,0.0,2.0,0.0,,2.0,0.0,2.0,0.0,,,1.0,1.0,0.0,,56.7,,,,0.43,50.0,0.0,0.0,0.0,0.0,0.0,0.0
/fighter/Brandon-Royval-83851,brandon royval,Raw Dawg,16/08/1992,28.0,,"Englewood, Colorado",United States,"5'7""",125 lbs,Factory X,Flyweight,12.0,3.0,8.0,1.0,,12.0,1.0,0.0,4.0,,Raw Dawg,15.0,6.0,0.0,175.26,56.7,172.72,Southpaw,1992-08-16,3.45,38.0,2.63,50.0,0.66,100.0,39.0,2.3
/fighter/Brandon-Saling-37375,brandon saling,White Steel,28/01/1986,35.0,,"Cumberland, Ohio",United States,"5'10""",170 lbs,Tribal Jiu-Jitsu,Welterweight,8.0,5.0,3.0,0.0,,8.0,1.0,3.0,2.0,,White Steel,8.0,6.0,0.0,177.8,77.11,,,,2.88,40.0,6.08,20.0,0.0,0.0,57.0,0.0
,brandon sayles,,,,,,,,,,,,,,,,,,,,,Man of War,5.0,1.0,0.0,195.58,120.2,,,,0.0,0.0,0.0,0.0,0.0,0.0,0.0,0.0
,brandon sene,,,,,,,,,,,,,,,,,,,,,,2.0,2.0,0.0,180.34,92.99,,,,0.0,0.0,0.0,0.0,0.0,0.0,0.0,0.0
/fighter/Brandon-Seyler-75260,brandon seyler,Soku,01/09/1989,31.0,,"Frisco, Texas",United States,"5'7""",144 lbs,Next Generation,Featherweight,8.0,1.0,6.0,1.0,,8.0,1.0,1.0,5.0,,,,,,,,,,,,,,,,,,
/fighter/Brandon-Shelhart-52211,brandon shelhart,,,,,"South Bend, Indiana",United States,"5'1""",135 lbs,Bulldog Fight Team,Bantamweight,5.0,0.0,2.0,3.0,,5.0,0.0,0.0,1.0,,,,,,,,,,,,,,,,,,
/fighter/Brandon-Shelton-15406,brandon shelton,,,,,"Norman, Oklahoma",United States,"5'6""",145 lbs,Blacklock's Vale-Tudo,Featherweight,21.0,1.0,16.0,4.0,,21.0,1.0,4.0,2.0,,,,,,,,,,,,,,,,,,
,brandon shuey,,,,,,,,,,,,,,,,,,,,,Big Dawg,7.0,6.0,0.0,170.18,70.31,,Orthodox,1976-02-01,0.68,33.0,1.36,0.0,0.0,0.0,0.0,10.2
/fighter/Brandon-Thatch-22298,brandon thatch,Rukus,11/07/1985,36.0,,"Denver, Colorado",United States,"6'2""",170 lbs,Elevation Fight Team,Welterweight,11.0,8.0,3.0,0.0,,11.0,0.0,4.0,1.0,,Rukus,11.0,5.0,0.0,187.96,77.11,187.96,Switch,1985-07-11,2.7,42.0,3.63,52.0,1.36,66.0,50.0,0.7
/fighter/Brandon-Vera-4886,brandon vera,The Truth,10/10/1977,43.0,,"San Diego, California",United States,"6'2""",246 lbs,Alliance MMA,Heavyweight,16.0,11.0,1.0,4.0,,16.0,6.0,0.0,3.0,,The Truth,15.0,7.0,0.0,190.5,104.33,198.12,Orthodox,1977-10-10,3.03,56.0,2.81,52.0,0.7,53.0,59.0,0.2
,brandon visher,,,,,,,,,,,,,,,,,,,,,The Viper,13.0,3.0,0.0,167.64,61.23,172.72,Orthodox,1984-05-06,2.55,45.0,3.76,42.0,0.67,20.0,0.0,0.0
/fighter/Brandon-Warne-90833,brandon warne,,,,,"Ovid, New York",United States,"0'0""",125 lbs,Team Bombsquad,Flyweight,1.0,0.0,1.0,0.0,,1.0,0.0,2.0,1.0,,,,,,,,,,,,,,,,,,
/fighter/Brandon-Wolff-4673,brandon wolff,,,,,"Kailua, Hawaii",United States,"5'10""",168 lbs,MMA Development,Welterweight,7.0,3.0,0.0,4.0,,7.0,2.0,2.0,1.0,,,7.0,5.0,0.0,175.26,77.11,,Orthodox,1975-10-18,0.47,33.0,10.91,19.0,0.0,0.0,0.0,0.0
/fighter/Branko-Busick-249509,branko busick,,15/07/1990,31.0,,"Steubenville, Ohio",United States,"6'1""",205 lbs,Superfly MMA,Light Heavyweight,2.0,1.0,1.0,0.0,,2.0,1.0,0.0,1.0,,,,,,,,,,,,,,,,,,
,branko cikatic,,,,,,,,,,,,,,,,,,,,,,0.0,2.0,0.0,185.42,97.52,,Orthodox,1954-10-03,0.0,0.0,0.0,0.0,0.0,0.0,0.0,0.0
,braxton smith,,,,,,,,,,,,,,,,,,,,,The Beautiful Monster,5.0,2.0,0.0,180.34,116.57,182.88,Orthodox,1990-01-01,6.46,48.0,11.54,32.0,0.0,0.0,100.0,0.0
/fighter/Brayan-Rafiq-13092,brayan rafiq,,23/04/1986,35.0,,,France,"5'9""",184 lbs,A.B.S.,Middleweight,8.0,1.0,6.0,1.0,,8.0,1.0,0.0,3.0,,,,,,,,,,,,,,,,,,
/fighter/Braydon-Akeo-306541,braydon akeo,,,,,Oregon,United States,"5'10""",145 lbs,,Featherweight,3.0,2.0,0.0,1.0,,3.0,0.0,0.0,1.0,,,,,,,,,,,,,,,,,,
/fighter/Brendan-Allen-201703,brendan allen,All In,28/12/1995,25.0,,"Milwaukee, Wisconsin",United States,"6'2""",185 lbs,Sanford MMA,Middleweight,17.0,5.0,9.0,3.0,,17.0,1.0,1.0,2.0,,All In,23.0,5.0,0.0,187.96,83.91,190.5,Orthodox,1995-12-28,3.87,54.0,3.6,46.0,1.36,47.0,58.0,1.7
/fighter/Brendan-Loughnane-44417,brendan loughnane,,05/12/1989,31.0,,"Manchester, Greater Manchester",England,"5'10""",145 lbs,All Powers Gym,Featherweight,21.0,11.0,2.0,8.0,,21.0,0.0,0.0,3.0,,,17.0,3.0,0.0,177.8,65.77,177.8,Switch,1989-12-05,6.23,63.0,6.7,53.0,1.5,30.0,92.0,0.0
/fighter/Brendan-OReilly-52633,brendan o'reilly,The Badger,24/06/1987,34.0,,"Brisbane, Queensland",Australia,"5'8""",170 lbs,Gamebred Submission Fighting,Welterweight,6.0,1.0,2.0,3.0,,6.0,1.0,0.0,2.0,,Badger,6.0,3.0,0.0,170.18,77.11,175.26,Orthodox,1987-06-24,1.9,47.0,2.77,39.0,2.22,43.0,36.0,0.6
/fighter/Brendan-Schaub-33926,brendan schaub,Big Brown,18/03/1983,38.0,,"Aurora, Colorado",United States,"6'4""",238 lbs,Reign MMA,Heavyweight,10.0,7.0,1.0,2.0,,10.0,4.0,0.0,1.0,,Big Brown,10.0,5.0,0.0,193.04,111.13,198.12,Orthodox,1983-03-18,2.92,37.0,2.22,57.0,2.32,46.0,72.0,0.4
/fighter/Brendan-Seguin-1495,brendan seguin,The Caucasian Devastation,03/07/1976,45.0,,"Detroit, Michigan",United States,"6'0""",185 lbs,Eastside Combat Club,Middleweight,23.0,11.0,2.0,10.0,,23.0,11.0,4.0,4.0,,,23.0,19.0,1.0,182.88,83.91,,,,2.6,45.0,0.6,84.0,5.0,62.0,100.0,0.0
/fighter/Brendan-Tierney-21921,brendan tierney,Tiny Shorts,10/06/1975,46.0,,"Tempe, Arizona",United States,"6'2""",180 lbs,Power MMA Team,Middleweight,11.0,2.0,9.0,0.0,,11.0,8.0,1.0,0.0,,,,,,,,,,,,,,,,,,
,brendon marotte,,,,,,,,,,,,,,,,,,,,,The Kid,8.0,2.0,0.0,175.26,70.31,177.8,Orthodox,1996-01-12,3.0,100.0,42.0,33.0,0.0,0.0,0.0,0.0
/fighter/Brendon-Raftery-99315,brendon raftery,,25/07/1991,30.0,,"Boise, Idaho",United States,"5'7""",125 lbs,,Flyweight,5.0,3.0,2.0,0.0,,5.0,1.0,1.0,1.0,,,,,,,,,,,,,,,,,,
,brendson ribeiro,,,,,,,,,,,,,,,,,,,,,The Gorilla,15.0,5.0,0.0,190.5,92.99,205.74,Orthodox,1996-09-08,8.46,46.0,5.29,64.0,0.0,0.0,0.0,0.0
/fighter/Brennan-Ward-41566,brennan ward,Irish,28/06/1988,33.0,,"Waterford, Connecticut",United States,"5'10""",170 lbs,Whaling City Boxing,Welterweight,14.0,9.0,4.0,1.0,,14.0,2.0,4.0,0.0,,The Irish Bad Boy,14.0,5.0,0.0,177.8,77.11,180.34,,,7.2,60.0,2.76,52.0,0.0,0.0,100.0,3.6
/fighter/Brent-Dillingham-90829,brent dillingham,,,,,"Brunswick, Maine",United States,"6'1""",205 lbs,MMA Athletix,Light Heavyweight,1.0,1.0,0.0,0.0,,1.0,0.0,1.0,0.0,,,,,,,,,,,,,,,,,,
/fighter/Brent-Hess-39747,brent hess,,25/06/1985,36.0,,"Bailey's Crossroads, Virginia",United States,"5'7""",145 lbs,Mikido MMA,Featherweight,4.0,2.0,2.0,0.0,,4.0,2.0,0.0,0.0,,,,,,,,,,,,,,,,,,
/fighter/Brent-Primus-55884,brent primus,,12/04/1985,36.0,,"Portland, Oregon",United States,"5'10""",155 lbs,Sports Lab,Lightweight,10.0,2.0,6.0,2.0,,10.0,0.0,0.0,2.0,,,8.0,0.0,0.0,177.8,70.31,,,,1.73,39.0,2.27,59.0,5.0,38.0,0.0,2.0
/fighter/Brent-Weedman-9869,brent weedman,,10/10/1984,36.0,,"Louisville, Kentucky",United States,"6'0""",170 lbs,Team Haycraft,Welterweight,22.0,10.0,9.0,3.0,,22.0,1.0,1.0,7.0,,,,,,,,,,,,,,,,,,
/fighter/Brenton-Taylor-48482,brenton taylor,,20/07/1985,36.0,,"Tyler, Texas",United States,"5'10""",155 lbs,,Lightweight,6.0,4.0,0.0,2.0,,6.0,1.0,0.0,1.0,,,,,,,,,,,,,,,,,,
,bret bergmark,,,,,,,,,,,,,,,,,,,,,The Angry Hick,6.0,1.0,1.0,175.26,77.11,,,,2.78,52.0,2.78,37.0,4.17,100.0,50.0,4.2
,brett albee,,,,,,,,,,,,,,,,,,,,,,3.0,2.0,0.0,,102.06,,,,0.0,0.0,0.0,0.0,0.0,0.0,0.0,0.0
/fighter/Brett-Cooper-14030,brett cooper,Fudoshin,02/07/1987,34.0,,"Long Beach, California",United States,"6'0""",170 lbs,Reign MMA,Welterweight,27.0,17.0,2.0,7.0,1.0,27.0,6.0,3.0,6.0,0.0,,23.0,12.0,0.0,182.88,77.11,,Orthodox,1987-07-02,0.0,0.0,0.0,0.0,0.0,0.0,0.0,0.0
/fighter/Brett-Glass-97881,brett glass,The Unbreakable,13/05/1990,31.0,,"Springfield, Virginia",United States,"5'10""",156 lbs,Freelance,Lightweight,4.0,3.0,0.0,1.0,,4.0,0.0,2.0,1.0,,,,,,,,,,,,,,,,,,
/fighter/Brett-Johns-92891,brett johns,The Pikey,21/02/1992,29.0,,Swansea,Wales,"5'7""",135 lbs,Chris Rees Academy,Bantamweight,17.0,2.0,6.0,9.0,,17.0,0.0,0.0,3.0,,The Pikey,17.0,2.0,0.0,170.18,61.23,180.34,Orthodox,1992-02-21,2.86,49.0,3.84,53.0,4.92,49.0,58.0,1.0
/fighter/Brett-Martinez-72587,brett martinez,Young Blood,06/10/1986,34.0,,"Slatington, Pennsylvania",United States,"5'6""",165 lbs,Rat Pack Fighting Systems,Welterweight,6.0,2.0,3.0,1.0,,6.0,2.0,3.0,0.0,,,,,,,,,,,,,,,,,,
/fighter/Brett-McDermott-89439,brett mcdermott,The Spartan,,,,"Barrow-in-Furness, Cumbria",England,"5'11""",205 lbs,Flex MMA,Light Heavyweight,9.0,8.0,0.0,1.0,,9.0,2.0,2.0,1.0,,,,,,,,,,,,,,,,,,
/fighter/Brett-Oteri-41574,brett oteri,The Hammer,18/06/1977,44.0,,"Dedham, Massachusetts",United States,"5'11""",155 lbs,FAF Gym,Lightweight,12.0,1.0,7.0,3.0,1.0,12.0,5.0,3.0,1.0,0.0,,,,,,,,,,,,,,,,,
/fighter/Brett-Rogers-16048,brett rogers,Da Grim,17/02/1981,40.0,,"Minneapolis, Minnesota",United States,"6'5""",262 lbs,,Heavyweight,17.0,15.0,0.0,2.0,,17.0,3.0,2.0,5.0,,The Grim,17.0,10.0,0.0,195.58,120.2,205.74,Orthodox,1981-02-17,3.17,44.0,3.2,46.0,0.0,0.0,58.0,0.0
,brett tillis,,,,,,,,,,,,,,,,,,,,,,0.0,0.0,0.0,,65.77,,,,0.0,0.0,0.0,0.0,0.0,0.0,0.0,0.0
/fighter/Brian-Akins-248133,brian akins,Flyin',21/03/1992,29.0,,Illinios,United States,"6'1""",160 lbs,,Welterweight,1.0,0.0,0.0,1.0,,1.0,0.0,0.0,3.0,,,,,,,,,,,,,,,,,,
/fighter/Brian-Albin-26740,brian albin,,17/11/1978,42.0,,"Ridgeland, Mississippi",United States,"0'0""",205 lbs,,Light Heavyweight,8.0,3.0,3.0,2.0,,8.0,3.0,3.0,3.0,,,,,,,,,,,,,,,,,,
/fighter/Brian-Bowles-18944,brian bowles,,22/06/1980,41.0,,"Athens, Georgia",United States,"5'7""",135 lbs,Hardcore Gym,Bantamweight,10.0,3.0,6.0,1.0,,10.0,2.0,1.0,0.0,,,10.0,3.0,0.0,170.18,61.23,177.8,Orthodox,1980-06-22,2.36,26.0,2.98,64.0,1.39,70.0,54.0,1.4
/fighter/Brian-Camozzi-101093,brian camozzi,The Mantis,24/06/1991,30.0,,"Parker, Colorado",United States,"6'2""",170 lbs,Factory X,Welterweight,7.0,3.0,4.0,0.0,,7.0,2.0,1.0,2.0,,Mantis,7.0,5.0,0.0,187.96,77.11,198.12,Orthodox,1991-06-24,3.15,26.0,6.39,54.0,0.0,0.0,0.0,0.7
/fighter/Brian-Choi-67174,brian choi,The Polar Bear,10/09/1983,37.0,,Seoul,South Korea,"5'8""",143 lbs,Team Posse,Featherweight,3.0,0.0,1.0,2.0,,3.0,0.0,1.0,3.0,,,,,,,,,,,,,,,,,,
/fighter/Brian-Cobb-5739,brian cobb,The Bandit,03/09/1980,40.0,,"Bakersfield, California",United States,"5'11""",155 lbs,Team Pain and Suffering,Lightweight,20.0,3.0,12.0,5.0,,20.0,2.0,5.0,2.0,,,20.0,9.0,0.0,180.34,70.31,,Orthodox,,0.0,0.0,3.68,55.0,5.81,50.0,0.0,0.0
/fighter/Brian-Davidson-32079,brian davidson,Mr. D,22/11/1975,45.0,,"Lee's Summit, Missouri",United States,"5'8""",145 lbs,K2L Grindhouse,Featherweight,13.0,6.0,2.0,5.0,,13.0,2.0,1.0,1.0,,,13.0,4.0,0.0,167.64,65.77,,,,0.0,0.0,0.0,0.0,0.0,0.0,0.0,0.0
/fighter/Brian-Ebersole-3015,brian ebersole,Bad Boy,27/11/1980,40.0,,"Bradley, Illinois",United States,"6'0""",170 lbs,Tiger Muay Thai,Welterweight,51.0,17.0,17.0,17.0,,51.0,2.0,8.0,8.0,,Bad Boy,51.0,18.0,1.0,182.88,77.11,185.42,Southpaw,1980-11-27,2.32,49.0,2.14,56.0,1.7,23.0,61.0,0.1
/fighter/Brian-Eckstein-17313,brian eckstein,,06/03/1985,36.0,,"Orlando, Florida",United States,"5'6""",135 lbs,American Top Team,Bantamweight,5.0,1.0,1.0,3.0,,5.0,1.0,0.0,0.0,,,,,,,,,,,,,,,,,,
/fighter/Brian-Foster-17723,brian foster,,04/04/1984,37.0,,"Sallisaw, Oklahoma",United States,"5'10""",155 lbs,Factory X,Lightweight,29.0,15.0,13.0,1.0,0.0,29.0,2.0,9.0,0.0,1.0,The Foster Boy,27.0,10.0,0.0,175.26,77.11,180.34,Orthodox,1984-04-03,3.3,39.0,1.63,65.0,3.67,60.0,37.0,1.8
/fighter/Brian-Gassaway-886,brian gassaway,Mandingo,07/08/1972,49.0,,"Chicago, Illinois",United States,"6'0""",171 lbs,,Welterweight,29.0,6.0,11.0,10.0,2.0,29.0,2.0,10.0,7.0,1.0,,29.0,20.0,2.0,185.42,77.11,,Orthodox,1972-08-07,0.34,26.0,3.65,44.0,0.0,0.0,42.0,0.0
/fighter/Brian-Geraghty-5269,brian geraghty,,04/11/1980,40.0,,"Pleasant Prairie, Wisconsin",United States,"5'7""",155 lbs,Freestyle Academy,Lightweight,26.0,7.0,14.0,5.0,,26.0,5.0,4.0,9.0,,Duke,26.0,18.0,1.0,170.18,70.31,,Orthodox,1980-11-04,0.47,25.0,9.77,36.0,0.0,0.0,50.0,0.0
/fighter/Brian-Green-4164,brian green,,05/09/1985,35.0,,"Des Moines, Iowa",United States,"5'11""",194 lbs,,Light Heavyweight,32.0,8.0,24.0,0.0,,32.0,10.0,8.0,6.0,,,,,,,,,,,,,,,,,,
/fighter/Brian-Grinnell-62329,brian grinnell,,17/01/1988,33.0,,"Ada, Oklahoma",United States,"5'9""",170 lbs,Apex MMA,Welterweight,11.0,1.0,9.0,1.0,,11.0,6.0,3.0,1.0,,,,,,,,,,,,,,,,,,
/fighter/Brian-Hall-54190,brian hall,The Law,13/06/1982,39.0,,"Memphis, Tennessee",United States,"5'5""",125 lbs,Memphis Judo & Jiu-Jitsu,Flyweight,9.0,4.0,4.0,1.0,,9.0,2.0,0.0,2.0,,,,,,,,,,,,,,,,,,
/fighter/Brian-Houston-59769,brian houston,B-Hue,26/04/1987,34.0,,"Omaha, Nebraska",United States,"6'1""",185 lbs,Disorderly Conduct,Middleweight,6.0,5.0,0.0,1.0,,6.0,2.0,2.0,2.0,,B-Hue,4.0,6.0,0.0,187.96,83.91,,Orthodox,1981-04-26,1.9,35.0,3.67,53.0,0.95,100.0,87.0,0.0
/fighter/Brian-Imes-34983,brian imes,,06/05/1978,43.0,,"Kansas City, Missouri",United States,"6'5""",205 lbs,Premier Martial Arts,Light Heavyweight,8.0,3.0,5.0,0.0,,8.0,5.0,4.0,2.0,,,,,,,,,,,,,,,,,,
/fighter/Brian-Johnston-137,brian johnston,Fury,28/07/1968,53.0,,"San Jose, California",United States,"6'4""",222 lbs,American Kickboxing Academy,Heavyweight,5.0,3.0,2.0,0.0,,5.0,2.0,3.0,0.0,,,5.0,5.0,0.0,190.5,104.33,,Orthodox,,0.0,0.0,0.0,0.0,0.0,0.0,0.0,0.0
/fighter/Brian-Kelleher-53666,brian kelleher,Boom,19/08/1986,34.0,,"Selden, New York",United States,"5'6""",145 lbs,Maxum BJJ,Featherweight,22.0,8.0,10.0,4.0,,22.0,1.0,6.0,5.0,,Boom,24.0,14.0,0.0,167.64,61.23,167.64,Switch,1986-08-19,3.36,41.0,4.61,54.0,1.79,42.0,60.0,0.7
,brian lo-a-njoe,,,,,,,,,,,,,,,,,,,,,,6.0,10.0,3.0,170.18,70.31,,Orthodox,,3.87,42.0,0.0,0.0,0.0,0.0,66.0,0.0
,brian mclaughlin,,,,,,,,,,,,,,,,,,,,,,6.0,2.0,0.0,175.26,70.31,,,,0.0,0.0,0.0,0.0,0.0,0.0,0.0,0.0
/fighter/Brian-Melancon-43621,brian melancon,,28/05/1982,39.0,,"Houston, Texas",United States,"5'8""",170 lbs,Paradigm Training Center,Welterweight,7.0,4.0,1.0,2.0,,7.0,0.0,1.0,2.0,,,7.0,3.0,0.0,172.72,77.11,,Orthodox,1982-05-28,4.18,49.0,3.64,64.0,2.02,100.0,66.0,0.0
/fighter/Brian-Moore-64364,brian moore,The Pikeman,13/08/1987,33.0,,"Wexford, Leinster",Ireland,"5'8""",145 lbs,SBG Ireland,Featherweight,14.0,4.0,6.0,4.0,,14.0,1.0,2.0,4.0,,,,,,,,,,,,,,,,,,
/fighter/Brian-Ortega-65310,brian ortega,T-City,21/02/1991,30.0,,"Torrance, California",United States,"5'9""",145 lbs,Black House,Featherweight,15.0,3.0,7.0,5.0,,15.0,1.0,0.0,0.0,,T-City,15.0,3.0,0.0,172.72,65.77,175.26,Switch,1991-02-21,4.19,38.0,6.66,49.0,0.95,23.0,56.0,1.2
/fighter/Brian-Rogers-22583,brian rogers,The Professional Predator,15/02/1984,37.0,,"Independence, Ohio",United States,"5'11""",185 lbs,Factory X,Middleweight,14.0,10.0,2.0,2.0,,14.0,4.0,0.0,5.0,,The Professional Predator,14.0,9.0,0.0,180.34,83.91,,,,4.79,38.0,5.76,58.0,1.22,50.0,100.0,0.6
,brian schwartz,,,,,,,,,,,,,,,,,,,,,,1.0,1.0,0.0,190.5,77.11,,Orthodox,,1.27,44.0,0.87,45.0,0.0,0.0,50.0,1.0
,brian sleeman,,,,,,,,,,,,,,,,,,,,,,9.0,9.0,1.0,172.72,83.91,,,,4.0,48.0,1.85,70.0,9.23,100.0,100.0,0.0
/fighter/Brian-Stann-14829,brian stann,All-American,24/09/1980,40.0,,"Jacksonville, North Carolina",United States,"6'1""",185 lbs,Jackson-Wink MMA,Middleweight,12.0,9.0,1.0,2.0,,12.0,2.0,2.0,2.0,,All American,12.0,6.0,0.0,185.42,92.99,187.96,Orthodox,1980-09-24,3.28,42.0,2.65,59.0,0.12,12.0,60.0,0.3
/fighter/Brian-van-Hoven-47825,brian van hoven,Vicious,27/04/1974,47.0,,"Fairfax, Virginia",United States,"5'9""",155 lbs,,Lightweight,8.0,2.0,2.0,4.0,,8.0,1.0,3.0,3.0,,,,,,,,,,,,,,,,,,
/fighter/Brian-Warren-99,brian warren,Mr. Unbreakable,05/06/1974,47.0,,"San Bernardino, California",United States,"6'0""",185 lbs,Unbreakable Gym,Middleweight,18.0,6.0,7.0,5.0,,18.0,6.0,7.0,4.0,,Mr. Unbreakable,18.0,17.0,1.0,182.88,83.91,,Orthodox,,1.16,21.0,4.63,57.0,0.0,0.0,0.0,0.0
/fighter/Brian-White-32473,brian white,,,,,"Pontotoc, Mississippi",United States,"6'1""",170 lbs,,Welterweight,5.0,4.0,1.0,0.0,0.0,5.0,3.0,3.0,0.0,1.0,,,,,,,,,,,,,,,,,
/fighter/Brianata-Rosadhi-126095,brianata rosadhi,The Farmer,,,,"Solo, Central Java",Indonesia,"5'5""",122 lbs,Hans Fight Club,Flyweight,6.0,0.0,5.0,1.0,,6.0,3.0,2.0,0.0,,,,,,,,,,,,,,,,,,
,brianna fortino,,,,,,,,,,,,,,,,,,,,,The Bull,9.0,3.0,0.0,152.4,52.16,157.48,Southpaw,1993-08-04,3.53,41.0,3.23,57.0,2.5,45.0,66.0,0.0
/fighter/Brianna-Van-Buren-98559,brianna van buren,Tha Bull,04/08/1993,28.0,,"Gilroy, California",United States,"4'11""",115 lbs,American Kickboxing Academy,Strawweight,9.0,2.0,3.0,4.0,,9.0,0.0,0.0,3.0,,,,,,,,,,,,,,,,,,
/fighter/Bristol-Marunde-12961,bristol marunde,,20/04/1982,39.0,,"Las Vegas, Nevada",United States,"6'1""",171 lbs,Syndicate MMA,Welterweight,16.0,3.0,6.0,7.0,,16.0,5.0,3.0,2.0,,,16.0,10.0,0.0,185.42,77.11,190.5,Orthodox,1982-04-20,1.42,21.0,4.4,47.0,1.6,33.0,14.0,0.0
/fighter/Brittney-Elkin-101013,brittney elkin,,11/06/1986,35.0,,"Gillette, Wyoming",United States,"5'11""",155 lbs,FusBoxe,Lightweight,3.0,1.0,0.0,2.0,,3.0,3.0,3.0,1.0,,,,,,,,,,,,,,,,,,
/fighter/Brock-Jardine-36630,brock jardine,The Machine,10/07/1985,36.0,,"Orem, Utah",United States,"5'11""",170 lbs,The Pit Elevated Fight Team,Welterweight,12.0,5.0,4.0,3.0,,12.0,3.0,1.0,2.0,,The Machine,12.0,6.0,0.0,180.34,77.11,,Orthodox,1985-07-10,1.06,30.0,3.34,56.0,0.0,0.0,14.0,0.8
/fighter/Brock-Kerry-20029,brock kerry,,,,,,United States,"0'0""",135 lbs,,Bantamweight,9.0,3.0,5.0,1.0,,9.0,1.0,2.0,4.0,,,,,,,,,,,,,,,,,,
/fighter/Brock-Larson-6373,brock larson,,23/08/1977,43.0,,"Brainerd, Minnesota",United States,"5'11""",170 lbs,Get Sum Athletic Compound,Welterweight,42.0,15.0,21.0,5.0,1.0,42.0,3.0,2.0,5.0,0.0,,42.0,10.0,0.0,180.34,77.11,180.34,Southpaw,1977-08-23,1.39,46.0,1.5,55.0,2.67,34.0,43.0,2.0
/fighter/Brock-Lesnar-17522,brock lesnar,,12/07/1977,44.0,,"Webster, South Dakota",United States,"6'3""",265 lbs,Team Death Clutch,Heavyweight,5.0,3.0,1.0,1.0,,5.0,2.0,1.0,0.0,,,5.0,3.0,0.0,190.5,120.2,205.74,Orthodox,1977-07-12,3.53,72.0,2.11,50.0,3.9,55.0,60.0,0.5
/fighter/Brodie-Farber-6123,brodie farber,,,,,"Grass Valley, California",United States,"6'1""",205 lbs,Tiger Muay Thai,Light Heavyweight,17.0,4.0,11.0,2.0,,17.0,4.0,2.0,1.0,,,16.0,7.0,0.0,185.42,77.11,,Orthodox,1980-07-05,1.69,45.0,2.17,53.0,0.9,50.0,20.0,0.9
/fighter/Brogan-StewartNg-124477,brogan stewart-ng,Broken Heart,,,,Oregon,United States,"5'9""",145 lbs,F.A. Group Muay Thai Gym,Featherweight,2.0,0.0,2.0,0.0,,2.0,0.0,0.0,0.0,,,,,,,,,,,,,,,,,,
,brogan walker,,,,,,,,,,,,,,,,,,,,,The Bear,8.0,4.0,0.0,162.56,56.7,170.18,Switch,1988-08-02,2.04,30.0,3.7,47.0,0.0,0.0,11.0,0.0
/fighter/Brok-Weaver-53819,brok weaver,Chata Tuska,05/12/1991,29.0,,"McIntosh, Alabama",United States,"6'0""",170 lbs,American Top Team,Welterweight,17.0,3.0,3.0,9.0,2.0,17.0,1.0,3.0,2.0,0.0,Chata Tuska,15.0,6.0,0.0,182.88,70.31,185.42,Southpaw,1991-12-05,4.78,64.0,4.35,46.0,0.41,10.0,66.0,0.4
/fighter/Bronson-Mohika-125969,bronson mohika,,,,,"Dublin, California",United States,"5'7""",135 lbs,808 Fight Factory,Bantamweight,1.0,0.0,0.0,1.0,,1.0,0.0,1.0,0.0,,,1.0,1.0,0.0,,61.23,,,,0.0,0.0,0.0,0.0,0.0,0.0,0.0,0.0
/fighter/Bronson-St-Romaine-240623,bronson st. romaine,,,,,"Lafayette, Louisiana",United States,"6'1""",235 lbs,,Heavyweight,1.0,0.0,0.0,1.0,,1.0,0.0,0.0,0.0,,,,,,,,,,,,,,,,,,
/fighter/Brooke-Mayo-199381,brooke mayo,The Bully,10/08/1992,29.0,,"Pleasanton, California",United States,"5'7""",125 lbs,Team Alpha Male,Flyweight,0.0,0.0,0.0,0.0,,0.0,1.0,0.0,2.0,,The Bully,0.0,1.0,0.0,170.18,56.7,,,,1.92,34.0,3.2,63.0,3.2,60.0,0.0,2.1
/fighter/Bruce-Loh-88797,bruce loh,,,,,,Singapore,"5'6""",125 lbs,Impact MMA Singapore,Flyweight,2.0,0.0,1.0,1.0,,2.0,3.0,0.0,0.0,,,,,,,,,,,,,,,,,,
,bruna brasil,,,,,,,,,,,,,,,,,,,,,,9.0,3.0,1.0,167.64,52.16,165.1,Orthodox,1993-09-07,3.44,68.0,3.94,53.0,1.86,66.0,53.0,0.0
/fighter/Bruna-Ellen-183331,bruna ellen,,26/06/1996,25.0,,"Campinas, Sao Paulo",Brazil,"5'4""",125 lbs,Team Nogueira Campinas,Flyweight,5.0,1.0,0.0,4.0,,5.0,0.0,0.0,3.0,,,,,,,,,,,,,,,,,,
/fighter/Bruna-Vargas-146501,bruna vargas,,25/09/1989,31.0,,"Porto Alegre, Rio Grande do Sul",Brazil,"5'5""",115 lbs,Top Brother,Strawweight,4.0,1.0,1.0,2.0,,4.0,0.0,1.0,2.0,,,,,,,,,,,,,,,,,,
,brunno ferreira,,,,,,,,,,,,,,,,,,,,,The Hulk,10.0,1.0,0.0,177.8,83.91,182.88,Orthodox,1992-11-04,5.79,53.0,5.22,47.0,0.0,0.0,50.0,0.0
,bruno assis,,,,,,,,,,,,,,,,,,,,,Brunao,8.0,4.0,0.0,187.96,83.91,,Orthodox,1992-05-23,1.27,43.0,3.2,36.0,2.0,50.0,66.0,1.0
/fighter/Bruno-Carvalho-57137,bruno carvalho,,07/06/1982,39.0,,"Curitiba, Parana",Brazil,"5'8""",155 lbs,Evolucao Thai,Lightweight,11.0,5.0,4.0,2.0,,11.0,1.0,2.0,2.0,,,10.0,5.0,0.0,172.72,69.85,,,,0.6,45.0,0.93,53.0,0.0,0.0,66.0,4.0
/fighter/Bruno-Casillas-72980,bruno casillas,,,,,"Santa Barbara, California",United States,"6'1""",205 lbs,Valhalla Elite Training Center,Light Heavyweight,1.0,1.0,0.0,0.0,,1.0,2.0,1.0,0.0,,,,,,,,,,,,,,,,,,
,bruno korea,,,,,,,,,,,,,,,,,,,,,,7.0,3.0,0.0,167.64,61.23,165.1,,,2.12,34.0,3.96,42.0,0.0,0.0,25.0,0.0
,bruno lopes,,,,,,,,,,,,,,,,,,,,,Brunao,11.0,1.0,0.0,187.96,92.99,190.5,Orthodox,1993-04-24,5.29,35.0,8.46,53.0,0.0,0.0,0.0,0.0
,bruno oliveira,,,,,,,,,,,,,,,,,,,,,,8.0,2.0,0.0,193.04,92.99,203.2,Orthodox,1984-05-02,3.44,33.0,4.92,54.0,0.0,0.0,0.0,0.0
/fighter/Bruno-Pucci-94357,bruno pucci,,23/07/1990,31.0,,,Brazil,"5'9""",145 lbs,Evolve MMA,Featherweight,7.0,1.0,6.0,0.0,,7.0,4.0,0.0,1.0,,,,,,,,,,,,,,,,,,
/fighter/Bruno-Rodrigues-Mesquita-57480,bruno rodrigues mesquita,Korea,28/06/1991,30.0,,"Rio de Janeiro, Rio de Janeiro",Brazil,"5'6""",125 lbs,Tata Fight Team,Flyweight,12.0,1.0,7.0,4.0,,12.0,0.0,1.0,2.0,,,,,,,,,,,,,,,,,,
/fighter/Bruno-Santos-48052,bruno santos,Carioca,17/07/1987,34.0,,"Macae, Rio de Janeiro",Brazil,"5'8""",185 lbs,MMA Masters,Middleweight,18.0,1.0,1.0,16.0,,18.0,2.0,0.0,2.0,,Carioca,15.0,2.0,0.0,175.26,83.91,,Orthodox,1987-07-17,1.18,46.0,2.27,56.0,3.0,37.0,66.0,0.3
/fighter/Bruno-Silva-118601,bruno silva,Bulldog,16/03/1990,31.0,,"Piracicaba, Sao Paulo",Brazil,"5'4""",125 lbs,Pitbull Brothers,Flyweight,12.0,5.0,3.0,4.0,,12.0,1.0,1.0,3.0,,Bulldog,13.0,5.0,2.0,162.56,56.7,165.1,Orthodox,1990-03-16,3.05,46.0,3.09,59.0,2.57,30.0,64.0,0.3
,bruno souza,,,,,,,,,,,,,,,,,,,,,The Tiger,10.0,3.0,0.0,177.8,65.77,177.8,Orthodox,1996-03-07,3.73,39.0,5.3,45.0,0.5,16.0,60.0,0.0
/fighter/Bryan-Baker-18467,bryan baker,The Beast,13/10/1985,35.0,,"West Covina, California",United States,"6'3""",170 lbs,Team Wildman Vale Tudo,Welterweight,18.0,8.0,3.0,7.0,,18.0,3.0,1.0,1.0,,The Beast,18.0,5.0,0.0,190.5,83.91,,Orthodox,1985-10-13,1.78,52.0,2.83,45.0,0.44,50.0,37.0,0.9
/fighter/Bryan-Barberena-51471,bryan barberena,Bam Bam,03/05/1989,32.0,,"Minneapolis, Minnesota",United States,"6'0""",170 lbs,MMA Lab,Welterweight,15.0,10.0,2.0,3.0,,15.0,2.0,1.0,5.0,,Bam Bam,18.0,11.0,0.0,182.88,77.11,182.88,Southpaw,1989-05-03,5.53,48.0,4.74,44.0,0.14,22.0,49.0,0.3
,bryan battle,,,,,,,,,,,,,,,,,,,,,Pooh Bear,11.0,2.0,0.0,185.42,77.11,195.58,Orthodox,1994-09-21,4.52,54.0,3.73,42.0,0.94,25.0,45.0,0.6
/fighter/Bryan-Bautista-251093,bryan bautista,The Ecuadorian Warrior,,,,"Milwaukee, Wisconsin",United States,"5'7""",135 lbs,Roufusport,Bantamweight,3.0,0.0,3.0,0.0,,3.0,0.0,1.0,0.0,,,,,,,,,,,,,,,,,,
/fighter/Bryan-Caraway-13791,bryan caraway,Kid Lightning,04/08/1984,37.0,,"Seattle, Washington",United States,"5'9""",135 lbs,Xtreme Couture,Bantamweight,22.0,2.0,16.0,4.0,,22.0,2.0,2.0,5.0,,Kid Lightning,21.0,9.0,0.0,172.72,61.23,172.72,Orthodox,1984-08-04,2.53,34.0,3.61,54.0,2.57,25.0,80.0,0.8
/fighter/Bryan-Corley-26872,bryan corley,The Surgeon,26/01/1980,41.0,,"Omaha, Nebraska",United States,"5'9""",149 lbs,,Lightweight,2.0,1.0,1.0,0.0,,2.0,1.0,1.0,0.0,,,,,,,,,,,,,,,,,,
/fighter/Bryan-Goldsby-20999,bryan goldsby,,24/03/1982,39.0,,"Macon, Georgia",United States,"5'9""",134 lbs,Team Jorge Gurgel,Bantamweight,17.0,10.0,1.0,6.0,,17.0,2.0,7.0,7.0,,,,,,,,,,,,,,,,,,
,bryan humes,,,,,,,,,,,,,,,,,,,,,,6.0,2.0,0.0,,120.2,,,,0.0,0.0,0.0,0.0,0.0,0.0,0.0,0.0
,bryan pardoe,,,,,,,,,,,,,,,,,,,,,Pain Inducer,13.0,16.0,0.0,185.42,92.99,,Orthodox,,1.11,36.0,4.59,45.0,4.75,40.0,33.0,0.0
/fighter/Bryan-Travers-12969,bryan travers,The Bull,,,,"Bakersfield, California",United States,"5'10""",165 lbs,Academy of Martial Arts and Fitness,Welterweight,15.0,2.0,6.0,7.0,,15.0,0.0,3.0,1.0,,,15.0,4.0,0.0,,70.31,,,,2.33,48.0,3.93,55.0,2.0,28.0,63.0,0.0
,bryan vetell,,,,,,,,,,,,,,,,,,,,,,4.0,3.0,0.0,190.5,120.2,,Southpaw,1977-07-26,2.74,60.0,2.13,41.0,0.0,0.0,0.0,0.0
/fighter/Bryanna-Fissori-124301,bryanna fissori,The Pink Ranger,03/03/1985,36.0,,"Honolulu, Hawaii",United States,"5'6""",135 lbs,UFC Gym BJ Penn,Bantamweight,2.0,1.0,0.0,1.0,,2.0,2.0,0.0,3.0,,,2.0,4.0,0.0,162.56,65.77,,,,1.4,46.0,1.2,57.0,2.0,25.0,50.0,0.0
/fighter/Bryce-Edminister-75890,bryce edminister,The Vice,30/08/1991,29.0,,"Layton, Utah",United States,"5'8""",145 lbs,KOA Kingdom,Featherweight,2.0,1.0,1.0,0.0,,2.0,1.0,0.0,1.0,,,,,,,,,,,,,,,,,,
/fighter/Bryce-Logan-98125,bryce logan,,04/12/1989,31.0,,"Sioux Falls, South Dakota",United States,"5'9""",155 lbs,Power MMA Team,Lightweight,12.0,2.0,2.0,8.0,,12.0,2.0,1.0,2.0,,,,,,,,,,,,,,,,,,
,bryce mejia,,,,,,,,,,,,,,,,,,,,,,3.0,1.0,0.0,185.42,77.11,,,,3.49,62.0,6.98,50.0,0.0,0.0,0.0,0.0
/fighter/Bryce-Mitchell-151837,bryce mitchell,Thug Nasty,04/10/1994,26.0,,"Sherwood, Arkansas",United States,"5'9""",145 lbs,Barata MMA,Featherweight,14.0,0.0,9.0,5.0,,14.0,0.0,0.0,0.0,,Thug Nasty,16.0,2.0,0.0,177.8,65.77,177.8,Southpaw,1994-10-04,2.34,58.0,1.64,58.0,3.51,41.0,33.0,1.6
/fighter/Bryce-ShepardMejia-113679,bryce shepard-mejia,,,,,"San Diego, California",United States,"6'1""",170 lbs,International Self Defense,Welterweight,3.0,1.0,2.0,0.0,,3.0,1.0,0.0,0.0,,,,,,,,,,,,,,,,,,
/fighter/Brylan-Van-Artsdalen-42039,brylan van artsdalen,,14/08/1984,36.0,,"Palmyra, Pennsylvania",United States,"5'8""",146 lbs,Daddis Fight Camps,Featherweight,9.0,1.0,8.0,0.0,,9.0,0.0,12.0,0.0,,,,,,,,,,,,,,,,,,
/fighter/Bryony-Tyrell-145135,bryony tyrell,,,,,"Southampton, Hampshire",England,"0'0""",115 lbs,Exiles MMA,Strawweight,4.0,1.0,1.0,2.0,,4.0,3.0,1.0,0.0,,,,,,,,,,,,,,,,,,
/fighter/Bryson-Bolohao-230395,bryson bolohao,,,,,Hawaii,United States,"0'0""",155 lbs,,Lightweight,0.0,0.0,0.0,0.0,,0.0,0.0,2.0,0.0,,,,,,,,,,,,,,,,,,
,bryson kamaka,,,,,,,,,,,,,,,,,,,,,,12.0,20.0,1.0,180.34,77.11,,Orthodox,,9.47,60.0,12.63,0.0,0.0,0.0,100.0,0.0
/fighter/Bu-Huo-You-Ga-214717,bu huo you ga,The Son of the Yi,03/08/1992,29.0,,,China,"5'3""",145 lbs,Chongqing Monster MMA Fight Club,Featherweight,9.0,1.0,3.0,5.0,,9.0,0.0,1.0,10.0,,,,,,,,,,,,,,,,,,
,bu-kyung jung,,,,,,,,,,,,,,,,,,,,,,0.0,4.0,0.0,170.18,69.85,,Orthodox,1978-05-26,0.63,36.0,1.85,56.0,1.1,75.0,0.0,1.5
/fighter/Bubba-Bush-29111,bubba bush,The Fightin' Texas Aggie,24/07/1985,36.0,,"College Station, Texas",United States,"6'0""",185 lbs,Brazos Valley MMA,Middleweight,8.0,4.0,3.0,1.0,0.0,8.0,2.0,0.0,0.0,1.0,The Fightin' Texas Aggie,8.0,3.0,0.0,182.88,83.91,,Orthodox,1985-07-24,0.63,55.0,7.01,25.0,2.82,50.0,60.0,0.0
/fighter/Bubba-Jenkins-85196,bubba jenkins,I'm A Bad Man,05/02/1988,33.0,,"Corona, California",United States,"5'7""",145 lbs,Kings MMA,Featherweight,16.0,6.0,3.0,7.0,,16.0,2.0,2.0,0.0,,The Highlight Kid,11.0,4.0,0.0,170.18,65.77,,,,2.41,37.0,1.58,67.0,7.23,68.0,100.0,0.0
/fighter/Bubba-McDaniel-14600,bubba mcdaniel,The Menace,03/05/1983,38.0,,"Wichita Falls, Texas",United States,"6'3""",204 lbs,,Light Heavyweight,30.0,9.0,19.0,2.0,,30.0,3.0,6.0,1.0,,,,,,,,,,,,,,,,,,
/fighter/Bubba-Pugh-95997,bubba pugh,,,,,California,United States,"0'0""",185 lbs,Excel Jiu-Jitsu,Middleweight,3.0,1.0,2.0,0.0,,3.0,1.0,0.0,2.0,,,3.0,3.0,0.0,177.8,83.91,,,,2.87,67.0,2.6,23.0,4.0,57.0,80.0,0.0
,buck meredith,,,,,,,,,,,,,,,,,,,,,,3.0,3.0,0.0,187.96,83.91,,,,0.0,0.0,0.0,0.0,0.0,0.0,0.0,0.0
/fighter/Buddy-Roberts-23811,buddy roberts,,17/10/1982,38.0,,"Albuquerque, New Mexico",United States,"6'2""",185 lbs,Jackson-Wink MMA,Middleweight,12.0,4.0,5.0,3.0,,12.0,2.0,1.0,0.0,,,12.0,3.0,0.0,187.96,83.91,,Orthodox,1982-10-17,2.17,34.0,2.08,70.0,0.0,0.0,76.0,0.7
/fighter/Burenzorig-Batmunkh-83220,burenzorig batmunkh,,25/09/1985,35.0,,,Mongolia,"5'9""",155 lbs,Team Fighter,Lightweight,10.0,2.0,2.0,6.0,,10.0,2.0,5.0,3.0,,,,,,,,,,,,,,,,,,
/fighter/Byron-Bloodworth-17355,byron bloodworth,,16/08/1983,37.0,,"Atlanta, Georgia",United States,"5'9""",135 lbs,Iron Clutch Fitness,Bantamweight,6.0,1.0,2.0,3.0,,6.0,2.0,1.0,0.0,,,6.0,3.0,0.0,172.72,61.23,,Orthodox,1983-08-16,1.82,28.0,5.18,50.0,0.0,0.0,0.0,0.0
/fighter/Byron-Stevens-223889,byron stevens,,29/04/1993,28.0,,"St. Louis, Missouri",United States,"5'11""",263 lbs,,Heavyweight,2.0,1.0,0.0,1.0,,2.0,1.0,0.0,0.0,,,,,,,,,,,,,,,,,,
/fighter/Byung-Hee-Lim-173197,byung hee lim,The Lucky Guy,,,,,South Korea,"5'9""",145 lbs,Extreme Combat,Featherweight,4.0,3.0,0.0,1.0,,4.0,0.0,1.0,3.0,,,,,,,,,,,,,,,,,,
/fighter/CB-Dollaway-22350,c.b. dollaway,The Doberman,10/08/1983,38.0,,"Tempe, Arizona",United States,"6'2""",185 lbs,Power MMA Team,Middleweight,17.0,6.0,3.0,7.0,1.0,17.0,6.0,2.0,2.0,0.0,,,,,,,,,,,,,,,,,
/fighter/CJ-Hamilton-71119,c.j. hamilton,The Autobot,07/10/1986,34.0,,"Hartwell, Georgia",United States,"5'7""",125 lbs,Contemporary Martial Arts,Flyweight,15.0,4.0,2.0,9.0,,15.0,1.0,3.0,5.0,,,,,,,,,,,,,,,,,,
/fighter/CJ-Keith-70452,c.j. keith,,09/08/1986,35.0,,"Porterville, California",United States,"6'0""",155 lbs,Pro Buhawe,Lightweight,8.0,3.0,2.0,3.0,,8.0,2.0,1.0,1.0,,,,,,,,,,,,,,,,,,
/fighter/CJ-Meeks-40240,c.j. meeks,,,,,,England,"0'0""",185 lbs,,Middleweight,5.0,0.0,5.0,0.0,,5.0,1.0,2.0,0.0,,,,,,,,,,,,,,,,,,
/fighter/Cai-Chang-Bo-214845,cai  chang bo,,12/03/1996,25.0,,,China,"0'0""",135 lbs,Changsha Ge Rui Muay Thai,Bantamweight,0.0,0.0,0.0,0.0,,0.0,0.0,1.0,0.0,,,,,,,,,,,,,,,,,,
/fighter/Cain-Carrizosa-84645,cain carrizosa,The Insane,22/07/1986,35.0,,"Woodlake, California",United States,"5'8""",155 lbs,Elite Team,Lightweight,11.0,3.0,3.0,5.0,,11.0,1.0,1.0,2.0,,The Insane,10.0,3.0,0.0,172.72,70.31,,Orthodox,1986-07-22,2.72,42.0,5.8,51.0,0.0,0.0,14.0,0.0
/fighter/Cain-Velasquez-19102,cain velasquez,,28/07/1982,39.0,,"Salinas, California",United States,"6'1""",241 lbs,American Kickboxing Academy,Heavyweight,14.0,12.0,0.0,2.0,,14.0,2.0,1.0,0.0,,,14.0,3.0,0.0,185.42,108.86,195.58,Orthodox,1982-07-28,6.37,57.0,2.33,57.0,5.13,45.0,85.0,0.4
,caio bittencourt,,,,,,,,,,,,,,,,,,,,,Leao,14.0,7.0,0.0,182.88,83.91,190.5,Orthodox,1991-05-22,0.29,16.0,0.57,33.0,0.0,0.0,0.0,0.0
,caio borralho,,,,,,,,,,,,,,,,,,,,,The Natural,15.0,1.0,0.0,177.8,83.91,190.5,Southpaw,1993-01-16,2.73,58.0,1.98,60.0,2.16,63.0,57.0,0.5
,caio machado,,,,,,,,,,,,,,,,,,,,,Bigfoot,8.0,2.0,1.0,193.04,113.4,198.12,Southpaw,1994-07-20,6.57,64.0,1.87,64.0,0.0,0.0,82.0,0.0
/fighter/Caio-Magalhaes-51163,caio magalhaes,Hellboy,14/12/1987,33.0,,"Fortaleza, Ceara",Brazil,"6'1""",185 lbs,Teixeira MMA & Fitness,Middleweight,10.0,3.0,4.0,3.0,,10.0,2.0,1.0,4.0,,Hellboy,10.0,3.0,0.0,185.42,83.91,185.42,Orthodox,1987-12-14,2.27,40.0,2.78,56.0,1.05,15.0,58.0,1.6
/fighter/Caitlin-McEwen-220205,caitlin mcewen,,26/11/1996,24.0,,"Canberra, Australian Capital Territory",Australia,"5'4""",133 lbs,Stockade Training Centre,Bantamweight,4.0,3.0,1.0,0.0,,4.0,0.0,0.0,2.0,,,,,,,,,,,,,,,,,,
/fighter/Cal-Worsham-113,cal worsham,,11/06/1963,,28/11/2018,"Folsom, California",United States,"5'10""",230 lbs,Worsham Team X,Heavyweight,13.0,12.0,1.0,0.0,,13.0,7.0,2.0,1.0,,,13.0,10.0,0.0,180.34,104.33,,Orthodox,,0.0,0.0,0.0,0.0,0.0,0.0,0.0,0.0
/fighter/Cale-Yarbrough-34073,cale yarbrough,,27/12/1986,34.0,,"Atlanta, Georgia",United States,"6'2""",203 lbs,Hardcore Gym,Light Heavyweight,8.0,5.0,2.0,1.0,,8.0,1.0,1.0,1.0,,,8.0,3.0,0.0,185.42,83.91,,Orthodox,1986-12-27,3.16,27.0,10.0,72.0,0.0,0.0,0.0,0.0
,calen born,,,,,,,,,,,,,,,,,,,,,,7.0,1.0,0.0,172.72,77.11,182.88,Switch,1988-05-24,0.0,0.0,0.0,0.0,0.0,0.0,0.0,0.0
/fighter/Callan-Potter-105689,callan potter,The Rockstar,06/09/1984,36.0,,"Kensington, Victoria",Australia,"6'1""",155 lbs,Renegade MMA,Lightweight,18.0,6.0,10.0,2.0,,18.0,5.0,4.0,0.0,,The Rockstar,18.0,9.0,0.0,182.88,77.11,182.88,Orthodox,1984-06-09,3.18,50.0,4.72,58.0,3.29,66.0,100.0,0.0
/fighter/Callum-Ellenor-77142,callum ellenor,Cal Pacino,04/04/1991,30.0,,"Sunderland, Tyne and Wear",England,"5'7""",134 lbs,Team Fish Tank,Bantamweight,8.0,2.0,6.0,0.0,,8.0,0.0,1.0,2.0,,,,,,,,,,,,,,,,,,
/fighter/Callum-Murrie-71872,callum murrie,Bundy,,,,Clackmannanshire,Scotland,"5'11""",145 lbs,Dinky Ninjas,Featherweight,5.0,0.0,4.0,1.0,,5.0,0.0,0.0,3.0,,,,,,,,,,,,,,,,,,
,caludia gadelha,,,,,,,,,,,,,,,,,,,,,,,,,,,,,,,,,,,,,
,caludio puelles,,,,,,,,,,,,,,,,,,,,,,,,,,,,,,,,,,,,,
/fighter/Calvin-Kattar-23782,calvin kattar,The Boston Finisher,26/03/1988,33.0,,"Methuen, Massachusetts",United States,"5'11""",145 lbs,Carlos Neto BJJ,Featherweight,22.0,11.0,2.0,9.0,,22.0,0.0,1.0,4.0,,,23.0,7.0,0.0,180.34,65.77,182.88,Orthodox,1988-03-26,5.12,39.0,7.1,54.0,0.42,29.0,91.0,0.1
,cameron church,,,,,,,,,,,,,,,,,,,,,,4.0,1.0,0.0,180.34,70.31,182.88,Orthodox,1990-09-27,4.0,40.0,4.93,50.0,0.0,0.0,60.0,1.0
/fighter/Cameron-Dollar-25531,cameron dollar,The Money Man,12/05/1987,34.0,,"Colorado Springs, Colorado",United States,"5'11""",145 lbs,Colorado Fight Factory,Featherweight,11.0,4.0,6.0,1.0,,11.0,1.0,2.0,2.0,,,11.0,5.0,0.0,180.34,70.31,,Orthodox,1987-05-12,5.04,38.0,2.94,61.0,0.0,0.0,0.0,0.0
/fighter/Cameron-Else-66351,cameron else,Camchida,27/04/1991,30.0,,"Margate, Kent",England,"5'8""",135 lbs,Jackson-Wink MMA,Bantamweight,10.0,6.0,4.0,0.0,,10.0,3.0,1.0,1.0,,Camchida,10.0,6.0,0.0,175.26,61.23,180.34,Switch,1987-04-27,1.99,40.0,8.09,51.0,0.0,0.0,0.0,0.0
,cameron olson,,,,,,,,,,,,,,,,,,,,,Cap'n Crunch,7.0,3.0,0.0,185.42,92.99,190.5,Orthodox,1989-11-22,3.13,47.0,2.2,57.0,3.0,42.0,100.0,1.0
,cameron rowston,,,,,,,,,,,,,,,,,,,,,Van Damme,8.0,2.0,0.0,,83.91,,,,0.0,0.0,0.0,0.0,0.0,0.0,0.0,0.0
,cameron saaiman,,,,,,,,,,,,,,,,,,,,,MSP,9.0,1.0,0.0,172.72,61.23,170.18,Southpaw,2000-12-20,5.28,46.0,3.24,55.0,1.0,36.0,44.0,0.8
,cameron smotherman,,,,,,,,,,,,,,,,,,,,,The Baby-Faced Killa,8.0,4.0,0.0,175.26,61.23,175.26,Orthodox,1997-09-17,4.0,36.0,13.0,35.0,0.0,0.0,0.0,0.0
,cameron vancamp,,,,,,,,,,,,,,,,,,,,,Jumpman,15.0,7.0,1.0,187.96,70.31,187.96,Switch,1993-04-27,5.31,47.0,6.41,40.0,0.0,0.0,0.0,0.0
/fighter/Camila-Rivarola-261277,camila rivarola,,,,,Paris,France,"0'0""",123 lbs,Snake Team,Flyweight,3.0,0.0,1.0,2.0,,3.0,0.0,0.0,2.0,,,,,,,,,,,,,,,,,,
/fighter/Canaan-Grigsby-59332,canaan grigsby,Super Beast,21/06/1980,41.0,,"Tulsa, Oklahoma",United States,"6'3""",185 lbs,918 Factory,Middleweight,8.0,7.0,0.0,1.0,,8.0,3.0,1.0,4.0,,,,,,,,,,,,,,,,,,
/fighter/Canaan-Kawaihae-230231,canaan kawaihae,,26/08/1997,23.0,,"Kailua, Hawaii",United States,"6'0""",145 lbs,Caveirinha Jiu-Jitsu Academy,Featherweight,6.0,1.0,4.0,1.0,,6.0,0.0,0.0,1.0,,,6.0,2.0,0.0,182.88,65.77,180.34,Southpaw,1997-08-26,2.83,51.0,4.59,36.0,0.0,0.0,100.0,0.0
/fighter/Caol-Uno-283,caol uno,,08/05/1975,46.0,,"Yokosuka, Kanagawa",Japan,"5'7""",145 lbs,Uno Dojo,Featherweight,34.0,3.0,18.0,13.0,,34.0,8.0,3.0,10.0,,Uno Shoten,33.0,19.0,5.0,170.18,70.31,177.8,Southpaw,1975-05-08,1.91,49.0,1.9,50.0,1.95,31.0,37.0,0.5
,caolan loughran,,,,,,,,,,,,,,,,,,,,,The Don,8.0,1.0,0.0,167.64,61.23,172.72,Orthodox,1996-05-18,3.2,36.0,5.6,48.0,2.0,18.0,0.0,0.0
/fighter/Carey-Vanier-18541,carey vanier,,03/08/1981,40.0,,"Albuquerque, New Mexico",United States,"5'9""",160 lbs,Jackson-Wink MMA,Welterweight,11.0,5.0,4.0,2.0,,11.0,3.0,3.0,0.0,,,,,,,,,,,,,,,,,,
,carina damm,,,,,,,,,,,,,,,,,,,,,Beauty But the Beast,2.0,13.0,0.0,162.56,61.23,,,,0.0,0.0,0.0,0.0,0.0,0.0,0.0,0.0
,carl deaton,,,,,,,,,,,,,,,,,,,,,The Anishinaabe Kid,17.0,7.0,0.0,170.18,70.31,175.26,Orthodox,1989-11-24,1.53,31.0,1.85,61.0,0.0,0.0,50.0,0.0
,carl malenko,,,,,,,,,,,,,,,,,,,,,,6.0,4.0,0.0,180.34,90.72,,Orthodox,,0.0,0.0,0.0,0.0,0.0,0.0,0.0,0.0
/fighter/Carl-Noon-39272,carl noon,,,,,"Lancaster, Lancashire",England,"0'0""",185 lbs,Team Kaobon,Middleweight,7.0,3.0,3.0,1.0,,7.0,2.0,1.0,0.0,,,,,,,,,,,,,,,,,,
/fighter/Carl-Seumanutafa-22460,carl seumanutafa,Badwater,15/06/1983,38.0,,"San Francisco, California",United States,"6'1""",262 lbs,Skrap Pack,Heavyweight,12.0,11.0,0.0,1.0,,12.0,5.0,0.0,8.0,,,10.0,8.0,0.0,185.42,115.67,,Orthodox,,0.0,0.0,3.33,75.0,0.0,0.0,0.0,0.0
,carl toomey,,,,,,,,,,,,,,,,,,,,,,3.0,3.0,0.0,,,,,,0.0,0.0,0.0,0.0,0.0,0.0,0.0,0.0
/fighter/Carla-Esparza-63410,carla esparza,Cookie Monster,10/10/1987,33.0,,"Redondo Beach, California",United States,"5'1""",115 lbs,Team Oyama,Strawweight,18.0,4.0,4.0,10.0,,18.0,2.0,1.0,3.0,,Cookie Monster,20.0,7.0,0.0,154.94,52.16,160.02,Orthodox,1987-10-10,2.16,40.0,2.69,55.0,3.22,35.0,47.0,0.3
,carli judice,,,,,,,,,,,,,,,,,,,,,Crispy,3.0,1.0,0.0,170.18,56.7,172.72,Southpaw,1999-03-02,11.2,57.0,12.27,54.0,0.0,0.0,50.0,0.0
,carlo pedersoli,,,,,,,,,,,,,,,,,,,,,,,,,,,,,,,,,,,,,
/fighter/Carlo-Pedersoli-Jr-168505,carlo pedersoli jr.,Semento,08/06/1993,28.0,,"Miami, Florida",United States,"5'11""",170 lbs,Aurora MMA,Welterweight,11.0,3.0,4.0,4.0,,11.0,2.0,0.0,2.0,,Semento,11.0,3.0,0.0,180.34,77.11,190.5,Southpaw,1993-06-08,4.17,37.0,4.12,61.0,2.91,44.0,0.0,0.0
/fighter/Carlo-Prater-6767,carlo prater,Neo,25/06/1981,40.0,,"Brasilia, Federal District",Brazil,"5'11""",170 lbs,Neo Dojo,Welterweight,34.0,2.0,18.0,12.0,2.0,34.0,1.0,4.0,16.0,0.0,Neo,31.0,18.0,1.0,180.34,70.31,182.88,Switch,1981-06-25,2.03,47.0,4.07,35.0,0.43,9.0,57.0,1.7
/fighter/Carlos-Alexandre-Pereira-5990,carlos alexandre pereira,Indio,04/04/1979,42.0,,"Natal, Rio Grande do Norte",Brazil,"6'0""",170 lbs,Dragon Fight,Welterweight,34.0,20.0,9.0,5.0,,34.0,5.0,4.0,3.0,,,,,,,,,,,,,,,,,,
/fighter/Carlos-Barreto-180,carlos barreto,Carlao,22/07/1968,53.0,,Rio de Janeiro,Brazil,"6'4""",230 lbs,,Heavyweight,14.0,8.0,5.0,1.0,,14.0,2.0,0.0,7.0,,,14.0,9.0,0.0,193.04,104.33,,Orthodox,,0.0,0.0,0.0,0.0,0.0,0.0,0.0,0.0
/fighter/Carlos-Brooks-48232,carlos brooks,Shake 'n Bake,,,,"New York City, New York",United States,"6'3""",188 lbs,Team Tiger Schulmann,Light Heavyweight,4.0,3.0,0.0,1.0,,4.0,1.0,1.0,1.0,,,,,,,,,,,,,,,,,,
,carlos candelario,,,,,,,,,,,,,,,,,,,,,The Cannon,8.0,3.0,0.0,172.72,56.7,172.72,Southpaw,1991-06-04,3.97,46.0,5.17,44.0,2.28,36.0,53.0,0.3
/fighter/Carlos-Condit-6765,carlos condit,The Natural Born Killer,26/04/1984,37.0,,"Albuquerque, New Mexico",United States,"6'1""",170 lbs,Jackson-Wink MMA,Welterweight,32.0,15.0,13.0,4.0,,32.0,1.0,6.0,7.0,,The Natural Born Killer,32.0,14.0,0.0,187.96,77.11,190.5,Orthodox,1984-04-26,3.66,39.0,2.67,55.0,0.59,46.0,38.0,1.0
/fighter/Carlos-Correia-157483,carlos correia,,,,,"Naugatuck, Connecticut",United States,"5'9""",170 lbs,Danilo Cherman Nova Uniao,Welterweight,2.0,1.0,0.0,1.0,,2.0,0.0,0.0,0.0,,,,,,,,,,,,,,,,,,
/fighter/Carlos-Eduardo-11926,carlos eduardo,Cachorrao,09/12/1981,39.0,,"Fortaleza, Ceara",Brazil,"6'2""",205 lbs,Dragon Fight,Light Heavyweight,18.0,6.0,8.0,4.0,0.0,18.0,2.0,0.0,6.0,1.0,,,,,,,,,,,,,,,,,
/fighter/Carlos-Eduardo-Rocha-35142,carlos eduardo rocha,Ta Danado,12/07/1981,40.0,,"Fortaleza, Ceara",Brazil,"5'10""",170 lbs,American Kickboxing Academy,Welterweight,9.0,1.0,8.0,0.0,,9.0,2.0,0.0,2.0,,Ta Danado,9.0,4.0,0.0,177.8,77.11,185.42,Orthodox,1981-07-12,1.24,34.0,1.85,55.0,0.0,0.0,52.0,1.4
/fighter/Carlos-Felipe-185021,carlos felipe,Boi,12/01/1995,26.0,,"Feira de Santana, Bahia",Brazil,"6'0""",263 lbs,Life MMA,Heavyweight,11.0,6.0,0.0,5.0,,11.0,0.0,0.0,1.0,,Boi,11.0,2.0,0.0,182.88,111.13,190.5,Orthodox,1995-01-12,4.88,45.0,5.6,50.0,0.0,0.0,72.0,0.0
/fighter/Carlos-Flores-34542,carlos flores,The Yuman Prodigy,,,,"Yuma, Arizona",United States,"0'0""",210 lbs,,Heavyweight,5.0,2.0,1.0,2.0,,5.0,2.0,0.0,0.0,,,,,,,,,,,,,,,,,,
,carlos hernandez,,,,,,,,,,,,,,,,,,,,,,9.0,2.0,0.0,172.72,56.7,170.18,Orthodox,1993-10-25,5.51,46.0,4.41,49.0,1.24,16.0,65.0,0.3
/fighter/Carlos-Huachin-177353,carlos huachin,Perro Malo,06/06/1996,25.0,,Lima,Peru,"5'7""",135 lbs,PMAC (Pitbull Martial Arts Center),Bantamweight,10.0,8.0,2.0,0.0,,10.0,1.0,0.0,5.0,,Perro Malo,10.0,5.0,1.0,162.56,61.23,170.18,Southpaw,1996-06-04,2.1,21.0,4.8,50.0,0.0,0.0,66.0,0.0
,carlos leal,,,,,,,,,,,,,,,,,,,,,,,,,,,,,,,,,,,,,
/fighter/Carlos-Leal-Miranda-109073,carlos leal miranda,The Lion,04/05/1994,27.0,,"Curitiba, Parana",Brazil,"5'11""",155 lbs,SIAM Team MMA College,Lightweight,14.0,5.0,2.0,5.0,2.0,14.0,0.0,1.0,2.0,0.0,,,,,,,,,,,,,,,,,
,carlos mota,,,,,,,,,,,,,,,,,,,,,Tizil,8.0,2.0,0.0,162.56,56.7,175.26,Orthodox,1995-04-15,0.8,41.0,1.13,54.0,0.0,0.0,50.0,1.0
/fighter/Carlos-Newton-7,carlos newton,The Ronin,17/08/1976,44.0,,"Newmarket, Ontario",Canada,"5'9""",174 lbs,Warrior MMA Fight Team,Middleweight,16.0,2.0,10.0,4.0,,16.0,5.0,2.0,7.0,,The Ronin,16.0,14.0,0.0,175.26,77.11,,Orthodox,1976-08-17,0.65,41.0,1.55,44.0,2.47,70.0,43.0,0.9
/fighter/Carlos-Prates-95593,carlos prates,Carlao,17/08/1993,27.0,,"Taubate, Sao Paulo",Brazil,"6'0""",155 lbs,Phuket Top Team,Lightweight,10.0,5.0,2.0,2.0,1.0,10.0,1.0,3.0,1.0,0.0,The Nightmare,17.0,6.0,0.0,185.42,77.11,198.12,Switch,1993-08-17,4.81,63.0,3.69,47.0,0.0,0.0,0.0,0.0
/fighter/Carlos-Ulberg-84291,carlos ulberg,Black Jag,17/11/1990,30.0,,Auckland,New Zealand,"6'4""",205 lbs,City Kickboxing,Light Heavyweight,3.0,2.0,0.0,1.0,,3.0,1.0,0.0,0.0,,Black Jag,10.0,1.0,0.0,193.04,92.99,195.58,Orthodox,1990-11-07,7.29,59.0,3.59,52.0,0.95,75.0,75.0,0.3
,carlos vera,,,,,,,,,,,,,,,,,,,,,Pequeno,11.0,3.0,0.0,,61.23,,,,0.0,0.0,0.0,0.0,0.0,0.0,0.0,0.0
,carlos zevallos,,,,,,,,,,,,,,,,,,,,,,3.0,4.0,0.0,182.88,92.99,,Orthodox,,4.36,65.0,2.28,68.0,0.0,0.0,100.0,0.0
/fighter/Carls-John-de-Tomas-198787,carls john de tomas,Golden Boy,28/08/1996,24.0,,Quezon City,Philippines,"5'5""",135 lbs,De Tomas MMA,Bantamweight,6.0,0.0,3.0,3.0,,6.0,0.0,1.0,1.0,,,6.0,2.0,0.0,165.1,56.7,180.34,Southpaw,1996-08-28,1.74,37.0,3.93,44.0,1.37,33.0,66.0,0.0
,carlston harris,,,,,,,,,,,,,,,,,,,,,Mocambique,19.0,5.0,0.0,182.88,77.11,193.04,Orthodox,1987-07-09,2.93,49.0,2.44,53.0,2.05,29.0,55.0,0.8
/fighter/Carlston-Lindsay-Harris-85711,carlston lindsay harris,Mocambique,09/07/1987,34.0,,Skeldon,Guyana,"6'0""",170 lbs,Renovacao Fight Team,Welterweight,16.0,4.0,5.0,7.0,,16.0,1.0,0.0,3.0,,,,,,,,,,,,,,,,,,
,carlton jones,,,,,,,,,,,,,,,,,,,,,,1.0,4.0,0.0,185.42,102.06,,Orthodox,,2.32,41.0,3.58,56.0,4.02,50.0,57.0,2.7
/fighter/Carlton-Minus-177995,carlton minus,Clutch,26/04/1993,28.0,,"Anchorage, Alaska",United States,"5'11""",170 lbs,Avalanche Wrestling Association,Welterweight,10.0,6.0,1.0,3.0,,10.0,0.0,1.0,2.0,,Clutch,10.0,3.0,0.0,177.8,77.11,190.5,Orthodox,1993-04-26,3.5,40.0,4.97,50.0,0.0,0.0,58.0,0.0
/fighter/Carmela-James-217179,carmela james,,19/04/1994,27.0,,"Derby, Kansas",United States,"0'0""",111 lbs,Laselva MMA,Strawweight,0.0,0.0,0.0,0.0,,0.0,1.0,1.0,2.0,,,,,,,,,,,,,,,,,,
/fighter/Carmelo-Marrero-12855,carmelo marrero,The Fury,26/01/1981,40.0,,"Douglasville, Pennsylvania",United States,"6'2""",255 lbs,American Top Team,Heavyweight,16.0,3.0,7.0,6.0,,16.0,0.0,2.0,4.0,,The Fury,16.0,6.0,0.0,182.88,92.99,185.42,Orthodox,1981-01-26,0.84,34.0,2.04,54.0,3.21,36.0,36.0,0.9
/fighter/Caros-Fodor-45430,caros fodor,The Future,07/01/1984,37.0,,"Kirkland, Washington",United States,"5'9""",156 lbs,AMC Pankration,Lightweight,11.0,2.0,5.0,4.0,,11.0,0.0,2.0,4.0,,The Future,11.0,6.0,0.0,175.26,70.31,187.96,Orthodox,1984-01-07,2.76,54.0,2.83,54.0,2.1,25.0,50.0,0.0
/fighter/Carrington-Banks-126197,carrington banks,Jetsetter,17/02/1989,32.0,,"Peoria, Illinois",United States,"5'9""",155 lbs,Blackzilians,Lightweight,10.0,2.0,1.0,7.0,,10.0,1.0,1.0,0.0,,,,,,,,,,,,,,,,,,
,carter williams,,,,,,,,,,,,,,,,,,,,,The Beast,4.0,5.0,0.0,185.42,120.2,,Orthodox,,1.55,36.0,2.32,58.0,2.9,33.0,100.0,0.0
/fighter/Cary-Bullos-40883,cary bullos,The Prince,09/08/1983,38.0,,"Lapu-Lapu, Cebu",Philippines,"5'7""",145 lbs,Seldef MMA,Featherweight,7.0,3.0,4.0,0.0,,7.0,1.0,3.0,0.0,,,,,,,,,,,,,,,,,,
,casey huffman,,,,,,,,,,,,,,,,,,,,,Hellbent,3.0,1.0,0.0,190.5,83.91,,,,0.0,0.0,0.0,0.0,0.0,0.0,0.0,0.0
/fighter/Casey-Johnson-47431,casey johnson,Wild Style,29/07/1988,33.0,,"Middleton, Idaho",United States,"5'7""",135 lbs,Freak-Jitsu,Bantamweight,7.0,3.0,4.0,0.0,,7.0,2.0,0.0,3.0,,,,,,,,,,,,,,,,,,
/fighter/Casey-Jones-190835,casey jones,,07/05/1991,30.0,,"Baytown, Texas",United States,"5'8""",135 lbs,4oz. Fight Club,Bantamweight,7.0,0.0,5.0,2.0,,7.0,2.0,1.0,3.0,,,,,,,,,,,,,,,,,,
/fighter/Casey-Kenney-211031,casey kenney,,20/03/1991,30.0,,"Tuscon, Arizona",United States,"5'7""",135 lbs,Rise Combat Sports,Bantamweight,16.0,2.0,5.0,9.0,,16.0,0.0,0.0,4.0,,,16.0,4.0,1.0,170.18,61.23,172.72,Southpaw,1991-03-20,4.85,42.0,4.67,58.0,1.09,35.0,61.0,0.4
/fighter/Casey-Noland-69412,casey noland,KO,17/06/1978,43.0,,"San Luis Obispo, California",United States,"5'5""",126 lbs,The Pit,Flyweight,4.0,1.0,1.0,2.0,0.0,4.0,3.0,0.0,2.0,1.0,,,,,,,,,,,,,,,,,
/fighter/Casey-ONeill-175007,casey o'neill,King,07/10/1997,23.0,,Queensland,Australia,"5'6""",125 lbs,Tiger Muay Thai,Flyweight,7.0,2.0,2.0,3.0,,7.0,0.0,0.0,0.0,,King,9.0,1.0,0.0,167.64,56.7,175.26,Orthodox,1997-10-07,8.77,55.0,5.9,58.0,1.96,42.0,71.0,0.7
,casey olson,,,,,,,,,,,,,,,,,,,,,The Underdog,14.0,5.0,0.0,170.18,65.77,,Orthodox,,2.48,60.0,0.0,100.0,3.54,57.0,100.0,1.8
,casey ryan,,,,,,,,,,,,,,,,,,,,,,7.0,3.0,0.0,,83.91,,,,0.0,0.0,0.0,0.0,0.0,0.0,0.0,0.0
/fighter/Casey-Suire-100261,casey suire,,,,,"Lafayette, Louisiana",United States,"5'6""",133 lbs,Bali Muay Thai & MMA,Bantamweight,6.0,1.0,4.0,1.0,,6.0,1.0,1.0,0.0,,,,,,,,,,,,,,,,,,
/fighter/Cass-Bell-131763,cass bell,,23/04/1987,34.0,,"Arcata, California",United States,"5'8""",135 lbs,21 Grams Gym,Bantamweight,5.0,1.0,3.0,1.0,,5.0,0.0,1.0,1.0,,,,,,,,,,,,,,,,,,
/fighter/Castle-Williams-136127,castle williams,,,,,"Arroyo Grande, California",United States,"5'8""",144 lbs,The Pit,Featherweight,4.0,2.0,2.0,0.0,,4.0,1.0,1.0,1.0,,,,,,,,,,,,,,,,,,
/fighter/Cat-Zingano-33932,cat zingano,Alpha,01/07/1982,39.0,,"Broomfield, Colorado",United States,"5'6""",145 lbs,Zingano Brazilian Jiu-Jitsu,Featherweight,12.0,5.0,4.0,3.0,,12.0,1.0,1.0,2.0,,Alpha,10.0,4.0,0.0,167.64,65.77,172.72,Southpaw,1982-07-01,2.57,61.0,1.63,47.0,2.77,65.0,42.0,0.8
/fighter/Cathal-Pendred-64373,cathal pendred,The Punisher,02/09/1987,33.0,,"Dublin, Leinster",Ireland,"6'1""",170 lbs,SBG Ireland,Welterweight,17.0,6.0,1.0,10.0,,17.0,2.0,1.0,1.0,,The Punisher,17.0,4.0,1.0,185.42,77.11,190.5,Orthodox,1987-09-02,2.49,44.0,3.01,55.0,2.46,23.0,83.0,0.4
,cb dollaway,,,,,,,,,,,,,,,,,,,,,The Doberman,17.0,9.0,0.0,187.96,83.91,193.04,Orthodox,1983-08-10,2.65,47.0,2.58,54.0,3.55,54.0,62.0,1.2
,cedric doumbe,,,,,,,,,,,,,,,,,,,,,,2.0,0.0,0.0,177.8,77.11,,,,0.0,0.0,0.0,0.0,0.0,0.0,0.0,0.0
/fighter/Cedric-Marks-1918,cedric marks,Spider-Man,15/07/1974,47.0,,"Bremerton, Washington",United States,"5'11""",185 lbs,,Middleweight,31.0,16.0,7.0,5.0,3.0,31.0,6.0,19.0,2.0,0.0,,,,,,,,,,,,,,,,,
,cesar almeida,,,,,,,,,,,,,,,,,,,,,Cesinha,4.0,0.0,0.0,185.42,83.91,187.96,Orthodox,1988-03-28,4.73,61.0,1.87,48.0,0.0,0.0,70.0,0.0
/fighter/Cesar-Arzamendia-87012,cesar arzamendia,Goku,31/01/1991,30.0,,Asuncion,Paraguay,"5'11""",155 lbs,Paraguay Combat Team,Lightweight,9.0,2.0,4.0,3.0,,9.0,2.0,1.0,1.0,,Goku,8.0,3.0,0.0,180.34,70.31,,Orthodox,1991-01-31,5.37,45.0,5.2,56.0,7.32,75.0,0.0,2.4
/fighter/Cesar-Avila-53569,cesar avila,Dirty Boy,07/02/1989,32.0,,"El Centro, California",United States,"5'9""",155 lbs,Team United,Lightweight,8.0,2.0,4.0,1.0,1.0,8.0,1.0,3.0,0.0,0.0,,,,,,,,,,,,,,,,,
/fighter/Cesar-Bennett-350879,cesar bennett,,05/10/1987,33.0,,"San Diego, California",United States,"0'0""",205 lbs,,Light Heavyweight,0.0,0.0,0.0,0.0,,0.0,1.0,0.0,0.0,,,,,,,,,,,,,,,,,,
/fighter/Cesar-Gonzalez-179097,cesar gonzalez,Cubby,25/02/1989,32.0,,"Vallejo, California",United States,"5'8""",155 lbs,Train 4 Life Center,Lightweight,2.0,0.0,0.0,2.0,,2.0,0.0,1.0,3.0,,,,,,,,,,,,,,,,,,
,cesar gracie,,,,,,,,,,,,,,,,,,,,,,0.0,1.0,0.0,177.8,82.1,,Orthodox,,0.0,0.0,17.14,50.0,0.0,0.0,0.0,0.0
/fighter/Cesar-Marcussi-203,cesar marcussi,,,,,"Cascavel, Parana",Brazil,"0'0""",155 lbs,Ryan Gracie Team,Lightweight,3.0,1.0,1.0,1.0,,3.0,2.0,0.0,0.0,,,,,,,,,,,,,,,,,,
,cesar marscucci,,,,,,,,,,,,,,,,,,,,,,3.0,2.0,0.0,,,,,,0.0,0.0,0.0,0.0,0.0,0.0,0.0,0.0
/fighter/Cezar-Ferreira-22400,cezar ferreira,Mutante,15/02/1985,36.0,,"Ibitinga, Sao Paulo",Brazil,"6'1""",205 lbs,MMA Masters,Light Heavyweight,14.0,4.0,4.0,6.0,,14.0,4.0,0.0,5.0,,Mutante,13.0,8.0,0.0,185.42,83.91,198.12,Southpaw,1985-02-15,1.9,42.0,2.44,53.0,2.69,53.0,84.0,0.5
,chad anheliger,,,,,,,,,,,,,,,,,,,,,The Monster,12.0,7.0,0.0,167.64,61.23,162.56,Orthodox,1986-12-01,3.07,42.0,3.55,51.0,1.03,36.0,47.0,0.8
/fighter/Chad-Cook-2839,chad cook,,,,,"Birmingham, Alabama",United States,"6'2""",220 lbs,,Heavyweight,10.0,3.0,5.0,1.0,1.0,10.0,4.0,7.0,1.0,0.0,,10.0,12.0,0.0,187.96,92.99,,,,0.0,0.0,0.0,0.0,0.0,0.0,0.0,0.0
/fighter/Chad-Coon-77213,chad coon,,22/10/1980,40.0,,"Big Rapids, Michigan",United States,"5'10""",135 lbs,Titan MMA,Bantamweight,3.0,0.0,3.0,0.0,,3.0,3.0,3.0,4.0,,,,,,,,,,,,,,,,,,
,chad corvin,,,,,,,,,,,,,,,,,,,,,The Brave Warrior,5.0,0.0,0.0,195.58,115.67,,,,0.0,0.0,0.0,0.0,0.0,0.0,0.0,0.0
/fighter/Chad-Freeman-12574,chad freeman,The Diamond,15/04/1977,44.0,,"Kamloops, British Columbia",Canada,"5'10""",155 lbs,Diamond Mixed Martial Arts,Lightweight,8.0,3.0,5.0,0.0,,8.0,1.0,5.0,0.0,,,,,,,,,,,,,,,,,,
/fighter/Chad-George-12668,chad george,Savage,30/04/1982,39.0,,"Los Angeles, California",United States,"5'6""",135 lbs,California Mixed Martial Arts,Bantamweight,18.0,5.0,10.0,3.0,,18.0,0.0,6.0,2.0,,Savage,16.0,8.0,0.0,167.64,61.23,172.72,Southpaw,1982-04-30,1.26,50.0,1.11,65.0,3.08,46.0,0.0,1.3
/fighter/Chad-Griggs-15932,chad griggs,The Grave Digger,15/05/1978,43.0,,"Tucson, Arizona",United States,"6'3""",205 lbs,Apex MMA,Light Heavyweight,11.0,11.0,0.0,0.0,,11.0,0.0,3.0,0.0,,The Grave Digger,11.0,3.0,0.0,185.42,92.99,185.42,Orthodox,1978-05-15,2.67,50.0,2.22,46.0,1.51,66.0,41.0,0.0
,chad hanekom,,,,,,,,,,,,,,,,,,,,,Superman,9.0,3.0,0.0,193.04,83.91,187.96,Orthodox,1990-04-20,0.73,47.0,1.47,33.0,0.0,0.0,71.0,1.0
/fighter/Chad-Hinton-32468,chad hinton,,14/06/1971,50.0,,"Cincinnati, Ohio",United States,"5'8""",158 lbs,Cincy MMA,Welterweight,9.0,3.0,4.0,2.0,,9.0,0.0,2.0,2.0,,,,,,,,,,,,,,,,,,
,chad johnson,,,,,,,,,,,,,,,,,,,,,Big Rigg,6.0,2.0,0.0,187.96,104.33,203.2,Orthodox,1986-07-22,5.92,68.0,7.8,40.0,0.0,0.0,0.0,0.0
/fighter/Chad-Laprise-69681,chad laprise,The Disciple,23/07/1986,35.0,,"London, Ontario",Canada,"5'10""",159 lbs,Adrenaline Training Center,Welterweight,13.0,7.0,1.0,5.0,,13.0,3.0,0.0,1.0,,The Disciple,13.0,4.0,0.0,177.8,77.11,180.34,Orthodox,1986-07-23,4.78,42.0,3.59,65.0,1.05,54.0,78.0,0.0
/fighter/Chad-Leonhardt-17822,chad leonhardt,The Boss,19/02/1980,41.0,,"Shreveport, Louisiana",United States,"6'0""",171 lbs,Gladiators Academy,Welterweight,9.0,7.0,0.0,2.0,,9.0,2.0,3.0,0.0,,The Boss,9.0,4.0,0.0,182.88,77.11,,,,0.0,0.0,0.0,0.0,0.0,0.0,0.0,0.0
/fighter/Chad-Mendes-38393,chad mendes,Money,01/05/1985,36.0,,"Hanford, California",United States,"5'6""",145 lbs,Team Alpha Male,Featherweight,18.0,8.0,2.0,8.0,,18.0,4.0,0.0,1.0,,Money,18.0,5.0,0.0,167.64,65.77,167.64,Orthodox,1985-05-01,2.78,49.0,2.35,67.0,4.13,55.0,100.0,0.3
/fighter/Chad-Reiner-14016,chad reiner,The Grinder,29/06/1981,40.0,,"Omaha, Nebraska",United States,"6'0""",170 lbs,Premier Combat Center,Welterweight,33.0,11.0,16.0,6.0,,33.0,10.0,6.0,2.0,,The Grinder,33.0,18.0,0.0,180.34,77.11,,Orthodox,1981-06-29,0.53,20.0,1.97,46.0,0.99,33.0,25.0,2.0
/fighter/Chad-Robichaux-25199,chad robichaux,Robo,18/08/1975,45.0,,"The Woodlands, Texas",United States,"5'3""",125 lbs,Gracie Barra,Flyweight,13.0,0.0,12.0,1.0,,13.0,1.0,1.0,0.0,,Robo,13.0,2.0,0.0,162.56,61.23,,,,0.0,0.0,0.0,0.0,0.0,0.0,0.0,0.0
,chad sutton,,,,,,,,,,,,,,,,,,,,,,2.0,2.0,0.0,185.42,83.91,,,,0.0,0.0,0.0,0.0,0.0,0.0,0.0,0.0
,chad vance,,,,,,,,,,,,,,,,,,,,,,7.0,5.0,0.0,182.88,83.91,,Orthodox,,0.0,0.0,0.0,0.0,0.0,0.0,0.0,0.0
/fighter/Chad-Vandenberg-35231,chad vandenberg,The Kansas City Kid,10/06/1985,36.0,,"Kansas City, Missouri",United States,"5'9""",140 lbs,K2L Grindhouse,Featherweight,6.0,2.0,2.0,2.0,,6.0,0.0,3.0,1.0,,,,,,,,,,,,,,,,,,
,chad w. saunders,,,,,,,,,,,,,,,,,,,,,,7.0,2.0,0.0,177.8,77.11,,Orthodox,,0.0,0.0,0.0,0.0,0.0,0.0,0.0,0.0
/fighter/Chael-Sonnen-4112,chael sonnen,,03/04/1977,44.0,,"West Linn, Oregon",United States,"6'1""",205 lbs,Team Quest,Light Heavyweight,31.0,8.0,4.0,19.0,,31.0,7.0,9.0,1.0,,,29.0,15.0,1.0,185.42,92.99,185.42,Southpaw,1977-04-03,3.08,43.0,1.1,62.0,3.81,59.0,66.0,0.4
,chalid arrab,,,,,,,,,,,,,,,,,,,,,Die Faust,7.0,3.0,0.0,180.34,92.99,,Orthodox,1975-05-28,1.56,34.0,1.63,56.0,3.05,75.0,37.0,1.0
/fighter/Chan-Heng-140291,chan heng,,,,,,Cambodia,"0'0""",132 lbs,Cambodian Top Team,Bantamweight,8.0,1.0,6.0,1.0,,8.0,2.0,2.0,0.0,,,,,,,,,,,,,,,,,,
/fighter/Chan-Rothana-175869,chan rothana,,08/02/1986,35.0,,,Cambodia,"5'6""",135 lbs,Selapak,Bantamweight,7.0,5.0,1.0,1.0,0.0,7.0,1.0,1.0,1.0,1.0,,,,,,,,,,,,,,,,,
/fighter/Chan-Samart-137331,chan samart,,,,,,Cambodia,"5'4""",145 lbs,Cambodian Top Team,Featherweight,1.0,1.0,0.0,0.0,,1.0,3.0,0.0,3.0,,,,,,,,,,,,,,,,,,
/fighter/Chan-Sung-Jung-36155,chan sung jung,The Korean Zombie,17/03/1987,34.0,,"Gyeongju, North Gyeongsang",South Korea,"5'9""",145 lbs,Fight Ready,Featherweight,17.0,6.0,8.0,3.0,,17.0,3.0,0.0,3.0,,The Korean Zombie,17.0,8.0,0.0,170.18,65.77,182.88,Orthodox,1987-03-17,3.93,41.0,4.52,52.0,0.7,44.0,72.0,0.6
,chan-mi jeon,,,,,,,,,,,,,,,,,,,,,,5.0,2.0,0.0,165.1,52.16,,Orthodox,1997-08-28,6.23,31.0,7.77,55.0,0.0,0.0,0.0,0.0
,chance farrar,,,,,,,,,,,,,,,,,,,,,,8.0,3.0,0.0,175.26,65.77,,Southpaw,1975-09-11,0.81,22.0,2.21,67.0,3.02,100.0,0.0,0.0
/fighter/Chance-Rencountre-143911,chance rencountre,Black Eagle,31/12/1986,34.0,,"Pawhuska, Oklahoma",United States,"6'2""",170 lbs,Alliance MMA,Welterweight,15.0,6.0,4.0,5.0,,15.0,1.0,0.0,3.0,,Black Eagle,14.0,4.0,0.0,187.96,77.11,190.5,Southpaw,1986-12-31,1.1,20.0,3.62,49.0,1.35,26.0,16.0,0.3
,chandler cole,,,,,,,,,,,,,,,,,,,,,The Hammer,10.0,4.0,0.0,177.8,119.75,182.88,Orthodox,1995-01-09,2.45,60.0,3.59,26.0,0.0,0.0,0.0,0.0
/fighter/Chang-Ho-Lee-258443,chang ho lee,,09/05/1994,27.0,,"Goyang, Gyeonggi",South Korea,"5'8""",145 lbs,Team Max,Featherweight,6.0,2.0,1.0,3.0,,6.0,0.0,0.0,0.0,,,,,,,,,,,,,,,,,,
,changho lee,,,,,,,,,,,,,,,,,,,,,,9.0,1.0,0.0,172.72,61.23,175.26,Orthodox,1994-05-09,4.3,69.0,1.03,47.0,4.3,35.0,25.0,0.0
/fighter/Changxin-Fu-186589,changxin  fu,,12/08/1992,28.0,,"Harbin, Heilongjiang",China,"5'10""",145 lbs,Tianchi Wrestling,Featherweight,8.0,4.0,1.0,3.0,,8.0,0.0,2.0,0.0,,,,,,,,,,,,,,,,,,
/fighter/Chanmi-Jeon-128633,chanmi jeon,Ottogi Girl,28/08/1997,23.0,,Seoul,South Korea,"5'5""",115 lbs,Kukje Gym,Strawweight,5.0,4.0,0.0,1.0,,5.0,0.0,0.0,3.0,,,,,,,,,,,,,,,,,,
/fighter/Chao-Xie-255827,chao xie,,,,,,China,"5'10""",145 lbs,Longyun MMA Gym,Featherweight,14.0,4.0,8.0,1.0,1.0,14.0,3.0,2.0,5.0,0.0,,,,,,,,,,,,,,,,,
,charalampos grigoriou,,,,,,,,,,,,,,,,,,,,,Ferocious,8.0,3.0,0.0,170.18,61.23,170.18,Orthodox,1992-03-31,13.0,65.0,4.0,63.0,0.0,0.0,0.0,0.0
,charlene gellner,,,,,,,,,,,,,,,,,,,,,Princess,0.0,4.0,0.0,157.48,56.7,,,,2.01,42.0,3.24,43.0,0.0,0.0,0.0,1.7
,charles bennett,,,,,,,,,,,,,,,,,,,,,Krazy Horse,30.0,33.0,2.0,172.72,70.31,,Orthodox,1979-11-23,1.39,39.0,1.35,64.0,2.02,100.0,36.0,2.0
/fighter/Charles-Byrd-51234,charles byrd,Kid Dynamite,11/10/1983,37.0,,"Plano, Texas",United States,"5'10""",185 lbs,Fortis MMA,Middleweight,10.0,3.0,5.0,2.0,0.0,10.0,3.0,2.0,1.0,1.0,Kid Dynamite,10.0,7.0,0.0,177.8,83.91,185.42,Orthodox,1983-10-11,3.43,55.0,2.63,55.0,2.5,50.0,40.0,1.5
/fighter/Charles-Hackmann-39276,charles hackmann,,10/10/1985,35.0,,"Granite City, Illinois",United States,"0'0""",204 lbs,The Hit Squad,Light Heavyweight,4.0,2.0,2.0,0.0,,4.0,2.0,1.0,2.0,,,,,,,,,,,,,,,,,,
,charles johnson,,,,,,,,,,,,,,,,,,,,,InnerG,13.0,6.0,0.0,175.26,56.7,177.8,Switch,1991-01-10,4.34,55.0,3.27,54.0,0.19,14.0,62.0,0.2
/fighter/Charles-Jourdain-210843,charles jourdain,Air,27/11/1995,25.0,,"Beloeil, Quebec",Canada,"5'9""",145 lbs,Academie Pro Star MMA,Featherweight,11.0,8.0,3.0,0.0,,11.0,0.0,0.0,3.0,,Air,15.0,6.0,1.0,175.26,65.77,175.26,Switch,1995-11-27,5.71,49.0,4.21,58.0,0.1,16.0,47.0,0.5
/fighter/Charles-McCarthy-7987,charles mccarthy,Chainsaw,06/08/1980,41.0,,"Miami, Florida",United States,"5'10""",185 lbs,American Top Team,Middleweight,10.0,0.0,10.0,0.0,,10.0,2.0,2.0,1.0,,Chainsaw,10.0,5.0,0.0,177.8,83.91,180.34,Orthodox,1980-08-06,0.18,12.0,4.03,56.0,2.67,60.0,0.0,2.7
,charles mctorry,,,,,,,,,,,,,,,,,,,,,,3.0,0.0,0.0,,,,,,0.0,0.0,0.0,0.0,0.0,0.0,0.0,0.0
/fighter/Charles-Oliveira-30300,charles oliveira,do Bronx,17/10/1989,31.0,,"Guaruja, Sao Paulo",Brazil,"5'10""",155 lbs,Chute Boxe Diego Lima,Lightweight,31.0,9.0,19.0,3.0,,31.0,4.0,3.0,1.0,,Do Bronxs,34.0,9.0,0.0,177.8,70.31,187.96,Orthodox,1989-10-17,3.54,53.0,3.19,51.0,2.32,40.0,55.0,2.7
,charles radtke,,,,,,,,,,,,,,,,,,,,,Chuck Buffalo,8.0,3.0,0.0,175.26,77.11,182.88,Orthodox,1990-07-09,2.33,46.0,2.93,53.0,1.0,16.0,100.0,0.0
/fighter/Charles-Rosa-71116,charles rosa,Boston Strong,24/08/1986,34.0,,"Peabody, Massachusetts",United States,"5'10""",145 lbs,American Top Team,Featherweight,14.0,3.0,8.0,3.0,,14.0,1.0,0.0,4.0,,Boston Strong,14.0,8.0,0.0,175.26,65.77,175.26,Switch,1986-08-24,3.08,36.0,3.86,47.0,1.67,35.0,38.0,1.0
/fighter/Charles-Williams-236419,charles williams,,,,,"Grand Prairie, Texas",United States,"5'10""",155 lbs,King Monkey Gym,Lightweight,3.0,1.0,0.0,2.0,,3.0,1.0,0.0,5.0,,,,,,,,,,,,,,,,,,
/fighter/Charlie-Brenneman-23403,charlie brenneman,The Spaniard,09/02/1981,40.0,,"Hollidaysburg, Pennsylvania",United States,"5'10""",155 lbs,AMA Fight Club,Lightweight,19.0,5.0,5.0,9.0,,19.0,4.0,3.0,1.0,,The Spaniard,19.0,8.0,0.0,177.8,70.31,177.8,Orthodox,1981-02-09,1.52,56.0,1.55,46.0,4.23,42.0,72.0,0.0
/fighter/Charlie-Campbell-286213,charlie campbell,The Cannibal,03/06/1995,26.0,,"East Rockaway, New York",United States,"6'0""",155 lbs,Longo Weidman MMA,Lightweight,4.0,2.0,0.0,2.0,,4.0,0.0,0.0,1.0,,The Cannibal,8.0,2.0,0.0,182.88,70.31,182.88,Orthodox,1995-07-03,11.03,54.0,5.42,60.0,0.0,0.0,100.0,0.0
,charlie kohler,,,,,,,,,,,,,,,,,,,,,,8.0,4.0,1.0,175.26,70.31,,Orthodox,1976-07-16,0.81,33.0,4.31,46.0,0.0,0.0,0.0,4.0
/fighter/Charlie-Leary-58464,charlie leary,917,,,,"Harrow, Greater London",England,"6'0""",155 lbs,Team Crossface,Lightweight,17.0,10.0,2.0,5.0,,17.0,2.0,3.0,6.0,,,,,,,,,,,,,,,,,,
/fighter/Charlie-Ontiveros-83277,charlie ontiveros,The American Bad Boy,04/07/1991,30.0,,"Cleveland, Texas",United States,"6'2""",170 lbs,W4R Training Center,Welterweight,11.0,4.0,2.0,4.0,1.0,11.0,7.0,0.0,0.0,0.0,American Bad Boy,11.0,9.0,0.0,187.96,70.31,187.96,Switch,1991-07-04,1.89,41.0,5.86,31.0,0.0,0.0,30.0,0.0
/fighter/Charlie-Rader-24678,charlie rader,Superstar,06/04/1982,39.0,,"New Orleans, Louisiana",United States,"6'1""",185 lbs,Power MMA,Middleweight,18.0,10.0,3.0,5.0,,18.0,1.0,6.0,2.0,,,,,,,,,,,,,,,,,,
/fighter/Charlie-Radtke-175669,charlie radtke,,09/07/1990,31.0,,Illinois,United States,"5'10""",155 lbs,,Lightweight,3.0,1.0,1.0,1.0,,3.0,1.0,0.0,2.0,,,,,,,,,,,,,,,,,,
/fighter/Charlie-Valencia-503,charlie valencia,,31/10/1974,46.0,,"Los Angeles, California",United States,"5'3""",135 lbs,Millennia MMA,Bantamweight,12.0,2.0,4.0,6.0,,12.0,3.0,3.0,1.0,,,12.0,7.0,0.0,160.02,61.23,162.56,Orthodox,1974-10-31,2.58,37.0,2.61,77.0,1.4,53.0,75.0,0.5
/fighter/Charlie-Ward-163615,charlie ward,Relentless,17/12/1980,40.0,,Dublin,Ireland,"5'11""",185 lbs,SBG Ireland,Middleweight,9.0,6.0,0.0,3.0,,9.0,3.0,0.0,1.0,,,3.0,3.0,0.0,180.34,77.11,,Orthodox,1980-12-17,1.64,19.0,7.21,53.0,0.0,0.0,0.0,0.0
/fighter/Charlotte-McIntyre-279075,charlotte mcintyre,,,,,London,England,"5'6""",145 lbs,,Featherweight,1.0,1.0,0.0,0.0,,1.0,0.0,0.0,0.0,,,,,,,,,,,,,,,,,,
,charon spain,,,,,,,,,,,,,,,,,,,,,,14.0,26.0,0.0,175.26,70.31,,,,0.0,0.0,0.0,0.0,0.0,0.0,0.0,0.0
/fighter/Chas-Dunhour-108085,chas dunhour,,,,,Hawaii,United States,"5'5""",125 lbs,Hawaii Elite MMA,Flyweight,1.0,1.0,0.0,0.0,,1.0,0.0,1.0,0.0,,,,,,,,,,,,,,,,,,
/fighter/Chas-Skelly-47227,chas skelly,The Scrapper,11/05/1985,36.0,,"Keller, Texas",United States,"5'11""",145 lbs,Sanford MMA,Featherweight,18.0,3.0,10.0,5.0,,18.0,1.0,0.0,2.0,,The Scrapper,19.0,3.0,0.0,180.34,65.77,182.88,Orthodox,1985-05-11,2.01,40.0,3.21,49.0,1.74,34.0,39.0,2.3
/fighter/Chase-Beebe-16027,chase beebe,The Rage,29/03/1985,36.0,,"Chicago, Illinois",United States,"5'7""",137 lbs,Jackson-Wink MMA,Featherweight,24.0,1.0,17.0,6.0,,24.0,3.0,3.0,7.0,,,24.0,13.0,1.0,170.18,61.23,170.18,Orthodox,1985-03-29,2.17,38.0,1.64,69.0,2.49,42.0,41.0,0.9
,chase gibson,,,,,,,,,,,,,,,,,,,,,El Guero,9.0,5.0,0.0,177.8,70.31,182.88,Orthodox,1990-02-07,3.13,54.0,6.4,52.0,0.0,0.0,0.0,0.0
/fighter/Chase-Gormley-22247,chase gormley,,11/08/1983,38.0,,"Los Angeles, California",United States,"6'3""",264 lbs,Reign MMA,Heavyweight,14.0,4.0,2.0,8.0,,14.0,7.0,1.0,1.0,,,14.0,6.0,0.0,190.5,120.2,,Orthodox,,3.6,42.0,6.03,44.0,3.12,42.0,0.0,1.0
/fighter/Chase-Hooper-249301,chase hooper,The Dream,13/09/1999,21.0,,"Enumclaw, Washington",United States,"6'1""",145 lbs,Combat Sport & Fitness,Featherweight,10.0,3.0,5.0,2.0,,10.0,0.0,0.0,2.0,,The Dream,13.0,3.0,1.0,185.42,70.31,187.96,Southpaw,1999-09-13,4.86,51.0,3.59,36.0,1.42,22.0,55.0,2.2
/fighter/Chase-Morton-118795,chase morton,E.T.,,,,London,England,"6'0""",155 lbs,Extraterrestrial Martial Arts,Lightweight,6.0,5.0,0.0,1.0,,6.0,0.0,2.0,3.0,,,,,,,,,,,,,,,,,,
/fighter/Chase-Sherman-159319,chase sherman,The Vanilla Gorilla,06/11/1989,31.0,,"D'Iberville, Mississippi",United States,"6'4""",251 lbs,Jackson-Wink MMA,Heavyweight,15.0,14.0,0.0,1.0,,15.0,4.0,0.0,3.0,,The Vanilla Gorilla,16.0,12.0,0.0,193.04,113.4,198.12,Orthodox,1989-11-16,6.04,45.0,6.65,52.0,0.09,50.0,74.0,0.0
,chase waldon,,,,,,,,,,,,,,,,,,,,,,11.0,2.0,0.0,185.42,83.91,190.5,Orthodox,1986-09-19,1.03,28.0,6.72,38.0,7.76,33.0,0.0,0.0
,chatt lavender,,,,,,,,,,,,,,,,,,,,,,9.0,7.0,0.0,172.72,77.11,,,,0.0,0.0,0.0,0.0,0.0,0.0,0.0,0.0
/fighter/Chauncey-Foxworth-176217,chauncey foxworth,The Machine,27/10/1991,29.0,,"Hot Springs, Arkansas",United States,"5'11""",170 lbs,Off the Chain MMA,Welterweight,11.0,4.0,3.0,4.0,,11.0,2.0,3.0,3.0,,,,,,,,,,,,,,,,,,
/fighter/Chavous-Smith-77256,chavous smith,,,,,"Tulsa, Oklahoma",United States,"5'10""",135 lbs,Team Thunder Tulsa,Bantamweight,8.0,3.0,4.0,1.0,,8.0,0.0,6.0,0.0,,,,,,,,,,,,,,,,,,
/fighter/Che-Mills-8800,che mills,Beautiful,29/09/1982,38.0,,"Gloucester, Gloucestershire",England,"6'2""",170 lbs,Trojan Free Fighters,Welterweight,16.0,9.0,4.0,3.0,,16.0,5.0,4.0,1.0,,Beautiful,16.0,10.0,0.0,185.42,77.11,193.04,Orthodox,1982-09-29,2.08,52.0,2.87,43.0,1.18,66.0,58.0,0.0
/fighter/Cheick-Kongo-2193,cheick kongo,,17/05/1975,46.0,,Paris,France,"6'4""",234 lbs,Kongo Smashin' Club,Heavyweight,30.0,15.0,3.0,12.0,,30.0,3.0,1.0,7.0,,,27.0,10.0,2.0,193.04,108.86,208.28,Orthodox,1975-05-17,3.33,56.0,1.28,54.0,2.3,56.0,52.0,0.2
/fighter/Chel-ErwinDavis-148611,chel erwin-davis,The First Sun,10/07/1986,35.0,,"Troy, New Jersey",United States,"6'0""",170 lbs,Bludgeon Brigade,Welterweight,5.0,2.0,3.0,0.0,,5.0,2.0,0.0,1.0,,The First Sun,5.0,1.0,0.0,182.88,77.11,,,,4.06,54.0,1.13,61.0,4.25,100.0,50.0,1.4
,chelsea chandler,,,,,,,,,,,,,,,,,,,,,,5.0,2.0,0.0,172.72,65.77,172.72,Southpaw,1990-11-23,3.12,45.0,3.06,42.0,0.78,33.0,33.0,0.0
,chelsea hackett,,,,,,,,,,,,,,,,,,,,,Hammer,3.0,1.0,1.0,162.56,56.7,167.64,Switch,1998-08-16,2.58,51.0,4.85,46.0,0.0,0.0,57.0,0.0
/fighter/Chen-Hao-350867,chen hao,,,,,,China,"0'0""",150 lbs,,Lightweight,1.0,0.0,0.0,1.0,,1.0,0.0,1.0,0.0,,,,,,,,,,,,,,,,,,
/fighter/Chen-Lei-253785,chen lei,Rock Man,31/12/1969,,31/12/1969,,China,"5'11""",145 lbs,Lion Heart,Featherweight,6.0,4.0,1.0,1.0,,6.0,1.0,1.0,0.0,,,,,,,,,,,,,,,,,,
/fighter/Chen-Shhori-237117,chen shhori,,,,,,Israel,"0'0""",205 lbs,,Light Heavyweight,1.0,1.0,0.0,0.0,,1.0,0.0,0.0,0.0,,,,,,,,,,,,,,,,,,
/fighter/Cheng-Zhao-186679,cheng  zhao,,,,,Shanxi,China,"0'0""",155 lbs,,Lightweight,4.0,3.0,0.0,1.0,,4.0,2.0,2.0,1.0,,,,,,,,,,,,,,,,,,
/fighter/Cheng-Chao-Li-263261,cheng chao li,,,,,,China,"0'0""",145 lbs,Dragon Warrior,Featherweight,0.0,0.0,0.0,0.0,,0.0,2.0,1.0,0.0,,,,,,,,,,,,,,,,,,
,chepe mariscal,,,,,,,,,,,,,,,,,,,,,Machine Gun,15.0,6.0,1.0,170.18,65.77,175.26,Orthodox,1992-10-27,4.67,53.0,3.95,52.0,3.22,38.0,100.0,0.6
/fighter/Cheyanne-Buys-152049,cheyanne buys,The Warrior Princess,25/06/1995,26.0,,"Clearwater, Florida",United States,"5'4""",116 lbs,Fortis MMA,Strawweight,6.0,2.0,0.0,4.0,,6.0,0.0,0.0,2.0,,,,,,,,,,,,,,,,,,
,cheyanne vlismas,,,,,,,,,,,,,,,,,,,,,The Warrior Princess,7.0,3.0,0.0,160.02,52.16,160.02,Switch,1995-06-25,4.93,50.0,2.57,64.0,0.25,33.0,66.0,0.2
/fighter/Cheyden-Leialoha-173905,cheyden leialoha,Steadfast,15/03/1994,27.0,,"Puna, Hawaii",United States,"5'8""",145 lbs,Gracie Technics,Featherweight,8.0,1.0,4.0,3.0,,8.0,0.0,0.0,2.0,,Steadfast,6.0,0.0,0.0,172.72,61.23,185.42,Orthodox,1994-03-15,1.87,28.0,3.2,53.0,2.0,33.0,71.0,0.0
/fighter/Chi-LewisParry-91943,chi lewis-parry,Chopper,10/08/1983,38.0,,London,England,"6'9""",243 lbs,The Dream Team,Heavyweight,9.0,7.0,2.0,0.0,,9.0,0.0,0.0,0.0,,Chopper,7.0,0.0,1.0,205.74,110.22,,,,0.0,0.0,0.0,0.0,0.0,0.0,0.0,0.0
/fighter/Chiao-Chen-Wu-291463,chiao chen wu,Miss Red,15/08/1983,37.0,,,Taiwan,"0'0""",115 lbs,iFighting Martial Fitness,Strawweight,2.0,0.0,1.0,1.0,,2.0,2.0,0.0,1.0,,,,,,,,,,,,,,,,,,
/fighter/Chiara-Penco-252967,chiara penco,Beasty Barbie,21/11/1995,25.0,,Livorno,Italy,"5'4""",115 lbs,Rendoki Dojo,Strawweight,5.0,1.0,4.0,0.0,,5.0,0.0,0.0,2.0,,,,,,,,,,,,,,,,,,
,chibwikem onyenegecha,,,,,,,,,,,,,,,,,,,,,,5.0,0.0,0.0,190.5,83.91,,Orthodox,1994-04-18,5.6,55.0,3.4,52.0,0.0,0.0,100.0,0.0
/fighter/Chico-Camus-42850,chico camus,King,26/01/1985,36.0,,"Milwaukee, Wisconsin",United States,"5'6""",135 lbs,Roufusport,Bantamweight,19.0,4.0,4.0,11.0,,19.0,1.0,1.0,6.0,,The King,17.0,7.0,0.0,167.64,56.7,167.64,Orthodox,1985-01-26,2.58,41.0,2.46,64.0,0.77,40.0,72.0,0.4
/fighter/Chidi-Njokuani-25761,chidi njokuani,Chidi Bang Bang,31/12/1988,32.0,,"Las Vegas, Nevada",United States,"6'3""",170 lbs,One Kick's Gym,Welterweight,19.0,11.0,1.0,7.0,,19.0,3.0,3.0,1.0,,Bang Bang,22.0,10.0,0.0,190.5,83.91,203.2,Orthodox,1988-12-31,4.04,60.0,3.19,53.0,0.0,0.0,67.0,0.3
/fighter/Chim-Chetra-137319,chim  chetra,,,,,,Cambodia,"0'0""",132 lbs,,Bantamweight,1.0,1.0,0.0,0.0,,1.0,2.0,0.0,0.0,,,,,,,,,,,,,,,,,,
/fighter/Chin-Heng-171227,chin heng,,,,,,Cambodia,"5'5""",145 lbs,,Featherweight,1.0,1.0,0.0,0.0,,1.0,1.0,2.0,0.0,,,,,,,,,,,,,,,,,,
/fighter/Chinzo-Machida-13002,chinzo machida,,09/03/1977,44.0,,"Salvador, Bahia",Brazil,"5'9""",145 lbs,Machida Karate Academy,Featherweight,5.0,4.0,0.0,1.0,,5.0,0.0,2.0,1.0,,,,,,,,,,,,,,,,,,
/fighter/Chip-MorazaPollard-39674,chip moraza-pollard,The Surgeon,,,,"Plymouth, Massachusetts",United States,"5'10""",170 lbs,Cape Cod Fighting Alliance,Welterweight,10.0,5.0,1.0,4.0,,10.0,1.0,2.0,6.0,,,,,,,,,,,,,,,,,,
/fighter/Chris-Page-35220,chris  page,,08/03/1985,36.0,,"Springfield, Missouri",United States,"5'10""",171 lbs,,Welterweight,2.0,0.0,2.0,0.0,,2.0,4.0,7.0,0.0,,,,,,,,,,,,,,,,,,
,chris amarante,,,,,,,,,,,,,,,,,,,,,,2.0,0.0,0.0,,83.91,,,,0.0,0.0,0.0,0.0,0.0,0.0,0.0,0.0
/fighter/Chris-Avila-155641,chris avila,,16/01/1993,28.0,,"Lodi, California",United States,"5'10""",155 lbs,Cesar Gracie Fight Team,Lightweight,7.0,4.0,2.0,1.0,,7.0,0.0,0.0,9.0,,,5.0,4.0,0.0,177.8,65.77,,Orthodox,1993-01-16,2.37,30.0,4.17,48.0,0.0,0.0,46.0,0.0
/fighter/Chris-Barnett-45664,chris barnett,Huggy Bear / Beastboy,14/06/1986,35.0,,"Tampa, Florida",United States,"5'9""",263 lbs,XFC,Heavyweight,21.0,16.0,0.0,5.0,,21.0,3.0,1.0,3.0,,Beastboy,23.0,8.0,0.0,175.26,120.2,190.5,Orthodox,1986-06-14,4.41,48.0,5.87,40.0,0.0,0.0,33.0,0.0
,chris barnhizer,,,,,,,,,,,,,,,,,,,,,,2.0,3.0,0.0,,,,,,0.0,0.0,0.0,0.0,0.0,0.0,0.0,0.0
,chris beal,,,,,,,,,,,,,,,,,,,,,Real Deal,10.0,5.0,0.0,170.18,56.7,175.26,Orthodox,1985-08-06,3.45,35.0,3.18,61.0,1.6,58.0,78.0,0.2
/fighter/Chris-Bell-30571,chris bell,Triple Threat,,,,,United States,"5'11""",190 lbs,,Light Heavyweight,11.0,6.0,4.0,1.0,,11.0,1.0,4.0,0.0,,,,,,,,,,,,,,,,,,
,chris birchler,,,,,,,,,,,,,,,,,,,,,The Big Buck,7.0,4.0,0.0,190.5,92.99,,Switch,1987-06-05,9.35,46.0,14.83,35.0,0.0,0.0,0.0,0.0
/fighter/Chris-Boffil-36580,chris boffil,,11/08/1985,36.0,,"Lakeland, Florida",United States,"5'10""",184 lbs,,Middleweight,3.0,1.0,2.0,0.0,,3.0,1.0,1.0,0.0,,,,,,,,,,,,,,,,,,
,chris bostick,,,,,,,,,,,,,,,,,,,,,,6.0,3.0,0.0,,,,,,0.0,0.0,0.0,0.0,0.0,0.0,0.0,0.0
/fighter/Chris-Brennan-64,chris brennan,The Westside Strangler,12/10/1971,49.0,,"Mission Viejo, California",United States,"5'8""",155 lbs,Next Generation,Lightweight,21.0,1.0,19.0,1.0,,21.0,6.0,4.0,4.0,,The Westside Strangler,21.0,13.0,1.0,172.72,77.11,,Orthodox,1971-10-12,0.6,40.0,0.97,50.0,0.0,0.0,25.0,2.1
,chris brown,,,,,,,,,,,,,,,,,,,,,,10.0,1.0,0.0,,77.11,,,,0.0,0.0,0.0,0.0,0.0,0.0,0.0,0.0
/fighter/Chris-Bungard-73304,chris bungard,,19/12/1988,32.0,,"Bellshill, North Lanarkshire",Scotland,"5'11""",155 lbs,Scottish Hit Squad,Lightweight,15.0,5.0,8.0,2.0,,15.0,0.0,3.0,4.0,,,,,,,,,,,,,,,,,,
/fighter/Chris-Camozzi-17224,chris camozzi,,20/11/1986,34.0,,"Englewood, Colorado",United States,"6'3""",185 lbs,Factory X,Middleweight,26.0,8.0,7.0,11.0,,26.0,1.0,6.0,8.0,,,24.0,13.0,0.0,187.96,83.91,190.5,Orthodox,1986-11-20,3.57,44.0,2.96,56.0,0.27,19.0,57.0,0.5
/fighter/Chris-Cariaso-16467,chris cariaso,Kamikaze,27/05/1981,40.0,,"San Francisco, California",United States,"5'3""",125 lbs,Fight and Fitness,Flyweight,17.0,3.0,2.0,12.0,,17.0,1.0,3.0,4.0,,Kamikaze,17.0,8.0,0.0,160.02,56.7,162.56,Southpaw,1981-05-27,3.35,43.0,2.23,61.0,1.11,39.0,57.0,0.8
/fighter/Chris-Cisneros-872,chris cisneros,The Maverick,24/12/1979,41.0,,"Mountain View, Hawaii",United States,"5'11""",170 lbs,Boss MMA,Welterweight,19.0,6.0,7.0,5.0,1.0,19.0,3.0,2.0,6.0,0.0,,,,,,,,,,,,,,,,,
/fighter/Chris-Clements-13469,chris clements,The Menace,09/02/1976,45.0,,"Chatam, Ontario",Canada,"5'10""",170 lbs,Adrenaline Training Center,Welterweight,12.0,11.0,0.0,1.0,,12.0,2.0,3.0,1.0,,The Menace,12.0,6.0,0.0,177.8,77.11,177.8,Orthodox,1976-02-09,3.2,49.0,2.37,44.0,0.0,0.0,32.0,0.3
/fighter/Chris-Coggins-57166,chris coggins,Dodgin',09/10/1989,31.0,,"Clarksville, Tennessee",United States,"5'9""",143 lbs,Clarksville Fight Club,Featherweight,7.0,0.0,5.0,2.0,,7.0,6.0,0.0,5.0,,,7.0,10.0,0.0,,,,,,0.0,0.0,0.0,0.0,0.0,0.0,0.0,0.0
/fighter/Chris-Condo-287,chris condo,,,,,,,"0'0""",0 lbs,,,0.0,0.0,0.0,0.0,,0.0,1.0,0.0,0.0,,,0.0,1.0,0.0,182.88,151.95,,Orthodox,,0.0,0.0,0.0,0.0,0.0,0.0,0.0,0.0
/fighter/Chris-Cope-25784,chris cope,C-Murder,05/03/1983,38.0,,"San Diego, California",United States,"6'0""",170 lbs,The Arena,Welterweight,8.0,4.0,1.0,3.0,,8.0,3.0,1.0,0.0,,C-Murder,8.0,4.0,0.0,182.88,77.11,182.88,Orthodox,1983-03-05,3.96,26.0,4.82,50.0,0.0,0.0,80.0,0.0
/fighter/Chris-Crawford-46153,chris crawford,,,,,"Durham, North Carolina",United States,"0'0""",205 lbs,,Light Heavyweight,0.0,0.0,0.0,0.0,,0.0,0.0,0.0,0.0,,,,,,,,,,,,,,,,,,
,chris culley,,,,,,,,,,,,,,,,,,,,,,20.0,15.0,0.0,,65.77,,,,0.0,0.0,0.0,0.0,0.0,0.0,0.0,0.0
,chris curtis,,,,,,,,,,,,,,,,,,,,,Action-Man,30.0,10.0,0.0,177.8,83.91,190.5,Orthodox,1987-07-15,5.36,50.0,6.3,54.0,0.0,0.0,92.0,0.0
/fighter/Chris-Daniel-268269,chris daniel,,01/11/1991,29.0,,"Pembroke Pines, Florida",United States,"0'0""",125 lbs,,Flyweight,1.0,0.0,0.0,1.0,,1.0,0.0,1.0,0.0,,,,,,,,,,,,,,,,,,
/fighter/Chris-Daukaus-103685,chris daukaus,,25/09/1989,31.0,,"Philadelphia, Pennsylvania",United States,"6'2""",234 lbs,Team Balance,Heavyweight,11.0,10.0,0.0,1.0,,11.0,2.0,1.0,0.0,,,12.0,7.0,0.0,190.5,92.99,193.04,Orthodox,1989-09-25,6.05,50.0,4.64,55.0,0.0,0.0,100.0,0.0
/fighter/Chris-Davis-41387,chris davis,The Professional,18/11/1982,38.0,,"Gadsden, Alabama",United States,"6'0""",204 lbs,Team Headhunters,Light Heavyweight,10.0,5.0,5.0,0.0,,10.0,4.0,2.0,0.0,,,,,,,,,,,,,,,,,,
/fighter/Chris-de-la-Rocha-146377,chris de la rocha,,15/05/1979,42.0,,"Washougal, Washington",United States,"6'3""",243 lbs,Forge Combat Academy,Heavyweight,5.0,3.0,2.0,0.0,,5.0,3.0,0.0,0.0,,,5.0,3.0,0.0,190.5,113.4,203.2,Orthodox,1979-05-15,4.08,45.0,6.37,43.0,2.02,30.0,33.0,1.0
/fighter/Chris-Decaro-44367,chris decaro,,20/05/1986,35.0,,"Cooper City, Florida",United States,"0'0""",185 lbs,,Middleweight,1.0,1.0,0.0,0.0,,1.0,0.0,1.0,0.0,,,,,,,,,,,,,,,,,,
/fighter/Chris-Dempsey-79277,chris dempsey,,08/09/1987,33.0,,"Johnstown, Pennsylvania",United States,"5'10""",185 lbs,Cold Steel MMA,Middleweight,11.0,2.0,3.0,6.0,,11.0,5.0,1.0,0.0,,,11.0,5.0,0.0,177.8,83.91,182.88,Orthodox,1987-09-08,2.25,32.0,2.82,65.0,2.64,23.0,16.0,0.0
/fighter/Chris-Disonell-231081,chris disonell,Showbiz Diz,,,,Connecticut,United States,"0'0""",145 lbs,Renzo Gracie Training Facility,Featherweight,6.0,2.0,1.0,3.0,,6.0,1.0,1.0,2.0,,,,,,,,,,,,,,,,,,
,chris drumm,,,,,,,,,,,,,,,,,,,,,,0.0,1.0,0.0,172.72,65.77,,,,0.0,0.0,0.0,0.0,0.0,0.0,0.0,0.0
/fighter/Chris-Duncan-74346,chris duncan,The Problem,,,,"Alloa, East Ayrshire",Scotland,"6'0""",155 lbs,MXP Fitness,Lightweight,7.0,6.0,1.0,0.0,,7.0,0.0,0.0,0.0,,The Problem,11.0,1.0,0.0,177.8,70.31,180.34,Orthodox,1993-05-10,5.08,46.0,3.74,49.0,3.63,39.0,100.0,0.0
/fighter/Chris-Fishgold-50861,chris fishgold,,06/06/1992,29.0,,"Liverpool, Merseyside",England,"5'8""",149 lbs,Next Generation UK,Lightweight,18.0,2.0,13.0,3.0,,18.0,1.0,1.0,2.0,,,18.0,4.0,1.0,172.72,65.77,172.72,Orthodox,1992-06-06,2.01,32.0,2.7,46.0,2.59,46.0,44.0,1.3
/fighter/Chris-Foster-25653,chris foster,Cassius,,,,"Middletown, Connecticut",United States,"5'9""",145 lbs,Danilo Cherman Nova Uniao,Featherweight,11.0,5.0,0.0,6.0,,11.0,1.0,2.0,2.0,,,,,,,,,,,,,,,,,,
/fighter/Chris-Goldbaugh-18460,chris goldbaugh,Shenanigans,,,,"Wheeling, West Virginia",United States,"6'0""",185 lbs,Bullpen Fight Club,Middleweight,3.0,2.0,1.0,0.0,,3.0,0.0,0.0,2.0,,,,,,,,,,,,,,,,,,
/fighter/Chris-Gruetzemacher-36924,chris gruetzemacher,Gritz,16/06/1986,35.0,,"Surprise, Arizona",United States,"5'8""",155 lbs,2 Knuckle Sports MMA Academy,Lightweight,15.0,7.0,3.0,5.0,,15.0,1.0,3.0,0.0,,Gritz,15.0,5.0,0.0,172.72,70.31,172.72,Orthodox,1986-06-16,6.18,57.0,4.96,52.0,0.21,50.0,65.0,0.0
,chris guillen,,,,,,,,,,,,,,,,,,,,,,13.0,16.0,0.0,182.88,108.86,,Orthodox,1972-12-09,0.82,27.0,1.91,36.0,0.0,0.0,0.0,0.0
/fighter/Chris-Gutierrez-59736,chris gutierrez,El Guapo,22/04/1991,30.0,,"Greenville, Texas",United States,"5'8""",145 lbs,Factory X,Featherweight,16.0,7.0,1.0,8.0,,16.0,0.0,1.0,3.0,,El Guapo,20.0,5.0,2.0,175.26,61.23,170.18,Orthodox,1991-04-22,5.04,57.0,2.73,65.0,0.34,37.0,71.0,0.1
/fighter/Chris-Harris-191663,chris harris,,14/03/1990,31.0,,"Wichita, Kansas",United States,"5'11""",170 lbs,JMTK,Welterweight,11.0,5.0,3.0,3.0,,11.0,1.0,3.0,1.0,,,,,,,,,,,,,,,,,,
/fighter/Chris-Haseman-1449,chris haseman,The Hammer,02/06/1969,52.0,,,Australia,"5'11""",198 lbs,Rings Australia,Light Heavyweight,20.0,2.0,14.0,3.0,1.0,20.0,8.0,3.0,6.0,0.0,The Hammer,20.0,17.0,0.0,180.34,92.99,,Orthodox,1969-06-02,0.93,70.0,4.67,28.0,0.0,0.0,40.0,2.0
/fighter/Chris-Hatley-Jr-216751,chris hatley jr.,Solo,24/08/1996,24.0,,"Hot Springs, Arkansas",United States,"5'6""",155 lbs,Off The Chain MMA,Lightweight,8.0,3.0,1.0,4.0,,8.0,1.0,2.0,2.0,,,,,,,,,,,,,,,,,,
,chris hawk,,,,,,,,,,,,,,,,,,,,,,5.0,10.0,0.0,185.42,92.99,,,,0.0,0.0,0.0,0.0,0.0,0.0,0.0,0.0
/fighter/Chris-Heatherly-101117,chris heatherly,Stump,24/11/1987,33.0,,"Cahokia, Illinois",United States,"5'8""",180 lbs,Fit or Fight,Middleweight,9.0,1.0,4.0,4.0,,9.0,2.0,2.0,0.0,,Stump,9.0,4.0,0.0,175.26,70.31,,Orthodox,1987-11-24,1.08,45.0,2.67,52.0,3.39,50.0,100.0,0.7
/fighter/Chris-Herrera-70125,chris herrera,The Crusher,23/04/1984,37.0,,"Temecula, California",United States,"5'8""",170 lbs,Team Quest,Welterweight,3.0,3.0,0.0,0.0,,3.0,3.0,1.0,0.0,,The Crusher,3.0,2.0,1.0,177.8,83.91,,,,2.04,37.0,3.35,48.0,1.8,100.0,100.0,0.0
,chris hofmann,,,,,,,,,,,,,,,,,,,,,,9.0,2.0,0.0,182.88,77.11,182.88,Orthodox,1989-11-18,4.78,45.0,4.63,35.0,3.42,42.0,0.0,0.0
/fighter/Chris-Holdsworth-51225,chris holdsworth,Holds It Down,24/10/1987,33.0,,"Las Vegas, Nevada",United States,"5'11""",135 lbs,Team Alpha Male,Bantamweight,6.0,0.0,5.0,1.0,,6.0,0.0,0.0,0.0,,,6.0,0.0,0.0,180.34,61.23,,,,1.85,29.0,1.94,58.0,3.38,62.0,100.0,2.0
/fighter/Chris-Honeycutt-124263,chris honeycutt,The Cutt,25/07/1988,33.0,,"Fresno, California",United States,"5'10""",185 lbs,Dethrone Base Camp,Middleweight,12.0,5.0,1.0,6.0,,12.0,1.0,1.0,2.0,,The Cutt,9.0,1.0,0.0,177.8,77.11,185.42,,,2.99,44.0,1.41,66.0,3.4,45.0,75.0,0.0
/fighter/Chris-Horodecki-13944,chris horodecki,The Polish Hammer,24/09/1987,33.0,,"London, Ontario",Canada,"5'9""",145 lbs,Adrenaline MMA,Featherweight,21.0,7.0,4.0,10.0,,21.0,4.0,2.0,1.0,,The Polish Hammer,21.0,7.0,1.0,175.26,70.31,175.26,Orthodox,1987-09-24,4.59,41.0,3.16,65.0,1.52,55.0,37.0,0.9
/fighter/Chris-Indich-42419,chris indich,,22/04/1987,34.0,,"Perth, Western Australia",Australia,"5'10""",170 lbs,The Arena MMA,Welterweight,6.0,3.0,2.0,0.0,1.0,6.0,2.0,0.0,2.0,0.0,,6.0,4.0,0.0,177.8,77.11,,,,1.31,30.0,4.32,43.0,0.75,50.0,50.0,1.5
,chris inman,,,,,,,,,,,,,,,,,,,,,,1.0,0.0,0.0,,,,,,0.0,0.0,0.0,0.0,0.0,0.0,0.0,0.0
/fighter/Chris-Inocencio-183177,chris inocencio,,,,,"Jackson, California",United States,"5'9""",145 lbs,,Featherweight,2.0,1.0,0.0,1.0,,2.0,1.0,1.0,0.0,,,,,,,,,,,,,,,,,,
/fighter/Chris-Jones-25808,chris jones,Lionheart,16/11/1981,39.0,,"Dallas, Texas",United States,"5'9""",163 lbs,Mohler MMA,Welterweight,10.0,4.0,2.0,4.0,,10.0,3.0,1.0,1.0,,Lionheart,10.0,5.0,0.0,175.26,67.59,,,,0.0,0.0,0.0,0.0,0.0,0.0,0.0,0.0
/fighter/Chris-Kelades-51576,chris kelades,The Greek Assassin,21/02/1981,40.0,,"Cole Harbour, Nova Scotia",Canada,"5'7""",125 lbs,Fit Plus,Flyweight,14.0,2.0,4.0,8.0,,14.0,0.0,1.0,4.0,,The Greek Assassin,9.0,3.0,0.0,170.18,56.7,172.72,Orthodox,1981-02-21,2.4,43.0,2.64,48.0,1.04,18.0,53.0,0.3
/fighter/Chris-Lane-67473,chris lane,Kid Khaos,,,,"Cedar Falls, Iowa",United States,"5'8""",140 lbs,Hard Drive MMA,Featherweight,13.0,1.0,11.0,1.0,,13.0,7.0,6.0,1.0,,,,,,,,,,,,,,,,,,
/fighter/Chris-Leben-6258,chris leben,The Crippler,21/07/1980,41.0,,"Portland, Oregon",United States,"5'11""",185 lbs,Alliance MMA,Middleweight,22.0,12.0,5.0,5.0,,22.0,4.0,2.0,6.0,,The Crippler,22.0,11.0,0.0,180.34,83.91,185.42,Southpaw,1980-07-21,2.87,42.0,2.87,52.0,1.14,41.0,53.0,0.8
/fighter/Chris-Liguori-4102,chris liguori,The Story,,,,"Toms River, New Jersey",United States,"5'10""",155 lbs,Ricardo Almeida Jiu-Jitsu,Lightweight,15.0,5.0,5.0,5.0,,15.0,2.0,5.0,3.0,,,15.0,10.0,0.0,175.26,83.91,,Orthodox,,0.29,33.0,1.44,0.0,0.0,0.0,50.0,0.0
/fighter/Chris-Lokteff-79116,chris lokteff,Igor,05/09/1986,34.0,,"Brisbane, Queensland",Australia,"6'1""",248 lbs,Integrated MMA,Heavyweight,12.0,9.0,2.0,1.0,,12.0,3.0,0.0,0.0,,,,,,,,,,,,,,,,,,
/fighter/Chris-Lozano-39539,chris lozano,The Cleveland Assassin,14/09/1982,38.0,,"Cleveland, Ohio",United States,"6'1""",170 lbs,Evolve MMA,Welterweight,10.0,8.0,1.0,1.0,,10.0,2.0,1.0,2.0,,,,,,,,,,,,,,,,,,
/fighter/Chris-Lytle-267,chris lytle,Lights Out,18/08/1974,46.0,,"Indianapolis, Indiana",United States,"5'11""",170 lbs,Integrated Fighting Academy,Welterweight,31.0,6.0,19.0,6.0,,31.0,2.0,0.0,16.0,,Lights Out,31.0,18.0,5.0,180.34,77.11,172.72,Orthodox,1974-08-18,3.76,45.0,3.03,58.0,0.7,55.0,55.0,2.4
/fighter/Chris-Manuel-18669,chris manuel,,21/07/1987,34.0,,"Coconut Creek, Florida",United States,"5'6""",143 lbs,American Top Team,Featherweight,9.0,3.0,5.0,1.0,,9.0,1.0,1.0,5.0,,,9.0,7.0,2.0,175.26,61.23,,Orthodox,1987-07-21,2.53,40.0,2.67,66.0,1.0,20.0,100.0,0.0
,chris mickle,,,,,,,,,,,,,,,,,,,,,,30.0,21.0,2.0,175.26,65.77,,Orthodox,1983-07-10,3.03,27.0,9.7,48.0,0.0,0.0,0.0,0.0
/fighter/Chris-Mierzwiak-43188,chris mierzwiak,College,14/02/1988,33.0,,"Sylvania, Ohio",United States,"6'1""",170 lbs,Team Jorge Gurgel,Welterweight,5.0,1.0,4.0,0.0,,5.0,0.0,0.0,3.0,,,5.0,3.0,0.0,185.42,83.91,,,,1.6,61.0,1.73,48.0,2.0,28.0,0.0,1.0
/fighter/Chris-Padilla-124527,chris padilla,Taco,14/09/1995,25.0,,"Gardena, California",United States,"5'9""",155 lbs,Fight Science,Lightweight,9.0,4.0,3.0,2.0,,9.0,1.0,2.0,1.0,,,,,,,,,,,,,,,,,,
/fighter/Chris-Pham-45885,chris pham,C-Lo,,,,"Baton Rouge, Louisiana",United States,"5'7""",139 lbs,Gracie United,Featherweight,5.0,1.0,3.0,1.0,,5.0,2.0,2.0,2.0,,,,,,,,,,,,,,,,,,
/fighter/Chris-Price-14121,chris price,Exorcist,,,,"Beach Grove, Indiana",United States,"6'2""",203 lbs,Team IBJJA,Light Heavyweight,19.0,7.0,7.0,5.0,,19.0,1.0,3.0,0.0,,The Exorcist,19.0,4.0,0.0,187.96,83.91,,Southpaw,1982-11-09,1.44,66.0,2.59,48.0,0.0,0.0,33.0,2.2
/fighter/Chris-Sanford-2656,chris sanford,,12/03/1968,53.0,,"San Francisco, California",United States,"5'11""",185 lbs,Cesar Gracie Jiu-Jitsu,Middleweight,5.0,1.0,4.0,0.0,,5.0,1.0,0.0,0.0,,,5.0,1.0,0.0,180.34,83.91,,Orthodox,1968-03-12,0.23,50.0,3.22,17.0,0.0,0.0,0.0,3.5
/fighter/Chris-Saunders-7358,chris saunders,The SoCal Kid,11/03/1986,35.0,,"Buena Park, California",United States,"5'8""",155 lbs,All In MMA,Lightweight,16.0,3.0,7.0,6.0,,16.0,1.0,3.0,4.0,,The So Cal Kid,16.0,8.0,0.0,172.72,70.31,,,,1.48,22.0,2.96,75.0,3.7,100.0,0.0,0.0
/fighter/Chris-Simmons-23779,chris simmons,,25/09/1985,35.0,,Connecticut,United States,"0'0""",155 lbs,Strike Zone MMA,Lightweight,7.0,2.0,4.0,1.0,,7.0,0.0,1.0,3.0,,,,,,,,,,,,,,,,,,
/fighter/Chris-Soliz-190975,chris soliz,,14/01/1998,23.0,,"Houston, Texas",United States,"5'6""",135 lbs,4oz. Fight Club,Bantamweight,0.0,0.0,0.0,0.0,,0.0,0.0,1.0,0.0,,,,,,,,,,,,,,,,,,
,chris solomon,,,,,,,,,,,,,,,,,,,,,,0.0,0.0,0.0,180.34,70.31,,,,0.0,0.0,2.8,37.0,0.0,0.0,33.0,0.0
/fighter/Chris-Spang-40205,chris spang,The Kiss,26/11/1987,33.0,,"Las Vegas, Nevada",United States,"6'2""",171 lbs,J-Sect MMA,Welterweight,6.0,4.0,1.0,1.0,,6.0,1.0,0.0,2.0,,The Kiss,6.0,3.0,0.0,187.96,77.11,,Orthodox,1987-11-26,1.83,36.0,1.95,60.0,0.0,0.0,50.0,0.9
/fighter/Chris-Spicer-35421,chris spicer,,,,,"Waco, Texas",United States,"0'0""",185 lbs,Relson Gracie Waco,Middleweight,4.0,1.0,3.0,0.0,,4.0,2.0,1.0,1.0,,,,,,,,,,,,,,,,,,
/fighter/Chris-Tickle-22955,chris tickle,Bad Boy,01/02/1982,39.0,,"Bloomington, Illinois",United States,"5'9""",160 lbs,Adrenaline MMA,Welterweight,9.0,6.0,1.0,2.0,,9.0,1.0,6.0,2.0,,BadBoy,9.0,9.0,0.0,175.26,70.31,,,,1.07,40.0,1.13,43.0,1.0,25.0,20.0,2.0
/fighter/Chris-Tuchscherer-10669,chris tuchscherer,The Crowbar,08/09/1975,45.0,,"Fargo, North Dakota",United States,"6'2""",260 lbs,Academy of Combat Arts,Heavyweight,21.0,12.0,4.0,5.0,,21.0,3.0,0.0,1.0,,The Crowbar,21.0,4.0,0.0,187.96,117.03,193.04,Orthodox,1975-09-08,1.35,31.0,3.17,47.0,1.19,18.0,0.0,0.6
/fighter/Chris-Wade-79335,chris wade,The Long Island Killer,30/09/1987,33.0,,"Long Island, New York",United States,"5'9""",145 lbs,East Islip Kickboxing,Featherweight,19.0,1.0,5.0,13.0,,19.0,0.0,0.0,6.0,,,12.0,3.0,0.0,177.8,70.31,177.8,Orthodox,1987-09-30,1.7,53.0,1.75,51.0,2.6,51.0,55.0,1.1
/fighter/Chris-Weidman-42804,chris weidman,The All-American,17/06/1984,37.0,,"Baldwin, New York",United States,"6'2""",185 lbs,Serra-Longo Fight Team,Middleweight,15.0,6.0,4.0,5.0,,15.0,6.0,0.0,0.0,,The All-American,15.0,7.0,0.0,187.96,83.91,198.12,Orthodox,1984-06-17,2.98,43.0,3.27,50.0,3.6,43.0,65.0,0.8
/fighter/Chris-Wilson-9281,chris wilson,The Professor,07/06/1977,44.0,,"Ribeirao Preto, Sao Paulo",Brazil,"6'1""",155 lbs,CW Combat Sports,Lightweight,18.0,7.0,8.0,3.0,,18.0,1.0,2.0,7.0,,The Professor,18.0,10.0,0.0,185.42,77.11,190.5,Orthodox,1977-06-07,2.32,50.0,1.36,55.0,1.31,50.0,60.0,1.6
,chris wright,,,,,,,,,,,,,,,,,,,,,,8.0,5.0,1.0,,,,,,0.0,0.0,0.0,0.0,0.0,0.0,0.0,0.0
,chris yee,,,,,,,,,,,,,,,,,,,,,,4.0,6.0,0.0,175.26,83.91,,,,0.0,0.0,0.0,0.0,0.0,0.0,0.0,0.0
/fighter/Chrissie-Daniels-120041,chrissie daniels,The Demon,13/05/1986,35.0,,"Ypsilanti Township, Michigan",United States,"5'5""",114 lbs,Michigan Top Team,Strawweight,2.0,2.0,0.0,0.0,,2.0,2.0,2.0,0.0,,,,,,,,,,,,,,,,,,
/fighter/Christ-Franck-71182,christ franck,The Beast,18/09/1982,38.0,,"Montreal, Quebec",Canada,"6'0""",170 lbs,Champion's Creed MMA,Welterweight,6.0,3.0,0.0,3.0,0.0,6.0,3.0,0.0,3.0,1.0,,,,,,,,,,,,,,,,,
/fighter/Christian-Aguilera-90555,christian aguilera,The Beast,25/11/1991,29.0,,"Brea, California",United States,"5'9""",170 lbs,Total MMA Studios,Welterweight,14.0,11.0,0.0,3.0,,14.0,4.0,2.0,2.0,,The Beast,14.0,8.0,0.0,175.26,77.11,182.88,Switch,1991-11-25,2.54,37.0,4.04,48.0,0.0,0.0,60.0,0.0
/fighter/Christian-Colombo-55092,christian colombo,Godzilla,07/01/1980,41.0,,Copenhagen,Denmark,"6'5""",258 lbs,Combat Sports Academy,Heavyweight,8.0,6.0,0.0,2.0,,8.0,0.0,3.0,1.0,,,8.0,3.0,1.0,195.58,120.2,,Orthodox,1980-07-01,2.76,44.0,4.02,42.0,0.0,0.0,33.0,0.0
/fighter/Christian-Echols-250011,christian echols,,11/06/1998,23.0,,"Cullman, Alabama",United States,"0'0""",233 lbs,,Heavyweight,1.0,0.0,1.0,0.0,,1.0,0.0,1.0,0.0,,,,,,,,,,,,,,,,,,
/fighter/Christian-Edwards-270755,christian edwards,,05/11/1998,22.0,,Oklahoma,United States,"6'5""",205 lbs,,Light Heavyweight,5.0,2.0,1.0,2.0,,5.0,0.0,0.0,0.0,,,,,,,,,,,,,,,,,,
/fighter/Christian-Fulgium-24677,christian fulgium,,,,,"Benton, Louisiana",United States,"5'10""",170 lbs,,Welterweight,8.0,4.0,3.0,0.0,1.0,8.0,4.0,6.0,0.0,0.0,,,,,,,,,,,,,,,,,
/fighter/Christian-Gonzalez-128089,christian gonzalez,The Vato,,,,"Buena Park, California",United States,"6'4""",172 lbs,All In MMA,Middleweight,2.0,2.0,0.0,0.0,,2.0,1.0,0.0,0.0,,,,,,,,,,,,,,,,,,
/fighter/Christian-Holley-29428,christian holley,The Animal,13/05/1988,33.0,,Newcastle,England,"5'9""",155 lbs,Atherton Submission Wrestling,Lightweight,10.0,4.0,4.0,2.0,,10.0,3.0,1.0,0.0,,,,,,,,,,,,,,,,,,
/fighter/Christian-Lee-212247,christian lee,The Warrior,21/06/1998,23.0,,"Vancouver, British Columbia",Canada,"5'10""",170 lbs,Evolve MMA,Welterweight,15.0,10.0,4.0,1.0,0.0,15.0,0.0,1.0,1.0,1.0,,,,,,,,,,,,,,,,,
,christian leroy duncan,,,,,,,,,,,,,,,,,,,,,CLD,9.0,1.0,0.0,187.96,83.91,200.66,Switch,1995-07-24,5.06,59.0,4.68,47.0,0.0,0.0,50.0,0.0
,christian lohsen,,,,,,,,,,,,,,,,,,,,,Hollywood,4.0,2.0,0.0,187.96,70.31,195.58,Southpaw,1995-01-24,5.27,49.0,6.93,44.0,0.0,0.0,0.0,2.0
/fighter/Christian-MPumbu-10555,christian m'pumbu,Everlasting,02/06/1977,44.0,,Kinshasa,Congo,"6'2""",191 lbs,MMA Factory,Light Heavyweight,21.0,9.0,8.0,3.0,1.0,21.0,3.0,2.0,6.0,0.0,,,,,,,,,,,,,,,,,
/fighter/Christian-Medina-282373,christian medina,The Giant Killer,,,,,United States,"0'0""",128 lbs,,Bantamweight,0.0,0.0,0.0,0.0,,0.0,2.0,0.0,0.0,,,,,,,,,,,,,,,,,,
/fighter/Christian-Morecraft-34376,christian morecraft,,08/09/1986,34.0,,"Plymouth, Massachusetts",United States,"6'6""",261 lbs,Team Bombsquad,Heavyweight,8.0,3.0,5.0,0.0,,8.0,3.0,0.0,0.0,,,8.0,3.0,0.0,198.12,117.93,205.74,Orthodox,1986-09-08,2.82,34.0,2.46,46.0,3.26,66.0,50.0,2.2
,christian ocon,,,,,,,,,,,,,,,,,,,,,,2.0,1.0,0.0,172.72,61.23,175.26,Orthodox,1996-02-05,1.73,53.0,5.27,34.0,0.0,0.0,63.0,0.0
/fighter/Christian-Rodriguez-303043,christian rodriguez,,17/12/1997,23.0,,"Milwaukee, Wisconsin",United States,"5'7""",145 lbs,Roufusport,Featherweight,5.0,3.0,2.0,0.0,,5.0,0.0,0.0,0.0,,,10.0,1.0,0.0,170.18,61.23,180.34,Orthodox,1997-12-17,3.51,46.0,2.46,58.0,1.4,54.0,70.0,1.4
/fighter/Christian-Uflacker-34561,christian uflacker,,04/08/1985,36.0,,"Chicago, Illinois",United States,"5'11""",170 lbs,Uflacker Academy,Welterweight,5.0,0.0,2.0,3.0,,5.0,0.0,0.0,0.0,,,5.0,0.0,0.0,180.34,77.11,,,,0.0,0.0,0.0,0.0,0.0,0.0,0.0,0.0
/fighter/Christian-Wellisch-3328,christian wellisch,,,,,"Los Angeles, California",United States,"6'2""",234 lbs,American Kickboxing Academy,Heavyweight,8.0,4.0,3.0,1.0,,8.0,3.0,1.0,1.0,,The Hungarian Nightmare,8.0,5.0,0.0,187.96,106.14,195.58,Orthodox,1975-09-13,3.12,27.0,3.04,56.0,1.22,42.0,45.0,1.2
/fighter/Christian-Ynastrilla-268267,christian ynastrilla,,18/03/1996,25.0,,"Miramar, Florida",United States,"5'6""",132 lbs,American Top Team Miramar,Bantamweight,6.0,0.0,5.0,1.0,,6.0,2.0,0.0,1.0,,,,,,,,,,,,,,,,,,
/fighter/Christina-Marks-49840,christina marks,,09/11/1985,35.0,,"San Diego, California",United States,"5'7""",125 lbs,Fight Ugly,Flyweight,8.0,3.0,2.0,3.0,,8.0,1.0,7.0,2.0,,,8.0,9.0,0.0,170.18,56.7,175.26,Orthodox,1985-11-08,5.0,58.0,3.0,64.0,7.5,100.0,0.0,0.0
/fighter/Christophe-Leninger-40,christophe leninger,,16/07/1962,59.0,,"Scottsdale, Arizona",United States,"6'0""",200 lbs,,Light Heavyweight,3.0,0.0,3.0,0.0,,3.0,1.0,0.0,3.0,,,3.0,4.0,0.0,182.88,90.72,,Southpaw,,0.0,0.0,0.0,0.0,0.0,0.0,0.0,0.0
/fighter/Christophe-Van-Dijck-80318,christophe van dijck,,05/07/1985,36.0,,Brussels,Belgium,"6'0""",170 lbs,Tiger Muay Thai,Welterweight,9.0,2.0,5.0,2.0,,9.0,3.0,0.0,2.0,,,,,,,,,,,,,,,,,,
/fighter/Christopher-Gonzalez-302397,christopher gonzalez,CG Lion,29/07/1991,30.0,,"Sacramento, California",United States,"5'11""",155 lbs,Team Alpha Male,Lightweight,6.0,1.0,1.0,4.0,,6.0,1.0,0.0,0.0,,,,,,,,,,,,,,,,,,
/fighter/Christopher-Hicks-78019,christopher hicks,The Tree Hugger,06/11/1990,30.0,,"Humbolt, California",United States,"6'0""",169 lbs,,Welterweight,7.0,0.0,6.0,1.0,,7.0,5.0,9.0,0.0,,,,,,,,,,,,,,,,,,
,christopher lopez,,,,,,,,,,,,,,,,,,,,,,9.0,1.0,0.0,177.8,77.11,,,,0.0,0.0,0.0,0.0,0.0,0.0,0.0,0.0
/fighter/Christopher-Mario-Beal-53369,christopher mario beal,The Real Deal,06/08/1985,36.0,,"Ventura, California",United States,"5'7""",135 lbs,KnuckleHeadz Boxing,Bantamweight,10.0,3.0,0.0,7.0,,10.0,2.0,1.0,3.0,,,,,,,,,,,,,,,,,,
/fighter/Christopher-Reyes-313753,christopher reyes,,,,,California,United States,"5'8""",185 lbs,,Middleweight,0.0,0.0,0.0,0.0,,0.0,1.0,0.0,0.0,,,,,,,,,,,,,,,,,,
/fighter/Christopher-Wing-66690,christopher wing,Red Line,02/06/1988,33.0,,"Trevose, Pennsylvania",United States,"5'10""",186 lbs,Wing's Martial Arts Academy,Middleweight,4.0,2.0,0.0,2.0,,4.0,1.0,0.0,3.0,,,,,,,,,,,,,,,,,,
/fighter/Christos-Giagos-68130,christos giagos,The Spartan,23/01/1990,31.0,,"Hawthorne, California",United States,"5'10""",155 lbs,Black House,Lightweight,19.0,7.0,4.0,8.0,,19.0,1.0,4.0,3.0,,The Spartan,20.0,11.0,0.0,177.8,70.31,180.34,Orthodox,1990-01-23,2.98,42.0,2.95,51.0,2.93,37.0,52.0,0.4
/fighter/Christos-Nicolaou-263267,christos nicolaou,Coco,,,,,Cyprus,"6'0""",170 lbs,Paphos Thai Boxing & MMA Fight Club,Welterweight,2.0,2.0,0.0,0.0,,2.0,1.0,0.0,0.0,,,,,,,,,,,,,,,,,,
/fighter/Chuck-Campbell-299875,chuck campbell,,,,,"San Jose, California",United States,"6'4""",205 lbs,American Kickboxing Academy,Light Heavyweight,2.0,1.0,0.0,1.0,,2.0,0.0,0.0,1.0,,,,,,,,,,,,,,,,,,
,chuck grigsby,,,,,,,,,,,,,,,,,,,,,The Reverend,23.0,10.0,0.0,198.12,92.99,,Orthodox,,0.71,16.0,3.29,46.0,0.0,0.0,66.0,0.0
/fighter/Chuck-Liddell-192,chuck liddell,The Iceman,17/12/1969,51.0,,"San Luis Obispo, California",United States,"6'2""",205 lbs,The Pit,Light Heavyweight,21.0,13.0,1.0,7.0,,21.0,7.0,1.0,1.0,,The Iceman,21.0,8.0,0.0,187.96,92.99,193.04,Orthodox,1969-12-17,2.97,35.0,2.71,56.0,0.44,75.0,81.0,0.0
/fighter/Chuck-Mady-34223,chuck mady,The Energiza Bunny,16/10/1988,32.0,,"Windsor, Ontario",Canada,"5'7""",145 lbs,Mady's School of Martial Arts,Featherweight,6.0,1.0,5.0,0.0,,6.0,6.0,5.0,0.0,,,,,,,,,,,,,,,,,,
/fighter/Chuck-ONeil-15855,chuck o'neil,Cold Steel,22/09/1985,35.0,,"Bourne, Massachusetts",United States,"6'2""",185 lbs,Mass BJJ,Middleweight,17.0,6.0,6.0,5.0,,17.0,2.0,3.0,4.0,,Cold Steel,17.0,9.0,0.0,187.96,77.11,,,,3.13,37.0,4.4,72.0,0.0,0.0,0.0,0.0
/fighter/Chuka-Willis-122799,chuka willis,The Lion King,09/05/1993,28.0,,"Emporia, Kansas",United States,"5'11""",145 lbs,American Top Team HD,Featherweight,10.0,5.0,1.0,4.0,,10.0,1.0,1.0,4.0,,,,,,,,,,,,,,,,,,
/fighter/Chunbo-Yuan-69455,chunbo yuan,The Windmill from Hell,,,,"Harbin, Heilongjiang",China,"5'10""",145 lbs,Longyun MMA Gym,Featherweight,7.0,0.0,3.0,4.0,,7.0,3.0,1.0,4.0,,,,,,,,,,,,,,,,,,
/fighter/Chunyan-Xu-263265,chunyan xu,,10/03/1990,31.0,,Beijing,China,"5'3""",115 lbs,,Strawweight,1.0,0.0,0.0,1.0,,1.0,0.0,0.0,0.0,,,,,,,,,,,,,,,,,,
/fighter/Ciaran-Clarke-151927,ciaran clarke,,,,,Drogheda,Ireland,"5'8""",155 lbs,SBG Ireland,Lightweight,3.0,0.0,1.0,2.0,,3.0,0.0,0.0,0.0,,,,,,,,,,,,,,,,,,
/fighter/Cindy-Dandois-42457,cindy dandois,Battlecat,26/10/1984,36.0,,Deurne,Belgium,"5'7""",135 lbs,Lynx MMA,Bantamweight,16.0,5.0,8.0,2.0,1.0,16.0,1.0,2.0,4.0,0.0,Battlecat,8.0,3.0,0.0,170.18,61.23,,Orthodox,1984-10-26,3.13,32.0,3.4,58.0,5.0,55.0,0.0,0.0
/fighter/Ciryl-Gane-293973,ciryl gane,Bon Gamin,06/05/1990,31.0,,"Paris, Ville de Paris",France,"6'5""",247 lbs,MMA Factory,Heavyweight,10.0,4.0,3.0,3.0,,10.0,0.0,0.0,0.0,,Bon Gamin,12.0,2.0,0.0,193.04,111.13,205.74,Orthodox,1990-04-12,5.49,60.0,2.19,63.0,0.58,21.0,50.0,0.5
/fighter/CJ-Fernandes-261,cj fernandes,,13/11/1977,43.0,,"Granite City, Illinois",United States,"6'0""",170 lbs,HIT Squad,Welterweight,14.0,10.0,2.0,2.0,0.0,14.0,4.0,3.0,0.0,1.0,,14.0,8.0,3.0,187.96,77.11,,,,0.0,0.0,0.0,0.0,0.0,0.0,0.0,0.0
,cj hamilton,,,,,,,,,,,,,,,,,,,,,The Autobot,11.0,4.0,0.0,170.18,56.7,172.72,Switch,1986-10-07,2.47,31.0,3.93,58.0,0.0,0.0,62.0,0.0
,cj keith,,,,,,,,,,,,,,,,,,,,,,8.0,4.0,0.0,182.88,70.31,,Orthodox,1986-08-09,0.86,50.0,1.82,50.0,0.0,0.0,62.0,0.0
,cj marsh,,,,,,,,,,,,,,,,,,,,,,5.0,7.0,0.0,,,,,,0.0,0.0,0.0,0.0,0.0,0.0,0.0,0.0
,cj vergara,,,,,,,,,,,,,,,,,,,,,,12.0,4.0,1.0,167.64,56.7,172.72,Orthodox,1991-06-18,6.01,57.0,5.01,53.0,0.0,0.0,74.0,0.2
/fighter/Claire-Lopez-269797,claire lopez,,04/11/1988,32.0,,,France,"5'4""",115 lbs,Great Britain Top Team,Strawweight,4.0,2.0,2.0,0.0,,4.0,0.0,3.0,0.0,,,,,,,,,,,,,,,,,,
/fighter/Claude-Patrick-4114,claude patrick,The Prince,14/06/1980,41.0,,"Mississauga, Ontario",Canada,"5'10""",170 lbs,Elite Mixed Fighters,Welterweight,14.0,3.0,9.0,2.0,,14.0,0.0,0.0,2.0,,The Prince,14.0,2.0,0.0,180.34,77.11,190.5,Orthodox,1980-06-14,1.8,55.0,0.89,69.0,2.32,53.0,84.0,1.7
/fighter/Claude-Wilcox-307853,claude wilcox,,10/03/1994,27.0,,"Arkadelphia, Arkansas",United States,"5'11""",185 lbs,,Middleweight,1.0,1.0,0.0,0.0,,1.0,2.0,0.0,0.0,,,,,,,,,,,,,,,,,,
/fighter/Claudia-Diaz-302777,claudia diaz,,,,,,Spain,"0'0""",115 lbs,Tiger Muay Thai & MMA,Strawweight,1.0,1.0,0.0,0.0,,1.0,1.0,0.0,1.0,,,,,,,,,,,,,,,,,,
/fighter/Claudia-Gadelha-48404,claudia gadelha,Claudinha,07/12/1988,32.0,,"Mossoro, Rio Grande do Norte",Brazil,"5'3""",115 lbs,Luttrell-Yee MMA,Strawweight,18.0,2.0,7.0,9.0,,18.0,0.0,0.0,5.0,,Claudinha,18.0,5.0,0.0,162.56,52.16,160.02,Orthodox,1988-12-07,3.31,41.0,4.57,57.0,3.03,42.0,58.0,0.7
,claudia leite,,,,,,,,,,,,,,,,,,,,,,8.0,3.0,0.0,160.02,61.23,162.56,Orthodox,1996-11-04,1.27,47.0,1.73,57.0,1.0,25.0,0.0,1.0
/fighter/Claudio-Annicchiarico-220889,claudio annicchiarico,,,,,,Italy,"6'2""",185 lbs,,Middleweight,1.0,1.0,0.0,0.0,,1.0,2.0,2.0,0.0,,,,,,,,,,,,,,,,,,
/fighter/Claudio-Ledesma-61676,claudio ledesma,,02/04/1983,38.0,,"Denville, New Jersey",United States,"5'6""",125 lbs,Team Renzo Gracie Denville,Flyweight,15.0,2.0,3.0,10.0,,15.0,0.0,0.0,9.0,,,,,,,,,,,,,,,,,,
,claudio mattos,,,,,,,,,,,,,,,,,,,,,Popeye,5.0,4.0,0.0,,83.91,,Orthodox,,0.0,0.0,3.53,0.0,0.0,0.0,0.0,0.0
/fighter/Claudio-Puelles-105897,claudio puelles,El Nino,21/04/1996,25.0,,Molina,Peru,"5'11""",155 lbs,Pitbull Martial Arts Center,Lightweight,10.0,2.0,5.0,3.0,,10.0,1.0,0.0,1.0,,Prince of Peru,13.0,3.0,0.0,177.8,70.31,182.88,Southpaw,1996-04-21,1.82,49.0,2.93,47.0,2.41,30.0,60.0,1.4
,claudio ribeiro,,,,,,,,,,,,,,,,,,,,,,11.0,4.0,0.0,185.42,83.91,195.58,Orthodox,1992-07-17,4.65,57.0,3.34,31.0,0.76,50.0,75.0,0.0
/fighter/Claudio-Silva-25830,claudio silva,Hannibal,06/09/1982,38.0,,"Rondonopolis, Mato Grosso",Brazil,"5'11""",170 lbs,London Shootfighters,Welterweight,14.0,2.0,9.0,3.0,0.0,14.0,0.0,0.0,2.0,1.0,Hannibal,14.0,4.0,0.0,180.34,77.11,180.34,Southpaw,1982-09-06,2.48,42.0,3.0,46.0,2.85,26.0,44.0,1.1
,claudionor fontinelle,,,,,,,,,,,,,,,,,,,,,,10.0,15.0,1.0,165.1,83.91,,Orthodox,,2.62,42.0,10.25,28.0,0.0,0.0,0.0,0.0
/fighter/Clay-Collard-78465,clay collard,Cassius,10/03/1993,28.0,,"Price, Utah",United States,"5'11""",155 lbs,The Pit Elevated Fight Team,Lightweight,20.0,10.0,3.0,7.0,,20.0,1.0,3.0,4.0,,Cassius,14.0,7.0,0.0,180.34,65.77,185.42,Orthodox,1993-03-10,4.22,32.0,5.0,50.0,2.81,39.0,71.0,0.5
,clay french,,,,,,,,,,,,,,,,,,,,,,19.0,7.0,0.0,170.18,73.03,,Southpaw,1980-10-07,1.52,50.0,1.27,16.0,0.0,0.0,100.0,0.0
/fighter/Clay-Guida-8184,clay guida,The Carpenter,08/12/1981,39.0,,"Round Lake, Illinois",United States,"5'7""",155 lbs,Team Alpha Male,Lightweight,36.0,7.0,13.0,15.0,1.0,36.0,2.0,10.0,7.0,1.0,The Carpenter,38.0,21.0,0.0,170.18,70.31,177.8,Orthodox,1981-12-08,2.64,33.0,3.01,61.0,3.13,36.0,67.0,0.6
/fighter/Clay-Harvison-21131,clay harvison,Heavy Metal,25/09/1980,40.0,,"Marietta, Georgia",United States,"6'1""",160 lbs,Madhouse Training,Welterweight,14.0,6.0,4.0,4.0,,14.0,3.0,4.0,2.0,,Bushwacker,13.0,6.0,0.0,185.42,77.11,187.96,Orthodox,1980-09-25,3.29,48.0,3.91,58.0,0.66,100.0,68.0,1.3
/fighter/Clay-Mitchell-188081,clay mitchell,,18/08/1983,37.0,,"Carlyle, Illinois",United States,"6'2""",185 lbs,,Middleweight,1.0,0.0,1.0,0.0,,1.0,1.0,1.0,0.0,,,1.0,2.0,0.0,187.96,83.91,,,,1.63,85.0,0.0,0.0,0.0,0.0,100.0,4.1
,clayton carpenter,,,,,,,,,,,,,,,,,,,,,,7.0,0.0,0.0,167.64,56.7,167.64,Orthodox,1996-06-09,4.5,51.0,2.85,60.0,2.47,50.0,0.0,2.5
/fighter/Clayton-MacFarlane-108593,clayton macfarlane,,,,,"Vista, California",United States,"5'11""",170 lbs,Team Xplode MMA,Welterweight,4.0,1.0,2.0,1.0,,4.0,1.0,0.0,0.0,,,4.0,1.0,0.0,,77.11,,,,1.33,52.0,1.82,55.0,1.05,33.0,37.0,0.0
/fighter/Cleber-Luciano-824,cleber luciano,,15/12/1973,47.0,,"Huntington Beach, California",United States,"5'6""",142 lbs,Cleber Jiu-Jitsu,Featherweight,16.0,1.0,11.0,4.0,,16.0,5.0,1.0,1.0,,,14.0,6.0,0.0,167.64,70.31,,,,0.0,0.0,0.0,0.0,0.0,0.0,0.0,0.0
/fighter/Cliff-Wright-40852,cliff wright,The Goblin,22/01/1979,42.0,,"Belle Plaine, Iowa",United States,"5'11""",170 lbs,Swing First MMA,Welterweight,12.0,1.0,11.0,0.0,,12.0,2.0,4.0,11.0,,,,,,,,,,,,,,,,,,
/fighter/Clifford-Starks-56902,clifford starks,Big Cat,25/04/1981,40.0,,"Tempe, Arizona",United States,"5'10""",185 lbs,Arizona Combat Sports,Middleweight,14.0,3.0,4.0,7.0,,14.0,1.0,2.0,2.0,,,13.0,3.0,0.0,182.88,83.91,198.12,Orthodox,1981-04-25,1.94,33.0,2.49,58.0,1.94,100.0,60.0,0.0
,clint coronel,,,,,,,,,,,,,,,,,,,,,,2.0,5.0,0.0,,70.31,,,,4.93,32.0,5.6,66.0,0.0,0.0,66.0,0.0
,clint godfrey,,,,,,,,,,,,,,,,,,,,,,13.0,3.0,0.0,167.64,61.23,,Southpaw,1982-10-21,0.57,31.0,0.96,65.0,0.85,25.0,50.0,0.0
/fighter/Clint-Hester-43866,clint hester,Headbussa,21/11/1986,34.0,,"Atlanta, Georgia",United States,"6'2""",205 lbs,X3 Sports,Light Heavyweight,11.0,7.0,1.0,3.0,,11.0,2.0,3.0,1.0,,Headbussa,11.0,6.0,0.0,187.96,92.99,195.58,Orthodox,1986-11-21,3.36,42.0,3.44,56.0,1.02,35.0,60.0,0.0
/fighter/Clint-Musser-71114,clint musser,,10/07/1975,46.0,,"Uniontown, Ohio",United States,"5'7""",155 lbs,Evolve MMA,Lightweight,2.0,0.0,1.0,1.0,,2.0,1.0,0.0,0.0,,,,,,,,,,,,,,,,,,
,cm punk,,,,,,,,,,,,,,,,,,,,,,0.0,1.0,0.0,185.42,77.11,185.42,Orthodox,1978-10-26,1.1,23.0,4.87,40.0,0.87,11.0,0.0,0.0
/fighter/Codale-Ford-54566,codale ford,Crunch Time,13/05/1979,42.0,,"Wagoner, Oklahoma",United States,"5'9""",169 lbs,,Welterweight,13.0,4.0,6.0,3.0,,13.0,3.0,3.0,6.0,,Crunch Time,11.0,9.0,0.0,175.26,77.11,,,,0.0,0.0,0.0,0.0,0.0,0.0,0.0,0.0
/fighter/Codie-Shuffield-59553,codie shuffield,,15/10/1988,32.0,,"Water Valley, Mississippi",United States,"5'9""",170 lbs,Ironman Combat,Welterweight,9.0,2.0,6.0,1.0,,9.0,1.0,2.0,0.0,,,,,,,,,,,,,,,,,,
/fighter/Cody-Bollinger-17387,cody bollinger,The Cali Cowboy,18/03/1991,30.0,,"Rancho Cucamonga, California",United States,"5'10""",155 lbs,Millennia MMA,Lightweight,19.0,5.0,8.0,5.0,1.0,19.0,2.0,4.0,1.0,0.0,,,,,,,,,,,,,,,,,
,cody brundage,,,,,,,,,,,,,,,,,,,,,,10.0,5.0,0.0,182.88,83.91,182.88,Orthodox,1994-05-16,1.8,55.0,2.51,43.0,2.69,52.0,73.0,1.1
,cody canterbury,,,,,,,,,,,,,,,,,,,,,,1.0,10.0,0.0,172.72,70.31,,,,0.0,0.0,0.0,0.0,0.0,0.0,0.0,0.0
/fighter/Cody-Carrillo-79050,cody carrillo,,15/04/1982,39.0,,"Wichita, Kansas",United States,"5'10""",155 lbs,Fox Fitness,Lightweight,14.0,6.0,6.0,2.0,,14.0,3.0,7.0,9.0,,,11.0,16.0,0.0,177.8,70.31,,,,0.0,0.0,0.0,0.0,0.0,0.0,0.0,0.0
/fighter/Cody-Donovan-22304,cody donovan,Donnybrook,20/02/1981,40.0,,"Denver, Colorado",United States,"6'3""",205 lbs,Grudge Training Center,Light Heavyweight,8.0,4.0,3.0,1.0,,8.0,5.0,0.0,0.0,,Donnybrook,8.0,5.0,0.0,190.5,92.99,187.96,Orthodox,1981-02-20,5.61,59.0,5.44,45.0,1.67,28.0,0.0,1.7
/fighter/Cody-Durden-222325,cody durden,,29/03/1991,30.0,,"Covington, Georgia",United States,"5'9""",125 lbs,American Top Team Atlanta,Flyweight,11.0,5.0,5.0,1.0,,11.0,0.0,2.0,1.0,,,16.0,4.0,1.0,170.18,56.7,170.18,Southpaw,1991-03-29,3.13,49.0,2.94,52.0,5.41,50.0,80.0,0.4
/fighter/Cody-East-33359,cody east,The Freight Train,29/06/1988,33.0,,"Los Lunas, New Mexico",United States,"6'3""",261 lbs,Jackson-Wink MMA,Heavyweight,13.0,8.0,3.0,2.0,,13.0,6.0,0.0,1.0,,The Freight Train,12.0,3.0,0.0,190.5,111.13,,Orthodox,1988-06-29,4.15,43.0,7.32,40.0,3.97,100.0,16.0,0.0
,cody floyd,,,,,,,,,,,,,,,,,,,,,,2.0,0.0,0.0,,,,,,0.0,0.0,0.0,0.0,0.0,0.0,0.0,0.0
/fighter/Cody-Garbrandt-50381,cody garbrandt,No Love,07/07/1991,30.0,,"Uhrichsville, Ohio",United States,"5'7""",135 lbs,Team Alpha Male,Bantamweight,12.0,10.0,0.0,2.0,,12.0,3.0,0.0,1.0,,No Love,13.0,5.0,0.0,172.72,61.23,165.1,Orthodox,1991-07-07,3.0,40.0,3.89,61.0,1.13,34.0,78.0,0.0
/fighter/Cody-Gibson-38903,cody gibson,The Renegade,11/09/1987,33.0,,"Visalia, California",United States,"5'10""",135 lbs,Elite Team,Bantamweight,17.0,7.0,3.0,7.0,,17.0,0.0,4.0,3.0,,The Renegade,20.0,9.0,0.0,177.8,61.23,180.34,Orthodox,1987-09-11,4.75,45.0,4.73,55.0,1.35,35.0,64.0,0.3
,cody haddon,,,,,,,,,,,,,,,,,,,,,,,,,,,,,,,,,,,,,
/fighter/Cody-Jones-232809,cody jones,,06/10/1992,28.0,,"Myrtle Beach, South Carolina",United States,"6'1""",170 lbs,,Welterweight,7.0,2.0,4.0,1.0,,7.0,0.0,2.0,1.0,,,,,,,,,,,,,,,,,,
/fighter/Cody-Law-293255,cody law,,24/03/1995,26.0,,"Windber, Pennsylvania",United States,"5'9""",145 lbs,,Featherweight,4.0,2.0,1.0,1.0,,4.0,0.0,0.0,0.0,,,,,,,,,,,,,,,,,,
/fighter/Cody-Matthews-237237,cody matthews,Mad Cat,12/06/1998,23.0,,"Lonaconing, Maryland",United States,"5'3""",135 lbs,Ryoma Academy,Bantamweight,1.0,0.0,0.0,1.0,,1.0,0.0,1.0,1.0,,,,,,,,,,,,,,,,,,
/fighter/Cody-McKenzie-22173,cody mckenzie,The AK Kid,16/12/1987,33.0,,"Cordova, Alaska",United States,"6'0""",170 lbs,Warrior Camp,Welterweight,16.0,1.0,14.0,1.0,0.0,16.0,4.0,4.0,2.0,1.0,,16.0,10.0,0.0,182.88,70.31,182.88,Switch,1987-12-16,1.74,34.0,2.5,67.0,2.5,25.0,14.0,2.5
/fighter/Cody-Miskell-231659,cody miskell,,,,,"Georgetown, Kentucky",United States,"5'10""",263 lbs,,Heavyweight,0.0,0.0,0.0,0.0,,0.0,1.0,0.0,0.0,,,,,,,,,,,,,,,,,,
/fighter/Cody-Pfister-48481,cody pfister,The Pfist,12/07/1990,31.0,,"Amarillo, Texas",United States,"5'10""",155 lbs,Nick's Fight Club,Lightweight,16.0,4.0,6.0,6.0,,16.0,0.0,4.0,4.0,,The Fist,13.0,6.0,1.0,177.8,70.31,185.42,Orthodox,1990-07-12,1.41,25.0,2.8,51.0,2.82,30.0,0.0,0.0
/fighter/Cody-Sons-139975,cody sons,God of Thunder,04/04/1994,27.0,,"Bakersfield, California",United States,"5'10""",238 lbs,Dawg House MMA,Heavyweight,5.0,3.0,2.0,0.0,,5.0,9.0,3.0,0.0,,,3.0,7.0,0.0,175.26,92.99,,,,0.0,0.0,0.0,0.0,0.0,0.0,0.0,0.0
/fighter/Cody-Stamann-61896,cody stamann,The Spartan,09/11/1989,31.0,,"Wayne, Michigan",United States,"5'7""",135 lbs,Michigan Top Team,Bantamweight,19.0,6.0,2.0,11.0,,19.0,0.0,1.0,3.0,,The Spartan,21.0,6.0,1.0,167.64,61.23,162.56,Orthodox,1989-11-09,4.39,47.0,3.63,62.0,2.34,39.0,76.0,0.0
/fighter/Cody-Stevens-18341,cody stevens,The Wolverine,19/08/1982,38.0,,"Mansfield, Ohio",United States,"5'6""",145 lbs,Tiger Muay Thai,Featherweight,14.0,2.0,6.0,6.0,,14.0,3.0,1.0,7.0,,,,,,,,,,,,,,,,,,
/fighter/Cody-Vidal-127929,cody vidal,,,,,New Jersey,United States,"5'10""",190 lbs,,Light Heavyweight,1.0,1.0,0.0,0.0,,1.0,2.0,0.0,0.0,,,,,,,,,,,,,,,,,,
/fighter/Cody-Walker-72118,cody walker,The Crow,15/01/1988,33.0,,"Plano, Texas",United States,"6'1""",150 lbs,Subfighter MMA,Lightweight,9.0,5.0,4.0,0.0,,9.0,2.0,2.0,3.0,,,,,,,,,,,,,,,,,,
/fighter/Colbey-Northcutt-115403,colbey northcutt,,29/03/1993,28.0,,"Katy, Texas",United States,"5'9""",135 lbs,Classic Fight Team,Bantamweight,2.0,0.0,1.0,1.0,,2.0,1.0,0.0,0.0,,,,,,,,,,,,,,,,,,
/fighter/Colby-Covington-57269,colby covington,Chaos,22/02/1988,33.0,,"Springfield, Oregon",United States,"5'11""",169 lbs,MMA Masters,Welterweight,16.0,4.0,4.0,8.0,,16.0,1.0,1.0,0.0,,Chaos,17.0,3.0,0.0,180.34,77.11,182.88,Orthodox,1988-02-22,4.1,39.0,3.05,55.0,4.05,45.0,72.0,0.2
/fighter/Colby-Fletcher-188969,colby fletcher,Dreamcatcher,31/01/1993,28.0,,"Muskogee, Oklahoma",United States,"5'6""",125 lbs,Fusion Boxing,Flyweight,1.0,0.0,1.0,0.0,,1.0,2.0,1.0,0.0,,,,,,,,,,,,,,,,,,
/fighter/Cole-Escovedo-2291,cole escovedo,Apache Kid,30/08/1981,39.0,,"Fresno, California",United States,"5'7""",135 lbs,Pacific Martial Arts,Bantamweight,17.0,7.0,9.0,1.0,,17.0,4.0,1.0,4.0,,Apache Kid,17.0,9.0,0.0,170.18,61.23,182.88,Orthodox,1981-08-30,1.77,43.0,4.32,49.0,0.43,33.0,13.0,0.0
/fighter/Cole-Konrad-59013,cole konrad,The Polar Bear,02/04/1984,37.0,,"Appleton, Wisconsin",United States,"6'5""",265 lbs,Team Death Clutch,Heavyweight,9.0,1.0,3.0,5.0,,9.0,0.0,0.0,0.0,,,,,,,,,,,,,,,,,,
/fighter/Cole-Miller-13133,cole miller,Magrinho,26/04/1984,37.0,,"Augusta, Georgia",United States,"6'1""",145 lbs,American Top Team,Featherweight,21.0,3.0,15.0,3.0,,21.0,2.0,0.0,9.0,,Magrinho,21.0,11.0,0.0,185.42,65.77,185.42,Orthodox,1984-04-26,3.0,33.0,3.88,59.0,0.6,36.0,38.0,1.8
,cole province,,,,,,,,,,,,,,,,,,,,,,6.0,2.0,0.0,175.26,65.77,172.72,Orthodox,1981-01-17,1.47,44.0,2.72,43.0,2.4,50.0,83.0,1.0
/fighter/Cole-Smith-153345,cole smith,The Cole Train,05/04/1989,32.0,,"Vancouver, British Columbia",Canada,"5'11""",135 lbs,Team Quest Thailand,Bantamweight,7.0,2.0,3.0,2.0,,7.0,0.0,0.0,2.0,,The Cole Train,7.0,2.0,0.0,180.34,61.23,170.18,Orthodox,1989-04-05,1.78,35.0,1.96,49.0,1.67,33.0,45.0,1.7
/fighter/Cole-Williams-37661,cole williams,,15/12/1983,37.0,,"Darien, Wisconsin",United States,"6'0""",170 lbs,Chosen Few Gym,Welterweight,11.0,4.0,4.0,3.0,,11.0,0.0,3.0,0.0,,Havoc,11.0,3.0,0.0,182.88,77.11,185.42,Orthodox,1983-12-15,0.31,27.0,5.34,23.0,0.0,0.0,25.0,0.0
/fighter/Colin-Fletcher-34621,colin fletcher,Freakshow,08/01/1983,38.0,,"Sunderland, Tyne and Wear",England,"6'2""",170 lbs,Unity Gym,Welterweight,16.0,1.0,11.0,4.0,0.0,16.0,1.0,4.0,4.0,1.0,The Freakshow,14.0,8.0,0.0,187.96,70.31,,Orthodox,1983-01-08,3.1,34.0,2.97,62.0,0.0,0.0,27.0,0.0
/fighter/Colin-Robinson-13660,colin robinson,Big C,27/11/1968,52.0,,Ballymena,Northern Ireland,"6'4""",243 lbs,,Heavyweight,10.0,6.0,3.0,1.0,,10.0,5.0,5.0,2.0,,Big C,10.0,12.0,0.0,193.04,110.22,,Orthodox,1968-11-27,6.19,69.0,7.91,37.0,2.58,100.0,50.0,5.2
/fighter/Colleen-Schneider-50014,colleen schneider,Super Collider,12/03/1982,39.0,,"Los Angeles, California",United States,"5'9""",132 lbs,CMMA,Bantamweight,11.0,4.0,3.0,4.0,,11.0,1.0,4.0,3.0,,,11.0,7.0,0.0,,61.23,,,,2.17,48.0,2.5,50.0,2.5,50.0,60.0,0.0
,colley  bradford,,,,,,,,,,,,,,,,,,,,,,0.0,1.0,0.0,170.18,65.77,,,,0.43,25.0,1.73,50.0,19.42,50.0,100.0,0.0
/fighter/Collin-Anglin-280415,collin anglin,,20/02/1993,28.0,,"South Lyon, Michigan",United States,"5'9""",145 lbs,Scorpion Fighting System,Featherweight,8.0,5.0,0.0,3.0,,8.0,1.0,0.0,1.0,,,8.0,3.0,0.0,175.26,65.77,180.34,Orthodox,1993-02-20,4.59,48.0,5.54,51.0,2.28,66.0,100.0,0.0
/fighter/Collin-Hart-47991,collin hart,,12/10/1989,31.0,,"Santa Rosa, California",United States,"6'2""",185 lbs,Nor-Cal Fighting Alliance,Middleweight,6.0,1.0,4.0,1.0,,6.0,0.0,0.0,4.0,,,6.0,3.0,1.0,185.42,83.91,,Orthodox,1989-10-12,6.33,44.0,7.53,51.0,2.0,16.0,50.0,0.0
,collin huckbody,,,,,,,,,,,,,,,,,,,,,All In,8.0,2.0,0.0,190.5,83.91,193.04,Orthodox,1994-09-29,2.05,60.0,2.73,42.0,10.23,100.0,0.0,20.4
/fighter/Collin-Tebo-48178,collin tebo,,,,,"Boston, Massachusetts",United States,"0'0""",135 lbs,Wai Kru MMA,Bantamweight,1.0,1.0,0.0,0.0,,1.0,1.0,0.0,0.0,,,,,,,,,,,,,,,,,,
,coltin cole,,,,,,,,,,,,,,,,,,,,,,4.0,5.0,0.0,,83.91,,,,0.0,0.0,0.0,0.0,0.0,0.0,0.0,0.0
/fighter/Colton-Smith-63163,colton smith,,14/08/1987,33.0,,"Manassas, Virginia",United States,"6'0""",170 lbs,Vanguard,Welterweight,7.0,2.0,1.0,4.0,,7.0,2.0,2.0,1.0,,,7.0,4.0,0.0,182.88,70.31,180.34,Orthodox,1987-08-14,1.64,41.0,2.3,51.0,4.09,36.0,25.0,1.4
/fighter/Connor-Dixon-306117,connor dixon,The Caveman,01/04/1996,25.0,,"Millville, New Jersey",United States,"6'1""",179 lbs,Renzo Gracie Philly,Middleweight,2.0,0.0,2.0,0.0,,2.0,1.0,0.0,0.0,,,,,,,,,,,,,,,,,,
,connor matthews,,,,,,,,,,,,,,,,,,,,,The Controller,7.0,1.0,0.0,172.72,65.77,180.34,Switch,1992-05-31,5.13,44.0,5.57,55.0,3.5,58.0,50.0,1.0
,conor heun,,,,,,,,,,,,,,,,,,,,,Hurricane,9.0,5.0,0.0,177.8,70.31,,Orthodox,1979-02-11,2.92,36.0,3.66,54.0,2.45,31.0,33.0,0.3
/fighter/Conor-McGregor-29688,conor mcgregor,Notorious,14/07/1988,33.0,,Dublin,Ireland,"5'8""",155 lbs,SBG Ireland,Lightweight,22.0,19.0,1.0,2.0,,22.0,2.0,4.0,0.0,,The Notorious,22.0,6.0,0.0,175.26,70.31,187.96,Southpaw,1988-07-14,5.32,49.0,4.66,54.0,0.67,55.0,66.0,0.1
/fighter/Constantin-Blanita-248669,constantin blanita,,,,,,Ireland,"5'8""",145 lbs,Team Ryano MMA,Featherweight,1.0,0.0,0.0,1.0,,1.0,0.0,0.0,0.0,,,,,,,,,,,,,,,,,,
/fighter/Constantin-Gnusarev-267835,constantin gnusarev,,24/11/1995,25.0,,Chisinau,Moldova,"5'9""",154 lbs,SBG Ireland,Lightweight,4.0,1.0,0.0,3.0,,4.0,0.0,0.0,0.0,,,,,,,,,,,,,,,,,,
,constantinos philippou,,,,,,,,,,,,,,,,,,,,,,13.0,5.0,0.0,180.34,83.91,185.42,Orthodox,1979-11-29,2.19,35.0,2.73,54.0,0.4,42.0,65.0,0.3
/fighter/Cooper-Gibson-63409,cooper gibson,,07/02/1990,31.0,,California,United States,"5'10""",150 lbs,A4 Fitness,Lightweight,10.0,2.0,5.0,3.0,,10.0,0.0,1.0,1.0,,,,,,,,,,,,,,,,,,
/fighter/Corey-Anderson-171723,corey anderson,Overtime,22/09/1989,31.0,,"Rockton, Illinois",United States,"6'3""",205 lbs,The Kennel Fight Club,Light Heavyweight,15.0,7.0,0.0,8.0,,15.0,4.0,0.0,1.0,,Overtime,14.0,5.0,0.0,190.5,92.99,200.66,Orthodox,1989-09-22,4.43,46.0,2.22,59.0,4.89,50.0,83.0,0.0
/fighter/Corey-Browning-187147,corey browning,,,,,Tennessee,United States,"5'11""",155 lbs,,Lightweight,4.0,1.0,3.0,0.0,,4.0,0.0,3.0,0.0,,,,,,,,,,,,,,,,,,
/fighter/Corey-Davis-136227,corey davis,,03/12/1991,29.0,,"Omaha, Nebraska",United States,"6'0""",170 lbs,Premier Combat Center,Welterweight,6.0,3.0,3.0,0.0,,6.0,1.0,1.0,1.0,,,,,,,,,,,,,,,,,,
/fighter/Corey-Hill-23864,corey hill,The Real Deal,03/10/1978,,15/05/2015,"Brookfield, Florida",United States,"6'4""",168 lbs,KO Evolution,Welterweight,6.0,2.0,3.0,1.0,,6.0,3.0,3.0,3.0,,,6.0,9.0,0.0,193.04,70.31,203.2,Orthodox,1978-10-03,3.57,46.0,1.61,70.0,3.02,80.0,100.0,0.0
/fighter/Corey-Jackson-275145,corey jackson,Maximus,,,,"Michigan City, Indiana",United States,"5'8""",145 lbs,Team Colon MMA,Featherweight,4.0,0.0,0.0,4.0,,4.0,0.0,0.0,1.0,,,,,,,,,,,,,,,,,,
/fighter/Corey-Samuels-159745,corey samuels,Lightning Wolf,04/03/1993,28.0,,"Fort Lauderdale, Florida",United States,"5'11""",155 lbs,,Lightweight,3.0,1.0,1.0,0.0,1.0,3.0,1.0,1.0,0.0,0.0,,,,,,,,,,,,,,,,,
/fighter/Corina-Herrera-24202,corina herrera,Taz,15/04/1989,32.0,,"Porterville, California",United States,"5'2""",125 lbs,Fearless Fighters,Flyweight,4.0,1.0,2.0,1.0,,4.0,0.0,0.0,5.0,,,,,,,,,,,,,,,,,,
,corinne laframboise,,,,,,,,,,,,,,,,,,,,,,8.0,4.0,0.0,,56.7,,,,0.0,0.0,0.0,0.0,0.0,0.0,0.0,0.0
/fighter/Cornelius-Savage-340677,cornelius savage,,,,,"Vallejo, California",United States,"6'2""",185 lbs,Crispim BJJ,Middleweight,1.0,0.0,0.0,1.0,,1.0,0.0,0.0,0.0,,,,,,,,,,,,,,,,,,
/fighter/Cort-Wahle-206847,cort wahle,,13/01/1995,26.0,,"Godfrey, Illinois",United States,"5'9""",145 lbs,Cahokia MMA,Featherweight,4.0,1.0,2.0,1.0,,4.0,2.0,3.0,0.0,,,,,,,,,,,,,,,,,,
,cortavious romious,,,,,,,,,,,,,,,,,,,,,Are You Not Entertained?,7.0,2.0,0.0,162.56,61.23,172.72,Southpaw,1994-01-06,14.48,31.0,20.69,41.0,0.0,0.0,0.0,0.0
/fighter/Cortez-Coleman-48423,cortez coleman,The Crazy Cowboy,28/01/1982,39.0,,"Hugo, Oklahoma",United States,"6'0""",185 lbs,Finney's HIT Squad,Middleweight,13.0,4.0,4.0,5.0,,13.0,0.0,3.0,6.0,,Hollywood,13.0,8.0,0.0,185.42,83.91,,,,0.0,0.0,0.0,0.0,0.0,0.0,0.0,0.0
/fighter/Cortez-Phelia-79590,cortez phelia,The Tazmanian Devil,01/11/1989,31.0,,"Cincinnati, Ohio",United States,"5'5""",135 lbs,,Bantamweight,1.0,0.0,1.0,0.0,,1.0,1.0,1.0,0.0,,,,,,,,,,,,,,,,,,
/fighter/Cortney-Casey-91121,cortney casey,Cast Iron,05/05/1987,34.0,,"Phoenix, Arizona",United States,"5'6""",125 lbs,MMA Lab,Flyweight,9.0,3.0,4.0,2.0,,9.0,0.0,2.0,7.0,,Cast Iron,10.0,10.0,0.0,170.18,56.7,170.18,Orthodox,1987-05-05,4.29,39.0,4.0,55.0,0.39,31.0,39.0,0.5
,cory devela,,,,,,,,,,,,,,,,,,,,,The One,16.0,7.0,0.0,152.4,83.91,,Orthodox,,4.07,41.0,4.0,47.0,1.07,12.0,62.0,0.0
/fighter/Cory-Galloway-93383,cory galloway,The People's Champ,,,,"Crystal Lake, Illinois",United States,"5'8""",135 lbs,Team Curran,Bantamweight,11.0,4.0,4.0,3.0,,11.0,2.0,3.0,5.0,,,,,,,,,,,,,,,,,,
/fighter/Cory-Hendricks-87323,cory hendricks,,10/05/1988,33.0,,"Las Vegas, Nevada",United States,"6'0""",205 lbs,Syndicate MMA,Light Heavyweight,8.0,2.0,5.0,1.0,,8.0,1.0,0.0,2.0,,,3.0,1.0,0.0,190.5,92.99,,Switch,1988-05-10,3.13,39.0,4.07,42.0,0.0,0.0,100.0,0.0
/fighter/Cory-McKenna-178347,cory mckenna,The Hobbit / Poppins,11/07/1999,22.0,,"Colchester, Essex",England,"5'3""",115 lbs,Team Alpha Male,Strawweight,6.0,2.0,1.0,3.0,,6.0,0.0,0.0,1.0,,Poppins,8.0,2.0,0.0,160.02,52.16,147.32,Orthodox,1999-07-11,3.01,40.0,3.22,48.0,2.04,56.0,71.0,0.5
,cory peterson,,,,,,,,,,,,,,,,,,,,,LA Giant,2.0,1.0,0.0,210.82,181.44,,Orthodox,,2.17,60.0,6.51,40.0,0.0,0.0,0.0,0.0
/fighter/Cory-Sandhagen-112869,cory sandhagen,Sandman,20/04/1992,29.0,,"Aurora, Colorado",United States,"5'11""",135 lbs,Elevation Fight Team,Bantamweight,14.0,6.0,3.0,5.0,,14.0,0.0,1.0,2.0,,,17.0,4.0,0.0,180.34,61.23,177.8,Switch,1992-04-20,5.33,44.0,3.4,58.0,1.36,33.0,64.0,0.3
/fighter/Cory-Tait-58466,cory tait,Capcom,,,,"Harrow, Greater London",England,"5'7""",135 lbs,Gintas Combat,Bantamweight,10.0,5.0,5.0,0.0,,10.0,1.0,1.0,4.0,,,,,,,,,,,,,,,,,,
/fighter/Cory-Walmsley-5170,cory walmsley,,,,,"St. Paul, Minnesota",United States,"6'0""",205 lbs,Team Bison,Light Heavyweight,8.0,2.0,5.0,1.0,,8.0,0.0,1.0,1.0,,Hardcore,8.0,2.0,0.0,182.88,92.99,,Orthodox,,0.79,100.0,1.18,50.0,0.0,0.0,0.0,0.0
/fighter/Cosmo-Alexandre-84698,cosmo alexandre,Good Boy,24/04/1982,39.0,,"Santos, Sao Paulo",Brazil,"6'2""",155 lbs,Blackzilians,Lightweight,8.0,6.0,0.0,2.0,,8.0,0.0,0.0,1.0,,,,,,,,,,,,,,,,,,
/fighter/Costas-Philippou-32432,costas philippou,,29/11/1979,41.0,,"Merrick, New York",United States,"5'11""",185 lbs,Bellmore Kickboxing Academy,Middleweight,13.0,7.0,1.0,5.0,,13.0,1.0,0.0,4.0,,,,,,,,,,,,,,,,,,
/fighter/Costello-van-Steenis-152859,costello van steenis,The Spaniard,26/07/1992,29.0,,,Netherlands,"6'1""",185 lbs,MMA Vlaardingen,Middleweight,13.0,4.0,5.0,3.0,1.0,13.0,0.0,0.0,2.0,0.0,,,,,,,,,,,,,,,,,
,coty wheeler,,,,,,,,,,,,,,,,,,,,,Ox,14.0,5.0,0.0,167.64,61.23,170.18,Orthodox,1978-10-11,1.88,22.0,3.16,59.0,0.87,37.0,33.0,2.6
/fighter/Court-McGee-34124,court mcgee,The Crusher,12/12/1984,36.0,,"Layton, Utah",United States,"5'11""",170 lbs,Factory X,Welterweight,20.0,5.0,5.0,10.0,,20.0,1.0,0.0,9.0,,The Crusher,22.0,12.0,0.0,180.34,77.11,190.5,Orthodox,1984-12-12,4.63,37.0,3.68,60.0,1.89,25.0,69.0,0.4
,courtney buck,,,,,,,,,,,,,,,,,,,,,,12.0,11.0,0.0,177.8,61.23,,Orthodox,1982-03-19,1.49,28.0,3.24,54.0,0.0,0.0,33.0,0.0
/fighter/Courtney-Martin-300321,courtney martin,No Mercy,13/01/1993,28.0,,,Australia,"5'5""",125 lbs,Wolves Den Perth,Flyweight,0.0,0.0,0.0,0.0,,0.0,0.0,1.0,0.0,,,,,,,,,,,,,,,,,,
/fighter/Courtney-Turner-285,courtney turner,,,,,"Metairie, Louisiana",United States,"6'2""",170 lbs,,Welterweight,0.0,0.0,0.0,0.0,,0.0,2.0,1.0,0.0,,,0.0,3.0,0.0,187.96,77.11,,,,0.0,0.0,0.0,0.0,0.0,0.0,0.0,0.0
/fighter/Crafton-Wallace-8269,crafton wallace,,15/04/1972,49.0,,"Naples, Florida",United States,"6'0""",184 lbs,Inferno MMA,Middleweight,18.0,8.0,9.0,1.0,,18.0,2.0,3.0,1.0,,Blaze,18.0,6.0,1.0,182.88,83.91,,Orthodox,1975-11-10,1.55,44.0,2.36,47.0,0.0,0.0,42.0,0.0
/fighter/Craig-Campbell-129695,craig campbell,,29/04/1985,36.0,,Texas,United States,"0'0""",154 lbs,,Lightweight,2.0,0.0,2.0,0.0,,2.0,2.0,0.0,1.0,,,,,,,,,,,,,,,,,,
/fighter/Craig-Fairley-213671,craig fairley,Showtime,25/03/1992,29.0,,"Lincoln, Nebraska",United States,"0'0""",155 lbs,Laselva MMA,Lightweight,3.0,0.0,3.0,0.0,,3.0,4.0,1.0,0.0,,,,,,,,,,,,,,,,,,
/fighter/Craig-Hudson-75425,craig hudson,Wardog,10/04/1974,47.0,,"Brantford, Ontario",Canada,"6'2""",251 lbs,Tapout Burlington,Heavyweight,5.0,5.0,0.0,0.0,,5.0,4.0,3.0,0.0,,,,,,,,,,,,,,,,,,
,craig jones,,,,,,,,,,,,,,,,,,,,,,0.0,0.0,0.0,,92.99,,,,0.0,0.0,0.0,0.0,0.0,0.0,0.0,0.0
,craig oxley,,,,,,,,,,,,,,,,,,,,,,0.0,3.0,0.0,175.26,70.31,,,,0.0,0.0,0.0,0.0,0.0,0.0,0.0,0.0
/fighter/Craig-Plaskett-167415,craig plaskett,Grasshopper,21/02/1990,31.0,,"Los Angeles, California",United States,"5'11""",170 lbs,Team Hayastan,Welterweight,4.0,2.0,0.0,2.0,0.0,4.0,0.0,1.0,1.0,1.0,,,,,,,,,,,,,,,,,
/fighter/Craig-Turner-77432,craig turner,,,,,,England,"0'0""",170 lbs,Team Rough House,Welterweight,6.0,4.0,0.0,2.0,,6.0,0.0,0.0,1.0,,,,,,,,,,,,,,,,,,
/fighter/Craig-White-47948,craig white,The Thundercat,01/07/1990,31.0,,"Exmouth, Devon",England,"6'2""",170 lbs,Team Lionheart,Welterweight,14.0,5.0,9.0,0.0,,14.0,3.0,6.0,3.0,,The Thundercat,14.0,9.0,0.0,187.96,77.11,193.04,Orthodox,1990-07-01,1.23,40.0,3.28,39.0,0.0,0.0,50.0,0.8
,craig zellner,,,,,,,,,,,,,,,,,,,,,Big Z,4.0,3.0,0.0,187.96,92.99,,Orthodox,1976-09-09,0.61,9.0,4.65,61.0,0.0,0.0,0.0,0.0
,crezio de souza,,,,,,,,,,,,,,,,,,,,,,1.0,2.0,0.0,,77.11,,Orthodox,,0.0,0.0,0.0,0.0,0.0,0.0,0.0,0.0
,cris cyborg,,,,,,,,,,,,,,,,,,,,,,,,,,,,,,,,,,,,,
/fighter/Cris-Lencioni-213799,cris lencioni,Sunshine,28/07/1994,27.0,,"Portland, Oregon",United States,"5'10""",145 lbs,Gracie Barra Portland,Featherweight,7.0,0.0,4.0,3.0,,7.0,0.0,0.0,2.0,,,,,,,,,,,,,,,,,,
/fighter/Cris-Leyva-22874,cris leyva,The Lightning,,,,"Farmington, New Mexico",United States,"5'10""",170 lbs,Team Four Corners,Welterweight,9.0,6.0,1.0,2.0,,9.0,5.0,3.0,1.0,,,,,,,,,,,,,,,,,,
,cristian quinonez,,,,,,,,,,,,,,,,,,,,,Problema,18.0,4.0,0.0,172.72,61.23,177.8,Orthodox,1996-04-26,5.23,42.0,5.13,59.0,0.73,100.0,85.0,0.0
/fighter/Cristiane-Justino-14477,cristiane justino,Cris Cyborg,09/07/1985,36.0,,"Curitiba, Parana",Brazil,"5'8""",145 lbs,Chute Boxe,Featherweight,24.0,19.0,1.0,4.0,,24.0,1.0,1.0,0.0,,Cyborg,21.0,2.0,0.0,172.72,65.77,172.72,Orthodox,1985-07-09,7.28,52.0,2.25,64.0,0.66,55.0,94.0,0.4
/fighter/Cristiano-Kaminishi-11531,cristiano kaminishi,,14/07/1979,42.0,,,Brazil,"6'2""",205 lbs,Immortal Fight Team,Light Heavyweight,8.0,4.0,2.0,2.0,,8.0,1.0,0.0,2.0,,,,,,,,,,,,,,,,,,
/fighter/Cristiano-Marcello-3530,cristiano marcello,,03/12/1977,43.0,,"Curitiba, Parana",Brazil,"5'10""",155 lbs,CM System,Lightweight,13.0,2.0,9.0,2.0,,13.0,3.0,0.0,3.0,,,13.0,6.0,0.0,175.26,70.31,182.88,Orthodox,1977-12-03,2.56,33.0,3.61,58.0,0.44,11.0,20.0,0.9
/fighter/Cristiano-Souza-54489,cristiano souza,Soldier Boy,02/08/1982,39.0,,"Boca Raton, Florida",United States,"5'10""",170 lbs,American Top Team,Welterweight,7.0,3.0,3.0,1.0,,7.0,1.0,1.0,0.0,,,,,,,,,,,,,,,,,,
/fighter/Cristina-Stanciu-179481,cristina stanciu,Barbie,29/03/1994,27.0,,Bucharest,Romania,"5'5""",115 lbs,Planet Eater,Strawweight,5.0,1.0,3.0,1.0,,5.0,1.0,1.0,1.0,,Barbie,5.0,2.0,0.0,160.02,52.16,,Orthodox,1994-03-29,2.5,50.0,3.07,52.0,0.85,100.0,40.0,1.7
,crosley gracie,,,,,,,,,,,,,,,,,,,,,,2.0,2.0,0.0,175.26,86.18,,Orthodox,1979-07-18,1.69,37.0,1.54,60.0,3.46,85.0,50.0,0.6
/fighter/Cub-Swanson-11002,cub swanson,Killer,02/11/1983,37.0,,"Palm Springs, California",United States,"5'8""",145 lbs,UFC Gym Costa Mesa,Featherweight,27.0,12.0,4.0,11.0,,27.0,2.0,7.0,3.0,,,29.0,13.0,0.0,172.72,65.77,177.8,Orthodox,1983-11-02,4.7,50.0,3.84,59.0,1.09,52.0,61.0,0.4
/fighter/Cung-Le-14883,cung le,,25/05/1972,49.0,,"San Jose, California",United States,"5'10""",185 lbs,Cung Le's Universal Strength Headquarters,Middleweight,9.0,8.0,0.0,1.0,,9.0,3.0,0.0,0.0,,,9.0,3.0,0.0,175.26,83.91,177.8,Southpaw,1972-05-25,4.36,48.0,2.98,66.0,1.37,71.0,88.0,0.3
/fighter/Curt-Warburton-34623,curt warburton,The War,,,,"Bishop Auckland, County Durham",England,"6'0""",155 lbs,NEVT,Lightweight,14.0,5.0,4.0,5.0,,14.0,1.0,3.0,2.0,,,13.0,6.0,0.0,182.88,70.31,185.42,Orthodox,,2.13,42.0,3.44,43.0,2.35,50.0,83.0,0.9
/fighter/Curtis-Blaydes-172939,curtis blaydes,Razor,18/02/1991,30.0,,"Naperville, Illinois",United States,"6'4""",259 lbs,Elevation Fight Team,Heavyweight,14.0,10.0,0.0,4.0,,14.0,3.0,0.0,0.0,,Razor,17.0,4.0,0.0,193.04,120.2,203.2,Orthodox,1991-02-18,3.56,49.0,1.89,59.0,5.93,53.0,33.0,0.0
/fighter/Curtis-Dodge-205935,curtis dodge,,02/12/1992,28.0,,"Swansea, West Glamorgan",Wales,"5'9""",170 lbs,Chris Rees Academy,Welterweight,0.0,0.0,0.0,0.0,,0.0,1.0,0.0,0.0,,,,,,,,,,,,,,,,,,
/fighter/Curtis-Millender-127439,curtis millender,Curtious,01/12/1987,33.0,,"San Bernardino, California",United States,"6'3""",170 lbs,CSW,Welterweight,18.0,6.0,0.0,12.0,,18.0,0.0,5.0,3.0,,Curtious,17.0,5.0,0.0,187.96,77.11,193.04,Orthodox,1987-12-01,3.86,46.0,2.95,61.0,0.43,100.0,57.0,0.0
/fighter/Curtis-Stout-279,curtis stout,,07/11/1973,47.0,,"Kansas City, Kansas",United States,"6'1""",185 lbs,,Middleweight,11.0,9.0,1.0,1.0,,11.0,4.0,4.0,4.0,,,11.0,12.0,1.0,185.42,83.91,,Southpaw,1973-11-07,0.69,67.0,3.2,29.0,0.0,0.0,20.0,0.0
,cyborg abreu,,,,,,,,,,,,,,,,,,,,,,0.0,0.0,0.0,,,,,,0.0,0.0,0.0,0.0,0.0,0.0,0.0,0.0
/fighter/Cynthia-Calvillo-93095,cynthia calvillo,,13/07/1987,34.0,,"San Jose, California",United States,"5'4""",125 lbs,Tiger Muay Thai,Flyweight,9.0,2.0,3.0,4.0,,9.0,0.0,0.0,2.0,,,9.0,6.0,1.0,162.56,52.16,162.56,Orthodox,1987-07-13,4.41,38.0,4.12,64.0,1.8,44.0,77.0,0.8
/fighter/Cyril-Asker-94411,cyril asker,Silverback,24/12/1985,35.0,,"Avignon, Vaucluse",France,"6'0""",244 lbs,Bushido Academie,Heavyweight,9.0,4.0,3.0,2.0,,9.0,3.0,1.0,0.0,,Silverback,9.0,4.0,0.0,182.88,112.04,187.96,Orthodox,1985-12-24,3.35,39.0,5.82,35.0,4.41,62.0,100.0,0.9
/fighter/Cyrille-Diabate-2191,cyrille diabate,Snake,10/06/1973,48.0,,"Le Celle St. Clous, Haut de Seine",France,"6'6""",205 lbs,Snake Team,Light Heavyweight,19.0,8.0,6.0,5.0,,19.0,2.0,5.0,3.0,,The Snake,19.0,10.0,1.0,198.12,92.99,205.74,Southpaw,1973-10-06,4.06,71.0,1.78,60.0,1.17,83.0,53.0,0.2
,cyrillo padilha,,,,,,,,,,,,,,,,,,,,,,3.0,3.0,0.0,180.34,70.31,,,,0.0,0.0,0.0,0.0,0.0,0.0,0.0,0.0
/fighter/DJ-Linderman-30279,d.j. linderman,Da Protege,01/09/1983,37.0,,"Yreka, California",United States,"6'1""",249 lbs,Dosomthin Athletics,Heavyweight,22.0,6.0,7.0,9.0,,22.0,8.0,1.0,9.0,,,,,,,,,,,,,,,,,,
/fighter/Da-Eun-Jung-185031,da eun jung,,,,,,South Korea,"5'7""",135 lbs,Team Poma,Bantamweight,8.0,3.0,0.0,5.0,,8.0,2.0,1.0,2.0,,,,,,,,,,,,,,,,,,
/fighter/Da-Peng-Hao-319993,da peng hao,,,,,,China,"0'0""",145 lbs,,Featherweight,1.0,1.0,0.0,0.0,,1.0,0.0,0.0,0.0,,,,,,,,,,,,,,,,,,
/fighter/Da-Un-Jung-202241,da un jung,Sseda,07/12/1993,27.0,,Daegu,South Korea,"6'3""",205 lbs,Korean Top Team,Light Heavyweight,14.0,10.0,2.0,2.0,,14.0,0.0,1.0,1.0,,,,,,,,,,,,,,,,,,
,da woon jung,,,,,,,,,,,,,,,,,,,,,Sseda,15.0,5.0,1.0,193.04,92.99,198.12,Orthodox,1993-12-07,3.49,43.0,3.89,51.0,1.9,50.0,77.0,0.2
/fighter/DaMon-Blackshear-243891,da'mon blackshear,The Diamond,12/08/1994,26.0,,"Fayetteville, North Carolina",United States,"5'10""",145 lbs,Team ROC,Featherweight,9.0,1.0,6.0,2.0,,9.0,0.0,0.0,4.0,,The Monster,14.0,6.0,1.0,177.8,61.23,182.88,Switch,1994-08-12,4.28,47.0,4.09,48.0,2.34,37.0,66.0,0.8
,da-un jung,,,,,,,,,,,,,,,,,,,,,,,,,,,,,,,,,,,,,
/fighter/Dae-Hwan-Kim-45071,dae hwan kim,Ottogi,31/01/1987,34.0,,Seoul,South Korea,"5'6""",135 lbs,Kukje Gym,Bantamweight,15.0,4.0,6.0,5.0,0.0,15.0,0.0,1.0,5.0,1.0,,,,,,,,,,,,,,,,,
/fighter/Dae-Song-Park-127427,dae song park,Crazy Dog / DSP,09/06/1993,28.0,,"Seoul, Seoul Capital Area",South Korea,"5'8""",154 lbs,Team Posse,Lightweight,11.0,3.0,0.0,8.0,,11.0,1.0,1.0,0.0,,,,,,,,,,,,,,,,,,
,dae won kim,,,,,,,,,,,,,,,,,,,,,,11.0,7.0,0.0,180.34,81.65,,Orthodox,,1.75,32.0,2.51,36.0,3.43,42.0,0.0,0.0
,daermisi zhawupasi,,,,,,,,,,,,,,,,,,,,,,7.0,1.0,0.0,172.72,61.23,172.72,Switch,2000-03-13,1.24,51.0,2.75,34.0,6.19,75.0,64.0,2.1
/fighter/Daichi-Abe-191861,daichi abe,,27/11/1991,29.0,,Niigata,Japan,"5'11""",170 lbs,HMC Japan,Welterweight,9.0,6.0,0.0,3.0,,9.0,1.0,1.0,2.0,,,6.0,2.0,0.0,180.34,77.11,180.34,Orthodox,1991-11-27,3.8,33.0,4.49,56.0,0.33,50.0,0.0,0.0
/fighter/Daichi-Kitakata-58645,daichi kitakata,,30/03/1991,30.0,,"Kawachinagano, Osaka",Japan,"5'5""",115 lbs,Pancrase Inagakigumi,Strawweight,20.0,5.0,4.0,11.0,,20.0,2.0,1.0,7.0,,,,,,,,,,,,,,,,,,
/fighter/Daichi-Takenaka-103287,daichi takenaka,,29/01/1990,31.0,,Osaka,Japan,"5'5""",132 lbs,Paraestra Izumi,Bantamweight,13.0,3.0,5.0,4.0,1.0,13.0,1.0,0.0,1.0,0.0,,,,,,,,,,,,,,,,,
,daijiro matsui,,,,,,,,,,,,,,,,,,,,,,13.0,29.0,7.0,175.26,90.72,,Orthodox,1972-12-05,0.84,45.0,1.69,55.0,1.83,30.0,43.0,0.4
/fighter/Daiju-Takase-226,daiju takase,,20/04/1978,43.0,,Tokyo,Japan,"6'0""",183 lbs,IamI,Middleweight,12.0,2.0,4.0,6.0,0.0,12.0,7.0,1.0,6.0,1.0,,12.0,15.0,2.0,182.88,77.11,,Southpaw,1978-04-20,0.49,30.0,1.64,47.0,0.84,17.0,21.0,1.2
,daiki hata,,,,,,,,,,,,,,,,,,,,,DJ Taiki,17.0,11.0,7.0,167.64,63.05,,Orthodox,1982-08-24,1.44,39.0,1.42,55.0,0.67,100.0,35.0,0.7
,daisuke nakamura,,,,,,,,,,,,,,,,,,,,,,28.0,19.0,1.0,170.18,69.85,,Orthodox,1980-06-10,0.94,30.0,1.38,61.0,0.46,40.0,30.0,3.6
,daisuke sugie,,,,,,,,,,,,,,,,,,,,,Amazon,10.0,8.0,1.0,167.64,72.57,,Orthodox,,0.0,0.0,0.22,80.0,3.27,50.0,0.0,3.3
/fighter/Dakota-Bush-203711,dakota bush,Hairy,09/06/1994,27.0,,"St. Clair, Missouri",United States,"5'10""",155 lbs,The Smith Pit,Lightweight,8.0,2.0,4.0,2.0,,8.0,0.0,0.0,3.0,,,8.0,4.0,0.0,177.8,70.31,185.42,Orthodox,1994-06-09,2.77,38.0,4.42,41.0,2.4,33.0,0.0,0.0
/fighter/Dakota-Cochrane-48554,dakota cochrane,,01/05/1986,35.0,,"Omaha, Nebraska",United States,"5'8""",170 lbs,Premier Combat Center,Welterweight,33.0,7.0,16.0,10.0,0.0,33.0,2.0,8.0,2.0,1.0,,29.0,12.0,0.0,172.72,70.31,,,,2.66,75.0,2.66,30.0,4.43,33.0,0.0,0.0
/fighter/Dakota-Zimmerman-225381,dakota zimmerman,,21/02/1996,25.0,,"Arnold, Missouri",United States,"5'4""",115 lbs,,Strawweight,1.0,0.0,1.0,0.0,,1.0,0.0,0.0,1.0,,,,,,,,,,,,,,,,,,
/fighter/Dalcha-Lungiambula-167487,dalcha lungiambula,Champion,31/07/1985,36.0,,"Cape Town, Western Cape",South Africa,"5'10""",185 lbs,Dragon Power,Middleweight,11.0,5.0,1.0,5.0,,11.0,1.0,1.0,0.0,,Champion,11.0,6.0,0.0,172.72,83.91,193.04,Orthodox,1987-07-31,3.07,45.0,3.93,52.0,2.14,45.0,77.0,0.0
/fighter/Dale-Hartt-11970,dale hartt,,,,,"Bangor, Maine",United States,"5'10""",155 lbs,Team Sityodtong,Lightweight,6.0,4.0,2.0,0.0,,6.0,1.0,2.0,0.0,,,6.0,3.0,0.0,177.8,70.31,175.26,Orthodox,1979-04-04,1.14,35.0,1.55,66.0,1.22,100.0,25.0,2.5
/fighter/Dale-Mitchell-36541,dale mitchell,The Alpha Male,16/04/1983,38.0,,"Cypress, Texas",United States,"6'1""",265 lbs,Silverback Fight Club,Heavyweight,6.0,6.0,0.0,0.0,,6.0,5.0,0.0,2.0,,,,,,,,,,,,,,,,,,
/fighter/Dalton-Rosta-277187,dalton rosta,Hercules,09/11/1995,25.0,,"New Castle, Pennsylvania",United States,"6'0""",205 lbs,The Mat Factory,Light Heavyweight,5.0,3.0,0.0,2.0,,5.0,0.0,0.0,0.0,,,,,,,,,,,,,,,,,,
/fighter/Damacio-Page-12158,damacio page,The Angel of Death,30/09/1982,38.0,,"Albuquerque, New Mexico",United States,"5'6""",125 lbs,Jackson-Wink MMA,Flyweight,20.0,11.0,8.0,1.0,,20.0,0.0,8.0,2.0,,The Angel of Death,19.0,10.0,0.0,167.64,61.23,167.64,Orthodox,1982-09-30,2.05,38.0,2.47,51.0,2.63,64.0,23.0,0.9
/fighter/DaMarques-Johnson-12913,damarques johnson,Darkness,28/06/1982,39.0,,"Salt Lake City, Utah",United States,"6'0""",170 lbs,Elite Performance,Welterweight,15.0,7.0,6.0,2.0,,15.0,5.0,8.0,2.0,,Darkness,15.0,15.0,0.0,185.42,77.11,190.5,Orthodox,1982-06-28,2.11,37.0,3.75,51.0,1.18,55.0,19.0,0.7
/fighter/Damian-Frankiewicz-187989,damian frankiewicz,,15/08/1992,28.0,,Sosnowiec,Poland,"5'9""",145 lbs,Sutemi Fight Academy,Featherweight,9.0,1.0,6.0,2.0,,9.0,0.0,3.0,1.0,,,,,,,,,,,,,,,,,,
/fighter/Damian-Grabowski-30320,damian grabowski,The Polish Pitbull,12/05/1980,41.0,,Opole,Poland,"6'1""",261 lbs,Lutadores Opole,Heavyweight,22.0,8.0,11.0,3.0,,22.0,2.0,1.0,2.0,,The Polish Pitbull,20.0,5.0,0.0,185.42,109.32,190.5,Orthodox,1980-05-12,4.0,36.0,7.65,51.0,0.0,0.0,0.0,0.0
/fighter/Damian-Norris-112393,damian norris,Pretty Boy,,,,"Schaumburg, Illinois",United States,"5'11""",170 lbs,Team Alpha Male,Welterweight,10.0,5.0,2.0,3.0,,10.0,1.0,1.0,1.0,,,,,,,,,,,,,,,,,,
/fighter/Damian-Stasiak-86920,damian stasiak,Webster,20/02/1990,31.0,,Lodz,Poland,"5'5""",135 lbs,United Gym,Bantamweight,13.0,1.0,10.0,2.0,,13.0,1.0,0.0,6.0,,Webster,10.0,6.0,0.0,165.1,61.23,177.8,Orthodox,1990-02-20,1.86,36.0,3.1,52.0,2.64,35.0,43.0,0.6
/fighter/Damian-Vitale-22930,damian vitale,,,,,,,"0'0""",0 lbs,,,4.0,1.0,1.0,1.0,1.0,4.0,2.0,1.0,0.0,0.0,,,,,,,,,,,,,,,,,
/fighter/Damien-Brown-62243,damien brown,Beatdown,25/12/1984,36.0,,"Townsville, Queensland",Australia,"5'10""",155 lbs,Base Training Centre,Lightweight,19.0,3.0,9.0,7.0,,19.0,3.0,4.0,6.0,,Beatdown,17.0,12.0,0.0,177.8,70.31,172.72,Orthodox,1984-12-25,3.66,38.0,4.86,50.0,0.68,27.0,53.0,0.7
/fighter/Damien-Trites-21035,damien trites,The Omen,23/08/1979,41.0,,"Springfield, Massachusetts",United States,"5'11""",165 lbs,Wai Kru MMA,Welterweight,7.0,1.0,6.0,0.0,,7.0,1.0,2.0,3.0,,The Omen,7.0,6.0,0.0,180.34,74.84,,,,0.0,0.0,0.0,0.0,0.0,0.0,0.0,0.0
,damion douglas,,,,,,,,,,,,,,,,,,,,,,4.0,1.0,0.0,,77.11,,,,0.0,0.0,0.0,0.0,0.0,0.0,0.0,0.0
/fighter/Damir-Ferhatbegovic-223271,damir ferhatbegovic,,,,,"Knoxville, Tennessee",United States,"0'0""",155 lbs,,Lightweight,5.0,2.0,1.0,2.0,,5.0,0.0,2.0,0.0,,,,,,,,,,,,,,,,,,
/fighter/Damir-Hadzovic-56139,damir hadzovic,The Bosnian Bomber,08/08/1986,35.0,,Gorazde,Bosnia and Herzegovina,"5'11""",155 lbs,Arte Suave Copenhagen,Lightweight,14.0,7.0,3.0,4.0,,14.0,1.0,1.0,4.0,,The Bosnian Bomber,14.0,7.0,0.0,175.26,70.31,177.8,Orthodox,1986-08-08,3.36,48.0,3.26,62.0,0.78,55.0,34.0,0.2
/fighter/Damir-Ismagulov-181183,damir ismagulov,,03/02/1991,30.0,,Orenburg,Russia,"5'10""",155 lbs,Boets MMA,Lightweight,23.0,12.0,1.0,10.0,,23.0,0.0,0.0,1.0,,Qazaq,24.0,3.0,0.0,177.8,70.31,187.96,Orthodox,1991-02-03,3.36,42.0,2.44,61.0,1.0,28.0,70.0,0.0
,damir mirenic,,,,,,,,,,,,,,,,,,,,,Wolf,9.0,4.0,0.0,182.88,83.91,,Orthodox,1974-08-02,0.84,50.0,9.86,35.0,0.0,0.0,0.0,0.0
/fighter/Damon-Jackson-113767,damon jackson,The Leech,08/08/1988,33.0,,"Dallas, Texas",United States,"5'11""",145 lbs,Fortis MMA,Featherweight,18.0,3.0,14.0,1.0,,18.0,3.0,1.0,0.0,,The Leech,22.0,6.0,1.0,180.34,65.77,180.34,Switch,1988-08-08,3.02,40.0,3.46,50.0,2.44,34.0,40.0,1.6
,damonte robinson,,,,,,,,,,,,,,,,,,,,,,6.0,1.0,1.0,182.88,70.31,195.58,,,0.0,0.0,0.0,0.0,0.0,0.0,0.0,0.0
,dan argueta,,,,,,,,,,,,,,,,,,,,,The Determined,9.0,2.0,0.0,170.18,61.23,172.72,Southpaw,1993-08-13,2.35,47.0,1.9,52.0,2.54,50.0,60.0,1.9
,dan barrera,,,,,,,,,,,,,,,,,,,,,The Fireman,3.0,1.0,0.0,175.26,77.11,,Orthodox,1980-12-23,0.8,70.0,1.2,28.0,1.0,8.0,0.0,0.0
/fighter/Dan-Bobish-174,dan bobish,The Bull,26/01/1970,51.0,,"Cleveland, Ohio",United States,"6'1""",332 lbs,Strong Style Fight Team,Super Heavyweight,17.0,9.0,8.0,0.0,,17.0,6.0,3.0,0.0,,,17.0,9.0,0.0,187.96,156.49,,Southpaw,1970-01-26,2.06,44.0,1.74,34.0,2.44,42.0,0.0,1.6
/fighter/Dan-Bonnell-16473,dan bonnell,,30/05/1980,41.0,,"Haverhill, Massachusetts",United States,"5'7""",150 lbs,Renzo Gracie Jiu-Jitsu NH,Lightweight,11.0,3.0,5.0,3.0,,11.0,5.0,5.0,0.0,,,,,,,,,,,,,,,,,,
/fighter/Dan-Charles-80850,dan charles,The Man,24/09/1985,35.0,,"Phoenix, Arizona",United States,"6'2""",232 lbs,Power MMA and Fitness,Heavyweight,11.0,7.0,2.0,2.0,,11.0,7.0,0.0,0.0,,The Man,10.0,6.0,1.0,187.96,103.42,,,,2.82,45.0,3.51,44.0,0.0,0.0,31.0,0.0
/fighter/Dan-Christison-2646,dan christison,The Sandman,26/04/1972,49.0,,"Albuquerque, New Mexico",United States,"6'8""",270 lbs,Jackson-Wink MMA,Super Heavyweight,20.0,8.0,12.0,0.0,,20.0,1.0,0.0,6.0,,The Sandman,20.0,7.0,0.0,203.2,120.2,,Orthodox,1972-04-26,4.23,51.0,3.88,54.0,0.0,0.0,37.0,1.1
/fighter/Dan-Cormier-67968,dan cormier,The Hamburglar,,,,"Cranston, Rhode Island",United States,"5'4""",125 lbs,Tri-Force MMA,Flyweight,8.0,1.0,2.0,5.0,0.0,8.0,1.0,3.0,5.0,1.0,,,,,,,,,,,,,,,,,
/fighter/Dan-Cramer-42310,dan cramer,Cosmo,31/10/1985,35.0,,"Bethel, Connecticut",United States,"6'1""",185 lbs,American Top Team,Middleweight,11.0,2.0,0.0,9.0,,11.0,2.0,0.0,2.0,,,11.0,4.0,0.0,187.96,77.11,,Orthodox,1985-10-31,0.97,30.0,2.1,31.0,0.0,0.0,66.0,0.5
/fighter/Dan-Evensen-10584,dan evensen,,01/06/1974,47.0,,Arendal,Norway,"6'3""",252 lbs,,Heavyweight,11.0,7.0,1.0,2.0,1.0,11.0,3.0,1.0,0.0,0.0,The Viking,11.0,4.0,0.0,190.5,113.4,,Orthodox,1974-06-01,0.27,10.0,3.86,38.0,0.0,0.0,0.0,4.0
/fighter/Dan-Hardy-10629,dan hardy,The Outlaw,17/05/1982,39.0,,"Nottingham, East Midlands",England,"6'0""",170 lbs,Team Rough House,Welterweight,25.0,13.0,3.0,9.0,0.0,25.0,1.0,4.0,4.0,1.0,The Outlaw,25.0,10.0,0.0,182.88,77.11,187.96,Orthodox,1982-05-17,2.46,35.0,3.44,51.0,0.73,35.0,35.0,0.4
/fighter/Dan-Henderson-195,dan henderson,Hendo,24/08/1970,50.0,,"Temecula, California",United States,"6'1""",185 lbs,Team Quest,Middleweight,32.0,17.0,1.0,14.0,,32.0,3.0,4.0,8.0,,Hendo,32.0,15.0,0.0,180.34,83.91,187.96,Orthodox,1970-08-24,2.44,47.0,2.7,51.0,1.52,52.0,57.0,0.3
/fighter/Dan-Hooker-45122,dan hooker,The Hangman,13/02/1990,31.0,,Auckland,New Zealand,"6'0""",155 lbs,City Kickboxing,Lightweight,20.0,10.0,7.0,3.0,,20.0,2.0,2.0,6.0,,The Hangman,23.0,12.0,0.0,182.88,70.31,190.5,Switch,1990-02-13,5.08,48.0,4.76,51.0,0.79,34.0,80.0,0.4
/fighter/Dan-Hornbuckle-16658,dan hornbuckle,The Handler,26/12/1980,40.0,,"Mahomet, Illinois",United States,"6'2""",170 lbs,American Top Team,Welterweight,25.0,10.0,11.0,4.0,,25.0,0.0,3.0,6.0,,,,,,,,,,,,,,,,,,
/fighter/Dan-Ige-136499,dan ige,50K,06/08/1991,30.0,,"Honolulu, Hawaii",United States,"5'7""",145 lbs,Xtreme Couture,Featherweight,15.0,4.0,5.0,6.0,,15.0,0.0,0.0,4.0,,50K,17.0,7.0,0.0,170.18,65.77,180.34,Orthodox,1991-08-06,3.76,45.0,3.53,57.0,1.07,26.0,58.0,0.3
/fighter/Dan-Keenan-47228,dan keenan,,,,,,United States,"0'0""",165 lbs,,Welterweight,4.0,1.0,2.0,1.0,,4.0,1.0,0.0,0.0,,,,,,,,,,,,,,,,,,
/fighter/Dan-Konecke-77162,dan konecke,,,,,"Sheffield, South Yorkshire",England,"6'1""",205 lbs,Ludus Magnus,Light Heavyweight,8.0,5.0,3.0,0.0,,8.0,7.0,7.0,1.0,,,,,,,,,,,,,,,,,,
/fighter/Dan-Lauzon-16556,dan lauzon,The Upgrade,30/03/1988,33.0,,"Bridgewater, Massachusetts",United States,"5'10""",170 lbs,Lauzon MMA,Welterweight,17.0,9.0,7.0,1.0,,17.0,3.0,2.0,1.0,,The Upgrade,17.0,6.0,0.0,177.8,70.31,,Orthodox,1988-03-30,1.34,25.0,4.09,61.0,1.63,33.0,80.0,2.7
,dan manasoiu,,,,,,,,,,,,,,,,,,,,,,0.0,0.0,0.0,,,,,,0.0,0.0,0.0,0.0,0.0,0.0,0.0,0.0
/fighter/Dan-Matala-55764,dan matala,,06/03/1991,30.0,,"Philadelphia, Pennsylvania",United States,"6'0""",145 lbs,Daddis Fight Camps,Featherweight,1.0,1.0,0.0,0.0,,1.0,0.0,0.0,0.0,,,,,,,,,,,,,,,,,,
/fighter/Dan-Miller-14464,dan miller,,30/06/1981,40.0,,"Sparta, New Jersey",United States,"6'1""",185 lbs,Miller Brothers MMA,Middleweight,14.0,1.0,9.0,4.0,,14.0,1.0,0.0,7.0,,,14.0,8.0,0.0,185.42,83.91,187.96,Orthodox,1981-06-30,2.03,36.0,3.06,49.0,1.67,54.0,47.0,1.8
,dan molina,,,,,,,,,,,,,,,,,,,,,,13.0,9.0,0.0,177.8,97.98,,,,0.0,0.0,5.58,60.0,0.0,0.0,0.0,20.9
/fighter/Dan-Moret-52514,dan moret,The Hitman,21/11/1986,34.0,,"Mankato, Minnesota",United States,"6'0""",155 lbs,Minnesota Martial Arts Academy,Lightweight,15.0,2.0,8.0,5.0,,15.0,2.0,0.0,4.0,,The Hitman,13.0,6.0,0.0,182.88,70.31,185.42,Southpaw,1986-11-21,2.67,43.0,3.56,43.0,1.25,27.0,45.0,0.4
/fighter/Dan-OConnor-95183,dan o'connor,Johnny Irish,17/11/1982,38.0,,"St. Louis, Missouri",United States,"5'4""",142 lbs,,Featherweight,7.0,1.0,6.0,0.0,,7.0,2.0,4.0,1.0,,Johnny Irish,6.0,6.0,0.0,162.56,52.16,,,,4.0,56.0,5.1,54.0,0.0,0.0,100.0,0.0
/fighter/Dan-Severn-52,dan severn,The Beast,08/06/1958,63.0,,"Coldwater, Michigan",United States,"6'2""",253 lbs,The Beast Academy,Heavyweight,101.0,23.0,54.0,24.0,,101.0,5.0,7.0,7.0,,The Beast,101.0,19.0,1.0,187.96,113.4,,Southpaw,1958-06-08,0.0,0.0,0.0,0.0,0.0,0.0,0.0,0.0
/fighter/Dan-Spohn-39485,dan spohn,Dragon,12/10/1984,36.0,,"Zanesville, Ohio",United States,"6'4""",206 lbs,Cambridge Martial Arts,Light Heavyweight,18.0,7.0,5.0,6.0,,18.0,1.0,2.0,5.0,,,,,,,,,,,,,,,,,,
,dan stittgen,,,,,,,,,,,,,,,,,,,,,The Anvil,12.0,5.0,0.0,185.42,77.11,,Orthodox,1980-11-17,2.97,46.0,4.42,37.0,0.78,100.0,100.0,0.0
/fighter/Dan-Vinni-35904,dan vinni,,04/08/1987,34.0,,"London, Greater London",England,"6'2""",170 lbs,Rumble Sports,Welterweight,16.0,7.0,9.0,0.0,,16.0,8.0,6.0,3.0,,,,,,,,,,,,,,,,,,
/fighter/Danaa-Batgerel-85013,danaa batgerel,Storm,04/07/1989,32.0,,,Mongolia,"5'8""",135 lbs,Team Tungaa,Bantamweight,9.0,5.0,2.0,2.0,,9.0,0.0,0.0,2.0,,,,,,,,,,,,,,,,,,
/fighter/Danasabe-Mohammed-88013,danasabe mohammed,,06/10/1990,30.0,,"Napa, California",United States,"5'9""",170 lbs,Napa Valley MMA,Welterweight,6.0,1.0,4.0,1.0,,6.0,0.0,0.0,3.0,,,,,,,,,,,,,,,,,,
/fighter/Dane-Bonnigson-39601,dane bonnigson,,07/10/1980,40.0,,"Bowling Green, Ohio",United States,"6'1""",204 lbs,USA Martial Arts,Light Heavyweight,1.0,1.0,0.0,0.0,,1.0,1.0,1.0,0.0,,,,,,,,,,,,,,,,,,
/fighter/Danie-van-Heerden-71256,danie van heerden,The Pitbull,,,,"Johannesburg, Gauteng",South Africa,"6'2""",205 lbs,Tapout Academy,Light Heavyweight,11.0,8.0,3.0,0.0,,11.0,1.0,4.0,3.0,,,,,,,,,,,,,,,,,,
,daniel acacio,,,,,,,,,,,,,,,,,,,,,,30.0,18.0,0.0,172.72,81.65,,Orthodox,1977-12-27,3.52,36.0,2.85,62.0,0.33,20.0,81.0,0.0
,daniel allen,,,,,,,,,,,,,,,,,,,,,,5.0,0.0,0.0,182.88,70.31,190.5,Southpaw,1992-08-10,7.6,51.0,5.87,53.0,2.0,66.0,100.0,0.0
,daniel barez,,,,,,,,,,,,,,,,,,,,,,16.0,6.0,0.0,167.64,56.7,167.64,Orthodox,1988-12-10,3.8,53.0,5.32,55.0,4.07,31.0,91.0,1.6
/fighter/Daniel-Barrera-23762,daniel barrera,,23/12/1980,40.0,,"Radcliff, Kentucky",United States,"0'0""",170 lbs,,Welterweight,3.0,1.0,1.0,1.0,,3.0,0.0,0.0,1.0,,,,,,,,,,,,,,,,,,
/fighter/Daniel-Carey-130595,daniel carey,Scary,22/01/1990,31.0,,"Ada, Oklahoma",United States,"5'7""",145 lbs,,Featherweight,7.0,2.0,3.0,2.0,,7.0,3.0,0.0,2.0,,,,,,,,,,,,,,,,,,
/fighter/Daniel-Cassell-147021,daniel cassell,Pork Chop,26/04/1991,30.0,,"Birmingham, West Midlands",England,"5'10""",170 lbs,UTC Staffs,Welterweight,4.0,3.0,0.0,1.0,,4.0,1.0,2.0,1.0,,,,,,,,,,,,,,,,,,
/fighter/Daniel-Compton-120661,daniel compton,Santo,02/10/1988,32.0,,"Santa Cruz, California",United States,"6'2""",185 lbs,Smash Fighter Fight Team,Middleweight,4.0,0.0,3.0,1.0,,4.0,2.0,1.0,0.0,,,,,,,,,,,,,,,,,,
/fighter/Daniel-Cormier-52311,daniel cormier,DC,20/03/1979,42.0,,"San Jose, California",United States,"5'11""",251 lbs,American Kickboxing Academy,Heavyweight,22.0,10.0,5.0,7.0,,22.0,1.0,0.0,2.0,,DC,22.0,3.0,0.0,180.34,106.59,182.88,Orthodox,1979-03-20,4.25,52.0,2.92,54.0,1.83,44.0,80.0,0.4
/fighter/Daniel-Crawford-141729,daniel crawford,,,,,"Croydon, Greater London",England,"5'9""",145 lbs,New Wave Academy MMA,Featherweight,10.0,6.0,1.0,3.0,,10.0,1.0,1.0,1.0,,,,,,,,,,,,,,,,,,
/fighter/Daniel-Downes-41666,daniel downes,Danny Boy,08/04/1986,35.0,,"Milwaukee, Wisconsin",United States,"6'0""",155 lbs,Roufusport,Lightweight,8.0,5.0,1.0,2.0,,8.0,0.0,1.0,2.0,,,,,,,,,,,,,,,,,,
/fighter/Daniel-Dustin-Moore-158197,daniel dustin moore,,,,,"Soquel, California",United States,"5'4""",125 lbs,Farley's Kickboxing Academy,Flyweight,0.0,0.0,0.0,0.0,,0.0,2.0,0.0,0.0,,,,,,,,,,,,,,,,,,
/fighter/Daniel-Gallemore-83132,daniel gallemore,Big Kansas,14/06/1985,36.0,,"Emporia, Kansas",United States,"6'5""",265 lbs,Elevation Fight Team,Heavyweight,7.0,5.0,2.0,0.0,,7.0,5.0,0.0,1.0,,Big Kansas,7.0,3.0,0.0,195.58,120.2,,,,3.1,41.0,6.0,52.0,0.0,0.0,0.0,0.0
/fighter/Daniel-Gonzalez-252665,daniel gonzalez,,09/03/1995,26.0,,"San Jose, California",United States,"5'7""",125 lbs,American Kickboxing Academy,Flyweight,3.0,2.0,0.0,1.0,,3.0,1.0,0.0,1.0,,,,,,,,,,,,,,,,,,
/fighter/Daniel-Gracie-4836,daniel gracie,,28/06/1972,49.0,,Rio de Janeiro,Brazil,"6'2""",205 lbs,Renzo Gracie Jiu-Jitsu,Light Heavyweight,5.0,0.0,4.0,1.0,,5.0,2.0,0.0,2.0,,,5.0,4.0,1.0,187.96,102.06,,Orthodox,,1.9,38.0,1.33,59.0,0.36,100.0,80.0,2.1
/fighter/Daniel-James-147707,daniel james,The Predator,31/12/1981,39.0,,"Chicago, Illinois",United States,"6'5""",263 lbs,Midwest Training Center,Heavyweight,10.0,6.0,3.0,1.0,0.0,10.0,1.0,1.0,3.0,1.0,,,,,,,,,,,,,,,,,
/fighter/Daniel-Jolly-83243,daniel jolly,The Werewolf of Texas,03/09/1984,36.0,,"Austin, Texas",United States,"6'1""",205 lbs,American Top Team,Light Heavyweight,6.0,3.0,1.0,2.0,,6.0,5.0,0.0,0.0,,The Werewolf of Texas,5.0,3.0,0.0,185.42,92.99,190.5,Orthodox,1984-09-03,1.32,46.0,3.39,44.0,2.83,33.0,50.0,0.0
/fighter/Daniel-Kelly-49516,daniel kelly,,31/10/1977,43.0,,"Melbourne, Victoria",Australia,"6'0""",185 lbs,Resilience Training Centre,Middleweight,13.0,3.0,5.0,5.0,,13.0,3.0,0.0,1.0,,,13.0,4.0,0.0,182.88,83.91,177.8,Southpaw,1977-10-31,3.62,38.0,4.64,61.0,1.86,34.0,78.0,0.3
,daniel lacerda,,,,,,,,,,,,,,,,,,,,,Miojo,11.0,5.0,0.0,167.64,56.7,177.8,Switch,1996-06-05,4.16,47.0,8.7,34.0,1.91,42.0,0.0,1.3
/fighter/Daniel-Langbeen-58762,daniel langbeen,,,,,"Eastpointe, Michigan",United States,"5'9""",149 lbs,,Lightweight,5.0,3.0,0.0,2.0,,5.0,1.0,1.0,2.0,,,,,,,,,,,,,,,,,,
/fighter/Daniel-Madrid-14953,daniel madrid,Demigod,24/04/1984,37.0,,"Phoenix, Arizona",United States,"6'3""",185 lbs,Grace Fighting Systems,Middleweight,18.0,1.0,15.0,1.0,1.0,18.0,4.0,2.0,1.0,0.0,,,,,,,,,,,,,,,,,
,daniel marcos,,,,,,,,,,,,,,,,,,,,,Soncora,15.0,0.0,0.0,170.18,61.23,175.26,Orthodox,1993-03-07,4.88,46.0,3.7,69.0,0.4,50.0,89.0,0.0
/fighter/Daniel-Mashamaite-78614,daniel mashamaite,Black Diamond,06/12/1976,44.0,,"Polokwane, Limpopo",South Africa,"5'7""",136 lbs,Grappling Unlimited,Bantamweight,1.0,0.0,1.0,0.0,,1.0,1.0,1.0,1.0,,,,,,,,,,,,,,,,,,
,daniel mcwilliams,,,,,,,,,,,,,,,,,,,,,The Animal,15.0,37.0,0.0,185.42,83.91,,,,3.36,77.0,0.0,0.0,0.0,0.0,100.0,21.6
/fighter/Daniel-Miller-52646,daniel miller,,16/10/1985,35.0,,"Fort Worth, Texas",United States,"6'3""",185 lbs,,Middleweight,4.0,0.0,3.0,1.0,,4.0,0.0,3.0,2.0,,,,,,,,,,,,,,,,,,
/fighter/Daniel-Morales-16841,daniel morales,Chango,24/12/1981,39.0,,"Chula Vista, Florida",United States,"5'6""",155 lbs,Alliance MMA,Lightweight,8.0,1.0,4.0,3.0,,8.0,2.0,2.0,1.0,,,,,,,,,,,,,,,,,,
/fighter/Daniel-Omielanczuk-54303,daniel omielanczuk,,31/08/1982,38.0,,Warsaw,Poland,"6'0""",252 lbs,WCA Fight Team,Heavyweight,25.0,6.0,10.0,9.0,,25.0,1.0,1.0,8.0,,,19.0,8.0,1.0,182.88,112.04,187.96,Southpaw,1982-08-31,3.09,57.0,3.29,47.0,0.56,26.0,68.0,0.1
/fighter/Daniel-Oseguera-165503,daniel oseguera,,,,,"Modesto, California",United States,"5'6""",135 lbs,Dynamic Mixed Martial Arts,Bantamweight,1.0,0.0,0.0,1.0,,1.0,1.0,0.0,0.0,,,,,,,,,,,,,,,,,,
,daniel pereira,,,,,,,,,,,,,,,,,,,,,Gaucho,9.0,2.0,0.0,177.8,83.91,,,,0.0,0.0,0.0,0.0,0.0,0.0,0.0,0.0
/fighter/Daniel-Pineda-21564,daniel pineda,The Pit,06/08/1985,36.0,,"Houston, Texas",United States,"5'7""",145 lbs,4oz. Fight Club,Featherweight,27.0,9.0,18.0,0.0,,27.0,3.0,6.0,5.0,,The Pit,28.0,15.0,0.0,170.18,65.77,175.26,Orthodox,1985-08-06,3.09,49.0,3.18,46.0,1.71,25.0,48.0,1.7
,daniel puder,,,,,,,,,,,,,,,,,,,,,,8.0,0.0,0.0,190.5,106.59,,Orthodox,1981-10-09,2.77,68.0,1.17,38.0,1.21,50.0,81.0,9.0
/fighter/Daniel-Roberts-23999,daniel roberts,Ninja,05/08/1980,41.0,,"Rockford, Illinois",United States,"5'10""",170 lbs,Cesar Gracie Fight Team,Welterweight,15.0,1.0,10.0,4.0,,15.0,1.0,1.0,5.0,,Ninja,15.0,7.0,0.0,177.8,77.11,187.96,Southpaw,1980-08-05,0.73,20.0,2.27,46.0,2.46,44.0,40.0,2.5
/fighter/Daniel-Rodriguez-145945,daniel rodriguez,D-Rod,31/12/1986,34.0,,"Alhambra, California",United States,"6'0""",170 lbs,10th Planet Jiu-Jitsu,Welterweight,15.0,8.0,4.0,3.0,,15.0,0.0,0.0,2.0,,D-Rod,17.0,4.0,0.0,185.42,77.11,187.96,Southpaw,1986-12-31,7.3,50.0,5.28,56.0,0.62,50.0,63.0,0.1
,daniel santos,,,,,,,,,,,,,,,,,,,,,Willycat,12.0,2.0,0.0,170.18,61.23,170.18,Orthodox,1995-03-12,4.26,37.0,5.12,50.0,1.9,50.0,73.0,0.0
/fighter/Daniel-Sarafian-17665,daniel sarafian,,21/08/1982,38.0,,"Sao Paulo, Sao Paulo",Brazil,"5'9""",185 lbs,Power MMA,Middleweight,11.0,1.0,7.0,3.0,,11.0,2.0,1.0,3.0,,,10.0,6.0,0.0,175.26,83.91,185.42,Orthodox,1982-08-21,2.23,46.0,3.1,58.0,0.36,7.0,53.0,0.7
,daniel schmitt,,,,,,,,,,,,,,,,,,,,,,2.0,3.0,0.0,,83.91,,,,0.0,0.0,0.0,0.0,0.0,0.0,0.0,0.0
/fighter/Daniel-Spitz-172211,daniel spitz,Daddy Long Legs,31/07/1990,31.0,,"Spokane, Washington",United States,"6'7""",240 lbs,Sikjitsu,Heavyweight,6.0,2.0,3.0,1.0,,6.0,1.0,0.0,2.0,,,6.0,3.0,0.0,200.66,111.13,208.28,Orthodox,1990-07-31,2.6,35.0,5.3,46.0,0.74,66.0,0.0,0.0
,daniel spohn,,,,,,,,,,,,,,,,,,,,,Dragon,15.0,6.0,0.0,193.04,92.99,200.66,Southpaw,1984-10-12,2.42,49.0,1.6,53.0,0.0,0.0,28.0,2.5
/fighter/Daniel-Stittgen-42258,daniel stittgen,The Anvil,17/11/1980,40.0,,"Schaumburg, Illinois",United States,"6'1""",170 lbs,Midwest Training Center,Welterweight,12.0,2.0,9.0,1.0,,12.0,2.0,3.0,2.0,,,,,,,,,,,,,,,,,,
/fighter/Daniel-Straus-45414,daniel straus,,27/07/1984,37.0,,"Cincinnati, Ohio",United States,"5'8""",145 lbs,Sanford MMA,Featherweight,26.0,7.0,4.0,15.0,,26.0,2.0,5.0,2.0,,,24.0,7.0,0.0,170.18,65.77,180.34,,,4.76,43.0,2.99,57.0,0.84,15.0,81.0,1.1
,daniel swain,,,,,,,,,,,,,,,,,,,,,,20.0,10.0,1.0,175.26,65.77,177.8,Orthodox,1991-01-30,0.8,44.0,3.2,40.0,0.0,0.0,0.0,6.0
/fighter/Daniel-Tabera-4476,daniel tabera,The Gladiator,25/12/1977,43.0,,Valencia,Spain,"5'11""",170 lbs,Espanha Imperial,Welterweight,18.0,4.0,6.0,8.0,,18.0,2.0,1.0,5.0,,,,,,,,,,,,,,,,,,
/fighter/Daniel-Teymur-163939,daniel teymur,Kid Dynamite,03/02/1988,33.0,,Stockholm,Sweden,"5'5""",145 lbs,Allstars Training Center,Featherweight,7.0,3.0,3.0,1.0,,7.0,1.0,2.0,1.0,,Kid Dynamite,7.0,4.0,0.0,165.1,65.77,175.26,Orthodox,1988-02-03,3.08,46.0,3.93,56.0,0.56,18.0,60.0,0.3
/fighter/Daniel-Vizcaya-67208,daniel vizcaya,The Bulldog,01/07/1985,36.0,,"Lisle, Illinois",United States,"6'0""",185 lbs,Prime Muay Thai,Middleweight,10.0,2.0,6.0,2.0,,10.0,0.0,3.0,1.0,,,,,,,,,,,,,,,,,,
/fighter/Daniel-Weichel-4541,daniel weichel,Drake,22/11/1984,36.0,,"Frankfurt, Hesse",Germany,"5'10""",145 lbs,Team MMA Spirit,Featherweight,41.0,5.0,22.0,14.0,,41.0,5.0,3.0,4.0,,The Weasel,39.0,9.0,0.0,177.8,65.77,177.8,,,5.71,42.0,4.05,61.0,0.84,50.0,83.0,0.0
,daniel zellhuber,,,,,,,,,,,,,,,,,,,,,Golden Boy,14.0,1.0,0.0,185.42,70.31,195.58,Switch,1999-07-07,5.26,39.0,4.79,53.0,0.28,33.0,94.0,0.3
/fighter/Daniele-Miceli-194907,daniele miceli,The Cyborg,20/10/1987,33.0,,"Lamezia Terme, Calabria",Italy,"5'7""",155 lbs,Fight Club Lamezia Terme,Lightweight,9.0,1.0,4.0,4.0,,9.0,4.0,0.0,0.0,,,,,,,,,,,,,,,,,,
/fighter/Daniele-Scatizzi-147723,daniele scatizzi,Scat,15/05/1993,28.0,,"Cerveteri, Rome",Italy,"5'10""",155 lbs,SBG Ireland,Lightweight,10.0,6.0,1.0,3.0,,10.0,1.0,1.0,3.0,,,,,,,,,,,,,,,,,,
/fighter/Danielle-Taylor-123439,danielle taylor,Dynamite,25/10/1989,31.0,,"Palmdale, California",United States,"5'0""",115 lbs,Saekson Muay Thai,Strawweight,11.0,3.0,1.0,7.0,,11.0,1.0,0.0,4.0,,Dynamite,9.0,4.0,0.0,152.4,52.16,152.4,Orthodox,1989-10-25,2.75,29.0,3.31,71.0,0.2,20.0,70.0,0.2
/fighter/Danillo-Villefort-13093,danillo villefort,Indio,08/05/1983,38.0,,"Coconut Creek, Florida",United States,"6'1""",186 lbs,Blackzilians,Middleweight,15.0,6.0,5.0,4.0,,15.0,4.0,0.0,2.0,,Indio,15.0,5.0,0.0,185.42,83.91,,Orthodox,1983-05-08,2.86,37.0,2.4,68.0,1.71,66.0,33.0,1.7
/fighter/Danilo-Belluardo-128147,danilo belluardo,Caterpillar,21/07/1994,27.0,,Milan,Italy,"5'11""",155 lbs,Aurora MMA,Lightweight,13.0,7.0,3.0,3.0,,13.0,6.0,0.0,0.0,,Caterpillar,12.0,5.0,0.0,182.88,70.31,187.96,Southpaw,1994-07-21,1.52,61.0,4.79,41.0,3.5,100.0,50.0,0.0
/fighter/Danilo-Marques-172145,danilo marques,,26/12/1985,35.0,,"Sao Paulo, Sao Paulo",Brazil,"6'6""",205 lbs,Demian Maia Jiu-Jitsu,Light Heavyweight,11.0,4.0,5.0,2.0,,11.0,2.0,0.0,1.0,,,11.0,4.0,0.0,198.12,92.99,195.58,Orthodox,1985-12-26,1.44,79.0,2.52,52.0,3.93,28.0,0.0,0.8
,danilo suzart,,,,,,,,,,,,,,,,,,,,,,9.0,2.0,0.0,182.88,117.93,,Orthodox,1991-12-04,4.09,55.0,11.73,51.0,0.0,0.0,0.0,0.0
/fighter/Danni-Neilan-239613,danni neilan,,,,,Dublin,Ireland,"5'6""",115 lbs,SBG Ireland,Strawweight,4.0,0.0,1.0,3.0,,4.0,0.0,0.0,0.0,,,,,,,,,,,,,,,,,,
/fighter/Danny-Abbadi-16696,danny abbadi,,03/07/1983,38.0,,"Orlando, Florida",United States,"5'11""",185 lbs,,Middleweight,4.0,3.0,0.0,1.0,,4.0,1.0,1.0,4.0,,The Assassin,4.0,6.0,0.0,180.34,70.31,,Orthodox,1983-07-03,3.29,38.0,4.41,57.0,0.0,0.0,77.0,0.0
,danny barlow,,,,,,,,,,,,,,,,,,,,,LeftHand2God,7.0,0.0,0.0,187.96,77.11,200.66,Southpaw,1995-08-02,12.15,57.0,5.32,61.0,0.0,0.0,0.0,0.0
/fighter/Danny-Castillo-26070,danny castillo,Last Call,25/08/1979,41.0,,"Sacaramento, California",United States,"5'9""",155 lbs,Team Alpha Male,Lightweight,17.0,7.0,3.0,7.0,,17.0,3.0,2.0,5.0,,Last Call,17.0,10.0,0.0,175.26,70.31,180.34,Orthodox,1979-08-25,2.57,42.0,1.96,62.0,2.95,38.0,63.0,0.2
/fighter/Danny-Chavez-59478,danny chavez,The Colombian Warrior,14/03/1987,34.0,,"Miami, Florida",United States,"5'7""",145 lbs,MMA Masters,Featherweight,11.0,3.0,0.0,8.0,,11.0,0.0,1.0,3.0,,The Colombian Warrior,11.0,5.0,1.0,172.72,65.77,170.18,Orthodox,1987-03-14,2.86,38.0,3.83,50.0,1.95,60.0,87.0,0.0
,danny davis,,,,,,,,,,,,,,,,,,,,,,13.0,11.0,1.0,187.96,77.11,,,,0.0,0.0,0.0,0.0,0.0,0.0,0.0,0.0
,danny downes,,,,,,,,,,,,,,,,,,,,,,8.0,3.0,0.0,182.88,70.31,182.88,Orthodox,1986-04-08,1.66,34.0,3.53,37.0,0.0,0.0,37.0,0.5
/fighter/Danny-Henry-59830,danny henry,The Hatchet,17/07/1988,33.0,,Edinburgh,Scotland,"5'11""",145 lbs,Higher Level Martial Arts,Featherweight,12.0,5.0,5.0,2.0,,12.0,0.0,2.0,2.0,,The Hatchet,12.0,4.0,0.0,182.88,65.77,185.42,Orthodox,1988-07-17,5.2,51.0,4.16,45.0,0.74,33.0,50.0,2.2
/fighter/Danny-Kingad-191627,danny kingad,The King,28/09/1995,25.0,,"La Trinidad, Benguet",Philippines,"5'5""",135 lbs,Team Lakay,Bantamweight,14.0,1.0,2.0,11.0,,14.0,0.0,1.0,1.0,,,,,,,,,,,,,,,,,,
/fighter/Danny-Martinez-16777,danny martinez,The Gremlin,14/06/1985,36.0,,"Tempe, Arizona",United States,"5'5""",125 lbs,Alliance MMA,Flyweight,21.0,9.0,4.0,8.0,,21.0,0.0,0.0,9.0,,The Gremlin,21.0,8.0,0.0,167.64,56.7,170.18,Orthodox,1985-06-14,2.73,28.0,3.77,63.0,3.0,45.0,36.0,0.0
/fighter/Danny-Mitchell-40523,danny mitchell,The Cheesecake Assassin,08/08/1986,35.0,,"Doncaster, Yorkshire",England,"6'2""",170 lbs,AVT Fight Team,Welterweight,20.0,6.0,12.0,2.0,,20.0,4.0,1.0,4.0,,The Cheesecake Assassin,19.0,9.0,1.0,187.96,77.11,,Orthodox,1986-08-08,2.53,49.0,2.53,52.0,0.0,0.0,100.0,3.0
/fighter/Danny-Navarro-26922,danny navarro,Ironman,27/05/1983,38.0,,"Riverside, California",United States,"5'10""",165 lbs,Millennia MMA,Welterweight,19.0,3.0,9.0,7.0,,19.0,3.0,1.0,3.0,,,17.0,7.0,0.0,177.8,70.31,,,,3.83,32.0,4.62,57.0,2.17,25.0,100.0,0.0
/fighter/Danny-Roberts-64677,danny roberts,Hot Chocolate,14/07/1987,34.0,,"Liverpool, Merseyside",England,"6'1""",170 lbs,Team McHale,Welterweight,17.0,8.0,5.0,4.0,,17.0,3.0,2.0,0.0,,Hot Chocolate,18.0,8.0,0.0,185.42,77.11,187.96,Southpaw,1987-07-14,3.18,39.0,3.73,50.0,0.24,9.0,57.0,0.2
/fighter/Danny-Sabatello-293067,danny sabatello,The Italian Gangster,31/03/1993,28.0,,"Coconut Creek, Florida",United States,"5'9""",135 lbs,American Top Team,Bantamweight,11.0,3.0,4.0,4.0,,11.0,1.0,0.0,0.0,,Italian Gangster,9.0,1.0,0.0,177.8,61.23,180.34,Orthodox,1993-03-31,2.07,57.0,0.2,25.0,3.0,75.0,100.0,1.0
,danny silva,,,,,,,,,,,,,,,,,,,,,El Puma,8.0,1.0,0.0,180.34,65.77,177.8,Switch,1997-01-30,13.6,64.0,13.13,59.0,2.0,66.0,100.0,0.0
/fighter/Danny-Sykora-25317,danny sykora,,,,,"Cedar Rapids, Iowa",United States,"5'7""",134 lbs,Hard Drive MMA,Bantamweight,7.0,2.0,5.0,0.0,,7.0,0.0,0.0,5.0,,,,,,,,,,,,,,,,,,
/fighter/Danny-Tims-23738,danny tims,,12/12/1988,32.0,,"Independence, Missouri",United States,"5'5""",135 lbs,,Bantamweight,10.0,0.0,9.0,1.0,,10.0,0.0,2.0,3.0,,,,,,,,,,,,,,,,,,
/fighter/Danny-van-Bergen-11477,danny van bergen,,03/09/1987,33.0,,Amsterdam,Netherlands,"5'7""",154 lbs,Mike's Gym,Lightweight,11.0,1.0,7.0,2.0,1.0,11.0,1.0,6.0,3.0,0.0,,,,,,,,,,,,,,,,,
/fighter/Dano-Moore-34550,dano moore,Black Dynamite,,,,"Yuma, Arizona",United States,"6'0""",185 lbs,,Middleweight,8.0,3.0,3.0,2.0,,8.0,3.0,4.0,1.0,,,,,,,,,,,,,,,,,,
/fighter/Dante-Rivera-5746,dante rivera,,12/08/1974,46.0,,"Jackson, New Jersey",United States,"6'0""",170 lbs,Renzo Gracie Jiu-Jitsu,Welterweight,16.0,3.0,8.0,5.0,,16.0,2.0,0.0,5.0,,,16.0,7.0,0.0,185.42,83.91,,Southpaw,1974-12-08,2.27,53.0,4.0,25.0,0.0,0.0,16.0,0.0
/fighter/Dante-Schiro-229509,dante schiro,,,,,"Madison, Wisconsin",United States,"0'0""",185 lbs,Chosen Few Gym,Middleweight,8.0,4.0,3.0,1.0,,8.0,0.0,0.0,2.0,,,,,,,,,,,,,,,,,,
,danyelle wolf,,,,,,,,,,,,,,,,,,,,,,1.0,1.0,0.0,180.34,65.77,177.8,Orthodox,1983-09-08,2.37,25.0,4.57,47.0,0.0,0.0,77.0,0.5
,daria zhelezniakova,,,,,,,,,,,,,,,,,,,,,,,,,,,,,,,,,,,,,
,darian weeks,,,,,,,,,,,,,,,,,,,,,,5.0,3.0,0.0,180.34,77.11,182.88,Orthodox,1993-11-23,4.49,51.0,4.56,51.0,2.0,30.0,100.0,0.0
/fighter/Darion-Abbey-255585,darion abbey,,25/02/1993,28.0,,"Cedar Rapids, Iowa",United States,"6'6""",265 lbs,Down to Fight MMA,Heavyweight,2.0,2.0,0.0,0.0,,2.0,2.0,1.0,0.0,,,,,,,,,,,,,,,,,,
,dariya zheleznykova,,,,,,,,,,,,,,,,,,,,,,8.0,1.0,0.0,,61.23,,,,0.0,0.0,0.0,0.0,0.0,0.0,0.0,0.0
/fighter/Darko-Banovic-71203,darko banovic,Face Smasher,10/08/1991,30.0,,Vienna,Austria,"5'6""",145 lbs,Gym 23,Featherweight,15.0,7.0,6.0,2.0,,15.0,3.0,1.0,4.0,,,,,,,,,,,,,,,,,,
/fighter/Darko-Stosic-107757,darko stosic,,09/02/1992,29.0,,Belgrade,Serbia,"6'0""",232 lbs,MMA Red Star,Heavyweight,15.0,10.0,1.0,4.0,,15.0,1.0,0.0,3.0,,,13.0,4.0,0.0,182.88,92.99,193.04,Orthodox,1992-02-09,2.61,45.0,4.04,58.0,3.42,50.0,83.0,0.0
/fighter/Daron-Cruickshank-53717,daron cruickshank,The Detroit Superstar,11/06/1985,36.0,,"Wayne, Michigan",United States,"5'8""",155 lbs,Michigan Top Team,Lightweight,23.0,14.0,2.0,7.0,,23.0,2.0,8.0,4.0,,Detroit Superstar,18.0,10.0,0.0,172.72,70.31,182.88,Switch,1985-06-11,2.88,38.0,2.98,57.0,2.04,41.0,60.0,0.2
,darrel gholar,,,,,,,,,,,,,,,,,,,,,,5.0,6.0,0.0,172.72,88.0,,Orthodox,,0.0,0.0,0.0,0.0,0.0,0.0,0.0,0.0
/fighter/Darrell-Gholar-213,darrell gholar,,07/11/1962,58.0,,"North Hollywood, California",United States,"5'8""",198 lbs,,Light Heavyweight,5.0,3.0,1.0,1.0,,5.0,1.0,2.0,3.0,,,,,,,,,,,,,,,,,,
/fighter/Darrell-Horcher-47899,darrell horcher,The Saint,28/07/1987,34.0,,"Shermans Dale, Pennsylvania",United States,"5'10""",154 lbs,Unrivaled Athletics,Lightweight,14.0,7.0,1.0,6.0,,14.0,1.0,1.0,2.0,,The Saint,13.0,4.0,0.0,177.8,70.31,177.8,Southpaw,1987-07-28,2.05,44.0,4.21,39.0,0.35,50.0,47.0,0.7
/fighter/Darrell-Montague-34214,darrell montague,The Mongoose,03/11/1987,33.0,,"Chino, California",United States,"5'6""",125 lbs,Millennia MMA,Flyweight,13.0,5.0,5.0,3.0,,13.0,3.0,1.0,1.0,,Mongoose,13.0,5.0,0.0,167.64,56.7,170.18,Southpaw,1987-11-03,1.92,25.0,5.38,52.0,0.72,25.0,33.0,1.4
/fighter/Darren-Elkins-22094,darren elkins,The Damage,16/05/1984,37.0,,"Hobart, Indiana",United States,"5'10""",145 lbs,Duneland Vale Tudo,Featherweight,26.0,9.0,5.0,12.0,,26.0,3.0,1.0,5.0,,The Damage,28.0,11.0,0.0,177.8,65.77,180.34,Orthodox,1984-05-16,3.44,38.0,3.27,52.0,2.85,35.0,56.0,1.1
/fighter/Darren-Smith-Jr-60553,darren smith jr.,Hollywood,05/04/1987,34.0,,"Irvine, California",United States,"5'9""",158 lbs,OC Kickboxing,Welterweight,16.0,6.0,4.0,6.0,,16.0,3.0,2.0,6.0,,,,,,,,,,,,,,,,,,
/fighter/Darren-Stewart-128141,darren stewart,The Dentist,30/12/1990,30.0,,"London, Greater London",England,"6'0""",205 lbs,The MMA Clinic,Light Heavyweight,12.0,7.0,1.0,4.0,,12.0,0.0,2.0,5.0,,The Dentist,12.0,8.0,0.0,182.88,92.99,187.96,Orthodox,1990-12-30,3.05,45.0,3.29,48.0,1.75,45.0,67.0,0.1
/fighter/Darren-Till-73436,darren till,The Gorilla,24/12/1992,28.0,,"Liverpool, Merseyside",England,"6'0""",185 lbs,Astra Fight Team,Middleweight,18.0,10.0,2.0,6.0,,18.0,1.0,1.0,1.0,,The Gorilla,18.0,5.0,1.0,182.88,83.91,187.96,Southpaw,1992-12-24,2.3,46.0,3.31,56.0,0.55,46.0,69.0,0.0
/fighter/Darren-Uyenoyama-4679,darren uyenoyama,BC,15/10/1979,41.0,,"San Francisco, California",United States,"5'6""",125 lbs,Faito Tamashii Combat Club,Flyweight,10.0,2.0,4.0,4.0,,10.0,2.0,1.0,3.0,,BC,10.0,6.0,0.0,167.64,56.7,165.1,Orthodox,1979-10-15,1.34,39.0,2.21,66.0,1.42,33.0,35.0,0.7
/fighter/Darrick-Minner-92115,darrick minner,,28/04/1990,31.0,,"Nebraska City, Nebraska",United States,"5'8""",145 lbs,Glory MMA & Fitness,Featherweight,26.0,1.0,22.0,3.0,,26.0,3.0,8.0,1.0,,,26.0,14.0,0.0,170.18,65.77,175.26,Orthodox,1990-04-28,2.63,65.0,2.28,35.0,2.4,72.0,66.0,2.7
/fighter/Darrill-Schoonover-33084,darrill schoonover,The Boss,18/06/1985,36.0,,"El Paso, Texas",United States,"6'2""",257 lbs,Red Spider MMA,Heavyweight,14.0,7.0,5.0,2.0,0.0,14.0,2.0,2.0,3.0,1.0,The Boss,14.0,8.0,0.0,187.96,99.79,,Orthodox,1985-07-18,1.2,33.0,4.35,38.0,0.0,0.0,50.0,1.1
/fighter/Darrion-Caldwell-105431,darrion caldwell,The Wolf,19/12/1987,33.0,,"Rahway, New Jersey",United States,"5'10""",135 lbs,Sanford MMA,Bantamweight,15.0,2.0,6.0,7.0,,15.0,0.0,3.0,2.0,,The Wolf,10.0,1.0,0.0,177.8,61.23,,,,0.85,34.0,0.57,60.0,3.41,66.0,100.0,0.8
,darrius flowers,,,,,,,,,,,,,,,,,,,,,Beast Mode,12.0,6.0,1.0,175.26,77.11,180.34,Orthodox,1994-08-25,4.19,56.0,7.02,40.0,1.7,33.0,100.0,0.0
/fighter/Darryal-Griffin-209263,darryal griffin,D.J.,,,,"Lynnwood, Washington",United States,"5'11""",164 lbs,Catalyst Fight House,Welterweight,0.0,0.0,0.0,0.0,,0.0,1.0,0.0,0.0,,,,,,,,,,,,,,,,,,
/fighter/Darryl-Cobb-16031,darryl cobb,Devastating,04/08/1980,41.0,,"East St. Louis, Illinois",United States,"5'9""",185 lbs,Andre's MMA,Middleweight,6.0,3.0,0.0,3.0,,6.0,2.0,4.0,2.0,,,6.0,8.0,0.0,175.26,83.91,,,,0.0,0.0,0.0,0.0,0.0,0.0,0.0,0.0
,dashawn boatwright,,,,,,,,,,,,,,,,,,,,,"Buck, the 400-pound Silverback",3.0,1.0,0.0,182.88,92.99,,Orthodox,1988-02-29,0.0,0.0,52.5,12.0,0.0,0.0,0.0,0.0
/fighter/Dashon-Johnson-120663,dashon johnson,Fly Boy,25/01/1988,33.0,,"Escondido, California",United States,"5'9""",155 lbs,Team Xplode MMA,Lightweight,9.0,5.0,3.0,1.0,,9.0,0.0,2.0,0.0,,Flyboy,9.0,2.0,0.0,170.18,65.77,,Orthodox,1988-01-25,1.01,69.0,3.83,35.0,0.85,33.0,63.0,0.8
/fighter/Dave-Banguigui-210097,dave banguigui,Kintas,,,,Baguio City,Philippines,"5'6""",125 lbs,Fight Corps MMA,Flyweight,8.0,4.0,2.0,2.0,,8.0,0.0,0.0,1.0,,,,,,,,,,,,,,,,,,
/fighter/Dave-Beneteau-56,dave beneteau,Dangerous,16/07/1968,53.0,,"Windsor, Ontario",Canada,"6'2""",250 lbs,,Heavyweight,6.0,3.0,2.0,1.0,,6.0,1.0,4.0,0.0,,Dangerous,6.0,5.0,1.0,187.96,113.4,,Orthodox,,0.0,0.0,0.0,0.0,0.0,0.0,0.0,0.0
/fighter/Dave-Berry-143,dave berry,,,,,"Laconia, New Hampshire",United States,"0'0""",0 lbs,,,0.0,0.0,0.0,0.0,,0.0,1.0,0.0,0.0,,,0.0,1.0,0.0,,,,,,0.0,0.0,0.0,0.0,0.0,0.0,0.0,0.0
/fighter/Dave-Blattman-117577,dave blattman,,15/03/1991,30.0,,Ohio,United States,"0'0""",130 lbs,,Bantamweight,1.0,0.0,1.0,0.0,,1.0,1.0,2.0,0.0,,,,,,,,,,,,,,,,,,
,dave cochran,,,,,,,,,,,,,,,,,,,,,,26.0,29.0,1.0,167.64,70.31,,,,0.0,0.0,0.0,0.0,0.0,0.0,0.0,0.0
,dave courchaine,,,,,,,,,,,,,,,,,,,,,,20.0,7.0,0.0,172.72,77.11,,,,0.0,0.0,0.0,0.0,0.0,0.0,0.0,0.0
/fighter/Dave-Cryer-22798,dave cryer,,,,,"Norco, California",United States,"6'0""",185 lbs,Temple Fitness MMA,Middleweight,13.0,8.0,3.0,2.0,,13.0,3.0,0.0,1.0,,,,,,,,,,,,,,,,,,
,dave dalgliesh,,,,,,,,,,,,,,,,,,,,,,30.0,19.0,2.0,187.96,92.99,,Orthodox,1978-04-05,0.0,0.0,1.85,50.0,0.0,0.0,0.0,0.0
/fighter/Dave-Galera-93863,dave galera,Scarecrow,,,,"Baguio, Cordillera Administrative Region",Philippines,"5'11""",135 lbs,Lakay MMA,Bantamweight,5.0,2.0,3.0,0.0,,5.0,0.0,0.0,1.0,,Scarecrow,5.0,1.0,0.0,180.34,61.23,,Orthodox,1978-01-12,1.67,69.0,0.53,33.0,0.0,0.0,14.0,2.0
/fighter/Dave-Herman-19720,dave herman,,03/10/1984,36.0,,"Columbia City, Indiana",United States,"6'4""",223 lbs,Team Quest,Heavyweight,22.0,17.0,3.0,2.0,0.0,22.0,4.0,1.0,0.0,1.0,,22.0,6.0,0.0,193.04,109.77,195.58,Orthodox,1984-10-03,4.98,60.0,3.78,48.0,1.49,100.0,58.0,0.0
/fighter/Dave-Huckaba-16826,dave huckaba,Bad Man,01/06/1974,47.0,,"Sacramento, California",United States,"6'2""",260 lbs,Huckaba's Next Generation,Heavyweight,23.0,20.0,2.0,1.0,,23.0,5.0,2.0,2.0,,,,,,,,,,,,,,,,,,
/fighter/Dave-Jansen-25414,dave jansen,The Fugitive,21/08/1979,41.0,,"Corbett, Oregon",United States,"5'9""",156 lbs,Sports Lab,Lightweight,20.0,1.0,10.0,9.0,,20.0,0.0,0.0,4.0,,,20.0,4.0,0.0,175.26,70.31,185.42,Orthodox,1979-08-21,2.94,33.0,3.67,58.0,2.79,28.0,38.0,0.9
/fighter/Dave-Latoria-326457,dave latoria,,,,,,United States,"6'0""",265 lbs,,Heavyweight,0.0,0.0,0.0,0.0,,0.0,0.0,0.0,0.0,,,,,,,,,,,,,,,,,,
/fighter/Dave-Marfone-99551,dave marfone,Flexter,07/09/1986,34.0,,"New Hartford, New York",United States,"5'11""",170 lbs,Mohawk Valley MMA,Welterweight,5.0,3.0,1.0,1.0,,5.0,2.0,1.0,0.0,,,,,,,,,,,,,,,,,,
,dave martin,,,,,,,,,,,,,,,,,,,,,,0.0,2.0,0.0,182.88,92.99,,,,0.0,0.0,0.0,0.0,0.0,0.0,0.0,0.0
/fighter/Dave-Menne-245,dave menne,The Warrior,29/07/1974,47.0,,"Minneapolis, Minnesota",United States,"5'10""",185 lbs,Menne Combat Academy,Middleweight,45.0,6.0,19.0,20.0,,45.0,7.0,1.0,9.0,,The Warrior,45.0,17.0,2.0,177.8,77.11,,Orthodox,1974-07-29,1.84,44.0,1.99,42.0,0.46,50.0,57.0,2.5
/fighter/Dave-Morgan-83943,dave morgan,,22/06/1985,36.0,,"West Scranton, Pennsylvania",United States,"5'4""",126 lbs,,Flyweight,5.0,0.0,1.0,4.0,,5.0,1.0,5.0,2.0,,,,,,,,,,,,,,,,,,
,dave phillips,,,,,,,,,,,,,,,,,,,,,The Rockstar,13.0,7.0,0.0,182.88,83.91,,Orthodox,1980-01-12,0.0,0.0,2.0,25.0,0.0,0.0,0.0,10.0
,dave rickels,,,,,,,,,,,,,,,,,,,,,The Caveman,18.0,4.0,0.0,180.34,70.31,,,,4.29,59.0,5.53,42.0,0.0,0.0,25.0,0.0
/fighter/Dave-Roberts-220,dave roberts,,15/11/1977,43.0,,"Jacksonville, Florida",United States,"6'1""",203 lbs,,Light Heavyweight,5.0,2.0,3.0,0.0,,5.0,5.0,2.0,1.0,,,,,,,,,,,,,,,,,,
/fighter/Dave-Strasser-615,dave strasser,,13/07/1969,52.0,,"Kenosha, Wisconsin",United States,"5'10""",167 lbs,Freestyle Academy,Welterweight,25.0,10.0,9.0,6.0,,25.0,1.0,5.0,2.0,,,25.0,8.0,0.0,177.8,77.11,,Orthodox,1969-07-13,3.04,45.0,1.88,59.0,0.72,33.0,33.0,0.0
,dave terrel,,,,,,,,,,,,,,,,,,,,,The Bionic,7.0,7.0,0.0,172.72,77.11,,Southpaw,1978-05-10,2.62,43.0,2.8,48.0,3.28,38.0,100.0,0.0
/fighter/Dave-Vitkay-6166,dave vitkay,The A-Town Ogre,,,,"Atlanta, Georgia",United States,"6'0""",170 lbs,Knuckle Up,Welterweight,18.0,4.0,10.0,4.0,,18.0,9.0,2.0,2.0,,,,,,,,,,,,,,,,,,
,dave zitanick,,,,,,,,,,,,,,,,,,,,,,5.0,7.0,0.0,,77.11,,,,0.0,0.0,0.0,0.0,0.0,0.0,0.0,0.0
/fighter/Davey-Grant-30564,davey grant,Dangerous,18/12/1985,35.0,,Bishop Auckland,England,"5'8""",135 lbs,North East Top Team,Bantamweight,13.0,3.0,8.0,2.0,,13.0,0.0,4.0,1.0,,Dangerous,15.0,7.0,0.0,172.72,61.23,175.26,Orthodox,1985-12-18,4.77,42.0,3.82,55.0,1.26,41.0,61.0,0.2
,davi bittencourt,,,,,,,,,,,,,,,,,,,,,The Black,14.0,4.0,0.0,165.1,61.23,165.1,Orthodox,1994-10-12,4.15,66.0,1.51,46.0,14.15,33.0,0.0,0.0
/fighter/Davi-Ramos-101995,davi ramos,The Tasmanian Devil,05/11/1986,34.0,,"Rio de Janeiro, Rio de Janeiro",Brazil,"5'8""",155 lbs,Team Nogueira,Lightweight,10.0,1.0,7.0,2.0,,10.0,0.0,0.0,4.0,,Tasmanian Devil,10.0,4.0,0.0,167.64,70.31,177.8,Orthodox,1986-11-05,2.64,37.0,3.44,56.0,1.95,40.0,83.0,0.6
/fighter/David-Abbott-110,david abbott,Tank,26/04/1965,56.0,,"Huntington Beach, California",United States,"6'0""",250 lbs,,Heavyweight,10.0,7.0,2.0,1.0,,10.0,8.0,5.0,2.0,,Tank,10.0,15.0,0.0,182.88,120.2,,Switch,,1.35,30.0,3.55,38.0,1.07,33.0,66.0,0.0
/fighter/David-Abisror-267225,david abisror,Cobra,17/04/1994,27.0,,Ashdod,Israel,"5'7""",170 lbs,Abisror MMA,Welterweight,1.0,0.0,1.0,0.0,,1.0,0.0,0.0,0.0,,,,,,,,,,,,,,,,,,
/fighter/David-Allred-37108,david allred,Dangerous,,,,"Salt Lake City, Utah",United States,"5'11""",155 lbs,,Lightweight,11.0,2.0,8.0,1.0,,11.0,3.0,1.0,2.0,,,,,,,,,,,,,,,,,,
/fighter/David-Aranda-Santacana-55678,david aranda santacana,,01/11/1976,44.0,,Barcelona,Spain,"5'5""",135 lbs,CFC MMA,Bantamweight,9.0,0.0,8.0,1.0,,9.0,1.0,0.0,0.0,,,,,,,,,,,,,,,,,,
,david avellan,,,,,,,,,,,,,,,,,,,,,,2.0,1.0,0.0,175.26,83.91,,Orthodox,,3.33,25.0,10.0,57.0,0.0,0.0,0.0,0.0
/fighter/David-Baron-2860,david baron,,15/02/1973,48.0,,"Bois-Colombes, Hauts-de-Seine",France,"5'6""",169 lbs,Haute Tension,Welterweight,17.0,4.0,11.0,2.0,,17.0,0.0,2.0,2.0,,,17.0,4.0,1.0,167.64,70.31,,Switch,1973-02-15,1.17,30.0,2.1,56.0,0.0,0.0,14.0,0.7
,david barrios,,,,,,,,,,,,,,,,,,,,,,4.0,8.0,0.0,167.64,65.77,,,,0.0,0.0,0.0,0.0,0.0,0.0,0.0,0.0
/fighter/David-Bielkheden-3863,david bielkheden,,06/06/1979,42.0,,Stockholm,Sweden,"5'10""",170 lbs,Allstars Training Center,Welterweight,26.0,10.0,6.0,10.0,0.0,26.0,1.0,2.0,9.0,1.0,,24.0,12.0,0.0,177.8,70.31,180.34,Orthodox,1979-06-06,1.11,57.0,1.64,54.0,2.65,63.0,14.0,0.0
/fighter/David-Blanco-71628,david blanco,,,,,"San Jose, California",United States,"5'7""",144 lbs,Team Pedro MMA,Featherweight,2.0,0.0,0.0,2.0,,2.0,0.0,0.0,0.0,,,2.0,0.0,0.0,170.18,65.77,,,,0.0,0.0,0.0,0.0,0.0,0.0,0.0,0.0
/fighter/David-Branch-32431,david branch,,26/09/1981,39.0,,"Brooklyn, New York",United States,"6'1""",185 lbs,Renzo Gracie Jiu-Jitsu,Middleweight,22.0,6.0,7.0,9.0,,22.0,3.0,3.0,1.0,,,22.0,6.0,0.0,185.42,83.91,198.12,Orthodox,1981-09-26,1.66,39.0,1.91,56.0,2.55,32.0,43.0,0.0
/fighter/David-Conte-281211,david conte,,08/07/1985,36.0,,,United States,"0'0""",145 lbs,,Featherweight,0.0,0.0,0.0,0.0,,0.0,0.0,1.0,0.0,,,,,,,,,,,,,,,,,,
/fighter/David-Dodd-81,david dodd,,,,,"Mesa, Arizona",United States,"6'2""",205 lbs,Arizona Combat Sports,Light Heavyweight,4.0,0.0,4.0,0.0,,4.0,3.0,1.0,3.0,,,4.0,7.0,0.0,187.96,90.72,,Orthodox,1973-09-22,0.0,0.0,0.0,0.0,0.0,0.0,0.0,0.0
,david douglas,,,,,,,,,,,,,,,,,,,,,Tarzan,9.0,7.0,0.0,180.34,70.31,,,,0.0,0.0,0.0,0.0,0.0,0.0,0.0,0.0
/fighter/David-Duran-90547,david duran,Farmer of Destruction,16/01/1985,36.0,,"Whittier, California",United States,"5'6""",125 lbs,Total MMA Studios,Flyweight,8.0,4.0,0.0,4.0,,8.0,2.0,1.0,3.0,,,,,,,,,,,,,,,,,,
/fighter/David-Dvorak-67185,david dvorak,The Undertaker,05/06/1992,29.0,,Hradec Kralove,Czech Republic,"5'5""",125 lbs,All Sports Academy,Flyweight,20.0,8.0,8.0,4.0,,20.0,1.0,0.0,2.0,,Undertaker,20.0,6.0,0.0,165.1,56.7,172.72,Orthodox,1992-06-05,3.48,43.0,3.29,59.0,0.58,30.0,70.0,0.2
/fighter/David-Garcia-188269,david garcia,,13/03/1994,27.0,,"La Grange, Illinois",United States,"5'8""",135 lbs,Top Notch MMA,Bantamweight,5.0,2.0,3.0,0.0,,5.0,1.0,2.0,0.0,,,,,,,,,,,,,,,,,,
,david gardner,,,,,,,,,,,,,,,,,,,,,,18.0,21.0,0.0,180.34,70.31,,Orthodox,1977-05-17,0.17,100.0,0.34,0.0,0.0,0.0,66.0,0.0
/fighter/David-Gomez-34185,david gomez,,08/11/1980,40.0,,"Rancho Cucamonga, California",United States,"6'0""",185 lbs,Shark Tank,Middleweight,17.0,9.0,1.0,7.0,,17.0,5.0,2.0,3.0,,,1.0,2.0,0.0,,70.31,,,,0.0,0.0,0.0,0.0,0.0,0.0,0.0,0.0
/fighter/David-Hammons-122797,david hammons,,22/05/1990,31.0,,"El Dorado Springs, Missouri",United States,"6'4""",262 lbs,,Heavyweight,1.0,0.0,1.0,0.0,,1.0,4.0,0.0,0.0,,,,,,,,,,,,,,,,,,
/fighter/David-Harris-45879,david harris,Bo,08/10/1981,39.0,,"Mount Clemens, Michigan",United States,"5'5""",135 lbs,Michigan Top Team,Bantamweight,7.0,2.0,2.0,3.0,,7.0,2.0,5.0,3.0,,,,,,,,,,,,,,,,,,
/fighter/David-Heath-11483,david heath,The Headhunter,02/10/1976,44.0,,"Tulsa, Oklahoma",United States,"5'11""",203 lbs,Absolute Combat Alliance,Light Heavyweight,18.0,7.0,8.0,3.0,,18.0,1.0,3.0,3.0,,,18.0,7.0,0.0,180.34,92.99,182.88,Orthodox,1976-02-10,1.48,30.0,5.16,49.0,0.33,50.0,57.0,1.0
,david hood,,,,,,,,,,,,,,,,,,,,,,1.0,3.0,0.0,182.88,90.72,,,,0.0,0.0,0.0,0.0,0.0,0.0,0.0,0.0
,david hulett,,,,,,,,,,,,,,,,,,,,,Hollywood,22.0,10.0,0.0,177.8,77.11,,,,0.0,0.0,0.0,0.0,0.0,0.0,0.0,0.0
/fighter/David-Kaplan-13848,david kaplan,Diamond,16/11/1979,41.0,,"Las Vegas, Nevada",United States,"5'6""",155 lbs,Team Tompkins,Lightweight,3.0,2.0,1.0,0.0,,3.0,1.0,2.0,1.0,,Diamond,3.0,4.0,0.0,170.18,70.31,,Orthodox,1979-11-16,2.88,46.0,4.32,67.0,4.88,43.0,0.0,0.7
/fighter/David-Khalsa-248651,david khalsa,Demolition Man,,,,Kidderminster,England,"0'0""",145 lbs,,Featherweight,2.0,0.0,1.0,1.0,,2.0,4.0,1.0,1.0,,,,,,,,,,,,,,,,,,
/fighter/David-Lee-6945,david lee,,,,,"London, Greater London",England,"5'11""",145 lbs,Team Crossface,Featherweight,12.0,0.0,12.0,0.0,,12.0,3.0,6.0,1.0,,,12.0,10.0,0.0,177.8,70.31,,Orthodox,,1.49,50.0,3.31,42.0,0.0,0.0,50.0,0.0
/fighter/David-Levicki-28,david levicki,,,,,"Orem, Utah",United States,"6'5""",290 lbs,,Super Heavyweight,1.0,1.0,0.0,0.0,,1.0,2.0,0.0,1.0,,,1.0,3.0,0.0,195.58,124.74,,,,0.0,0.0,0.0,0.0,0.0,0.0,0.0,0.0
/fighter/David-Loiseau-903,david loiseau,The Crow,17/12/1979,41.0,,"Montreal, Quebec",Canada,"6'0""",192 lbs,Tristar Gym,Light Heavyweight,23.0,15.0,3.0,5.0,,23.0,2.0,2.0,7.0,,The Crow,23.0,11.0,0.0,182.88,83.91,193.04,Orthodox,1979-12-17,1.59,44.0,3.64,43.0,0.43,42.0,36.0,0.1
/fighter/David-Malka-350529,david malka,,19/02/2001,20.0,,Kiryat Ono,Israel,"0'0""",170 lbs,,Welterweight,0.0,0.0,0.0,0.0,,0.0,2.0,0.0,0.0,,,,,,,,,,,,,,,,,,
,david marshall,,,,,,,,,,,,,,,,,,,,,,8.0,4.0,0.0,187.96,77.11,,,,0.0,0.0,0.0,0.0,0.0,0.0,0.0,0.0
/fighter/David-Meak-108787,david meak,,,,,,Australia,"0'0""",145 lbs,Chau Kaizen,Featherweight,1.0,0.0,1.0,0.0,,1.0,2.0,2.0,1.0,,,,,,,,,,,,,,,,,,
/fighter/David-Mejia-18262,david mejia,The Freight Train,,,,"Wilmington, North Carolina",United States,"5'11""",265 lbs,NC3 Athletics,Heavyweight,5.0,5.0,0.0,0.0,,5.0,0.0,0.0,0.0,,,,,,,,,,,,,,,,,,
/fighter/David-Meshkhoradze-302803,david meshkhoradze,,,,,New York,United States,"0'0""",170 lbs,,Welterweight,0.0,0.0,0.0,0.0,,0.0,0.0,0.0,1.0,,,,,,,,,,,,,,,,,,
/fighter/David-Michaud-53778,david michaud,Bulldawg,10/11/1988,32.0,,"Brookings, South Dakota",United States,"5'9""",170 lbs,MMA Lab,Welterweight,18.0,9.0,5.0,4.0,,18.0,3.0,1.0,2.0,,BullDawg,11.0,3.0,0.0,175.26,70.31,,Orthodox,1988-11-10,3.25,43.0,4.45,54.0,2.53,58.0,77.0,0.7
/fighter/David-Mitchell-16830,david mitchell,Bulletproof,24/10/1979,41.0,,"Windsor, California",United States,"6'0""",185 lbs,Team Alpha Male,Middleweight,22.0,2.0,17.0,3.0,,22.0,3.0,0.0,4.0,,Daudi,22.0,7.0,0.0,182.88,77.11,190.5,Orthodox,1979-10-24,1.74,32.0,2.06,55.0,0.66,50.0,29.0,2.0
/fighter/David-Mundell-161205,david mundell,Redneck,01/08/1991,30.0,,"Clearwater, Florida",United States,"5'9""",185 lbs,Team Bamboo,Middleweight,10.0,2.0,1.0,7.0,,10.0,3.0,1.0,1.0,,,,,,,,,,,,,,,,,,
,david onama,,,,,,,,,,,,,,,,,,,,,,11.0,2.0,0.0,180.34,65.77,187.96,Orthodox,1994-06-07,5.38,46.0,5.48,51.0,0.87,18.0,45.0,0.3
/fighter/David-Overfield-21829,david overfield,,,,,"Evansville, Indiana",United States,"0'0""",160 lbs,Big Bully Martial Arts,Welterweight,6.0,1.0,5.0,0.0,,6.0,3.0,0.0,0.0,,,,,,,,,,,,,,,,,,
/fighter/David-Pacheco-312479,david pacheco,Dynamite,08/06/1991,30.0,,Kentucky,United States,"5'8""",155 lbs,,Lightweight,1.0,1.0,0.0,0.0,,1.0,0.0,0.0,1.0,,,,,,,,,,,,,,,,,,
/fighter/David-Ramirez-205443,david ramirez,,,,,"Austin, Texas",United States,"0'0""",155 lbs,,Lightweight,0.0,0.0,0.0,0.0,,0.0,0.0,0.0,1.0,,,,,,,,,,,,,,,,,,
/fighter/David-Rangel-247375,david rangel,The Kid,,,,"Ontario, Oregon",United States,"5'7""",170 lbs,Time and Distance Muay Thai,Welterweight,0.0,0.0,0.0,0.0,,0.0,0.0,2.0,0.0,,,,,,,,,,,,,,,,,,
,david rasouri,,,,,,,,,,,,,,,,,,,,,,2.0,3.0,0.0,170.18,70.31,,,,0.0,0.0,0.0,0.0,0.0,0.0,0.0,0.0
/fighter/David-Rickels-36198,david rickels,The Caveman,05/01/1989,32.0,,"Derby, Kansas",United States,"5'11""",170 lbs,Janjira Muay Thai,Welterweight,21.0,7.0,6.0,8.0,,21.0,4.0,1.0,1.0,,,,,,,,,,,,,,,,,,
/fighter/David-Rivera-252663,david rivera,,09/11/1991,29.0,,"Turlock, California",United States,"5'8""",135 lbs,Turlock Academy of Martial Arts,Bantamweight,0.0,0.0,0.0,0.0,,0.0,1.0,3.0,0.0,,,,,,,,,,,,,,,,,,
,david roberts,,,,,,,,,,,,,,,,,,,,,,5.0,8.0,0.0,185.42,77.11,,Orthodox,1975-11-15,0.0,0.0,0.0,0.0,0.0,0.0,0.0,0.0
/fighter/David-Sharp-98311,david sharp,,05/01/1981,40.0,,"Pacific, Missouri",United States,"6'3""",265 lbs,,Heavyweight,2.0,1.0,1.0,0.0,,2.0,0.0,0.0,0.0,,,,,,,,,,,,,,,,,,
/fighter/David-Shepherd-23201,david shepherd,,17/09/1980,40.0,,"Grayling, Michigan",United States,"6'0""",155 lbs,Galer World MMA,Lightweight,5.0,0.0,5.0,0.0,,5.0,2.0,1.0,1.0,,,,,,,,,,,,,,,,,,
,david smith,,,,,,,,,,,,,,,,,,,,,,5.0,1.0,0.0,,70.31,,,,0.0,0.0,0.0,0.0,0.0,0.0,0.0,0.0
/fighter/David-Terrell-536,david terrell,The Soul Assassin,09/01/1978,43.0,,California,USA,"6'0""",185 lbs,Cesar Gracie Jiu-Jitsu,Middleweight,6.0,2.0,4.0,0.0,,6.0,1.0,0.0,1.0,,The Soul Assassin,6.0,2.0,0.0,185.42,83.91,,Southpaw,1978-01-09,2.34,63.0,2.71,37.0,5.54,50.0,0.0,5.5
/fighter/David-Teymur-163937,david teymur,,01/05/1989,32.0,,Stockholm,Sweden,"5'9""",155 lbs,Allstars Training Center,Lightweight,8.0,4.0,0.0,4.0,,8.0,0.0,1.0,1.0,,,8.0,2.0,0.0,175.26,70.31,185.42,Southpaw,1989-05-01,4.69,43.0,3.53,55.0,0.94,33.0,77.0,0.0
/fighter/David-Velasquez-243,david velasquez,Little,,,,"San Jose, California",United States,"5'5""",145 lbs,American Kickboxing Academy,Featherweight,10.0,3.0,5.0,2.0,0.0,10.0,3.0,3.0,3.0,1.0,Little,10.0,10.0,0.0,165.1,65.77,,Orthodox,,0.0,0.0,0.0,0.0,0.0,0.0,0.0,0.0
/fighter/David-Zawada-72910,david zawada,Sagat,01/08/1990,31.0,,Dusseldorf,Germany,"6'0""",170 lbs,UFD Gym,Welterweight,17.0,11.0,4.0,2.0,,17.0,2.0,1.0,3.0,,Sagat,17.0,7.0,0.0,182.88,77.11,190.5,Orthodox,1990-08-01,3.84,41.0,4.54,55.0,0.97,33.0,57.0,1.7
/fighter/Davie-McLaughlin-181849,davie mclaughlin,,,,,"Hebburn, Tyne and Wear",England,"0'0""",155 lbs,South Shields Fight Factory,Lightweight,1.0,1.0,0.0,0.0,,1.0,1.0,1.0,0.0,,,,,,,,,,,,,,,,,,
/fighter/Davin-Clark-19714,davin clark,Relentless,11/01/1982,39.0,,"San Jose, California",United States,"6'2""",185 lbs,American Kickboxing Academy,Middleweight,6.0,2.0,1.0,3.0,,6.0,1.0,2.0,0.0,,,,,,,,,,,,,,,,,,
/fighter/Davion-Franklin-349017,davion franklin,All Day,21/06/1994,27.0,,Oklahoma,United States,"6'2""",265 lbs,Jackson-Wink MMA,Heavyweight,3.0,2.0,0.0,1.0,,3.0,0.0,0.0,0.0,,,,,,,,,,,,,,,,,,
/fighter/Dawna-Aung-201691,dawna aung,,14/02/1981,40.0,,"Hlaingbwe Township, Kayin State",Myanmar,"5'8""",155 lbs,A Phyu Yaung Thway Thit,Lightweight,0.0,0.0,0.0,0.0,,0.0,1.0,0.0,0.0,,,,,,,,,,,,,,,,,,
/fighter/Dawond-Pickney-168561,dawond pickney,,02/07/1978,43.0,,"Hot Springs, Arkansas",United States,"5'10""",155 lbs,,Lightweight,17.0,7.0,0.0,10.0,,17.0,4.0,8.0,2.0,,,,,,,,,,,,,,,,,,
/fighter/Dayana-Silva-38831,dayana silva,,17/08/1990,30.0,,"Nova Iguacu, Rio de Janeiro",Brazil,"5'7""",145 lbs,Nova Uniao,Featherweight,9.0,2.0,0.0,7.0,,9.0,2.0,0.0,5.0,,,7.0,4.0,0.0,170.18,61.23,,Orthodox,1990-08-27,6.33,51.0,5.93,57.0,0.0,0.0,42.0,0.0
,dean barry,,,,,,,,,,,,,,,,,,,,,The Sniper,4.0,2.0,0.0,177.8,77.11,182.88,Orthodox,1992-07-03,9.31,40.0,4.66,51.0,0.0,0.0,100.0,0.0
/fighter/Dean-Garnett-60927,dean garnett,,25/07/1988,33.0,,"Liverpool, Merseyside",England,"5'6""",136 lbs,Team McHale,Bantamweight,9.0,1.0,5.0,3.0,,9.0,0.0,2.0,0.0,,,,,,,,,,,,,,,,,,
/fighter/Dean-Hancock-191227,dean hancock,The Hammer,,,,"Danbury, Connecticut",United States,"5'9""",155 lbs,Teixeira MMA & Fitness,Lightweight,4.0,3.0,1.0,0.0,,4.0,2.0,2.0,0.0,,The Hammer,2.0,1.0,0.0,,70.31,,,,7.97,63.0,1.94,67.0,1.71,33.0,75.0,1.7
/fighter/Dean-Lister-338,dean lister,The Boogeyman,13/02/1976,45.0,,"San Diego, California",United States,"6'1""",185 lbs,Victory MMA,Middleweight,13.0,0.0,11.0,2.0,,13.0,0.0,0.0,7.0,,The Boogeyman,13.0,7.0,0.0,185.42,83.91,190.5,Orthodox,1976-02-13,1.26,35.0,1.89,61.0,1.58,15.0,50.0,1.1
/fighter/DeAnna-Bennett-75456,deanna bennett,Vitamin D,18/11/1984,36.0,,"Orem, Utah",United States,"5'4""",126 lbs,The Pit Elevated Fight Team,Flyweight,10.0,2.0,2.0,6.0,,10.0,1.0,2.0,4.0,,The Argentine Assassin,8.0,3.0,1.0,162.56,56.7,172.72,Orthodox,1984-11-18,3.13,58.0,3.27,58.0,0.0,0.0,0.0,1.0
/fighter/Deborah-Kouzmin-285557,deborah kouzmin,The Punisher From Paris,,,,"Dallas, Texas",United States,"5'3""",135 lbs,Fortis MMA,Bantamweight,2.0,0.0,0.0,2.0,,2.0,0.0,0.0,1.0,,,,,,,,,,,,,,,,,,
/fighter/Deiveson-Figueiredo-110485,deiveson figueiredo,Daico / Deus da Guerra,18/12/1987,33.0,,"Soure, Para",Brazil,"5'5""",125 lbs,Figueiredo Team,Flyweight,20.0,9.0,8.0,3.0,,20.0,0.0,1.0,1.0,,Deus da Guerra,22.0,3.0,1.0,165.1,61.23,172.72,Orthodox,1987-12-18,3.08,55.0,3.46,51.0,1.65,44.0,58.0,1.6
/fighter/Deividas-Taurosevicius-5729,deividas taurosevicius,Taurus,28/08/1977,43.0,,"Long Island, New York",United States,"5'9""",146 lbs,Taurus MMA,Featherweight,17.0,0.0,13.0,4.0,,17.0,0.0,0.0,5.0,,,17.0,5.0,0.0,175.26,65.77,172.72,Southpaw,1977-08-28,2.13,43.0,1.82,59.0,2.0,28.0,50.0,0.3
/fighter/Dejdamrong-Sor-Amnuaysirichoke-168471,dejdamrong sor amnuaysirichoke,Kru Rong,07/11/1978,42.0,,Trang,Thailand,"5'3""",115 lbs,Evolve MMA,Strawweight,11.0,6.0,3.0,2.0,,11.0,2.0,2.0,2.0,,,,,,,,,,,,,,,,,,
,del hawkins,,,,,,,,,,,,,,,,,,,,,The Filipino Delight,22.0,17.0,0.0,165.1,61.23,,Orthodox,,1.15,27.0,2.01,46.0,0.0,0.0,0.0,0.0
/fighter/Deligerihu-Liu-255773,deligerihu liu,The Little Squirrel,,,,,China,"0'0""",125 lbs,,Flyweight,3.0,1.0,0.0,2.0,,3.0,2.0,1.0,0.0,,,,,,,,,,,,,,,,,,
/fighter/Delson-Heleno-5434,delson heleno,Pe de Chumbo,16/11/1977,43.0,,"Teresopolis, Rio de Janeiro",Brazil,"5'11""",170 lbs,CM System,Welterweight,30.0,4.0,14.0,12.0,0.0,30.0,7.0,1.0,2.0,1.0,Pe De Chumbo,29.0,10.0,0.0,180.34,83.91,,Orthodox,1977-11-16,0.69,75.0,4.83,19.0,0.0,0.0,0.0,0.0
/fighter/DeMarco-Villalona-62588,demarco villalona,,27/09/1986,34.0,,"San Jose, California",United States,"5'9""",185 lbs,Nor Cal Fight Factory,Middleweight,2.0,2.0,0.0,0.0,,2.0,3.0,1.0,0.0,,,1.0,3.0,0.0,175.26,83.91,,,,0.0,0.0,0.0,0.0,0.0,0.0,0.0,0.0
/fighter/DeMarcus-Brown-173729,demarcus brown,Bang 'Em Up,30/08/1990,30.0,,"Murrieta, California",United States,"5'9""",145 lbs,Fight Syndicate,Featherweight,6.0,3.0,1.0,2.0,,6.0,2.0,6.0,1.0,,,,,,,,,,,,,,,,,,
/fighter/DeMarcus-Simmons-264305,demarcus simmons,,,,,"Enid, Oklahoma",United States,"5'11""",190 lbs,,Light Heavyweight,0.0,0.0,0.0,0.0,,0.0,0.0,3.0,0.0,,,,,,,,,,,,,,,,,,
/fighter/Demario-Cade-137643,demario cade,The Dangerous Man,10/06/1992,29.0,,"Fort Smith, Arkansas",United States,"5'3""",135 lbs,,Bantamweight,3.0,1.0,2.0,0.0,,3.0,1.0,2.0,1.0,,,,,,,,,,,,,,,,,,
/fighter/Demarques-Jackson-175589,demarques jackson,Scrap Iron,22/08/1990,30.0,,"Lithonia, Georgia",United States,"5'8""",155 lbs,Sanford MMA,Lightweight,11.0,2.0,5.0,4.0,,11.0,3.0,0.0,3.0,,,,,,,,,,,,,,,,,,
/fighter/Demetrious-Johnson-45452,demetrious johnson,Mighty Mouse,13/08/1986,34.0,,"Kirkland, Washington",United States,"5'3""",135 lbs,AMC Pankration,Bantamweight,30.0,5.0,12.0,13.0,,30.0,1.0,0.0,3.0,,Mighty Mouse,27.0,3.0,1.0,160.02,56.7,167.64,Orthodox,1986-08-13,3.43,54.0,1.66,67.0,3.35,56.0,65.0,0.5
,demetrius gioulacos,,,,,,,,,,,,,,,,,,,,,,0.0,1.0,0.0,180.34,83.91,,,,0.0,0.0,0.0,0.0,0.0,0.0,0.0,0.0
/fighter/Demetrius-Plaza-289025,demetrius plaza,Demi God,,,,"Wappingers, New York",United States,"0'0""",170 lbs,Black Hole Jiu Jitsu,Welterweight,1.0,0.0,0.0,1.0,,1.0,0.0,1.0,0.0,,,,,,,,,,,,,,,,,,
/fighter/Demetrius-Richards-41379,demetrius richards,D-MO-lition,21/01/1975,46.0,,"Omaha, Nebraska",United States,"6'2""",205 lbs,MidAmerica Martial Arts,Light Heavyweight,5.0,2.0,3.0,0.0,,5.0,2.0,6.0,0.0,,,,,,,,,,,,,,,,,,
/fighter/Demi-Deeds-4314,demi deeds,,07/08/1984,37.0,,"Des Moines, Iowa",United States,"5'7""",155 lbs,Victory MMA,Lightweight,18.0,11.0,6.0,0.0,1.0,18.0,6.0,5.0,0.0,0.0,,,,,,,,,,,,,,,,,
/fighter/Demian-Maia-14637,demian maia,,06/11/1977,43.0,,"Santana de Parnaiba, Sao Paulo",Brazil,"6'0""",170 lbs,Demian Maia Jiu-Jitsu,Welterweight,28.0,3.0,14.0,11.0,,28.0,2.0,0.0,9.0,,,28.0,11.0,0.0,185.42,77.11,182.88,Southpaw,1977-11-06,1.8,43.0,2.07,63.0,2.49,24.0,61.0,1.0
/fighter/Denice-Zamboanga-276287,denice zamboanga,The Menace,14/01/1997,24.0,,"Quezon City, Quezon",Philippines,"5'2""",115 lbs,Tough Guys International,Strawweight,6.0,1.0,3.0,2.0,,6.0,0.0,0.0,0.0,,,,,,,,,,,,,,,,,,
/fighter/Denis-Kang-935,denis kang,,17/09/1977,43.0,,"Vancouver, British Columbia",Canada,"5'11""",185 lbs,American Top Team,Middleweight,35.0,15.0,14.0,6.0,,35.0,6.0,8.0,2.0,,,35.0,16.0,2.0,180.34,83.91,195.58,Orthodox,1977-09-17,2.27,35.0,1.65,67.0,2.51,65.0,38.0,1.2
/fighter/Denis-Palancica-246663,denis palancica,,03/08/1996,25.0,,,Moldova,"5'8""",135 lbs,Aurora MMA,Bantamweight,8.0,3.0,3.0,2.0,,8.0,0.0,0.0,0.0,,,,,,,,,,,,,,,,,,
/fighter/Denis-Puric-39679,denis puric,The Bosnian Menice,,,,"Ohsweken, Ontario",Canada,"5'5""",136 lbs,Iron Tiger Muay Thai,Bantamweight,8.0,4.0,2.0,2.0,0.0,8.0,0.0,3.0,1.0,1.0,,,,,,,,,,,,,,,,,
,denis sobolev,,,,,,,,,,,,,,,,,,,,,,4.0,7.0,0.0,190.5,97.98,,Orthodox,,0.0,0.0,5.45,33.0,0.0,0.0,0.0,0.0
/fighter/Denis-Stojnic-12955,denis stojnic,The Menace,02/02/1980,41.0,,Sarajevo,Bosnia and Herzegovina,"6'0""",282 lbs,Golden Glory,Super Heavyweight,14.0,5.0,5.0,4.0,,14.0,1.0,1.0,1.0,,,13.0,3.0,0.0,182.88,111.13,,Orthodox,1980-02-02,1.51,23.0,6.06,36.0,0.0,0.0,80.0,1.0
,denis tiuliulin,,,,,,,,,,,,,,,,,,,,,,10.0,9.0,0.0,185.42,83.91,195.58,Orthodox,1988-05-17,4.5,41.0,6.15,36.0,0.0,0.0,73.0,0.0
,denise gomes,,,,,,,,,,,,,,,,,,,,,Dee,8.0,3.0,0.0,157.48,52.16,160.02,Orthodox,1999-12-30,4.81,48.0,3.66,49.0,1.13,33.0,47.0,0.8
/fighter/Denise-Kielholtz-211003,denise kielholtz,Miss Dynamite,30/03/1989,32.0,,Amsterdam,Netherlands,"5'3""",125 lbs,Sports Academy Schreiber,Flyweight,6.0,2.0,3.0,1.0,,6.0,0.0,2.0,1.0,,,,,,,,,,,,,,,,,,
/fighter/Dennis-Bermudez-58065,dennis bermudez,The Menace,13/12/1986,34.0,,"Saugerties, New York",United States,"5'6""",145 lbs,Long Island MMA,Featherweight,17.0,4.0,3.0,10.0,,17.0,2.0,4.0,3.0,,The Menace,17.0,9.0,0.0,167.64,70.31,167.64,Orthodox,1986-12-13,4.42,46.0,3.07,59.0,3.89,40.0,82.0,1.1
,dennis bryant,,,,,,,,,,,,,,,,,,,,,The Beard,5.0,2.0,0.0,182.88,92.99,,Orthodox,1985-10-18,10.56,59.0,10.56,13.0,0.0,0.0,0.0,0.0
/fighter/Dennis-Buzukja-286225,dennis buzukja,The Great,01/10/1997,23.0,,"New York, New York",United States,"5'11""",145 lbs,Longo and Weidman MMA,Featherweight,5.0,2.0,0.0,3.0,,5.0,0.0,0.0,2.0,,The Great,8.0,4.0,0.0,175.26,65.77,177.8,Switch,1997-10-01,3.3,43.0,4.93,40.0,0.98,30.0,73.0,0.3
,dennis dombrow,,,,,,,,,,,,,,,,,,,,,,7.0,5.0,0.0,,65.77,,,,0.0,0.0,0.0,0.0,0.0,0.0,0.0,0.0
/fighter/Dennis-Hallman-275,dennis hallman,Superman,02/12/1975,45.0,,"Yelm, Washington",United States,"5'9""",181 lbs,Victory Athletics,Middleweight,53.0,5.0,40.0,7.0,1.0,53.0,11.0,0.0,9.0,0.0,Superman,53.0,20.0,2.0,175.26,70.31,182.88,Orthodox,1975-12-02,1.12,44.0,1.96,43.0,1.79,30.0,25.0,2.1
/fighter/Dennis-Olson-20303,dennis olson,The Menace,,,,"Amherst, New Hampshire",United States,"6'0""",170 lbs,Team Triumph,Welterweight,14.0,1.0,9.0,4.0,,14.0,6.0,3.0,3.0,,,14.0,11.0,0.0,182.88,77.11,,,,1.02,42.0,5.27,38.0,2.77,40.0,0.0,0.0
,dennis reed,,,,,,,,,,,,,,,,,,,,,,45.0,62.0,1.0,,92.99,,Orthodox,,0.0,0.0,0.0,0.0,0.0,0.0,0.0,0.0
/fighter/Dennis-Siver-9817,dennis siver,,13/01/1979,42.0,,Mannheim,Germany,"5'7""",145 lbs,Kiboju,Featherweight,23.0,7.0,7.0,9.0,,23.0,3.0,5.0,3.0,,,23.0,11.0,0.0,167.64,65.77,177.8,Orthodox,1979-01-13,3.87,32.0,2.67,65.0,0.87,32.0,65.0,0.3
,denys bondar,,,,,,,,,,,,,,,,,,,,,Psycho,16.0,5.0,0.0,167.64,56.7,175.26,Orthodox,1992-06-27,4.89,45.0,6.42,56.0,2.75,50.0,62.0,0.0
/fighter/Dequan-Townsend-91563,dequan townsend,The Tarantula,11/05/1986,35.0,,"Lansing, Michigan",United States,"6'3""",185 lbs,Murcielago MMA,Middleweight,21.0,12.0,5.0,4.0,,21.0,2.0,1.0,9.0,,The Tarantula,21.0,12.0,0.0,190.5,92.99,200.66,Orthodox,1986-05-11,1.23,34.0,3.92,38.0,0.0,0.0,46.0,0.0
/fighter/Deray-Davis-26498,deray davis,,30/10/1982,38.0,,"Gary, Indiana",United States,"6'0""",170 lbs,Team Corral,Welterweight,8.0,2.0,3.0,3.0,,8.0,2.0,1.0,1.0,,,,,,,,,,,,,,,,,,
/fighter/Derek-Anderson-83421,derek anderson,The Barbaric,20/02/1990,31.0,,"San Diego, California",United States,"6'0""",175 lbs,Team Xplode MMA,Middleweight,17.0,6.0,6.0,5.0,,17.0,1.0,1.0,2.0,,Barbaric,14.0,3.0,0.0,182.88,70.31,,,,3.97,37.0,3.08,61.0,0.34,14.0,60.0,0.0
/fighter/Derek-Arcement-23013,derek arcement,,,,,"Carriere, Louisiana",United States,"5'10""",145 lbs,Gold Dragon MMA,Featherweight,3.0,0.0,2.0,1.0,,3.0,1.0,1.0,2.0,,,,,,,,,,,,,,,,,,
/fighter/Derek-Bohi-81033,derek bohi,Marshmallow,09/12/1979,41.0,,"Kansas City, Missouri",United States,"6'4""",264 lbs,Broken Smile Fight Team,Heavyweight,8.0,5.0,3.0,0.0,,8.0,4.0,1.0,0.0,,Marshmallow,8.0,5.0,0.0,193.04,117.93,,,,0.0,0.0,0.0,0.0,0.0,0.0,0.0,0.0
/fighter/Derek-Brunson-68494,derek brunson,,04/01/1984,37.0,,"Wilmington, North Carolina",United States,"6'1""",186 lbs,Sanford MMA,Middleweight,22.0,12.0,3.0,7.0,,22.0,5.0,0.0,2.0,,The One,23.0,9.0,0.0,185.42,83.91,195.58,Southpaw,1984-01-04,3.51,47.0,3.05,51.0,3.14,33.0,85.0,0.6
/fighter/Derek-Campos-42543,derek campos,The Stallion,01/04/1988,33.0,,"Lubbock, Texas",United States,"5'9""",145 lbs,Mohler MMA,Featherweight,20.0,6.0,5.0,9.0,,20.0,4.0,4.0,3.0,,The Stallion,19.0,6.0,0.0,175.26,70.31,,,,2.41,23.0,10.34,44.0,0.0,0.0,0.0,0.0
/fighter/Derek-Downey-12234,derek downey,The Gentleman,27/04/1980,41.0,,"Orem, Utah",United States,"6'2""",185 lbs,Victory MMA,Middleweight,11.0,5.0,5.0,1.0,,11.0,1.0,2.0,1.0,,,11.0,4.0,0.0,185.42,83.91,,Orthodox,1980-04-27,0.32,100.0,3.36,12.0,2.4,16.0,0.0,0.0
,derek getzel,,,,,,,,,,,,,,,,,,,,,The Pretzel,8.0,5.0,0.0,182.88,70.31,,,,0.0,0.0,0.0,0.0,0.0,0.0,0.0,0.0
/fighter/Derek-Loffer-96807,derek loffer,The Cedar Rapids Psycho,09/02/1988,33.0,,"Cedar Rapids, Iowa",United States,"5'9""",190 lbs,Down to Fight MMA,Light Heavyweight,10.0,6.0,3.0,1.0,,10.0,2.0,2.0,1.0,,,,,,,,,,,,,,,,,,
/fighter/Derek-Palmer-205489,derek palmer,,06/09/1987,33.0,,"Oklahoma City, Oklahoma",United States,"5'9""",194 lbs,,Light Heavyweight,0.0,0.0,0.0,0.0,0.0,0.0,1.0,0.0,0.0,1.0,,,,,,,,,,,,,,,,,
/fighter/Derek-Wilson-253699,derek wilson,D.J.,03/06/1988,33.0,,"Atlanta, Georgia",United States,"0'0""",190 lbs,,Light Heavyweight,2.0,1.0,0.0,1.0,,2.0,2.0,0.0,2.0,,,,,,,,,,,,,,,,,,
/fighter/Derigun-Yi-329241,derigun yi,The Villain on the Prairie,,,,Beijing,China,"0'0""",155 lbs,Hunters League Fighting Club,Lightweight,1.0,1.0,0.0,0.0,,1.0,1.0,1.0,0.0,,,,,,,,,,,,,,,,,,
/fighter/Deron-Carlis-105065,deron carlis,The Pharaoh,01/10/1986,34.0,,"Overland Park, Kansas",United States,"5'5""",161 lbs,American Top Team HD,Welterweight,7.0,2.0,5.0,0.0,,7.0,1.0,3.0,2.0,,,,,,,,,,,,,,,,,,
/fighter/Deron-Winn-248699,deron winn,,13/06/1989,32.0,,"Liberty, Missouri",United States,"5'6""",195 lbs,American Kickboxing Academy,Light Heavyweight,7.0,4.0,0.0,3.0,,7.0,0.0,1.0,1.0,,,7.0,3.0,0.0,167.64,83.91,177.8,Orthodox,1989-06-13,4.55,44.0,6.21,46.0,4.28,52.0,40.0,0.0
,derrick,,,,,,,,,,,,,,,,,,,,,,,,,,,,,,,,,,,,,
/fighter/Derrick-Adkins-127741,derrick adkins,A-Game,12/12/1989,31.0,,"Edmond, Oklahoma",United States,"5'11""",162 lbs,American Elite MMA,Welterweight,10.0,0.0,5.0,5.0,,10.0,2.0,1.0,3.0,,,,,,,,,,,,,,,,,,
,derrick burnsed,,,,,,,,,,,,,,,,,,,,,,1.0,0.0,3.0,,70.31,,,,0.0,0.0,0.0,0.0,0.0,0.0,0.0,0.0
/fighter/Derrick-Kennington-24022,derrick kennington,DK,18/05/1983,38.0,,"Belmar, New Jersey",United States,"6'0""",154 lbs,Pellegrino MMA,Lightweight,13.0,4.0,8.0,1.0,,13.0,5.0,4.0,2.0,,,,,,,,,,,,,,,,,,
/fighter/Derrick-Krantz-35518,derrick krantz,D-Rock,13/01/1988,33.0,,"Marshall, Texas",United States,"5'10""",170 lbs,Team 515,Welterweight,25.0,11.0,11.0,3.0,,25.0,3.0,5.0,4.0,,D-Rock,22.0,12.0,0.0,177.8,77.11,182.88,Orthodox,1988-01-13,2.07,37.0,4.03,50.0,3.18,50.0,0.0,0.8
/fighter/Derrick-Lewis-59284,derrick lewis,The Black Beast,07/02/1985,36.0,,"Houston, Texas",United States,"6'3""",265 lbs,Grind House Fitness,Heavyweight,25.0,20.0,1.0,4.0,,25.0,5.0,1.0,2.0,,The Black Beast,27.0,12.0,0.0,190.5,117.93,200.66,Orthodox,1985-02-07,2.43,50.0,2.48,40.0,0.53,26.0,53.0,0.0
/fighter/Derrick-Mehmen-17137,derrick mehmen,Caveman,30/05/1985,36.0,,"Cedar Rapids, Iowa",United States,"6'3""",237 lbs,American Top Team,Heavyweight,19.0,11.0,2.0,6.0,,19.0,2.0,2.0,6.0,,Caveman,19.0,9.0,0.0,193.04,92.99,,,,1.93,14.0,4.53,48.0,1.0,16.0,0.0,0.0
/fighter/Derrick-Noble-4556,derrick noble,The Eraser,14/08/1978,42.0,,"Cuba, Illinois",United States,"5'9""",169 lbs,Minnesota Martial Arts Academy,Welterweight,27.0,9.0,12.0,6.0,,27.0,5.0,6.0,4.0,,The Eraser,27.0,15.0,1.0,175.26,77.11,,Southpaw,1978-08-14,6.21,40.0,3.79,59.0,0.0,0.0,0.0,0.0
/fighter/Derrick-Ruffin-5221,derrick ruffin,,27/01/1971,50.0,,"Kansas City, Missouri",United States,"0'0""",265 lbs,,Heavyweight,1.0,1.0,0.0,0.0,,1.0,2.0,2.0,0.0,,,,,,,,,,,,,,,,,,
,deshaun johnson,,,,,,,,,,,,,,,,,,,,,,6.0,9.0,0.0,,75.75,,,,2.27,41.0,6.67,43.0,0.0,0.0,0.0,0.0
/fighter/Desi-Rahayu-168469,desi rahayu,Eagle Eyes,10/01/1991,30.0,,Jakarta,Indonesia,"5'5""",135 lbs,Tigershark Fighting Academy,Bantamweight,1.0,0.0,0.0,1.0,,1.0,0.0,0.0,0.0,,,,,,,,,,,,,,,,,,
/fighter/Desiree-Yanez-286877,desiree yanez,Dirty Dez,19/02/1990,31.0,,"Waco, Texas",United States,"5'4""",115 lbs,Blitz Sport MMA,Strawweight,5.0,2.0,1.0,2.0,,5.0,0.0,1.0,2.0,,,,,,,,,,,,,,,,,,
/fighter/Desmond-Green-89993,desmond green,The Predator,11/10/1989,31.0,,"Rochester, New York",United States,"5'10""",155 lbs,Sanford MMA,Lightweight,23.0,6.0,1.0,16.0,,23.0,0.0,2.0,6.0,,The Predator,23.0,8.0,0.0,177.8,70.31,185.42,Southpaw,1989-10-11,3.7,46.0,2.51,69.0,1.62,50.0,75.0,0.0
/fighter/Desmond-Torres-251669,desmond torres,The Tyrant,06/01/1997,24.0,,"Wahiawa, Hawaii",United States,"5'7""",135 lbs,Team Oyama,Bantamweight,7.0,1.0,4.0,2.0,,7.0,1.0,1.0,1.0,,,7.0,2.0,0.0,167.64,61.23,175.26,Orthodox,1997-01-06,4.8,64.0,11.78,48.0,0.0,0.0,100.0,0.0
/fighter/Detchadin-Srosirisuphathin-148583,detchadin srosirisuphathin,Phetsingkorn / Detchpool,,,,,Thailand,"5'3""",125 lbs,Bangkok Fight Lab,Flyweight,8.0,5.0,2.0,1.0,,8.0,3.0,2.0,1.0,,,,,,,,,,,,,,,,,,
/fighter/Devante-Sewell-221211,devante sewell,The Grinder,14/08/1995,25.0,,"Atlanta, Georgia",United States,"5'7""",135 lbs,,Bantamweight,8.0,0.0,6.0,2.0,,8.0,1.0,2.0,2.0,,,,,,,,,,,,,,,,,,
/fighter/Devin-Clark-72777,devin clark,Brown Bear,12/04/1990,31.0,,"Sioux Falls, South Dakota",United States,"6'0""",205 lbs,Jackson-Wink MMA,Light Heavyweight,12.0,3.0,1.0,8.0,,12.0,2.0,3.0,0.0,,Brown Bear,14.0,8.0,0.0,182.88,92.99,190.5,Orthodox,1990-04-12,2.99,55.0,2.95,43.0,2.35,33.0,60.0,0.1
,devin cole,,,,,,,,,,,,,,,,,,,,,,20.0,10.0,1.0,193.04,108.86,,Orthodox,1976-10-01,3.5,55.0,2.14,48.0,2.18,42.0,66.0,0.0
,devin johnson,,,,,,,,,,,,,,,,,,,,,,1.0,1.0,1.0,,,,,,0.0,0.0,0.0,0.0,0.0,0.0,0.0,0.0
/fighter/Devin-Powell-64166,devin powell,,01/03/1988,33.0,,"South Berwick, Maine",United States,"6'0""",155 lbs,Nostos MMA,Lightweight,10.0,3.0,4.0,3.0,,10.0,0.0,0.0,5.0,,,9.0,4.0,0.0,182.88,70.31,185.42,Orthodox,1988-03-01,2.88,41.0,3.67,51.0,0.0,0.0,0.0,0.6
,devin smyth,,,,,,,,,,,,,,,,,,,,,,4.0,2.0,0.0,177.8,77.11,182.88,Switch,1995-07-21,2.6,68.0,6.73,25.0,4.0,26.0,100.0,0.0
/fighter/Devon-Brock-259537,devon brock,Dangerous,21/09/1995,25.0,,"Los Angeles, California",United States,"5'9""",160 lbs,The Movement Boxing and Fitness,Welterweight,5.0,3.0,0.0,2.0,,5.0,0.0,1.0,2.0,,,,,,,,,,,,,,,,,,
/fighter/Devonte-Smith-89163,devonte smith,King Kage,30/07/1993,28.0,,"Bedford, Ohio",United States,"5'9""",160 lbs,Factory X,Welterweight,11.0,10.0,1.0,0.0,,11.0,2.0,0.0,0.0,,King Kage,11.0,4.0,0.0,175.26,70.31,193.04,Orthodox,1993-07-30,4.55,53.0,3.91,49.0,0.35,25.0,85.0,0.3
/fighter/Devorious-Tubbs-176823,devorious tubbs,,,,,"Atlanta, Georgia",United States,"6'2""",185 lbs,,Middleweight,4.0,1.0,0.0,3.0,,4.0,0.0,0.0,4.0,,,,,,,,,,,,,,,,,,
/fighter/DeWayne-Diggs-227521,dewayne diggs,,30/05/1988,33.0,,"St. Louis, Missouri",United States,"6'0""",187 lbs,,Light Heavyweight,3.0,1.0,2.0,0.0,,3.0,1.0,1.0,0.0,,,,,,,,,,,,,,,,,,
,dewey cooper,,,,,,,,,,,,,,,,,,,,,The Black Cobra,2.0,1.0,0.0,,92.99,,,,0.0,0.0,0.0,0.0,0.0,0.0,0.0,0.0
,dhafir harris,,,,,,,,,,,,,,,,,,,,,Dada 5000,2.0,0.0,0.0,,116.57,,,,0.0,0.0,0.0,0.0,0.0,0.0,0.0,0.0
/fighter/Dhiego-Lima-59607,dhiego lima,,31/01/1989,32.0,,"Goiania, Goias",Brazil,"6'2""",170 lbs,American Top Team Atlanta,Welterweight,15.0,4.0,4.0,7.0,,15.0,5.0,1.0,3.0,,,17.0,9.0,0.0,187.96,77.11,190.5,Orthodox,1989-01-31,3.12,39.0,3.88,58.0,1.26,34.0,73.0,0.6
/fighter/Di-Yuan-Huang-199399,di yuan huang,Dragon Kid,14/11/1992,28.0,,Tianjin,China,"5'8""",145 lbs,Big King,Featherweight,2.0,1.0,0.0,1.0,,2.0,0.0,0.0,0.0,,,,,,,,,,,,,,,,,,
/fighter/Diana-Avsaragova-274607,diana avsaragova,Pantera,07/08/1998,23.0,,Nart,Russia,"5'7""",125 lbs,,Flyweight,4.0,1.0,1.0,2.0,,4.0,0.0,0.0,0.0,,,,,,,,,,,,,,,,,,
/fighter/Diana-Belbita-174381,diana belbita,The Warrior Princess,26/06/1996,25.0,,Drobeta,Romania,"5'7""",115 lbs,House of Champions MMA,Strawweight,14.0,6.0,4.0,4.0,,14.0,0.0,4.0,2.0,,The Warrior Princess,15.0,8.0,0.0,170.18,52.16,172.72,Orthodox,1996-06-26,6.59,42.0,6.43,51.0,0.97,62.0,69.0,0.0
/fighter/Diego-Barbosa-84640,diego barbosa,The Barbarian,07/08/1994,27.0,,"Goiania, Goias",Brazil,"5'7""",145 lbs,Nova Forca,Featherweight,6.0,4.0,2.0,0.0,,6.0,0.0,2.0,1.0,,,,,,,,,,,,,,,,,,
/fighter/Diego-Brandao-25097,diego brandao,Ceara,27/05/1987,34.0,,"Fortaleza, Ceara",Brazil,"5'7""",145 lbs,Jackson-Wink MMA,Featherweight,25.0,14.0,6.0,5.0,0.0,25.0,8.0,2.0,6.0,1.0,DB,22.0,11.0,0.0,170.18,65.77,162.56,Orthodox,1987-05-27,2.94,47.0,3.38,62.0,3.21,68.0,80.0,0.6
/fighter/Diego-Ferreira-26358,diego ferreira,,18/01/1985,36.0,,"Careiro da Varzea, Amazonas",Brazil,"5'9""",155 lbs,Fortis MMA,Lightweight,17.0,3.0,7.0,7.0,,17.0,2.0,0.0,2.0,,,18.0,5.0,0.0,175.26,70.31,187.96,Orthodox,1985-01-18,4.66,37.0,3.42,56.0,0.71,22.0,63.0,0.7
/fighter/Diego-Freitas-365193,diego freitas,,,,,,Portugal,"5'9""",145 lbs,,Featherweight,0.0,0.0,0.0,0.0,,0.0,0.0,0.0,1.0,,,,,,,,,,,,,,,,,,
/fighter/Diego-Garijo-19491,diego garijo,Dos Pistolas,,,,"San Diego, California",United States,"5'9""",155 lbs,Alliance MMA,Lightweight,7.0,2.0,4.0,1.0,,7.0,1.0,0.0,0.0,,,,,,,,,,,,,,,,,,
,diego henrique da silva,,,,,,,,,,,,,,,,,,,,,Gaucho,8.0,4.0,0.0,187.96,83.91,,Orthodox,1986-08-22,2.53,57.0,3.27,30.0,0.0,0.0,63.0,0.0
/fighter/Diego-Herzog-17107,diego herzog,Nosferatu,24/05/1983,38.0,,"San Jose, California",United States,"6'1""",184 lbs,,Middleweight,4.0,2.0,2.0,0.0,,4.0,2.0,0.0,1.0,,,,,,,,,,,,,,,,,,
,diego lopes,,,,,,,,,,,,,,,,,,,,,,23.0,6.0,0.0,180.34,65.77,182.88,Orthodox,1994-12-30,2.47,53.0,4.91,37.0,0.0,0.0,42.0,5.3
/fighter/Diego-Marlon-12875,diego marlon,,10/09/1985,35.0,,"Curitiba, Parana",Brazil,"5'6""",145 lbs,Gile Ribeiro Team,Featherweight,28.0,6.0,17.0,4.0,1.0,28.0,5.0,5.0,3.0,0.0,,,,,,,,,,,,,,,,,
/fighter/Diego-Nunes-25981,diego nunes,The Gun,30/11/1982,38.0,,"Caxias do Sul, Rio Grande do Sul",Brazil,"5'6""",145 lbs,Evolucao Thai,Featherweight,23.0,7.0,9.0,7.0,,23.0,2.0,0.0,6.0,,The Gun,19.0,7.0,0.0,167.64,65.77,170.18,Orthodox,1982-11-30,2.72,43.0,2.59,58.0,1.18,44.0,65.0,0.6
/fighter/Diego-Rivas-81835,diego rivas,Pitbull,11/11/1991,29.0,,Temuco,Chile,"5'9""",145 lbs,Elemental Dojo,Featherweight,7.0,2.0,3.0,2.0,,7.0,0.0,0.0,2.0,,Pitbull,10.0,2.0,0.0,172.72,65.77,175.26,Orthodox,1991-11-11,1.37,40.0,2.14,52.0,1.79,60.0,64.0,0.9
/fighter/Diego-Sanchez-4824,diego sanchez,The Nightmare,31/12/1981,39.0,,"Albuquerque, New Mexico",United States,"5'10""",170 lbs,Jackson-Wink MMA,Welterweight,30.0,10.0,6.0,13.0,1.0,30.0,4.0,0.0,9.0,0.0,Nightmare,31.0,13.0,0.0,177.8,77.11,182.88,Southpaw,1981-12-31,2.69,37.0,3.02,56.0,1.51,24.0,46.0,0.8
/fighter/Diego-Saraiva-9534,diego saraiva,The Octopus,23/04/1982,39.0,,"Atlanta, Georgia",United States,"5'6""",149 lbs,Team Octopus,Lightweight,22.0,4.0,14.0,4.0,,22.0,5.0,0.0,15.0,,The Octopus,22.0,20.0,1.0,167.64,70.31,,Orthodox,1982-04-23,1.64,32.0,3.58,62.0,1.33,40.0,0.0,0.7
/fighter/Dietter-Navarro-71520,dietter navarro,,15/01/1982,39.0,,"Miami, Florida",United States,"5'9""",155 lbs,American Top Team,Lightweight,2.0,0.0,0.0,2.0,,2.0,2.0,2.0,1.0,,,,,,,,,,,,,,,,,,
,dieusel berto,,,,,,,,,,,,,,,,,,,,,,0.0,3.0,0.0,175.26,90.72,,,,0.0,0.0,0.0,0.0,0.0,0.0,0.0,0.0
/fighter/Dieuseul-Berto-2007,dieuseul berto,Tiger,16/07/1960,61.0,,"Winter Haven, Florida",United States,"5'9""",200 lbs,Tiger's World of Martial Arts,Light Heavyweight,0.0,0.0,0.0,0.0,,0.0,1.0,1.0,1.0,,,,,,,,,,,,,,,,,,
/fighter/Dileno-Lopes-29635,dileno lopes,,26/09/1984,36.0,,"Manacapuru, Amazonas",Brazil,"5'5""",135 lbs,Nova Uniao Manaus,Bantamweight,21.0,4.0,15.0,2.0,,21.0,2.0,0.0,5.0,,,19.0,3.0,0.0,165.1,61.23,,,,2.37,36.0,3.33,53.0,2.5,31.0,100.0,1.5
/fighter/Dillon-Danis-247811,dillon danis,El Jefe,22/08/1993,27.0,,"New York, New York",United States,"6'0""",175 lbs,SBG Ireland,Middleweight,2.0,0.0,2.0,0.0,,2.0,0.0,0.0,0.0,,,,,,,,,,,,,,,,,,
,dillon smith,,,,,,,,,,,,,,,,,,,,,,0.0,0.0,0.0,182.88,77.11,,,,0.0,0.0,0.0,0.0,0.0,0.0,0.0,0.0
/fighter/DiMarcco-Hutchison-221647,dimarcco hutchison,Marco Hutch / Afro Samurai,20/07/1993,28.0,,Missouri,United States,"6'1""",185 lbs,Branson Fight Club,Middleweight,3.0,0.0,3.0,0.0,,3.0,0.0,2.0,1.0,,,,,,,,,,,,,,,,,,
,dimitiri wanderley,,,,,,,,,,,,,,,,,,,,,,5.0,2.0,0.0,,92.99,,Orthodox,,0.92,25.0,4.31,30.0,1.16,20.0,0.0,0.0
/fighter/Din-Thomas-1301,din thomas,Dinyero,28/09/1976,44.0,,"Orlando, Florida",United States,"5'9""",143 lbs,American Top Team,Featherweight,26.0,7.0,15.0,4.0,,26.0,2.0,2.0,5.0,,Dinyero,26.0,9.0,0.0,175.26,70.31,,Orthodox,1976-09-28,1.85,37.0,2.6,59.0,1.38,52.0,76.0,1.2
,dinis paiva jr.,,,,,,,,,,,,,,,,,,,,,Sweetbread,13.0,8.0,0.0,175.26,65.77,180.34,Southpaw,1988-05-26,2.6,41.0,2.73,67.0,0.0,0.0,81.0,0.0
,dino pezao,,,,,,,,,,,,,,,,,,,,,,1.0,3.0,0.0,,92.99,,Orthodox,,0.66,30.0,3.28,31.0,0.0,0.0,0.0,0.0
,dion staring,,,,,,,,,,,,,,,,,,,,,Soldier,35.0,14.0,0.0,185.42,106.59,,Orthodox,1978-06-09,1.09,37.0,5.0,47.0,0.0,0.0,33.0,0.0
,dione barbosa,,,,,,,,,,,,,,,,,,,,,The Witch,6.0,2.0,0.0,167.64,56.7,167.64,Orthodox,1992-05-08,0.87,50.0,0.65,66.0,3.27,100.0,0.0,9.8
/fighter/Djamil-Chan-78386,djamil chan,Dynamite,14/06/1990,31.0,,Rotterdam,Netherlands,"6'2""",155 lbs,Ruthless Fight Company,Lightweight,15.0,12.0,1.0,2.0,,15.0,2.0,2.0,5.0,,,,,,,,,,,,,,,,,,
/fighter/Djatmiko-Waluyo-51126,djatmiko waluyo,,,,,"Mexico City, Federal District",Mexico,"5'10""",170 lbs,Bonebreakers Team,Welterweight,6.0,2.0,3.0,1.0,,6.0,0.0,1.0,0.0,,,,,,,,,,,,,,,,,,
/fighter/Dmitri-Stepanov-165,dmitri stepanov,,,,,Minsk,Belarus,"6'3""",220 lbs,,Heavyweight,0.0,0.0,0.0,0.0,,0.0,0.0,1.0,0.0,,,0.0,1.0,0.0,190.5,98.43,,Orthodox,,0.0,0.0,0.0,0.0,0.0,0.0,0.0,0.0
,dmitrii smoliakov,,,,,,,,,,,,,,,,,,,,,The Lifeguard,9.0,3.0,0.0,187.96,114.76,187.96,Switch,1982-08-05,1.44,42.0,3.81,55.0,0.0,0.0,75.0,0.0
/fighter/Dmitriy-Sosnovskiy-116389,dmitriy sosnovskiy,Wicked Machine,06/07/1989,32.0,,Moscow,Russia,"6'3""",240 lbs,GOR MMA,Heavyweight,11.0,6.0,3.0,2.0,,11.0,0.0,0.0,0.0,,,,,,,,,,,,,,,,,,
,dmitry poberezhets,,,,,,,,,,,,,,,,,,,,,,24.0,5.0,1.0,190.5,107.5,,,,0.0,0.0,0.0,0.0,0.0,0.0,0.0,0.0
/fighter/Dmitry-Smoliakov-125781,dmitry smoliakov,The Lifeguard,05/08/1982,39.0,,Kaliningrad,Russia,"6'2""",257 lbs,Baltic Challenge Team,Heavyweight,9.0,4.0,5.0,0.0,,9.0,2.0,1.0,1.0,,,,,,,,,,,,,,,,,,
,dmitry sosnovskiy,,,,,,,,,,,,,,,,,,,,,Wicked Machine,11.0,0.0,0.0,190.5,108.86,195.58,Orthodox,1989-07-06,2.95,70.0,2.53,35.0,3.16,66.0,100.0,3.2
/fighter/Doan-Birawa-278191,doan birawa,,,,,Solo,Indonesia,"0'0""",115 lbs,Han Fighting Academy,Strawweight,0.0,0.0,0.0,0.0,,0.0,0.0,2.0,0.0,,,,,,,,,,,,,,,,,,
/fighter/Dodi-Mardian-269889,dodi mardian,The Maung,,,,,Indonesia,"0'0""",135 lbs,,Bantamweight,1.0,1.0,0.0,0.0,,1.0,1.0,3.0,0.0,,,,,,,,,,,,,,,,,,
/fighter/Dokonjonosuke-Mishima-1170,dokonjonosuke mishima,,19/04/1972,49.0,,Kobe,Japan,"5'7""",154 lbs,Cobra Kai MMA Dojo,Lightweight,21.0,3.0,8.0,10.0,,21.0,2.0,3.0,2.0,,,21.0,7.0,2.0,170.18,70.31,,Southpaw,1972-04-19,1.06,41.0,1.22,52.0,2.47,40.0,25.0,1.4
/fighter/Dom-Clark-48575,dom clark,Dominator,28/09/1982,38.0,,"Hammersmith, Greater London",England,"5'10""",185 lbs,Fight Science Gym,Middleweight,6.0,3.0,3.0,0.0,,6.0,7.0,4.0,0.0,,,,,,,,,,,,,,,,,,
/fighter/Dom-OGrady-23582,dom o'grady,I Hate You So Much,13/09/1981,,22/12/2015,"Detroit, Michigan",United States,"6'0""",155 lbs,H8 Squad,Lightweight,16.0,3.0,6.0,7.0,,16.0,3.0,1.0,4.0,,,,,,,,,,,,,,,,,,
/fighter/Domingo-Pilarte-48495,domingo pilarte,Son of Fire,05/01/1990,31.0,,"Houston, Texas",United States,"6'0""",135 lbs,Revolution Dojo,Bantamweight,8.0,2.0,4.0,2.0,,8.0,0.0,0.0,2.0,,Son of Fire,8.0,3.0,0.0,182.88,61.23,185.42,Southpaw,1990-01-05,1.31,47.0,2.96,40.0,1.2,42.0,54.0,0.8
/fighter/Domingos-Barros-190195,domingos barros,,07/02/1992,29.0,,"Praia, Santiago",Cape Verde,"6'4""",265 lbs,Porto Fight Club,Heavyweight,6.0,4.0,0.0,2.0,,6.0,0.0,0.0,1.0,,,,,,,,,,,,,,,,,,
,dominic brown,,,,,,,,,,,,,,,,,,,,,,16.0,23.0,0.0,180.34,86.18,,,,0.0,0.0,0.0,0.0,0.0,0.0,0.0,0.0
/fighter/Dominic-Clark-61114,dominic clark,All Day,01/08/1985,36.0,,"Fresno, California",United States,"5'10""",155 lbs,PKG,Lightweight,14.0,3.0,7.0,3.0,1.0,14.0,7.0,3.0,1.0,0.0,,10.0,7.0,0.0,177.8,70.31,,,,0.0,0.0,0.0,0.0,0.0,0.0,0.0,0.0
/fighter/Dominic-Garcia-192787,dominic garcia,Domo,30/01/1987,34.0,,"Kansas City, Kansas",United States,"6'1""",185 lbs,Glory MMA & Fitness,Middleweight,5.0,4.0,1.0,0.0,,5.0,3.0,0.0,0.0,,,,,,,,,,,,,,,,,,
/fighter/Dominic-Jones-168023,dominic jones,Domnation,23/09/1993,27.0,,"Orange Park, Florida",United States,"5'5""",135 lbs,,Bantamweight,2.0,1.0,1.0,0.0,,2.0,1.0,2.0,0.0,,,,,,,,,,,,,,,,,,
/fighter/Dominic-Mazzotta-95933,dominic mazzotta,The Honey Badger,17/06/1987,34.0,,"New Kensington, Pennsylvania",United States,"5'7""",135 lbs,Sanford MMA,Bantamweight,15.0,2.0,9.0,4.0,,15.0,2.0,0.0,1.0,,,,,,,,,,,,,,,,,,
/fighter/Dominic-Sumner-237137,dominic sumner,,18/12/1991,29.0,,"San Jose, California",United States,"6'1""",170 lbs,,Welterweight,1.0,1.0,0.0,0.0,,1.0,3.0,0.0,0.0,,,,,,,,,,,,,,,,,,
/fighter/Dominic-Waters-68971,dominic waters,Sho Nuff,11/04/1989,32.0,,"Santa Rosa, California",United States,"6'1""",170 lbs,Jackson-Wink MMA,Welterweight,10.0,3.0,2.0,5.0,,10.0,1.0,1.0,4.0,,Sho Nuff,9.0,5.0,0.0,185.42,77.11,200.66,Orthodox,1989-04-11,0.48,23.0,2.53,39.0,4.07,52.0,28.0,0.0
/fighter/Dominick-Cruz-12107,dominick cruz,The Dominator,03/09/1985,35.0,,"San Diego, California",United States,"5'8""",135 lbs,Alliance MMA,Bantamweight,23.0,7.0,1.0,15.0,,23.0,1.0,1.0,1.0,,The Dominator,24.0,4.0,0.0,172.72,61.23,172.72,Orthodox,1985-03-09,3.91,33.0,2.61,70.0,2.82,42.0,83.0,0.1
/fighter/Dominick-Reyes-145941,dominick reyes,The Devastator,26/12/1989,31.0,,"Victorville, California",United States,"6'4""",205 lbs,Cage Combat Academy,Light Heavyweight,12.0,7.0,2.0,3.0,,12.0,2.0,0.0,1.0,,The Devastator,12.0,4.0,0.0,193.04,92.99,195.58,Southpaw,1989-12-26,4.75,50.0,3.77,48.0,0.36,28.0,80.0,0.4
/fighter/Dominique-Steele-47845,dominique steele,Non-Stop Action Packed,25/01/1988,33.0,,"Cincinnati, Ohio",United States,"5'10""",170 lbs,Team Vision,Welterweight,17.0,6.0,2.0,9.0,,17.0,7.0,0.0,5.0,,Non-Stop Action-Packed,14.0,9.0,0.0,177.8,77.11,187.96,Orthodox,1988-01-27,2.32,49.0,2.42,50.0,2.95,42.0,76.0,0.0
/fighter/Dominique-Wooding-154945,dominique wooding,The Black Panther,19/08/1996,24.0,,"London, Greater London",England,"5'9""",145 lbs,Team Titan,Featherweight,7.0,7.0,0.0,0.0,,7.0,0.0,1.0,3.0,,,,,,,,,,,,,,,,,,
/fighter/Don-CarloClauss-42658,don carlo-clauss,,,,,"Rochester, New York",United States,"5'7""",157 lbs,Team Bombsquad,Welterweight,10.0,3.0,0.0,6.0,1.0,10.0,0.0,3.0,3.0,1.0,,10.0,7.0,0.0,,77.11,,,,1.44,30.0,7.68,43.0,0.0,0.0,66.0,0.0
/fighter/Don-Frye-124,don frye,The Predator,23/11/1965,55.0,,"Sierra Vista, Arizona",United States,"6'1""",210 lbs,Team Frye,Heavyweight,20.0,8.0,10.0,1.0,1.0,20.0,5.0,2.0,2.0,0.0,The Predator,20.0,9.0,1.0,185.42,99.34,,Orthodox,1965-11-23,2.87,64.0,3.57,37.0,0.91,57.0,45.0,0.7
/fighter/Don-Madge-86651,don madge,Magic Man,12/11/1990,30.0,,"Johannesburg, Gauteng",South Africa,"6'0""",155 lbs,FightFit Militia,Lightweight,9.0,5.0,3.0,1.0,,9.0,1.0,1.0,1.0,,Magic Man,9.0,3.0,1.0,182.88,70.31,182.88,Southpaw,1990-11-12,2.08,52.0,0.74,67.0,2.22,25.0,80.0,0.7
/fighter/Don-Shainis-59975,don shainis,Shameless,,,,"Stoughton, Massachusetts",United States,"0'0""",149 lbs,Victory Combat Sports,Lightweight,7.0,4.0,2.0,1.0,,7.0,1.0,0.0,1.0,,Shameless,12.0,5.0,0.0,167.64,65.77,170.18,Orthodox,1990-09-16,3.42,50.0,5.87,31.0,0.97,25.0,20.0,1.9
/fighter/DonTale-Mayes-237177,don'tale mayes,Kong,16/01/1992,29.0,,"Louisville, Kentucky",United States,"6'6""",262 lbs,Bronx Hill MMA,Heavyweight,8.0,4.0,1.0,3.0,0.0,8.0,1.0,2.0,0.0,1.0,Lord Kong,10.0,6.0,0.0,198.12,117.93,205.74,Orthodox,1992-01-16,3.6,44.0,3.84,46.0,0.79,43.0,60.0,0.0
/fighter/Donald-Cerrone-15105,donald cerrone,Cowboy,29/03/1983,38.0,,"Broomfield, Colorado",United States,"6'0""",170 lbs,BMF Ranch,Welterweight,36.0,10.0,17.0,9.0,,36.0,8.0,1.0,7.0,,Cowboy,36.0,17.0,0.0,185.42,70.31,185.42,Orthodox,1983-03-29,4.41,46.0,4.48,53.0,1.16,33.0,73.0,1.2
/fighter/Donald-Sanchez-17386,donald sanchez,,18/08/1984,36.0,,"Albuquerque, New Mexico",United States,"5'10""",145 lbs,Jackson-Wink MMA,Featherweight,31.0,12.0,11.0,8.0,,31.0,2.0,7.0,11.0,,,31.0,17.0,0.0,177.8,65.77,,,,0.58,50.0,1.16,55.0,0.0,0.0,50.0,0.0
,donavon frelow,,,,,,,,,,,,,,,,,,,,,,6.0,3.0,0.0,170.18,61.23,,Orthodox,1985-01-20,2.4,27.0,3.2,52.0,1.0,100.0,26.0,0.0
/fighter/Dong-Hyun-Kim-16374,dong hyun kim,Stun Gun,17/11/1981,39.0,,"Busan, Yeongnam",South Korea,"6'2""",170 lbs,Busan Team M.A.D.,Welterweight,22.0,9.0,2.0,11.0,,22.0,3.0,0.0,1.0,,Stun Gun,22.0,4.0,1.0,187.96,77.11,193.04,Southpaw,1981-11-17,2.12,49.0,1.89,58.0,2.93,43.0,71.0,0.6
/fighter/Dong-Hyun-Ma-21673,dong hyun ma,Maestro,09/09/1988,32.0,,Busan,South Korea,"5'11""",155 lbs,Busan Team MAD,Lightweight,16.0,6.0,6.0,4.0,,16.0,4.0,2.0,5.0,,Maestro,16.0,11.0,3.0,180.34,70.31,177.8,Orthodox,1988-09-09,2.84,41.0,4.1,54.0,1.27,53.0,33.0,0.0
,dong sik yoon,,,,,,,,,,,,,,,,,,,,,,9.0,9.0,0.0,182.88,83.91,,Orthodox,1972-08-24,0.99,36.0,2.33,51.0,1.6,29.0,33.0,1.3
,donghun choi,,,,,,,,,,,,,,,,,,,,,,,,,,,,,,,,,,,,,
/fighter/Dongi-Yang-23501,dongi yang,The Ox,07/12/1984,36.0,,Seoul,South Korea,"5'11""",185 lbs,Team Macho,Middleweight,14.0,13.0,1.0,0.0,,14.0,1.0,0.0,3.0,,The Ox,13.0,3.0,0.0,177.8,83.91,185.42,Southpaw,1984-12-07,3.55,51.0,3.21,63.0,1.7,41.0,61.0,0.5
/fighter/Donnie-Bell-79137,donnie bell,Da Bomber,29/08/1990,30.0,,"Coppell, Texas",United States,"5'6""",155 lbs,Arlington MMA,Lightweight,8.0,1.0,6.0,1.0,,8.0,1.0,0.0,2.0,,,,,,,,,,,,,,,,,,
/fighter/Donnie-Chappell-169,donnie chappell,,,,,,,"0'0""",0 lbs,,,0.0,0.0,0.0,0.0,,0.0,0.0,1.0,0.0,,,0.0,1.0,0.0,180.34,80.74,,Southpaw,,0.0,0.0,0.0,0.0,0.0,0.0,0.0,0.0
,donnie liles,,,,,,,,,,,,,,,,,,,,,,17.0,7.0,0.0,175.26,77.11,,Orthodox,,2.25,41.0,1.75,65.0,2.5,28.0,0.0,1.2
/fighter/Donny-Walker-11486,donny walker,Eagle Eye,04/01/1980,41.0,,"Cleveland, Ohio",United States,"5'9""",145 lbs,GriffonRawl Thaiboxing & MMA Academy,Featherweight,15.0,4.0,8.0,3.0,,15.0,3.0,5.0,2.0,,Eagle Eye,15.0,10.0,0.0,175.26,61.23,,,,1.81,37.0,3.85,46.0,0.0,0.0,57.0,1.7
,donovan beard,,,,,,,,,,,,,,,,,,,,,The Highlight Reel,7.0,2.0,0.0,187.96,83.91,198.12,Orthodox,1989-11-05,0.0,0.0,5.77,28.0,0.0,0.0,0.0,0.0
/fighter/Donyiell-Winrow-65075,donyiell winrow,,,,,"Dallas, Texas",United States,"0'0""",185 lbs,Texas Gladiators,Middleweight,1.0,0.0,0.0,0.0,1.0,1.0,0.0,0.0,1.0,0.0,,,,,,,,,,,,,,,,,
/fighter/Doo-Ho-Choi-56689,doo ho choi,The Korean Superboy,10/04/1991,30.0,,"Gumi, Gyeongsangbuk-do",South Korea,"5'9""",145 lbs,Busan Team MAD,Featherweight,14.0,11.0,1.0,2.0,,14.0,2.0,0.0,2.0,,,,,,,,,,,,,,,,,,
,dooho choi,,,,,,,,,,,,,,,,,,,,,The Korean Superboy,14.0,4.0,1.0,177.8,65.77,177.8,Orthodox,1991-04-10,4.74,53.0,4.91,54.0,0.29,20.0,50.0,0.0
/fighter/Dorian-Price-9786,dorian price,,20/08/1977,43.0,,"Columbus, Ohio",United States,"6'3""",155 lbs,Team Jorge Gurgel,Lightweight,8.0,1.0,6.0,0.0,1.0,8.0,1.0,4.0,0.0,0.0,,8.0,5.0,0.0,190.5,77.11,,Southpaw,1977-08-20,0.0,0.0,0.0,0.0,0.0,0.0,0.0,0.0
,dos caras jr.,,,,,,,,,,,,,,,,,,,,,,9.0,5.0,0.0,193.04,102.06,,Orthodox,1977-05-25,0.77,23.0,1.2,59.0,0.0,0.0,72.0,0.0
,doug evans,,,,,,,,,,,,,,,,,,,,,,13.0,10.0,0.0,175.26,70.31,,Orthodox,1980-10-10,1.79,35.0,2.55,55.0,3.19,83.0,69.0,0.6
/fighter/Doug-Gordon-15802,doug gordon,Flash,,,,"New Castle, Delaware",United States,"5'8""",170 lbs,Elite BJJ,Welterweight,11.0,6.0,3.0,2.0,,11.0,2.0,3.0,6.0,,,,,,,,,,,,,,,,,,
,doug kay,,,,,,,,,,,,,,,,,,,,,,0.0,0.0,0.0,,,,,,0.0,0.0,0.0,0.0,0.0,0.0,0.0,0.0
/fighter/Doug-Marshall-9510,doug marshall,The Rhino,03/02/1977,44.0,,"Visalia, California",United States,"5'10""",185 lbs,Elite Team,Middleweight,18.0,13.0,3.0,2.0,,18.0,7.0,1.0,0.0,,The Rhino,18.0,8.0,0.0,177.8,92.99,,Orthodox,1975-09-09,6.99,46.0,4.02,60.0,0.0,0.0,66.0,2.4
/fighter/Doug-Williams-17747,doug williams,The Carthage Killer,,,,"Carthage, Texas",United States,"5'10""",225 lbs,,Heavyweight,6.0,4.0,1.0,1.0,,6.0,3.0,7.0,3.0,,,,,,,,,,,,,,,,,,
/fighter/Douglas-Evans-18184,douglas evans,,10/10/1980,40.0,,"Anchorage, Alaska",United States,"5'9""",144 lbs,AK Wolfpack,Featherweight,13.0,2.0,8.0,3.0,,13.0,3.0,4.0,3.0,,,,,,,,,,,,,,,,,,
/fighter/Douglas-Frey-40250,douglas frey,,08/08/1982,39.0,,"Amarillo, Texas",United States,"5'11""",145 lbs,Fitness Fight Factory,Featherweight,10.0,5.0,4.0,1.0,,10.0,4.0,5.0,4.0,,,,,,,,,,,,,,,,,,
/fighter/Douglas-Lima-17236,douglas lima,The Phenom,05/01/1988,33.0,,"Goiania, Goias",Brazil,"6'1""",170 lbs,American Top Team Atlanta,Welterweight,32.0,16.0,10.0,6.0,,32.0,1.0,1.0,7.0,,The Phenom,29.0,6.0,0.0,185.42,77.11,,,,1.92,36.0,2.84,60.0,0.6,100.0,46.0,0.0
/fighter/Douglas-Silva-de-Andrade-87981,douglas silva de andrade,D'Silva,22/06/1985,36.0,,"Castanhal, Para",Brazil,"5'6""",145 lbs,Corinthians MMA,Featherweight,26.0,19.0,1.0,6.0,,26.0,1.0,1.0,2.0,,D Silva,29.0,5.0,0.0,170.18,61.23,172.72,Orthodox,1985-06-22,3.66,38.0,3.99,58.0,0.61,46.0,70.0,0.2
/fighter/Dovletdzhan-Yagshimuradov-96307,dovletdzhan yagshimuradov,,22/05/1989,32.0,,Ashgabat,Turkmenistan,"5'11""",205 lbs,,Light Heavyweight,18.0,11.0,4.0,3.0,,18.0,2.0,3.0,1.0,,,,,,,,,,,,,,,,,,
/fighter/Doyle-Childs-140917,doyle childs,,11/11/1979,41.0,,"San Jose, California",United States,"5'11""",170 lbs,Tribull MMA,Welterweight,2.0,1.0,1.0,0.0,,2.0,1.0,0.0,1.0,,,,,,,,,,,,,,,,,,
/fighter/Dragan-Tesanovic-21904,dragan tesanovic,Gagi,02/09/1985,35.0,,Belgrade,Serbia,"6'2""",185 lbs,MMA Academy,Middleweight,8.0,6.0,0.0,2.0,,8.0,0.0,1.0,1.0,,,,,,,,,,,,,,,,,,
/fighter/Dragos-Zubko-243231,dragos zubko,,,,,,Moldova,"0'0""",205 lbs,,Light Heavyweight,3.0,2.0,0.0,1.0,,3.0,1.0,0.0,0.0,,,,,,,,,,,,,,,,,,
/fighter/Drakkar-Klose-84568,drakkar klose,,09/03/1988,33.0,,"South Haven, Michigan",United States,"5'8""",155 lbs,Fight Ready,Lightweight,11.0,4.0,0.0,7.0,,11.0,1.0,0.0,1.0,,,14.0,2.0,1.0,175.26,70.31,177.8,Orthodox,1988-03-09,4.33,55.0,3.4,52.0,1.78,30.0,68.0,0.0
/fighter/Drako-Rodriguez-203421,drako rodriguez,The Great Drakolini,16/06/1996,25.0,,"Sioux City, Iowa",United States,"5'8""",135 lbs,One Combat Academy,Bantamweight,7.0,2.0,4.0,1.0,,7.0,2.0,0.0,1.0,,,7.0,3.0,0.0,172.72,61.23,175.26,Orthodox,1996-06-16,3.37,36.0,4.4,58.0,2.93,66.0,75.0,0.7
,drew brokenshire,,,,,,,,,,,,,,,,,,,,,,16.0,6.0,0.0,,,,,,0.0,0.0,0.0,0.0,0.0,0.0,0.0,0.0
,drew dimanlig,,,,,,,,,,,,,,,,,,,,,,3.0,4.0,0.0,,83.91,,,,3.7,73.0,3.17,20.0,0.0,0.0,0.0,0.0
/fighter/Drew-Dober-23982,drew dober,,19/10/1988,32.0,,"Omaha, Nebraska",United States,"5'8""",155 lbs,Elevation Fight Team,Lightweight,23.0,10.0,6.0,7.0,,23.0,1.0,4.0,6.0,,,27.0,12.0,0.0,172.72,70.31,177.8,Southpaw,1988-10-19,4.58,40.0,4.46,51.0,0.68,17.0,56.0,0.1
/fighter/Drew-Fickett-725,drew fickett,Night Rider,24/12/1979,41.0,,"Tucson, Arizona",United States,"5'10""",151 lbs,Team Scrub,Lightweight,42.0,4.0,30.0,8.0,,42.0,14.0,2.0,5.0,,The Master,42.0,21.0,0.0,177.8,70.31,177.8,Orthodox,1979-12-14,2.33,41.0,2.29,57.0,1.3,35.0,30.0,2.2
/fighter/Drew-McFedries-2386,drew mcfedries,The Massacre,27/07/1978,43.0,,"Bettendorf, Iowa",United States,"6'0""",185 lbs,Champions Gym,Middleweight,12.0,11.0,0.0,1.0,,12.0,2.0,4.0,1.0,,The Massacre,12.0,7.0,0.0,182.88,83.91,182.88,Southpaw,1978-07-27,5.13,51.0,4.56,52.0,1.42,100.0,56.0,0.7
,drew pendleton,,,,,,,,,,,,,,,,,,,,,,5.0,0.0,0.0,,65.77,,,,0.0,0.0,0.0,0.0,0.0,0.0,0.0,0.0
/fighter/Drex-Zamboanga-148113,drex zamboanga,T-Rex,07/06/1989,32.0,,,Philippines,"5'8""",143 lbs,Tough Guys International,Featherweight,8.0,3.0,4.0,1.0,,8.0,3.0,1.0,1.0,,,,,,,,,,,,,,,,,,
/fighter/Dricus-Du-Plessis-146193,dricus du plessis,Stillknocks,14/01/1994,27.0,,"Pretoria, Gauteng",South Africa,"6'0""",185 lbs,Team CIT,Middleweight,16.0,7.0,9.0,0.0,,16.0,1.0,1.0,0.0,,Stillknocks,20.0,2.0,0.0,185.42,83.91,193.04,Switch,1994-01-14,6.95,55.0,3.79,53.0,2.72,50.0,40.0,1.1
/fighter/Duane-Bastress-52084,duane bastress,,30/05/1983,38.0,,"New Cumberland, Pennsylvania",United States,"5'10""",185 lbs,Central Pennsylvania Martial Arts Academy,Middleweight,7.0,5.0,1.0,1.0,,7.0,1.0,1.0,0.0,,,,,,,,,,,,,,,,,,
/fighter/Duane-Ludwig-101,duane ludwig,Bang,04/08/1978,43.0,,"Denver, Colorado",United States,"5'10""",170 lbs,Grudge Training Center,Welterweight,21.0,14.0,2.0,5.0,,21.0,7.0,6.0,1.0,,Bang,21.0,14.0,0.0,177.8,77.11,177.8,Orthodox,1978-08-04,4.62,44.0,3.05,57.0,0.43,25.0,59.0,0.1
/fighter/Duda-Santana-249137,duda santana,Cowboyzinha,01/10/1996,24.0,,"Rio de Janeiro, Rio de Janeiro",Brazil,"5'7""",135 lbs,Tata Fight Team,Bantamweight,3.0,1.0,0.0,2.0,,3.0,0.0,1.0,0.0,,Cowboyzinha,3.0,1.0,0.0,170.18,65.77,185.42,Orthodox,1996-01-10,6.01,39.0,2.72,73.0,6.44,60.0,0.0,0.0
/fighter/Dusko-Todorovic-207339,dusko todorovic,Thunder,19/05/1994,27.0,,Belgrade,Serbia,"6'1""",185 lbs,Secutor,Middleweight,10.0,6.0,3.0,1.0,,10.0,1.0,0.0,1.0,,Thunder,12.0,4.0,0.0,185.42,83.91,187.96,Orthodox,1994-05-19,5.54,57.0,4.55,46.0,0.96,12.0,45.0,0.0
/fighter/Dustin-Barca-84031,dustin barca,,,,,Hawaii,United States,"0'0""",155 lbs,,Lightweight,4.0,1.0,1.0,2.0,,4.0,0.0,0.0,0.0,,,,,,,,,,,,,,,,,,
/fighter/Dustin-CollinsMiles-237891,dustin collins-miles,,09/03/1992,29.0,,"Hazard, Kentucky",United States,"6'2""",192 lbs,,Light Heavyweight,1.0,0.0,1.0,0.0,,1.0,1.0,0.0,0.0,,,,,,,,,,,,,,,,,,
/fighter/Dustin-Hazelett-11481,dustin hazelett,McLovin,29/04/1986,35.0,,"Cincinnati, Ohio",United States,"6'1""",155 lbs,Team Jorge Gurgel,Lightweight,12.0,1.0,9.0,2.0,,12.0,4.0,2.0,1.0,,McLovin,12.0,7.0,0.0,185.42,77.11,193.04,Orthodox,1986-04-29,2.24,40.0,3.51,46.0,0.55,50.0,25.0,4.1
/fighter/Dustin-Jacoby-73825,dustin jacoby,The Hanyak,04/04/1988,33.0,,"Arenzville, Illinois",United States,"6'4""",205 lbs,Factory X,Light Heavyweight,14.0,9.0,1.0,4.0,,14.0,1.0,2.0,2.0,,The Hanyak,19.0,7.0,1.0,190.5,92.99,193.04,Orthodox,1988-04-04,5.46,46.0,4.02,59.0,0.4,25.0,60.0,0.0
,dustin joynson,,,,,,,,,,,,,,,,,,,,,,5.0,0.0,0.0,198.12,110.68,198.12,Orthodox,1985-10-14,3.28,53.0,5.63,47.0,0.0,0.0,0.0,0.0
/fighter/Dustin-Kempf-18464,dustin kempf,The Reaper,26/07/1985,36.0,,"Leetonia, Ohio",United States,"5'7""",155 lbs,Instigator Fight Team,Lightweight,8.0,2.0,6.0,0.0,,8.0,2.0,7.0,0.0,,,,,,,,,,,,,,,,,,
/fighter/Dustin-Kimura-41247,dustin kimura,The Diamond,21/05/1989,32.0,,"Honolulu, Hawaii",United States,"5'6""",136 lbs,Gracie Technics,Bantamweight,11.0,2.0,8.0,1.0,,11.0,0.0,1.0,2.0,,The Diamond,11.0,3.0,0.0,170.18,61.23,180.34,Orthodox,1989-05-21,1.33,21.0,3.82,51.0,0.93,37.0,50.0,2.2
,dustin moore,,,,,,,,,,,,,,,,,,,,,,0.0,2.0,0.0,162.56,56.7,,,,0.0,0.0,0.0,0.0,0.0,0.0,0.0,0.0
/fighter/Dustin-Neace-13599,dustin neace,The Beast,12/09/1986,34.0,,"Indianapolis, Indiana",United States,"5'9""",146 lbs,Damage Incorporated,Featherweight,25.0,5.0,20.0,0.0,,25.0,5.0,11.0,5.0,,The Beast,25.0,21.0,1.0,175.26,65.77,,,,2.08,32.0,2.66,56.0,0.0,0.0,0.0,1.7
/fighter/Dustin-Ortiz-58097,dustin ortiz,,25/12/1988,32.0,,"Franklin, Tennessee",United States,"5'5""",125 lbs,Combat Sports Academy,Flyweight,19.0,8.0,4.0,7.0,,19.0,0.0,1.0,8.0,,,19.0,8.0,0.0,165.1,56.7,165.1,Orthodox,1988-12-25,2.94,44.0,2.17,56.0,3.01,36.0,52.0,0.1
/fighter/Dustin-Pague-39781,dustin pague,The Disciple,05/08/1987,34.0,,"Harrisburg, Pennsylvania",United States,"5'9""",152 lbs,Disciple MMA,Lightweight,12.0,3.0,9.0,0.0,,12.0,4.0,3.0,4.0,,The Disciple,12.0,11.0,0.0,175.26,61.23,187.96,Orthodox,1987-08-05,1.65,53.0,2.96,41.0,1.03,44.0,55.0,2.6
/fighter/Dustin-Phillips-16173,dustin phillips,Pain Train,06/10/1978,42.0,,"Topeka, Kansas",United States,"5'8""",145 lbs,Xtreme Couture,Featherweight,13.0,4.0,4.0,5.0,,13.0,0.0,8.0,0.0,,,,,,,,,,,,,,,,,,
/fighter/Dustin-Poirier-50529,dustin poirier,The Diamond,19/01/1989,32.0,,"Carencro, Louisiana",United States,"5'9""",155 lbs,American Top Team,Lightweight,28.0,14.0,7.0,7.0,,28.0,2.0,2.0,2.0,,The Diamond,29.0,8.0,0.0,175.26,70.31,182.88,Southpaw,1989-01-19,5.49,50.0,4.3,53.0,1.36,36.0,63.0,1.2
/fighter/Dustin-Stoltzfus-113779,dustin stoltzfus,,15/11/1991,29.0,,"Lancaster, Pennsylvania",United States,"5'11""",185 lbs,Frankers Fight Team,Middleweight,13.0,2.0,5.0,5.0,1.0,13.0,0.0,1.0,2.0,0.0,,15.0,5.0,0.0,182.88,83.91,190.5,Orthodox,1991-11-15,3.49,44.0,3.29,48.0,2.4,40.0,46.0,0.7
/fighter/Dustin-Stusse-282243,dustin stusse,The Stussinator,,,,,United States,"0'0""",158 lbs,,Welterweight,0.0,0.0,0.0,0.0,,0.0,1.0,0.0,0.0,,,,,,,,,,,,,,,,,,
,dustin west,,,,,,,,,,,,,,,,,,,,,,6.0,6.0,0.0,180.34,77.11,,,,0.0,0.0,0.0,0.0,0.0,0.0,0.0,0.0
/fighter/Dwayne-Cason-177,dwayne cason,,,,,"Fayettville, North Carolina",United States,"5'10""",212 lbs,,Heavyweight,1.0,1.0,0.0,0.0,,1.0,0.0,1.0,0.0,,,1.0,1.0,0.0,177.8,96.16,,Orthodox,,0.0,0.0,0.0,0.0,0.0,0.0,0.0,0.0
/fighter/Dwayne-Hinds-69886,dwayne hinds,Punie,01/12/1983,37.0,,Diego Martin,Trinidad and Tobago,"5'11""",170 lbs,,Welterweight,10.0,4.0,5.0,1.0,,10.0,1.0,0.0,0.0,,,,,,,,,,,,,,,,,,
/fighter/Dwi-Ani-Retno-Wulan-307341,dwi ani retno wulan,,,,,,Indonesia,"0'0""",115 lbs,,Strawweight,2.0,0.0,0.0,2.0,,2.0,1.0,0.0,0.0,,,,,,,,,,,,,,,,,,
/fighter/Dwight-Grant-68983,dwight grant,The Body Snatcher,14/09/1984,36.0,,"New York, New York",United States,"6'1""",170 lbs,Alliance MMA,Welterweight,11.0,7.0,0.0,4.0,,11.0,1.0,0.0,2.0,,The Body Snatcher,11.0,6.0,0.0,185.42,83.91,193.04,Switch,1984-09-14,3.29,36.0,2.66,60.0,0.61,100.0,66.0,0.0
,dwight joseph,,,,,,,,,,,,,,,,,,,,,,5.0,0.0,0.0,167.64,61.23,,Switch,1989-08-16,2.6,52.0,2.87,55.0,1.0,20.0,20.0,1.0
/fighter/Dylan-Andrews-21803,dylan andrews,The Villain,15/11/1979,41.0,,,New Zealand,"6'1""",185 lbs,Heartbreak Conditioning,Middleweight,18.0,13.0,3.0,2.0,,18.0,4.0,5.0,2.0,,The Villain,18.0,7.0,0.0,185.42,83.91,187.96,Switch,1979-11-15,2.21,50.0,2.72,46.0,2.83,50.0,57.0,0.4
,dylan budka,,,,,,,,,,,,,,,,,,,,,The Mindless Hulk,7.0,2.0,0.0,182.88,83.91,190.5,Switch,2000-01-14,1.47,66.0,0.73,52.0,2.0,28.0,100.0,1.0
,dylan lockard,,,,,,,,,,,,,,,,,,,,,,6.0,2.0,0.0,175.26,65.77,182.88,Orthodox,1992-05-19,1.31,53.0,3.31,52.0,2.31,40.0,28.0,1.2
/fighter/Dylan-Logan-171167,dylan logan,,,,,Dublin,Ireland,"6'0""",145 lbs,SBG Ireland,Featherweight,4.0,0.0,4.0,0.0,,4.0,2.0,2.0,0.0,,,,,,,,,,,,,,,,,,
,dylan mantello,,,,,,,,,,,,,,,,,,,,,The Quiet Man,7.0,3.0,0.0,185.42,70.31,185.42,Orthodox,1992-11-19,5.93,56.0,9.42,53.0,0.0,0.0,0.0,0.0
,dylan potter,,,,,,,,,,,,,,,,,,,,,Big Poppa,10.0,6.0,0.0,187.96,102.06,195.58,Switch,1995-01-14,3.1,48.0,5.78,46.0,0.0,0.0,33.0,1.1
,dylan salvador,,,,,,,,,,,,,,,,,,,,,,5.0,2.0,0.0,175.26,70.31,175.26,Southpaw,1993-05-20,4.34,37.0,11.57,46.0,0.0,0.0,0.0,0.0
/fighter/Dylan-Smith-48227,dylan smith,Savage,,,,"Tulsa, Oklahoma",United States,"6'0""",170 lbs,,Welterweight,10.0,2.0,8.0,0.0,,10.0,1.0,3.0,2.0,,,,,,,,,,,,,,,,,,
/fighter/Dylan-Tuke-94241,dylan tuke,The Nuke,,,,,Ireland,"0'0""",145 lbs,SBG Ireland,Featherweight,4.0,2.0,2.0,0.0,,4.0,2.0,0.0,0.0,,,,,,,,,,,,,,,,,,
/fighter/EJ-Brooks-77809,e.j. brooks,The Pretty Boy,27/11/1985,35.0,,"Cahokia, Illinois",United States,"5'8""",185 lbs,St. Charles MMA,Middleweight,14.0,1.0,3.0,10.0,,14.0,2.0,0.0,4.0,,,,,,,,,,,,,,,,,,
/fighter/Ebenezer-Fontes-Braga-207,ebenezer fontes braga,Pitbull,14/04/1969,52.0,,Rio de Janeiro,Brazil,"6'0""",199 lbs,Gracie Barra Combat Team,Light Heavyweight,13.0,5.0,3.0,2.0,3.0,13.0,3.0,2.0,2.0,0.0,Pitbull,13.0,7.0,2.0,182.88,90.26,,Orthodox,1969-04-14,2.42,50.0,0.42,71.0,0.0,0.0,90.0,0.6
/fighter/Ed-Carpenter-41632,ed carpenter,,26/12/1986,34.0,,"Chicago, Illinois",United States,"6'2""",219 lbs,Midwest Training Center,Heavyweight,6.0,1.0,5.0,0.0,,6.0,2.0,2.0,1.0,,,,,,,,,,,,,,,,,,
/fighter/Ed-Herman-6561,ed herman,Short Fuse,02/10/1980,40.0,,"Portland, Oregon",United States,"6'2""",205 lbs,American Top Team Portland,Light Heavyweight,26.0,7.0,14.0,5.0,,26.0,3.0,6.0,6.0,,Short Fuse,27.0,16.0,0.0,185.42,92.99,195.58,Orthodox,1980-10-02,3.31,48.0,3.71,42.0,1.96,47.0,59.0,1.0
,ed ratcliff,,,,,,,,,,,,,,,,,,,,,9mm,7.0,3.0,0.0,177.8,70.31,180.34,Orthodox,1983-03-05,2.71,38.0,2.96,63.0,0.28,16.0,53.0,0.0
/fighter/Ed-Ruth-197807,ed ruth,Easy,21/10/1990,30.0,,"Susquehanna Township, Pennsylvania",United States,"5'11""",170 lbs,Dethrone Base Camp,Welterweight,8.0,6.0,0.0,2.0,,8.0,0.0,2.0,1.0,,,,,,,,,,,,,,,,,,
/fighter/Ed-West-7166,ed west,Wild,30/10/1983,37.0,,"Tucson, Arizona",United States,"5'9""",135 lbs,Apex MMA,Bantamweight,25.0,1.0,14.0,10.0,,25.0,3.0,1.0,6.0,,,,,,,,,,,,,,,,,,
/fighter/Eddey-Kalai-170743,eddey kalai,The Clown,23/03/1982,39.0,,"Sandakan, Sabah",Malaysia,"5'4""",115 lbs,Kalai Brothers,Strawweight,0.0,0.0,0.0,0.0,,0.0,2.0,3.0,0.0,,,,,,,,,,,,,,,,,,
/fighter/Eddie-Alvarez-9265,eddie alvarez,The Underground King,11/01/1984,37.0,,"Philadelphia, Pennsylvania",United States,"5'9""",170 lbs,Ricardo Almeida Jiu-Jitsu,Welterweight,30.0,18.0,6.0,6.0,,30.0,4.0,2.0,2.0,,,29.0,6.0,0.0,175.26,70.31,175.26,Orthodox,1984-01-11,4.32,41.0,4.39,55.0,2.92,36.0,92.0,0.5
/fighter/Eddie-Castillo-97645,eddie castillo,,24/12/1989,31.0,,,United States,"0'0""",318 lbs,,Super Heavyweight,2.0,2.0,0.0,0.0,,2.0,2.0,0.0,1.0,,,,,,,,,,,,,,,,,,
/fighter/Eddie-Gordon-66410,eddie gordon,Truck,22/07/1983,38.0,,"Freeport, New York",United States,"6'0""",170 lbs,Serra-Longo Fight Team,Welterweight,8.0,3.0,1.0,4.0,,8.0,1.0,1.0,5.0,,Truck,8.0,4.0,0.0,182.88,83.91,193.04,Orthodox,1983-07-22,2.03,32.0,2.57,60.0,1.93,83.0,63.0,0.0
/fighter/Eddie-Larrea-28037,eddie larrea,Fast,22/02/1982,39.0,,"Rhinelander, Wisconsin",United States,"6'0""",184 lbs,Independent,Middleweight,22.0,11.0,11.0,0.0,,22.0,9.0,29.0,10.0,,,,,,,,,,,,,,,,,,
/fighter/Eddie-Mendez-37421,eddie mendez,,,,,"Sun Valley, California",United States,"5'9""",185 lbs,House of Champions,Middleweight,8.0,3.0,1.0,4.0,,8.0,1.0,1.0,1.0,,,8.0,3.0,1.0,177.8,83.91,,,,1.71,33.0,3.43,11.0,0.0,0.0,0.0,0.0
/fighter/Eddie-Ng-22810,eddie ng,The Magician,08/03/1986,35.0,,,Hong Kong,"5'8""",155 lbs,Evolve MMA,Lightweight,7.0,3.0,4.0,0.0,,7.0,2.0,1.0,1.0,,,,,,,,,,,,,,,,,,
/fighter/Eddie-Ruiz-3265,eddie ruiz,,,,,,USA,"5'7""",155 lbs,,Lightweight,1.0,0.0,1.0,0.0,,1.0,0.0,0.0,1.0,,,1.0,1.0,0.0,170.18,70.31,,Orthodox,1967-06-10,0.2,25.0,1.4,47.0,2.0,12.0,0.0,0.0
/fighter/Eddie-Sanchez-12098,eddie sanchez,The Manic Hispanic,11/04/1982,39.0,,"San Diego, California",United States,"6'3""",214 lbs,Kings MMA,Heavyweight,15.0,11.0,2.0,2.0,,15.0,5.0,1.0,2.0,,The Manic Hispanic,15.0,8.0,0.0,187.96,104.33,187.96,Orthodox,1982-11-04,3.45,43.0,3.3,43.0,1.13,26.0,42.0,0.0
/fighter/Eddie-Wineland-4173,eddie wineland,,26/06/1984,37.0,,"Portage, Indiana",United States,"5'8""",135 lbs,Duneland Vale Tudo,Bantamweight,24.0,15.0,4.0,4.0,1.0,24.0,5.0,4.0,6.0,0.0,,24.0,16.0,1.0,170.18,61.23,175.26,Orthodox,1984-06-26,3.4,29.0,3.76,68.0,0.34,33.0,86.0,0.1
/fighter/Eddie-Yagin-2825,eddie yagin,The Filipino Phenom,23/03/1979,42.0,,"Honolulu, Hawaii",United States,"5'6""",145 lbs,Kong Submission Academy,Featherweight,16.0,5.0,5.0,6.0,,16.0,3.0,1.0,3.0,,The Filipino Phenom,16.0,7.0,1.0,170.18,65.77,,Orthodox,1979-03-23,3.13,30.0,5.77,42.0,0.0,0.0,62.0,1.0
,eddy ellis,,,,,,,,,,,,,,,,,,,,,Fast,21.0,16.0,1.0,175.26,77.11,,Orthodox,,3.4,69.0,1.53,68.0,4.0,66.0,50.0,2.0
,eddy millis,,,,,,,,,,,,,,,,,,,,,,0.0,2.0,0.0,185.42,83.91,,,,0.0,0.0,3.36,22.0,0.0,0.0,0.0,7.2
/fighter/Ederson-Cristian-Macedo-108165,ederson cristian macedo,Lion,10/06/1984,37.0,,Rio de Janeiro,Brazil,"6'2""",185 lbs,XGym Brazil,Middleweight,10.0,2.0,8.0,0.0,,10.0,1.0,4.0,1.0,,,,,,,,,,,,,,,,,,
,edgar cardenas,,,,,,,,,,,,,,,,,,,,,Kitty Katt,4.0,1.0,0.0,,65.77,,,,0.0,0.0,0.0,0.0,0.0,0.0,0.0,0.0
,edgar chairez,,,,,,,,,,,,,,,,,,,,,Puro Chicali,10.0,5.0,0.0,170.18,56.7,180.34,Orthodox,1996-01-27,2.6,48.0,4.26,41.0,0.0,0.0,45.0,1.3
/fighter/Edgar-Garcia-23108,edgar garcia,,22/02/1984,37.0,,"Yuma, Arizona",United States,"5'10""",170 lbs,Arizona Athletic Club,Welterweight,14.0,8.0,4.0,2.0,,14.0,2.0,2.0,1.0,,,14.0,5.0,0.0,177.8,77.11,180.34,Orthodox,1984-02-22,3.16,29.0,4.23,60.0,2.21,57.0,50.0,0.6
/fighter/Edilah-Nadrah-Johany-262299,edilah nadrah johany,Ilah,,,,Ranau,Malaysia,"5'1""",115 lbs,Ewako Gym,Strawweight,2.0,1.0,1.0,0.0,,2.0,3.0,1.0,0.0,,,,,,,,,,,,,,,,,,
/fighter/Edilberto-de-Oliveira-11907,edilberto de oliveira,Crocota,22/11/1982,38.0,,"Campo Formoso, Bahia",Brazil,"6'0""",170 lbs,Champion Team,Welterweight,30.0,13.0,13.0,4.0,,30.0,5.0,1.0,13.0,,Crocota,29.0,15.0,2.0,182.88,77.11,,Orthodox,1982-11-22,4.12,32.0,6.79,61.0,0.0,0.0,0.0,0.0
/fighter/Edimilson-Souza-57343,edimilson souza,Kevin,17/10/1984,36.0,,"Salvador, Bahia",Brazil,"6'0""",145 lbs,DS Team,Featherweight,17.0,14.0,1.0,2.0,,17.0,1.0,4.0,1.0,,Kevin,15.0,5.0,0.0,182.88,65.77,187.96,Orthodox,1984-10-17,4.65,44.0,2.91,58.0,0.0,0.0,50.0,0.0
,edivan santos,,,,,,,,,,,,,,,,,,,,,Pe De Sapo,12.0,3.0,1.0,193.04,112.49,198.12,Orthodox,1992-05-03,1.55,48.0,7.09,26.0,0.0,0.0,25.0,0.0
/fighter/Edmen-Shahbazyan-247691,edmen shahbazyan,The Golden Boy,20/11/1997,23.0,,"Los Angeles, California",United States,"6'2""",185 lbs,Glendale Fighting Club,Middleweight,11.0,9.0,1.0,1.0,,11.0,1.0,0.0,1.0,,The Golden Boy,12.0,4.0,0.0,187.96,83.91,190.5,Orthodox,1997-11-20,3.46,51.0,4.13,43.0,2.17,39.0,63.0,0.6
/fighter/Ednaldo-Oliveira-14972,ednaldo oliveira,Lula Molusco,19/02/1984,37.0,,"Salvador, Bahia",Brazil,"6'7""",205 lbs,Champion Team,Light Heavyweight,21.0,11.0,2.0,8.0,,21.0,2.0,4.0,2.0,,Lula,17.0,3.0,1.0,195.58,92.99,,Orthodox,1984-02-19,1.03,22.0,1.8,52.0,0.0,0.0,42.0,0.0
/fighter/Edson-Barboza-46259,edson barboza,,21/01/1986,35.0,,"Nova Friburgo, Rio de Janeiro",Brazil,"5'11""",145 lbs,American Top Team,Featherweight,22.0,13.0,1.0,8.0,,22.0,3.0,2.0,4.0,,Junior,24.0,11.0,0.0,180.34,65.77,190.5,Orthodox,1986-01-21,4.18,45.0,4.34,57.0,0.48,50.0,75.0,0.1
/fighter/Edson-Berto-9770,edson berto,Little Tiger,05/07/1983,38.0,,"Orlando, Florida",United States,"5'6""",145 lbs,Tiger's World of Martial Arts,Featherweight,17.0,4.0,10.0,3.0,,17.0,3.0,1.0,8.0,,Little Tiger,17.0,12.0,1.0,167.64,70.31,,Orthodox,1983-07-05,1.76,36.0,4.62,47.0,5.47,40.0,0.0,2.7
/fighter/Edson-Diniz-3651,edson diniz,,22/03/1978,43.0,,"Rio de Janeiro, Rio de Janeiro",Brazil,"5'9""",155 lbs,OxyGym Fight Team,Lightweight,12.0,1.0,8.0,3.0,0.0,12.0,2.0,1.0,2.0,1.0,,,,,,,,,,,,,,,,,
,edson drago,,,,,,,,,,,,,,,,,,,,,,11.0,7.0,0.0,193.04,99.79,,Orthodox,1977-08-29,1.16,40.0,2.39,36.0,0.0,0.0,55.0,0.0
,edson gomez,,,,,,,,,,,,,,,,,,,,,,6.0,2.0,0.0,172.72,77.11,175.26,Switch,1991-02-23,2.66,32.0,8.78,45.0,0.0,0.0,0.0,0.0
/fighter/Edson-Marques-137419,edson marques,Panico,16/10/1988,32.0,,"Goiania, Goias",Brazil,"6'0""",170 lbs,New Level Muay Thai Academy,Welterweight,9.0,6.0,1.0,1.0,1.0,9.0,1.0,0.0,0.0,0.0,,,,,,,,,,,,,,,,,
,edson silva,,,,,,,,,,,,,,,,,,,,,Paredao,14.0,12.0,0.0,,92.99,,Orthodox,,2.69,14.0,5.37,50.0,0.0,0.0,0.0,0.0
/fighter/Eduard-Folayang-40882,eduard folayang,Landslide,22/11/1983,37.0,,"Baguio City, Benguet",Philippines,"5'9""",155 lbs,Lakay MMA,Lightweight,22.0,7.0,1.0,14.0,,22.0,4.0,3.0,4.0,,,,,,,,,,,,,,,,,,
/fighter/Eduard-Muravitskiy-104055,eduard muravitskiy,The Hunter,,,,Minsk,Belarus,"5'10""",155 lbs,Phoenix,Lightweight,7.0,2.0,4.0,1.0,,7.0,3.0,2.0,4.0,,,,,,,,,,,,,,,,,,
,eduarda moura,,,,,,,,,,,,,,,,,,,,,Ronda,10.0,0.0,0.0,167.64,52.16,167.64,Orthodox,1994-02-28,5.61,67.0,0.45,80.0,5.34,100.0,0.0,1.3
/fighter/Eduardo-Bustillos-136235,eduardo bustillos,,02/06/1987,34.0,,"Saltillo, Coahuila",Mexico,"5'8""",155 lbs,,Lightweight,5.0,1.0,4.0,0.0,,5.0,1.0,4.0,0.0,,,5.0,3.0,0.0,172.72,61.23,,,,2.61,59.0,6.22,35.0,0.0,0.0,100.0,0.0
/fighter/Eduardo-Dantas-21767,eduardo dantas,Dudu,03/02/1989,32.0,,Rio de Janeiro,Brazil,"5'10""",135 lbs,Nova Uniao,Bantamweight,22.0,4.0,7.0,11.0,0.0,22.0,3.0,0.0,3.0,1.0,Dudu,20.0,4.0,0.0,177.8,61.23,,,,3.33,60.0,3.0,60.0,4.0,23.0,100.0,0.0
,eduardo garagorri,,,,,,,,,,,,,,,,,,,,,,13.0,2.0,0.0,175.26,65.77,177.8,Orthodox,1989-05-28,3.42,51.0,2.36,58.0,0.48,100.0,61.0,0.0
/fighter/Eduardo-Guedes-21879,eduardo guedes,,,,,"Jupiter, Florida",United States,"5'7""",155 lbs,The Armory,Lightweight,6.0,2.0,2.0,2.0,,6.0,0.0,0.0,1.0,,,,,,,,,,,,,,,,,,
,eduardo neves,,,,,,,,,,,,,,,,,,,,,Bebezao,7.0,2.0,0.0,187.96,119.29,198.12,Orthodox,2000-03-16,7.69,65.0,6.15,55.0,5.77,66.0,0.0,0.0
/fighter/Eduardo-Novaes-244329,eduardo novaes,,26/07/1980,41.0,,Singapore,Brazil,"0'0""",145 lbs,Evolve MMA,Featherweight,0.0,0.0,0.0,0.0,,0.0,1.0,0.0,0.0,,,,,,,,,,,,,,,,,,
,eduardo pamplona,,,,,,,,,,,,,,,,,,,,,,16.0,4.0,0.0,180.34,77.11,,,,0.0,0.0,0.0,0.0,0.0,0.0,0.0,0.0
,eduardo torres caut,,,,,,,,,,,,,,,,,,,,,Cyborg,16.0,2.0,0.0,170.18,61.23,177.8,Orthodox,1995-04-26,1.1,34.0,1.24,65.0,2.06,33.0,50.0,0.0
/fighter/Edward-Faaloloto-55070,edward faaloloto,Falo,15/07/1985,36.0,,"Honolulu, Hawaii",United States,"5'9""",170 lbs,Mori Dojo,Welterweight,2.0,0.0,1.0,1.0,,2.0,2.0,2.0,1.0,,,2.0,5.0,0.0,,70.31,177.8,Orthodox,1984-07-15,2.28,32.0,6.25,44.0,1.01,25.0,33.0,0.0
/fighter/Edward-Kelly-130299,edward kelly,The Ferocious,01/03/1984,37.0,,"Baguio, Benguet",Philippines,"5'9""",145 lbs,Lakay MMA,Featherweight,13.0,6.0,3.0,2.0,2.0,13.0,4.0,1.0,3.0,0.0,,,,,,,,,,,,,,,,,
/fighter/Edward-Thommes-69128,edward thommes,The Promise,18/07/1992,29.0,,Hawaii,United States,"0'0""",145 lbs,Gracie Technics,Featherweight,8.0,1.0,4.0,3.0,,8.0,1.0,0.0,2.0,,,,,,,,,,,,,,,,,,
/fighter/Edwin-Aguilar-4635,edwin aguilar,El Tigre,,,24/11/2016,"Tijuana, Baja California",Mexico,"5'10""",170 lbs,Tiger's Team,Welterweight,26.0,20.0,3.0,3.0,,26.0,8.0,9.0,2.0,,Tigre,26.0,19.0,0.0,177.8,83.91,,,,0.0,0.0,0.0,0.0,0.0,0.0,0.0,0.0
/fighter/Edwin-Dewees-720,edwin dewees,Babyface,07/08/1982,39.0,,"Scottsdale, Arizona",United States,"6'1""",205 lbs,Lions Den Scottsdale,Light Heavyweight,38.0,10.0,24.0,4.0,,38.0,7.0,6.0,4.0,,Babyface,38.0,17.0,0.0,185.42,83.91,,Orthodox,1982-08-07,1.53,33.0,6.19,39.0,2.18,66.0,0.0,3.3
/fighter/Edwin-Figueroa-22490,edwin figueroa,El Feroz,31/07/1984,37.0,,"McKinney, Texas",United States,"5'7""",135 lbs,Mohler MMA,Bantamweight,9.0,6.0,2.0,1.0,,9.0,1.0,0.0,4.0,,El Feroz,9.0,5.0,0.0,170.18,61.23,175.26,Orthodox,1984-07-31,2.57,39.0,3.06,51.0,0.2,100.0,37.0,0.6
/fighter/Efrain-Escudero-16555,efrain escudero,Hecho en Mexico,15/01/1986,35.0,,"Tempe, Arizona",United States,"5'9""",155 lbs,Inv1ktus MMA,Lightweight,31.0,2.0,16.0,13.0,,31.0,0.0,2.0,14.0,,Hecho En Mexico,28.0,12.0,0.0,175.26,70.31,180.34,Orthodox,1986-01-15,2.92,44.0,2.3,63.0,1.31,40.0,66.0,0.8
,egan inoue,,,,,,,,,,,,,,,,,,,,,,13.0,8.0,0.0,175.26,86.18,,Southpaw,1965-07-04,1.66,36.0,3.31,57.0,0.0,0.0,0.0,0.0
/fighter/Egidijus-Valavicius-2598,egidijus valavicius,,23/12/1978,42.0,,Marijampole,Lithuania,"6'0""",205 lbs,Flawless MMA,Light Heavyweight,29.0,18.0,6.0,5.0,,29.0,3.0,5.0,4.0,,,29.0,12.0,0.0,182.88,90.72,,Orthodox,,0.0,0.0,0.0,0.0,0.0,0.0,0.0,0.0
/fighter/Ehpriyanut-Phouthong-210957,ehpriyanut   phouthong,Eh Ya Nut,14/09/1997,23.0,,,Cambodia,"5'4""",105 lbs,A-Fighter,Atomweight,0.0,0.0,0.0,0.0,,0.0,0.0,0.0,2.0,,,,,,,,,,,,,,,,,,
,eiji ishikawa,,,,,,,,,,,,,,,,,,,,,,29.0,24.0,3.0,177.8,77.11,,,,1.2,29.0,4.07,60.0,1.0,9.0,0.0,0.0
/fighter/Eiji-Mitsuoka-2235,eiji mitsuoka,The Heaven-Sent Child of the Cage,01/01/1976,45.0,,"Handa, Aichi",Japan,"5'7""",145 lbs,Wajyutsu Keisyukai RJW,Featherweight,18.0,4.0,10.0,4.0,,18.0,3.0,2.0,4.0,,,18.0,9.0,2.0,170.18,65.77,,Southpaw,1976-01-01,1.49,49.0,2.26,45.0,2.3,36.0,20.0,1.6
/fighter/Eka-Aprilianto-272611,eka aprilianto,Egi Rozten,05/04/1988,33.0,,Jakarta,Indonesia,"5'6""",135 lbs,IndoGym,Bantamweight,2.0,2.0,0.0,0.0,,2.0,3.0,2.0,0.0,,,,,,,,,,,,,,,,,,
/fighter/Eko-Subandono-232893,eko  subandono,,,,,"Sidoarjo, Jawa Timur",Indonesia,"0'0""",145 lbs,,Featherweight,1.0,0.0,0.0,1.0,,1.0,0.0,0.0,0.0,,,,,,,,,,,,,,,,,,
/fighter/Eko-Roni-Saputra-320023,eko roni saputra,,02/05/1991,30.0,,,Indonesia,"5'4""",135 lbs,Evolve MMA,Bantamweight,4.0,1.0,3.0,0.0,,4.0,1.0,0.0,0.0,,,,,,,,,,,,,,,,,,
,elaina maxwell,,,,,,,,,,,,,,,,,,,,,Beef,7.0,4.0,0.0,172.72,65.77,,Orthodox,1978-12-16,2.07,60.0,2.4,53.0,0.0,0.0,50.0,1.0
/fighter/Elazar-Tariku-151121,elazar tariku,,23/06/1987,34.0,,Ashkelon,Israel,"5'8""",145 lbs,Team Spider Ashkelon,Featherweight,4.0,0.0,4.0,0.0,,4.0,1.0,0.0,0.0,,,,,,,,,,,,,,,,,,
,eldari kurtanidze,,,,,,,,,,,,,,,,,,,,,,0.0,1.0,0.0,167.64,106.59,,Orthodox,1972-04-16,0.47,20.0,3.72,60.0,0.0,0.0,0.0,0.0
/fighter/Eldo-Dias-Xavier-55,eldo dias xavier,Iron Hand,16/07/1964,57.0,,Belo Horizonte,Brazil,"5'11""",180 lbs,,Middleweight,0.0,0.0,0.0,0.0,,0.0,1.0,0.0,0.0,,,,,,,,,,,,,,,,,,
,eldo xavier dias,,,,,,,,,,,,,,,,,,,,,,0.0,1.0,0.0,180.34,81.65,,,,0.0,0.0,0.0,0.0,0.0,0.0,0.0,0.0
/fighter/Elena-Pashnina-202067,elena pashnina,,06/11/1994,26.0,,,Russia,"5'3""",105 lbs,Chengdu BJJ,Atomweight,0.0,0.0,0.0,0.0,,0.0,1.0,0.0,1.0,,,,,,,,,,,,,,,,,,
/fighter/Eli-Aronov-295271,eli aronov,,06/06/1996,25.0,,Arad,Israel,"5'10""",205 lbs,,Light Heavyweight,5.0,1.0,1.0,3.0,,5.0,0.0,0.0,0.0,,The Israeli Tank,6.0,1.0,0.0,177.8,83.91,182.88,Orthodox,1996-06-06,8.92,68.0,6.49,38.0,12.16,100.0,0.0,0.0
,eli tamez,,,,,,,,,,,,,,,,,,,,,Tomahawk,10.0,0.0,0.0,170.18,61.23,,,,0.0,0.0,0.0,0.0,0.0,0.0,0.0,0.0
/fighter/Elias-Anderson-284467,elias anderson,,,,,,USA,"0'0""",155 lbs,,Lightweight,0.0,0.0,0.0,0.0,,0.0,1.0,0.0,1.0,,,,,,,,,,,,,,,,,,
/fighter/Elias-Garcia-71080,elias garcia,,13/09/1992,28.0,,"Milwaukee, Wisconsin",United States,"5'5""",125 lbs,Roufusport,Flyweight,6.0,2.0,3.0,1.0,,6.0,0.0,1.0,1.0,,,6.0,2.0,0.0,165.1,56.7,170.18,Southpaw,1992-09-13,1.59,27.0,5.05,50.0,0.68,14.0,33.0,1.4
/fighter/Elias-Mamadov-45507,elias mamadov,,,,,Beer Sheva,Israel,"5'7""",145 lbs,,Featherweight,1.0,1.0,0.0,0.0,,1.0,0.0,0.0,1.0,,,,,,,,,,,,,,,,,,
/fighter/Elias-Silverio-88613,elias silverio,Xuxu,22/09/1986,34.0,,"Pirapora do Bom Jesus, Sao Paulo",Brazil,"5'11""",170 lbs,Elias Silverio Team,Welterweight,17.0,4.0,1.0,12.0,,17.0,1.0,1.0,5.0,,Xuxu,13.0,3.0,0.0,180.34,70.31,185.42,Orthodox,1986-09-22,3.67,49.0,2.97,51.0,1.62,38.0,85.0,0.2
/fighter/Elias-Theodorou-81765,elias theodorou,The Spartan,31/05/1988,33.0,,"Mississauga, Ontario",Canada,"6'1""",185 lbs,Kros Gym,Middleweight,18.0,8.0,1.0,9.0,,18.0,0.0,0.0,3.0,,The Spartan,16.0,3.0,0.0,185.42,83.91,190.5,Orthodox,1988-05-31,4.19,42.0,2.39,53.0,1.27,28.0,59.0,0.0
,elias urbina,,,,,,,,,,,,,,,,,,,,,,3.0,1.0,0.0,190.5,83.91,195.58,Southpaw,1993-10-09,3.85,37.0,6.17,50.0,0.0,0.0,0.0,0.0
/fighter/Elina-Kallionidou-186033,elina kallionidou,Gunner,18/11/1998,22.0,,"Preveza, Epirus",Greece,"5'5""",125 lbs,Armagos Gym,Flyweight,7.0,4.0,1.0,2.0,,7.0,0.0,0.0,4.0,,,,,,,,,,,,,,,,,,
/fighter/Eliot-Corley-69091,eliot corley,,,,,,United States,"6'0""",155 lbs,Tough MMA,Lightweight,2.0,1.0,1.0,0.0,,2.0,0.0,1.0,1.0,,,,,,,,,,,,,,,,,,
/fighter/Eliot-Marshall-15104,eliot marshall,The Fire,07/07/1980,41.0,,"Boulder, Colorado",United States,"6'3""",205 lbs,Grudge Training Center,Light Heavyweight,10.0,1.0,5.0,4.0,,10.0,2.0,0.0,2.0,,Fire,10.0,4.0,0.0,187.96,92.99,195.58,Orthodox,1980-07-07,1.93,27.0,2.39,67.0,0.47,33.0,79.0,0.9
/fighter/Elipitua-Siregar-285043,elipitua siregar,The Magician,,,,,Indonesia,"0'0""",125 lbs,Bali MMA,Flyweight,4.0,1.0,3.0,0.0,,4.0,0.0,1.0,0.0,,,,,,,,,,,,,,,,,,
/fighter/Elise-Reed-278133,elise reed,,05/12/1992,28.0,,"Princeton, New Jersey",United States,"5'3""",125 lbs,Kickside Martial Arts,Flyweight,4.0,2.0,0.0,2.0,,4.0,1.0,0.0,0.0,,,7.0,4.0,0.0,160.02,52.16,160.02,Orthodox,1992-12-05,2.66,49.0,3.06,52.0,0.58,60.0,42.0,0.0
,elisha helsper,,,,,,,,,,,,,,,,,,,,,Knuckles,0.0,4.0,0.0,167.64,61.23,,Orthodox,1983-02-06,0.0,0.0,0.0,0.0,0.0,0.0,0.0,0.0
/fighter/Eliyas-Latupeirissa-232905,eliyas latupeirissa,Malaku Warrior,07/09/1994,26.0,,Jakarta,Indonesia,"0'0""",125 lbs,Tigershark Fighting Academy,Flyweight,0.0,0.0,0.0,0.0,,0.0,0.0,0.0,1.0,,,,,,,,,,,,,,,,,,
/fighter/Elizabeth-Phillips-83021,elizabeth phillips,,20/08/1986,34.0,,"Spokane, Washington",United States,"5'6""",135 lbs,SikJitsu,Bantamweight,7.0,2.0,1.0,4.0,,7.0,2.0,0.0,6.0,,,6.0,6.0,0.0,167.64,61.23,165.1,Orthodox,1986-08-20,2.6,33.0,3.07,58.0,0.75,25.0,53.0,0.2
,elizeu dos santos,,,,,,,,,,,,,,,,,,,,,,,,,,,,,,,,,,,,,
/fighter/Elizeu-Zaleski-dos-Santos-63825,elizeu zaleski dos santos,Capoeira,12/11/1986,34.0,,"Francisco Beltrao, Parana",Brazil,"5'11""",170 lbs,CM System,Welterweight,22.0,14.0,3.0,5.0,,22.0,1.0,2.0,4.0,,Capoeira,24.0,7.0,1.0,180.34,77.11,185.42,Orthodox,1986-12-11,4.52,42.0,3.33,57.0,0.43,13.0,68.0,0.4
/fighter/Ella-Tang-71925,ella tang,Ice Cool,15/10/1989,31.0,,Kuala Lumpur,Malaysia,"5'6""",139 lbs,TNT Kickboxing,Featherweight,0.0,0.0,0.0,0.0,,0.0,3.0,0.0,1.0,,,,,,,,,,,,,,,,,,
,elves brener,,,,,,,,,,,,,,,,,,,,,,16.0,3.0,0.0,177.8,70.31,182.88,Orthodox,1997-09-27,4.64,46.0,5.05,55.0,0.93,20.0,85.0,0.0
/fighter/Elvis-Mutapcic-28038,elvis mutapcic,The King,19/07/1986,35.0,,"Des Moines, Iowa",United States,"6'0""",185 lbs,RoundKick Gym,Middleweight,16.0,7.0,6.0,3.0,,16.0,2.0,0.0,4.0,,The King,15.0,6.0,1.0,182.88,83.91,182.88,Orthodox,1986-07-19,3.41,40.0,4.27,38.0,0.0,0.0,81.0,0.0
/fighter/Elvis-Sinosic-281,elvis sinosic,The King of Rock n Rumble,13/02/1971,50.0,,Sydney,Australia,"6'3""",199 lbs,,Light Heavyweight,7.0,4.0,3.0,0.0,,7.0,6.0,1.0,4.0,,The King of Rock n' Rumble,7.0,11.0,2.0,190.5,92.99,195.58,Orthodox,1971-02-13,1.13,37.0,4.6,53.0,0.0,0.0,0.0,1.2
/fighter/Emanuel-Newton-8833,emanuel newton,The Hardcore Kid,02/01/1984,37.0,,"Norwalk, California",United States,"6'1""",204 lbs,Reign MMA,Light Heavyweight,26.0,4.0,10.0,12.0,,26.0,2.0,3.0,8.0,,The Hardcore Kid,26.0,12.0,1.0,185.42,92.99,,,,1.92,49.0,1.35,51.0,2.02,100.0,0.0,0.0
/fighter/Emanuele-Palombi-199703,emanuele palombi,,22/04/1986,35.0,,Rome,Italy,"5'11""",185 lbs,Kombat Gym Pordenone,Middleweight,6.0,3.0,2.0,1.0,,6.0,3.0,0.0,4.0,,,,,,,,,,,,,,,,,,
/fighter/Emil-Meek-66143,emil meek,Valhalla,20/08/1988,32.0,,Trondheim,Norway,"5'11""",170 lbs,Xtreme Couture,Welterweight,9.0,7.0,1.0,1.0,,9.0,2.0,0.0,3.0,,Valhalla,9.0,5.0,1.0,180.34,77.11,187.96,Switch,1988-08-20,2.52,39.0,2.53,38.0,0.25,33.0,47.0,1.0
/fighter/Emilee-King-255835,emilee king,,19/02/1993,28.0,,"Knoxville, Tennessee",United States,"5'4""",115 lbs,Knoxville Martial Arts Academy,Strawweight,5.0,0.0,3.0,2.0,,5.0,0.0,5.0,0.0,,,,,,,,,,,,,,,,,,
,emiliano linares,,,,,,,,,,,,,,,,,,,,,Golden Bull,8.0,2.0,0.0,172.72,65.77,182.88,Orthodox,1997-04-21,1.17,28.0,3.59,26.0,0.0,0.0,33.0,0.0
/fighter/Emiliano-Sordi-79071,emiliano sordi,He-Man,15/02/1991,30.0,,"Rio Cuarto, Cordoba",Argentina,"6'2""",205 lbs,Nova Uniao Argentina,Light Heavyweight,23.0,16.0,6.0,1.0,,23.0,3.0,4.0,1.0,,He-Man,16.0,7.0,0.0,187.96,92.99,,Orthodox,1991-02-15,4.79,50.0,4.79,48.0,0.0,0.0,100.0,8.3
/fighter/Emilio-Chavez-23991,emilio chavez,The Ferocious Aztec,18/12/1986,34.0,,"Fullerton, California",United States,"5'9""",145 lbs,Bodyshop Fitness Team,Featherweight,12.0,2.0,5.0,5.0,,12.0,1.0,5.0,4.0,,,12.0,9.0,0.0,175.26,65.77,,,,2.73,48.0,1.53,54.0,3.0,50.0,0.0,0.0
,emilio cuellar,,,,,,,,,,,,,,,,,,,,,Show Kid,6.0,1.0,0.0,,56.7,,,,0.0,0.0,0.0,0.0,0.0,0.0,0.0,0.0
/fighter/Emilio-Trevino-282989,emilio trevino,,,,,,United States,"6'2""",265 lbs,,Heavyweight,5.0,2.0,1.0,2.0,,5.0,0.0,0.0,0.0,,,,,,,,,,,,,,,,,,
/fighter/Emilio-Urrutia-152647,emilio urrutia,The Honey Badger,19/11/1986,34.0,,"Miami, Florida",United States,"5'8""",143 lbs,Tiger Muay Thai,Featherweight,11.0,1.0,4.0,6.0,,11.0,4.0,2.0,2.0,,,,,,,,,,,,,,,,,,
/fighter/Emilio-Williams-231183,emilio williams,El Pinguino,21/08/1991,29.0,,"San Diego, California",United States,"6'1""",185 lbs,One Training Center,Middleweight,4.0,4.0,0.0,0.0,,4.0,2.0,0.0,0.0,,,,,,,,,,,,,,,,,,
/fighter/Emily-Ducote-207407,emily ducote,Gordinha,01/01/1994,27.0,,"Oklahoma City, Oklahoma",United States,"5'2""",115 lbs,American Top Team OKC,Strawweight,9.0,1.0,4.0,4.0,,9.0,0.0,1.0,5.0,,Gordinha,13.0,8.0,0.0,157.48,52.16,160.02,Orthodox,1994-01-01,6.93,48.0,7.98,56.0,0.25,14.0,92.0,0.0
,emily fernandez,,,,,,,,,,,,,,,,,,,,,,0.0,0.0,0.0,,,,,,0.0,0.0,0.0,0.0,0.0,0.0,0.0,0.0
/fighter/Emily-Kagan-68959,emily kagan,,14/07/1981,40.0,,"Albuquerque, New Mexico",United States,"5'3""",115 lbs,Jackson-Wink MMA,Strawweight,3.0,0.0,0.0,3.0,,3.0,0.0,2.0,1.0,,,3.0,3.0,0.0,160.02,52.16,,,,2.6,36.0,5.29,38.0,1.86,14.0,50.0,0.0
,emily peters kagan,,,,,,,,,,,,,,,,,,,,,,,,,,,,,,,,,,,,,
/fighter/Emily-Whitmire-61380,emily whitmire,Spitfire,24/05/1991,30.0,,"Hillsboro, Oregon",United States,"5'5""",115 lbs,Xtreme Couture,Strawweight,4.0,0.0,1.0,3.0,,4.0,0.0,4.0,0.0,,Spitfire,4.0,5.0,0.0,165.1,56.7,160.02,Orthodox,1991-05-24,2.5,31.0,2.98,54.0,1.9,66.0,70.0,0.5
/fighter/Emmanuel-Dawa-41877,emmanuel dawa,Papou Lele,03/12/1984,36.0,,Paris,France,"6'1""",170 lbs,Snake Team,Welterweight,9.0,6.0,1.0,2.0,,9.0,3.0,2.0,0.0,,,,,,,,,,,,,,,,,,
/fighter/Emmanuel-Onyedikachi-289317,emmanuel onyedikachi,The Biafran Warrior,29/11/1986,34.0,,,Nigeria,"0'0""",205 lbs,Selapak,Light Heavyweight,4.0,1.0,0.0,3.0,,4.0,1.0,0.0,0.0,,,,,,,,,,,,,,,,,,
/fighter/Emmanuel-Rivera-83999,emmanuel rivera,El Punisher,12/11/1986,34.0,,"Edmond, Oklahoma",United States,"5'9""",145 lbs,Oklahoma Wrestling Academy,Featherweight,6.0,4.0,0.0,2.0,,6.0,0.0,0.0,2.0,,,,,,,,,,,,,,,,,,
/fighter/Emmanuel-Sanchez-29839,emmanuel sanchez,El Matador,11/08/1990,31.0,,"Milwaukee, Wisconsin",United States,"5'9""",145 lbs,Roufusport,Featherweight,20.0,1.0,8.0,11.0,,20.0,0.0,1.0,5.0,,El Matador,15.0,3.0,0.0,175.26,65.77,180.34,,,4.45,35.0,4.17,55.0,0.25,6.0,16.0,0.5
/fighter/Emmanuel-Verdier-227435,emmanuel verdier,Bad News,25/12/1993,27.0,,"Margate, Florida",United States,"6'1""",185 lbs,,Middleweight,5.0,3.0,1.0,1.0,,5.0,3.0,0.0,1.0,,,,,,,,,,,,,,,,,,
/fighter/Emmanuel-Yarborough-39,emmanuel yarborough,Manny,05/09/1964,,21/12/2015,"Rahway, New Jersey",United States,"6'8""",600 lbs,Freelance,Super Heavyweight,1.0,0.0,1.0,0.0,,1.0,2.0,0.0,0.0,,,1.0,2.0,0.0,203.2,349.27,,Open Stance,1960-09-05,0.0,0.0,0.0,0.0,0.0,0.0,0.0,0.0
,emrah sonmez,,,,,,,,,,,,,,,,,,,,,Anatolian Wolf,14.0,5.0,0.0,177.8,65.77,180.34,Orthodox,1992-06-26,1.47,46.0,1.73,48.0,5.0,21.0,0.0,0.0
/fighter/Enkhtaivan-Davaabayar-271065,enkhtaivan davaabayar,,,,,,Mongolia,"0'0""",170 lbs,Zorky's MMA,Welterweight,1.0,1.0,0.0,0.0,,1.0,0.0,1.0,1.0,,,,,,,,,,,,,,,,,,
/fighter/Enrique-Barzola-129351,enrique barzola,El Fuerte,25/04/1989,32.0,,"El Agustino, Lima",Peru,"5'7""",145 lbs,Pitbull Martial Arts Center,Featherweight,16.0,4.0,4.0,8.0,,16.0,0.0,0.0,5.0,,El Fuerte,17.0,5.0,2.0,170.18,65.77,177.8,Orthodox,1989-04-28,3.91,41.0,2.97,68.0,4.2,45.0,66.0,0.3
/fighter/Enrique-Briones-20939,enrique briones,Henry Bure,22/10/1980,40.0,,"Tijuana, Baja California",Mexico,"5'8""",135 lbs,Entram Gym,Bantamweight,16.0,8.0,6.0,2.0,,16.0,1.0,2.0,5.0,,,,,,,,,,,,,,,,,,
/fighter/Enrique-Marin-27077,enrique marin,Wasabi,02/09/1986,34.0,,"Seville, Andalusia",Spain,"5'10""",155 lbs,Sutemi Fight Academy,Lightweight,12.0,2.0,5.0,5.0,,12.0,1.0,2.0,3.0,,Wasabi,10.0,4.0,0.0,177.8,77.11,,,,1.43,33.0,3.0,50.0,2.5,38.0,60.0,1.0
/fighter/Enrique-Watson-173641,enrique watson,,25/08/1978,42.0,,"St. Robert, Missouri",United States,"5'9""",186 lbs,,Middleweight,3.0,2.0,1.0,0.0,,3.0,1.0,0.0,0.0,,,3.0,1.0,0.0,,83.91,,,,0.0,0.0,0.0,0.0,0.0,0.0,0.0,0.0
/fighter/Enson-Inoue-12,enson inoue,Yamato Damashi,15/04/1967,54.0,,"Omiya, Saitama",Japan,"5'10""",204 lbs,Purebred Omiya,Light Heavyweight,12.0,5.0,7.0,0.0,0.0,12.0,4.0,1.0,2.0,1.0,Yamato Damashii,12.0,8.0,0.0,177.8,95.25,,Orthodox,1967-04-15,1.7,63.0,1.88,30.0,0.0,0.0,33.0,0.0
,eperaim ginting,,,,,,,,,,,,,,,,,,,,,The Wolfman,6.0,1.0,0.0,162.56,61.23,162.56,Orthodox,1995-11-30,0.0,0.0,0.0,100.0,15.52,100.0,0.0,0.0
/fighter/Eric-Albright-76341,eric albright,,07/11/1986,34.0,,Pennsylvania,United States,"5'7""",145 lbs,,Featherweight,3.0,0.0,1.0,2.0,,3.0,0.0,1.0,0.0,,,,,,,,,,,,,,,,,,
/fighter/Eric-Bedard-77201,eric bedard,Lucky Strikes,11/09/1984,36.0,,"Providence, Rhode Island",United States,"6'0""",257 lbs,Gillett's MMA,Heavyweight,6.0,4.0,2.0,0.0,,6.0,3.0,4.0,1.0,,Lucky Strikes,6.0,7.0,0.0,187.96,108.41,,,,6.37,35.0,8.54,52.0,0.0,0.0,0.0,0.0
/fighter/Eric-Brown-111555,eric brown,Encyclopedia,03/04/1983,38.0,,"New Bedford, Massachusetts",United States,"5'9""",155 lbs,CSW,Lightweight,4.0,1.0,3.0,0.0,,4.0,2.0,1.0,1.0,,,,,,,,,,,,,,,,,,
,eric castile,,,,,,,,,,,,,,,,,,,,,,3.0,2.0,0.0,172.72,65.77,,,,0.0,0.0,0.0,0.0,0.0,0.0,0.0,0.0
/fighter/Eric-Ellington-254675,eric ellington,Big Dogg,13/09/1988,32.0,,"East St. Louis, Illinois",United States,"5'6""",135 lbs,Academy of Courage,Bantamweight,7.0,3.0,0.0,4.0,,7.0,0.0,2.0,0.0,,,,,,,,,,,,,,,,,,
,eric esch,,,,,,,,,,,,,,,,,,,,,Butterbean,15.0,10.0,1.0,180.34,158.76,,Orthodox,1968-08-03,3.07,71.0,1.74,43.0,0.0,0.0,0.0,2.0
,eric galvan,,,,,,,,,,,,,,,,,,,,,,0.0,0.0,0.0,,70.31,,,,0.0,0.0,0.0,0.0,0.0,0.0,0.0,0.0
/fighter/Eric-Howser-25289,eric howser,,,,,"Des Moines, Iowa",United States,"6'1""",149 lbs,,Lightweight,9.0,2.0,7.0,0.0,,9.0,1.0,1.0,0.0,,,,,,,,,,,,,,,,,,
/fighter/Eric-Huggins-116055,eric huggins,,,,,"Bakersfield, California",United States,"6'0""",185 lbs,Bakersfield Elite Martial Arts,Middleweight,1.0,1.0,0.0,0.0,,1.0,0.0,1.0,0.0,,,,,,,,,,,,,,,,,,
/fighter/Eric-Irvin-55950,eric irvin,The Hedgehog,10/01/1986,35.0,,"Farmington, Missouri",United States,"5'8""",155 lbs,Team Destruction,Lightweight,11.0,2.0,6.0,3.0,,11.0,0.0,2.0,2.0,,,11.0,4.0,0.0,172.72,70.31,,,,3.27,42.0,4.47,36.0,4.0,30.0,33.0,0.0
,eric jacob,,,,,,,,,,,,,,,,,,,,,,1.0,9.0,0.0,,70.31,,,,0.0,0.0,0.0,0.0,0.0,0.0,0.0,0.0
/fighter/Eric-Kelly-49999,eric kelly,The Natural,30/04/1982,39.0,,"Baguio, Benguet",Philippines,"5'7""",145 lbs,Team Eric Kelly,Featherweight,12.0,1.0,9.0,2.0,,12.0,4.0,3.0,1.0,,,,,,,,,,,,,,,,,,
/fighter/Eric-Kriegermeier-50266,eric kriegermeier,Blitz,,,,"Atlanta, Georgia",United States,"5'9""",155 lbs,Ascension Mixed Martial Arts,Lightweight,3.0,0.0,3.0,0.0,,3.0,0.0,0.0,1.0,,,,,,,,,,,,,,,,,,
/fighter/Eric-Larkin-68743,eric larkin,,,,,"Scottsdale, Arizona",United States,"0'0""",155 lbs,Power MMA Team,Lightweight,3.0,1.0,2.0,0.0,,3.0,0.0,1.0,0.0,,,,,,,,,,,,,,,,,,
,eric lawson,,,,,,,,,,,,,,,,,,,,,,9.0,5.0,0.0,182.88,83.91,,Orthodox,,1.58,57.0,1.97,44.0,8.88,42.0,0.0,3.0
/fighter/Eric-Luke-41072,eric luke,,27/10/1984,36.0,,"Port St. Lucie, Florida",United States,"5'8""",144 lbs,American Top Team,Featherweight,6.0,0.0,3.0,3.0,,6.0,0.0,2.0,3.0,,,,,,,,,,,,,,,,,,
,eric magana,,,,,,,,,,,,,,,,,,,,,,1.0,1.0,0.0,,,,,,0.0,0.0,0.0,0.0,0.0,0.0,0.0,0.0
/fighter/Eric-Marriott-31767,eric marriott,The Machine,20/02/1986,35.0,,"Independence, Missouri",United States,"5'7""",151 lbs,K2L Grindhouse,Lightweight,22.0,3.0,10.0,9.0,,22.0,0.0,0.0,8.0,,,,,,,,,,,,,,,,,,
/fighter/Eric-Martin-151,eric martin,,,,,"Oklahoma City, Oklahoma",United States,"0'0""",0 lbs,,,0.0,0.0,0.0,0.0,,0.0,0.0,1.0,0.0,,,0.0,1.0,0.0,,,,,,0.0,0.0,0.0,0.0,0.0,0.0,0.0,0.0
/fighter/Eric-Moon-54354,eric moon,The Monster,26/07/1985,36.0,,"Hazel Park, Michigan",United States,"5'8""",170 lbs,Michigan Top Team,Welterweight,13.0,5.0,5.0,3.0,,13.0,6.0,9.0,0.0,,,,,,,,,,,,,,,,,,
/fighter/Eric-Olsen-293161,eric olsen,Bloodaxe,,,,New York,United States,"0'0""",185 lbs,East West MMA,Middleweight,1.0,1.0,0.0,0.0,,1.0,3.0,1.0,0.0,,,,,,,,,,,,,,,,,,
/fighter/Eric-Prindle-33301,eric prindle,The American Soldier,30/08/1976,44.0,,"Prescott, Arizona",United States,"6'5""",265 lbs,Team Death Clutch,Heavyweight,12.0,7.0,3.0,2.0,0.0,12.0,4.0,3.0,1.0,1.0,,,,,,,,,,,,,,,,,
/fighter/Eric-Ramirez-160525,eric ramirez,The Ram,10/04/1991,30.0,,"Waterford, Michigan",United States,"5'6""",135 lbs,,Bantamweight,3.0,0.0,3.0,0.0,,3.0,0.0,5.0,1.0,,,,,,,,,,,,,,,,,,
/fighter/Eric-Reynolds-20976,eric reynolds,It's A Wrap,17/03/1986,35.0,,"Bradenton, Florida",United States,"5'11""",154 lbs,The Dungeon,Lightweight,18.0,8.0,8.0,2.0,0.0,18.0,3.0,4.0,4.0,1.0,,,,,,,,,,,,,,,,,
/fighter/Eric-Scallan-57626,eric scallan,,,,,"Baton Rouge, Louisiana",United States,"6'0""",185 lbs,Gladiators Academy,Middleweight,13.0,0.0,8.0,5.0,,13.0,0.0,5.0,1.0,,,,,,,,,,,,,,,,,,
/fighter/Eric-Schafer-13275,eric schafer,Red,20/09/1977,43.0,,"Milwaukee, Wisconsin",United States,"6'3""",185 lbs,Red Schafer MMA,Middleweight,14.0,4.0,8.0,1.0,1.0,14.0,4.0,1.0,3.0,0.0,Red,14.0,8.0,2.0,190.5,83.91,193.04,Orthodox,1977-09-20,1.89,34.0,3.38,56.0,1.81,36.0,50.0,1.8
/fighter/Eric-Schambari-13306,eric schambari,,22/04/1978,43.0,,"Las Vegas, Nevada",United States,"6'0""",186 lbs,Team Takedown,Middleweight,15.0,1.0,9.0,5.0,,15.0,1.0,2.0,3.0,,,15.0,6.0,0.0,180.34,83.91,,Orthodox,1978-04-22,1.43,42.0,1.07,54.0,3.0,42.0,0.0,1.0
,eric schwartz,,,,,,,,,,,,,,,,,,,,,,2.0,0.0,0.0,,92.99,,,,0.0,0.0,0.0,0.0,0.0,0.0,0.0,0.0
/fighter/Eric-Shelton-86414,eric shelton,Showtime,02/02/1991,30.0,,"Lawton, Oklahoma",United States,"5'6""",125 lbs,American Top Team,Flyweight,14.0,3.0,5.0,6.0,,14.0,0.0,0.0,7.0,,Showtime,12.0,6.0,0.0,167.64,56.7,172.72,Orthodox,1991-02-02,2.57,42.0,1.88,63.0,2.83,51.0,46.0,0.2
/fighter/Eric-Smith-33534,eric smith,,04/06/1984,37.0,,"Boise, Idaho",United States,"6'0""",205 lbs,Syndicate MMA,Light Heavyweight,6.0,1.0,4.0,1.0,,6.0,1.0,1.0,0.0,,,1.0,1.0,0.0,,,,Southpaw,,0.0,0.0,0.0,0.0,0.0,0.0,0.0,0.0
/fighter/Eric-Spicely-63723,eric spicely,Zebrinha,29/09/1986,34.0,,"Olneyville, Rhode Island",United States,"6'1""",185 lbs,Syndicate MMA,Middleweight,12.0,4.0,6.0,2.0,,12.0,4.0,2.0,1.0,,Zebrinha,12.0,6.0,0.0,185.42,83.91,185.42,Orthodox,1986-09-29,3.71,45.0,5.72,55.0,1.31,20.0,75.0,1.0
,eric steenberg,,,,,,,,,,,,,,,,,,,,,,5.0,1.0,0.0,,70.31,,,,0.0,0.0,0.0,0.0,0.0,0.0,0.0,0.0
/fighter/Eric-Wisely-25320,eric wisely,Little Lee,25/07/1984,37.0,,"Clinton, Iowa",United States,"5'8""",155 lbs,Team Conquest,Lightweight,33.0,14.0,5.0,9.0,5.0,33.0,0.0,1.0,8.0,0.0,Little Lee,26.0,9.0,1.0,172.72,65.77,,Southpaw,1984-07-25,1.42,47.0,2.08,56.0,0.0,0.0,27.0,0.9
,eric wray,,,,,,,,,,,,,,,,,,,,,,5.0,1.0,0.0,182.88,77.11,,Orthodox,,1.76,48.0,3.12,28.0,4.07,66.0,0.0,2.0
/fighter/Erick-Correa-150791,erick correa,The Ram,,,,"Chicago, Illinois",United States,"6'0""",263 lbs,,Heavyweight,4.0,2.0,0.0,2.0,,4.0,2.0,0.0,0.0,,,,,,,,,,,,,,,,,,
,erick gonzalez,,,,,,,,,,,,,,,,,,,,,The Ghost Pepper,14.0,8.0,0.0,180.34,70.31,190.5,Orthodox,1992-01-20,2.4,36.0,8.08,40.0,6.0,55.0,50.0,0.0
/fighter/Erick-Montano-40308,erick montano,Perry,19/11/1985,35.0,,Mexico City,Mexico,"6'0""",170 lbs,Bonebreakers Team,Welterweight,8.0,2.0,4.0,2.0,,8.0,1.0,4.0,1.0,,Perry,7.0,5.0,0.0,182.88,77.11,185.42,Orthodox,1985-11-19,2.79,44.0,2.06,64.0,2.29,36.0,66.0,0.0
/fighter/Erick-Sanchez-96765,erick sanchez,,04/10/1990,30.0,,"Sacramento, California",United States,"5'10""",145 lbs,Team Alpha Male,Featherweight,10.0,3.0,3.0,4.0,,10.0,1.0,0.0,5.0,,,8.0,3.0,0.0,177.8,65.77,,,,0.0,0.0,0.0,0.0,0.0,0.0,0.0,0.0
/fighter/Erick-Silva-15009,erick silva,A Fierce Tiger,21/06/1984,37.0,,"Vila Velha, Espirito Santo",Brazil,"5'11""",170 lbs,Team Nogueira,Welterweight,20.0,4.0,13.0,3.0,0.0,20.0,4.0,0.0,6.0,1.0,,19.0,9.0,0.0,182.88,77.11,187.96,Orthodox,1984-06-21,2.5,48.0,4.18,49.0,0.85,35.0,56.0,1.4
,erick wanderlei,,,,,,,,,,,,,,,,,,,,,,3.0,3.0,0.0,185.42,92.99,,Orthodox,,0.63,41.0,2.66,40.0,3.8,66.0,0.0,1.9
/fighter/Ericka-Almeida-98419,ericka almeida,,05/03/1989,32.0,,"Sorocaba, Sao Paulo",Brazil,"5'6""",135 lbs,Team Nogueira,Bantamweight,8.0,2.0,6.0,0.0,,8.0,0.0,0.0,3.0,,,7.0,3.0,0.0,167.64,52.16,,Orthodox,1989-03-05,1.07,39.0,3.33,43.0,0.5,33.0,37.0,0.0
,erik apple,,,,,,,,,,,,,,,,,,,,,,10.0,3.0,0.0,182.88,77.11,,Orthodox,1977-08-26,0.0,0.0,0.54,81.0,0.0,0.0,0.0,8.1
/fighter/Erik-Gunha-324289,erik gunha,,,,,"San Jose, California",United States,"5'7""",125 lbs,American Kickboxing Academy,Flyweight,0.0,0.0,0.0,0.0,,0.0,0.0,0.0,0.0,,,,,,,,,,,,,,,,,,
/fighter/Erik-Koch-23390,erik koch,The Phoenix,04/10/1988,32.0,,"Cedar Rapids, Iowa",United States,"5'10""",155 lbs,Roufusport,Lightweight,16.0,4.0,8.0,4.0,,16.0,2.0,0.0,4.0,,Phoenix,16.0,6.0,0.0,177.8,77.11,180.34,Southpaw,1988-10-04,2.33,42.0,2.82,47.0,1.02,42.0,81.0,1.0
/fighter/Erik-Perez-35509,erik perez,El Goyito,19/11/1989,31.0,,"Monterrey, Nuevo Leon",Mexico,"5'7""",135 lbs,Alliance MMA,Bantamweight,20.0,5.0,8.0,7.0,,20.0,1.0,2.0,5.0,,Goyito,17.0,6.0,0.0,172.72,61.23,172.72,Orthodox,1989-11-19,3.16,40.0,2.09,66.0,3.16,55.0,69.0,0.2
/fighter/Erik-Sianov-252891,erik sianov,,,,,Jerusalem,Israel,"5'9""",170 lbs,MMA Jerusalem,Welterweight,0.0,0.0,0.0,0.0,,0.0,0.0,1.0,1.0,,,,,,,,,,,,,,,,,,
,erik silva,,,,,,,,,,,,,,,,,,,,,The King,9.0,2.0,0.0,175.26,65.77,180.34,Orthodox,1987-03-16,2.17,71.0,1.58,40.0,3.94,80.0,71.0,0.0
/fighter/Erin-Beach-38961,erin beach,Dead Aim,16/04/1983,38.0,,"San Diego, California",United States,"6'2""",155 lbs,Alliance MMA,Lightweight,4.0,2.0,1.0,1.0,,4.0,1.0,0.0,0.0,,,,,,,,,,,,,,,,,,
,erin blanchfield,,,,,,,,,,,,,,,,,,,,,Cold Blooded,12.0,1.0,0.0,162.56,56.7,167.64,Orthodox,1999-05-04,5.58,52.0,3.32,62.0,2.86,36.0,83.0,1.2
,erisson ferreira,,,,,,,,,,,,,,,,,,,,,Gato,12.0,2.0,0.0,167.64,56.7,177.8,Orthodox,1991-05-03,1.75,32.0,2.75,56.0,1.11,100.0,66.0,1.7
/fighter/Ernest-Chavez-80837,ernest chavez,The Mad Titan,27/06/1983,38.0,,"Tustin, California",United States,"5'8""",146 lbs,Total MMA Studios,Featherweight,10.0,5.0,0.0,5.0,,10.0,1.0,1.0,0.0,,EJ,10.0,2.0,0.0,172.72,65.77,177.8,Orthodox,1983-06-27,2.79,40.0,3.89,59.0,0.89,33.0,50.0,0.0
/fighter/Ernest-de-la-Cruz-70055,ernest de la cruz,,,,,"San Antonio, Texas",United States,"5'10""",144 lbs,Texas Powerhouse MMA,Featherweight,1.0,0.0,1.0,0.0,,1.0,0.0,0.0,2.0,,,,,,,,,,,,,,,,,,
/fighter/Ernest-James-220189,ernest james,,,,,"Fresno, California",United States,"6'3""",261 lbs,American Kickboxing Academy,Heavyweight,1.0,1.0,0.0,0.0,,1.0,1.0,0.0,0.0,,,,,,,,,,,,,,,,,,
/fighter/Ernest-Tang-225395,ernest tang,,,,,,Hong Kong,"0'0""",155 lbs,Hong Kong Fight Club,Lightweight,3.0,1.0,2.0,0.0,,3.0,1.0,1.0,0.0,,,,,,,,,,,,,,,,,,
,ernesta kareckaite,,,,,,,,,,,,,,,,,,,,,Heavy-Handed,5.0,0.0,1.0,175.26,56.7,180.34,Orthodox,1998-07-05,12.27,45.0,11.2,42.0,1.0,50.0,100.0,0.0
,ernie verdicia,,,,,,,,,,,,,,,,,,,,,,0.0,1.0,0.0,180.34,90.26,,Orthodox,,0.0,0.0,0.0,0.0,0.0,0.0,0.0,0.0
,errol zimmerman,,,,,,,,,,,,,,,,,,,,,The Bonecrusher,0.0,1.0,0.0,190.5,83.91,,Orthodox,1986-04-20,2.95,42.0,0.0,0.0,0.0,0.0,0.0,0.0
/fighter/Eryk-Anders-93407,eryk anders,Ya Boi,21/04/1987,34.0,,"Birmingham, Alabama",United States,"6'1""",205 lbs,Spartan Fitness,Light Heavyweight,14.0,8.0,1.0,5.0,,14.0,1.0,0.0,4.0,,Ya Boi,15.0,8.0,0.0,185.42,83.91,190.5,Southpaw,1987-04-21,3.56,47.0,4.39,50.0,1.54,24.0,79.0,0.1
,esteban ribovics,,,,,,,,,,,,,,,,,,,,,El Gringo,12.0,1.0,0.0,177.8,70.31,175.26,Orthodox,1996-04-27,6.16,52.0,3.4,52.0,0.95,66.0,60.0,0.5
,estefani almeida,,,,,,,,,,,,,,,,,,,,,,7.0,3.0,0.0,162.56,56.7,,Orthodox,1988-10-17,3.13,37.0,6.07,42.0,0.0,0.0,0.0,0.0
/fighter/Estevan-Payan-24952,estevan payan,El Terrible,03/04/1982,39.0,,"Tempe, Arizona",United States,"5'10""",148 lbs,Arizona Combat Sports,Lightweight,17.0,7.0,3.0,7.0,,17.0,8.0,1.0,5.0,,El Terrible,16.0,12.0,0.0,177.8,65.77,,Orthodox,1982-03-14,4.25,42.0,3.58,57.0,0.36,100.0,60.0,0.4
/fighter/Ethan-Goss-92783,ethan goss,,08/01/1992,29.0,,"Petersburg, Pennsylvania",United States,"5'10""",145 lbs,,Featherweight,5.0,1.0,3.0,1.0,,5.0,1.0,2.0,3.0,,,,,,,,,,,,,,,,,,
/fighter/Eugene-Cancino-155931,eugene cancino,,18/06/1993,28.0,,"Fresno, California",United States,"5'4""",125 lbs,Thrive MMA,Flyweight,0.0,0.0,0.0,0.0,,0.0,0.0,0.0,2.0,,,,,,,,,,,,,,,,,,
/fighter/Eugene-Correa-208943,eugene correa,,22/04/1993,28.0,,"Long Beach, California",United States,"6'0""",161 lbs,Team Bodyshop,Welterweight,2.0,0.0,2.0,0.0,,2.0,1.0,1.0,0.0,,,,,,,,,,,,,,,,,,
/fighter/Eugene-Fadiora-30810,eugene fadiora,The Sniper,01/06/1988,33.0,,"Stafford, Staffordshire",England,"6'1""",185 lbs,Team Supreme,Middleweight,13.0,6.0,6.0,1.0,,13.0,0.0,1.0,1.0,,,,,,,,,,,,,,,,,,
/fighter/Eugene-Jackson-222,eugene jackson,The Wolf,31/12/1969,51.0,,"East Palo Alto, California",United States,"5'8""",185 lbs,Gladiators Training Academy,Middleweight,15.0,4.0,10.0,1.0,,15.0,4.0,5.0,0.0,,The Wolf,15.0,9.0,1.0,172.72,83.91,,Orthodox,1966-09-23,2.19,33.0,3.44,32.0,1.91,71.0,16.0,2.3
/fighter/Eugene-Toquero-99159,eugene toquero,,,,,Manila,Philippines,"5'5""",125 lbs,Submission Sport Philippines,Flyweight,8.0,7.0,0.0,1.0,,8.0,0.0,4.0,3.0,,,,,,,,,,,,,,,,,,
/fighter/Eugenio-Diaz-Tan-106779,eugenio diaz tan,,,,,,Malaysia,"0'0""",205 lbs,,Light Heavyweight,1.0,1.0,0.0,0.0,,1.0,0.0,1.0,1.0,,,,,,,,,,,,,,,,,,
/fighter/Eugenio-Tadeu-187,eugenio tadeu,,,,,Rio de Janeiro,Brazil,"5'8""",170 lbs,,Welterweight,2.0,1.0,1.0,0.0,,2.0,3.0,0.0,0.0,,,2.0,3.0,0.0,172.72,72.57,,Orthodox,,0.0,0.0,0.0,0.0,0.0,0.0,0.0,0.0
,eun soo lee,,,,,,,,,,,,,,,,,,,,,,17.0,4.0,0.0,185.42,97.52,,Orthodox,1982-03-07,0.0,0.0,3.05,60.0,0.0,0.0,50.0,0.0
/fighter/Ev-Ting-60988,ev ting,The Extraterrestrial,11/08/1989,32.0,,,New Zealand,"5'7""",155 lbs,Auckland MMA,Lightweight,17.0,5.0,5.0,7.0,,17.0,1.0,3.0,3.0,,,,,,,,,,,,,,,,,,
/fighter/Evan-Dunham-22038,evan dunham,,18/12/1981,39.0,,"Eugene, Oregon",United States,"5'10""",155 lbs,Xtreme Couture,Lightweight,18.0,3.0,6.0,9.0,,18.0,4.0,2.0,3.0,,,18.0,9.0,1.0,177.8,70.31,177.8,Southpaw,1981-12-18,5.33,39.0,3.54,61.0,1.82,33.0,79.0,1.0
,evan elder,,,,,,,,,,,,,,,,,,,,,The Phenom,8.0,2.0,0.0,177.8,70.31,182.88,Switch,1997-04-11,4.75,48.0,5.0,57.0,0.74,22.0,28.0,0.4
,evan esguerra,,,,,,,,,,,,,,,,,,,,,,8.0,7.0,0.0,,65.77,,,,0.0,0.0,0.0,0.0,0.0,0.0,0.0,0.0
/fighter/Evan-Gubera-339123,evan gubera,,,,,"Fremont, California",United States,"0'0""",185 lbs,American Kickboxing Academy,Middleweight,0.0,0.0,0.0,0.0,,0.0,0.0,0.0,2.0,,,,,,,,,,,,,,,,,,
/fighter/Evan-Tanner-212,evan tanner,,11/02/1971,,05/09/2008,"Amarillo, Texas",United States,"6'0""",185 lbs,Hard Knocks Kickboxing,Middleweight,32.0,12.0,17.0,3.0,,32.0,6.0,1.0,1.0,,,32.0,8.0,0.0,182.88,83.91,187.96,Orthodox,1971-02-11,3.05,59.0,2.64,56.0,2.55,43.0,25.0,1.3
/fighter/Evangelista-Santos-2605,evangelista santos,Cyborg,13/12/1977,43.0,,"Rondonopolis, Mato Grosso",Brazil,"5'10""",170 lbs,Chute Boxe Team Cyborg,Welterweight,21.0,14.0,4.0,3.0,,21.0,12.0,2.0,4.0,,Cyborg,21.0,18.0,0.0,177.8,77.11,193.04,Orthodox,1977-12-12,3.94,36.0,6.01,49.0,0.78,100.0,50.0,0.4
/fighter/Everett-Cummings-74490,everett cummings,,16/11/1986,34.0,,"Corona, California",United States,"6'0""",280 lbs,,Super Heavyweight,15.0,6.0,9.0,0.0,,15.0,0.0,0.0,0.0,,,12.0,0.0,0.0,,92.99,,,,0.43,60.0,4.34,45.0,0.0,0.0,0.0,2.2
,everett sims,,,,,,,,,,,,,,,,,,,,,Sexual Chocolate,4.0,1.0,0.0,195.58,117.93,195.58,Southpaw,1988-09-04,0.81,66.0,2.19,30.0,0.0,0.0,42.0,1.2
/fighter/Ewerton-Teixeira-107825,ewerton teixeira,,13/02/1982,39.0,,"Sao Paulo, Sao Paulo",Brazil,"6'2""",236 lbs,Corinthians MMA,Heavyweight,3.0,1.0,0.0,2.0,,3.0,0.0,1.0,0.0,,,3.0,1.0,0.0,185.42,109.77,,,,2.0,39.0,3.22,35.0,0.0,0.0,33.0,0.0
/fighter/Ezzoubair-Bouarsa-200611,ezzoubair bouarsa,,,,,,Morocco,"5'7""",125 lbs,NR Fight,Flyweight,7.0,0.0,5.0,2.0,,7.0,1.0,0.0,1.0,,,,,,,,,,,,,,,,,,
/fighter/Fabacary-Diatta-224141,fabacary diatta,,16/10/1996,24.0,,Aubervilliers,France,"5'9""",145 lbs,Atch Academy,Featherweight,7.0,2.0,1.0,4.0,,7.0,0.0,0.0,0.0,,,,,,,,,,,,,,,,,,
/fighter/Fabian-Edwards-200595,fabian edwards,The Assassin,24/03/1993,28.0,,"Birmingham, West Midlands",England,"6'1""",185 lbs,Team Renagade,Middleweight,9.0,3.0,3.0,3.0,,9.0,0.0,0.0,2.0,,,,,,,,,,,,,,,,,,
/fighter/Fabian-Gonzalez-173535,fabian gonzalez,,,,,"Buena Park, California",United States,"5'8""",135 lbs,,Bantamweight,2.0,0.0,1.0,1.0,,2.0,0.0,1.0,0.0,,,2.0,1.0,0.0,177.8,61.23,,,,3.9,48.0,4.39,51.0,0.0,0.0,66.0,0.0
/fighter/Fabiano-Iha-218,fabiano iha,,28/07/1970,51.0,,"Huntington Beach, California",United States,"5'8""",155 lbs,,Lightweight,10.0,3.0,7.0,0.0,,10.0,3.0,0.0,2.0,,,9.0,5.0,0.0,172.72,70.31,,Orthodox,1970-07-28,1.73,47.0,2.49,42.0,2.88,40.0,50.0,2.9
/fighter/Fabiano-Scherner-7690,fabiano scherner,Pega-Leve,30/06/1972,49.0,,"Florianopolis, Santa Catarina",Brazil,"6'4""",257 lbs,Gracie Barra Portland,Heavyweight,11.0,5.0,6.0,0.0,,11.0,9.0,2.0,0.0,,Pegaleve,11.0,10.0,0.0,190.5,116.57,,Orthodox,1972-06-30,1.31,31.0,3.2,38.0,1.09,33.0,40.0,0.0
/fighter/Fabio-Aguiar-132429,fabio aguiar,,10/02/1988,33.0,,"Recife, Pernambuco",Brazil,"6'0""",185 lbs,Eduardo Team,Middleweight,17.0,9.0,5.0,3.0,,17.0,1.0,0.0,1.0,,,17.0,1.0,0.0,182.88,83.91,,,,0.0,0.0,0.0,0.0,0.0,0.0,0.0,0.0
/fighter/Fabio-Cherant-230293,fabio cherant,The Water Buffalo,25/11/1994,26.0,,"Wrentham, Massachusetts",United States,"6'1""",205 lbs,Sityodtong Boston,Light Heavyweight,7.0,0.0,5.0,2.0,,7.0,1.0,1.0,0.0,,Water Buffalo,7.0,4.0,0.0,185.42,92.99,187.96,Southpaw,1994-11-25,1.35,40.0,4.89,38.0,0.0,0.0,0.0,0.0
/fighter/Fabio-Gurgel-146,fabio gurgel,,18/01/1970,51.0,,Rio de Janeiro,Brazil,"6'0""",205 lbs,Alliance,Light Heavyweight,3.0,3.0,0.0,0.0,,3.0,0.0,0.0,2.0,,,3.0,2.0,0.0,182.88,92.99,,Orthodox,,0.0,0.0,0.0,0.0,0.0,0.0,0.0,0.0
/fighter/Fabio-Maldonado-16426,fabio maldonado,Caipira de Aco,17/03/1980,41.0,,"Sorocaba, Sao Paulo",Brazil,"6'1""",227 lbs,Team Maldonado,Heavyweight,28.0,19.0,2.0,7.0,,28.0,6.0,2.0,7.0,,Caipira de Aco,23.0,11.0,0.0,185.42,92.99,190.5,Orthodox,1980-03-17,5.29,58.0,4.31,53.0,0.44,57.0,61.0,0.6
/fighter/Fabio-Mello-2195,fabio mello,,28/06/1975,46.0,,"Coconut Creek, Florida",United States,"5'6""",145 lbs,Imperial Athletics,Featherweight,12.0,2.0,5.0,5.0,,12.0,4.0,0.0,5.0,,,11.0,8.0,0.0,165.1,70.31,,Southpaw,,0.86,35.0,3.94,50.0,0.0,0.0,0.0,0.0
,fabio nascimento,,,,,,,,,,,,,,,,,,,,,Negao,11.0,6.0,0.0,177.8,83.91,,Orthodox,,2.94,38.0,4.63,55.0,0.0,0.0,55.0,0.8
/fighter/Fabio-Pinca-352621,fabio pinca,,14/06/1984,37.0,,Lyon,France,"5'9""",155 lbs,,Lightweight,0.0,0.0,0.0,0.0,,0.0,0.0,0.0,1.0,,,,,,,,,,,,,,,,,,
,fabio silva,,,,,,,,,,,,,,,,,,,,,,1.0,8.0,0.0,180.34,92.99,,Orthodox,1982-03-31,0.09,11.0,5.9,38.0,0.0,0.0,0.0,0.0
,fabiola pidroni,,,,,,,,,,,,,,,,,,,,,The Queen,5.0,0.0,0.0,,52.16,,,,0.0,0.0,0.0,0.0,0.0,0.0,0.0,0.0
/fighter/Fabricio-Andrade-221997,fabricio andrade,Wonder Boy,,,,"Fortaleza, Ceara",Brazil,"5'6""",135 lbs,Fighters Unite Dujiangyan,Bantamweight,5.0,1.0,2.0,2.0,0.0,5.0,1.0,0.0,0.0,1.0,,,,,,,,,,,,,,,,,
/fighter/Fabricio-Camoes-2427,fabricio camoes,Morango,23/12/1978,42.0,,Rio de Janeiro,Brazil,"5'9""",155 lbs,Gracie Humaita,Lightweight,14.0,4.0,7.0,3.0,,14.0,3.0,4.0,2.0,,Morango,14.0,9.0,1.0,177.8,70.31,180.34,Orthodox,1978-12-23,1.29,33.0,1.85,61.0,2.34,32.0,20.0,1.5
/fighter/Fabricio-de-Assis-Costa-da-Silva-77095,fabricio de assis costa da silva,Guerreiro,24/07/1990,31.0,,"Santana, Amapa",Brazil,"5'10""",155 lbs,Ronildo Nobre Judo Club,Lightweight,22.0,5.0,14.0,3.0,,22.0,1.0,1.0,3.0,,,,,,,,,,,,,,,,,,
,fabricio guerreiro,,,,,,,,,,,,,,,,,,,,,,21.0,5.0,0.0,177.8,65.77,,,,1.87,31.0,2.2,67.0,2.0,50.0,0.0,0.0
/fighter/Fabricio-Monteiro-10621,fabricio monteiro,Pitbull,,,,Rio de Janeiro,Brazil,"5'10""",169 lbs,Gracie Fusion,Welterweight,18.0,7.0,7.0,4.0,,18.0,4.0,3.0,3.0,,,,,,,,,,,,,,,,,,
/fighter/Fabricio-Werdum-8390,fabricio werdum,Vai Cavalo,30/07/1977,44.0,,"Porto Alegre, Rio Grande do Sul",Brazil,"6'4""",242 lbs,Werdum Combat Team,Heavyweight,24.0,6.0,12.0,6.0,,24.0,3.0,0.0,6.0,,Vai Cavalo,24.0,9.0,1.0,193.04,104.78,195.58,Orthodox,1977-07-30,3.59,52.0,2.64,55.0,1.75,31.0,31.0,1.2
/fighter/Fadi-Haiyadre-306565,fadi haiyadre,,,,,,Israel,"0'0""",170 lbs,,Welterweight,1.0,1.0,0.0,0.0,,1.0,1.0,1.0,0.0,,,,,,,,,,,,,,,,,,
/fighter/Faizan-Khan-Suddozai-99747,faizan khan suddozai,The Grenade,05/08/1991,30.0,,Islamabad,Pakistan,"5'7""",135 lbs,Fight Fortress,Bantamweight,2.0,1.0,1.0,0.0,,2.0,1.0,0.0,1.0,,,,,,,,,,,,,,,,,,
/fighter/Fajar-Fajar-279151,fajar fajar,Macho,,,,,Indonesia,"5'6""",135 lbs,BSA Martial Arts Center,Bantamweight,4.0,2.0,1.0,1.0,,4.0,0.0,0.0,1.0,,,,,,,,,,,,,,,,,,
/fighter/Falaniko-Vitale-370,falaniko vitale,Niko,14/07/1974,47.0,,"Honolulu, Hawaii",United States,"5'10""",185 lbs,808 Top Team,Middleweight,30.0,14.0,12.0,4.0,,30.0,5.0,3.0,3.0,,Niko,30.0,11.0,0.0,177.8,83.91,,Orthodox,1974-07-14,1.88,49.0,3.68,47.0,0.72,33.0,86.0,0.0
/fighter/Falco-Neto-Lopes-42302,falco neto lopes,Telelo,02/04/1985,36.0,,,Portugal,"5'10""",185 lbs,Porto Fight Club,Middleweight,11.0,7.0,2.0,2.0,,11.0,5.0,7.0,0.0,,,,,,,,,,,,,,,,,,
/fighter/Fan-Rong-215625,fan rong,King Kong Warrior,,,,,China,"6'0""",185 lbs,Longyun MMA,Middleweight,14.0,4.0,8.0,2.0,,14.0,1.0,1.0,0.0,,,,,,,,,,,,,,,,,,
/fighter/Fares-Ziam-184241,fares ziam,Smile Killer,21/03/1997,24.0,,Lyon,France,"6'0""",155 lbs,Team Ezbiri,Lightweight,12.0,5.0,4.0,3.0,,12.0,0.0,2.0,1.0,,Smile Killer,14.0,4.0,0.0,185.42,70.31,190.5,Orthodox,1997-03-21,2.82,47.0,2.01,65.0,0.97,23.0,75.0,0.0
,farid basharat,,,,,,,,,,,,,,,,,,,,,Ferocious,11.0,0.0,0.0,172.72,61.23,180.34,Orthodox,1997-08-02,5.2,63.0,2.34,58.0,3.5,53.0,83.0,0.4
/fighter/Farkhad-Sharipov-26618,farkhad sharipov,Frank,18/04/1984,37.0,,"Kissimmee, Florida",United States,"5'7""",144 lbs,Gracie Barra Orlando,Featherweight,17.0,3.0,2.0,12.0,,17.0,0.0,0.0,8.0,,,,,,,,,,,,,,,,,,
,fatima kline,,,,,,,,,,,,,,,,,,,,,,,,,,,,,,,,,,,,,
/fighter/Favian-Gutierrez-157675,favian gutierrez,,05/01/1985,36.0,,"San Jose, California",United States,"6'0""",208 lbs,Independent,Heavyweight,2.0,0.0,1.0,0.0,1.0,2.0,0.0,1.0,2.0,0.0,,,,,,,,,,,,,,,,,
/fighter/Fazlo-Mulabitinovic-177687,fazlo mulabitinovic,,09/02/1993,28.0,,"St. Louis, Missouri",United States,"5'9""",135 lbs,,Bantamweight,4.0,0.0,2.0,2.0,,4.0,0.0,0.0,2.0,,,4.0,2.0,0.0,,61.23,,,,0.54,16.0,0.0,100.0,0.0,0.0,0.0,8.0
,federico lopez,,,,,,,,,,,,,,,,,,,,,Kiko,10.0,6.0,0.0,162.56,63.05,,Orthodox,,1.78,23.0,5.35,30.0,0.0,0.0,0.0,0.0
/fighter/Fedor-Emelianenko-1500,fedor emelianenko,The Last Emperor,28/09/1976,44.0,,"Stary Oskol, Belgorod Oblast",Russia,"6'0""",223 lbs,FedorTeam,Heavyweight,39.0,15.0,15.0,9.0,,39.0,5.0,1.0,0.0,,The Last Emperor,36.0,5.0,0.0,182.88,104.33,187.96,Orthodox,1976-09-28,3.18,51.0,1.0,63.0,2.0,63.0,82.0,1.9
,fedor nikolov,,,,,,,,,,,,,,,,,,,,,,0.0,0.0,0.0,,,,,,0.0,0.0,0.0,0.0,0.0,0.0,0.0,0.0
/fighter/Feilong-Cai-186571,feilong  cai,,04/02/1995,26.0,,Qingdao,China,"5'8""",145 lbs,Xin Jiang International Fight Club,Featherweight,0.0,0.0,0.0,0.0,,0.0,1.0,1.0,0.0,,,,,,,,,,,,,,,,,,
/fighter/Felice-Herrig-42432,felice herrig,Lil Bulldog,18/09/1984,36.0,,"Buffalo Grove, Illinois",United States,"5'4""",115 lbs,Team Curran,Strawweight,14.0,1.0,4.0,9.0,,14.0,0.0,1.0,8.0,,Lil Bulldog,14.0,10.0,0.0,162.56,52.16,165.1,Orthodox,1984-09-18,3.84,37.0,5.19,48.0,1.08,28.0,75.0,0.8
/fighter/Felicia-Spencer-203909,felicia spencer,FeeNom,29/11/1990,30.0,,"Winter Park, Florida",United States,"5'6""",145 lbs,The Jungle MMA,Featherweight,8.0,2.0,4.0,2.0,,8.0,0.0,0.0,3.0,,FeeNom,9.0,3.0,0.0,167.64,65.77,172.72,Orthodox,1990-11-29,3.21,48.0,4.54,45.0,1.18,18.0,27.0,0.2
/fighter/Felipe-Arantes-31372,felipe arantes,Sertanejo,09/02/1988,33.0,,"Sao Paulo, Sao Paulo",Brazil,"5'8""",145 lbs,Chute Boxe Diego Lima,Featherweight,18.0,7.0,6.0,5.0,,18.0,1.0,2.0,7.0,,Sertanejo,18.0,10.0,1.0,172.72,61.23,185.42,Orthodox,1988-02-09,2.37,45.0,2.66,64.0,0.93,47.0,41.0,0.7
,felipe bunes,,,,,,,,,,,,,,,,,,,,,Felipinho,13.0,6.0,0.0,170.18,56.7,175.26,Orthodox,1989-10-29,0.0,0.0,0.0,0.0,0.0,0.0,0.0,0.0
/fighter/Felipe-Chavez-12597,felipe chavez,Flip,,,,"Albuquerque, New Mexico",United States,"0'0""",135 lbs,Mean1 MMA,Bantamweight,6.0,1.0,5.0,0.0,,6.0,2.0,2.0,0.0,,,,,,,,,,,,,,,,,,
,felipe colares,,,,,,,,,,,,,,,,,,,,,Cabocao,10.0,4.0,0.0,172.72,65.77,175.26,Orthodox,1994-03-31,2.17,45.0,4.65,36.0,1.88,24.0,43.0,0.5
/fighter/Felipe-Dias-Colares-144701,felipe dias colares,Cabocao,31/03/1994,27.0,,"Macapa, Amapa",Brazil,"5'9""",145 lbs,Team Nogueira,Featherweight,10.0,2.0,5.0,3.0,,10.0,0.0,0.0,2.0,,,,,,,,,,,,,,,,,,
,felipe dos santos,,,,,,,,,,,,,,,,,,,,,Lipe Detona,7.0,1.0,0.0,170.18,56.7,177.8,Orthodox,2000-09-11,6.6,32.0,7.47,38.0,0.0,0.0,0.0,0.0
/fighter/Felipe-Enomoto-32141,felipe enomoto,,27/08/1982,38.0,,Zurich,Switzerland,"5'10""",155 lbs,Enomoto Dojo,Lightweight,6.0,1.0,2.0,3.0,,6.0,1.0,3.0,2.0,,,,,,,,,,,,,,,,,,
,felipe lima,,,,,,,,,,,,,,,,,,,,,,,,,,,,,,,,,,,,,
/fighter/Felipe-Olivieri-28181,felipe olivieri,,,,,"Rio de Janeiro, Rio de Janeiro",Brazil,"0'0""",155 lbs,Nova Uniao,Lightweight,15.0,11.0,3.0,1.0,,15.0,4.0,1.0,2.0,,,14.0,5.0,0.0,175.26,70.31,,Orthodox,1985-04-12,6.68,58.0,4.6,57.0,0.0,0.0,71.0,0.0
,felipe pena,,,,,,,,,,,,,,,,,,,,,Preguica,0.0,0.0,0.0,,,,,,0.0,0.0,0.0,0.0,0.0,0.0,0.0,0.0
,felipe portela,,,,,,,,,,,,,,,,,,,,,Balboa,9.0,2.0,0.0,,77.11,,,,0.0,0.0,0.0,0.0,0.0,0.0,0.0,0.0
/fighter/Felipe-Silva-128357,felipe silva,,05/08/1984,37.0,,"Juiz de Fora, Minas Gerais",Brazil,"6'0""",155 lbs,CM System,Lightweight,9.0,7.0,1.0,1.0,,9.0,4.0,1.0,0.0,,,8.0,2.0,0.0,182.88,70.31,195.58,Orthodox,1984-05-08,5.4,50.0,1.8,59.0,1.0,100.0,71.0,0.0
,felix klinkhammer,,,,,,,,,,,,,,,,,,,,,,7.0,0.0,0.0,182.88,77.11,,,,0.0,0.0,0.0,0.0,0.0,0.0,0.0,0.0
,felix lee mitchell,,,,,,,,,,,,,,,,,,,,,,2.0,7.0,0.0,,,,Orthodox,,0.0,0.0,0.0,0.0,0.0,0.0,0.0,0.0
/fighter/Felix-Mitchell-45,felix mitchell,,,,,"Antioch, Tennessee",United States,"5'11""",220 lbs,,Heavyweight,2.0,2.0,0.0,0.0,,2.0,3.0,3.0,1.0,,,,,,,,,,,,,,,,,,
,fellipe andrew,,,,,,,,,,,,,,,,,,,,,,0.0,0.0,0.0,,,,,,0.0,0.0,0.0,0.0,0.0,0.0,0.0,0.0
,feng pengchao,,,,,,,,,,,,,,,,,,,,,,15.0,9.0,1.0,,61.23,,,,0.0,0.0,0.0,0.0,0.0,0.0,0.0,0.0
,feng xiaocan,,,,,,,,,,,,,,,,,,,,,,,,,,,,,,,,,,,,,
,fernando bettega,,,,,,,,,,,,,,,,,,,,,,7.0,5.0,0.0,,77.11,,,,0.0,0.0,0.0,0.0,0.0,0.0,0.0,0.0
/fighter/Fernando-Bruno-25491,fernando bruno,Acougueiro,24/02/1982,39.0,,"Rio de Janeiro, Rio de Janeiro",Brazil,"5'6""",145 lbs,Nova Uniao,Featherweight,16.0,0.0,8.0,8.0,,16.0,0.0,1.0,4.0,,Acougueiro,15.0,4.0,0.0,167.64,65.77,,,,1.75,39.0,1.78,48.0,2.02,22.0,56.0,0.5
/fighter/Fernando-Gonzalez-8578,fernando gonzalez,The Menifee Maniac,15/09/1983,37.0,,"Menifee, California",United States,"5'9""",170 lbs,Team Quest,Welterweight,29.0,12.0,6.0,11.0,,29.0,3.0,4.0,11.0,,The Menifee Maniac,26.0,14.0,0.0,175.26,77.11,172.72,Southpaw,1983-09-15,4.47,47.0,4.03,65.0,0.86,33.0,43.0,1.4
/fighter/Fernando-Gonzalez-Trevino-240625,fernando gonzalez trevino,,12/10/1987,33.0,,"Piedras Negras, Coahuila",Mexico,"5'11""",175 lbs,American Kickboxing Academy,Middleweight,5.0,1.0,2.0,2.0,,5.0,1.0,2.0,0.0,,,,,,,,,,,,,,,,,,
/fighter/Fernando-Martinez-48413,fernando martinez,Pitbull,03/02/1980,41.0,,Buenos Aires,Argentina,"5'8""",155 lbs,Glory MMA & Fitness,Lightweight,21.0,5.0,8.0,8.0,,21.0,2.0,4.0,5.0,,,,,,,,,,,,,,,,,,
,fernando padilla,,,,,,,,,,,,,,,,,,,,,El Valiente,15.0,5.0,0.0,185.42,65.77,193.04,Orthodox,1996-12-15,5.51,38.0,5.81,53.0,0.0,0.0,100.0,0.0
/fighter/Fernando-Rodriguez-65464,fernando rodriguez,,,,,"San Antonio, Texas",United States,"5'8""",155 lbs,,Lightweight,2.0,0.0,2.0,0.0,,2.0,0.0,0.0,1.0,,,,,,,,,,,,,,,,,,
,fernie garcia,,,,,,,,,,,,,,,,,,,,,,10.0,4.0,0.0,170.18,61.23,170.18,Orthodox,1992-04-12,1.8,34.0,2.69,50.0,0.32,50.0,47.0,0.6
/fighter/Filip-Pejic-85664,filip pejic,Nitro,21/07/1992,29.0,,Zagreb,Croatia,"5'11""",145 lbs,American Top Team Zagreb,Featherweight,15.0,10.0,3.0,2.0,,15.0,2.0,2.0,1.0,,,12.0,2.0,2.0,172.72,61.23,,Orthodox,1992-07-21,0.0,0.0,0.88,33.0,0.0,0.0,0.0,0.0
,fiona muxlow,,,,,,,,,,,,,,,,,,,,,,6.0,3.0,0.0,162.56,65.77,,,,1.44,27.0,5.45,34.0,0.0,0.0,0.0,0.0
/fighter/Flavio-Luiz-Moura-225,flavio luiz moura,,26/01/1976,45.0,,Rio de Janiero,Brazil,"5'11""",187 lbs,Gracie Fusion,Light Heavyweight,19.0,5.0,9.0,5.0,,19.0,1.0,4.0,2.0,,,19.0,7.0,0.0,180.34,83.01,,Open Stance,,0.67,16.0,0.0,0.0,0.0,0.0,0.0,0.0
/fighter/Florian-Garel-84855,florian garel,,,,,,France,"5'7""",145 lbs,Taiwan Top Team,Featherweight,2.0,0.0,1.0,1.0,,2.0,1.0,4.0,0.0,,,,,,,,,,,,,,,,,,
/fighter/Floyd-Sword-340,floyd sword,,,,,"Farmington, New Mexico",United States,"5'11""",185 lbs,Team Four Corners,Middleweight,12.0,4.0,7.0,1.0,,12.0,1.0,1.0,1.0,,,12.0,3.0,0.0,182.88,83.91,,Orthodox,1976-08-24,0.78,42.0,1.57,40.0,0.0,0.0,33.0,0.0
/fighter/Forrest-Griffin-3526,forrest griffin,,01/07/1979,42.0,,"Athens, Georgia",United States,"6'3""",205 lbs,Xtreme Couture,Light Heavyweight,19.0,4.0,6.0,9.0,,19.0,5.0,0.0,2.0,,,19.0,7.0,0.0,190.5,92.99,195.58,Orthodox,1979-03-16,4.38,36.0,2.81,61.0,1.05,48.0,57.0,0.7
/fighter/Forrest-Petz-4411,forrest petz,The Meat Cleaver,22/09/1975,45.0,,"Cleveland, Ohio",United States,"5'9""",185 lbs,Strong Style Fight Team,Middleweight,26.0,13.0,4.0,9.0,,26.0,2.0,4.0,4.0,,The Meat Cleaver,26.0,10.0,0.0,175.26,77.11,180.34,Orthodox,1975-09-22,2.27,29.0,2.2,57.0,1.3,100.0,66.0,0.0
/fighter/Fran-Evans-72245,fran evans,,,,,"Philadelphia, Pennsylvania",United States,"0'0""",145 lbs,,Featherweight,1.0,0.0,1.0,0.0,,1.0,0.0,0.0,0.0,,,,,,,,,,,,,,,,,,
,francesco maturi,,,,,,,,,,,,,,,,,,,,,,0.0,1.0,0.0,,,,,,0.0,0.0,0.0,0.0,0.0,0.0,0.0,0.0
/fighter/Francimar-Barroso-14702,francimar barroso,Bodao,29/02/1980,41.0,,"Xapuri, Acre",Brazil,"6'1""",205 lbs,Nova Uniao,Light Heavyweight,25.0,11.0,5.0,9.0,,25.0,3.0,1.0,3.0,,Bodao,19.0,7.0,0.0,185.42,92.99,190.5,Orthodox,1980-02-28,2.77,52.0,3.07,59.0,2.22,24.0,83.0,0.0
/fighter/Francis-Carmont-9798,francis carmont,Limitless,10/11/1981,39.0,,Paris,France,"6'3""",205 lbs,Tristar Gym,Light Heavyweight,25.0,6.0,11.0,8.0,,25.0,3.0,3.0,6.0,,Limitless,25.0,12.0,0.0,190.5,92.99,198.12,Orthodox,1981-10-11,2.22,42.0,1.64,59.0,1.79,36.0,73.0,0.6
/fighter/Francis-Healy-72715,francis healy,,11/10/1989,31.0,,"Douglassville, Pennsylvania",United States,"5'7""",145 lbs,Mad Dog Fight Team,Featherweight,7.0,0.0,5.0,2.0,,7.0,1.0,1.0,3.0,,,,,,,,,,,,,,,,,,
,francis marshall,,,,,,,,,,,,,,,,,,,,,Fire,7.0,2.0,0.0,175.26,65.77,182.88,Orthodox,1999-03-03,3.66,33.0,4.07,53.0,3.29,50.0,0.0,0.7
/fighter/Francis-Ngannou-152341,francis ngannou,The Predator,05/09/1986,34.0,,Paris,France,"6'4""",263 lbs,MMA Factory,Heavyweight,16.0,12.0,4.0,0.0,,16.0,0.0,0.0,3.0,,The Predator,17.0,3.0,0.0,193.04,113.4,210.82,Orthodox,1986-09-05,2.33,41.0,2.16,41.0,0.76,62.0,71.0,0.3
/fighter/Francisco-Silva-267221,francisco     silva,,,,,"Porto Velho, Rondonia",Brazil,"0'0""",170 lbs,Fight & Fitness Co.,Welterweight,0.0,0.0,0.0,0.0,,0.0,0.0,0.0,1.0,,,,,,,,,,,,,,,,,,
,francisco bueno,,,,,,,,,,,,,,,,,,,,,,5.0,2.0,0.0,175.26,102.06,,Orthodox,,0.0,0.0,0.0,0.0,0.0,0.0,0.0,0.0
/fighter/Francisco-Figueiredo-69484,francisco figueiredo,Sniper,23/10/1989,31.0,,"Soure, Para",Brazil,"5'6""",125 lbs,Figueiredo Team,Flyweight,12.0,3.0,7.0,2.0,,12.0,1.0,1.0,2.0,,Sniper,13.0,5.0,1.0,167.64,56.7,172.72,Southpaw,1989-10-23,2.04,61.0,2.59,61.0,2.51,75.0,76.0,0.4
/fighter/Francisco-France-35652,francisco france,Kiko,21/01/1983,38.0,,"Gilbert, Arizona",United States,"6'1""",185 lbs,Power MMA Team,Middleweight,13.0,0.0,12.0,1.0,,13.0,4.0,0.0,1.0,,Kiko,13.0,5.0,1.0,182.88,92.99,,,,0.54,33.0,3.51,27.0,0.0,0.0,0.0,6.1
,francisco prado,,,,,,,,,,,,,,,,,,,,,,12.0,1.0,0.0,177.8,70.31,175.26,Orthodox,2002-06-16,3.46,50.0,3.83,46.0,0.0,0.0,25.0,0.8
/fighter/Francisco-Rivera-11908,francisco rivera,Cisco,08/10/1981,39.0,,"Buena Park, California",United States,"5'8""",135 lbs,All In MMA,Bantamweight,13.0,9.0,0.0,4.0,,13.0,2.0,3.0,3.0,,Cisco,11.0,7.0,0.0,172.72,61.23,177.8,Orthodox,1981-10-08,4.07,41.0,3.16,68.0,1.01,63.0,68.0,0.6
/fighter/Francisco-Soares-11997,francisco soares,Maneol,09/08/1975,46.0,,"Boca Raton, Florida",United States,"5'8""",169 lbs,Maneol Soares American Fight Team,Welterweight,5.0,1.0,2.0,1.0,1.0,5.0,2.0,0.0,0.0,0.0,,,,,,,,,,,,,,,,,
/fighter/Francisco-Trevino-38029,francisco trevino,Sitkayan,17/12/1981,39.0,,"Edinburg, Texas",United States,"5'10""",155 lbs,Macaco Gold Team,Lightweight,13.0,4.0,4.0,5.0,,13.0,1.0,1.0,1.0,,Sitkayan,13.0,3.0,0.0,175.26,70.31,177.8,Orthodox,1981-12-17,2.65,42.0,2.42,64.0,0.97,22.0,41.0,0.0
/fighter/Francisco-Trinaldo-31103,francisco trinaldo,Massaranduba,24/08/1978,42.0,,"Brasilia, Federal District",Brazil,"5'8""",170 lbs,Evolucao Thai,Welterweight,26.0,9.0,5.0,12.0,,26.0,0.0,3.0,5.0,,Massaranduba,28.0,9.0,0.0,175.26,77.11,177.8,Southpaw,1978-08-24,3.13,45.0,2.67,60.0,0.98,42.0,60.0,0.5
/fighter/Francois-Ambang-42307,francois ambang,Bang Bang,06/11/1986,34.0,,"Mechanicsville, Virginia",Cameroon,"6'0""",185 lbs,Combat Sports Center,Middleweight,3.0,0.0,2.0,1.0,,3.0,1.0,2.0,1.0,,,,,,,,,,,,,,,,,,
,francois botha,,,,,,,,,,,,,,,,,,,,,White Buffalo,0.0,1.0,0.0,187.96,117.93,,Orthodox,1968-09-28,0.0,0.0,1.05,77.0,0.0,0.0,0.0,0.0
/fighter/Frank-Baca-40367,frank baca,,,,,"Albuquerque, New Mexico",United States,"5'8""",125 lbs,Fit NHB,Flyweight,16.0,6.0,5.0,5.0,,16.0,0.0,3.0,2.0,,,,,,,,,,,,,,,,,,
/fighter/Frank-Buenafuente-84192,frank buenafuente,The Praying Mantis,09/12/1987,33.0,,"Garfield, New Jersey",United States,"5'9""",145 lbs,Iron Horse MMA,Featherweight,10.0,1.0,4.0,5.0,,10.0,0.0,2.0,3.0,,,,,,,,,,,,,,,,,,
/fighter/Frank-Camacho-22114,frank camacho,The Crank,18/05/1989,32.0,,Saipan,Northern Mariana Islands,"5'10""",155 lbs,Team Oyama,Lightweight,22.0,17.0,2.0,3.0,,22.0,5.0,2.0,2.0,,The Crank,22.0,10.0,0.0,177.8,70.31,185.42,Orthodox,1989-05-18,6.56,46.0,7.44,51.0,1.11,31.0,73.0,0.0
/fighter/Frank-Caraballo-36530,frank caraballo,The Tank,18/12/1984,36.0,,"Cleveland, Ohio",United States,"5'8""",144 lbs,Fearless Fight Team,Featherweight,15.0,6.0,5.0,4.0,,15.0,3.0,3.0,4.0,,,,,,,,,,,,,,,,,,
/fighter/Frank-Caracci-211,frank caracci,,16/02/1970,51.0,,"New Orleans, Louisiana",United States,"5'7""",205 lbs,,Light Heavyweight,2.0,1.0,0.0,0.0,1.0,2.0,1.0,1.0,0.0,1.0,,2.0,3.0,0.0,,,,,,0.0,0.0,0.0,0.0,0.0,0.0,0.0,0.0
/fighter/Frank-Carrillo-52656,frank carrillo,The Tank,12/01/1984,37.0,,"Miami, Florida",United States,"5'7""",172 lbs,MMA Masters,Middleweight,10.0,4.0,1.0,5.0,,10.0,3.0,0.0,4.0,,,,,,,,,,,,,,,,,,
,frank gomez,,,,,,,,,,,,,,,,,,,,,,10.0,6.0,0.0,177.8,61.23,170.18,Orthodox,1986-03-31,1.52,48.0,0.79,66.0,1.14,60.0,70.0,0.8
/fighter/Frank-Hamaker-29,frank hamaker,,,,,Amsterdam,Netherlands,"6'2""",245 lbs,,Heavyweight,1.0,1.0,0.0,0.0,,1.0,0.0,0.0,0.0,,,1.0,0.0,0.0,,,,,,0.0,0.0,0.0,0.0,0.0,0.0,0.0,0.0
/fighter/Frank-Lester-22791,frank lester,The Tank,10/06/1984,37.0,,"Temecula, California",United States,"5'11""",170 lbs,Jackson-Wink MMA,Welterweight,10.0,6.0,4.0,0.0,0.0,10.0,1.0,3.0,2.0,2.0,,11.0,6.0,0.0,180.34,77.11,,Orthodox,1984-06-10,2.18,36.0,3.82,53.0,0.0,0.0,0.0,0.0
,frank megallon,,,,,,,,,,,,,,,,,,,,,,2.0,3.0,0.0,177.8,83.91,,Southpaw,,1.14,21.0,5.32,54.0,0.0,0.0,0.0,0.0
/fighter/Frank-Mir-2329,frank mir,,24/05/1979,42.0,,"Las Vegas, Nevada",United States,"6'3""",262 lbs,Frank Mir Gym,Heavyweight,19.0,5.0,9.0,4.0,1.0,19.0,10.0,0.0,3.0,0.0,,18.0,11.0,0.0,190.5,119.75,200.66,Southpaw,1979-05-24,2.18,47.0,3.84,38.0,2.02,40.0,54.0,2.0
/fighter/Frank-Sforza-67973,frank sforza,,,,,"Rockland, Massachusetts",United States,"6'0""",155 lbs,South Shore Sport Fighting,Lightweight,8.0,1.0,5.0,2.0,,8.0,0.0,1.0,0.0,,,,,,,,,,,,,,,,,,
/fighter/Frank-Shamrock-284,frank shamrock,,08/12/1972,48.0,,"Santa Monica, California",United States,"5'10""",185 lbs,The Alliance,Middleweight,23.0,4.0,12.0,5.0,2.0,23.0,4.0,2.0,3.0,1.0,,23.0,10.0,2.0,177.8,83.91,,Orthodox,1972-12-08,4.75,53.0,4.66,57.0,0.35,50.0,37.0,1.1
/fighter/Frank-Tate-181193,frank tate,Big,22/04/1976,45.0,,"Birmingham, Alabama",United States,"6'2""",243 lbs,,Heavyweight,6.0,4.0,0.0,2.0,,6.0,2.0,2.0,3.0,,,,,,,,,,,,,,,,,,
/fighter/Frank-Trigg-311,frank trigg,Twinkle Toes,07/05/1972,49.0,,"Rochester, New York",United States,"5'8""",181 lbs,Xtreme Couture,Middleweight,21.0,12.0,4.0,5.0,,21.0,4.0,4.0,1.0,,Twinkle Toes,21.0,9.0,0.0,175.26,77.11,180.34,Southpaw,1972-05-07,2.79,46.0,1.9,56.0,2.35,47.0,75.0,0.8
/fighter/Frankie-Edgar-14204,frankie edgar,The Answer,16/10/1981,39.0,,"Toms River, New Jersey",United States,"5'6""",135 lbs,Ricardo Almeida Jiu-Jitsu,Bantamweight,24.0,7.0,4.0,13.0,,24.0,3.0,0.0,6.0,,The Answer,23.0,11.0,1.0,167.64,61.23,172.72,Orthodox,1981-10-16,3.77,40.0,2.82,65.0,2.29,31.0,65.0,0.3
/fighter/Frankie-Perez-79784,frankie perez,,11/05/1989,32.0,,"Howell, New Jersey",United States,"5'11""",155 lbs,Ricardo Almeida Jiu-Jitsu,Lightweight,11.0,2.0,6.0,3.0,,11.0,1.0,0.0,3.0,,,10.0,4.0,0.0,180.34,70.31,185.42,Orthodox,1989-05-11,1.64,41.0,2.17,54.0,1.75,41.0,50.0,0.3
/fighter/Frankie-Saenz-55410,frankie saenz,,12/08/1980,40.0,,"Scottsdale, Arizona",United States,"5'6""",135 lbs,Fight Ready,Bantamweight,12.0,3.0,2.0,7.0,0.0,12.0,4.0,0.0,2.0,1.0,,13.0,7.0,0.0,167.64,61.23,167.64,Orthodox,1980-08-12,3.94,47.0,3.5,52.0,1.74,31.0,61.0,0.1
/fighter/Frans-Mlambo-137701,frans mlambo,The Zulu Irishman / The Black Mamba,22/05/1991,30.0,,Dublin,Ireland,"5'9""",134 lbs,SBG Ireland,Bantamweight,10.0,4.0,4.0,2.0,,10.0,2.0,1.0,2.0,,,,,,,,,,,,,,,,,,
/fighter/Fransino-Tirta-26387,fransino tirta,,29/03/1981,40.0,,Jakarta,Indonesia,"5'5""",135 lbs,Synergy,Bantamweight,16.0,7.0,6.0,3.0,,16.0,0.0,0.0,0.0,,,,,,,,,,,,,,,,,,
/fighter/Fred-Ettish-36,fred ettish,,12/10/1955,65.0,,"Bemiji, Minnesota",United States,"6'0""",180 lbs,,Middleweight,1.0,1.0,0.0,0.0,,1.0,0.0,1.0,0.0,,,1.0,1.0,0.0,182.88,81.65,,Southpaw,,0.0,0.0,0.0,0.0,0.0,0.0,0.0,0.0
/fighter/Fred-Freeman-149351,fred freeman,,04/12/1988,32.0,,"St. Louis, Missouri",United States,"5'9""",154 lbs,,Lightweight,2.0,2.0,0.0,0.0,,2.0,0.0,2.0,0.0,,,,,,,,,,,,,,,,,,
/fighter/Freddie-Aquitania-66936,freddie aquitania,Bigg,06/12/1979,41.0,,"Fairfield, California",United States,"6'1""",238 lbs,Team Alpha Male,Heavyweight,7.0,3.0,1.0,3.0,,7.0,0.0,0.0,1.0,,,,,,,,,,,,,,,,,,
/fighter/Frederick-Brown-68497,frederick brown,,20/11/1976,44.0,,"Wichita, Kansas",United States,"6'0""",235 lbs,,Heavyweight,3.0,3.0,0.0,0.0,,3.0,2.0,0.0,0.0,,,3.0,2.0,0.0,182.88,106.59,,,,0.0,0.0,0.0,0.0,0.0,0.0,0.0,0.0
/fighter/Fredson-Paixao-10432,fredson paixao,,13/05/1979,42.0,,"Las Vegas, Nevada",United States,"5'6""",145 lbs,Syndicate MMA,Featherweight,10.0,1.0,5.0,4.0,,10.0,1.0,0.0,4.0,,,10.0,5.0,0.0,167.64,65.77,167.64,Orthodox,1979-05-13,1.71,54.0,2.31,62.0,0.62,11.0,10.0,2.2
/fighter/Fredy-Serrano-112413,fredy serrano,El Profe,22/09/1979,41.0,,Bogota,Colombia,"5'2""",125 lbs,Octagon MMA Bogota,Flyweight,4.0,2.0,0.0,1.0,1.0,4.0,0.0,0.0,2.0,0.0,El Profe,3.0,2.0,0.0,160.02,56.7,165.1,Orthodox,1979-09-22,1.58,26.0,1.89,61.0,2.84,25.0,84.0,0.0
/fighter/Fuchong-Yang-284123,fuchong yang,,,,,,China,"0'0""",135 lbs,Yunnan Kunli Fight Club,Bantamweight,6.0,4.0,1.0,1.0,,6.0,1.0,2.0,2.0,,,,,,,,,,,,,,,,,,
/fighter/Furqan-Cheema-261053,furqan cheema,,12/06/1990,31.0,,Rawalpindi,Pakistan,"6'3""",170 lbs,Gracie Barra Huddersfield,Welterweight,3.0,2.0,1.0,0.0,,3.0,0.0,1.0,0.0,,,,,,,,,,,,,,,,,,
,gabe green,,,,,,,,,,,,,,,,,,,,,Gifted,11.0,5.0,0.0,177.8,77.11,185.42,Switch,1993-05-02,6.28,45.0,6.95,47.0,0.83,50.0,53.0,0.3
,gabe lemley,,,,,,,,,,,,,,,,,,,,,,13.0,9.0,0.0,172.72,70.31,,Orthodox,,0.82,35.0,6.03,45.0,0.0,0.0,0.0,0.0
/fighter/Gabe-Ruediger-5542,gabe ruediger,Godzilla,29/08/1977,43.0,,"Rancho Cucamonga, California",United States,"5'10""",155 lbs,PKG,Lightweight,18.0,4.0,13.0,1.0,,18.0,5.0,2.0,1.0,,Godzilla,18.0,8.0,0.0,177.8,70.31,,Orthodox,1977-08-29,1.7,31.0,5.16,41.0,2.04,11.0,28.0,0.0
/fighter/Gabe-Wood-70297,gabe wood,,14/12/1982,38.0,,"Chalmette, Louisiana",United States,"5'8""",153 lbs,Power MMA,Lightweight,3.0,1.0,0.0,2.0,,3.0,1.0,3.0,1.0,,,,,,,,,,,,,,,,,,
,gabriel arges,,,,,,,,,,,,,,,,,,,,,,0.0,0.0,0.0,,77.11,,,,0.0,0.0,0.0,0.0,0.0,0.0,0.0,0.0
/fighter/Gabriel-Benitez-25733,gabriel benitez,Moggly,15/06/1988,33.0,,"Tijuana, Baja California",Mexico,"5'8""",145 lbs,American Kickboxing Academy,Featherweight,22.0,8.0,10.0,4.0,,22.0,3.0,2.0,4.0,,Moggly,23.0,11.0,0.0,172.72,70.31,180.34,Southpaw,1988-06-15,4.79,41.0,4.05,65.0,0.27,50.0,58.0,1.1
,gabriel bonfim,,,,,,,,,,,,,,,,,,,,,Marretinha,15.0,1.0,0.0,185.42,77.11,182.88,Orthodox,1997-08-20,4.87,40.0,5.25,59.0,4.75,71.0,100.0,3.8
/fighter/Gabriel-Carrasco-101703,gabriel carrasco,,,,,"San Jose, California",United States,"5'6""",135 lbs,American Kickboxing Academy,Bantamweight,7.0,2.0,2.0,3.0,,7.0,0.0,0.0,0.0,,,7.0,0.0,0.0,167.64,61.23,,,,4.15,37.0,1.53,80.0,0.0,0.0,100.0,0.0
,gabriel checco,,,,,,,,,,,,,,,,,,,,,Zangief,10.0,2.0,0.0,185.42,83.91,,Switch,1986-04-03,0.0,0.0,0.0,0.0,0.0,0.0,0.0,0.0
/fighter/Gabriel-Gonzaga-7306,gabriel gonzaga,Napao,18/05/1979,42.0,,Rio de Janeiro,Brazil,"6'2""",264 lbs,Team Link,Heavyweight,17.0,9.0,7.0,1.0,,17.0,10.0,0.0,2.0,,Napao,17.0,11.0,0.0,187.96,109.77,193.04,Orthodox,1979-05-18,2.12,45.0,2.94,57.0,2.8,39.0,66.0,1.1
/fighter/Gabriel-Green-195027,gabriel green,Gifted,02/05/1993,28.0,,"Downey, California",United States,"5'10""",170 lbs,Subfighter MMA,Welterweight,10.0,3.0,6.0,1.0,,10.0,2.0,0.0,1.0,,,,,,,,,,,,,,,,,,
/fighter/Gabriel-Miglioli-15680,gabriel miglioli,Gabe,10/07/1981,40.0,,"Sao Paulo, Sao Paulo",Brazil,"5'10""",155 lbs,Alliance MMA,Lightweight,9.0,7.0,0.0,2.0,0.0,9.0,3.0,0.0,5.0,1.0,Biel,9.0,9.0,0.0,172.72,77.11,,,,0.0,0.0,0.0,0.0,0.0,0.0,0.0,0.0
,gabriel miranda,,,,,,,,,,,,,,,,,,,,,Fly,17.0,6.0,0.0,180.34,65.77,180.34,Orthodox,1990-03-25,3.52,51.0,6.88,39.0,4.8,40.0,0.0,2.4
,gabriel salinas-jones,,,,,,,,,,,,,,,,,,,,,,5.0,2.0,1.0,185.42,111.13,,,,0.0,0.0,0.0,0.0,0.0,0.0,0.0,0.0
,gabriel santos,,,,,,,,,,,,,,,,,,,,,Mosquitinho,10.0,2.0,0.0,175.26,65.77,177.8,Orthodox,1996-11-28,4.46,55.0,6.03,44.0,4.34,46.0,66.0,1.2
/fighter/Gabriel-Silva-128611,gabriel silva,Gabito,26/08/1994,26.0,,"Vila Velha, Espirito Santo",Brazil,"5'6""",135 lbs,Team Nogueira,Bantamweight,8.0,3.0,1.0,4.0,,8.0,0.0,0.0,2.0,,,8.0,2.0,0.0,167.64,61.23,180.34,Orthodox,1994-08-26,1.3,34.0,3.47,45.0,1.5,25.0,38.0,0.5
/fighter/Gabriel-Varga-334411,gabriel varga,,16/05/1985,36.0,,"Toronto, Ontario",Canada,"5'10""",145 lbs,Varga Bros. Martial Arts,Featherweight,1.0,1.0,0.0,0.0,,1.0,0.0,0.0,1.0,,,,,,,,,,,,,,,,,,
,gabriella fernandes,,,,,,,,,,,,,,,,,,,,,Gabi,8.0,3.0,0.0,167.64,56.7,167.64,Southpaw,1993-08-13,1.63,47.0,2.7,47.0,0.0,0.0,61.0,0.0
/fighter/Gabriella-Gulfin-300267,gabriella gulfin,GDaddy,27/02/1992,29.0,,New York,United States,"5'5""",125 lbs,Class One MMA,Flyweight,2.0,0.0,1.0,1.0,,2.0,1.0,1.0,1.0,,,,,,,,,,,,,,,,,,
/fighter/Gabrielle-Holloway-107069,gabrielle holloway,Gabanator,15/04/1990,31.0,,"Rhoadesville, Virginia",United States,"5'3""",145 lbs,Evolve Academy,Featherweight,6.0,2.0,1.0,3.0,,6.0,0.0,0.0,6.0,,Gabanator,6.0,5.0,0.0,160.02,65.77,,,,0.7,42.0,3.07,34.0,3.0,35.0,16.0,1.0
,gadzhi omargadzhiev,,,,,,,,,,,,,,,,,,,,,,13.0,2.0,0.0,185.42,77.11,180.34,Switch,1993-02-24,1.8,39.0,2.2,39.0,1.35,30.0,60.0,0.5
/fighter/Gadzhi-Rabadanov-149247,gadzhi rabadanov,,,,,"Makhachkala, Dagestan",Russia,"5'9""",155 lbs,,Lightweight,16.0,6.0,5.0,5.0,,16.0,2.0,1.0,1.0,,,,,,,,,,,,,,,,,,
/fighter/Gadzhimurad-Abdullaev-255775,gadzhimurad abdullaev,,,,,,Russia,"6'1""",170 lbs,Team Wildhearts,Welterweight,6.0,3.0,2.0,1.0,,6.0,0.0,0.0,0.0,,,,,,,,,,,,,,,,,,
/fighter/Gadzhimurad-Antigulov-55325,gadzhimurad antigulov,,01/01/1987,34.0,,"Makhachkala, Dagestan",Russia,"5'11""",205 lbs,American Top Team,Light Heavyweight,20.0,4.0,15.0,1.0,,20.0,5.0,3.0,0.0,,,20.0,8.0,0.0,180.34,92.99,177.8,Orthodox,1987-02-09,2.08,55.0,4.21,40.0,5.08,36.0,0.0,1.4
/fighter/Gaetano-Pirrello-54431,gaetano pirrello,El Tigre,29/04/1992,29.0,,"La Louviere, Hainaut",Belgium,"5'7""",135 lbs,Osman Gym,Bantamweight,15.0,11.0,3.0,1.0,,15.0,1.0,4.0,1.0,,El Tigre,15.0,7.0,1.0,170.18,61.23,165.1,Orthodox,1992-04-29,0.99,55.0,2.44,42.0,0.0,0.0,30.0,0.0
/fighter/Galore-Bofando-59466,galore bofando,The Paranormal,,,,"London, Greater London",England,"5'11""",170 lbs,London Shootfighters,Welterweight,6.0,4.0,0.0,2.0,0.0,6.0,1.0,0.0,0.0,2.0,,5.0,3.0,0.0,180.34,77.11,182.88,Switch,1982-05-22,3.63,45.0,3.63,54.0,2.37,100.0,50.0,0.0
/fighter/Gan-McGee-273,gan mcgee,The Giant,20/11/1976,44.0,,"San Luis Obispo, California",United States,"6'10""",260 lbs,S.K.S. Fight Team,Heavyweight,13.0,11.0,1.0,0.0,1.0,13.0,3.0,1.0,1.0,0.0,The Giant,13.0,5.0,0.0,208.28,120.2,,Orthodox,1976-11-20,2.2,29.0,2.31,59.0,0.65,25.0,83.0,0.0
/fighter/Ganbat-Bayasgalan-273517,ganbat bayasgalan,,23/05/1989,32.0,,Ulaanbaatar,Mongolia,"5'8""",145 lbs,Team Tungaa,Featherweight,3.0,1.0,1.0,1.0,,3.0,0.0,0.0,0.0,,,,,,,,,,,,,,,,,,
/fighter/Ganbayar-Tumurkhuyag-144361,ganbayar tumurkhuyag,,26/07/1985,36.0,,,Mongolia,"6'2""",205 lbs,Zorky MMA,Light Heavyweight,5.0,3.0,1.0,1.0,,5.0,0.0,0.0,2.0,,,,,,,,,,,,,,,,,,
/fighter/Gao-Bo-222523,gao bo,Triangle Hunter,,,,,China,"6'1""",155 lbs,Yuan Jiujitsu,Lightweight,1.0,0.0,1.0,0.0,,1.0,3.0,0.0,1.0,,,,,,,,,,,,,,,,,,
,gareth joseph,,,,,,,,,,,,,,,,,,,,,,9.0,5.0,0.0,,92.99,,,,0.0,0.0,0.0,0.0,0.0,0.0,0.0,0.0
/fighter/Garett-Whiteley-39261,garett whiteley,,13/12/1980,40.0,,"Indianapolis, Indiana",United States,"6'0""",155 lbs,IndyBoxing and Grappling,Lightweight,7.0,5.0,2.0,0.0,,7.0,1.0,0.0,2.0,,Goodnight,7.0,3.0,0.0,182.88,70.31,182.88,Orthodox,1980-12-13,3.72,48.0,4.04,46.0,0.0,0.0,27.0,0.9
/fighter/Garreth-McLellan-71237,garreth mclellan,Soldier Boy,09/01/1982,39.0,,"Johannesburg, Gauteng",South Africa,"6'1""",185 lbs,FightFit Militia,Middleweight,13.0,3.0,9.0,1.0,,13.0,4.0,1.0,2.0,,Soldier Boy,13.0,6.0,0.0,185.42,83.91,182.88,Southpaw,1982-09-01,3.56,54.0,2.94,45.0,1.15,22.0,34.0,0.9
,garrett armfield,,,,,,,,,,,,,,,,,,,,,,9.0,3.0,0.0,167.64,61.23,177.8,Orthodox,1996-10-09,5.29,44.0,3.52,57.0,0.0,0.0,75.0,0.0
/fighter/Garrett-Gross-84704,garrett gross,Glory to God,08/08/1988,33.0,,"Du Quoin, Illinois",United States,"5'11""",155 lbs,Sabens Martial Arts,Lightweight,11.0,8.0,2.0,1.0,,11.0,2.0,4.0,3.0,,,11.0,7.0,0.0,175.26,70.31,,Orthodox,1988-08-08,2.39,45.0,1.67,46.0,0.0,0.0,52.0,0.0
/fighter/Garrett-Mueller-100377,garrett mueller,,29/01/1989,32.0,,"Jefferson City, Missouri",United States,"5'9""",155 lbs,,Lightweight,4.0,0.0,2.0,2.0,,4.0,4.0,1.0,2.0,,,3.0,3.0,0.0,175.26,61.23,,,,0.0,0.0,0.0,0.0,0.0,0.0,0.0,0.0
/fighter/Garrett-Scott-124441,garrett scott,,18/04/1983,38.0,,Texas,United States,"0'0""",169 lbs,,Welterweight,2.0,1.0,1.0,0.0,,2.0,0.0,0.0,0.0,,,,,,,,,,,,,,,,,,
/fighter/Garry-Tonon-222287,garry tonon,The Lion Killer,12/09/1991,29.0,,"Brunswick, New Jersey",United States,"5'8""",155 lbs,Team Renzo Gracie,Lightweight,6.0,2.0,3.0,1.0,,6.0,0.0,0.0,0.0,,,,,,,,,,,,,,,,,,
,gary frazier,,,,,,,,,,,,,,,,,,,,,,3.0,3.0,0.0,182.88,111.13,,Orthodox,,1.5,39.0,2.77,46.0,0.0,0.0,100.0,0.0
/fighter/Gary-Goodridge-129,gary goodridge,Big Daddy,17/01/1966,55.0,,"Barrie, Ontario",Canada,"6'3""",240 lbs,Big Daddy Fight Team,Heavyweight,23.0,16.0,6.0,1.0,,23.0,10.0,8.0,4.0,,Big Daddy,23.0,22.0,1.0,190.5,112.94,,Orthodox,1966-01-17,1.84,56.0,2.14,48.0,0.4,100.0,53.0,0.8
,gary mangat,,,,,,,,,,,,,,,,,,,,,,15.0,3.0,0.0,170.18,61.23,,,,0.0,0.0,0.0,0.0,0.0,0.0,0.0,0.0
/fighter/Gary-Padilla-14754,gary padilla,,05/09/1980,40.0,,"San Diego, California",United States,"6'1""",185 lbs,Alliance MMA,Middleweight,12.0,4.0,3.0,5.0,,12.0,0.0,0.0,6.0,,,12.0,6.0,0.0,180.34,92.99,,,,2.2,27.0,2.0,76.0,0.0,0.0,50.0,0.0
,gary quan,,,,,,,,,,,,,,,,,,,,,,3.0,5.0,0.0,172.72,64.86,,,,0.0,0.0,0.0,0.0,0.0,0.0,0.0,0.0
/fighter/Gary-Tapusoa-55537,gary tapusoa,Freak Train,02/09/1979,41.0,,"Jefferson City, Missouri",United States,"5'10""",184 lbs,MMA Center,Middleweight,8.0,6.0,2.0,0.0,,8.0,2.0,0.0,1.0,,,8.0,3.0,0.0,170.18,83.91,,,,0.0,0.0,0.0,0.0,0.0,0.0,0.0,0.0
/fighter/Gasan-Umalatov-53109,gasan umalatov,,03/11/1983,37.0,,"Zinzeli, Astrakhan Oblast",Russia,"5'11""",181 lbs,Astrakhan Top Team,Middleweight,18.0,4.0,7.0,7.0,,18.0,0.0,1.0,4.0,,Cobra,17.0,4.0,2.0,180.34,77.11,180.34,Orthodox,1982-09-11,2.23,39.0,4.1,59.0,0.75,17.0,90.0,0.0
/fighter/Gaston-Bolanos-140905,gaston bolanos,The Dreamkiller,14/09/1992,28.0,,"Dublin, California",United States,"5'7""",145 lbs,CSA,Featherweight,5.0,5.0,0.0,0.0,,5.0,0.0,2.0,1.0,,The Dreamkiller,7.0,3.0,0.0,170.18,61.23,175.26,Orthodox,1992-09-14,4.2,49.0,1.13,56.0,0.0,0.0,40.0,0.0
/fighter/Gaston-Reyno-145565,gaston reyno,Tonga,11/11/1986,34.0,,Montevideo,Uruguay,"5'10""",145 lbs,Glory MMA & Fitness,Featherweight,9.0,4.0,4.0,1.0,,9.0,0.0,1.0,1.0,,Tonga,6.0,2.0,0.0,182.88,65.77,,,,7.79,62.0,3.9,44.0,0.0,0.0,0.0,11.7
/fighter/Gavin-Hughes-168545,gavin hughes,Big Tasty,,,,"Liverpool, Merseyside",England,"5'10""",155 lbs,Blackledge MMA,Lightweight,10.0,4.0,5.0,1.0,,10.0,1.0,1.0,0.0,,,,,,,,,,,,,,,,,,
/fighter/Gavin-Sterritt-31943,gavin sterritt,War Horse,27/08/1979,41.0,,"Liverpool, Merseyside",England,"5'11""",155 lbs,,Lightweight,6.0,1.0,4.0,1.0,,6.0,1.0,2.0,0.0,,,,,,,,,,,,,,,,,,
/fighter/Gavin-Tucker-78469,gavin tucker,Guv'Nor,17/06/1986,35.0,,"Ship Cove, Newfoundland",Canada,"5'7""",145 lbs,Titans MMA,Featherweight,13.0,4.0,6.0,3.0,,13.0,1.0,0.0,1.0,,Guv'nor,13.0,3.0,0.0,167.64,65.77,167.64,Southpaw,1986-06-17,4.29,44.0,4.18,57.0,3.13,44.0,53.0,1.5
/fighter/Geane-Herrera-79290,geane herrera,La Pulga,27/05/1990,31.0,,"Tampa, Florida",United States,"5'5""",125 lbs,Banks MMA,Flyweight,10.0,2.0,6.0,2.0,,10.0,0.0,0.0,3.0,,La Pulga,9.0,3.0,0.0,165.1,56.7,167.64,Orthodox,1990-05-27,1.51,31.0,5.07,52.0,0.83,37.0,38.0,0.6
/fighter/Gedan-Ni-228273,gedan ni,,,,,,China,"0'0""",115 lbs,,Strawweight,12.0,3.0,4.0,5.0,,12.0,2.0,0.0,2.0,,,,,,,,,,,,,,,,,,
/fighter/Gegard-Mousasi-7466,gegard mousasi,The Dreamcatcher,01/08/1985,36.0,,"Leiden, South Holland",Netherlands,"6'2""",185 lbs,Team Jurojin,Middleweight,47.0,26.0,12.0,9.0,,47.0,1.0,3.0,3.0,,,42.0,6.0,2.0,187.96,83.91,193.04,Orthodox,1985-08-01,3.75,50.0,1.21,68.0,1.59,60.0,59.0,1.1
/fighter/Geje-Eustaquio-76813,geje eustaquio,Gravity,06/04/1989,32.0,,"Baguio, Benguet",Philippines,"5'5""",125 lbs,Lakay MMA,Flyweight,14.0,3.0,2.0,9.0,,14.0,1.0,2.0,5.0,,,,,,,,,,,,,,,,,,
/fighter/Gemiyale-Adkins-62278,gemiyale adkins,Baby Hercules,09/12/1982,38.0,,"Philadelphia, Pennsylvania",United States,"5'10""",166 lbs,Team Balance,Welterweight,11.0,4.0,2.0,5.0,,11.0,0.0,1.0,8.0,,,,,,,,,,,,,,,,,,
/fighter/Genair-da-Silva-48947,genair da silva,Junior PQD,26/12/1983,37.0,,"Rio de Janeiro, Rio de Janeiro",Brazil,"5'9""",145 lbs,Renovacao Fight Team,Featherweight,15.0,8.0,4.0,3.0,0.0,15.0,2.0,1.0,2.0,1.0,,,,,,,,,,,,,,,,,
,genaro valdez,,,,,,,,,,,,,,,,,,,,,Rayadito,10.0,3.0,0.0,175.26,70.31,182.88,Orthodox,1992-01-16,4.08,30.0,7.16,48.0,1.54,44.0,36.0,0.4
/fighter/Genki-Sudo-1227,genki sudo,Neo-Samurai,08/03/1978,43.0,,Tokyo,Japan,"5'9""",155 lbs,Beverly Hills Jiu-Jitsu Club,Lightweight,15.0,2.0,11.0,2.0,,15.0,1.0,0.0,3.0,,Neo-Samurai,15.0,4.0,2.0,175.26,70.31,,Orthodox,1978-03-08,1.55,39.0,2.23,33.0,3.58,60.0,50.0,4.2
,gennaro strangis,,,,,,,,,,,,,,,,,,,,,,0.0,1.0,0.0,,,,,,0.0,0.0,0.0,0.0,0.0,0.0,0.0,0.0
/fighter/Geoff-Neal-72107,geoff neal,Handz of Steel,28/08/1990,30.0,,"Harker Heights, Texas",United States,"5'11""",170 lbs,Fortis MMA,Welterweight,13.0,8.0,2.0,3.0,,13.0,1.0,1.0,2.0,,Handz of Steel,15.0,5.0,0.0,180.34,77.11,190.5,Southpaw,1990-08-28,5.22,50.0,5.6,58.0,0.51,44.0,87.0,0.1
/fighter/Geoffrey-Then-219327,geoffrey then,,,,,Connecticut,United States,"0'0""",135 lbs,Kore BJJ,Bantamweight,1.0,0.0,1.0,0.0,,1.0,1.0,0.0,1.0,,,,,,,,,,,,,,,,,,
,george allen,,,,,,,,,,,,,,,,,,,,,,13.0,19.0,2.0,187.96,92.99,,Open Stance,1967-01-13,0.8,38.0,3.1,43.0,0.0,0.0,50.0,0.0
,george bush,,,,,,,,,,,,,,,,,,,,,,5.0,2.0,0.0,185.42,92.99,,,,6.35,64.0,2.31,55.0,17.31,66.0,0.0,0.0
/fighter/George-Courtney-155115,george courtney,,,,,,Northern Ireland,"0'0""",154 lbs,,Lightweight,1.0,0.0,1.0,0.0,,1.0,0.0,1.0,0.0,,,,,,,,,,,,,,,,,,
/fighter/George-Hardwick-155397,george hardwick,,,,,"Middlesbrough, North Yorkshire",England,"0'0""",154 lbs,Middlesbrough Fight Academy,Lightweight,7.0,1.0,2.0,4.0,,7.0,0.0,0.0,1.0,,King,12.0,2.0,0.0,177.8,70.31,182.88,Orthodox,1996-12-06,3.6,38.0,4.6,71.0,0.0,0.0,83.0,0.0
/fighter/George-Hickman-50655,george hickman,,21/11/1985,35.0,,"Wrightsville Beach, North Carolina",United States,"5'9""",145 lbs,Tiger Muay Thai,Featherweight,9.0,2.0,2.0,5.0,,9.0,1.0,1.0,1.0,,,,,,,,,,,,,,,,,,
/fighter/George-Pacurariu-31717,george pacurariu,Constantine,28/07/1984,37.0,,,Romania,"5'7""",150 lbs,Octagon MMA,Lightweight,10.0,2.0,5.0,3.0,,10.0,2.0,1.0,2.0,,Constantine,10.0,5.0,0.0,170.18,61.23,,,,4.69,53.0,2.68,63.0,5.03,100.0,100.0,5.0
/fighter/George-Roop-16415,george roop,,10/11/1981,39.0,,"Tucson, Arizona",United States,"6'1""",135 lbs,Apex MMA,Bantamweight,15.0,4.0,4.0,7.0,,15.0,5.0,4.0,4.0,,,15.0,13.0,1.0,185.42,61.23,182.88,Orthodox,1981-11-10,3.43,34.0,2.47,60.0,1.05,57.0,59.0,0.1
/fighter/George-Sotiropoulos-11702,george sotiropoulos,,09/07/1977,44.0,,"Geelong, Victoria",Australia,"5'10""",155 lbs,American Top Team,Lightweight,14.0,1.0,8.0,5.0,0.0,14.0,2.0,0.0,4.0,1.0,,14.0,7.0,0.0,177.8,70.31,180.34,Orthodox,1977-07-09,2.61,27.0,2.52,67.0,2.32,31.0,53.0,1.6
,george stork,,,,,,,,,,,,,,,,,,,,,,7.0,9.0,0.0,177.8,83.91,,,,0.0,0.0,0.0,0.0,0.0,0.0,0.0,0.0
/fighter/George-Sullivan-15148,george sullivan,The Silencer,13/03/1981,40.0,,"Belmar, New Jersey",United States,"6'0""",169 lbs,Pellegrino MMA,Welterweight,18.0,11.0,0.0,7.0,,18.0,1.0,5.0,2.0,,The Silencer,17.0,7.0,0.0,182.88,77.11,185.42,Orthodox,1981-03-13,3.53,39.0,2.42,57.0,1.37,20.0,38.0,0.7
/fighter/George-Tokkos-175999,george tokkos,Tuco,,,,London,England,"6'3""",185 lbs,Sanford MMA,Middleweight,4.0,3.0,0.0,1.0,,4.0,1.0,0.0,1.0,,,,,,,,,,,,,,,,,,
/fighter/George-Zuniga-148803,george zuniga,GZ,,,,"Fresno, California",United States,"6'2""",185 lbs,,Middleweight,3.0,1.0,1.0,1.0,,3.0,1.0,0.0,0.0,,,3.0,1.0,0.0,175.26,83.91,,,,7.64,38.0,5.45,37.0,0.0,0.0,100.0,0.0
,georges st-pierre,,,,,,,,,,,,,,,,,,,,,Rush,26.0,2.0,0.0,180.34,83.91,193.04,Orthodox,1981-05-19,3.78,53.0,1.4,72.0,4.16,74.0,83.0,1.1
/fighter/Georges-St-Pierre-3500,georges st. pierre,Rush,19/05/1981,40.0,,"St. Isidore, Quebec",Canada,"5'10""",170 lbs,Tristar Gym,Welterweight,26.0,8.0,6.0,12.0,,26.0,1.0,1.0,0.0,,,,,,,,,,,,,,,,,,
/fighter/Georgi-Karakhanyan-19472,georgi karakhanyan,Insane,29/05/1985,36.0,,"Riverside, California",United States,"5'8""",145 lbs,Millennia MMA,Featherweight,31.0,7.0,16.0,8.0,,31.0,3.0,0.0,8.0,,Insane,26.0,7.0,1.0,172.72,65.77,,,,4.49,39.0,5.0,54.0,1.41,50.0,33.0,1.9
/fighter/Georgi-Stoyanov-39813,georgi stoyanov,Stanchev,07/07/1980,41.0,,Burgas,Bulgaria,"5'7""",145 lbs,,Featherweight,20.0,1.0,11.0,7.0,1.0,20.0,0.0,5.0,6.0,0.0,,,,,,,,,,,,,,,,,
/fighter/Georgy-Kichigin-127557,georgy kichigin,Knight,05/03/1989,32.0,,,Kazakhstan,"6'1""",170 lbs,,Welterweight,25.0,3.0,17.0,5.0,,25.0,2.0,3.0,2.0,,,,,,,,,,,,,,,,,,
/fighter/Gerald-Harris-17903,gerald harris,Hurricane,19/11/1979,41.0,,"Tulsa, Oklahoma",United States,"5'11""",170 lbs,Hurricane Fitness,Welterweight,26.0,15.0,2.0,9.0,,26.0,1.0,2.0,5.0,,,23.0,5.0,0.0,180.34,83.91,195.58,Southpaw,1979-11-19,1.41,29.0,1.58,62.0,2.96,54.0,72.0,0.0
/fighter/Gerald-Meerschaert-21501,gerald meerschaert,GM3,18/12/1987,33.0,,"Racine, Wisconsin",United States,"6'1""",185 lbs,Roufusport,Middleweight,32.0,6.0,24.0,2.0,,32.0,3.0,8.0,3.0,,GM3,35.0,17.0,0.0,185.42,83.91,195.58,Southpaw,1987-12-18,3.3,44.0,3.5,53.0,2.01,37.0,34.0,1.5
/fighter/Gerald-Strebendt-2327,gerald strebendt,The Finishing Machine,01/03/1979,42.0,,"Los Angeles, California",United States,"5'9""",155 lbs,10th Planet Jiu-Jitsu,Lightweight,9.0,1.0,8.0,0.0,,9.0,4.0,3.0,0.0,,The Finishing Machine,9.0,7.0,0.0,175.26,70.31,,Orthodox,1979-03-01,0.0,0.0,4.0,38.0,0.0,0.0,0.0,16.4
,geraldo de freitas,,,,,,,,,,,,,,,,,,,,,Spartan,12.0,6.0,0.0,170.18,61.23,182.88,Orthodox,1991-09-30,3.67,52.0,2.62,50.0,3.0,45.0,59.0,0.0
/fighter/Geraldo-de-Freitas-Jr-107229,geraldo de freitas jr.,The Spartan,30/09/1991,29.0,,"Conselheiro Lafaiete, Minas Gerais",Brazil,"5'9""",135 lbs,Nova Uniao,Bantamweight,13.0,4.0,6.0,3.0,,13.0,0.0,0.0,6.0,,,,,,,,,,,,,,,,,,
/fighter/Gerard-Gordeau-15,gerard gordeau,,30/03/1955,66.0,,The Hague,Netherlands,"6'5""",216 lbs,Kamakura,Heavyweight,2.0,2.0,0.0,0.0,,2.0,0.0,2.0,0.0,,,2.0,2.0,0.0,195.58,97.98,,Orthodox,1959-03-30,0.0,0.0,0.0,0.0,0.0,0.0,0.0,0.0
/fighter/Germaine-de-Randamie-41745,germaine de randamie,The Iron Lady,24/04/1984,37.0,,Utrecht,Netherlands,"5'9""",135 lbs,American Kickboxing Academy,Bantamweight,10.0,4.0,1.0,5.0,,10.0,1.0,1.0,2.0,,The Iron Lady,10.0,4.0,0.0,175.26,61.23,180.34,Orthodox,1984-04-24,2.72,46.0,2.14,65.0,0.0,0.0,69.0,0.4
,geronimo dos santos,,,,,,,,,,,,,,,,,,,,,Mondragon,39.0,19.0,0.0,190.5,119.75,,Orthodox,1980-08-17,1.09,33.0,8.73,41.0,0.0,0.0,33.0,0.0
,gerric hayes,,,,,,,,,,,,,,,,,,,,,,8.0,11.0,0.0,177.8,,,,,0.0,0.0,0.0,0.0,0.0,0.0,0.0,0.0
,gerry harris,,,,,,,,,,,,,,,,,,,,,,1.0,4.0,0.0,203.2,122.47,,Orthodox,,0.0,0.0,0.0,0.0,0.0,0.0,0.0,0.0
,gesias cavalcante,,,,,,,,,,,,,,,,,,,,,JZ,21.0,10.0,1.0,172.72,70.31,180.34,Orthodox,1983-07-06,1.98,35.0,3.11,51.0,1.25,36.0,66.0,1.1
/fighter/Getu-Hexi-169173,getu hexi,Wolf of the Grasslands,,,,,China,"5'4""",125 lbs,China Top Team,Flyweight,7.0,0.0,3.0,4.0,,7.0,1.0,1.0,1.0,,,,,,,,,,,,,,,,,,
/fighter/Geza-Kalman-115,geza kalman,Big Dawg,,,,"Cambridge, Ontario",Canada,"5'10""",265 lbs,,Heavyweight,4.0,2.0,2.0,0.0,,4.0,4.0,5.0,0.0,,,4.0,9.0,0.0,185.42,90.72,,,,0.0,0.0,0.0,0.0,0.0,0.0,0.0,0.0
,giacomo lemos,,,,,,,,,,,,,,,,,,,,,,6.0,0.0,0.0,190.5,112.04,190.5,Orthodox,1989-06-23,0.0,0.0,0.0,0.0,0.0,0.0,0.0,0.0
,gian siqueira,,,,,,,,,,,,,,,,,,,,,Pitbull,19.0,5.0,0.0,185.42,77.11,187.96,Orthodox,1994-06-23,0.8,100.0,3.41,19.0,0.0,0.0,0.0,0.0
/fighter/Gian-Villante-42802,gian villante,,18/08/1985,35.0,,"Bellmore, New York",United States,"6'2""",243 lbs,Bellmore Kickboxing Academy,Heavyweight,17.0,10.0,2.0,5.0,,17.0,5.0,1.0,7.0,,,17.0,14.0,0.0,190.5,104.33,193.04,Orthodox,1985-08-18,4.38,44.0,5.47,55.0,0.45,23.0,83.0,0.0
/fighter/Gianni-Subba-113449,gianni subba,,04/12/1992,28.0,,"Kuala Lumpur, Federal Territory",Malaysia,"5'8""",125 lbs,Bali Muay Thai & MMA,Flyweight,9.0,3.0,2.0,4.0,,9.0,0.0,1.0,2.0,,,,,,,,,,,,,,,,,,
/fighter/Gideon-Ray-4555,gideon ray,,27/05/1973,48.0,,"Roselle, Illinois",United States,"5'10""",170 lbs,MMA Masters Chicago,Welterweight,17.0,8.0,8.0,1.0,,17.0,3.0,5.0,7.0,,,17.0,15.0,1.0,177.8,83.91,,Southpaw,1973-05-27,2.08,40.0,2.58,53.0,1.49,100.0,0.0,0.0
/fighter/Giedrius-Karavackas-60827,giedrius karavackas,,,,,"Atlantic City, New Jersey",United States,"6'0""",169 lbs,International Karate Academy,Welterweight,6.0,2.0,4.0,0.0,,6.0,1.0,0.0,0.0,,,,,,,,,,,,,,,,,,
/fighter/Giga-Chikadze-213745,giga chikadze,Ninja,25/08/1988,32.0,,Tbilisi,Georgia,"6'0""",145 lbs,Kings MMA,Featherweight,13.0,8.0,1.0,4.0,,13.0,0.0,1.0,1.0,,Ninja,15.0,3.0,0.0,182.88,65.77,187.96,Orthodox,1988-08-25,4.08,43.0,3.44,62.0,0.23,33.0,69.0,0.2
,gigo jara,,,,,,,,,,,,,,,,,,,,,The Little Animal,6.0,9.0,0.0,175.26,65.77,,,,2.26,57.0,2.71,51.0,0.0,0.0,66.0,0.0
/fighter/Gil-Castillo-553,gil castillo,,21/10/1965,55.0,,"Concord, California",United States,"5'9""",170 lbs,Cesar Gracie Fight Team,Welterweight,8.0,2.0,2.0,4.0,,8.0,3.0,0.0,2.0,,,8.0,5.0,0.0,175.26,77.11,,Southpaw,1965-10-21,0.6,45.0,2.22,44.0,3.33,45.0,50.0,0.0
/fighter/Gilbert-Aldana-10334,gilbert aldana,El Peligro,25/08/1977,,11/03/2007,"Chandler, Arizona",United States,"6'1""",250 lbs,Brausa Academy,Heavyweight,6.0,5.0,1.0,0.0,,6.0,2.0,0.0,0.0,,El Peligro,6.0,2.0,0.0,185.42,113.4,,Orthodox,1977-08-25,2.91,54.0,6.26,26.0,2.57,40.0,33.0,0.0
/fighter/Gilbert-Burns-91727,gilbert burns,Durinho,20/07/1986,35.0,,"Niteroi, Rio de Janeiro",Brazil,"5'10""",170 lbs,Sanford MMA,Welterweight,20.0,6.0,8.0,6.0,,20.0,2.0,0.0,2.0,,Durinho,22.0,6.0,0.0,177.8,77.11,180.34,Orthodox,1986-07-20,3.36,48.0,3.34,54.0,1.95,35.0,47.0,0.5
/fighter/Gilbert-Jimenez-45633,gilbert jimenez,The Pitbull,11/05/1985,36.0,,"San Antonio, Texas",United States,"5'7""",155 lbs,Team DeLima,Lightweight,8.0,3.0,3.0,2.0,,8.0,6.0,4.0,2.0,,,8.0,12.0,1.0,,70.31,,,,0.0,0.0,0.0,0.0,0.0,0.0,0.0,0.0
/fighter/Gilbert-Melendez-5545,gilbert melendez,El Nino,12/04/1982,39.0,,"San Francisco, California",United States,"5'9""",155 lbs,Skrap Pack,Lightweight,22.0,12.0,0.0,10.0,,22.0,0.0,1.0,7.0,,El Nino,22.0,8.0,0.0,175.26,65.77,185.42,Orthodox,1982-04-12,3.44,33.0,2.53,63.0,1.64,41.0,71.0,0.2
,gilbert rael,,,,,,,,,,,,,,,,,,,,,,1.0,3.0,0.0,172.72,70.31,,,,0.0,0.0,7.46,37.0,4.86,100.0,0.0,0.0
/fighter/Gilbert-Smith-65128,gilbert smith,Chocolate Thunder,19/10/1981,39.0,,"Colorado Springs, Colorado",United States,"5'9""",170 lbs,Team Victory,Welterweight,13.0,1.0,8.0,4.0,,13.0,0.0,1.0,5.0,,,12.0,6.0,0.0,175.26,83.91,,Southpaw,1981-10-19,1.09,41.0,2.73,35.0,3.51,60.0,0.0,1.2
,gilbert urbina,,,,,,,,,,,,,,,,,,,,,The RGV Bad Boy,7.0,3.0,0.0,190.5,77.11,190.5,Orthodox,1996-04-05,6.33,60.0,4.09,47.0,3.96,50.0,0.0,1.0
/fighter/Gilbert-Yvel-323,gilbert yvel,The Hurricane,30/06/1976,45.0,,Amsterdam,Netherlands,"6'2""",225 lbs,Throwdown,Heavyweight,40.0,34.0,6.0,0.0,0.0,40.0,5.0,2.0,6.0,3.0,The Hurricane,39.0,16.0,1.0,187.96,102.06,195.58,Orthodox,1976-06-30,1.05,47.0,1.78,50.0,0.0,0.0,25.0,1.0
/fighter/Gilberto-Galvao-18957,gilberto galvao,Giba,09/03/1982,39.0,,"Sao Paulo, Sao Paulo",Brazil,"5'10""",185 lbs,Astra Fight Team,Middleweight,30.0,3.0,15.0,12.0,0.0,30.0,4.0,1.0,1.0,1.0,,,,,,,,,,,,,,,,,
,gilles arsene,,,,,,,,,,,,,,,,,,,,,,1.0,1.0,0.0,175.26,86.18,,Southpaw,,0.06,10.0,2.45,32.0,0.0,0.0,0.0,0.0
/fighter/Gillian-Robertson-219015,gillian robertson,The Savage,17/05/1995,26.0,,"Niagara Falls, Ontario",Canada,"5'5""",125 lbs,American Top Team,Flyweight,9.0,1.0,6.0,2.0,,9.0,1.0,1.0,4.0,,The Savage,12.0,8.0,0.0,165.1,52.16,160.02,Orthodox,1995-05-17,2.6,45.0,3.21,55.0,2.46,41.0,43.0,0.9
,gina carano,,,,,,,,,,,,,,,,,,,,,Conviction,7.0,1.0,0.0,172.72,65.77,,Orthodox,1982-04-16,4.5,47.0,2.66,64.0,1.24,66.0,85.0,1.6
/fighter/Gina-Iniong-62343,gina iniong,Conviction,,,,"Baguio City, Benguet",Philippines,"5'2""",105 lbs,Lakay MMA,Atomweight,9.0,2.0,2.0,5.0,,9.0,0.0,1.0,3.0,,,,,,,,,,,,,,,,,,
/fighter/Gina-Mazany-36287,gina mazany,Danger,19/08/1988,32.0,,"Anchorage, Alaska",United States,"5'6""",125 lbs,Xtreme Couture,Flyweight,7.0,3.0,2.0,2.0,,7.0,3.0,1.0,1.0,,Danger,7.0,6.0,0.0,167.64,56.7,172.72,Southpaw,1988-08-19,3.73,50.0,3.52,50.0,4.34,52.0,33.0,0.2
/fighter/Giorgio-Belsanti-80422,giorgio belsanti,Dr. Joker,07/07/1989,32.0,,Turin,Italy,"5'8""",135 lbs,Ligorio Top Team,Bantamweight,7.0,1.0,4.0,2.0,,7.0,0.0,6.0,2.0,,,,,,,,,,,,,,,,,,
/fighter/Giorgio-Pietrini-117093,giorgio pietrini,,23/06/1991,30.0,,Livorno,Italy,"6'0""",170 lbs,Rendoki Dojo,Welterweight,16.0,8.0,4.0,4.0,,16.0,0.0,2.0,3.0,,,,,,,,,,,,,,,,,,
/fighter/Giovanni-Melillo-195245,giovanni melillo,The Punisher,05/02/1985,36.0,,Bari,Italy,"5'11""",170 lbs,MMA Factory,Welterweight,14.0,9.0,2.0,3.0,,14.0,5.0,1.0,0.0,,,,,,,,,,,,,,,,,,
/fighter/Giovanni-Sarran-61471,giovanni sarran,Bam Bam,26/12/1988,32.0,,"Antelope Valley, California",United States,"5'7""",252 lbs,,Heavyweight,6.0,3.0,2.0,1.0,,6.0,1.0,0.0,3.0,,,,,,,,,,,,,,,,,,
,gisele moreira,,,,,,,,,,,,,,,,,,,,,,8.0,3.0,0.0,167.64,61.23,,Orthodox,1981-01-14,5.93,42.0,6.33,48.0,4.0,57.0,0.0,0.0
/fighter/Gita-Suharsono-317465,gita suharsono,,,,,,Indonesia,"0'0""",105 lbs,,Atomweight,0.0,0.0,0.0,0.0,,0.0,0.0,0.0,1.0,,,,,,,,,,,,,,,,,,
/fighter/Giva-Santana-16614,giva santana,The Arm Collector,20/11/1971,49.0,,"Irvine, California",United States,"5'10""",185 lbs,Team Oyama,Middleweight,18.0,1.0,16.0,1.0,,18.0,1.0,0.0,2.0,,,,,,,,,,,,,,,,,,
/fighter/Glaico-Franca-117927,glaico franca,Brazilian Zombie,28/02/1991,30.0,,"Balneario Camboriu, Santa Catarina",Brazil,"6'0""",170 lbs,Astra Fight Team,Welterweight,21.0,10.0,9.0,2.0,,21.0,0.0,1.0,5.0,,,,,,,,,,,,,,,,,,
,glaico franca moreira,,,,,,,,,,,,,,,,,,,,,Nego,15.0,5.0,0.0,182.88,70.31,195.58,Orthodox,1991-02-28,2.35,42.0,3.46,47.0,2.68,42.0,76.0,0.3
,gleidson cutis,,,,,,,,,,,,,,,,,,,,,Poney,7.0,4.0,0.0,175.26,70.31,,Orthodox,1989-02-07,2.99,52.0,8.28,59.0,0.0,0.0,0.0,0.0
/fighter/Gleison-Tibau-5993,gleison tibau,,10/07/1983,38.0,,"Mossoro, Rio Grande do Norte",Brazil,"5'10""",155 lbs,American Top Team,Lightweight,36.0,4.0,14.0,18.0,0.0,36.0,4.0,2.0,8.0,1.0,,33.0,14.0,0.0,177.8,70.31,180.34,Southpaw,1983-10-07,1.95,31.0,2.51,63.0,4.08,53.0,92.0,0.8
/fighter/Glenn-Allaire-24053,glenn allaire,,,,,"Providence, Rhode Island",United States,"0'0""",135 lbs,Team Santos Jiu-Jitsu,Bantamweight,3.0,2.0,1.0,0.0,,3.0,2.0,0.0,0.0,,,,,,,,,,,,,,,,,,
/fighter/Gleristone-Santos-35842,gleristone santos,Toninho Furia,20/08/1988,32.0,,"Campina Grande, Paraiba",Brazil,"5'9""",155 lbs,Pitbull Brothers,Lightweight,35.0,14.0,6.0,15.0,,35.0,5.0,2.0,4.0,,Toninho Furia,33.0,7.0,0.0,175.26,65.77,,,,3.4,31.0,4.4,64.0,0.0,0.0,75.0,0.0
/fighter/Gloria-de-Paula-230933,gloria de paula,Glorinha,10/06/1995,26.0,,"Campinas, Sao Paulo",Brazil,"5'5""",115 lbs,Chute Boxe Diego Lima,Strawweight,5.0,3.0,0.0,2.0,,5.0,1.0,0.0,3.0,,Glorinha,6.0,5.0,0.0,165.1,52.16,170.18,Orthodox,1995-06-10,4.89,53.0,3.77,66.0,0.74,37.0,65.0,0.5
/fighter/Gloria-Telles-207639,gloria telles,,,,,"San Jose, California",United States,"5'3""",125 lbs,Ernie Reyes West Coast Martial Arts,Flyweight,0.0,0.0,0.0,0.0,,0.0,0.0,0.0,0.0,,,,,,,,,,,,,,,,,,
/fighter/Glover-Teixeira-4655,glover teixeira,,28/10/1979,41.0,,"Sobralia, Minas Gerais",Brazil,"6'2""",205 lbs,Teixeira MMA & Fitness,Light Heavyweight,32.0,18.0,9.0,5.0,,32.0,3.0,0.0,4.0,,,33.0,9.0,0.0,187.96,92.99,193.04,Orthodox,1979-10-28,3.73,49.0,4.43,51.0,2.11,33.0,60.0,0.9
/fighter/Godofredo-Castro-40623,godofredo castro,Pepey,02/07/1987,34.0,,"Fortaleza, Ceara",Brazil,"5'10""",145 lbs,Evolucao Thai,Featherweight,14.0,4.0,9.0,1.0,,14.0,3.0,0.0,3.0,,,,,,,,,,,,,,,,,,
,godofredo pepey,,,,,,,,,,,,,,,,,,,,,,13.0,6.0,0.0,170.18,65.77,185.42,Orthodox,1987-07-02,2.32,38.0,3.23,47.0,0.37,7.0,35.0,1.5
/fighter/Goiti-Yamauchi-48629,goiti yamauchi,,05/01/1993,28.0,,"Anjo, Aichi",Japan,"5'10""",155 lbs,Yamauchi Team,Lightweight,26.0,2.0,20.0,4.0,,26.0,0.0,0.0,5.0,,,21.0,3.0,0.0,177.8,65.77,,,,1.66,54.0,1.01,66.0,0.0,0.0,0.0,4.3
/fighter/Gokhan-Saki-10925,gokhan saki,The Rebel,19/10/1983,37.0,,Kars,Turkey,"6'0""",205 lbs,Mike's Gym,Light Heavyweight,1.0,1.0,0.0,0.0,,1.0,2.0,0.0,0.0,,The Rebel,1.0,2.0,0.0,182.88,92.99,185.42,Orthodox,1983-10-19,7.09,58.0,4.57,53.0,0.0,0.0,100.0,0.0
/fighter/Gokhan-Saricam-291351,gokhan saricam,,,,,Istanbul,Turkey,"6'3""",240 lbs,,Heavyweight,5.0,4.0,1.0,0.0,,5.0,0.0,1.0,0.0,,,,,,,,,,,,,,,,,,
,goldman butler,,,,,,,,,,,,,,,,,,,,,,1.0,4.0,0.0,,,,,,0.0,0.0,0.0,0.0,0.0,0.0,0.0,0.0
/fighter/Goran-Reljic-10165,goran reljic,Ghost,20/03/1984,37.0,,"Zadar, Dalmatia",Croatia,"6'3""",205 lbs,Renbukai Training Center,Light Heavyweight,20.0,6.0,7.0,7.0,,20.0,3.0,0.0,6.0,,,15.0,8.0,0.0,190.5,92.99,205.74,Southpaw,1984-03-20,1.69,37.0,2.69,59.0,1.69,50.0,33.0,1.1
/fighter/Govind-Singh-148309,govind singh,The Mountain Boy,,,,Uttarakhand,India,"5'4""",125 lbs,Phuket Top Team,Flyweight,6.0,4.0,0.0,2.0,,6.0,1.0,1.0,0.0,,,,,,,,,,,,,,,,,,
/fighter/Grachik-Bozinyan-160551,grachik bozinyan,,18/07/1995,26.0,,Voronezh,Russia,"6'0""",185 lbs,Legion Fight Team,Middleweight,11.0,4.0,6.0,1.0,0.0,11.0,0.0,2.0,1.0,1.0,,,,,,,,,,,,,,,,,
/fighter/Grady-Hurley-4033,grady hurley,Sue,,,,"Saltillo, Mississippi",United States,"6'1""",185 lbs,,Middleweight,13.0,6.0,3.0,4.0,,13.0,2.0,0.0,1.0,,,,,,,,,,,,,,,,,,
/fighter/Granson-Clark-101699,granson clark,,,,,"Dos Palos, California",United States,"5'10""",185 lbs,American Kickboxing Academy Fresno,Middleweight,3.0,3.0,0.0,0.0,,3.0,1.0,1.0,0.0,,,,,,,,,,,,,,,,,,
/fighter/Grant-Dawson-103525,grant dawson,KGD,20/02/1994,27.0,,"Stromsburg, Nebraska",United States,"5'10""",155 lbs,Glory MMA & Fitness,Lightweight,17.0,4.0,11.0,2.0,,17.0,1.0,0.0,0.0,,KGD,20.0,2.0,1.0,177.8,70.31,182.88,Switch,1994-02-20,2.97,51.0,2.27,45.0,3.68,36.0,40.0,1.5
/fighter/Grant-Neal-250539,grant neal,The Truth,,,,"Denver, Colorado",United States,"6'0""",205 lbs,Genesis Training Academy,Light Heavyweight,6.0,1.0,3.0,2.0,,6.0,0.0,0.0,0.0,,,,,,,,,,,,,,,,,,
/fighter/Gray-Maynard-15835,gray maynard,The Bully,05/09/1979,41.0,,"Santa Cruz, California",United States,"5'8""",145 lbs,American Kickboxing Academy,Featherweight,13.0,2.0,0.0,11.0,,13.0,5.0,0.0,2.0,,,13.0,7.0,1.0,175.26,70.31,177.8,Orthodox,1979-05-09,1.92,32.0,2.64,66.0,2.91,47.0,81.0,0.7
/fighter/Greg-Hardy-271461,greg hardy,Prince of War,28/07/1988,33.0,,"Millington, Tennessee",United States,"6'5""",265 lbs,American Top Team,Heavyweight,7.0,6.0,0.0,1.0,0.0,7.0,2.0,0.0,1.0,1.0,Prince of War,7.0,5.0,0.0,195.58,120.2,203.2,Orthodox,1988-07-28,4.79,50.0,3.31,55.0,0.2,33.0,64.0,0.0
/fighter/Greg-Loughran-5234,greg loughran,The Hitman,12/05/1983,38.0,,Antrim,Northern Ireland,"6'0""",155 lbs,Elite Fighting Revolution,Lightweight,23.0,7.0,13.0,3.0,,23.0,3.0,11.0,5.0,,,,,,,,,,,,,,,,,,
,greg mcintyre,,,,,,,,,,,,,,,,,,,,,,6.0,4.0,0.0,177.8,70.31,,Orthodox,1980-04-21,0.79,30.0,1.36,41.0,5.09,50.0,0.0,0.0
,greg nagy,,,,,,,,,,,,,,,,,,,,,,1.0,3.0,0.0,185.42,95.25,,Orthodox,1983-10-18,0.41,50.0,2.69,37.0,0.0,0.0,0.0,1.2
/fighter/Greg-Rebello-12293,greg rebello,Ribz,13/06/1982,39.0,,"Cranston, Rhode Island",United States,"6'0""",248 lbs,Team Sityodtong,Heavyweight,26.0,17.0,2.0,7.0,,26.0,5.0,2.0,2.0,,Ribz,24.0,8.0,0.0,182.88,108.86,185.42,Southpaw,1982-06-13,2.61,39.0,2.92,58.0,0.0,0.0,0.0,0.0
/fighter/Greg-Scott-85544,greg scott,Dark Rage,,,,"Wichita, Kansas",United States,"5'9""",145 lbs,Valor Martial Arts,Featherweight,3.0,0.0,3.0,0.0,,3.0,2.0,1.0,1.0,,,3.0,4.0,0.0,175.26,65.77,,,,3.9,55.0,7.79,37.0,11.69,100.0,0.0,0.0
/fighter/Greg-Soto-19080,greg soto,,03/06/1986,35.0,,"Oakhurst, New Jersey",United States,"5'11""",170 lbs,Pellegrino MMA,Welterweight,9.0,2.0,4.0,3.0,0.0,9.0,1.0,2.0,0.0,1.0,,9.0,4.0,0.0,180.34,77.11,185.42,Orthodox,1986-06-03,3.21,63.0,2.61,52.0,1.49,27.0,44.0,1.0
/fighter/Greg-Stott-179,greg stott,The Ranger,,,,"Sanford, North Carolina",United States,"5'7""",240 lbs,,Heavyweight,0.0,0.0,0.0,0.0,,0.0,1.0,0.0,0.0,,Ranger,0.0,1.0,0.0,170.18,99.79,,Southpaw,,0.0,0.0,0.0,0.0,0.0,0.0,0.0,0.0
,greg velasco,,,,,,,,,,,,,,,,,,,,,The Viking King,6.0,1.0,0.0,187.96,120.2,177.8,Southpaw,1993-09-23,0.0,0.0,1.52,0.0,0.0,0.0,0.0,0.0
,greg wilson,,,,,,,,,,,,,,,,,,,,,,2.0,3.0,0.0,,70.31,,,,0.0,0.0,0.0,0.0,0.0,0.0,0.0,0.0
/fighter/Gregor-Gillespie-111701,gregor gillespie,The Gift,18/03/1987,34.0,,"New York, New York",United States,"5'9""",155 lbs,Bellmore Kickboxing Academy,Lightweight,14.0,7.0,5.0,2.0,,14.0,1.0,0.0,0.0,,The Gift,14.0,1.0,0.0,170.18,70.31,180.34,Orthodox,1986-11-13,3.74,52.0,2.3,57.0,6.86,48.0,100.0,0.8
/fighter/Gregor-Gracie-23007,gregor gracie,,26/12/1986,34.0,,Rio de Janeiro,Brazil,"5'11""",171 lbs,Renzo Gracie Jiu-Jitsu,Welterweight,7.0,0.0,6.0,1.0,,7.0,2.0,0.0,2.0,,,,,,,,,,,,,,,,,,
/fighter/Gregory-Babene-10677,gregory babene,Blade,26/01/1984,37.0,,Paris,France,"6'0""",185 lbs,Atch Academy,Middleweight,20.0,6.0,11.0,2.0,1.0,20.0,2.0,6.0,3.0,0.0,,,,,,,,,,,,,,,,,
,gregory bouchelaghem,,,,,,,,,,,,,,,,,,,,,,5.0,4.0,0.0,187.96,83.01,,Switch,,0.27,21.0,1.53,36.0,0.0,0.0,50.0,0.0
/fighter/Gregory-Maynard-48109,gregory maynard,,06/03/1980,41.0,,"Williamson, West Virginia",United States,"5'11""",260 lbs,Hells Forty Fight Team,Heavyweight,3.0,0.0,2.0,1.0,,3.0,3.0,0.0,0.0,,,,,,,,,,,,,,,,,,
/fighter/Gregory-Milliard-31498,gregory milliard,The Arubian Assassin,,,,,Aruba,"5'11""",205 lbs,,Light Heavyweight,12.0,8.0,1.0,3.0,,12.0,0.0,2.0,4.0,,,,,,,,,,,,,,,,,,
/fighter/Gregory-Rodrigues-176275,gregory rodrigues,Robocop,17/02/1992,29.0,,"Rio de Janeiro, Rio de Janeiro",Brazil,"6'2""",185 lbs,X-Gym,Middleweight,10.0,4.0,4.0,2.0,,10.0,2.0,0.0,1.0,,Robocop,14.0,5.0,0.0,190.5,83.91,190.5,Orthodox,1992-02-17,5.99,55.0,5.67,51.0,2.4,50.0,100.0,0.5
/fighter/Griet-Eeckhout-197301,griet eeckhout,The Painapple,,,,Brussels,Belgium,"5'3""",125 lbs,Red Kings,Flyweight,5.0,1.0,2.0,2.0,,5.0,1.0,0.0,3.0,,,,,,,,,,,,,,,,,,
,grigorii popov,,,,,,,,,,,,,,,,,,,,,,,,,,,,,,,,,,,,,
/fighter/Grigory-Popov-131039,grigory popov,,18/04/1984,37.0,,"Yakutsk, Sakha",Russia,"5'6""",135 lbs,Tiger Muay Thai,Bantamweight,13.0,4.0,3.0,6.0,,13.0,2.0,1.0,1.0,,,13.0,3.0,0.0,170.18,61.23,172.72,Switch,1984-04-18,3.63,37.0,4.2,55.0,0.0,0.0,45.0,0.0
/fighter/Guan-Wang-26368,guan wang,The Dongbei Tiger,14/03/1986,35.0,,"Beipiao, Liaoning",China,"5'11""",145 lbs,American Top Team,Featherweight,18.0,11.0,2.0,5.0,,18.0,0.0,0.0,1.0,,,,,,,,,,,,,,,,,,
/fighter/Guangyou-Ning-26389,guangyou ning,Smasher,15/12/1981,39.0,,"Cangzhou, Hebei",China,"5'5""",145 lbs,Tiger Muay Thai,Featherweight,5.0,3.0,1.0,1.0,,5.0,0.0,1.0,3.0,,Smasher,5.0,4.0,1.0,162.56,65.77,162.56,Southpaw,1981-12-15,2.66,41.0,1.91,61.0,1.09,50.0,62.0,0.3
,gugun gusman,,,,,,,,,,,,,,,,,,,,,The Tiger,8.0,4.0,0.0,170.18,61.23,172.72,Orthodox,1990-03-03,0.88,27.0,6.18,41.0,0.0,0.0,33.0,0.0
/fighter/Guido-Cannetti-69513,guido cannetti,Ninja,19/12/1979,41.0,,Buenos Aires,Argentina,"5'6""",135 lbs,Our Town MMA,Bantamweight,8.0,3.0,3.0,2.0,,8.0,1.0,4.0,0.0,,Ninja,10.0,8.0,0.0,167.64,61.23,172.72,Southpaw,1979-12-19,3.44,55.0,2.84,51.0,2.27,55.0,64.0,0.4
,guilherme costa,,,,,,,,,,,,,,,,,,,,,The Prodigy,7.0,1.0,0.0,,70.31,,,,0.0,0.0,0.0,0.0,0.0,0.0,0.0,0.0
/fighter/Guilherme-Farias-da-Costa-174559,guilherme farias da costa,,,,,"Manaus, Amazonas",Brazil,"0'0""",155 lbs,Gentilini Fighters,Lightweight,2.0,0.0,1.0,1.0,,2.0,0.0,1.0,0.0,,,,,,,,,,,,,,,,,,
/fighter/Guilherme-Vasconcelos-108499,guilherme vasconcelos,Bomba,23/03/1986,35.0,,"Belo Horizonte, Minas Gerais",Brazil,"6'0""",170 lbs,BH Rhinos,Welterweight,10.0,5.0,5.0,0.0,,10.0,0.0,0.0,6.0,,Bomba,9.0,4.0,0.0,182.88,83.91,,Orthodox,1986-03-23,3.27,29.0,4.4,70.0,0.0,0.0,0.0,0.0
/fighter/Guilherme-Viana-93945,guilherme viana,,13/05/1986,35.0,,"Porto Alegre, Rio Grande do Sul",Brazil,"6'3""",205 lbs,Teixeira MMA & Fitness,Light Heavyweight,7.0,5.0,2.0,0.0,,7.0,1.0,0.0,2.0,,,7.0,3.0,0.0,193.04,92.99,,,,2.92,40.0,2.72,59.0,1.2,66.0,77.0,0.0
/fighter/Guillaume-DeLorenzi-30193,guillaume delorenzi,Il Toro,01/07/1984,37.0,,"Montreal, Quebec",Canada,"5'9""",165 lbs,Nordik Fight Club,Welterweight,10.0,8.0,1.0,1.0,,10.0,1.0,1.0,0.0,,,,,,,,,,,,,,,,,,
/fighter/Guillermo-Martinez-Ayme-101129,guillermo martinez ayme,Cubano,,,,,Cuba,"5'8""",170 lbs,Nova Uniao Argentina,Welterweight,10.0,7.0,0.0,3.0,,10.0,1.0,0.0,3.0,,,,,,,,,,,,,,,,,,
/fighter/Gunnar-Nelson-25246,gunnar nelson,Gunni,28/07/1988,33.0,,Reykjavik,Iceland,"5'11""",170 lbs,Mjolnir,Welterweight,17.0,4.0,12.0,1.0,,17.0,1.0,0.0,4.0,,Gunni,19.0,5.0,1.0,180.34,77.11,182.88,Switch,1988-07-28,1.84,61.0,3.0,49.0,1.9,59.0,66.0,1.0
/fighter/Gunther-Kalunda-222945,gunther kalunda,The Beast,,,,,"Congo, The Democratic Republic of the","6'0""",170 lbs,Tapout Academy,Welterweight,6.0,3.0,1.0,2.0,,6.0,2.0,1.0,0.0,,,,,,,,,,,,,,,,,,
/fighter/Guntur-Guntur-323051,guntur guntur,,,,,,Indonesia,"0'0""",125 lbs,,Flyweight,0.0,0.0,0.0,0.0,,0.0,0.0,1.0,0.0,,,,,,,,,,,,,,,,,,
/fighter/Guoan-Fu-302769,guoan fu,Kim,,,,,China,"0'0""",170 lbs,Action MMA Academy,Welterweight,0.0,0.0,0.0,0.0,,0.0,1.0,0.0,0.0,,,,,,,,,,,,,,,,,,
/fighter/Guram-Kutateladze-127817,guram kutateladze,Georgian Viking,08/01/1992,29.0,,Tbilisi,Georgia,"5'11""",155 lbs,Allstars Training Center,Lightweight,12.0,7.0,1.0,4.0,,12.0,0.0,1.0,1.0,,Georgian Viking,12.0,4.0,0.0,180.34,70.31,182.88,Orthodox,1992-01-08,4.62,45.0,4.53,56.0,0.69,18.0,75.0,0.0
/fighter/Gurdarshan-Mangat-62374,gurdarshan mangat,Gary / Saint Lion,24/01/1987,34.0,,"Williams Lake, British Columbia",Canada,"5'7""",134 lbs,Revolution Fight Team,Bantamweight,16.0,5.0,5.0,6.0,,16.0,2.0,1.0,0.0,,,,,,,,,,,,,,,,,,
/fighter/Gustavo-Balart-203591,gustavo balart,El Gladiador,23/06/1987,34.0,,Santiago,Cuba,"4'11""",124 lbs,American Top Team,Flyweight,9.0,1.0,0.0,8.0,,9.0,2.0,0.0,2.0,,,,,,,,,,,,,,,,,,
/fighter/Gustavo-Falciroli-23776,gustavo falciroli,,13/12/1982,38.0,,"Paulinia, Sao Paulo",Brazil,"5'8""",135 lbs,Mach 1,Bantamweight,17.0,3.0,10.0,4.0,,17.0,1.0,0.0,5.0,,,,,,,,,,,,,,,,,,
,gustavo gabriel,,,,,,,,,,,,,,,,,,,,,,13.0,1.0,0.0,167.64,56.7,,Orthodox,1994-04-01,4.06,65.0,4.26,46.0,0.0,0.0,50.0,0.0
/fighter/Gustavo-Lopez-107201,gustavo lopez,,27/06/1989,32.0,,"Wapato, Washington",United States,"5'5""",135 lbs,Xtreme Couture,Bantamweight,12.0,5.0,6.0,1.0,,12.0,3.0,0.0,3.0,,,12.0,6.0,1.0,165.1,61.23,170.18,Orthodox,1989-06-27,2.48,40.0,3.87,57.0,1.74,41.0,31.0,0.7
/fighter/Gustavo-Trujillo-262513,gustavo trujillo,Cuban Assassin,28/02/1993,28.0,,"Miami, Florida",United States,"6'2""",205 lbs,Fusion X-Cel,Light Heavyweight,3.0,2.0,1.0,0.0,,3.0,0.0,1.0,1.0,,,,,,,,,,,,,,,,,,
/fighter/Gustavo-Wurlitzer-14608,gustavo wurlitzer,Show Man,25/03/1983,38.0,,"Curitiba, Parana",Brazil,"5'9""",145 lbs,Immortal Fight Team,Featherweight,23.0,6.0,14.0,3.0,,23.0,5.0,19.0,0.0,,,,,,,,,,,,,,,,,,
/fighter/Guto-Inocente-17786,guto inocente,,29/05/1986,35.0,,"Brasilia, Federal District",Brazil,"6'3""",254 lbs,Real Kombat Technique,Heavyweight,10.0,6.0,3.0,1.0,,10.0,1.0,2.0,3.0,,,7.0,4.0,0.0,190.5,92.99,,Orthodox,1986-05-29,4.13,66.0,2.92,54.0,0.67,33.0,66.0,0.7
/fighter/Guy-Mezger-14,guy mezger,The Sandman,01/01/1968,53.0,,"Houston, Texas",United States,"6'1""",200 lbs,Lion's Den Dallas,Light Heavyweight,30.0,11.0,6.0,13.0,,30.0,6.0,3.0,5.0,,,30.0,14.0,2.0,185.42,90.72,,Orthodox,1968-01-01,2.3,32.0,1.36,72.0,0.39,50.0,88.0,0.0
/fighter/Gzim-Selmani-112975,gzim selmani,Rezar / The Albanian Psycho,16/06/1994,27.0,,,Albania,"6'3""",263 lbs,Golden Glory,Heavyweight,4.0,1.0,3.0,0.0,,4.0,2.0,0.0,0.0,,,,,,,,,,,,,,,,,,
/fighter/Hacran-Dias-19789,hacran dias,Barnabe,16/05/1984,37.0,,"Rio de Janeiro, Rio de Janeiro",Brazil,"5'8""",155 lbs,Nova Uniao,Lightweight,26.0,3.0,10.0,13.0,,26.0,0.0,0.0,6.0,,Barnabe,23.0,6.0,1.0,172.72,70.31,175.26,Orthodox,1984-06-16,2.08,41.0,3.31,55.0,2.5,39.0,76.0,0.5
/fighter/Haiat-Farag-Youssef-226331,haiat farag youssef,,18/02/1982,39.0,,,Egypt,"0'0""",145 lbs,Egyptian Top Team,Featherweight,1.0,0.0,1.0,0.0,,1.0,0.0,1.0,0.0,,,,,,,,,,,,,,,,,,
,hailey cowan,,,,,,,,,,,,,,,,,,,,,All Hail,7.0,3.0,0.0,172.72,61.23,170.18,Southpaw,1992-02-12,2.97,42.0,3.17,34.0,1.5,33.0,80.0,0.0
/fighter/Haim-Gozali-20669,haim gozali,,06/05/1973,48.0,,,Israel,"6'2""",185 lbs,Team Renzo Gracie,Middleweight,14.0,1.0,13.0,0.0,,14.0,1.0,2.0,3.0,,,,,,,,,,,,,,,,,,
,haisam rida,,,,,,,,,,,,,,,,,,,,,,0.0,0.0,0.0,,,,,,0.0,0.0,0.0,0.0,0.0,0.0,0.0,0.0
/fighter/Haitham-Kiuof-237119,haitham kiuof,,,,,,Israel,"0'0""",155 lbs,,Lightweight,0.0,0.0,0.0,0.0,,0.0,2.0,0.0,0.0,,,,,,,,,,,,,,,,,,
/fighter/Hakeem-Dawodu-158725,hakeem dawodu,Mean,02/07/1991,30.0,,"Calgary, Alberta",Canada,"5'8""",145 lbs,Champion's Creed MMA,Featherweight,12.0,7.0,0.0,5.0,,12.0,0.0,1.0,1.0,,Mean,13.0,4.0,1.0,172.72,65.77,185.42,Orthodox,1991-07-02,5.45,50.0,3.37,56.0,0.0,0.0,65.0,0.0
,hamdy abdelwahab,,,,,,,,,,,,,,,,,,,,,The Hammer,5.0,0.0,0.0,187.96,119.75,182.88,Southpaw,1993-01-22,3.87,52.0,3.13,59.0,3.0,75.0,0.0,0.0
/fighter/Hamilton-Ash-65944,hamilton ash,Hammy,,,,"Whitefish, Montana",United States,"5'10""",154 lbs,Whitefish BJJ,Lightweight,4.0,1.0,2.0,1.0,,4.0,2.0,0.0,3.0,,,,,,,,,,,,,,,,,,
/fighter/Hamza-Salim-58713,hamza salim,The Hamza,,,,"Portland, Oregon",United States,"6'1""",205 lbs,Gracie Barra Portland,Light Heavyweight,5.0,4.0,0.0,1.0,,5.0,0.0,1.0,3.0,,,,,,,,,,,,,,,,,,
,han ten yun,,,,,,,,,,,,,,,,,,,,,,0.0,1.0,0.0,180.34,99.79,,,,0.0,0.0,0.0,0.0,0.0,0.0,0.0,0.0
/fighter/Hannah-Cifers-117571,hannah cifers,Shockwave,26/06/1992,29.0,,"Wake Forest, North Carolina",United States,"5'1""",115 lbs,Embrace Martial Arts,Strawweight,10.0,5.0,0.0,5.0,,10.0,2.0,4.0,1.0,,Shockwave,10.0,7.0,0.0,154.94,52.16,157.48,Orthodox,1992-06-26,4.99,44.0,5.39,52.0,0.26,100.0,64.0,0.3
/fighter/Hannah-Goldy-204879,hannah goldy,Queen of Sparta,18/05/1992,29.0,,"Dunedin, Florida",United States,"5'4""",115 lbs,UFC Gym Winter Springs,Strawweight,5.0,1.0,0.0,4.0,,5.0,0.0,0.0,2.0,,24K,6.0,4.0,0.0,162.56,52.16,154.94,Orthodox,1992-05-18,5.19,47.0,4.67,50.0,0.66,12.0,54.0,0.2
/fighter/Hannah-Guy-250007,hannah guy,The Hurricane,04/05/1995,26.0,,"Columbus, Mississippi",United States,"5'4""",125 lbs,Relentless Grappling & MMA,Flyweight,3.0,0.0,2.0,1.0,,3.0,0.0,0.0,1.0,,,,,,,,,,,,,,,,,,
/fighter/Hannah-Regina-Merullo-235051,hannah regina merullo,,,,,"Boston, Massachusetts",United States,"5'4""",125 lbs,,Flyweight,1.0,0.0,1.0,0.0,,1.0,0.0,0.0,0.0,,,,,,,,,,,,,,,,,,
,hans nijman,,,,,,,,,,,,,,,,,,,,,,9.0,7.0,0.0,182.88,113.4,,Switch,1959-10-23,0.0,0.0,0.0,0.0,0.0,0.0,0.0,0.0
/fighter/Hans-Stringer-14825,hans stringer,,06/07/1987,34.0,,Zevenbergen,Netherlands,"6'2""",205 lbs,Blackzilians,Light Heavyweight,22.0,9.0,8.0,5.0,,22.0,4.0,1.0,3.0,,,22.0,8.0,3.0,190.5,92.99,,Orthodox,1987-07-06,3.16,61.0,2.84,41.0,2.4,36.0,62.0,0.0
,hanseul kim,,,,,,,,,,,,,,,,,,,,,Spade,13.0,5.0,0.0,185.42,77.11,187.96,Southpaw,1990-06-19,6.93,45.0,8.09,50.0,0.0,0.0,0.0,4.0
/fighter/Hao-Jie-Li-217329,hao jie li,,28/06/1995,26.0,,Chongqing,China,"5'4""",135 lbs,Yu Hao Fight Club,Bantamweight,8.0,1.0,0.0,7.0,,8.0,0.0,2.0,2.0,,,,,,,,,,,,,,,,,,
/fighter/Hao-Yi-Jie-183209,hao yi jie,,28/06/1996,25.0,,Zhengzhou,China,"0'0""",125 lbs,Shunyuan Fight Club,Flyweight,0.0,0.0,0.0,0.0,,0.0,0.0,1.0,0.0,,,,,,,,,,,,,,,,,,
/fighter/Haobin-Ma-214849,haobin ma,The Southern Eagle,23/01/1994,27.0,,,China,"0'0""",125 lbs,Jincan Defense Club,Flyweight,13.0,3.0,5.0,5.0,,13.0,2.0,1.0,5.0,,,,,,,,,,,,,,,,,,
/fighter/Haoxiong-Mo-357705,haoxiong mo,,,,,,China,"5'6""",125 lbs,Kunming Quandongli MMA Club,Flyweight,1.0,0.0,0.0,1.0,,1.0,1.0,1.0,0.0,,,,,,,,,,,,,,,,,,
/fighter/Harold-Howard-41,harold howard,,,,,"Niagara Falls, Ontario",Canada,"6'2""",240 lbs,,Heavyweight,1.0,1.0,0.0,0.0,,1.0,3.0,0.0,0.0,,,1.0,3.0,0.0,187.96,108.86,,Orthodox,,0.0,0.0,0.0,0.0,0.0,0.0,0.0,0.0
/fighter/Harris-Sarmiento-4584,harris sarmiento,The Hitman,09/09/1983,37.0,,"Waipahu, Hawaii",United States,"5'6""",145 lbs,Hawaii Elite MMA,Featherweight,36.0,9.0,5.0,22.0,,36.0,9.0,7.0,10.0,,The Hitman,36.0,26.0,0.0,175.26,70.31,,Orthodox,1983-09-09,0.84,25.0,3.46,36.0,2.36,60.0,57.0,0.0
/fighter/Harry-Hardwick-165375,harry hardwick,Houdini,,,,"Middlesbrough, North Yorkshire",England,"5'10""",145 lbs,Middlesbrough Fight Academy,Featherweight,7.0,1.0,3.0,3.0,,7.0,0.0,1.0,2.0,,,,,,,,,,,,,,,,,,
/fighter/Harry-Hunsucker-239513,harry hunsucker,The Hurricane,03/01/1989,32.0,,"Richmond, Kentucky",United States,"6'0""",249 lbs,Elite Martial Arts & Fitness,Heavyweight,7.0,3.0,4.0,0.0,,7.0,4.0,0.0,0.0,,The Hurricane,7.0,6.0,0.0,187.96,92.99,190.5,Orthodox,1989-01-03,3.54,52.0,6.53,42.0,0.0,0.0,0.0,2.0
/fighter/Harry-Johnson-40587,harry johnson,Wildchild,04/07/1986,35.0,,"Memphis, Tennessee",United States,"5'10""",155 lbs,Team Clinch Works,Lightweight,12.0,6.0,6.0,0.0,,12.0,2.0,9.0,1.0,,,,,,,,,,,,,,,,,,
/fighter/Harry-Moskowitz-176,harry moskowitz,Dirty,16/07/1968,53.0,,"Ocean Springs, Mississippi",United States,"6'5""",275 lbs,,Super Heavyweight,6.0,2.0,0.0,2.0,2.0,6.0,5.0,5.0,1.0,1.0,Dirty,6.0,12.0,0.0,195.58,124.74,,Orthodox,,0.0,0.0,0.0,0.0,0.0,0.0,0.0,0.0
/fighter/Haruo-Ochi-29147,haruo ochi,,07/02/1984,37.0,,"Saijo, Ehime",Japan,"5'3""",115 lbs,Paraestra Ehime,Strawweight,19.0,7.0,5.0,7.0,,19.0,0.0,1.0,8.0,,,,,,,,,,,,,,,,,,
,harvey park,,,,,,,,,,,,,,,,,,,,,Fightbot,12.0,3.0,0.0,182.88,70.31,177.8,Orthodox,1986-03-22,3.77,50.0,7.21,33.0,0.0,0.0,0.0,0.0
,hashem arkhagha,,,,,,,,,,,,,,,,,,,,,,6.0,1.0,0.0,187.96,83.91,190.5,Orthodox,1989-09-11,1.84,44.0,8.97,43.0,0.0,0.0,50.0,0.0
/fighter/Hatice-Ozyurt-92039,hatice ozyurt,The Turkish Delight,23/05/1987,34.0,,"Steenwijk, Overijssel",Netherlands,"5'4""",135 lbs,Tatsujin Dojo Deventer,Bantamweight,1.0,0.0,0.0,1.0,,1.0,2.0,5.0,0.0,,,,,,,,,,,,,,,,,,
/fighter/Hatsu-Hioki-5466,hatsu hioki,,18/07/1983,38.0,,"Nagoya, Aichi",Japan,"5'11""",145 lbs,Alive,Featherweight,29.0,5.0,12.0,12.0,,29.0,4.0,1.0,7.0,,,29.0,10.0,2.0,180.34,65.77,185.42,Orthodox,1983-07-18,2.42,42.0,2.12,65.0,2.55,56.0,54.0,0.6
,haven torres,,,,,,,,,,,,,,,,,,,,,,0.0,0.0,0.0,,56.7,,,,0.0,0.0,0.0,0.0,0.0,0.0,0.0,0.0
/fighter/Hayato-Sakurai-432,hayato sakurai,Mach,24/08/1975,45.0,,Ibaraki,Japan,"5'7""",168 lbs,Mach Dojo,Welterweight,38.0,12.0,10.0,16.0,,38.0,5.0,4.0,4.0,,Mach,38.0,13.0,2.0,170.18,76.2,,Orthodox,1975-08-24,2.45,49.0,1.94,59.0,1.87,69.0,56.0,0.3
/fighter/Hayato-Suzuki-112221,hayato suzuki,,19/07/1986,35.0,,"Misato, Saitama",Japan,"5'5""",115 lbs,Brave,Strawweight,20.0,5.0,10.0,5.0,,20.0,0.0,1.0,0.0,,,,,,,,,,,,,,,,,,
/fighter/Hayatun-Jihin-Radzuan-200255,hayatun jihin radzuan,Shadowcat,,,,Johor Bahru,Malaysia,"5'2""",120 lbs,Ultimate MMA,Flyweight,6.0,1.0,2.0,3.0,,6.0,0.0,0.0,2.0,,,,,,,,,,,,,,,,,,
/fighter/Hayder-Hassan-46033,hayder hassan,Hulk,20/10/1982,38.0,,"Coconut Creek, Florida",United States,"5'10""",170 lbs,American Top Team,Welterweight,9.0,6.0,0.0,3.0,0.0,9.0,1.0,2.0,1.0,1.0,Hulk,6.0,3.0,0.0,177.8,77.11,,,,2.11,46.0,3.16,48.0,0.0,0.0,25.0,0.0
/fighter/HeMan-Ali-Gipson-109,he-man ali gipson,,01/03/1973,48.0,,"Las Vegas, Nevada",United States,"0'0""",216 lbs,,Heavyweight,1.0,0.0,1.0,0.0,,1.0,1.0,1.0,0.0,,,,,,,,,,,,,,,,,,
,he-man gipson,,,,,,,,,,,,,,,,,,,,,,1.0,2.0,0.0,,,,,,0.0,0.0,0.0,0.0,0.0,0.0,0.0,0.0
/fighter/Heath-Herring-13,heath herring,The Texas Crazy Horse,02/03/1978,43.0,,"Waco, Texas",United States,"6'4""",250 lbs,Las Vegas Combat Club,Heavyweight,28.0,10.0,13.0,4.0,1.0,28.0,5.0,1.0,10.0,0.0,The Texas Crazy Horse,28.0,16.0,0.0,193.04,113.4,198.12,Orthodox,1978-03-02,2.37,50.0,1.77,54.0,1.22,50.0,32.0,0.7
/fighter/Heather-Clark-67132,heather clark,Hurricane,19/09/1980,40.0,,"Albuquerque, New Mexico",United States,"5'6""",115 lbs,Syndicate MMA,Strawweight,8.0,2.0,3.0,3.0,,8.0,1.0,0.0,5.0,,Hurricane,7.0,6.0,0.0,167.64,52.16,162.56,Orthodox,1980-09-19,3.69,49.0,5.62,50.0,0.33,4.0,80.0,0.3
/fighter/Heather-Hardy-241201,heather hardy,The Heat,25/01/1982,39.0,,"Brooklyn, New York",United States,"5'5""",125 lbs,,Flyweight,2.0,1.0,0.0,1.0,,2.0,2.0,0.0,0.0,,,,,,,,,,,,,,,,,,
,heather jo clark,,,,,,,,,,,,,,,,,,,,,,,,,,,,,,,,,,,,,
/fighter/Hector-Aldana-82725,hector aldana,El Charro,17/08/1988,32.0,,"Mexicali, Baja California",Mexico,"5'11""",170 lbs,Torture Athletics,Welterweight,4.0,2.0,1.0,1.0,,4.0,2.0,0.0,1.0,,,4.0,3.0,0.0,180.34,77.11,182.88,Orthodox,1988-08-17,3.59,38.0,5.08,59.0,0.93,100.0,0.0,0.0
/fighter/Hector-Garcia-77007,hector garcia,The Phoenix,19/10/1989,31.0,,"Kalamazoo, Michigan",United States,"5'10""",155 lbs,Lightning Kicks,Lightweight,4.0,4.0,0.0,0.0,,4.0,1.0,1.0,4.0,,,,,,,,,,,,,,,,,,
/fighter/Hector-Lombard-11292,hector lombard,Lightning,02/02/1978,43.0,,Matanzas,Cuba,"5'9""",185 lbs,UFD Gym,Middleweight,34.0,22.0,4.0,8.0,0.0,34.0,3.0,0.0,6.0,1.0,,34.0,10.0,1.0,175.26,83.91,180.34,Southpaw,1978-02-02,3.02,46.0,3.35,53.0,1.69,48.0,77.0,0.5
/fighter/Hector-Ramirez-10581,hector ramirez,Sick Dog,28/03/1976,45.0,,"Orange County, California",United States,"6'0""",205 lbs,,Light Heavyweight,10.0,6.0,0.0,4.0,,10.0,2.0,1.0,3.0,,Sick Dog,10.0,6.0,1.0,182.88,92.99,,Orthodox,1976-03-28,2.27,41.0,4.6,56.0,2.3,55.0,66.0,0.5
/fighter/Hector-Sandoval-35409,hector sandoval,Kid Alex,19/07/1986,35.0,,"Ukiah, California",United States,"5'2""",125 lbs,Team Alpha Male,Flyweight,15.0,4.0,2.0,9.0,,15.0,2.0,2.0,0.0,,Kid Alex,14.0,4.0,0.0,157.48,56.7,162.56,Orthodox,1986-07-19,3.31,52.0,2.33,65.0,3.49,25.0,71.0,1.4
/fighter/Hector-Urbina-18168,hector urbina,El Toro,17/09/1987,33.0,,"Chicago, Illinois",United States,"6'0""",170 lbs,,Welterweight,17.0,9.0,5.0,2.0,1.0,17.0,7.0,2.0,2.0,0.0,El Toro,17.0,10.0,1.0,180.34,77.11,185.42,Orthodox,1987-09-17,0.97,38.0,2.44,39.0,0.0,0.0,38.0,3.8
/fighter/Heili-Alateng-150691,heili alateng,The Mongolian Knight,14/12/1991,29.0,,Beijing,China,"5'6""",135 lbs,Burigude,Bantamweight,14.0,4.0,3.0,7.0,,14.0,3.0,1.0,4.0,,,,,,,,,,,,,,,,,,
/fighter/Helen-Harper-136035,helen harper,Hellraiser,05/05/1987,34.0,,,England,"5'1""",115 lbs,Andy Roberts BJJ,Strawweight,4.0,2.0,1.0,1.0,,4.0,3.0,0.0,0.0,,,,,,,,,,,,,,,,,,
,helena crevar,,,,,,,,,,,,,,,,,,,,,,0.0,0.0,0.0,,,,,,0.0,0.0,0.0,0.0,0.0,0.0,0.0,0.0
,helio dipp,,,,,,,,,,,,,,,,,,,,,,6.0,3.0,0.0,195.58,83.91,,Orthodox,,0.6,25.0,1.8,62.0,0.0,0.0,50.0,0.0
/fighter/Hendrick-Wijaya-232889,hendrick  wijaya,,,,,Bandung,Indonesia,"0'0""",125 lbs,,Flyweight,1.0,0.0,0.0,1.0,,1.0,0.0,1.0,0.0,,,,,,,,,,,,,,,,,,
/fighter/Henrique-da-Silva-175493,henrique da silva,Frankenstein,01/09/1989,31.0,,"Limoeiro, Pernambuco",Brazil,"6'3""",205 lbs,Minhoca Top Team,Light Heavyweight,15.0,13.0,1.0,1.0,,15.0,3.0,1.0,3.0,,Frankenstein,14.0,5.0,0.0,190.5,92.99,193.04,Orthodox,1989-09-01,3.89,60.0,5.28,40.0,0.25,14.0,22.0,0.2
,henrique da silva lopes,,,,,,,,,,,,,,,,,,,,,Montanha,5.0,2.0,0.0,190.5,108.86,,,,0.0,0.0,0.0,0.0,0.0,0.0,0.0,0.0
,henrique shiguemoto,,,,,,,,,,,,,,,,,,,,,,13.0,4.0,1.0,180.34,83.91,182.88,Orthodox,1989-06-22,3.6,33.0,6.0,16.0,0.0,0.0,50.0,0.0
,henry briones,,,,,,,,,,,,,,,,,,,,,Bure,16.0,8.0,1.0,172.72,61.23,175.26,Orthodox,1980-10-22,3.47,42.0,4.68,53.0,0.0,0.0,52.0,0.6
/fighter/Henry-Cejudo-125297,henry cejudo,The Messenger,09/02/1987,34.0,,"Phoenix, Arizona",United States,"5'4""",135 lbs,Fight Ready,Bantamweight,16.0,8.0,0.0,8.0,,16.0,1.0,0.0,1.0,,Triple C,16.0,3.0,0.0,162.56,61.23,162.56,Orthodox,1987-02-09,3.93,47.0,3.15,60.0,2.07,34.0,83.0,0.2
/fighter/Henry-Corrales-80091,henry corrales,OK,11/08/1986,35.0,,"Whittier, California",United States,"5'8""",135 lbs,Fight Ready,Bantamweight,18.0,7.0,6.0,5.0,,18.0,0.0,3.0,3.0,,,13.0,3.0,0.0,175.26,65.77,,,,4.12,41.0,5.84,55.0,0.0,0.0,69.0,0.0
/fighter/Henry-Lindsay-101989,henry lindsay,Rome,02/12/1984,36.0,,"Pittsburg, Kansas",United States,"5'9""",182 lbs,,Middleweight,7.0,2.0,4.0,1.0,,7.0,1.0,7.0,0.0,,,,,,,,,,,,,,,,,,
/fighter/Henry-Martinez-13237,henry martinez,,07/08/1983,38.0,,"Albuquerque, New Mexico",United States,"5'7""",155 lbs,Team Irish,Lightweight,9.0,2.0,4.0,3.0,,9.0,2.0,0.0,2.0,,Sicario,9.0,4.0,0.0,170.18,70.31,175.26,Southpaw,1983-08-07,2.79,25.0,4.01,60.0,0.0,0.0,80.0,0.0
,henry miller,,,,,,,,,,,,,,,,,,,,,Sentoryu,6.0,16.0,0.0,170.18,122.47,,Southpaw,1969-07-16,1.25,36.0,2.16,54.0,0.55,25.0,60.0,0.0
/fighter/Heqin-Lin-217015,heqin lin,Fighting Sister,28/10/1993,27.0,,"Wenzhou, Zhejiang",China,"5'5""",115 lbs,Hasheng MMA,Strawweight,14.0,7.0,1.0,6.0,,14.0,0.0,0.0,3.0,,,,,,,,,,,,,,,,,,
/fighter/Herbert-Burns-152211,herbert burns,The Blaze,02/02/1988,33.0,,"Niteroi, Rio de Janeiro",Brazil,"5'9""",145 lbs,Sanford MMA,Featherweight,11.0,1.0,8.0,2.0,,11.0,1.0,0.0,2.0,,The Blaze,11.0,4.0,0.0,175.26,65.77,185.42,Orthodox,1988-02-02,1.61,51.0,4.74,30.0,3.92,75.0,60.0,3.3
/fighter/Herbert-Goodman-17512,herbert goodman,Whisper,31/08/1977,43.0,,"Green Bay, Wisconsin",United States,"6'1""",183 lbs,Unified Martial Arts,Middleweight,19.0,8.0,7.0,3.0,1.0,19.0,3.0,2.0,6.0,0.0,,,,,,,,,,,,,,,,,
,herdem alacabek,,,,,,,,,,,,,,,,,,,,,,5.0,1.0,0.0,187.96,92.99,190.5,Orthodox,1991-06-07,3.84,65.0,6.66,23.0,2.06,50.0,42.0,0.0
,herman renting,,,,,,,,,,,,,,,,,,,,,,1.0,3.0,0.0,182.88,97.52,,Switch,,0.0,0.0,0.0,0.0,0.0,0.0,0.0,0.0
/fighter/Herman-Terrado-29836,herman terrado,The Titan,27/09/1989,31.0,,"San Diego, California",United States,"5'9""",170 lbs,Undisputed Downtown,Welterweight,15.0,8.0,6.0,1.0,,15.0,0.0,2.0,3.0,,,15.0,3.0,1.0,,77.11,,,,0.0,0.0,0.0,0.0,0.0,0.0,0.0,0.0
/fighter/Hermes-Franca-3068,hermes franca,,26/08/1974,46.0,,"Fortaleza, Ceara",Brazil,"5'6""",170 lbs,Victory MMA,Welterweight,26.0,8.0,15.0,3.0,,26.0,10.0,0.0,10.0,,,24.0,17.0,0.0,167.64,70.31,180.34,Orthodox,1974-08-26,1.78,39.0,2.85,55.0,1.53,36.0,37.0,2.4
/fighter/Hernani-Perpetuo-28185,hernani perpetuo,,24/05/1985,36.0,,"Rio de Janeiro, Rio de Janeiro",Brazil,"6'0""",170 lbs,Nova Uniao,Welterweight,20.0,9.0,5.0,6.0,,20.0,2.0,1.0,6.0,,,18.0,5.0,0.0,182.88,77.11,,Orthodox,1985-05-24,2.73,29.0,4.37,55.0,0.0,0.0,37.0,0.5
,herschel walker,,,,,,,,,,,,,,,,,,,,,,2.0,0.0,0.0,185.42,97.52,,Orthodox,1962-03-03,3.42,67.0,0.45,46.0,1.94,100.0,100.0,0.0
/fighter/Hesdy-Gerges-309587,hesdy gerges,,20/02/1984,37.0,,Amsterdam,Netherlands,"6'7""",265 lbs,Vos Gym,Heavyweight,0.0,0.0,0.0,0.0,,0.0,1.0,0.0,1.0,,,,,,,,,,,,,,,,,,
,hidehiko hasegawa,,,,,,,,,,,,,,,,,,,,,,19.0,20.0,6.0,175.26,77.11,,,,0.0,0.0,0.0,0.0,0.0,0.0,0.0,0.0
,hidehiko yoshida,,,,,,,,,,,,,,,,,,,,,,6.0,8.0,1.0,180.34,102.06,,Orthodox,1969-09-03,1.05,36.0,1.89,62.0,1.09,33.0,71.0,2.2
/fighter/Hideki-Sekine-53587,hideki sekine,Shrek / Big Body,13/08/1973,47.0,,,Japan,"5'10""",265 lbs,Bonsai Jiu-Jitsu,Heavyweight,9.0,5.0,3.0,1.0,,9.0,5.0,0.0,0.0,,,,,,,,,,,,,,,,,,
/fighter/Hideo-Tokoro-2276,hideo tokoro,,22/08/1977,43.0,,Gifu,Japan,"5'7""",134 lbs,Reversal Gym Tokoro Plus Fit,Bantamweight,35.0,5.0,21.0,9.0,,35.0,13.0,6.0,11.0,,,34.0,29.0,2.0,170.18,61.23,,Orthodox,1977-08-22,1.78,37.0,2.01,65.0,0.87,34.0,44.0,2.3
,hidetaka monma,,,,,,,,,,,,,,,,,,,,,,18.0,11.0,4.0,182.88,76.2,,Orthodox,1973-10-23,1.67,25.0,9.76,34.0,0.0,0.0,0.0,0.0
/fighter/Hikaru-Yoshino-192869,hikaru yoshino,The Painter,,,,,Japan,"0'0""",135 lbs,Freelance,Bantamweight,10.0,1.0,2.0,7.0,,10.0,0.0,1.0,1.0,,,,,,,,,,,,,,,,,,
,hilarie rose,,,,,,,,,,,,,,,,,,,,,,4.0,2.0,0.0,160.02,52.16,160.02,Orthodox,1992-11-11,2.33,33.0,6.13,44.0,0.0,0.0,100.0,0.0
/fighter/Himanshu-Kaushik-135675,himanshu kaushik,,04/06/1992,29.0,,DELHI,INDIA,"5'4""",125 lbs,,Flyweight,5.0,2.0,0.0,3.0,,5.0,1.0,3.0,0.0,,,,,,,,,,,,,,,,,,
,hiroko yamanaka,,,,,,,,,,,,,,,,,,,,,Cat's Eye,13.0,3.0,0.0,180.34,61.23,,,,2.1,26.0,3.54,63.0,0.0,0.0,100.0,0.0
,hiromitsu kanehara,,,,,,,,,,,,,,,,,,,,,,19.0,27.0,5.0,177.8,90.72,,Orthodox,1970-10-05,0.76,22.0,4.39,40.0,0.0,0.0,40.0,0.4
,hiromitsu miura,,,,,,,,,,,,,,,,,,,,,,12.0,7.0,0.0,175.26,77.11,180.34,Orthodox,1981-09-22,2.12,34.0,2.12,58.0,2.23,50.0,69.0,0.6
,hiroshi izumi,,,,,,,,,,,,,,,,,,,,,,4.0,2.0,0.0,,92.99,,Orthodox,1982-06-22,1.95,37.0,2.65,66.0,3.35,70.0,100.0,0.5
/fighter/Hiroshi-Nakamura-12076,hiroshi nakamura,Iron,14/02/1981,40.0,,"Tokyo, Tokyo",Japan,"5'5""",134 lbs,Carpe Diem Brazilian Jiu-Jitsu,Bantamweight,16.0,0.0,2.0,14.0,,16.0,5.0,0.0,2.0,,,,,,,,,,,,,,,,,,
/fighter/Hiroshige-Tanaka-30643,hiroshige tanaka,Hanzo,12/12/1981,39.0,,"Yokohama, Kanagawa",Japan,"5'7""",143 lbs,Fun's,Featherweight,13.0,7.0,0.0,6.0,,13.0,2.0,0.0,6.0,,,,,,,,,,,,,,,,,,
,hirotaka yokoi,,,,,,,,,,,,,,,,,,,,,Kaibatsu-Kun,11.0,5.0,0.0,180.34,92.99,,Orthodox,1978-06-08,1.52,33.0,3.42,38.0,1.87,41.0,66.0,0.4
/fighter/Hiroto-Uesako-91247,hiroto uesako,,03/05/1987,34.0,,Tokyo,Japan,"5'8""",155 lbs,Team Cloud,Lightweight,18.0,11.0,1.0,6.0,,18.0,3.0,2.0,5.0,,,,,,,,,,,,,,,,,,
/fighter/Hiroyasu-Sakurai-227501,hiroyasu sakurai,,03/12/1993,27.0,,Tokyo,Japan,"5'9""",145 lbs,Never Quit,Featherweight,4.0,0.0,0.0,4.0,,4.0,0.0,0.0,1.0,,,,,,,,,,,,,,,,,,
,hiroyuki abe,,,,,,,,,,,,,,,,,,,,,Abe Ani,8.0,15.0,3.0,167.64,65.77,,Orthodox,,1.71,36.0,3.11,63.0,0.0,0.0,33.0,0.0
,hiroyuki takaya,,,,,,,,,,,,,,,,,,,,,Streetfight Bancho,21.0,14.0,2.0,167.64,63.05,,Orthodox,1977-06-10,3.18,33.0,3.16,60.0,0.9,45.0,66.0,0.0
/fighter/Hiroyuki-Tetsuka-122523,hiroyuki tetsuka,Last Samurai,15/02/1990,31.0,,Tochigi,Japan,"5'6""",170 lbs,Yamada Hybrid Wrestling Dojo,Welterweight,9.0,6.0,1.0,2.0,,9.0,1.0,0.0,3.0,,,,,,,,,,,,,,,,,,
/fighter/Hisaki-Kato-125695,hisaki kato,The Japanese Musketeer,17/09/1982,38.0,,"Nagoya, Aichi",Japan,"6'0""",185 lbs,Alive,Middleweight,8.0,7.0,0.0,1.0,,8.0,2.0,0.0,1.0,,,8.0,2.0,0.0,182.88,83.91,,,,2.8,48.0,1.72,68.0,1.62,100.0,0.0,0.0
/fighter/Hisham-Hiba-113567,hisham hiba,,25/02/1992,29.0,,,Egypt,"5'8""",170 lbs,Egyptian Top Team,Welterweight,3.0,3.0,0.0,0.0,,3.0,2.0,2.0,0.0,,,,,,,,,,,,,,,,,,
/fighter/Hisyam-Samsudin-181203,hisyam samsudin,Zephyrus,,,,Kota Kinabalu,Malaysia,"0'0""",145 lbs,,Featherweight,2.0,1.0,1.0,0.0,,2.0,0.0,1.0,3.0,,,,,,,,,,,,,,,,,,
,hitomi akano,,,,,,,,,,,,,,,,,,,,,Girlfight Monster,18.0,10.0,0.0,162.56,61.23,,Southpaw,1974-07-27,0.59,45.0,2.58,55.0,0.0,0.0,8.0,0.5
/fighter/Hlit-Hlit-Lay-201791,hlit  hlit lay,,04/03/1995,26.0,,"Pha-An, Kayin State",Myanmar,"5'5""",145 lbs,A Phyu Yaung Thway Thit,Featherweight,0.0,0.0,0.0,0.0,,0.0,1.0,0.0,0.0,,,,,,,,,,,,,,,,,,
,ho bae myeon,,,,,,,,,,,,,,,,,,,,,,13.0,5.0,1.0,180.34,76.2,,Orthodox,,3.16,16.0,3.16,83.0,0.0,0.0,0.0,0.0
,ho taek oh,,,,,,,,,,,,,,,,,,,,,Spider,7.0,2.0,1.0,,70.31,,,,0.0,0.0,0.0,0.0,0.0,0.0,0.0,0.0
/fighter/Holly-Holm-75125,holly holm,The Preacher's Daughter,17/10/1981,39.0,,"Albuquerque, New Mexico",United States,"5'8""",145 lbs,Jackson-Wink MMA,Featherweight,14.0,8.0,0.0,6.0,,14.0,1.0,1.0,3.0,,The Preacher's Daughter,15.0,6.0,0.0,172.72,61.23,175.26,Southpaw,1981-10-17,3.21,40.0,2.79,56.0,0.9,30.0,78.0,0.1
/fighter/Holly-Lawson-177813,holly lawson,Lil Bear,18/03/1978,43.0,,"Sechelt, British Columbia",Canada,"0'0""",152 lbs,,Lightweight,0.0,0.0,0.0,0.0,,0.0,0.0,0.0,1.0,,,,,,,,,,,,,,,,,,
/fighter/Homer-Moore-853,homer moore,Rock,12/11/1971,49.0,,"Phoenix, Arizona",United States,"5'10""",205 lbs,,Light Heavyweight,26.0,8.0,4.0,14.0,,26.0,5.0,1.0,3.0,,The Rock,26.0,9.0,2.0,177.8,92.99,,Orthodox,1971-11-27,0.68,50.0,0.68,0.0,5.07,66.0,0.0,0.0
,hong man choi,,,,,,,,,,,,,,,,,,,,,Techno Goliath,4.0,5.0,0.0,218.44,149.69,,Orthodox,1980-10-30,1.32,26.0,1.46,36.0,0.71,100.0,84.0,0.0
/fighter/Hongjiang-Li-284097,hongjiang li,The Diamond,,,,,China,"5'7""",145 lbs,A.256 Super Evolution Team,Featherweight,2.0,1.0,0.0,1.0,,2.0,0.0,2.0,2.0,,,,,,,,,,,,,,,,,,
/fighter/Honglin-Li-329237,honglin li,,,,,,China,"5'8""",125 lbs,Beijing Ning Guangyou Combat and Fitness Club,Flyweight,3.0,1.0,2.0,0.0,,3.0,0.0,2.0,0.0,,,,,,,,,,,,,,,,,,
/fighter/Honor-Kelesh-236937,honor kelesh,The Hunter,,,,"Nalchik, Kabardino-Balkaria",Russia,"0'0""",155 lbs,,Lightweight,4.0,1.0,3.0,0.0,,4.0,0.0,0.0,1.0,,,,,,,,,,,,,,,,,,
/fighter/Honorio-Banario-62423,honorio banario,The Rock,25/09/1989,31.0,,"Mankayan, Benguet",Philippines,"5'9""",155 lbs,Lakay MMA,Lightweight,15.0,5.0,5.0,5.0,,15.0,3.0,5.0,2.0,,,,,,,,,,,,,,,,,,
/fighter/Horacio-Gutierrez-172941,horacio gutierrez,The Punisher,15/09/1990,30.0,,"Guadalajara, Jalisco",Mexico,"5'10""",145 lbs,Chicago Fight Team,Featherweight,7.0,4.0,1.0,2.0,0.0,7.0,1.0,0.0,1.0,1.0,The Punisher,4.0,3.0,0.0,177.8,65.77,,,,0.86,26.0,2.91,46.0,0.0,0.0,50.0,0.0
/fighter/Houston-Alexander-2352,houston alexander,The Assassin,22/03/1972,49.0,,"Omaha, Nebraska",United States,"6'0""",203 lbs,Grudge Training Center,Light Heavyweight,17.0,14.0,0.0,3.0,,17.0,10.0,2.0,4.0,,The Assassin,17.0,15.0,1.0,182.88,92.99,182.88,Orthodox,1972-03-22,3.06,54.0,3.2,52.0,1.19,57.0,33.0,0.0
/fighter/Houston-Dorr-178,houston dorr,,,,,"Diamond Head, Mississippi",United States,"6'0""",205 lbs,,Light Heavyweight,1.0,0.0,1.0,0.0,,1.0,1.0,1.0,0.0,,,1.0,2.0,0.0,185.42,95.25,,Orthodox,,0.0,0.0,0.0,0.0,0.0,0.0,0.0,0.0
/fighter/Hracho-Darpinyan-42695,hracho darpinyan,Hracho Man,13/05/1986,35.0,,,Armenia,"5'10""",185 lbs,Team Schrijber,Middleweight,17.0,6.0,8.0,3.0,,17.0,1.0,1.0,7.0,,,,,,,,,,,,,,,,,,
,hu yaozong,,,,,,,,,,,,,,,,,,,,,Totoro,3.0,3.0,0.0,190.5,83.91,182.88,Orthodox,1995-04-07,3.35,48.0,5.09,35.0,0.0,0.0,33.0,0.4
/fighter/Hugh-McKenna-67664,hugh mckenna,,14/07/1989,32.0,,"Syosset, New York",United States,"0'0""",184 lbs,Panza MMA,Middleweight,3.0,0.0,2.0,1.0,,3.0,0.0,2.0,2.0,,,,,,,,,,,,,,,,,,
/fighter/Hugh-Pulley-130833,hugh pulley,The Wolverine,29/12/1988,32.0,,"St. Louis, Missouri",United States,"6'0""",169 lbs,,Welterweight,8.0,6.0,0.0,2.0,,8.0,1.0,0.0,3.0,,,6.0,3.0,0.0,182.88,70.31,,,,4.47,63.0,3.27,57.0,4.0,66.0,69.0,0.0
,hugo cunha,,,,,,,,,,,,,,,,,,,,,Silverback,6.0,0.0,0.0,193.04,113.4,,,,0.0,0.0,0.0,0.0,0.0,0.0,0.0,0.0
/fighter/Hugo-Duarte-200,hugo duarte,,09/08/1968,53.0,,Rio De Janeiro,Brazil,"6'0""",240 lbs,Hugo Duarte Luta Livre,Heavyweight,6.0,3.0,2.0,0.0,1.0,6.0,3.0,0.0,0.0,0.0,,6.0,3.0,0.0,182.88,108.86,,Orthodox,1968-08-09,0.0,0.0,0.0,0.0,0.0,0.0,0.0,0.0
,hugo govea,,,,,,,,,,,,,,,,,,,,,,0.0,1.0,0.0,,,,,,0.0,0.0,0.0,0.0,0.0,0.0,0.0,0.0
/fighter/Hugo-Lujan-157657,hugo lujan,,27/06/1989,32.0,,"Soledad, California",United States,"6'0""",155 lbs,Extreme Martial Arts and Fitness,Lightweight,3.0,1.0,0.0,2.0,,3.0,1.0,1.0,4.0,,,,,,,,,,,,,,,,,,
/fighter/Hugo-Pereira-221665,hugo pereira,,,,,Setubal,Portugal,"5'9""",170 lbs,Gracie Barra,Welterweight,5.0,4.0,1.0,0.0,,5.0,0.0,0.0,3.0,,,,,,,,,,,,,,,,,,
,hugo sandoval,,,,,,,,,,,,,,,,,,,,,,2.0,3.0,0.0,,61.23,,,,0.0,0.0,0.0,0.0,0.0,0.0,0.0,0.0
